level_1,level_2,level_3,raw_timestamp,timestamp,author,speech
PERTANYAAN-PERTANYAAN BAGI JAWAB LISAN,,,■1120,1120,Datuk Haji Mustafa bin Musa,"*Alhamdulillah*, banyak institusi dan program kemahiran
telah pun dijalankan melalui TVET. Cuma, untuk memastikan pasaran tenaga selepas TVET
ini laku di pasaran tempatan dan antarabangsa, sejauh mana kerajaan dan Jabatan
Pembangunan Kemahiran menjalinkan kerjasama strategik dengan institusi pensijilan
kompetensi dan pengiktirafan kemahiran antarabangsa seperti SGS, *American Society of
Mechanical Engineer,* ataupun IEM, ataupun *Lots Register?* Bagi memastikan lepasan pelajar
TVET kita mendapat pengiktirafan dan laris di pasaran tempatan dan antarabangsa. Terima
kasih, Tan Sri Yang di-Pertua."
PERTANYAAN-PERTANYAAN BAGI JAWAB LISAN,,,■1120,1120,Datuk Ts. Mustapha Sakmud,"Terima kasih Yang Berhormat Senator atas soalan
tambahan tersebut. Memang, institusi TVET kita juga, selain daripada kita membangunkan
NOSS untuk peringkat tempatan, kita juga menjalinkan kerjasama dengan pelbagai industri
sama ada lokal dan juga internasional untuk kita dapatkan sijil-sijil tambahan untuk
memastikan bahawa pelajar-pelajar kita bukan sahaja mahir dengan kemahiran yang ada di
peringkat tempatan, tetapi juga kita memastikan juga mendapat sijil tambahan supaya mereka
dapat dipasarkan ke- di luar negara.
Saya fikir, ini sedang berjalan dan ada beberapa- saya tidak dapat sebut satu persatu
tetapi antaranya *Bosch, BOSS, Cisco, HUAWEI* dan yang lain-lain. Memang ada. Cuma, yang
ini pun sedang- sekarang ini sedang diperluaskan dan kita sedang memeterai beberapa
memorandum kerjasama dengan pelbagai industri dan kita memastikan bahawa sijil yang kita
keluarkan ini juga memang bertepatan dengan keperluan industri, pihak di peringkat dalam
negara dan juga luar negara. Okey. Sekian, terima kasih."
PERTANYAAN-PERTANYAAN BAGI JAWAB LISAN,,,■1120,1120,Tan Sri Haji Mohamad Fatmi bin Haji Che Salleh,"Tan Sri Yang di-Pertua, soalan
tambahan."
PERTANYAAN-PERTANYAAN BAGI JAWAB LISAN,,,■1120,1120,Tuan Yang di-Pertua,"Sila, Yang Berhormat."
PERTANYAAN-PERTANYAAN BAGI JAWAB LISAN,,,■1120,1120,Tan Sri Haji Mohamad Fatmi bin Haji Che Salleh,"Tan Sri Yang di-Pertua, bolehkah
Menteri memberi maklum kepada Dewan ini, daripada apa yang diperkatakan berbagai-bagai
jurusan kursus itu, statistik sudah berapa orang yang telah menjadi graduan-graduan dalam
semua bidang yang disebutkan itu tadi? Terima kasih."
PERTANYAAN-PERTANYAAN BAGI JAWAB LISAN,,,■1120,1120,Datuk Ts. Mustapha Sakmud,"Okey. Terima kasih Yang Berhormat Senator atas
soalan tambahan. Daripada segi data, itu agak spesifik. Mungkin saya boleh buat secara
bertulis, tetapi untuk makluman, setiap tahun kita keluarkan lebih kurang 80,000 orang
graduan TVET kita meliputi pelbagai kementerian yang hanya melibatkan NOSS.
Jadi, memang ini meliputi banyak kursus yang berkaitan. Kita juga memang
memastikan bahawa graduan TVET yang kita keluarkan ini memang berpadanan dengan
keperluan industri dan kita sedang monitor. Kita mahu padankan dalam MyFutureJobs itu
sendiri. Kita mahu pastikan bahawa syarikat-syarikat memberi maklumat tentang kursus-
kursus jawatan yang ada untuk dipadankan dengan kursus-kursus yang dikeluarkan oleh
institusi TVET kita, tetapi untuk maklumat lanjut, saya akan buat jawapan bertulis kepada
Yang Berhormat Senator. Terima kasih."
PERTANYAAN-PERTANYAAN BAGI JAWAB LISAN,,,■1120,1120,Tuan Yang di-Pertua,"Ahli-ahli Yang Berhormat, kita ada tersasul sedikit tadi. Jadi,
kita jemput Yang Berhormat Datuk Wira Dr. Mohd Hatta bin Md Ramli."
PERTANYAAN-PERTANYAAN BAGI JAWAB LISAN,,,■1120,1120,Datuk Wira Dr. Mohd Hatta bin Md Ramli,"Terima kasih Tan Sri Yang di-Pertua.
Soalan saya nombor 10.
**10. Datuk Wira Dr. Mohd Hatta bin Md Ramli** minta Menteri Kewangan menyatakan,
adakah kerajaan bersedia untuk mewujudkan semula Jawatankuasa Khas Kewangan Islam
yang lebih komprehensif untuk mengukuhkan lagi struktur kewangan Islam di Malaysia
seterusnya mengangkat Malaysia sebagai sebuah peneraju dalam sektor kewangan Islam
selaras dengan agenda Ekonomi MADANI."
PERTANYAAN-PERTANYAAN BAGI JAWAB LISAN,,,■1120,1120,Timbalan Menteri Kewangan [Datuk Seri Haji Ahmad bin Haji Maslan],"Tan Sri
Yang di-Pertua,
*Tebal awan musim tengkujuh,
tiada mentari gelapnya maya;
Untuk soalan nombor sepuluh,
dengarkanlah ini jawapannya...*"
PERTANYAAN-PERTANYAAN BAGI JAWAB LISAN,,,■1120,1120,ANNOTATION,[Ketawa]
PERTANYAAN-PERTANYAAN BAGI JAWAB LISAN,,,■1120,1120,Timbalan Menteri Kewangan [Datuk Seri Haji Ahmad bin Haji Maslan],"Senator Datuk Wira Dr. Mohd Hatta bin Md Ramli, pembangunan sistem kewangan
Islam di Malaysia merupakan usaha bersepadu pelbagai pihak, termasuk pengawal selia
kewangan, peserta industri dan kerajaan melalui strategi-strategi bagi memperkukuhkan
kedudukan Malaysia sebagai peneraju kewangan Islam di peringkat global.
Sehingga kini, kepimpinan Malaysia dalam kewangan Islam terus diiktiraf di peringkat
global dengan menduduki tempat pertama selama 10 tahun berturut-turut dalam ICD- *Refinitiv
Islamic Finance Development Indicator,* dengan izin. Seiring dengan pembangunan ekosistem
kewangan Islam di Malaysia yang komprehensif dan semakin matang dengan peserta yang
dinamik, berdaya tahan dan mampu mengeluarkan produk yang pelbagai.
Pasaran kewangan Islam di Malaysia yang terdiri daripada pemain industri domestik
dan global sentiasa berkolaborasi untuk saling mendapat manfaat daripada persekitaran
perniagaan yang kondusif, daripada segi inovasi kepakaran dan aliran urus niaga. Kerajaan
mengakui kepentingan untuk mengukuhkan struktur kewangan Islam di Malaysia dan
membangunkan sektor ini selaras dengan Agenda Ekonomi Madani.
Oleh itu, inisiatif bersepadu seperti *Malaysia International Islamic Financial Centre*
(MIFC), dengan izin, dalam memacu kewangan Islam cukup penting dalam usaha ini. Peranan
MIFC yang bermula pada tahun 2006 merupakan inisiatif oleh badan kawal selia pasaran
kewangan dengan kerjasama agensi kerajaan yang berkaitan bertujuan untuk
membangunkan sektor kewangan Islam di Malaysia melalui penglibatan industri dan kerajaan.
Ia juga bertujuan untuk mengukuhkan hala tuju bagi mempromosikan Malaysia
sebagai hab kewangan Islam utama di peringkat antarabangsa. Selaras dengan
pembangunan ekosistem untuk memacu fasa pembangunan seterusnya dalam mengukuhkan
Malaysia sebagai pusat kewangan Islam antarabangsa, Bank Negara dan Suruhanjaya
Sekuriti telah bekerjasama untuk menubuhkan Majlis Kepimpinan *Malaysia International
Islamic Financial Centre* ataupun *MIFC Leadership Council,* dengan izin, pada 5 Oktober
2022.
Majlis Kepimpinan MIFC ini berfungsi sebagai platform untuk menyediakan
kepimpinan industri dalam usaha memperkukuh Malaysia sebagai pasaran global dan
gerbang antarabangsa bagi kewangan Islam. Majlis Kepimpinan MIFC dipengerusikan oleh
Yang Berbahagia Tan Sri Azman Mokhtar dan ahli-ahli majlis terdiri daripada tokoh industri
tempatan dan antarabangsa yang terkemuka, di samping wakil dari Bank Negara Malaysia
dan Suruhanjaya Sekuriti. Terima kasih."
PERTANYAAN-PERTANYAAN BAGI JAWAB LISAN,,,■1120,1120,Tuan Yang di-Pertua,Silakan Yang Berhormat.
PERTANYAAN-PERTANYAAN BAGI JAWAB LISAN,,,■1120,1120,Datuk Wira Dr. Mohd Hatta bin Md Ramli,"Soalan tambahan ya, Tan Sri. Terima
kasih. Semangat sekali Menteri menjawab memberikan keyakinan kepada kita. Perdana
Menteri bulan lepas pun ada mencadangkan supaya penyelarasan industri kewangan Islam
ini ditingkatkan dan pengendali-pengendali diminta untuk membuat perubahan inovatif, ya
dalam usaha ini supaya bukan setakat kita mencari kesaksamaan, kesejahteraan tetapi juga
keberkatan.
Jadi, soalan saya, sebagai tapak untuk maju ini, ada *ker* maklumat-maklumat data?
Contohnya, yang boleh kita banggakan sebagai asas untuk kita lonjakkan lagi pencapaian
dalam kewangan Islam ini. Minta Menteri menjawab. Terima kasih."
PERTANYAAN-PERTANYAAN BAGI JAWAB LISAN,,,■1120,1120,Datuk Seri Haji Ahmad bin Haji Maslan,"Tan Sri Yang di-Pertua, terima kasih atas
soalan tambahan itu. Data yang ada di tangan saya, antaranya yang saya boleh kongsi akan,
pembiayaan dan pinjaman patuh syariah sektor perbankan.
Pada tahun 2010, hanya 15.2 peratus, 2015 – 31.3 peratus, 2023 meningkat kepada
44.7 peratus dibandingkan dengan konvensional, 55.3 peratus.
Perkara yang kedua, daripada segi data pasaran modal Islam. Kini pasaran modal
Islam 64.18 peratus, berjumlah RM2.4 trilion. Daripada 982 buah syarikat yang tersenarai,
804 buah syarikat patuh syariah, 178 yang konvensional.
Kemudian, daripada segi takaful insurans Islam, pertumbuhan amat positif. Tahun
2010 hanya 12.6 peratus, 2023 sejumlah 24.8 peratus. Saya juga ingin memaklumkan
bahawa Malaysia menerajui pasaran sukuk global dengan syer pasaran 39 peratus."
PERTANYAAN-PERTANYAAN BAGI JAWAB LISAN,,,■1130,1130,Datuk Seri Haji Ahmad bin Haji Maslan,"Seterusnya Indeks Kewangan Islam. Malaysia tempat pertama, nombor kedua Arab
Saudi, nombor ketiga Indonesia, nombor keempat Bahrain dan kelima Kuwait. Terima kasih."
PERTANYAAN-PERTANYAAN BAGI JAWAB LISAN,,,■1130,1130,Tuan Yang di-Pertua,"Dipersilakan Yang Berhormat Tuan Tuan Jaziri Alkaf Abdillah
Suffian.
**12. Tuan Jaziri Alkaf Abdillah Suffian** minta Menteri Pelaburan, Perdagangan dan
Industri menyatakan, setakat mana pelaburan langsung domestik yang telah dilaksanakan
oleh kerajaan."
PERTANYAAN-PERTANYAAN BAGI JAWAB LISAN,,,■1130,1130,Tuan Yang di-Pertua,Sila Yang Berhormat.
PERTANYAAN-PERTANYAAN BAGI JAWAB LISAN,,,■1130,1130,"Timbalan Menteri Pelaburan, Perdagangan dan Industri [Tuan Liew Chin Tong]","Tan Sri Yang di-Pertua, supaya langkah merancakkan landskap pelaburan negara, kerajaan
melalui Kementerian Pelaburan, Perdagangan dan Industri (MITI) dan Lembaga
Pembangunan Pelaburan Malaysia (MIDA) komited menjana pertumbuhan pelaburan
tempatan bagi merangsang pembangunan lestari dan seimbang di dalam negara.
Pada masa yang sama, kerajaan sentiasa mengukuhkan usaha untuk memudah cara
syarikat-syarikat tempatan dalam merealisasikan cadangan penubuhan kilang dan
melonjakkan produktiviti mereka di dalam negara.
Secara lazimnya, pelaksanaan projek mengambil masa satu hingga dua tahun untuk
direalisasikan bergantung kepada skala projek dan keadaan ekonomi semasa. Projek yang
telah direalisasikan merujukkan projek yang sama ada sedang dalam pembinaan bangunan
atau kilang sedang memasang mesin dan peralatan mahupun telah memulakan operasi.
Bagi tempoh tahun 2018 sehingga Jun 2023, sebanyak 6,581 projek pemilikan
tempatan telah diluluskan. Dengan nilai pelaburan RM180.5 bilion dalam sektor perkilangan
dan perkhidmatan di bawah seliaan MIDA. Daripada jumlah yang diluluskan tersebut- projek
yang telah direalisasikan iaitu sebanyak 71.97 peratus melibatkan 4,089 projek dengan nilai
RM129.9 bilion yang seterusnya mewujudkan sebanyak 174,921 pekerjaan. Terima kasih."
PERTANYAAN-PERTANYAAN BAGI JAWAB LISAN,,,■1130,1130,Tuan Jaziri Alkaf Abdillah Suffian,Soalan tambahan Tan Sri Yang di-Pertua.
PERTANYAAN-PERTANYAAN BAGI JAWAB LISAN,,,■1130,1130,Tuan Yang di-Pertua,Sila Yang Berhormat.
PERTANYAAN-PERTANYAAN BAGI JAWAB LISAN,,,■1130,1130,Tuan Jaziri Alkaf Abdillah Suffian,"Soalan saya, adakah kerajaan telah merancang
atau menyelaraskan DDI dengan dasar-dasar dan matlamat pembangunan negara seperti
Pelan Strategik Industri 4.0 dan Pelan Ekonomi Hijau? Terima kasih."
PERTANYAAN-PERTANYAAN BAGI JAWAB LISAN,,,■1130,1130,Tuan Liew Chin Tong,"Dalam *New Industrial Master Plan* 2030 bersama dengan
NETR dan juga pelbagai program telah ditegaskan bahawa kita perlukan DDI bersama
dengan FDI. Dalam usaha Majlis Pelaburan Negara dan juga usaha-usaha kerajaan lain,
memang DDI diberikan tekanan. Terima kasih."
PERTANYAAN-PERTANYAAN BAGI JAWAB LISAN,,,■1130,1130,Tuan Yang di-Pertua,"Sekarang saya menjemput Yang Berhormat Senator Tuan Haji
Abdul Nasir bin Haji Idris."
PERTANYAAN-PERTANYAAN BAGI JAWAB LISAN,,,■1130,1130,Tuan Haji Abdul Nasir bin Haji Idris,"*Bismillahi Rahmani Rahim. Assalamualaikum
warahmatullahi wabarakatuh.* Tan Sri Yang di-Pertua, pohon penjelasan soalan nombor 13.
**13. Tuan Haji Abdul Nasir bin Haji Idris** minta Menteri Pertanian dan Keterjaminan
Makanan menyatakan, hasrat kerajaan dalam memberikan insentif berbentuk fiskal dengan
harga yang munasabah pada Negeri Kedah sebagai negeri yang mengeluarkan beras
terbanyak di Malaysia."
PERTANYAAN-PERTANYAAN BAGI JAWAB LISAN,,,■1130,1130,Menteri Pertanian dan Keterjaminan Makanan [Datuk Seri Haji Mohamad bin Sabu],"Terima kasih Yang di-Pertua Dewan Negara dan Yang Berhormat.
Untuk makluman Ahli Yang Berhormat, kerajaan mengambil maklum akan cadangan
untuk memberi insentif berbentuk fiskal dengan harga yang munasabah kepada negeri Kedah
sebagai negeri yang mengeluarkan beras terbanyak di Malaysia.
Setakat ini pemberian insentif atau bantuan yang diberikan adalah berupa subsidi
input dan output pertanian dan diberikan kepada semua pesawah di seluruh negara. Tiada
pemberian insentif fiskal disediakan secara khusus kepada mana-mana negeri dan Perdana
Menteri pun ada di sini hari ini.
Umum mengetahui bahawa Kedah merupakan pengeluar beras terbanyak di Malaysia
meliputi hampir 40 peratus. Kerajaan amat menghargai kerjasama kerajaan negeri dalam
mengekalkan tanah sawah dan berharap terus bersama-sama Kerajaan Persekutuan untuk
meningkatkan pengeluaran padi dan beras demi keterjaminan makanan negara. Terima
kasih."
PERTANYAAN-PERTANYAAN BAGI JAWAB LISAN,,,■1130,1130,Tuan Yang di-Pertua,"Yang Berhormat. Ahli-ahli Yang Berhormat sekalian, sekian
sahaja sesi pertanyaan-pertanyaan bagi jawab lisan pada hari ini. Majlis mengumumkan
ketibaan Yang Amat Berhormat Perdana Menteri ke Dewan Negara..."
PERTANYAAN-PERTANYAAN BAGI JAWAB LISAN,,,■1130,1130,ANNOTATION,[Tepuk]
PERTANYAAN-PERTANYAAN BAGI JAWAB LISAN,,,■1130,1130,ANNOTATION,[Sesi Pertanyaan-pertanyaan bagi Jawab Lisan tamat]
RANG UNDANG-UNDANG,"RANG UNDANG-UNDANG PERBEKALAN 2024
Bacaan Kali yang Kedua",,■1130,1130,Tuan Yang di-Pertua,Dipersilakan Yang Amat Berhormat Menteri Kewangan.
RANG UNDANG-UNDANG,"RANG UNDANG-UNDANG PERBEKALAN 2024
Bacaan Kali yang Kedua",,11.35 pg.,1135,Perdana Menteri dan Menteri Kewangan [Dato’ Seri Anwar bin Ibrahim],"Tan Sri
Yang di-Pertua, saya mohon mencadangkan bahawa rang undang-undang bernama, “Suatu
Akta bagi menggunakan sejumlah wang daripada Kumpulan Wang Disatukan untuk
perkhidmatan bagi tahun 2024 dan bagi memperuntukkan jumlah wang itu untuk
perkhidmatan bagi tahun itu.” dibacakan bagi Kali Yang Kedua sekarang."
RANG UNDANG-UNDANG,"RANG UNDANG-UNDANG PERBEKALAN 2024
Bacaan Kali yang Kedua",,11.35 pg.,1135,Tuan Yang di-Pertua,Baik.
RANG UNDANG-UNDANG,"RANG UNDANG-UNDANG PERBEKALAN 2024
Bacaan Kali yang Kedua",,11.35 pg.,1135,Dato’ Seri Anwar bin Ibrahim,"Terima kasih Tan Sri Yang di-Pertua.
*Assalamualaikum warahmatullahi wabarakatuh*, salam sejahtera. *Alhamdulillah...*"
RANG UNDANG-UNDANG,"RANG UNDANG-UNDANG PERBEKALAN 2024
Bacaan Kali yang Kedua",,11.35 pg.,1135,ANNOTATION,"[Membaca
sepotong ayat Al-Quran]"
RANG UNDANG-UNDANG,"RANG UNDANG-UNDANG PERBEKALAN 2024
Bacaan Kali yang Kedua",,11.35 pg.,1135,Dato’ Seri Anwar bin Ibrahim,"*.*
Tan Sri Yang di-Pertua dan Ahli Yang Berhormat yang saya muliakan, sebagai
penghormatan kepada Ahli Dewan Negara, saya memilih untuk membentangkan sendiri
Belanjawan Madani Kedua di Dewan Negara ini..."
RANG UNDANG-UNDANG,"RANG UNDANG-UNDANG PERBEKALAN 2024
Bacaan Kali yang Kedua",,11.35 pg.,1135,ANNOTATION,[Tepuk]
RANG UNDANG-UNDANG,"RANG UNDANG-UNDANG PERBEKALAN 2024
Bacaan Kali yang Kedua",,11.35 pg.,1135,Dato’ Seri Anwar bin Ibrahim,"*Alhamdulillah* setahun negara di bawah Kerajaan Perpaduan sebagai Negara Madani.
Kita telah mencatatkan beberapa kejayaan dan prestasi ekonomi negara walaupun masih
menghadapi tentangan ekonomi global. Kita telah menyusun pendekatan terangkum dan
mampan di bawah Ekonomi Madani memperkasa rakyat.
Pertama, Pelan Peralihan Tenaga Negara. menjamin transisi tenaga yang diperlukan.
Kedua, Pelan Induk Perindustrian baharu yang memberikan hala tuju khusus tentang
pendekatan yang baharu diperkenalkan untuk menjamin penambahan pelaburan luar dan
domestik.
Ketiga, Kajian Separuh Penggal Malaysia Ke-12 yang diubahsuai dengan anjakan
baharu walaupun menggunakan beberapa prinsip yang lama yang kita teruskan, tetapi
beberapa anjakan baharu telah diperkenalkan.
Keempat ialah Belanjawan Madani 2024.
Masalah kita ialah- yang agak gusar ialah masalah inflasi. Kita mengambil alih negara
dalam keadaan inflasi mencecah 4 peratus, tetapi *alhamdulillah* setakat Oktober 2023 kadar
inflasi menurun ke 1.8 peratus.
Tahap pengangguran juga berjaya diturunkan kepada 3.4 peratus mengikut angka
September 2023 hampir menyamai kadar sebelum COVID-19 yang mencecah 3.3 peratus.
Komitmen pelaburan ini agak tinggi dan amat memberangsangkan. Sama ada hasil lawatan
dan juga hasil usaha agensi-agensi kerajaan termasuk MITI.
Komitmen mencecah RM347 bilion. Negara China, Singapura, Jepun, Korea Selatan,
Amerika Syarikat, UAE, Arab Saudi dan bagi separuh pertama 2023 kita meluluskan ya ini
bukan komitmen. Meluluskan pelaburan bernilai RM132.6 bilion iaitu melebihi 60 peratus
daripada sasaran tahun ini.
Yang utama ialah jaminan berkembangnya KDNK suku ketiga mencatat pertumbuhan
3.3 peratus ketimbang 2.9 peratus suku kedua, tahun sebelumnya. Ekonomi kita
berkembang 3.9 peratus pada sembilan bulan pertama 2023 selari dengan unjuran KDNK
sekitar 4 peratus.
Walaupun baharu setahun kita laksanakan dasar serta pendekatan yang jelas dan
tegas, ada langkah bilangan Madani kedua yang dilaksanakan umpamanya subsidi ayam
telah diapungkan dan *alhamdulillah* dapat mengekal kadar yang diunjurkan sebelum ini.
Lebih 8,000 buah tandas sekolah daif siap dibaik pulih."
RANG UNDANG-UNDANG,"RANG UNDANG-UNDANG PERBEKALAN 2024
Bacaan Kali yang Kedua",,■1140,1140,Dato’ Seri Anwar bin Ibrahim,"Ketegasan kita dalam soal tatakelola tidak boleh dipertikaikan. Ini termasuk Rang
Undang-undang Kewangan Awam dan Tanggungjawab Fiskal yang diluluskan oleh Dewan
Rakyat. Ini untuk Ahli-ahli Yang Berhormat, harus saya tegaskan. Ini maknanya,
memindahkan kuasa yang pada peringkat sekarang dikuasai sepenuhnya oleh Menteri
Kewangan tetapi dipindahkan kerana unjuran yang ditetapkan. Sekiranya tidak memenuhi
unjuran pertumbuhan atau unjuran fiskal dan defisit, Menteri Kewangan terpaksa bentang
semula untuk dibahaskan di Parlimen. Jadi, keputusan ini lebih telus, tetapi menunjukkan
kesungguhan kita menghormati prinsip tatakelola.
Untuk merancak pelancongan dan ekonomi, pengecualian visa tempoh 30 hari telah
kita umumkan minggu lalu, baik negara-negara Arab, Teluk, Turkiye, Iran dan kita
kembangkan juga ke negara China dan India, 30 hari tanpa visa mulai 1 Disember 2023
hingga 31 Disember 2024. Ada Ahli-ahli Yang Berhormat yang mungkin gusar kerana
kemungkinan isu keselamatan dibangkitkan. Maka, agensi keselamatan telah diminta untuk
diperkuatkan penapisan aspek keselamatan supaya kemudahan ini tidak menjejaskan
keselamatan negara. Semua usaha di bawah Belanjawan Madani kedua akan menyusul.
Setiap keutamaan ekonomi Madani yang dicerakinkan kepada tiga tumpuan utama:
(i) tatakelola terbaik demi ketangkasan perkhidmatan,
(ii) penstrukturan semula ekonomi bagi melonjak pertumbuhan; dan
(iii) peningkatan darjat hidup rakyat.
Mengenai reformasi fiskal. Pertumbuhan dijangka KDNK diunjurkan antara 4 hingga 5
peratus. Defisit fiskal diunjurkan berkurang kepada 4.3 peratus. Ini 5.6 peratus 2022 yang kita
warisi. Kita sudah turunkan ke-5 peratus tahun ini. *Insya-Allah,* 4.3 peratus tahun depan. Ini
sangat penting untuk menjamin keyakinan dan juga menunjukkan kesediaan kita mengurus
ekonomi secara lebih bertanggungjawab.
Belanjawan 2024 menyediakan RM393.8 bilion dengan RM303.8 bilion untuk
mengurus, RM90 bilion untuk pembangunan dan RM2 bilion untuk simpanan luar jangka atau
kontingensi. Beberapa cukai baharu diperkenalkan. Skop perkhidmatan bercukai diperluas.
Cukai perkhidmatan kepada 8 peratus ketimbang 6 peratus sekarang.
Namun, agak tidak membebankan rakyat, kenaikan tidak melibatkan perkhidmatan
seperti makan, minum, telekomunikasi, parkir kereta dan logistik. Cukai keuntungan modal
bagi pelupusan saham tidak tersenarai oleh syarikat tempatan berdasarkan keuntungan
bersih akan berkuat kuasa mulai 1 Mac 2024 pada kadar 10 peratus. Kerajaan akan
mengenakan cukai barang bernilai tinggi pada kadar 5 hingga 10 peratus ke atas barang
bernilai tinggi tertentu berdasarkan nilai ambang harga barangan. Ini juga dipastikan tidak
menjejaskan sektor pelancongan kerana pelancong asing boleh mendapat bayaran balik
cukai- *tax refund* di lapangan terbang.
Kerajaan akan menyasarkan semula subsidi secara berfasa. Ini agak kontroversial
tetapi seperti mana saya tekankan, kalau ikut jumlah subsidi tahun ini tanpa langkah-langkah
diambil, termasuk pengapungan ayam, ia akan mencecah RM81 bilion. Ini merupakan jumlah
subsidi tertinggi yang diperkenalkan oleh mana-mana negara di Asia dan bagi negara dengan
prinsip tata kelola dan pengurusan bertanggungjawab, ini tidak mampu diteruskan oleh- sebab
tanggungan hutang dan beban hutang akan tinggi.
Tetapi harus ada pendekatan. Maka, caranya iaitu meningkatkan jumlah Sumbangan
Tunai Rahmah kepada rakyat. Makna, tiap-tiap keupayaan kita menjimatkan belanja atau
mengurangkan subsidi, penjimatan itu sebahagiannya akan dipulangkan kepada rakyat
melalui Sumbangan Tunai Rahmah. Maka, kita tingkatkan jumlah Sumbangan Tunai Rahmah
ini dari RM8 bilion tahun 2023 kepada RM10 bilion tahun 2024. Umpamanya, harga ayam
telah diapungkan bermula 1 November dan *alhamdulillah,* tinjauan harga ayam rata-rata
masih berada di bawah siling RM9.40 sen sekilogram sebelum ini.
Kerajaan terus menyasarkan semula subsidi elektrik mengikut tahap penggunaan. Ini
menarik kerana ini juga menjadi isu kontroversial pada peringkat awal, tetapi yang dikenakan
hanya peringkat tertinggi satu peratus dan 99 peratus tidak dikurangkan subsidi.
Maknanya, kadar bayaran tetap kekal sama, tetapi penjimatan tingkat tertinggi yang
saya sebut maha kaya, walaupun tidak disenangi oleh sebahagian orang, tetapi maksud saya,
bila subsidi itu diberikan pada golongan paling kaya. Ini tidak munasabah. Subsidi ini macam
sedekah. Patut diberikan kepada orang yang memerlukan dan bila kita perkenalkan tahun ini,
pensasaran semula subsidi elektrik, kita jimatkan RM4.6 bilion yang diperoleh oleh 3.5 juta
orang warga asing yang sekarang mendapat manfaat dan juga orang yang dianggap kategori
terkaya di negara.
Jadi, bila kita tarik subsidi untuk mereka, makna tidak ada caj tambahan, tidak ada
cukai tambahan, tidak ada levi tambahan, yang dilakukan adalah menarik balik subsidi kepada
kategori ini dan juga kepada 3.5 juta orang warga asing. Jadi, kita jimatkan RM4.6 bilion.
Ayam tadi yang saya sebutkan tadi untuk satu tahun kita boleh jimat lebih RM1.2 bilion.
Subsidi diesel akan disasarkan semula secara berfasa. Harga diesel subsidi akan terus
dinikmati oleh pengguna terpilih seperti syarikat pengangkutan barangan.
Yang kedua adalah- ikhtiar kedua agenda reformasi institusi dan ini pasukan petugas
(STAR) pasukan khas reformasi agensi yang dipengerusikan oleh Tan Sri KSN, diberi tugas
untuk mencari jalan mempercepatkan projek. Kadang-kadang kita luluskan projek.
Pelaksanaannya mengambil masa bertahun-tahun.
Oleh itu, kita adakan satu pasukan khas dan kita berikan keutamaan. Umpamanya,
projek membina dan membaik pulih kuarters kerajaan yang sangat daif. Perumahan polis,
perumahan tentera, perumahan penjara, termasuk Penjara Sungai Buloh. Saya perhati baru-
baru ini, masih sangat daif.
Jadi oleh itu, kerajaan memperuntukkan untuk kuarters ini RM2.4 bilion dan
jawatankuasa ini akan pastikan ia dibelanjakan dengan keadaan yang sangat cepat. Saya
juga umumkan baru-baru ini Identiti Digital Nasional (IDN). Ini kerana tiap kementerian-
kadang tiap-tiap agensi perkenalkan sistem digital sendiri dan ini membebankan kewangan
rakyat, negara. Oleh itu, diperkenalkan IDN dan MIMOS sebagai agensi pelaksanaan
Program IDN dan peringkat awal diberikan RM80 juta untuk menyiapkan prasarana,
perkakasan yang cukup untuk melaksanakan dalam keadaan segera. Pendaftaran IDN untuk
pegawai-pegawai kerajaan telah dimulakan mulai minggu ini.
Saya sentuh tadi tentang ikhtiar ketiga perkhidmatan dan projek rakyat. Tandas yang
anak cucu kita gunakan di seluruh sekolah. Saya sebut sekolah kebangsaan, sekolah Cina,
sekolah Tamil, sekolah Arab dan sekarang akan menjejaskan sehingga maahad tahfiz. Itu
tandas itu di tahap- makna, kategori yang Kelas F. Jadi, tidak munasabah untuk kita latih
anak-anak, cucu kita ke sekolah dengan tandas yang begitu kotor dan tidak lengkap.
Untuk tahun ini, *alhamdulillah* kita sudah siapkan pembaikan tandas di 8,354 buah
sekolah dan telah siap sepenuhnya tahun ini. Tandas-tandas seluruh negara, tambahannya
akan disiapkan dengan tambahan peruntukan RM150 juta."
