level_1,level_2,level_3,raw_timestamp,timestamp,author,speech
RANG UNDANG-UNDANG,"RANG UNDANG-UNDANG PERBEKALAN 2024
Bacaan Kali yang Kedua",,3.41 ptg.,1541,Tuan Aknan a/l Ehtook,"Terima kasih, YB. Itulah kehendak kita. Kerana sebagaimana
yang disebutkan oleh YB tadi, orang Siam, orang Melayu, orang Cina, orang India di Kelantan
itu memang kadang-kadang tidak kenal. Kalau setakat muka dan percakapan, tidak boleh
beza.
Kalau orang Cina di Wakaf Baru itu, saya pernah bawa satu tim bola sepak Piala MCA,
penganjur itu semak sudah, semak sekali lagi IC itu. Sebab, tengok muka kulit macam saya,
cakap Melayu, satu tim cakap Melayu, cakap Kelantan. Penganjur bola MCA itu pening
kepala. *“Betul ke ini orang bukan Melayu yang masuk?”* Itu keadaannya.
Jadi, saya haraplah- kita faham. Jangan diperbesar-besarkan. Benda ini *is a private
function,* dengan izin, dan janganlah guna peluang ini untuk memporak-perandakan keadaan.
Saya fikir macam inilah. Orang-orang yang suka ambil peluang ini macam seolah-olah
orang Siam ini jadi mangsa. Duduk masak nasi tepi bendang, tiba-tiba anjing *dok* berkejar-
kejar langgar dapur itu, terbalik dapur. Nasi tidak boleh makan oleh sebab anjing berkejar.
Jangan jadi macam itu.
Jadi, saya harap pihak berkuasa pun janganlah terlalu dilihat sebagai melatah, kerana
fungsi pihak berkuasa ialah sekiranya ada isu yang boleh merosakkan keadaan, gunakanlah
peluang itu untuk menjelaskan kepada umum bahawa sebenarnya macam ini, macam ini,
macam ini. Sekiranya ada pelanggaran syarat, jika boleh ditegur, tegur, jika boleh didenda,
denda. Selesai masalah.
Dan juga, pihak berkuasa yang lain yang berkaitan dengan isu mem-*viral*-kan keadaan
yang merosakkan keamanan negara, ambillah tindakan. Jangan dibiarkan berulang. Kerana,
hari ini, orang Siam di Bachok. Saya tidak tahulah bila pula di mana, kemudian orang Siam
tempat lain *ker*, orang tidak Siam di tempat lain *ker*, kan...? Sebab benda ini boleh berlaku.
Jadi kita sama-samalah ambil iktibar supaya benda ini tidak berulang kerana kalau kita
biar berulang, yang tidak cerdiknya kita. Itu sahaja saya punya pandangan. Yang tak
cerdiknya kita kerana membiarkannya berulang. Apakah- orang kampung kata, *“Adakah
hangpa ramai-ramai duduk atas sana tak boleh buat apakah?”* Itu *slang* Kedah lah. Jadi,
fikirkanlah.
Pihak berkuasa di luar sana, tolonglah kumpulkan kepala-kepala anda, *get your head
together,* dengan izin, cari cara terbaik untuk menghalang benda ini berlaku. Tidak kiralah
Siam tak Siam, Melayu tak Melayu, kita amankan negara kita ini, kita *move forward.*"
RANG UNDANG-UNDANG,"RANG UNDANG-UNDANG PERBEKALAN 2024
Bacaan Kali yang Kedua",,■1550,1550,Tuan Aknan a/l Ehtook,"Bagi saya, saya ada pesan pada orang-orang saya bahawa denda telah dikenakan.
Saya tidak pastilah berapa penghujungnya dan *we can* bayar*. Okay, move on.* Lupakan bab
ini, yang lain itu kita biarkan begitu supaya tidak berulang, pengajarannya, okey. Itu tentang
yang bukan bajetlah..."
RANG UNDANG-UNDANG,"RANG UNDANG-UNDANG PERBEKALAN 2024
Bacaan Kali yang Kedua",,■1550,1550,ANNOTATION,[Ketawa]
RANG UNDANG-UNDANG,"RANG UNDANG-UNDANG PERBEKALAN 2024
Bacaan Kali yang Kedua",,■1550,1550,Tuan Aknan a/l Ehtook,Sekarang ini saya hendak masuk dalam bajet sedikit...
RANG UNDANG-UNDANG,"RANG UNDANG-UNDANG PERBEKALAN 2024
Bacaan Kali yang Kedua",,■1550,1550,Timbalan Yang di-Pertua,Panjang juga tadi...
RANG UNDANG-UNDANG,"RANG UNDANG-UNDANG PERBEKALAN 2024
Bacaan Kali yang Kedua",,■1550,1550,ANNOTATION,[Ketawa]
RANG UNDANG-UNDANG,"RANG UNDANG-UNDANG PERBEKALAN 2024
Bacaan Kali yang Kedua",,■1550,1550,Tuan Aknan a/l Ehtook,"Ya, Panjang juga okey. Isu utama sebab apa, saya nampak
kalau kita tidak selesaikan orang yang ganti saya nanti itu cakap benda yang sama, kan? Ini
tentang bajet sikit.
Baharu-baharu ini terima kasih kepada kerajaan kerana telah meluluskan peruntukan
sebanyak RM500,000 kepada masyarakat Siam untuk kita jelaskan sagu hati kepada guru-
guru yang mengajar bahasa Siam di Pasir Bunda di wat-wat. Kita ada 50 buah wat yang
mengadakan kelas bahasa ibunda. Seramai 170 orang guru yang telah berkhidmat secara
sukarela selama ini dan kita bayar sagu hati sedikit berdasarkan tabung yang ada.
Macam apa, orang kata tok siak di masjidlah, guna tabung masjid bayar, kan? Ada
lebih, lebihlah, sedikit, sedikitlah. Jadi, kadang-kadang kita rasa tidak berbaloi kita mohon
dengan kerajaan. Kerajaan meluluskan dan telah bayar. Saya berharaplah kerana dalam bajet
tahun ini diluluskan sebanyak jumlah yang lebih kurang sama. Mungkin diletakkan di
Kementerian Perpaduan untuk diagihkan kepada masyarakat minoriti yang ada kelas bahasa
ibunda masing-masing.
Jadi, tahun ini saya ingin berhasrat untuk mencadangkan kepada kerajaan, kita
perlukan dalam RM2 juta. Pertama, untuk bayar elaun sagu hati kepada guru-guru untuk
tempoh setahun. Baharu ini RM500,000 itu untuk tiga bulan sahaja dan dengan kos-kos lain
cukuplah kita bayar tetapi untuk tahun hadapan nanti kita perlu kos yang lebih. Kemudian, kita
perlu juga sedikit sumbangan untuk kos operasi, bayar bil air, bil api di kelas-kelas tersebut.
Jadi, saya harap kerajaan dapat menyediakan peruntukan tersebut. Saya ingin
mencadangkan kepada Kementerian Perpaduan, jadikanlah fungsi ini fungsi memberi
bantuan kepada kelas-kelas bahasa ibunda ini sebagai satu tugas rasmi Kementerian
Perpaduan. Adakan pegawai yang boleh bertanggungjawab, pegawai yang kita boleh rujuk
kan, senang kita hendak uruskan.
Kalau tidak nanti saya takut apabila tahun ini ada, tahun depan ada, tahun selebihnya
tidak ada, itu tidak sepatutnya berlaku ya, kerana kita dapati bahawa apabila pelajar-pelajar,
murid-murid Siam ini boleh berbahasa tambahan, mereka ada kelebihan dalam untuk
mendapat pekerjaan dan sebagainya. Ada syarikat yang membayar elaun lebih kerana boleh
lebih berbahasa.
Saya tidak pastilah sekarang. Dahulu pihak olis atau tentera ada elaun misai ya. Saya
tidak tahulah kalau bekas polis boleh cerita. Lebih kurang macam itulah, mereka yang boleh
berbahasa ibunda cakap Siam ini akan mendapat sedikit tambahan kerana keupayaan
mereka. Jadi, saya harap benda ini akan diteruskan.
Keduanya, tentang pendidikan. Berdasarkan soalan saya, semakan saya, kita dapati
bahawa sejak 2016 sehingga 2023 ada lebih daripada purata 580 orang pelajar mahasiswa
Siam di 20 buah universiti awam setiap tahun. Jadi, dengan jumlah orang dan juga bilangan
itu saya rasa terlalu sedikit. Saya pun hendak mohon kepada Kementerian Pendidikanlah
Tinggi carilah peluang macam mana ataupun cara macam mana untuk meningkatkan
kemasukan pelajar-pelajar ini.
Saya menyeru kepada pelajar-pelajar masyarakat Siam untuk berusaha lebih gigih
untuk melayakkan diri untuk masuk ke universiti awam kerana rata-rata orang Siam ini
kebanyakan petani, adalah yang sudah berpendidikan, masuk sektor pekerjaan lain dan
sebagainya. Jadi, masih ramai lagi yang bertani dan anak-anak mereka juga kalau tidak
dimajukan daripada segi pendidikan akan terus bertani.
Saya rasa kerajaan pun tidak mahulah rakyat-rakyat luar bandar terlalu bergantung
kepada pertanian. Pertanian pula bukan pertanian-pertanian secara besar-besaran, kan? Saiz
ladang, saiz kebun yang kecil, saiz sawahnya kecil, tidak akan memajukan keluarga dan
sebagainya.
Di bidang TVET, semakan terakhir saya dapati bahawa TVET ini masih lagi satu
bidang yang agak janggal bagi masyarakat Siam kerana ikut data yang saya dapat, 31 orang
sahaja yang masuk bidang TVET. Saya tidak pasti data itu setahun kah, tahun ini sahaja ke
tetapi angka 31, *so* saya anggap tahun ini.
Jadi kalau satu tahun 31 orang, terlalu kecil. Jadi, Kementerian Sumber Manusia,
Kementerian Pendidikan, carilah jalan macam mana kerana saya dapati ada satu Institut
Kemahiran Belia Negara (IKBN) di Kampung Naka di Kedah, di tengah-tengah kampung
Siam. Di tepi pun, tanah pun asalnya tanah orang Siam juga, diambil dan dibina.
Akan tetapi bilangan pelajar Siam di situ agak rendah. Saya jangkakan bolehlah orang
kata separuhnya orang-orang Siam dan separuh lagi orang Melayu di kawasan itu tetapi
bilangannya agak kecil dan mendukacitakan. Saya harap kementerian dapat mengambil
tindakan sewajarnya.
Satu perkara lagi yang menjadi bidang yang saya selalu kacau iaitu capaian Internet
kerana tempoh hari saya dan YB Dr. Hajah Wan Martina dan rakan-rakan yang lain adalah di
bawah bidang kuasa Jawatankuasa Sosiobudaya, Komunikasi dan Pendidikan. Jadi, banyak
kita bangkitkan tentang pencapaian Internet.
Orang-orang kampung di belah Utara, di belah Kelantan sana pun bangkit dengan
saya tentang capaian Internet yang mereka hadapi. Jadi, bila Menteri bercakap, menjawab
kata oh, kita ada purata 96 hingga 70 peratus kawasan berpenduduk, Tuan Yang di-Pertua,
mencapai, dapat capaian Internet yang sempurna. Okeylah baik lah, tetapi tiga hingga empat
peratus itu belum, kan?
Jadi, saya rasa kalau zaman ini capaian Internet kalau tidak dapat 100 peratus itu
bukan boleh dibanggakan."
RANG UNDANG-UNDANG,"RANG UNDANG-UNDANG PERBEKALAN 2024
Bacaan Kali yang Kedua",,■1550,1550,Timbalan Yang di-Pertua,Tidak payah 5G ya?
RANG UNDANG-UNDANG,"RANG UNDANG-UNDANG PERBEKALAN 2024
Bacaan Kali yang Kedua",,■1550,1550,Tuan Aknan a/l Ehtook,Ya.
RANG UNDANG-UNDANG,"RANG UNDANG-UNDANG PERBEKALAN 2024
Bacaan Kali yang Kedua",,■1550,1550,Timbalan Yang di-Pertua,Tidak payah 5G.
RANG UNDANG-UNDANG,"RANG UNDANG-UNDANG PERBEKALAN 2024
Bacaan Kali yang Kedua",,■1550,1550,Tuan Aknan a/l Ehtook,"Tidak perlu 5G lagi, itu kemudian cerita."
RANG UNDANG-UNDANG,"RANG UNDANG-UNDANG PERBEKALAN 2024
Bacaan Kali yang Kedua",,■1550,1550,Timbalan Yang di-Pertua,4G pun okey.
RANG UNDANG-UNDANG,"RANG UNDANG-UNDANG PERBEKALAN 2024
Bacaan Kali yang Kedua",,■1550,1550,Tuan Aknan a/l Ehtook,"Cerita yang 4G, 3G ini dulu.
Jadi, saya kata kalau tiga, empat persen itu di rumah mak mertua Menteri saya rasa
dapat 100 peratus *kot*. Itu sahaja ukuran, senang. Sama juga dengan air dan sebagainya.
Jadi, kepada orang kampung, ini besar. Kepada Menteri dia nampak 96, 97 itu cukup baik,
*excellent A plus, plus* supaya orang kampung tengok tiga hingga empat persen yang tidak
dapat ini, merata cari, kan?
Sampai bilakah kita hendak tengok gambar-gambar? Sekarang ini tidak ada lah
gambar apa yang budak perempuan yang masuk universiti naik pokok dan sebagainya. Kalau
di *viral* kan semula, mulalah satu kementerian berlari untuk pastikan bahawa benda ini tidak
berlaku lagi.
Jadi, saya hendak tanyalah kepada Kementerian Komunikasi dan Digital, sejauh mana
hasil perbincangan dengan syarikat-syarikat *telco* ya, dalam usaha untuk meningkatkan
capaian Internet melalui perkongsian menara dan perkongsian rangkaian? Hari itu soalan
saya sudah naik tetapi Menteri jawab tidak penuh.
Saya bagi peluang sekali lagi untuk Menteri menjawab. Beritahulah kami, bilakah?
Oleh sebab setakat ini hanya di Sarawak sebagai pemula sebagai pilot. Bilakah negeri-negeri
lain akan menikmati kemudahan capaian Internet yang lebih sempurna melalui kaedah
perkongsian rangkaian?
Itu perkongsian menara pun satu hal sudah, kan? Menara *Maxis, Digi* tidak boleh
hendak tumpang, sekarang ini boleh tumpang *ker*? Masing-masing dengan caranya. Ada
alasannya. Alasan kata menara itu tidak cukup kuat, kalau pasang *disc* tambah lagi, tumbang.
Macam-macam cerita.
Jadi, benda itu ialah *is a proses,* dengan izin Tuan Yang di-Pertua. Itu masalah
Menteri, masalah kementerian. Sekarang ini orang kampung hendak perkhidmatan. Cakap
cara orang kampung, *“Hampa dibayar gaji, buatlah.”* Kan? Tidak payah proses yang itu, kami
tidak mahu cerita. Kami cerita hasil, bilakah nak dapat? Itu sahaja, mudah sahaja.
Saya berpindah kepada kementerian satu lagi, ini Kementerian Pertanian ya."
RANG UNDANG-UNDANG,"RANG UNDANG-UNDANG PERBEKALAN 2024
Bacaan Kali yang Kedua",,■1550,1550,Timbalan Yang di-Pertua,"Tidak apa YB. YB tadi cakap ini mungkin kali terakhir jadi
YB hendak cakap lama sedikit pun tidak apa."
RANG UNDANG-UNDANG,"RANG UNDANG-UNDANG PERBEKALAN 2024
Bacaan Kali yang Kedua",,■1550,1550,Tuan Aknan a/l Ehtook,
RANG UNDANG-UNDANG,"RANG UNDANG-UNDANG PERBEKALAN 2024
Bacaan Kali yang Kedua",,■1550,1550,ANNOTATION,[Ketawa]
RANG UNDANG-UNDANG,"RANG UNDANG-UNDANG PERBEKALAN 2024
Bacaan Kali yang Kedua",,■1550,1550,Tuan Aknan a/l Ehtook,"Okey, terima kasih."
RANG UNDANG-UNDANG,"RANG UNDANG-UNDANG PERBEKALAN 2024
Bacaan Kali yang Kedua",,■1550,1550,Timbalan Yang di-Pertua,Bagi peluanglah.
RANG UNDANG-UNDANG,"RANG UNDANG-UNDANG PERBEKALAN 2024
Bacaan Kali yang Kedua",,■1550,1550,Tuan Aknan a/l Ehtook,"Terima kasih, terima kasih."
RANG UNDANG-UNDANG,"RANG UNDANG-UNDANG PERBEKALAN 2024
Bacaan Kali yang Kedua",,■1600,1600,Tuan Aknan a/l Ehtook,"Tentang makanan. Kita orang kata tanah subur. Orang kata baling apa pun tumbuh
kecuali batu la *noh,* kan? Air cukup. Hujan sentiasa ada tetapi makanan tidak cukup, kan?
Setiap kali Ahli-ahli, kawan-kawan tanya tentang beras, Menteri jawab jawapan sama, kan?
Sebab saya pun dahulu pun pernah juga jadi pegawai macam di belakang, di atas sana yang
sediakan jawapan. Jawapan selamat dan Menteri dari mana datang pun jawapan yang sama.
Sebab itu saya dah berhenti dah tanya Kementerian Perladangan tentang harga getah,
tentang harga sawit, semua itu. Dah berhenti dah sebab jawapan yang saya draf dahulu
dibaca balik semula Menteri ke-8, kan? Itu masalahnya."
RANG UNDANG-UNDANG,"RANG UNDANG-UNDANG PERBEKALAN 2024
Bacaan Kali yang Kedua",,■1600,1600,Timbalan Yang di-Pertua,"Dengar itu pegawai kementerian. Ada pegawai
kementerian?..."
RANG UNDANG-UNDANG,"RANG UNDANG-UNDANG PERBEKALAN 2024
Bacaan Kali yang Kedua",,■1600,1600,ANNOTATION,[Ketawa]
RANG UNDANG-UNDANG,"RANG UNDANG-UNDANG PERBEKALAN 2024
Bacaan Kali yang Kedua",,■1600,1600,Tuan Aknan a/l Ehtook,"Saya tidak tahu zaman- sempatlah zaman mendiang Tan Sri
Lim Keng Yaik dahulu. Jadi, tolonglah orang kata dalam bahasa Inggerisnya, *put your head
together*. Tengoklah macam mana. Kita *duk* import, laporan import kita makanan terpaksa
import. Bayangkan kalau katakanlah sempadan Siam, sempadan Thailand di utara itu ditutup,
kan? Ikan tidak sampai ke Selayang. Kita tidak dapat makan ikan. Tiap-tiap pagi lori berkejar
daripada Pattani itu ke Selayang untuk sampai bawa ikan sebelum pukul 2 pagi kerana
selepas pukul 2 peraih sudah keluar. Itu kita bergantung hidup kita."
RANG UNDANG-UNDANG,"RANG UNDANG-UNDANG PERBEKALAN 2024
Bacaan Kali yang Kedua",,■1600,1600,Tuan Haji Hussin bin Ismail,Boleh mencelah sedikit Yang Berhormat? Dekat depan.
RANG UNDANG-UNDANG,"RANG UNDANG-UNDANG PERBEKALAN 2024
Bacaan Kali yang Kedua",,■1600,1600,Tuan Aknan a/l Ehtook,"Ya, sila."
RANG UNDANG-UNDANG,"RANG UNDANG-UNDANG PERBEKALAN 2024
Bacaan Kali yang Kedua",,■1600,1600,Tuan Haji Hussin bin Ismail,"Yang Berhormat Yang di-Pertua, kadang-kadang saya
pun turut hairan. Sebelah Sungai Golok- dekat sebelah sini Golok, sebelah sininya Rantau
Panjang. Sebelah sini Padang Besar, sebelah sananya Siam, tepi rega itu tanah serupa, apa
pun serupa. Kenapakah yang Thailand mampu bekal pelbagai jenis produk pertanian di
Malaysia? Kenapakah Malaysia sepatutnya tidak bekalkan produk pertanian itu balik pada
Thailand? Dekat mana silapnya? Terima kasih."
RANG UNDANG-UNDANG,"RANG UNDANG-UNDANG PERBEKALAN 2024
Bacaan Kali yang Kedua",,■1600,1600,Tuan Aknan a/l Ehtook,Ini patut tanya Menteri tetapi saya jawablah...
RANG UNDANG-UNDANG,"RANG UNDANG-UNDANG PERBEKALAN 2024
Bacaan Kali yang Kedua",,■1600,1600,ANNOTATION,[Ketawa]
RANG UNDANG-UNDANG,"RANG UNDANG-UNDANG PERBEKALAN 2024
Bacaan Kali yang Kedua",,■1600,1600,Tuan Haji Hussin bin Ismail,Sebab tadi menyediakan jawapan kepada Menteri.
RANG UNDANG-UNDANG,"RANG UNDANG-UNDANG PERBEKALAN 2024
Bacaan Kali yang Kedua",,■1600,1600,Tuan Aknan a/l Ehtook,"Jawab kampung sayalah ya. Saya sudah perhati, kita tidak
lapar. Itu sahaja, kita tidak lapar. Orang-orang kita tidak lapar kerana macam-macam bantuan
ada. Tidak perlu berusaha. Sana- *depa* lapar*, depa* kena berusaha. Berusaha, berusaha jadi.
*Depa* jadi kaya, kan?
Kalau YB tengok video, Tuan Yang di-Pertua tengok video, macam-macam kaedah
pertanian dibelah sana. Mereka sudah tanam dan eksport kurma. Kurma ditanam di atas batas
tepinya sungai. Mereka guna perahu untuk bawa kurma daripada pokok, dari ladang ke luar.
Kurma sudah tidak perlu pergi ke Timur Tengah untuk beli kurma. Pergi ke Siam, Thailand
cukup. Itu sahaja, kan?
Kita bila hendak tanam sesuatu, buat Kertas Kerja. Datang macam-macam bantuan.
Daripada mesin, cangkul, kan? Semua bagi, kan? Satu musim terbang. Dengan mesin-mesin
itu pun hilang. Itu masalah kita. Itulah yang kita bermasalah. Kita orang kata terperanjat
ataupun apa perkataan yang lebih baik tidak tahu. Di negara sebelah sana macam-macam
dikeluarkan eksport pada kita dan kita *duk* tunggu, kan? Adakah kita tidak boleh buat
sedemikian? Tidak bolehlah *kut noh*. Sebab itu sampai sekarang ia jadi macam itu, kan?
Jadi, kepada Menteri, tengoklah. Fikirkanlah cara terbaik macam mana kita hendak
buat. Kaedah yang lama sedia ada itu saya rasa kena ubah sikitlah. Yang buat Kertas Kerja
bantuan *A to Z,* A sampai Z- habis.
Contoh satu lagi saya hendak ceritakan. Pernah cerita *kut* sini? Kepada yang baharu,
dengarlah sedikit. Kita hapuskan subsidi tembakau. Di kawasan Bachok banyaklah. Dahulu
ramai kaya-kaya kerana tembakau. Bila hapus tembakau LKTN perkenalkan tanaman..."
RANG UNDANG-UNDANG,"RANG UNDANG-UNDANG PERBEKALAN 2024
Bacaan Kali yang Kedua",,■1600,1600,Seorang Ahli,Kenaf.
RANG UNDANG-UNDANG,"RANG UNDANG-UNDANG PERBEKALAN 2024
Bacaan Kali yang Kedua",,■1600,1600,Tuan Aknan a/l Ehtook,"Sebelum kenaf, ubi keledek. Ikan hiasan. Saya kata, hampa
bagi orang Bachok yang dahulu daripada kecil sampai ke tua *duk* tanam tembakau, bagi dia
bela ikan hiasan. Gerenti tidak jadi punya. Memang tidak jadi pun. Nasib baik kecil. Kalau
besar depa dah goreng ikan hiasan itu. Tidak jadi. Bukan naluri mereka.
Sama juga dahulu- zaman dahulu tidak kisahlah orang-orang nelayan yang miskin ini
dibawa masuk jadi peneroka FELDA di atas bukit *nu*. *Duk* seminggu dia menung. Biasa *duk*
dengar bayu laut. Ini dia *duk* tengok bukit. Lari balik. Lebih kurang samalah ceritanya.
Jadi, saya pun tidak ada jawapan yang tepat, tetapi sama-samalah di kementerian,
Menteri, pakar-pakar penasihat yang ada, pakar-pakar pertanian pun ada. Cari jalan. Okey?
Kita tidak mahulah kita *duk* bergantung beras Siam, beras Thailand hari-hari, kan?
Sama juga dengan yang sarung tangan getah kita. Wah, kita keluarkan berbilion-bilion
pasang sarung tangan. Cuba negara Thailand cekik tambah cukai kepada lateks 10 peratus,
menangis tidak berlagu kita. Ha itu.
Sebab itu sesetengah syarikat sudah pandai. Selain daripada ada di sini, mereka buat
kilang di Selatan Thailand untuk pastikan mereka dapat bekalan sarung tangan. Jadi, eksport
atas nama syarikat di Malaysia. Benda itu dari Thailand. Kita pun dalam data kita, “Oh wah!”
Kita keluarkan berbilion-bilion sarung tangan getah tetapi bukan kita punya. Dia punya getah.
Lateks kita tidak ada. Getah skrap pun tidak ada.
Okey, seterusnya daripada segi- saya hendak bangkitkan tentang daya saing kita.
Okey, orang-orang kita ini daripada segi pendidikan bagus. Ramai yang masuk universiti,
ramai yang masuk kolej. Orang kata dahulu susah hendak cari orang ada ijazah. Sekarang ini
baling batu pun silap-silap lantun pertama itu ada Ijazah. Lantun kedua dapat ada yang PhD.
Itulah ramainya kita terpelajar, tetapi bila ramai yang terpelajar ini, ada juga kesannya. Mereka
tidak mahu kerja yang lain-lain. Pastilah, kalau sudah Ijazah takkan hendak kerja rendah-
rendah kan, tetapi dalam masa yang sama, kita telah mewujudkan lompong ataupun
kekurangan tenaga kerja di peringkat pertengahan.
Kalau pihak di bidang TVET tidak dapat memberi tenaga kerja tersebut, kita akan ada
masalah. Terpaksa kita import. Sudahlah kita import yang peringkat rendah. Jadi, kita kena
pelanlah betul dahulu. Hendak cakap dua perkara.
Pertama, kita mula hendak gunakan digital ID. Kita pun mula bising. Ish boleh *ka,* kan?
Pertama, kita *duk* gunakan syarikat luar negara.
Kedua, pakar dari luar negara. Kerana pakar IT dia banyak dari India. Bolehkah kita
hendak pastikan kita punya tidak bocor? Sebab apa, kita tidak ada orang kita. Dahulu saya di
Jabatan Kajian pun sama. Bila ada projek tentang IT ini, marilah konsultan kita. Masing-
masing masuk tender dan masing-masing bertanding apa tahu? Bertanding nama ‘mat saleh’
yang ada dalam senarai pegawai dia itu. Siapa yang ada ramai, peluang dia untuk dapat kerja
itu lebih tinggi. Itu mentaliti kita masa itu.
Saya harap ke depan nanti janganlah. Kita sudah ada macam-macam universiti.
Jangan setakat keluar ijazah. Keluarkan ijazah yang boleh buat kerja. Itu yang kita perlukan.
Jadi tidak payah kita risau bahawa tidak ada sabotaj daripada orang luar mencuri data kita
bila kita cuba hendak gunakan digital ID dan sebagainya.
Satu lagi ialah tentang tenaga kerja kita di peringkat bawah. Saya tidak pasti, saya
hendak minta tolong Yang Berhormat-Yang Berhormat kalau ada peluang. Hari Ahad, tengah
hari cuba pergi ke kawasan Central Market. Jalan Tun HS Lee, Petaling Street apa semua itu,
pergilah. Saya pernah pergi. Saya takut kerana saya rasa saya macam duduk di luar negara
kerana populasi pekerja asing di kawasan itu terlalu tinggi. Bukan apa, mereka hari Ahad
mereka cuti. Mereka keluar berlibur. Bahasanya- penuh."
