level_1,level_2,level_3,raw_timestamp,timestamp,author,speech
RANG UNDANG-UNDANG,"RANG UNDANG-UNDANG PERBEKALAN 2024
Bacaan Kali yang Kedua",,■1250,1250,Dato’ Kesavadas a/l A Achyuthan Nair,"Saya percaya bahawa pembangunan semula Stadium Paroi merupakan hasrat yang
turut dikongsi oleh Yang Berhormat Menteri Pertahanan yang merupakan figura penting di
sebalik kejayaan bersejarah Stadium Paroi menjadi tumpuan rumah bagi Temasya Sukan
2004.
Sejajar dengan fokus kerajaan untuk menaik taraf kemudahan belia dan sukan yang
daif di seluruh negara seperti yang dinyatakan dalam Ucapan Pembentangan Belanjawan
2024, saya memasang hasrat yang besar untuk melihat fasiliti sukan milikan kerajaan negeri
seperti Stadium Tuanku Abdul Rahman dapat dirangkumkan dalam agenda pembangunan
semula yang direncanakan oleh KBS.
Membawa suara seluruh rakyat Negeri Sembilan di Dewan yang mulia ini, kami
meletakkan harapan yang besar agar jalinan kerjasama yang erat antara KBS dengan
Kerajaan Negeri Sembilan dapat dibentuk ke arah merealisasikan kerja-kerja naik taraf
Stadium Paroi pada tahun hadapan.
Selain penyokong setia Hobin Jang Hobin, seluruh skuad kelab bola sepak NSFC juga
mengharapkan agar penukaran padang *cow grass* kepada padang *Zeon Zoysia* yang akan
menjadi realiti pada masa hadapan. Secara peribadi, saya musykil tentang kekuatan
kewangan KBS untuk menyokong apa jua perancangan bagi menaik taraf fasiliti sukan negeri
seperti stadium.
Berdasarkan apa yang dinyatakan dalam Anggaran Perbelanjaan Persekutuan 2024,
Kementerian Belia dan Sukan hanya diperuntukkan sebanyak RM100 juta bagi skop
perbelanjaan untuk menyelenggarakan kompleks serta kemudahan sukan negeri-negeri.
Berdasarkan hal tersebut, persoalan yang harus dijawab oleh Yang Berhormat Menteri
atau Timbalan Menteri ialah adakah kementerian pada hakikatnya benar-benar serius untuk
membantu negeri-negeri termasuk Negeri Sembilan dalam aspek kewangan untuk
melaksanakan pembangunan semula stadium utama seperti Stadium Tuanku Abdul
Rahman?
Stadium STAR yang dinaiktarafkan menerusi dukungan bersama KBS berupaya
menjadi antara *X-factor* kepada pembangunan ekonomi negeri. Seperti Stadium Nasional
Bukit Jalil, Stadium Tuanku Abdul Rahman yang dimodenkan mampu menjadikan Negeri
Sembilan sebagai destinasi tumpuan sempena Tahun Melawat Malaysia 2026 terutamanya
bagi penganjuran konsert atau festival budaya yang menampilkan artis-artis tempatan dan
antarabangsa yang terkemuka.
Tan Sri Yang di-Pertua, Tahun Melawat Malaysia 2026 merupakan aspirasi penting
untuk Malaysia Madani menggapai kemajuan ekonomi yang lebih memberangsangkan dalam
sektor pelancongan domestik.
Di Negeri Sembilan, Port Dickson merupakan antara destinasi tarikan pelancongan
yang sentiasa dekat di hati pelancong-pelancong asing dan tempatan. Selain dibangunkan
dengan pelbagai kemudahan, hospitaliti yang kondusif bertaraf Lima Bintang, keunikan
pantai-pantai Port Dickson juga menjadi daya penarik kepada- serta pengunjung untuk
menikmati waktu senggang mereka bersama keluarga dan rakan-rakan.
Namun begitu, masalah pencemaran laut dan pantai yang sekian lama menimpa bumi
Port Dickson sedikit sebanyak telah menjejaskan periuk nasi ramai pemain industri
pelancongan yang bertapak di Port Dickson. Oleh sebab itu, menerusi peruntukan-peruntukan
yang tersedia bagi tahun 2024, Kementerian Pelancongan, Seni dan Budaya seharusnya
menumpukan pelaksanaan 3M’s di Port Dickson iaitu mengindahkan semula pantai-pantai
Port Dickson yang tercemar. Yang kedua, membersihkan semula air laut Port Dickson yang
menjadi tempat untuk anak-anak kita mandi-manda ketika cuti persekolahan dan
membangunkan semula kemudahan-kemudahan asas perniagaan yang menjadi tempat
mencari rezeki bagi pengusaha-pengusaha perniagaan desa di sekitar Port Dickson.
Secara peribadi, saya menyambut baik penyediaan peruntukan bagi pengindahan
tempat pelancongan sebanyak RM20 juta. Ia berupaya menarik semula kehadiran pelancong-
pelancong asing dan tempatan ke destinasi pelancongan tersebut yang pada hari ini disurami
dengan pelbagai masalah pencemaran yang semakin tidak terkawal.
Seperti yang pernah disuarakan oleh Pengerusi Persatuan Nelayan Teluk Kemang,
sampah sarap yang mencemari air laut Port Dickson telah mengundang kemudaratan kepada
hidupan laut yang merupakan antara sumber rezeki para nelayan di situ. Beliau juga
menggesa agar kerajaan dapat campur tangan dalam hal ehwal pembinaan hotel atas laut
memandangkan pembangunan sebegitu telah menyukarkan pergerakan nelayan-nelayan
yang terpaksa bergerak lebih jauh untuk mencari hasil tangkapan. Berdasarkan inti pati yang
saya bangkitkan berkenaan Port Dickson, saya ingin membangkitkan tiga persoalan untuk
dijawab oleh Yang Berhormat Menteri.
Pertama, apakah aspek-aspek yang akan diberi penumpuan khusus dalam agenda
mengembalikan semula status Port Dickson sebagai destinasi pelancongan tumpuan
menjelang Tahun Melawat Malaysia 2026?
Kedua, apakah bentuk usaha sama jangka panjang yang akan dicapai bersama
Kerajaan Negeri Sembilan dalam melaksanakan setiap inisiatif pengindahan semula pantai
dan air laut Port Dickson yang tercemar? Adakah RM20 juta yang dikhaskan bagi tujuan
menaik taraf infrastruktur pelancongan bagi tahun 2024 akan turut mencakupi pembersihan
semula air laut, pengindahan semula pantai dan pembangunan semula perniagaan desa di
Port Dickson?
Ketiga, apakah bentuk dorongan atau insentif sokongan yang akan disediakan kepada
organisasi swasta dan badan bukan kerajaan untuk bersama-sama kerajaan membersihkan
sampah sarap yang mencemari pantai-pantai dan persekitaran pusat perniagaan di Port
Dickson?
Apakah bentuk penguatkuasaan serta pemantauan bersepadu yang akan
dilaksanakan bersama kerajaan tempatan dalam memelihara kebersihan serta keindahan
pantai dan air laut Port Dickson yang kini menjadi tempat bagi sukarelawan serta aktivis dalam
sekitar bergotong royong? Adakah apa-apa cadangan atau perancangan untuk membuat Port
Dickson sebagai tempat *duty free* atau cukai bebas seperti Langkawi dan Pulau Pangkor? Ini
akan menarik ramai lagi pelancong ke Port Dickson.
Tan Sri Yang di-Pertua, berbicara soal alam sekitar, teringat saya kepada tuduhan
yang dilemparkan oleh Kesatuan Eropah (EU) terhadap penghasilan komoditi minyak sawit
kita kononnya terpalit dengan aktiviti penebangan hutan. Tuduhan tersebut telah dicanangkan
di seluruh dunia sehinggakan imej serta kredibiliti Malaysia sebagai antara pengeluar terbesar
komoditi minyak sawit di peringkat global semakin tercalar. Persepsi negatif yang tidak
berasas itu telah mengheret negara untuk berhadapan dengan kemerosotan hasil eksport
minyak sawit yang turut memberi kesan domino kepada pendapatan negara.
Berdasarkan Undang-undang *Landmark Deforestation* yang telah diluluskan oleh
Parlimen Eropah pada April lalu, mana-mana syarikat yang mengimport komoditi dari negara
luar perlu menyediakan dokumentasi yang boleh mengesahkan ketiadaan unsur pembalakan
dalam satu-satu penghasilan komoditi. Dokumentasi yang diperlukan tersebut adalah
mandatori kepada mana-mana syarikat pengedar sebagai bukti sokongan bahawa komoditi
yang dieksport itu tidak melibatkan aktiviti penebangan hutan yang dijalankan selepas tahun
2020. Perundangan tersebut seolah-olah menggambarkan betapa curiganya Kesatuan
Eropah terhadap kredibiliti sektor minyak sawit negara yang sebelum ini menjadi antara sektor
yang mendapat perhatian dan pasaran Eropah.
Saya difahamkan bahawa Yang Berhormat Menteri Perladangan dan Komoditi telah
menyatakan pendirian tegas terhadap ketidakadilan yang ditonjolkan menerusi perundangan
tersebut. Kerajaan seharusnya mempamerkan keterbukaan dalam mencapai kesepakatan
mengenai pengeksportan minyak sawit negara bersama pihak EU. Rundingan dua hala
tersebut sewajarnya dibuat secara bersiri sebagai usaha untuk mengurangkan impak
langsung kepada golongan pekebun kecil yang terus terjejas."
RANG UNDANG-UNDANG,"RANG UNDANG-UNDANG PERBEKALAN 2024
Bacaan Kali yang Kedua",,■1250,1250,Tuan Yang di-Pertua,"Yang Berhormat, saya biar Yang Berhormat Senator baca
sampai habis agenda kelapa sawit itu tadi. Kalau hendak pindah, kita sudah pukul satu Yang
Berhormat dan lepas ini ada *function* PM dekat belakang."
RANG UNDANG-UNDANG,"RANG UNDANG-UNDANG PERBEKALAN 2024
Bacaan Kali yang Kedua",,■1250,1250,Dato’ Kesavadas a/l A Achyuthan Nair,Ya.
RANG UNDANG-UNDANG,"RANG UNDANG-UNDANG PERBEKALAN 2024
Bacaan Kali yang Kedua",,■1250,1250,"Tuan Yang di-Pertua Jadi, Yang Berhormat sambung semula... Dato’ Kesavadas a/l A Achyuthan Nair","Bolehkah saya- saya perlu lagi mungkin lagi
lima, enam minit. Boleh? Boleh? Sikit lagi, boleh? Saya akan sambung ya selepas *lunch,*
makanan tengah hari. Sekian, terima kasih."
RANG UNDANG-UNDANG,"RANG UNDANG-UNDANG PERBEKALAN 2024
Bacaan Kali yang Kedua",,■1250,1250,Tuan Yang di-Pertua,Sambung petang.
RANG UNDANG-UNDANG,"RANG UNDANG-UNDANG PERBEKALAN 2024
Bacaan Kali yang Kedua",,■1250,1250,Dato’ Kesavadas a/l A Achyuthan Nair,"Ya, terima kasih."
RANG UNDANG-UNDANG,"RANG UNDANG-UNDANG PERBEKALAN 2024
Bacaan Kali yang Kedua",,■1250,1250,Tuan Yang di-Pertua,"Ahli-ahli Yang Berhormat, Mesyuarat Dewan hari ini
ditangguhkan hingga jam 2.30 tengah hari nanti. Terima kasih Yang Berhormat."
RANG UNDANG-UNDANG,"RANG UNDANG-UNDANG PERBEKALAN 2024
Bacaan Kali yang Kedua",,1.01 tengah hari,1301,ANNOTATION,[Mesyuarat ditempohkan pada pukul 1.01 tengah hari]
RANG UNDANG-UNDANG,"RANG UNDANG-UNDANG PERBEKALAN 2024
Bacaan Kali yang Kedua",,2.30 petang,1430,ANNOTATION,[Mesyuarat disambung semula pada pukul 2.30 petang]
RANG UNDANG-UNDANG,"RANG UNDANG-UNDANG PERBEKALAN 2024
Bacaan Kali yang Kedua",,2.30 petang,1430,ANNOTATION,[Timbalan Yang di-Pertua mempengerusikan Mesyuarat]
RANG UNDANG-UNDANG,"RANG UNDANG-UNDANG PERBEKALAN 2024
Bacaan Kali yang Kedua",,2.30 petang,1430,Timbalan Yang di-Pertua,"Perbahasan rang undang-undang akan diteruskan. Saya
minta YB Dato’ Kesavadas untuk menyambung baki..."
RANG UNDANG-UNDANG,"RANG UNDANG-UNDANG PERBEKALAN 2024
Bacaan Kali yang Kedua",,2.32 ptg.,1432,Dato’ Kesavadas a/l A Achyuthan Nair,"Saya minta lagi lima minit *extra* sebab
hendak *start* balik enjin."
RANG UNDANG-UNDANG,"RANG UNDANG-UNDANG PERBEKALAN 2024
Bacaan Kali yang Kedua",,2.32 ptg.,1432,Timbalan Yang di-Pertua,"5 minit. Baik. Silakan, silakan..."
RANG UNDANG-UNDANG,"RANG UNDANG-UNDANG PERBEKALAN 2024
Bacaan Kali yang Kedua",,2.32 ptg.,1432,ANNOTATION,[Ketawa]
RANG UNDANG-UNDANG,"RANG UNDANG-UNDANG PERBEKALAN 2024
Bacaan Kali yang Kedua",,2.32 ptg.,1432,Dato’ Kesavadas a/l A Achyuthan Nair,"Terima kasih, terima kasih. Enjin lama ya
betul. Okey, seperti Yang Amat Berhormat Menteri sedia maklum, kelangsungan hidup
pekebun kecil sawit banyak bergantung kepada naik dan turun permintaan terhadap minyak
sawit yang didagangkan ke luar negara. Mereka merupakan tulang belakang terpenting dalam
industri sawit tempatan dengan 26 peratus atau 1.5 juta hektar.
Kawasan penanaman sawit negara diusahakan menerusi tulang yang mereka
bandingkan. Jangan kita lupa bahawa agenda menoktahkan kemiskinan yang di aspirasikan
oleh Yang Amat Berhormat Perdana Menteri antaranya merangkumi pemeriksaan ekonomi
bagi golongan pekebun kecil. Jadi tidak hairan mengapa kerajaan menyediakan insentif khas
kepada golongan pekebun kecil persendirian bagi menjayakan Program Tanam Semula
Sawit.
Justeru menerusi penambahan RM10 juta bagi menjayakan Kempen Menangani Anti
Minyak Sawit pada tahun 2024, kementerian seharusnya merangka pelan tindakan alternatif
yang boleh mempersiapkan golongan pekebun kecil dengan alternatif-alternatif terbaik untuk
menampung pendapatan mereka yang terkesan akibat embargo minyak sawit.
Keegoan Kesatuan Eropah dalam isu sekatan terhadap minyak sawit, ini sedikit
sebanyak meretakkan hubungan perdagangan Malaysia yang terjalin dengan negara-negara
Eropah. Keretakan dalam mana-mana hubungan perdagangan antarabangsa sudah tentu
akan memberi kesan kepada mana-mana potensi ekonomi yang boleh diketengahkan oleh
Malaysia di peringkat global.
Malaysia dan Indonesia seharusnya berdiri teguh sebagai gabungan dagangan terkuat
dalam mengungguli pasaran minyak sawit di peringkat global, sedangkan kita ingin
menamatkan krisis keyakinan Eropah terhadap minyak sawit keluaran kita apa jua bentuk
perseteruan yang tercetus antara Malaysia dan Indonesia perlu diketepikan. Malaysia dan
Indonesia seharusnya mencari jalan bersama untuk menjayakan misi bagi meyakinkan
Eropah bahawa penghasilan minyak sawit kita tidak langsung melibatkan sebarang bentuk
kompromi terhadap manipulasi buruh dan penebangan hutan.
Pensijilan Minyak Sawit Mampan (MSPO) perlu diberi nilai tambah menerusi
penekanan dalam aspek penarafan dan perakuan terhadap setiap rantaian aktiviti dalam
penghasilan minyak sawit bermula daripada proses penanaman buah sawit sehingga ke
peringkat pengilangan minyak sawit.
Berkenaan dengan minyak sawit negara yang saya bangkitkan tadi, saya minta Yang
Amat Berhormat Menteri atau Timbalan Menteri menyatakan:
(i) bagaimana penyediaan tambahan RM10 juta bagi menangani Kempen
Anti Minyak Sawit Negara dapat dimanfaatkan dalam bentuk
pelaksanaan memandangkan kempen tersebut bukan sahaja berbentuk
resipi malah turut melibatkan perundangan Kesatuan Eropah;
(ii) apa bentuk sokongan yang akan disediakan secara bersasar kepada
golongan pekebun kecil yang terkesan akibat daripada sekatan global
terhadap penghasilan minyak sawit keluaran negara. Bagaimanakah
segmen pekebun kecil khususnya *Independent Smallholders* dapat
dibantu sepanjang proses untuk mengembalikan kepercayaan EU
terhadap minyak sawit negara dilaksanakan;
(iii) apa bentuk solidariti industri yang akan direncanakan bersama-sama
Indonesia ke arah merungkaikan resolusi-resolusi jangka pendek yang
boleh meningkatkan kredibiliti minyak sawit kedua-dua negara di mata
dunia. Sejauh manakah hubungan baik Malaysia dengan negara-
negara berpendapatan tinggi seperti Turki dan Brunei mampu dijadikan
sebagai jambatan untuk memperkukuh kembali aktiviti eksport minyak
sawit yang selama ini terkesan akibat sekatan EU; dan
(iv) sejauh mana Pensijilan Minyak Sawit Mampan (MSPO) yang sekian
lama dilaksanakan berupaya mendorong penghasilan minyak sawit
yang bukan sahaja diiktiraf oleh negara pengimport, malah memperluas
potensi kebun-kebun kelapa sawit yang diusahakan sepenuhnya oleh
para pekebun kecil. Saya minta Yang Amat Berhormat Menteri atau
Timbalan Menteri menyatakan jumlah pekebun kecil serta keluasan
ladang sawit yang telah menerima pensijilan MSPO sejak ia bermula
diperkenalkan sehingga bulan November 2023.
Tuan Yang di-Pertua, sebelum saya mengakhiri ucapan, izinkan saya membacakan
serangkap pantun.
*Pergi ke Marang mencandat sotong,
sebelum singgah ke Sungai Petani;
Belanjawan 2024 wajar kita sokong,
demi rakyat yang kita kasihi...*"
RANG UNDANG-UNDANG,"RANG UNDANG-UNDANG PERBEKALAN 2024
Bacaan Kali yang Kedua",,2.32 ptg.,1432,ANNOTATION,[Tepuk]
RANG UNDANG-UNDANG,"RANG UNDANG-UNDANG PERBEKALAN 2024
Bacaan Kali yang Kedua",,2.32 ptg.,1432,Dato’ Kesavadas a/l A Achyuthan Nair,"Sekian sahaja ucapan perbahasan saya bagi Rang Undang-undang Perbekalan 2024.
Saya mohon menyokong. Wah, saya hormat masa bagus. Terima kasih."
RANG UNDANG-UNDANG,"RANG UNDANG-UNDANG PERBEKALAN 2024
Bacaan Kali yang Kedua",,2.32 ptg.,1432,Timbalan Yang di-Pertua,"Terima kasih YB. YB jual pantun itu lagi enam hari baharu
ada jawapan..."
RANG UNDANG-UNDANG,"RANG UNDANG-UNDANG PERBEKALAN 2024
Bacaan Kali yang Kedua",,2.32 ptg.,1432,ANNOTATION,[Ketawa]
RANG UNDANG-UNDANG,"RANG UNDANG-UNDANG PERBEKALAN 2024
Bacaan Kali yang Kedua",,2.32 ptg.,1432,Timbalan Yang di-Pertua,Sekarang ini saya minta Yang Berhormat Senator Datin Hajah Ros Suryati binti Alang.
RANG UNDANG-UNDANG,"RANG UNDANG-UNDANG PERBEKALAN 2024
Bacaan Kali yang Kedua",,2.39 ptg.,1439,Datin Hajah Ros Suryati binti Alang,"*Bismillahi Rahmani Rahim. Assalamualaikum
warahmatullahi wabarakatuh.*
Datuk Yang di-Pertua, terlebih dahulu saya ucapkan terima kasih kepada Datuk Yang
di-Pertua kerana memberikan peluang kepada saya untuk membahaskan dalam Rang
Undang-undang Perbekalan atau Belanjawan 2024.
RUU Perbekalan 2024 tersebut merupakan belanjawan kedua di bawah pentadbiran
Kerajaan Perpaduan dengan bertemakan, “Reformasi Ekonomi Memperkasakan Rakyat”. Ia
merupakan peruntukan tertinggi dalam sejarah negara yang bernilai RM393.8 bilion yang
telah dibentangkan oleh Perdana Menteri pada 13 Oktober yang lalu.
Ini merupakan Belanjawan Madani kedua di bawah Kerajaan Perpaduan di mana
peruntukan sebanyak RM393.8 bilion digunakan dan merupakan belanjawan tertinggi yang
pernah dibentangkan."
RANG UNDANG-UNDANG,"RANG UNDANG-UNDANG PERBEKALAN 2024
Bacaan Kali yang Kedua",,■1440,1440,Datin Hajah Ros Suryati binti Alang,"Daripada jumlah tersebut, sebanyak RM303.8 bilion adalah untuk belanja mengurus.
Sebanyak RM90 bilion untuk belanja pembangunan dan RM2 bilion simpanan luar jangka.
Ketiga, peruntukan untuk Kementerian Kewangan, Pendidikan, Kesihatan secara
kolektif merangkumi 42.3 peratus daripada jumlah perbelanjaan Belanjawan 2024. Manakala
subsidi dan bantuan sosial merangkumi 17.4 peratus daripada perbelanjaan mengurus
dianggarkan berjumlah RM52.8 bilion.
Keempat, sebelum saya memulakan ucapan saya, saya ingin mengambil peluang ini
untuk menyampaikan solidariti saya terhadap rakyat Palestin yang menderita akibat
peperangan pada ketika ini. Bersama-samalah kita- semua menghulurkan bantuan dan
berdoa agar penderitaan mereka berakhir dan juga kita sama-sama berdoa agar Palestin
menjadi sebuah negara yang berdaulat dan merdeka. Sudah tiba bagi Kerajaan Perpaduan
untuk memainkan peranan sebagai suara yang berani, lantang, tegas, berinformasi bagi
membela rakyat Palestin.
Kelima, melalui belanjawan ini, saya difahamkan sebanyak RM10 juta disalurkan bagi
Tabung Kemanusiaan bagi menampung serta membantu warga Palestin. Maka, soalan
pertama saya, saya ingin meminta perkara ini diperincikan daripada segi barangan dan
keperluan yang diberi, termasuk kos logistik penghantaran ke Palestin. Kita terdengar juga
banyak pihak mengambil kesempatan atas perang yang berlaku. Saya tidak mahu melihat
dana bantuan ini jatuh ke tangan orang lain. Maka, biarkan telus dan tiba pada rakyat Palestin.
Tuan Yang di-Pertua, kita mesti sedar bahawa kita terperangkap dalam ekonomi yang
bergantung kepada rantaian nilai yang rendah. Pergantungan kepada tenaga kerja asing
berkemahiran rendah yang terlampau tinggi. Cabaran untuk menghasilkan produk dan
perkhidmatan yang berteknologi tinggi dan masalah gaji pekerja yang rendah. Sekarang ini
pula, negara berdepan dengan suasana ekonomi global yang sangat tidak menentu. Seperti
kita- semua sedia maklum, perkembangan global telah mencetuskan kelembapan ekonomi
global bagi tempoh 2023 hingga 2025 dan dijangka akan memberi kesan kepada
pertumbuhan negara kita.
Kelapan, Tabung Kewangan Antarabangsa (IMF) pada Oktober 2023, baru-baru ini
telah mengunjurkan ekonomi dunia berkembang perlahan sebanyak tiga peratus sahaja pada
tahun 2023 dan dijangka akan lebih rendah pada tahun 2024 iaitu 2.9 peratus. Perdagangan
dunia pula diunjurkan berkembang sebanyak 0.9 peratus pada tahun 2023, namun dijangka
kembali pulih pada 3.1 peratus pada tahun 2024.
Walaupun kita berdepan dengan cabaran-cabaran yang di luar kawalan kita, kerajaan
masih komited untuk memastikan pertumbuhan ekonomi dapat dicapai seperti yang
disasarkan dan optimis dengan langkah-langkah yang diambil akan mengimbangi kesan
kelembapan ekonomi digital- ekonomi global. Apa yang penting, kita mesti menarik kembali
pelabur-pelabur luar untuk menjalankan perniagaan di negara kita dan sekali gus
merancakkan ekonomi negara kita.
Maka dengan hasrat itu, saya ingin bertanya, soalan pertama saya mengenai jumlah
keseluruhan pelaburan yang berjaya dibawa masuk oleh rombongan Yang Amat Berhormat
Perdana Menteri yang berjumpa pemimpin-pemimpin dunia. Apakah nilai ROI yang berjaya
diraih dan bila kita akan mula tengok hasil daripada kemasukan pelabur-pelabur asing ini hasil
daripada lawatan-lawatan tersebut?
Datuk Yang di-Pertua, saya ingin memulakan perbahasan saya dengan menyentuh
pembangunan Pulau Pinang. Saya mulakan dengan Kementerian Pengangkutan iaitu di
mana LRT Pulau Pinang ke Seberang Perai seperti yang dirancang kerajaan negeri berjumlah
RM10 bilion, menurut kaedah kerjasama awam-swasta iaitu PPP. Oleh sebab terdapat
kerjasama kerajaan-swasta, apakah Kerajaan Pusat dapat membantu untuk
mempercepatkan LRT ini? Apakah prospek nilai tambah yang bakal dinikmati oleh rakyat
Pulau Pinang dan negara apabila siap kelak?
Seterusnya, mengenai pembangunan tanah wakaf di Pulau Pinang. Dalam ucapan
belanjawan, kerajaan telah menyediakan sebanyak RM200 juta pada April lalu untuk
membangunkan semula tanah-tanah wakaf di Pulau Pinang secara pinjaman mudah. Bagi
tahun 2024, kerajaan akan meningkatkan dana kepada RM500 juta untuk pinjaman mudah
bagi meningkatkan pembangunan semula tanah-tanah wakaf di seluruh negara. Saya mohon
kerajaan memaklumkan kepada Dewan mengenai status pelaksanaan ini dan apakah projek
yang bakal dirancang di atas tanah-tanah wakaf ini?
Datuk Yang di-Pertua, saya ingin merujuk kepada Kementerian Pembangunan
Kerajaan Tempatan mengenai peruntukan sebanyak RM2.47 bilion yang sediakan untuk
melaksanakan Projek Perumahan Rakyat bagi tahun 2024. Daripada jumlah itu, sebanyak
RM546 juta yang disediakan oleh kerajaan bagi meneruskan 36 Program Perumahan Rakyat
(PPR) dan juga Program Rumah Mesra Rakyat di seluruh Malaysia.
Saya ingin tahu pecahan yang diperuntukkan untuk program perumahan di Pulau
Pinang dan adakah daripada peruntukan ini juga merangkumi kos pembinaan, kos membaiki
pulih rumah, kerja-kerja membaiki tangki air, bumbung dan sistem pendawaian serta
memasang kamera litar tertutup juga terkandung dalam peruntukan itu?
Saya juga ingin mengambil perhatian kementerian mengenai isu projek perumahan
swasta lewat, sakit dan terbengkalai yang menghimpit pembeli rumah di Pulau Pinang. Saya
difahamkan, tahun ini kerajaan telah menggerakkan pasukan khas di bawah kementerian
untuk menyelesaikan projek sakit atau unit rumah yang perlu dipulihkan. Soalan saya, apakah
status jumlah projek perumahan sakit di Pulau Pinang dan berapa jumlah peruntukan yang
telah disalurkan bagi memulihkan projek-projek tersebut?
Datuk Yang di-Pertua, saya ingin menyentuh Kementerian Perdagangan Dalam
Negeri dan Kos Sara Hidup. Beberapa langkah reformasi telah diumumkan oleh kerajaan.
Antaranya bagi tahun depan, Cukai Jualan dan Perkhidmatan (SST) dinaikkan sehingga lapan
peratus. Walaupun kerajaan juga mengumumkan cukai keuntungan modal bagi pelupusan
saham tidak tersenarai oleh syarikat tempatan, berdasarkan keuntungan bersih pada kadar
10 peratus, saya rasa mesti ada pihak yang- menangguk di air keruh, dan menaikkan harga
barangan dalam pasaran. Apakah jaminan kerajaan agar tidak berlaku kenaikan harga
barangan lagi pada tahun hadapan dan apakah mekanisme yang memastikan kos sara hidup
diunjurkan stabil bagi tahun 2024?
KPDN telah menerima peruntukan sejumlah RM1.88 bilion, satu peningkatan yang
agak ketara berbanding peruntukan KPDN pada tahun 2023 iaitu RM1.25 bilion. Antara
komponen utama dalam peruntukan ini meliputi pertamanya, menjamin rakyat mendapat
pembelaan akibat himpitan kos sara hidup.
Maka dengan itu, saya ingin bertanya dengan Inisiatif Payung Rahmah yang
diperuntukkan sejumlah RM200 juta. Adakah Inisiatif Payung Rahmah ini masih dan boleh
dikekalkan ketika peningkatan harga barangan dan kejatuhan nilai Ringgit? Umpamanya,
pelaksanaan Program Jualan Rahmah yang menawarkan barangan keperluan asas pada
harga sehingga 30 peratus lebih rendah akan diperluaskan di lebih banyak kawasan Dewan
Undangan Negeri di seluruh negara.
Program ini menawarkan insentif kepada 1.2 juta orang pengusaha pasar borong,
pasar malam dan pasar tani. Ia juga diteruskan bagi mengurangkan kos perniagaan, sekali
gus dapat menurunkan harga jualan.
Soalan saya, sejauh manakah sambutan rakyat terhadap Jualan Rahmah yang
diadakan oleh kementerian di seluruh Malaysia dan bolehkah program ini dilanjutkan untuk
tempoh lebih panjang serta menjemput banyak syarikat swasta dan usahawan desa agar
mereka juga dapat menjual produk dan perkhidmatan yang harganya murah dan berpatutan?"
