level_1,level_2,level_3,timestamp,author,speech
RANG UNDANG-UNDANG,"RANG UNDANG-UNDANG PERBEKALAN 2016
Bacaan Kali Yang Kedua
DAN
USUL
ANGGARAN PEMBANGUNAN 2016",,1640,Dato’ Seri Tiong King Sing [Bintulu],"Dalam bajet ini, tahun 2014 memang ada umum untuk Bajet 2015, Yang Amat
Berhormat telah mengumumkan peruntukan untuk sekolah-sekolah termasuk SJK(C) RM50
juta tetapi bila wang masuk ke kementerian, kementerian cuma bagi, semasa itu
Kementerian Pendidikan Malaysia, bagi RM20 juta sahaja. Sampai sekarang RM30 juta
peruntukan itu sudah pergi mana? SJK(T) pun sama, RM50 juta sudah diberi tetapi masuk
kementerian, kementerian bagi RM20 juta. RM30 juta lagi pun kongkalikung, sudah tidak
tahu mana pergi.
Ketiga, sekolah mubaligh. Diumumkan RM50 juta, kementerian bagi juga RM20
juta. RM30 juta belum sampai lagi. Keempat, sekolah agama bantuan kerajaan. Kerajaan
pun umum, Perdana Menteri pun umum merangkap Menteri Kewangan, umum RM50 juta
tetapi RM20 juta sampai, RM30 juta lagi hilang. Tidak tahu kementerian- nanti saya sebut
tanya betul atau tidak perkara ini? Kelima, sekolah menengah jenis kebangsaan.
Kementerian Kewangan ada umum RM25 juta tetapi bagi RM10 juta, RM15 juta lagi belum
sampai. Sekolah pondok sama juga, RM25 juta tetapi bagi RM10 juta, RM15 juta lagi belum
sampai.
Saya difahamkan bahawa kekurangan wang ini digunakan dalam mengatasi banjir
dalam projek pencegahan kebakaran dan lain-lain. Saya meminta penjelasan daripada
Menteri sekarang, bantu selesaikan isu ini kerana sekarang sudah keliru. Orang kata Yang
Amat Berhormat Perdana Menteri merangkap Menteri Kewangan janji tidak ditepati, janji
tidak tunai.
Ini janji bukan tidak tunai, janji ini peruntukan sudah turun ke kementerian, saya
faham kementerian punya KSU dan juga beberapa orang pegawai dan juga dulu punya,
saya tidak tahulah, peruntukan ini diguna di tempat lain. Kenapa KSU ini dan pegawai
semua boleh ubah apa yang sudah diumumkan dalam Dewan yang mulia ini? Kenapa tidak
minta kelulusan daripada Kementerian Kewangan sebelum ubah bajet ini untuk perkara
lain?
Sepatutnya kalau ada kecemasan, itu semua boleh guna MKN punya peruntukan.
Kenapa kementerian ini begitu berminat untuk kementerian ini, ini bajet-bajet sudah
dijanjikan, kita boleh tarik peruntukan ini untuk lain-lain punya..."
RANG UNDANG-UNDANG,"RANG UNDANG-UNDANG PERBEKALAN 2016
Bacaan Kali Yang Kedua
DAN
USUL
ANGGARAN PEMBANGUNAN 2016",,1640,Tuan Teo Kok Seong [Rasah],Yang Berhormat Bintulu.
RANG UNDANG-UNDANG,"RANG UNDANG-UNDANG PERBEKALAN 2016
Bacaan Kali Yang Kedua
DAN
USUL
ANGGARAN PEMBANGUNAN 2016",,1640,Seorang Ahli,
RANG UNDANG-UNDANG,"RANG UNDANG-UNDANG PERBEKALAN 2016
Bacaan Kali Yang Kedua
DAN
USUL
ANGGARAN PEMBANGUNAN 2016",,1640,ANNOTATION,[Bercakap tanpa menggunakan pembesar suara]
RANG UNDANG-UNDANG,"RANG UNDANG-UNDANG PERBEKALAN 2016
Bacaan Kali Yang Kedua
DAN
USUL
ANGGARAN PEMBANGUNAN 2016",,1640,Dato’ Seri Tiong King Sing [Bintulu],"Ha, lain-lain punya tujuan."
RANG UNDANG-UNDANG,"RANG UNDANG-UNDANG PERBEKALAN 2016
Bacaan Kali Yang Kedua
DAN
USUL
ANGGARAN PEMBANGUNAN 2016",,1640,Tuan Teo Kok Seong [Rasah],"Yang Berhormat, sikit."
RANG UNDANG-UNDANG,"RANG UNDANG-UNDANG PERBEKALAN 2016
Bacaan Kali Yang Kedua
DAN
USUL
ANGGARAN PEMBANGUNAN 2016",,1640,Dato’ Seri Tiong King Sing [Bintulu],"Yang Berhormat Rasah nanti dulu. Saya
dalam stim, jangan potong stim.
Tuan Yang di-Pertua, di sini saya mahu tanya dan juga meminta jasa baik
daripada Yang Berhormat Menteri Pendidikan yang baru ini, tolonglah selesaikan isu ini.
Kalau peruntukan itu betul-betul sudah habis awal tahun ini, bawa perkara ini dalam Kabinet
atau jumpa Yang Amat Berhormat Perdana Menteri merangkap Menteri Kewangan,
selesaikan isu ini dan tunaikan apa yang kita sudah umumkan dalam Dewan ini dan
salurkan kepada mana-mana sekolah yang sepatutnya yang sudah diumumkan.
Tuan Yang di-Pertua, isu lagi satu, UEC. UEC ini sijil *recognition* dengan izin, isu
ini sudah lama tetapi sampai hari ini masih belum selesai. Memang hari itu kita nampak di
surat khabar huru-hara lagi, Menteri cakap tidak akan diluluskan *recognition* ini. Bila saya
telefon tanya Menteri, dia kata dia tidak pernah cakap macam itu. Dia kata setakat
sekarang, memang tidak boleh *recognize* UEC punya sijil sebab ada lagi beberapa isu yang
kita mahu *trace it out* dengan izin, kita mahu selesaikan, lepas itu kerajaan baru boleh
pertimbangkan.
Itu yang saya minta ini Yang Berhormat Seputeh jangan kongkalikung dalam
Dewan. Dia cakap contoh di Sarawak, dia kata Ketua Menteri ini pula tipu sama rakyat. Kita
Ketua Menteri di Sarawak umumkan *recognition on this issue* tidak salah. Dia kata boleh
masuk *local* universiti Sarawak. Kerajaan Sarawak *recognize*, masuk kerajaan, bekerja *as a
government officer* di Sarawak, *Government of Sarawak recognize.* Tak salah. Apa cakap
janji kosong? Ini bukan janji kosong."
RANG UNDANG-UNDANG,"RANG UNDANG-UNDANG PERBEKALAN 2016
Bacaan Kali Yang Kedua
DAN
USUL
ANGGARAN PEMBANGUNAN 2016",,1640,Tuan Gooi Hsiao-Leung [Alor Setar],"Yang Berhormat Bintulu, boleh tanya satu
soalan mengenai UEC?"
RANG UNDANG-UNDANG,"RANG UNDANG-UNDANG PERBEKALAN 2016
Bacaan Kali Yang Kedua
DAN
USUL
ANGGARAN PEMBANGUNAN 2016",,1640,Dato’ Seri Tiong King Sing [Bintulu],"Nantilah. Saya sudah cakap nantilah. Saya
dalam stim, *you* kasi potong stim."
RANG UNDANG-UNDANG,"RANG UNDANG-UNDANG PERBEKALAN 2016
Bacaan Kali Yang Kedua
DAN
USUL
ANGGARAN PEMBANGUNAN 2016",,1640,Tuan Gooi Hsiao-Leung [Alor Setar],"Atas isu yang sama. Yang Berhormat
Bintulu, atas isu yang sama, UEC."
RANG UNDANG-UNDANG,"RANG UNDANG-UNDANG PERBEKALAN 2016
Bacaan Kali Yang Kedua
DAN
USUL
ANGGARAN PEMBANGUNAN 2016",,1640,Timbalan Yang di-Pertua [Datuk Seri Dr. Ronald Kiandee],"Dia tidak bagi jalan
Yang Berhormat."
RANG UNDANG-UNDANG,"RANG UNDANG-UNDANG PERBEKALAN 2016
Bacaan Kali Yang Kedua
DAN
USUL
ANGGARAN PEMBANGUNAN 2016",,1640,Dato’ Seri Tiong King Sing [Bintulu],"Tunggulah. Kalau kata Ketua Menteri
Sarawak ini banyak kuat tipu, saya mahu tanya, Kerajaan Selangor sekarang pun serupa
juga ikut Kerajaan Negeri Sarawak, dia kata Kerajaan Negeri Selangor akan *recognize,*
sama juga ikut Sarawak. Dia *local university* boleh dan lain-lain. Jadi saya mahu tanya
Yang Berhormat Seputeh, ini kalau beritahu macam itu, itu Kerajaan Negeri Selangor pun
tipu juga. Ini memang kongkalikung lah, ‘tatap’ kongkalikung. Itulah, saya di sini sekali lagi
memohon kepada..."
RANG UNDANG-UNDANG,"RANG UNDANG-UNDANG PERBEKALAN 2016
Bacaan Kali Yang Kedua
DAN
USUL
ANGGARAN PEMBANGUNAN 2016",,1640,Tuan Gooi Hsiao-Leung [Alor Star],"Yang Berhormat Bintulu, boleh beri *chance*
sekarang?"
RANG UNDANG-UNDANG,"RANG UNDANG-UNDANG PERBEKALAN 2016
Bacaan Kali Yang Kedua
DAN
USUL
ANGGARAN PEMBANGUNAN 2016",,1640,Dato’ Seri Tiong King Sing [Bintulu],"...Kementerian Pendidikan berbincanglah
secepat mungkin."
RANG UNDANG-UNDANG,"RANG UNDANG-UNDANG PERBEKALAN 2016
Bacaan Kali Yang Kedua
DAN
USUL
ANGGARAN PEMBANGUNAN 2016",,1640,Tuan Gooi Hsiao-Leung [Alor Star],"Yang Berhormat Bintulu, boleh kasi *chance*
Yang Berhormat Bintulu?"
RANG UNDANG-UNDANG,"RANG UNDANG-UNDANG PERBEKALAN 2016
Bacaan Kali Yang Kedua
DAN
USUL
ANGGARAN PEMBANGUNAN 2016",,1640,Timbalan Yang di-Pertua [Datuk Seri Dr. Ronald Kiandee],"Yang Berhormat,
tidak bagi jalan Yang Berhormat."
RANG UNDANG-UNDANG,"RANG UNDANG-UNDANG PERBEKALAN 2016
Bacaan Kali Yang Kedua
DAN
USUL
ANGGARAN PEMBANGUNAN 2016",,1640,Dato’ Seri Tiong King Sing [Bintulu],"Saya punya *floor,* bagi saya habis dululah.
Kalau *you* hebat, tadi patut *you* bahas. Saya bahas dia mahu kacau. Lagi-lagi cakap *time*
sudah habis nanti Tuan Yang di-Pertua ini. Saya mahu cerita isu ini sudah lama. Minta
kementerian ambil serius perkara ini dan berbincang dengan tunjangan baru. Saya
berharap dalam masa yang singkat boleh diselesaikan isu ini.
Tuan Yang di-Pertua, isu ini Sabah dan Sarawak memang hadapi iaitu mengenai
isu tiada sijil beranak dan IC dan surat mati. Sekarang isu ini di Sarawak contohnya di
kawasan saya, banyak lagi kaum Iban belum lagi dapat surat beranak, belum lagi dapat IC,
ada yang mati pun tidak dapat sijil kematian. Inilah menjadi kesusahan kepada rakyat.
Rakyat beritahu kepada saya, dia hidup pun susah, mati pun susah, sampai bawah, dia
orang tak bagi dia laluan lintas. Ini perkara sudah lama.
Saya minta Kerajaan Persekutuan kaji sedalam-dalamnya, bagi peluang autonomi
kepada Kerajaan Sarawak dan Sabah. Bagi peluang kepada Kerajaan Negeri Sarawak dan
Sabah untuk menyelesaikan masalah ini termasuk macam Sarawak, banyak anak-anak,
*children* pun tidak dapat. Oleh kerana ini melibatkan generasi yang muda ini, bila dia pergi
sekolah, paling tinggi sampai SPM saja. Selepas itu tidak boleh masuk universiti-universiti
sebab dia tiada surat beranak, tiada IC. *So* kita tidak boleh menganiaya. Apa kesilapan, apa
masalah, kita mesti mahu cari jalan untuk tolong. Ini generasi muda, selesaikan masalah
dia, beri peluang dia untuk masa hadapan dia boleh hidup senang."
RANG UNDANG-UNDANG,"RANG UNDANG-UNDANG PERBEKALAN 2016
Bacaan Kali Yang Kedua
DAN
USUL
ANGGARAN PEMBANGUNAN 2016",,1650,Dato’ Seri Tiong King Sing [Bintulu],"Tuan Yang di-Pertua, saya sentuh mengenai Bank Negara. Saya difahamkan
bank-bank ini sekarang kalau cek masuk mahu kena *charge* 50 sen. 50 sen kena lagi GST
3 sen, jadi 53 sen. Saya tanya bank-bank kenapa mahu *charge* 50 sen. Dia kata ini arahan
daripada Bank Negara. Dia mahu minta rakyat semua guna *Internet banking*. Saya mahu
tanya *Internet Banking* Bank Negara faham ke tidak? Ada satu limit, kalau orang
perniagaan limit itu memang tidak mencukupi. Rakyat pun pening kalau semua pakai
*Internet Banking*. Kalau sistem IT ada buat kesalahan, ataupun orang kata *hack banking
system* itu, dia punya wang semua hilang, siapa yang bertanggungjawab? Dahulu memang
perkara ini sudah pernah berlaku. ATM *machine* berapa kali kena? Akhirnya bank kata dia
tidak bertanggungjawab sampai Kabinet buat keputusan baru bank ambil alih untuk
selesaikan isu ini. Saya memohon jasa baik daripada Kementerian Kewangan boleh
timbang balik semula *charge-charge* ini boleh dikecualikan terutama sekali GST.
Tuan Yang di-Pertua, saya mahu cerita sedikit mengenai ATM ini, angkatan
tentera ini. Mereka untuk berkhidmat dan kawal keselamatan negara juga. Saya nampak
kejadian baru ini di Sarawak. Dua orang terlibat dalam *accident* dan kedua-duanya
meninggal dunia. Satu masih lagi tidak tahu sudah keluar hospital atau belum keluar
hospital. Isu ini satu dapat beli perumahan, satu tidak mampu sebab dia kena jaga ramai
ahli keluarga, adik-beradik dan ibu bapa. Masalahnya angkatan ini belum ada satu
rancangan. Saya memohon saya nampak hari itu apabila saya ke kem tersebut, terdapat
banyak tanah yang banyak kosong. Saya meminta kementerian yang berkaitan supaya
merancang satu tempat atau *certain area* di dalam kem ini untuk rancangan perumahan
untuk tentera-tentera atas satu harga yang mampu dibeli oleh anggota-anggota tentera.
Tuan Yang di-Pertua, boleh izinkan saya untuk minum air?"
RANG UNDANG-UNDANG,"RANG UNDANG-UNDANG PERBEKALAN 2016
Bacaan Kali Yang Kedua
DAN
USUL
ANGGARAN PEMBANGUNAN 2016",,1650,Timbalan Yang di-Pertua [Datuk Seri Dr. Ronald Kiandee],"Ya, boleh."
RANG UNDANG-UNDANG,"RANG UNDANG-UNDANG PERBEKALAN 2016
Bacaan Kali Yang Kedua
DAN
USUL
ANGGARAN PEMBANGUNAN 2016",,1650,Dato’ Seri Tiong King Sing [Bintulu],"Terima kasih Tuan Yang di-Pertua. Saya
mahu menyentuh mengenai Kementerian Sumber Asli. Saya minta perhatian atas isu ini.
Ini memang negara kita sekarang sampai masalah banjir sini sana. Mesti mengambil
perkara ini yang serius dan juga cari peluang bagaimana untuk membantu negara kita
untuk menyelesaikan masalah ini. Ada tempat banjir bukan kata *high tide*, sebab masalah
rancangan, apabila membuat projek perumahan itu, tidak dirancang betul-betul dan juga *the
river being shallow, never been deepening* dengan izin. Kita mesti mengambil serius
perkara ini. Kalau tidak sekali banjir *cause of all these problems* dengan izin kerajaan akan
mengalami kerugian berbilion-bilion ringgit. Saya mahu minta Kementerian di Menteri yang
baru melihat contoh di Sarawak masalah ini contoh di Bintulu, saya sudah sentuh, Sungai
Kemena mestilah mendalamkan dan juga Sungai Sibiu mestilah mendalamkan. *So* kita di
Bintulu tidak mahu mengalami masalah *flood* atas kesalahan kita. Saya mahu minta
kementerian sebab saya belum nampak lagi ada bajet ataupun bajet itu belum terang lagi
bagaimana mahu membelanjakannya, saya mahu minta betul-betul bagi anggaran
sekurang-kurangnya menyelesaikan isu Sungai Sibiu. Dahulu sudah janji pada tahun 2016
akan bagi RM20 juta, saya minta ini mesti ditunaikan.
Mengenai isu macam contoh di Sibu, janganlah kita asyik buat *pumping station*.
Tuan Yang di-Pertua, saya pun dari Sibu. Sungai Rajang sudah *slow* dengan izin, kalau
setiap hari hujan lebat air naik, kita *pump* air dan air akan pergi mana? Di Sarikei tidak ada
air, satu sungai, Rajang River dia orang bawah sana tidak ada banjir sebab banyak tempat
sudah *siltation*, air tidak boleh lalu. Kalau dalam masa *high tide*, kalau hujan lebat, orang
masih boleh lalu *certain sections of* Rajang River. Inilah yang saya minta Kementerian kaji
sedalam-dalamnya. Jangan kita cuma atas air-cond buat -meneliti. Cuma dalam *aircond* ini
kita buat cadangan syok sendiri. Ini tiba masanya kita mahu selesaikan masalah rakyat.
Kalau ada apa-apa – banjir itu, semasa kita beri peruntukan bantuan kepada rakyat RM500,
rakyat tidak akan cakap terima kasih. Rakyat akan marah dengan kita. Itulah kadang-
kadang pembangkang banyak syok, dia nampak ini macam punya *time,* dia pergi *turn and
twist,* dengan izin. Sama juga dia kata, macam GST, kalau dia jadi perintah, dia akan
dikecualikan.
Tuan Yang di-Pertua, sekarang saya hendak menyentuh sedikit mengenai
pembinaan Pan Borneo Highway. Tuan Yang di-Pertua, ini Pan Borneo di Bintulu punya
seksyen saya mahu mencadangkan, ini Pan Borneo ini Bintulu-Miri, bolehkah kita -
sekarang kita sudah mula bina Penyabau sampai Bakun. Bolehkah dari Bakun masuk ke
Costo *Highway* sebab kita hendak menaiktarafkannya jadikan empat *lane*. Di sana ada
*score project*, itulah kita diperlukan. Kita tidak perlu membazirkan peruntukan itu sebab
sekarang Bintulu-Miri jalan lama memang ada beberapa seksyen sudah naik taraf *for over
taking lane*. Kalau kita ubah lagi sudah kerugian besar. Kalau kita buat di Bintulu-Miri, esok
lagi Costo *Highway* perlu dinaik taraf lagi. Ini jadi satu masalah lagi di Bintulu mahu mencari
peruntukan yang besar untuk menaik taraf Costo *Road*. Saya cukup sedih dengan isu ini.
Yang Berhormat Bagan berkata ini Jalan Pan Borneo, disebabkan pembangkang
menyoalkan isu ini, sekarang baru dapat selesaikan. Akan tetapi dia tidak dengar berapa
ramai Ahli Parlimen dari Sarawak sudah berapa kali membahaskan isu ini termasuklah
penyelenggaraan Pan Borneo ini. Itulah masalah kita sekarang, banyak perkara ramai
orang membuat *turn and twist* sehingga orang keliru.
Tuan Yang di-Pertua, mengenai isu tol, sekarang kita minta tol di Malaysia ini
mestilah mahu kaji semula. Jika tidak mengkaji semula, rakyat memang marah sebab ini
menyebabkan *model of vehicle increase* tetapi tol pun *increase*. Kemungkinan sesiapa yang
terlibat yang membuat *negotiation concession toll*, kita membuat kesilapan di sini sana, kita
sekarang ubah balik semula. Itulah sekarang kalau kita tidak ada, rakyat banyak marah. Tol
sekarang berkali-kali naik harga. Contoh ada Kerajaan Negeri Selangor pun masuk, tetapi
dalam masa itu tiada orang keluar kata saya dikecualikan sebagai *shareholder*, saya beri
semula."
RANG UNDANG-UNDANG,"RANG UNDANG-UNDANG PERBEKALAN 2016
Bacaan Kali Yang Kedua
DAN
USUL
ANGGARAN PEMBANGUNAN 2016",,1700,Tuan Liang Teck Meng [Simpang Renggam],"Terima kasih Tuan Yang di-
Pertua, saya bersetuju dengan Yang Berhormat Bintulu bahawa mungkin kerajaan perlu kaji
balik tentang perjanjian tol ini. Akan tetapi masa yang sama juga saya lihat ada pihak yang
cuba mainkan politik seperti Kerajaan Negeri Selangor. Mereka menyatakan bahawa
mereka merupakan minoriti *shareholder*, ada saham, ada *share* 20%, 30%. Akan tetapi
kalau betul-betul demi kepentingan rakyat kenapa tidak mereka ada alternatif seperti tidak
mahu mengambil dividen ataupun serah balik *share* mereka supaya harga tol ini dapat
dikurangkan sebanyak 20%kah, 30%. Terima kasih."
RANG UNDANG-UNDANG,"RANG UNDANG-UNDANG PERBEKALAN 2016
Bacaan Kali Yang Kedua
DAN
USUL
ANGGARAN PEMBANGUNAN 2016",,1700,Dato' Seri Tiong King Sing [Bintulu],"Terima kasih Yang Berhormat Simpang
Renggam. Saya memang setuju, ambil dia punya ucapan masuk saya punya perbahasan.
Tuan Yang di-Pertua saya mahu tanya, ini perjanjian memang *sign* daripada dahulu, dahulu
sudah *sign* itu masa Ahli Lembaga lain. Saya minta Perdana Menteri dan Kabinet mengkaji
balik semula, meneliti masalah ini mesti mahu mendalam-dalamkan kaji balik semula.
Sekarang saya ambil ini peluang juga tanya, dalam masa ini semua jalan raya tol ini berapa
anggaran dia pembinaan, berapa sudah kutipan, berapa kos penyenggaraan? *So* kita,
rakyat mahu tahu ini sudah berapa sudah dikutip.
Tuan Yang di-Pertua minta ampun saya tahu saya punya masa sudah lebih. Ini
ada masalah bergantung semua yang duduk dalam Parlimen. Tuan Yang di-Pertua,
mengenai keselamatan Dewan ini. Ini Dewan kita nampak daripada pagar yang saya
pertama masuk memang sekarang Dewan ini cukup hebat. Dahulu pagar saya pertama
memang sunyi sekarang cukup hebat dalam Dewan. Saya nampak Bahagian Keselamatan
Dewan ini memang lemah tidak mahu jaga keselamatan di Dewan yang mulia ini.
Sekarang kita menghadapi Dewan di Kanada berlaku pertembakan.
Janganlah sampai kita Malaysia nanti orang bawa satu kereta pun masuk nanti dia
keluar balik setengah jam nanti meletup semua. Kita jangan sampai itu masa baru hendak
kelam kabut cari jalan hendak selesaikan. Sampai itu masa apa kita buat semua orang
cuba kena-kena kerana ini kejadian ataupun hilang nyawa dia akan kongkalikung sama kita
cakap kita awal-awal tidak buat kawalan. Saya mahu minta Tuan Yang di-Pertua dan
Timbalan Tuan Yang di-Pertua ambil meneliti ini perkara. Ini perkara isu ini contoh sekarang
semua orang kata saya siapa-siapa. Semuanya senang lepas, lepas kasi. Dahulu punya
zaman dia orang tidak kasi kalau ada betul-betul kaitan barulah dia orang kasi. *Now to
Parliament very easy access,* dengan izin.
Tuan Yang di-Pertua, kita sekarang media ini bukan kita tidak suka media kita
banyak sayang sama media. Fasal media, kita tidak menafikan media ini sangat penting
bagi Parlimen dan memainkan satu peranan yang amat dihargai. Media merupakan *the
eyes of Parliament* dan yang berkaitan Parlimen dengan rakyat jelata. Akan tetapi kita pun
tidak boleh biarkan. Semua ada orang masuk pun *claim* dia media, semua orang pun
masuk. Tuan Yang di-Pertua saya difahamkan dalam masa pembentangan bajet terdapat
400 orang wartawan masuk Parlimen.
Saya kira tangga satu, dua tidak begitu banyak sekarang boleh sampai 400, masa
biasa sampai 100 orang. Inilah kita bukan kasi aniaya. Kalau boleh saya minta Tuan Yang
di-Pertua meneliti perkara ini, mencadang sebelum Mesyuarat Parlimen *company-company*
ataupun *commercial paper*, media ataupun *social media* memohonlah seberapa orang
boleh masuk Dewan yang mulia ini. Kalau dia sakit bolehlah ataupun dia tidak boleh datang
lain orang boleh ganti.
Saya harap perkara ini betul-betul kita ambil serius dan tegas. Jangan sampai
perkara berlaku barulah kita..."
RANG UNDANG-UNDANG,"RANG UNDANG-UNDANG PERBEKALAN 2016
Bacaan Kali Yang Kedua
DAN
USUL
ANGGARAN PEMBANGUNAN 2016",,1700,Dato' Abdul Manan Ismail [Paya Besar],Yang Berhormat Bintulu.
RANG UNDANG-UNDANG,"RANG UNDANG-UNDANG PERBEKALAN 2016
Bacaan Kali Yang Kedua
DAN
USUL
ANGGARAN PEMBANGUNAN 2016",,1700,Timbalan Yang di-Pertua [Datuk Seri Dr. Ronald Kiandee],"Habis masa Yang
Berhormat."
RANG UNDANG-UNDANG,"RANG UNDANG-UNDANG PERBEKALAN 2016
Bacaan Kali Yang Kedua
DAN
USUL
ANGGARAN PEMBANGUNAN 2016",,1700,Dato' Seri Tiong King Sing [Bintulu],"Sekejap ini mustahak. Ini kalau
pembangkang esok dia kena, dia pun bising juga."
RANG UNDANG-UNDANG,"RANG UNDANG-UNDANG PERBEKALAN 2016
Bacaan Kali Yang Kedua
DAN
USUL
ANGGARAN PEMBANGUNAN 2016",,1700,Dato' Abdul Manan Ismail [Paya Besar],"Terima kasih Yang Berhormat Bintulu.
Saya setuju dengan cadangan Yang Berhormat Bintulu. Cuma kalau boleh saya
mencadangkan supaya setiap akhbar menamakan tiga atau empat orang sahaja untuk
masuk semasa membuat persidangan Parlimen. Kalau terlalu ramai seperti mana yang
berlaku sekarang kita tengok di depan sana hingga Parlimen tidak dapat menyediakan
kerusi meja untuk mereka kerana lambakan pemberita-pemberita. Terima kasih, Yang
Berhormat Bintulu setuju ya?"
RANG UNDANG-UNDANG,"RANG UNDANG-UNDANG PERBEKALAN 2016
Bacaan Kali Yang Kedua
DAN
USUL
ANGGARAN PEMBANGUNAN 2016",,1700,Dato' Seri Tiong King Sing [Bintulu],"Memang Yang Berhormat Paya Besar.
Saya amat setuju. Ambillah dia punya bahagian masuk saya punya bahagian."
RANG UNDANG-UNDANG,"RANG UNDANG-UNDANG PERBEKALAN 2016
Bacaan Kali Yang Kedua
DAN
USUL
ANGGARAN PEMBANGUNAN 2016",,1700,ANNOTATION,[Ketawa]
RANG UNDANG-UNDANG,"RANG UNDANG-UNDANG PERBEKALAN 2016
Bacaan Kali Yang Kedua
DAN
USUL
ANGGARAN PEMBANGUNAN 2016",,1700,Dato' Seri Tiong King Sing [Bintulu],Tuan Yang di-Pertua...
RANG UNDANG-UNDANG,"RANG UNDANG-UNDANG PERBEKALAN 2016
Bacaan Kali Yang Kedua
DAN
USUL
ANGGARAN PEMBANGUNAN 2016",,1700,Timbalan Yang di-Pertua [Datuk Seri Dr. Ronald Kiandee],"Macam P. Ramlee
Yang Berhormat."
RANG UNDANG-UNDANG,"RANG UNDANG-UNDANG PERBEKALAN 2016
Bacaan Kali Yang Kedua
DAN
USUL
ANGGARAN PEMBANGUNAN 2016",,1700,ANNOTATION,[Ketawa]
RANG UNDANG-UNDANG,"RANG UNDANG-UNDANG PERBEKALAN 2016
Bacaan Kali Yang Kedua
DAN
USUL
ANGGARAN PEMBANGUNAN 2016",,1700,Dato' Seri Tiong King Sing [Bintulu],"Tuan Yang di-Pertua saya juga ingin
memberi sedikit saranan kepada pihak pembangkang bahawa untuk mencapai negara maju
2020 pihak pembangkang mestilah bersifat membina dan bukannya merosakkan.
Pembangkang tidak seharusnya memainkan sentimen-sentimen yang mengelirukan rakyat
sehingga segala usaha yang telah di *...*"
RANG UNDANG-UNDANG,"RANG UNDANG-UNDANG PERBEKALAN 2016
Bacaan Kali Yang Kedua
DAN
USUL
ANGGARAN PEMBANGUNAN 2016",,1700,ANNOTATION,[Disampuk]
RANG UNDANG-UNDANG,"RANG UNDANG-UNDANG PERBEKALAN 2016
Bacaan Kali Yang Kedua
DAN
USUL
ANGGARAN PEMBANGUNAN 2016",,1700,Dato' Seri Tiong King Sing [Bintulu],"Kasi hancurkan negara kita.
Pembangkang seharusnya sama-sama beri sumbangan idea kepada kerajaan agar
ekonomi negara ke depan janganlah cuma mahu kacau sahaja. Tuan Yang di-Pertua, saya
memang setuju Bajet Belanjawan 2016. Sekian terima kasih."
RANG UNDANG-UNDANG,"RANG UNDANG-UNDANG PERBEKALAN 2016
Bacaan Kali Yang Kedua
DAN
USUL
ANGGARAN PEMBANGUNAN 2016",,1700,Timbalan Yang di-Pertua [Datuk Seri Dr. Ronald Kiandee],"Yang Berhormat
Raub."
RANG UNDANG-UNDANG,"RANG UNDANG-UNDANG PERBEKALAN 2016
Bacaan Kali Yang Kedua
DAN
USUL
ANGGARAN PEMBANGUNAN 2016",,1708,Dato’ Mohd. Ariff Sabri bin Abdul Aziz [Raub],"*Bismillahi Rahmani Rahim,
Assalamualaikum warahmatullahi wabarakatuh*. Bajet tahun 2016 ialah RM297.2 bilion
walaupun kurang tetapi masih berbilion-bilion ringgit. Tentulah rakyat akan suka jika setiap
sen pergi kepada matlamatnya dengan jujur dan memberi nilai hikmat dan barangan yang
setimpal dengan nilai wang tersebut. Ini satu jumlah yang besar yang akan disalurkan
melalui kementerian-kementerian yang dikuasai oleh menteri-menteri dan diurus dan
ditadbir oleh KSU, TKSU, SUB dan pegawai-pegawai sampailah kepada pegawai-pegawai
bawah. Cabarannya ialah untuk memastikan wang rakyat ini diaplikasikan dengan jujur dan
amanah dan bertepatan dengan nilai. Jika kita bayar RM1 kita mesti dapat nilai barangan
atau perkhidmatan RM1 juga.
Menentukan ia diaplikasikan seperti yang disebut di atas adalah satu cabaran
kepada semua Ahli Parlimen walau di sana atau sebelah sini untuk yang mahukan prinsip
pertanggungjawaban diamalkan dengan jujur dan amanah. Setiap tahun *World Bank* atau
Bank Dunia mengeluarkan satu laporan iaitu *Worldwide Governance Indicators*. Ini jarang
dipakai sebab kita selalu pakai *Transparency International Corruption Perceptions Index*
tetapi persepsi atau *perception* ini adalah satu *misnomer.* Ini sebab ianya apabila disebut
persepsi orang ingat benda itu tidak berlaku di *on the ground*. Oleh sebab itu saya lebih
suka kita pakai data dan laporan yang dikeluarkan oleh Bank Dunia iaitu *Worldwide
Governance Indicators.* Di dalam satu daripada laporan yang diterbitkan adalah *Control
Corruption Ranking.*"
