level_1,level_2,level_3,timestamp,author,speech
,,,1000,ANNOTATION,"[Timbalan Yang di-Pertua (Datuk Seri Dr. Ronald Kiandee)
mempengerusikan Mesyuarat]"
JAWAPAN-JAWAPAN LISAN BAGI PERTANYAAN-PERTANYAAN,1.,,1000,Datuk Haji Shabudin bin Yahaya [Tasek Gelugor],"minta Menteri Kewangan
menyatakan apakah pihak kerajaan telah menjalankan statistik terkini dan kaji selidik
terhadap keberkesanan pelaksanaan pemberian BR1M dalam menangani kos sara hidup
yang semakin meningkat ini. Apakah terdapat kaedah lain yang boleh membantu rakyat
dalam perkara ini."
JAWAPAN-JAWAPAN LISAN BAGI PERTANYAAN-PERTANYAAN,1.,,1000,Timbalan Menteri Kewangan [Datuk Chua Tee Yong],"Tuan Yang di-Pertua,
pemberian Bantuan Rakyat 1Malaysia (BR1M) adalah bermatlamat untuk membantu
meringankan beban dan juga hidup rakyat berpendapatan rendah bagi membeli barang-
barang keperluan harian seperti beras, ikan, daging, sayur-sayuran dan lain-lain. Bantuan
ini diberi secara menyeluruh kepada semua yang layak. BR1M telah bermula pada tahun
2012. Secara keseluruhannya sehingga tahun 2015, sebanyak hampir RM14 bilion telah
diperuntukkan bagi pengagihan BR1M yang memanfaatkan keseluruhannya hampir 7.4 juta
penerima setiap tahun.
Selain daripada BR1M, kerajaan turut menyediakan pelbagai insentif bagi
membantu rakyat terutamanya yang berpendapat rendah dan sederhana dalam
meringankan beban perbelanjaan harian. Antara program sedia ada yang telah
dilaksanakan adalah seperti berikut:
(i) pemberian Bantuan Persekolahan 1Malaysia sebanyak RM100
kepada pelajar sekolah;
(ii) pemberian Baucar Buku 1Malaysia sebanyak RM250 tanpa
mengira pendapatan ibu bapa;
(iii) kemudahan Klinik 1Malaysia dan Kedai Rakyat 1Malaysia;
(iv) program Penurunan Harga dengan menambah bilangan Pasar
Tani kepada 660 buah dan mewujudkan 150 buah AgroBazaar
Rakyat 1Malaysia; dan,
(v) menaikkan had pelepasan cukai bagi kumpulan M40.
Kerajaan dari semasa ke semasa akan terus menambah baik program-program
bantuan bagi memastikan ia dapat terus membantu rakyat. Untuk jangka masa panjang,
kerajaan akan terus komited dalam menyediakan peluang dan kemudahan kepada rakyat
bagi meningkatkan tahap pengetahuan serta kemahiran agar mereka lebih berdaya saing
seterusnya berjaya menikmati pekerjaan yang lebih mempunyai pendapatan yang tinggi. Ini
juga adalah selari dengan hasrat kerajaan untuk menjadi negara maju berpendapatan tinggi
pada tahun 2020. Terima kasih."
JAWAPAN-JAWAPAN LISAN BAGI PERTANYAAN-PERTANYAAN,1.,,1000,Datuk Shabudin bin Yahaya [Tasek Gelugor],"Terima kasih Tuan Yang di-
Pertua. Tahniah saya ucapkan kepada kerajaan yang telah pun mengambil pelbagai inisiatif
untuk membantu rakyat daripada segi perbelanjaan dan sebagainya supaya kesejahteraan
rakyat ini dapat kita tingkatkan. Namun begitu Tuan Yang di-Pertua, yang menjadi satu
persoalan kita di sini kalau dapat saya khususkan dalam tujuan dan juga pencapaian
matlamat pemberian BR1M sebagaimana yang disebutkan oleh Yang Berhormat Timbalan
Menteri sebentar tadi adalah untuk membolehkan rakyat membeli barangan keperluan
harian dan menjimatkan perbelanjaan mereka.
Namun begitu soalan yang ingin saya kemukakan ialah apakah kementerian ada
membuat kajian terhadap bagaimana bantuan BR1M ini dibelanjakan? Kita mempunyai
matlamat tetapi kita kena ada *follow through,* melihat sama ada perbelanjaan itu menepati
matlamat yang kita inginkan. Adakah ia digunakan untuk menampung perbelanjaan
keperluan harian ataupun digunakan untuk perkara-perkara lain mengikut kehendak mereka
masing-masing tanpa ada sebarang *guidance*, dengan izin? Seterusnya, apakah usaha
kementerian dalam memastikan kebergantungan rakyat terhadap BR1M ini dapat
dikurangkan pada masa hadapan dan saya mohon kepada pihak kerajaan menyatakan
usaha-usaha yang dilakukan bagi mengeluarkan mereka ini daripada senarai penerima
BR1M melalui peningkatan pendapatan rakyat tersebut. Terima kasih."
JAWAPAN-JAWAPAN LISAN BAGI PERTANYAAN-PERTANYAAN,1.,,1000,Datuk Chua Tee Yong,"Terima kasih atas soalan tambahan. Sebenarnya soalan
itu bukan satu soalan tetapi beberapa soalan. Nombor satu, daripada segi pemberian wang
tunai sama ada kita membuat kajian, sebenarnya kerajaan mempunyai pendapat bahawa
pemberian wang tunai ini, tujuan kita tidak menukar khususnya kepada baucar barangan
adalah kerana kita harus juga mengambil kira kemudahan infrastruktur yang masih perlu
ditambah baik jikalau kita perlu atau ingin melaksanakan proses sebegini. Maka pada masa
ini, ia adalah terpulang kepada pilihan penerima. Kita yakin kebanyakan penerima yang
terdiri daripada golongan B40, kebanyakan mereka memerlukan wang ini untuk barang-
barang keperluan asas.
Nombor dua, daripada segi meningkatkan terutamanya pendapatan golongan B40
dalam Bajet 2016 dan juga dalam Rancangan Malaysia Kesebelas, jelas menunjukkan
bahawa kerajaan ingin menumpukan daripada segi bagaimana meningkatkan daya
kemahiran mereka sama ada dengan program e-Rezeki atau dengan program-program
seperti *vocational training* dan sebagainya dan juga Skim Latihan 1Malaysia dan juga
kenaikan baru-baru ini gaji minimum mereka."
JAWAPAN-JAWAPAN LISAN BAGI PERTANYAAN-PERTANYAAN,1.,,1010,Datuk Chua Tee Yong,"Tujuan ini adalah terus usaha kerajaan untuk meningkatkan daripada segi
pendapatan mereka dan mengurangkan *Gini coefficient* kita. Akhirnya, daripada segi
pelaksanaan BR1M ini, memang daripada segi pelaksanaan ini sebenarnya adalah juga
kalau kita lihat cadangan daripada *World Bank* atau Bank Dunia, mereka mengatakan untuk
pemberian subsidi adalah lebih baik kita memberi secara terus, *direct cash*. Kalau kita
memberi subsidi melalui *indirect way,* kadang-kadang ia mempunyai isu iaitu *black
economy.* Sekian, terima kasih."
JAWAPAN-JAWAPAN LISAN BAGI PERTANYAAN-PERTANYAAN,1.,,1010,Tuan Abdullah Sani bin Abdul Hamid [Kuala Langat],"Sudah dua minggu Tuan
Yang di-Pertua, baru dapat. Terima kasih Tuan Yang di-Pertua atas kebijaksanaan
memberikan laluan kepada saya satu soalan tambahan.
Yang Berhormat Menteri, dalam soalan pokok yang berbunyi begini, *“Apakah
terdapat kaedah lain yang boleh membantu rakyat dalam perkara ini?”* Saya mengambil
pendekatan bahawa selain daripada kita membantu dalam memastikan pemberian BR1M
itu terlaksana dalam menyempurnakan kos sara hidup itu dicapai, namun yang jelas ialah
apabila kita melihat daripada pendapatan negara yang mendapati cukai pendapatan
individu itu berjumlah melebihi RM30 bilion dalam kumpulan B40 yang dimaksudkan oleh
Timbalan Menteri tadi.
Soalan tambahan saya ialah, apakah pandangan kementerian kalau sekiranya
RM30 bilion itu dianggap sebagai pendapatan utama yang memberikan kesan baik, tidak
bolehkah gaji minimum itu ditambahkan supaya cukai pendapatan individu itu dapat dikait
atau dikaut daripada hasil pendapatan individu itu? Apakah pandangan kementerian
bersetuju dengan kaedah ini membolehkan kita menambah pendapatan negara? Minta
penjelasan. Terima kasih Tuan Yang di-Pertua."
JAWAPAN-JAWAPAN LISAN BAGI PERTANYAAN-PERTANYAAN,1.,,1010,Datuk Chua Tee Yong,"Terima kasih atas soalan tambahan. Daripada segi
peningkatan cukai pendapatan terutamanya individu, kita harus melihat terutamanya pada
masa sekarang jumlah pembayar cukai pada masa sekarang adalah anggaran 1.7 juta
daripada jumlah pekerja 12 juta atau 13 juta. Maka, kalau kita meningkatkan lagi daripada
segi kadar cukai pendapatan, ini akan juga membebankan daripada segi pembayar cukai
iaitu 1.7 juta.
Selain daripada itu terdapat cadangan untuk kita meningkatkan gaji minimum.
Apabila kita meningkatkan gaji minimum, kita juga haruslah melihat dan juga melihat
terutamanya daripada segi kebanyakan sama ada SMEs dan PKSs yang menggaji hampir
52% daripada jumlah pekerja di negara ini dapat menampung kenaikan gaji minimum ini.
Kita harus melihat faktor-faktor yang lain dan bukan khususnya daripada cukai pendapatan.
Memang kerajaan ingin meningkatkan daripada segi jumlah cukai pendapatan kita, tetapi
kita juga harus melihat daripada segi ekosistem atau melihat daripada segi industri
memastikan bahawa gaji minimum yang ditetapkan itu masih boleh diterima agar PKSs
masih boleh berkembang dan memastikan mereka tidak menghadapi isu yang besar.
Sekian, terima kasih."
JAWAPAN-JAWAPAN LISAN BAGI PERTANYAAN-PERTANYAAN,2.,,1010,Tuan Sim Chee Keong [Bukit Mertajam],"minta Perdana Menteri menyatakan
kesan penurunan nilai Ringgit Malaysia terhadap pelajar-pelajar Malaysia di luar negara
tajaan kerajaan, sama ada melalui biasiswa ataupun pinjaman, serta langkah-langkah
bantuan yang telah ataupun akan dilaksanakan."
JAWAPAN-JAWAPAN LISAN BAGI PERTANYAAN-PERTANYAAN,2.,,1010,Menteri di Jabatan Perdana Menteri [Dato’ Sri Azalina Dato’ Othman Said],"Tuan Yang di-Pertua, izinkan saya untuk menjawab soalan ini bersekali dengan soalan
berikut, soalan Nombor 60 bertarikh 2 November oleh Yang Berhormat Temerloh dan
soalan Nombor 44 bertarikh 16 November oleh Yang Berhormat Telok Kemang.
Untuk makluman Ahli Yang Berhormat, penurunan nilai Ringgit Malaysia tidak
memberikan kesan secara langsung kepada pelajar tajaan Jabatan Perkhidmatan Awam di
luar negara. Ini adalah kerana bayaran biasiswa kepada mereka dibayar dalam mata wang
negara tajaan dan perkara ini telah diunjurkan semasa penyediaan peruntukan jabatan.
Pada masa ini, JPA memberikan biasiswa dan pinjaman merangkumi yuran
pengajian, elaun sara hidup, elaun buku, elaun alat perkakas, elaun tesis, elaun latihan
amali, elaun pakaian sekali sahaja dan elaun penempatan. Kadar elaun-elaun ini adalah
berbeza mengikut negara dan bidang pengajian yang diikuti oleh pelajar seperti yang
ditetapkan oleh Kementerian Kewangan. Terima kasih."
JAWAPAN-JAWAPAN LISAN BAGI PERTANYAAN-PERTANYAAN,2.,,1010,Tuan Sim Chee Keong [Bukit Mertajam],"Terima kasih kepada jawapan Menteri
tetapi saya rasa tidak bersetuju dengan jawapan tersebut kerana baru-baru ini, Tuanku
Permaisuri Johor, Duli Yang Maha Mulia Permaisuri Tuanku Raja Zarith Sofiah telah
memberikan perhatian yang amat serius terhadap isu ini apabila Baginda melawat pelajar-
pelajar kita di United Kingdom sehinggakan sanggup menawarkan bantuan kepada pelajar-
pelajar Malaysia di United Kingdom dan USA. Selepas itu, Kerajaan Negeri Johor juga
menawarkan bantuan *one-off.*
Saya rasa ini amat penting kerana pejabat saya juga menerima aduan-aduan
daripada pelajar kita yang berada di Jordan dan Mesir tentang kemerosotan dan ada di
antara mereka merupakan penerima bantuan kerajaan dan mereka mengadu tentang
kemerosotan nilai ringgit kita dan mengadu bahawa bantuan yang diberikan pada tahun ini
tidak cukup untuk menampung penurunan tersebut..."
JAWAPAN-JAWAPAN LISAN BAGI PERTANYAAN-PERTANYAAN,2.,,1010,Timbalan Yang di-Pertua [Datuk Seri Dr. Ronald Kiandee],"Soalan, soalan."
JAWAPAN-JAWAPAN LISAN BAGI PERTANYAAN-PERTANYAAN,2.,,1010,Tuan Sim Chee Keong [Bukit Mertajam],"Jadi soalan saya ialah mengapa
Kerajaan Pusat tidak mengikuti langkah-langkah seperti yang dilakukan oleh Tuanku
Permaisuri Johor dan juga Kerajaan Negeri Johor untuk menambahkan bantuan, mungkin
*one-off* pada tahun ini demi menutup jurang akibat daripada kemerosotan mata wang.
Juga satu soalan tambahan ialah bolehkah Menteri memberikan statistik 10 tahun
ini tentang bilangan pelajar yang dihantar ke luar negara oleh biasiswa kerajaan mengikut
pecahan kaum, jurusan, negara dan kos pembiayaan? Ini mungkin boleh dijawab dalam
jawapan bertulis. Terima kasih."
JAWAPAN-JAWAPAN LISAN BAGI PERTANYAAN-PERTANYAAN,2.,,1010,Dato’ Sri Azalina Dato’ Othman Said,"Terima kasih Tuan Yang di-Pertua. Saya
hendak mengucapkan terima kasih kepada Yang Berhormat Bukit Mertajam kerana
memberikan kenyataan tentang kelebihan orang negeri Johor. Saya sebagai Ahli Parlimen
dari Johor memang cukup berbangga dengan Kerajaan Negeri Johor serta Duli Yang Maha
Mulia Sultanah. Itu kelebihan Johor dari Bukit Mertajam.
Soalan yang ditanyakan oleh sahabat saya itu - pertama sekali soalan yang *last* itu
saya jawab secara bertulis tetapi ada bersama saya setakat ini, yang mana yang saya ada
dan boleh berikan penerangan ialah berkenaan dengan setakat ini bilangan tajaan di IPTA
luar negara, biasiswa ialah sebanyak 7,283 dan negara-negara yang menjadi tajaan adalah
di Amerika Syarikat, Australia, India, Indonesia, Ireland*,* Jepun, Jordan, Kanada, Korea,
Hong Kong, Mesir, New Zealand, Perancis, Poland, Republic Czech, Jerman, Republik
Rusia dan United Kingdom.
Daripada jumlah 7,283, pecahan daripada segi jenis pengajian dan pecahan
daripada segi mungkin kaum yang ditanya ataupun dari segi jantina dan sebagainya akan
dijawab secara bertulis."
JAWAPAN-JAWAPAN LISAN BAGI PERTANYAAN-PERTANYAAN,2.,,1010,Tuan Sim Chee Keong [Bukit Mertajam],Juga kos pembiayaan.
JAWAPAN-JAWAPAN LISAN BAGI PERTANYAAN-PERTANYAAN,2.,,1010,Dato’ Sri Azalina Dato’ Othman Said,"Kos pembiayaan juga akan diberikan
secara bertulis. Akan tetapi setakat ini yang saya ada bersama-sama saya dengan izin
Tuan Yang di-Pertua, dalam jumlah keseluruhan – kalau kita tengok dalam tahun 2013,
dalam aspek sastera RM10,350,000, sains RM10,650,000, teknologi RM10,850,000,
perubatan dipecahkan kepada empat kategori iaitu farmasi RM12,590,000, *veterinarian*
RM11,750,000, pergigian RM12,590,000, perubatan RM12,690,000, seni bina
RM11,050,000. Saya boleh beri secara bertulis daripada segi negara-negara luar yang
telah disebutkan tadi dan pecahan daripada segi aspek pengkhususan seperti perubatan,
pergigian, farmasi, kejuruteraan, bioteknologi, perakaunan, seni bina, sains komputer, sains
teknologi, ekonomi dan sains aktuari.
Dinyatakan oleh Yang Berhormat tentang kenapa kerajaan tidak memberikan *one-
off,* jawapannya adalah daripada jumlah yang diberikan bantuan oleh kerajaan pada setiap
tahun, jumlah perbelanjaan bagi membiayai pelajar tajaan JPA ialah RM1.9 bilion
merangkumi tajaan pelajar dalam negara dan juga luar negara tahunan. Purata kos
penajaan setahun bagi seorang pelajar tajaan luar negara adalah antara RM38,115 hingga
RM393,844 mengikut negara dan bidang pengajian."
JAWAPAN-JAWAPAN LISAN BAGI PERTANYAAN-PERTANYAAN,2.,,1020,Dato’ Sri Azalina Dato’ Othman Said,"Ini menunjukkan bahawa kerajaan memang memberikan bantuan kepada pelajar-
pelajar. Seperti yang saya sebut tadi Tuan Yang di-Pertua, bantuan itu diberikan kepada
nilai mata wang negara yang mereka belajar. Bererti kerajaan tidak mewujudkan penalti
ataupun mengurangkan kadar kepada harga tahap *exchange rate* Malaysia tetapi lebih
kepada negara yang mereka belajar. Terima kasih."
JAWAPAN-JAWAPAN LISAN BAGI PERTANYAAN-PERTANYAAN,2.,,1020,Dr. Haji Noor Azmi bin Ghazali [Bagan Serai],"Terima kasih Tuan Yang di-
Pertua. Bila nilai mata wang ringgit jatuh dan berlakunya ketidakstabilan ini, kalau mereka
yang menerima biasiswa dikatakan tergugat dengan perbelanjaan apatah lagi pelajar-
pelajar di luar negara yang dibiayai oleh keluarga masing-masing. Soalan saya Tuan Yang
di-Pertua, adakah kerajaan dalam masa nilai ringgit jatuh dan ketidaktentuan ini akan mula
memberikan tumpuan kepada tajaan biasiswa bagi pengajian dalam negara. Saya ingin
bertanya, adakah kerajaan akan melakukan langkah-langkah dari segi biasiswa untuk
membantu para pelajar di luar negara tentang bidang yang kritikal yang amat-amat
diperlukan oleh negara. Bagaimana bantu dari segi biasiswa. Terima kasih."
JAWAPAN-JAWAPAN LISAN BAGI PERTANYAAN-PERTANYAAN,2.,,1020,Dato' Sri Azalina Dato' Othman Said,"Terima kasih sahabat saya daripada
Bagan Serai. Inilah sebabnya dalam jawapan saya, saya memaklumkan bahawa kerajaan
memang melihat tentang perlu dilaksanakan terus penajaan kepada pelajar-pelajar di luar
negara memandangkan perlunya negara kepada beberapa kepakaran yang ada di
pengajian di luar negara. Itulah sebabnya cabaran yang dihadapi oleh kerajaan yang mana
sejak tahun 2012, JPA tidak lagi menawarkan kemudahan pinjaman bagi menaja pelajar di
dalam dan di luar negara. Bagi pelajar yang melanjutkan pengajian dalam negara,
kemudahan ini telah dilaksanakan sepenuhnya oleh Perbadanan Tabung Pendidikan Tinggi
Negara.
Jadi kalau kita tengok dalam aspek apakah pendekatan yang dilakukan. Kalau kita
bandingkan, sahabat saya dari Bagan Serai, antara negara-negara luar berdekatan dalam
ASEAN seperti di Singapura dan juga di Thailand. Kita tengok Malaysia adalah salah satu
daripada negara yang memang dilihat sentiasa meletakkan keutamaan kepada pendidikan
anak-anak dan juga mereka yang di dalam perkhidmatan kerajaan. Jadi itu sebabnya
program ini dilaksanakan dari segi janji yang telah diberikan oleh kerajaan yang mana
harga yang telah diletakkan disebabkan oleh kenaikan mata wang itu, mereka masih
dikekalkan. Jadi tidak ada perubahan dari segi nilai mata wang mereka di sebelah sana.
Walau bagaimanapun soalan yang disebut oleh Yang Berhormat berkenaan
dengan mungkin kerajaan boleh memberikan pengkhususan lebih kepada dalam negara.
Seperti jawapan saya bahawa memang kerajaan melihat perlunya pengkhususan tetapi kita
tidak boleh menafikan ada juga jenis-jenis kursus yang ditawarkan hanya di luar negara
yang menyebabkan kerajaan masih melaksanakan bantuan dalam aspek bukan sahaja
biasiswa tetapi juga pinjaman. Terima kasih."
JAWAPAN-JAWAPAN LISAN BAGI PERTANYAAN-PERTANYAAN,3.,,1020,Tuan Haji Hasbi bin Haji Habibollah [Limbang],"minta Menteri Perdagangan
Dalam Negeri, Koperasi dan Kepenggunaan menyatakan sejak 15 April 2015, berapakah
bilangan peniaga-peniaga yang sudah diberi amaran, diambil tindakan dan didakwa di
mahkamah di bawah Akta Kawalan Harga dan Antipencatutan 2011 sejak GST
dilaksanakan di Limbang."
JAWAPAN-JAWAPAN LISAN BAGI PERTANYAAN-PERTANYAAN,3.,,1020,"Timbalan Menteri Perdagangan Dalam Negeri, Koperasi dan Kepenggunaan [Dato' Seri Ahmad Bashah bin Md. Hanipah]","*Bismillahi Rahmani Rahim.
Assalamualaikum warahmatullahi wabarakatuh.* Salam sejahtera dan salam 1Malaysia.
Terima kasih Tuan Yang di-Pertua dan terima kasih sahabat saya dari Limbang yang
mengemukakan soalan kepada kementerian.
Tuan Yang di-Pertua, di bawah OPS Statut yang telah dijalankan di Sarawak,
sejumlah 163,779 buah premis perniagaan telah diperiksa di setiap peringkat dan juga jenis
perniagaan. Sejumlah 110 notis seksyen 21 telah dikeluarkan di atas peniaga dan
menghasilkan sejumlah 313 tindakan kes di bawah Akta Kawalan Harga dan
Antipencatutan 2011. Daripada jumlah tersebut, sebanyak tiga buah kes siasatan telah
dibuka untuk siasatan lanjut iaitu dua kertas siasatan di bawah seksyen 14 kerana
kesalahan mencatut dan satu kertas siasatan di bawah seksyen 21(5) kerana gagal
memberi maklum balas kepada notis yang dikeluarkan.
Bagi kawasan Limbang Tuan Yang di-Pertua, sebanyak 13,111 kali pemeriksaan
premis perniagaan telah dibuat. Namun setakat hari ini tiada kes pencatutan dikesan
berlaku di kawasan Limbang. Walau bagaimanapun terdapat 29 kes telah diasingkan di
bawah kesalahan-kesalahan lain iaitu 16 kes di bawah kesalahan tidak meletakkan tanda
harga di bawah akta 2011 dengan keseluruhan nilai rampasan sebanyak RM7,581 dan
kompaun berjumlah RM1,300 dan 12 kes penggunaan alat timbang sukat yang tidak ditentu
sahkan di bawah Akta Timbang dan Sukat 1972 yang melibatkan jumlah keseluruhan nilai
rampasan berjumlah RM790 dan kompaun berjumlah RM400.
Untuk makluman Yang Berhormat Limbang, ada satu kes kerana memberi
gambaran mengelirukan mengenai dengan harga di bawah Akta Perlindungan Pengguna
1999 yang melibatkan jumlah keseluruhan nilai rampasan berjumlah RM93. Itu kes-kes
yang berlaku di kawasan Limbang. Terima kasih Tuan Yang di-Pertua."
JAWAPAN-JAWAPAN LISAN BAGI PERTANYAAN-PERTANYAAN,3.,,1020,Tuan Haji Hasbi bin Haji Habibollah [Limbang],"Terima kasih Tuan Yang di-
Pertua dan terima kasih Yang Berhormat Timbalan Menteri. Saya ingin hendak bertanya
soalan tambahan iaitu tentang pemantauan yang dibuat sebanyak 13,111. Satu soalan
saya ialah, ini sejak berapa tahun dan juga saya hendak bertanya bagaimana cara dan
siapa yang memilih jawatankuasa pengguna yang diwujudkan oleh KPDNKK di tiap-tiap
Parlimen dan apakah peranan utama mereka kerana bagi saya didapati di tempat saya,
senyap sahaja dan dikhuatiri ia lebih menjaga peniaga daripada menjaga dan
memperjuangkan hak pengguna. Itu soalan saya."
JAWAPAN-JAWAPAN LISAN BAGI PERTANYAAN-PERTANYAAN,3.,,1020,Dato' Seri Ahmad Bashah bin Md. Hanipah,"Terima kasih Yang Berhormat atas
soalan tambahan yang dikemukakan. Untuk makluman Yang Berhormat, kes yang saya
sebut tadi berjumlah 163,000, ia bermula daripada 1 April hingga 27 Oktober yang lalu iaitu
setelah GST dimulakan dan daripada tarikh 1 April sejumlah 163,779 buah premis yang
telah kita periksa.
Kedua, mengenai dengan pilihan jawatankuasa pengguna. Pemilihan ini dibuat
oleh kementerian dan tugas-tugas mereka ialah untuk membantu supaya membuat laporan
pelbagai kepada kementerian dan juga penguat kuasa di kawasan masing-masing supaya
kita boleh mengambil tindakan yang agak segera. Sekiranya jawatankuasa pengguna ini
yang telah diberi tanggungjawab sedemikian tidak menjalankan tugas seperti yang telah
diarahkan ataupun membantu kementerian ataupun penguat kuasa di kawasan tersebut,
kemungkinan kita boleh mengambil suatu tindakan ataupun membuat perubahan-
perubahan yang boleh kita lakukan. Terima kasih.
**4. Puan Nurul Izzah binti Anwar [Lembah Pantai]** Menteri Dalam Negeri
menyatakan:
(a) apakah prosedur piawai serta tempoh masa yang diperlukan bagi
mendapatkan perhatian kesihatan segera bagi tahanan penjara;
dan
(b) mengapa pihak kerajaan gagal memenuhi saranan doktor pakar
untuk menjalankan fisioterapi intensif dan pembedahan bahu
yang diperlukan oleh Dato’ Seri Anwar Ibrahim."
JAWAPAN-JAWAPAN LISAN BAGI PERTANYAAN-PERTANYAAN,3.,,1020,Timbalan Menteri Dalam Negeri [Datuk Nur Jazlan bin Mohamed],"Terima
kasih Tuan Yang di-Pertua. Bagi menjawab soalan (a), kepentingan penjagaan kesihatan
terhadap seseorang banduan menjadi keutamaan kepada Jabatan Penjara. Oleh itu,
langkah melaksanakan pemeriksaan kesihatan dimulakan sebaik sahaja seseorang
banduan dimasukkan ke dalam penjara. Sekiranya seseorang banduan telah disyorkan oleh
pegawai perubatan untuk mendapat rawatan atau rawatan lanjut di hospital, tindakan
segera akan diambil oleh Jabatan Penjara untuk menghantar banduan berkenaan ke
hospital bagi tujuan rawatan termasuklah rawatan pakar.
Jabatan Penjara sememangnya mempunyai prosedur bagi menyegerakan
tindakan untuk menghantar banduan bagi mendapat rawatan oleh pegawai perubatan di
klinik penjara mahupun di hospital di luar penjara. Seperti mana ketetapan Seksyen 14 dan
Seksyen 37 Akta Penjara 1995, rawatan terhadap seseorang banduan adalah dibuat oleh
pegawai perubatan kerajaan dan juga dibuat di hospital kerajaan.
Seterusnya, berasaskan prosedur penjara, pegawai perubatan kerajaan dan
hospital kerajaan atas alasan tertentu bagi tujuan rawatan banduan boleh mengesyorkan
seseorang banduan menerima rawatan daripada pegawai perubatan bukan kerajaan."
JAWAPAN-JAWAPAN LISAN BAGI PERTANYAAN-PERTANYAAN,3.,,1030,Timbalan Menteri Dalam Negeri [Datuk Nur Jazlan bin Mohamed],"Jabatan Penjara setelah menerima syor berkenaan akan melaksanakannya
dengan kadar segera dan segala kos ditanggung oleh kerajaan.
Bagi menjawab soalan (b) pula, saya tidak terbayang bagaimana keadaan
keluarga Yang Berhormat mengalami situasi yang berlaku sekarang ini. Akan tetapi saya
hendak maklumkan di sini bahawa Dato’ Seri Anwar Ibrahim diberikan layanan yang
semaksimumnya yang dibenarkan oleh undang-undang untuk beliau diperiksa. Langkah-
langkah yang telah dilakukan adalah dia telah diperiksa oleh tiga kumpulan pakar ortopedik
termasuk pakar ortopedik yang dipilih oleh pihak keluarga beliau.
Ketiga-tiga kumpulan pakar ortopedik ini telah memeriksa Dato’ Seri Anwar
Ibrahim seterusnya memberikan beberapa cadangan rawatan dan pihak hospital menunggu
keputusan untuk jenis rawatan yang dipersetujui oleh Dato’ Seri Anwar Ibrahim. Dato’ Seri
Anwar Ibrahim telah disyorkan untuk menjalani fisioterapi yang bersesuaian dengan
keadaannya. Beliau telah diberikan tunjuk ajar jenis-jenis fisioterapi yang dilakukan olehnya
setiap hari. Dari semasa ke semasa pakar ortopedik dan anggota fisioterapi akan
memantau perkembangannya.
Di sini saya hendak memberi laporan tambahan kepada Dewan bahawa Dato’ Seri
Anwar Ibrahim telah melaksanakan atau menjalani hukuman selama 38 minggu. Dalam
masa 38 minggu itu, beliau telah menjalani pemeriksaan kesihatan dan rawatan di Penjara
Sungai Buloh sebanyak 83 kali termasuk doktor daripada Hospital Sungai Buloh, penjara
dan juga pakar daripada HKL. 10 kali rawatan itu adalah rawatan fisioterapi. Beliau juga
telah menjalani pemeriksaan dan ujian kesihatan di hospital luar iaitu 7 kali di Hospital
Kuala Lumpur. Beliau juga telah diberikan peluang untuk berjumpa dengan keluarga
sebanyak 15 kali selama tempoh tahanan beliau.
Beliau juga telah diberikan perjumpaan dengan peguam pun sebanyak 65 kali.
Maknanya, ini satu keistimewaan yang diberikan kepada Dato’ Seri Anwar Ibrahim. Beliau
diberikan peluang untuk membuat solat Jumaat sebanyak 35 kali, solat berjemaah
sebanyak 60 kali. Beliau juga telah diberikan kelulusan untuk menghadiri pengebumian
bapa beliau pada 5 April 2015. Beliau juga telah diberikan perjumpaan bersama *Inter-
Parliamentary Union* pada 29 Jun 2015. Beliau juga telah diberikan peluang untuk
berjumpa dengan SUHAKAM pada 20 Oktober 2015.
Jadi, pelbagai keistimewaan telah diberikan kepada Dato’ Seri Anwar Ibrahim yang
tidak diberikan kepada banduan lain. Saya berharap keluarga Dato’ Seri Anwar Ibrahim
akan memahami bahawa kerajaan sentiasa akan menjaga kesihatan beliau. Terima kasih."
JAWAPAN-JAWAPAN LISAN BAGI PERTANYAAN-PERTANYAAN,3.,,1030,Timbalan Yang di-Pertua [Datuk Seri Dr. Ronald Kiandee],"Yang Berhormat
Lembah Pantai."
