level_1,level_2,level_3,timestamp,author,speech
RANG UNDANG-UNDANG,"RANG UNDANG-UNDANG PERBEKALAN 2016
Bacaan Kali Yang Kedua
DAN
USUL
ANGGARAN PEMBANGUNAN 2016",,1240,Tuan Sivakumar Varatharaju Naidu [Batu Gajah],"Terima kasih Yang
Berhormat daripada Ipoh Timur. Saya memang bersetuju dengan apa yang dikatakan oleh
Yang Berhormat Ipoh Timur itu. Masukkan ucapan beliau dalam ucapan saya dan saya
berasa memang tidak rasional lah apa yang dilakukan oleh kerajaan dalam hal ini. Pekerja-
pekerja Bangladesh yang akan dibawa masuk itu adalah untuk kerja-kerja kotor, berbahaya
dan sukar. Mereka ini bukan pekerja mahir. Mengikut statistik yang diberikan oleh
Kementerian Sumber Manusia, pekerja asing yang memiliki pas lawatan kerja sementara
yang berdaftar di negara kita pada tahun 2014 telah mencecah 2.1 juta orang sementara
jumlah pendatang asing tanpa izin pula adalah berjumlah 4.6 juta.
Apabila kerajaan membawa masuk 1.5 juta pekerja Bangladesh, jumlah
keseluruhan pendatang asing akan mencecah 8.2 juta orang iaitu lebih kurang 27%
daripada jumlah penduduk Malaysia."
RANG UNDANG-UNDANG,"RANG UNDANG-UNDANG PERBEKALAN 2016
Bacaan Kali Yang Kedua
DAN
USUL
ANGGARAN PEMBANGUNAN 2016",,1240,Timbalan Yang di-Pertua [Dato' Haji Ismail bin Haji Mohamed Said],"Ya, Yang
Berhormat Indera Mahkota bangun."
RANG UNDANG-UNDANG,"RANG UNDANG-UNDANG PERBEKALAN 2016
Bacaan Kali Yang Kedua
DAN
USUL
ANGGARAN PEMBANGUNAN 2016",,1240,Dato' Fauzi bin Abdul Rahman [Indera Mahkota],Yang Berhormat Batu Gajah.
RANG UNDANG-UNDANG,"RANG UNDANG-UNDANG PERBEKALAN 2016
Bacaan Kali Yang Kedua
DAN
USUL
ANGGARAN PEMBANGUNAN 2016",,1240,Tuan Sivakumar Varatharaju Naidu [Batu Gajah],"Ya, Yang Berhormat Indera
Mahkota."
RANG UNDANG-UNDANG,"RANG UNDANG-UNDANG PERBEKALAN 2016
Bacaan Kali Yang Kedua
DAN
USUL
ANGGARAN PEMBANGUNAN 2016",,1240,Dato' Fauzi bin Abdul Rahman [Indera Mahkota],"Terima kasih Tuan Yang di-
Pertua, terima kasih Yang Berhormat Batu Gajah. Di dalam satu tamadun, apabila negara
kita maju, biasanya negara itu bermula dengan *labour intensive.* Apabila kemajuan sudah
meningkat, mereka akan pergi ke tahap satu lagi iaitu *they will go towards the stage of
mechanisation* supaya kita mengurangkan *labour intensive.* Lepas *mechanisation,* tahap
satu lagi adalah *automation.* Tapi kita masih kekal dengan keadaan yang lama. Apakah
pandangan Yang Berhormat Batu Gajah."
RANG UNDANG-UNDANG,"RANG UNDANG-UNDANG PERBEKALAN 2016
Bacaan Kali Yang Kedua
DAN
USUL
ANGGARAN PEMBANGUNAN 2016",,1240,Tuan Sivakumar Varatharaju Naidu [Batu Gajah],"Ya, saya pun bersetujulah.
Kita hendak capai Wawasan 2020, negara kita mencapai negara maju tetapi saya tidak
tahu kenapa kita tiba-tiba terpaksa membawa begitu ramai pekerja daripada negara lain.
Jadi *labour intensive* pula. Saya risau bahawa dengan kemasukan bilangan yang begitu
ramai itu, mereka ini akan membawa keluar khazanah negara dengan jumlah yang begitu
lumayan. Kehadiran pekerja-pekerja asing yang begitu ramai menjejaskan peluang
pekerjaan orang-orang tempatan, majikan memilih pekerja asing kerana kos yang rendah,
boleh dikawal dan produktivi tinggi. Ini akan menjadi rintangan untuk peningkatan gaji
rakyat negara kita. Gaji penduduk tempatan akan kaku selama-lamanya.
Untuk makluman Dewan yang mulia ini, statistik KWSP membuktikan lebih 40%
pekerja tempatan berpendapatan kurang daripada RM2 ribu sebulan. Pendapatan
bergabung pasangan suami isteri yang kurang daripada RM3,500 pula adalah 65%.
Dengan gaji pekerja yang sedemikian, Malaysia akan gagal mencapai taraf negara maju
pada tahun 2020 kerana sasaran gaji individu RM5,000 mustahil diperoleh dalam tempoh 5
tahun lagi. Selain daripada itu, keselamatan rakyat tempatan juga akan turut terancam dari
segi jenayah dan kesihatan yang boleh menggugat kestabilan sosial negara kita. Mereka
juga mendirikan rumah tangga dan mahu menjadi warga negara Malaysia. Ramai juga
akan memulakan perniagaan dan menguruskan kebun sendiri.
Hari ini pekerja-pekerja asing sudah mempunyai perniagaan mereka sendiri di
negara kita. Cadangan membawa masuk 1.5 juta pekerja Bangladesh menimbulkan
persoalan seperti berikut.
(i) Adakah Kementerian Sumber Manusia turut bersetuju dengan
cadangan yang dibuat oleh Yang Berhormat Menteri Dalam
Negeri kerana pengumuman ini dibuat oleh Yang Berhormat
Menteri Dalam Negeri dan bukannya Yang Berhormat Menteri
Sumber Manusia;
(ii) Kenapa boleh wujud permintaan yang begitu banyak untuk
pekerja asing negara kita. Apakah sumber yang dirujuk untuk
membuktikan jumlah permintaan itu. Apakah kajian terperinci
telah dibuat mengenai hal ini dan oleh siapa?; dan
*(iii)* Apakah kaedah atau cara pengendalian pengambilan pekerja
Bangladesh yang akan digunapakai oleh kerajaan. Ramai yang
berpendapat ianya kurang telus dan seolah-olah, *“ada udang di
sebalik batu”.*
Selain daripada itu saya ingin tahu berapakah jumlah pekerja Bangladesh yang
berada di negara kita pada masa ini. Daripada jumlah itu berapakah yang memasuki negara
kita secara tidak sah. Berapakah jumlah PATI yang telah dihantar pulang selepas Program
6P dilaksanakan. Tuan Yang di-Pertua, kemasukan pekerja-pekerja Bangladesh akan
merumitkan lagi masalah pengangguran di negara kita. Dianggarkan kadar pengangguran
sekarang adalah di antara 2.9% hingga 3.2%. Kemasukan pekerja asing secara melambak
akan meningkatkan kadar pengangguran mungkin lebih daripada 4%.
Sektor awam pula tidak mengambil pekerja baru. Banyak kilang dan syarikat-
syarikat akan menutup kedai atau terpaksa melaksanakan Skim Pemisahan Bersama
(MSS) dan Skim Pemberhentian Kerja Secara Sukarela (VSS). Semua ini akan
meningkatkan kadar pengangguran di negara kita. Oleh yang demikian, saya membantah
sekeras-kerasnya cadangan kerajaan untuk membawa masuk 1.5 juga pekerja Bangladesh
demi keselamatan dan kesejahteraan rakyat. Tuan Yang di-Pertua, saya rasa sungguh
kecewa dengan senarai keutamaan projek dalam bajet yang dibentangkan oleh Pekan.
Dalam senarai itu, tidak ada satu pun projek besar untuk negeri Perak yang disenaraikan
sehingga ke tangga 24 yang bernilai RM137.1 bilion.
Saya tidak tahu sama ada Ahli-ahli Yang Berhormat sebelah sini khususnya dari
Perak sedar atau tidak tentang perkara ini tetapi ini tidak adil kepada 2.4 juta rakyat Perak.
Oleh kerana kerajaan persekutuan tidak memberi kepentingan dan keutamaan kepada
negeri Perak, maka adalah wajar untuk rakyat negeri Perak untuk menolak sama sekali
Kerajaan Barisan Nasional dalam PRU Ke-14. Tuan Yang di-Pertua, saya difahamkan
bahawa kerajaan mempunyai hasrat untuk meminda Akta Perhubungan Perusahaan 1967,"
RANG UNDANG-UNDANG,"RANG UNDANG-UNDANG PERBEKALAN 2016
Bacaan Kali Yang Kedua
DAN
USUL
ANGGARAN PEMBANGUNAN 2016",,1240,ANNOTATION,[Akta 117]
RANG UNDANG-UNDANG,"RANG UNDANG-UNDANG PERBEKALAN 2016
Bacaan Kali Yang Kedua
DAN
USUL
ANGGARAN PEMBANGUNAN 2016",,1240,Tuan Sivakumar Varatharaju Naidu [Batu Gajah],dan Akta Kesatuan Sekerja 1959
RANG UNDANG-UNDANG,"RANG UNDANG-UNDANG PERBEKALAN 2016
Bacaan Kali Yang Kedua
DAN
USUL
ANGGARAN PEMBANGUNAN 2016",,1240,ANNOTATION,[Akta 262]
RANG UNDANG-UNDANG,"RANG UNDANG-UNDANG PERBEKALAN 2016
Bacaan Kali Yang Kedua
DAN
USUL
ANGGARAN PEMBANGUNAN 2016",,1240,Tuan Sivakumar Varatharaju Naidu [Batu Gajah],". Pihak Kementerian Sumber
Manusia sedang mengumpul maklumat dan maklum balas serta cadangan daripada
pelbagai pihak untuk mendapat kepentingan untuk meminda kedua-dua akta tersebut.
Pindaan yang dibuat harus memberi manfaat kepada semua pihak termasuk
golongan pekerja yang menjadi perkara asas dalam kedua-dua undang-undang ini.
kebajikan pekerja harus diberi keutamaan dan setiap pindaan yang bakal dibuat, undang-
undang yang sedia ada sebenarnya tidak sesuai kerana tidak memberi jaminan kebajikan
kepada golongan pekerja."
RANG UNDANG-UNDANG,"RANG UNDANG-UNDANG PERBEKALAN 2016
Bacaan Kali Yang Kedua
DAN
USUL
ANGGARAN PEMBANGUNAN 2016",,1250,Tuan Sivakumar Varatharaju Naidu [Batu Gajah],"Tidak juga salah jika saya merumuskan bahawa, kedua-dua undang-undang ini
lebih memihak kepada pihak majikan berbanding dengan golongan pekerja. Proses
perundingan kolektif (*collective bargaining*) satu kaedah yang amat penting untuk
menentukan dan memastikan kebajikan yang diperoleh oleh golongan pekerja.
Rundingan antara pihak pekerja dan majikan ini adalah penting untuk menentukan
pelbagai perkara seperti gaji, bonus, masa kerja dan faedah-faedah lain. Perundingan
seperti ini adalah mustahak untuk diadakan dari semasa ke semasa untuk menilai semula
kontrak-kontrak pekerjaan mengikut peredaran masa. Akan tetapi di bawah undang-undang
Malaysia, kesatuan sekerja pekerja perlu mendapat pengiktirafan terlebih dahulu daripada
majikan atau kesatuan sekerja majikan sebelum boleh memulakan proses rundingan
kolektif. Adakah ini adil untuk golongan pekerja?
Jika pihak majikan tidak berniat mengadakan perundingan kolektif, maka ini boleh
menjejaskan kebajikan golongan pekerja, dan tambahan pula kesatuan sekerja yang ada itu
seolah-olah tidak ada kuasa kerana pengiktirafannya tergugat apabila pihak majikan enggan
berunding.
Oleh yang demikian, adalah wajar untuk kerajaan meminda akta yang terlibat
supaya kesatuan sekerja benar-benar boleh berfungsi dengan baik dalam hal ehwal
menjaga kebajikan pekerja-pekerja. Kuasa kesatuan sekerja harus ditambahkan dalam
aspek perundingan kolektif supaya pihak majikan tidak mengambil kesempatan daripada
kecacatan undang-undang yang sedia ada.
Tuan Yang di-Pertua..."
RANG UNDANG-UNDANG,"RANG UNDANG-UNDANG PERBEKALAN 2016
Bacaan Kali Yang Kedua
DAN
USUL
ANGGARAN PEMBANGUNAN 2016",,1250,Timbalan Yang di-Pertua [Datuk Haji Ismail bin Haji Mohamed Said],"Ya, boleh
gulung.."
RANG UNDANG-UNDANG,"RANG UNDANG-UNDANG PERBEKALAN 2016
Bacaan Kali Yang Kedua
DAN
USUL
ANGGARAN PEMBANGUNAN 2016",,1250,Tuan Sivakumar Varatharaju Naidu [Batu Gajah],"Saya juga ingin mengambil
kesempatan ini untuk meminta kerajaan supaya meminda Akta Undang-undang Sivil 1956.
Undang-undang ini pernah dipinda pada tahun 1984. Tidak ada pindaan selepas itu untuk
jangka masa 31 tahun.
Saya rasa sudah tiba masanya untuk Parlimen meminda beberapa seksyen yang
penting dalam akta ini. Sebagai contoh, apabila seorang kanak-kanak mati kemalangan
disebabkan kecuaian pihak ketiga, berapakah ganti rugi kesedihan yang boleh dituntut oleh
ibu bapa?
Mengikut Seksyen 7(3a) dan (3b), ganti rugi kesedihan yang boleh dituntut
hanyalah RM10,000 sahaja. Jumlah ini terlalu kecil dan tidak mengikut peredaran masa.
Jika seseorang itu telah mencapai umur 18 tahun tetapi tidak bekerja atau masih belajar,
mati dalam suatu kemalangan, ibu bapanya tidak akan mendapat apa-apa ganti rugi
kesedihan. Adakah ini adil?
Apabila seseorang berumur 18 tahun yang bekerja pula mati, keluarganya berhak
untuk menuntut duit tanggungan. Bila seseorang yang berumur 55 tahun meninggal dunia
dalam kemalangan kerana kecuaian pihak ketiga, pasangannya hanya berhak menuntut
ganti rugi kesedihan sebanyak RM10,000, tetapi tidak berhak untuk duit tanggungan.
Oleh sebab umur persaraan juga telah dinaikkan oleh kerajaan, maka perkara ini
juga perlu dipinda untuk kesesuaian dan penyeragaman semua undang-undang negara.
Pindaan ini juga penting untuk menjaga kebajikan rakyat.
Oleh sebab masa tidak mengizinkan Tuan Yang di-Pertua, saya terpaksa
berhentikan perbahasan saya di sini, dan perkara-perkara lain akan saya bangkitkan dalam
peringkat Jawatankuasa. Terima kasih."
RANG UNDANG-UNDANG,"RANG UNDANG-UNDANG PERBEKALAN 2016
Bacaan Kali Yang Kedua
DAN
USUL
ANGGARAN PEMBANGUNAN 2016",,1250,Timbalan Yang di-Pertua [Datuk Haji Ismail bin Haji Mohamed Said],"Ya, Yang
Berhormat Sibuti."
RANG UNDANG-UNDANG,"RANG UNDANG-UNDANG PERBEKALAN 2016
Bacaan Kali Yang Kedua
DAN
USUL
ANGGARAN PEMBANGUNAN 2016",,1253,Tuan Haji Ahmad Lai bin Bujang [Sibuti],"Terima kasih Tuan Yang di-Pertua.
*Assalamualaikum warrahmatullaahi wabarakaatuh*.Terlebih dahulu saya ingin mengucapkan
jutaan terima kasih kepada Tuan Yang di-Pertua kerana memberi ruang untuk saya turut
serta dalam perbahasan Bajet 2016.
Tahniah kepada Yang Amat Berhormat Perdana Menteri atas pembentangan Bajet
2016 yang bertemakan, “Mensejahterakan Kehidupan Rakyat” yang ditujukan kepada lima
keutamaan.
Tuan Yang di-Pertua, kita selalu mendengar, apabila bajet dibentangkan bahawa
rakyatlah yang diambil perhatian penting kepada apa yang diadakan oleh bajet ini- sebab
yang mengelolakan bajet ini adalah orang yang bijak pandai, yang hebat dalam ekonomi,
yang merancang apa keperluan-keperluan rakyat semasa.
Sepanjang beberapa tahun ini, saya secara konsisten kerap membangkitkan
pembangunan pelancongan di kawasan Sibuti. Pada tahun ini, bahawa kawasan Sibuti telah
terdapat fenomena *“Blue Tears”* di Pesisiran Pantai Tusan yang menarik ratusan dan ribuan
kunjungan orang ramai setiap malam bagi melihat fenomena tersebut yang kini *viral* di
media sosial. Bagi tujuan ini, saya ingin sama-sama memohon kepada Yang Berhormat
Menteri yang berkenaan, supaya memberi ruang, datanglah melihat dan menyiasat keadaan
ini untuk menambah lagi pembangunan infra pelancongan di kawasan itu.
Tuan Yang di-Pertua, saya sangat kecewa apabila mendengar rakan seperjuangan
saya dari Sarawak, Yang Berhormat Bandar Kuching mengatakan bahawa rakyat Sarawak
tidak menyokong Yang Amat Berhormat Perdana Menteri sedangkan Yang Amat Berhormat
Ketua Menteri Sarawak sudah menyatakan, rakyat Sarawak menyokong penuh. Ini
ditunjukkan kepada kita bahawa Wakil Rakyat daripada Barisan Nasional dalam negeri
Sarawak adalah lebih ramai daripada kawan saya itu. Jangan marahlah Yang Berhormat,
kita kawan baik, kan?"
RANG UNDANG-UNDANG,"RANG UNDANG-UNDANG PERBEKALAN 2016
Bacaan Kali Yang Kedua
DAN
USUL
ANGGARAN PEMBANGUNAN 2016",,1253,ANNOTATION,[Ketawa]
RANG UNDANG-UNDANG,"RANG UNDANG-UNDANG PERBEKALAN 2016
Bacaan Kali Yang Kedua
DAN
USUL
ANGGARAN PEMBANGUNAN 2016",,1253,Tuan Haji Ahmad Lai bin Bujang [Sibuti],"Akan tetapi Yang Berhormat, kerana kita di luar bandar masih memerlukan banyak
pembangunan infra, sebab itulah kita sentiasa bersedia untuk menyokong kerajaan. Kalau
kita ambil contohlah Yang Berhormat Bandar Kuching, di kawasan saya, di Miri sana,
apabila sudah dipegang oleh pembangkang, projek-projek pun apabila rakyat berjumpa
Wakil Rakyat, dia kata, carilah Wakil Rakyat Kerajaan. Mereka ada peruntukan, kita tak
diberi peruntukan. Jadi baiklah pilih kita Yang Berhormat, ya. Jadi, saya mengharapkan
bahawa apa juga keperluan rakyat, apa yang dijanjikan mesti ditunaikan.
Tuan Yang di-Pertua, kita berterima kasih kepada Menteri yang baru iaitu Menteri
Kemajuan Luar Bandar, telah mengatakan bahawa banyak peruntukan akan diberi kepada
tadika, tabika di luar bandar iaitu di bawah KEMAS, dan Pegawai KEMAS juga patut dilatih
dan diberi peningkatan- mereka sebagai pendidik supaya bangunan-bangunan kelas tabika
KEMAS itu dinaik taraf supaya mereka lebih selesa daripada apa yang ada sekarang,
terutama sekali di kawasan saya di luar bandar, di rumah panjang dan di kampung-
kampung.
Taraf kesihatan adalah penting, sebab jika kesihatan kita tidak baik dan
keselamatan kita tidak baik, maka kita dalam hidup ketakutan. Oleh sebab itulah,
pentingnya Bajet 2016, di mana sebanyak RM206 juta itu bina barukah, naik tarafkah klinik-
klinik di kawasan saya, di Sibuti, saya mintalah- terima kasih kepada Yang Berhormat
Timbalan Menteri Kesihatan yang melawat dan berjanji untuk melihat dalam RMK-11 ini
nanti. Ia akan dibina, supaya taraf kesihatan kita yang klinik-klinik itu dibina pada tahun 50-
an, yang begitu usang boleh dinaik taraf lebih baik lagi, kerana kita di luar bandar walaupun
sudah diadakan Klinik 1Malaysia, Klinik Hemodialisis, jadi kita mengharapkan penambahan
baik ini akan dimulakan dengan segera.
Kalau boleh klinik-klinik ini diadakan di RTC yang kita sudah bina, dan sudah siap
akan dirasmi pada bila-bila masa oleh Yang Amat Berhormat Perdana Menteri.
Tuan Yang di-Pertua..."
RANG UNDANG-UNDANG,"RANG UNDANG-UNDANG PERBEKALAN 2016
Bacaan Kali Yang Kedua
DAN
USUL
ANGGARAN PEMBANGUNAN 2016",,1253,Timbalan Yang di-Pertua [Datuk Haji Ismail bin Haji Mohamed Said],"Ya, Yang
Berhormat Sibutti. Kita sambung selepas jam 2.30 petang ya."
RANG UNDANG-UNDANG,"RANG UNDANG-UNDANG PERBEKALAN 2016
Bacaan Kali Yang Kedua
DAN
USUL
ANGGARAN PEMBANGUNAN 2016",,1253,Tuan Haji Ahmad Lai bin Bujang [Sibuti],"Ya, terima kasih."
RANG UNDANG-UNDANG,"RANG UNDANG-UNDANG PERBEKALAN 2016
Bacaan Kali Yang Kedua
DAN
USUL
ANGGARAN PEMBANGUNAN 2016",,1253,Timbalan Yang di-Pertua [Datuk Haji Ismail bin Haji Mohamed Said],"Ada tiga
belas minit lagi."
RANG UNDANG-UNDANG,"RANG UNDANG-UNDANG PERBEKALAN 2016
Bacaan Kali Yang Kedua
DAN
USUL
ANGGARAN PEMBANGUNAN 2016",,1253,Tuan Haji Ahmad Lai bin Bujang [Sibuti],Terima kasih.
RANG UNDANG-UNDANG,"RANG UNDANG-UNDANG PERBEKALAN 2016
Bacaan Kali Yang Kedua
DAN
USUL
ANGGARAN PEMBANGUNAN 2016",,1253,Timbalan Yang di-Pertua [Datuk Haji Ismail bin Haji Mohamed Said],"Ahli-ahli Yang Berhormat, kita tangguhkan Mesyuarat kita sehingga jam 2.30
petang."
RANG UNDANG-UNDANG,"RANG UNDANG-UNDANG PERBEKALAN 2016
Bacaan Kali Yang Kedua
DAN
USUL
ANGGARAN PEMBANGUNAN 2016",,1300,ANNOTATION,[Mesyuarat ditempohkan pada pukul 1.00 petang]
RANG UNDANG-UNDANG,"RANG UNDANG-UNDANG PERBEKALAN 2016
Bacaan Kali Yang Kedua
DAN
USUL
ANGGARAN PEMBANGUNAN 2016",,1430,ANNOTATION,[Mesyuarat disambung semula pada pukul 2.30 petang]
RANG UNDANG-UNDANG,"RANG UNDANG-UNDANG PERBEKALAN 2016
Bacaan Kali Yang Kedua
DAN
USUL
ANGGARAN PEMBANGUNAN 2016",,1430,ANNOTATION,[Tuan Yang di-Pertua mempengerusikan Mesyuarat]
RANG UNDANG-UNDANG,"RANG UNDANG-UNDANG PERBEKALAN 2016
Bacaan Kali Yang Kedua
DAN
USUL
ANGGARAN PEMBANGUNAN 2016",,1430,Tuan Yang di-Pertua,"Perbahasan disambung semula. Apa yang tertulis di depan
saya sekarang, Yang Berhormat Sibuti mempunyai 13 minit lagi. Sila Yang Berhormat."
RANG UNDANG-UNDANG,"RANG UNDANG-UNDANG PERBEKALAN 2016
Bacaan Kali Yang Kedua
DAN
USUL
ANGGARAN PEMBANGUNAN 2016",,1432,Tuan Haji Ahmad Lai bin Bujang [Sibuti],"Terima kasih Tuan Yang di-Pertua.
Apabila saya keluar dari Dewan tadi Tuan Yang di-Pertua, saya didatangi mengatakan ada
surat untuk saya daripada orang di kawasan saya bahawa supaya saya menyokong undi
tidak percaya daripada seorang sahaja daripada pengundi-pengundi di kawasan saya
sejumlah 27,000 orang pengundi, saya dapat satu. Mana boleh saya hendak menyokong,
mana boleh. Tentu sekali saya tidak menyokong usul ataupun cadangan ini. Terima kasih.
Tuan Yang di-Pertua, memandangkan dadah adalah satu juga yang terlalu
membuat kehidupan remaja kita pada hari ini kucar-kacir. Jadi saya mengharapkan bahawa
apakah usaha kerajaan untuk memerangi dadah ini sebab masuk daripada pintu masuk
lapangan terbang pun ada mendapat beberapa kilo dadah dibawa masuk, masuk dari
sempadan pun kita dengar banyak yang tertangkap, terkumpul boleh terlepas.
Jadi sebab itulah golongan yang dikenali sebagai *career addict* di mana golongan
pekerja menjadikan dadah sintetik sebagai *lifestyle* sehingga menghabiskan pendapatan
bagi tujuan tersebut. Saya ingin menyeru kepada kerajaan agar dapat meningkatkan bajet
bagi memerangi dadah dan memperkasakan pusat pemulihan dadah dengan mengambil
modul-modul pemulihan NGO seperti Rumah PENGASIH bagi memulihkan penagih-
penagih ini.
Bagi negeri Sarawak, saya berterima kasih kerana banyak diperuntukkan yang
di*commit*kan oleh Kerajaan Pusat membantu Sarawak dalam Bajet 2016 amat kami hargai.
Kami rakyat negeri Sarawak sama-sama menyumbang kepada kerajaan daripada hasil
bumi seperti minyak dan gas. Terdapat ramai juga rakyat Sarawak yang bekerja di
Semenanjung Malaysia terutama sekali di Kuala Lumpur dan Johor yang menyumbang
kepada tenaga kerja. Maka adalah sesuai setiap kali bajet pasti ada ruang untuk Sarawak
mendapat hasil daripada sumbangan ini.
Terlebih dahulu saya ingin mengucapkan tahniah dan terima kasih kepada
kerajaan kerana telah menyediakan peruntukan sebanyak RM70 juta bagi membolehkan
rakyat Sarawak mendapat pinjaman rumah RM50,000 seunit bagi membina rumah panjang.
Skim ini adalah diurus oleh BSN. Bagi tujuan ini saya amat memohon agar tidak dikenakan
birokrasi yang terlalu ketat sehingga dengan sengaja cuba untuk menggagalkan
permohonan rakyat Sarawak mendapat pinjaman ini. Kerajaan perlu meringankan prosedur
dan saya yakin rakyat Sarawak berterima kasih jika diperlakukan sedemikian.
Dalam Bajet 2016 juga kerajaan terus memberi komitmen bagi membantu program
penyukatan tanah NCR di Sarawak dengan tambahan RM30 juta. Begitu juga dengan
peruntukan sebanyak RM70 juta itu subsidi padi huma kepada pekebun padi di Sarawak.
Diharap agar program ini dapat diuar-uarkan kepada rakyat Sabah dan Sarawak melalui
hebahan media agar pekebun kecil padi huma tidak ketinggalan untuk menikmati insentif
baik Kerajaan Barisan Nasional ini.
Tuan Yang di-Pertua, kita di luar bandar hanya memerlukan prasarana dan juga
sambungan jalan raya dari satu tempat ke satu tempat dan begitu juga sekolah-sekolah.
Sekolah kita di luar bandar kebanyakannya sudah uzur. Jadi kita memohon agar pihak
kementerian menggunakan kaedah IBS untuk membina sekolah-sekolah dan asrama di luar
bandar. Saya gembira kerajaan mempunyai insentif untuk kontraktor dan menggunakan
kaedah IBS dalam pembinaan satu-satu projek. Bagi tujuan ini, saya mencadangkan
kerajaan mewujudkan kilang IBS di kawasan Samalaju bagi memenuhi keperluan
pembinaan bangunan melalui IBS terutama sekali bagi projek-projek sekolah kerajaan dan
bangunan kerajaan di Sabah dan Sarawak.
Tuan Yang di-Pertua, keselamatan adalah penting bagi seluruh rakyat Sarawak.
Kita juga mengalu-alukan Bajet 2016 ini kerana untuk menambahkan jentera-jentera
keselamatan baik di laut, di darat dan di udara agar negara kita sentiasa di dalam jagaan
yang selamat. Kita berharap juga selain daripada itu di kawasan saya Parlimen Sibuti
mencadangkan agar diwujudkan pondok bit polis di kawasan simpang Bekenu yang boleh
mengguna pakai bangunan hentian SEDC yang sedia ada. Selain itu juga, pondok bit polis
ditempatkan di kawasan simpang Sepupok Niah di mana kita melihat pada hari ini, lori-lori
yang mempunyai 20 dan 24 tayar berhenti di tepi jalan sesuka hati dan senang lenang
tanpa menghiraukan keselamatan orang lain."
RANG UNDANG-UNDANG,"RANG UNDANG-UNDANG PERBEKALAN 2016
Bacaan Kali Yang Kedua
DAN
USUL
ANGGARAN PEMBANGUNAN 2016",,1440,Tuan Haji Ahmad Lai bin Bujang [Sibuti],"Jadi dengan itu, pondok bit polis ini sangat diperlukan di kawasan-kawasan yang
saya sebut tadi. Dengan peruntukan sebanyak RM31.2 bilion bagi pertahanan negara,
adalah wajar jika pembelian kapal peronda di tempat perairan Laut China Selatan untuk
perairan Sarawak, sebab kita telah mendengar bahawa dari Beting Patinggi Ali ke pinggir
air telah dijaga kawal rapi oleh *Chinese Coast Guards* dari nelayan-nelayan kita. Maka mata
pencarian nelayan kita telah pun hilang daripada apa yang kita harapkan- daripada penting
ketinggian ilmu.
Tuan Yang di-Pertua, rakyat sentiasa memikirkan apa pekerjaan yang boleh
membantu. Kita benar-benar berterima kasih kepada Yang Amat Berhormat Perdana
Menteri kerana memikirkan BR1M. Pihak sana tidak mahu BR1M tetapi Tuan Yang di-
Pertua saya terangkan di sini, di kawasan saya di Mirilah, orang di sini cakap tidak mahu
BR1M, tidak mahu BR1M, tetapi wakil-wakil rakyat dia menggalakkan pergi daftar di BR1M
supaya kamu dapat itu sebab bahagian nanti dia tunggu *line* juga berdiri sama-sama
menerima *check* BR1M itu. Jadi tidak- betul, memang duit rakyat sebab itulah. Tidak
betullah kita cakap bahawa semua rakyat ini kita kena bayar cukai. Mana ada orang miskin
yang makan beras, minum guladan minum teh tarik mana ada kena GST tetapi mereka
pusing ini, Tuan Yang di-Pertua."
RANG UNDANG-UNDANG,"RANG UNDANG-UNDANG PERBEKALAN 2016
Bacaan Kali Yang Kedua
DAN
USUL
ANGGARAN PEMBANGUNAN 2016",,1440,Tuan Chua Tian Chang @ Tian Chua [Batu],
RANG UNDANG-UNDANG,"RANG UNDANG-UNDANG PERBEKALAN 2016
Bacaan Kali Yang Kedua
DAN
USUL
ANGGARAN PEMBANGUNAN 2016",,1440,ANNOTATION,[Ketawa]
RANG UNDANG-UNDANG,"RANG UNDANG-UNDANG PERBEKALAN 2016
Bacaan Kali Yang Kedua
DAN
USUL
ANGGARAN PEMBANGUNAN 2016",,1440,Tuan Chua Tian Chang @ Tian Chua [Batu],"Boleh beri laluan? Yang
Berhormat Batu."
RANG UNDANG-UNDANG,"RANG UNDANG-UNDANG PERBEKALAN 2016
Bacaan Kali Yang Kedua
DAN
USUL
ANGGARAN PEMBANGUNAN 2016",,1440,Tuan Haji Ahmad Lai bin Bujang [Sibuti],"Boleh, tidak ada masalah."
RANG UNDANG-UNDANG,"RANG UNDANG-UNDANG PERBEKALAN 2016
Bacaan Kali Yang Kedua
DAN
USUL
ANGGARAN PEMBANGUNAN 2016",,1440,Tuan Chua Tian Chang @ Tian Chua [Batu],"Okey, terima kasih. Saya cuma
hendak dapat - Tuan Yang di-Pertua..."
RANG UNDANG-UNDANG,"RANG UNDANG-UNDANG PERBEKALAN 2016
Bacaan Kali Yang Kedua
DAN
USUL
ANGGARAN PEMBANGUNAN 2016",,1440,Tuan Yang di-Pertua,"Yang Berhormat, apabila respons kepada persoalan ini
selepas ini Yang Berhormat gulung, sebab masa Yang Berhormat."
RANG UNDANG-UNDANG,"RANG UNDANG-UNDANG PERBEKALAN 2016
Bacaan Kali Yang Kedua
DAN
USUL
ANGGARAN PEMBANGUNAN 2016",,1440,Tuan Chua Tian Chang @ Tian Chua [Batu],"Okey, okey."
RANG UNDANG-UNDANG,"RANG UNDANG-UNDANG PERBEKALAN 2016
Bacaan Kali Yang Kedua
DAN
USUL
ANGGARAN PEMBANGUNAN 2016",,1440,Tuan Yang di-Pertua,Silakan.
RANG UNDANG-UNDANG,"RANG UNDANG-UNDANG PERBEKALAN 2016
Bacaan Kali Yang Kedua
DAN
USUL
ANGGARAN PEMBANGUNAN 2016",,1440,Tuan Chua Tian Chang @ Tian Chua [Batu],"Saya hendak dapat pandangan
sama ada setuju tidak apabila Yang Amat Berhormat Perdana Menteri menyatakan kita
dapat BR1M dengan hasil yang dikutip dari GST dan juga tol yang ditambah, itu adalah
hakikatnya kita terpaksa tanggung untuk membayar lebih banyak cukai. Terima kasih."
