level_1,level_2,level_3,timestamp,author,speech
,,,10.00 pagi.,ANNOTATION,"[Timbalan Yang di-Pertua (Puan Alice Lau Kiong Yieng)
mempengerusikan Mesyuarat]"
,,,10.00 pagi.,WAKTU PERTANYAAN-PERTANYAAN MENTERI Timbalan Yang di-Pertua [Puan Alice Lau Kiong Yieng],"Selamat pagi,
saya jemput Yang Berhormat Bagan."
,1.,,10.00 pagi.,Tuan Lim Guan Eng [Bagan],"minta  Menteri Pertahanan menyatakan
pendirian Malaysia ekoran pakatan pertahanan AUKUS yang mana Australia akan
membeli lapan buah kapal selam perang nuklear berharga AUD368 bilion dan
kesannya kepada keselamatan negara-negara ASEAN berdasarkan Zone of Peace
Freedom and Neutrality atau ZOPFAN dan sama ada 8 kapal selam perang nuklear
akan dibenarkan beroperasi dalam rantau perairan negara-negara ASEAN."
,1.,,10.00 pagi.,Menteri Pertahanan [Dato’ Seri Utama Mohamad bin Haji Hasan],"Terima
kasih Tuan Yang di-Pertua. Ini soalan ini saya kena bagi untuk jawapannya. Saya
tidak hendak cakap off the cuff takut nanti salah perkataan yang saya gunakan
kerana ini melibatkan soal hubungan banyak negara dan juga keselamatan. Saya
mohon izin untuk saya membacakan jawapan.
Tuan Yang di-Pertua, pada 13 Mac 2023 baru-baru ini, Perdana Menteri
Australia, Perdana Menteri United Kingdom dan Presiden Amerika Syarikat telah
mengumumkan mengenai status kemajuan pelaksanaan perjanjian keselamatan tiga
hala AUKUS.
Sebelum pengumuman tersebut dibuat, Panglima Angkatan Tentera
Australia yang merupakan utusan khas Perdana Menteri Australia telah datang ke
pejabat bertemu dengan saya, memberikan penerangan pada 9 Mac 2023 bahawa
pembangunan lapan buah kapal selam berkuasa nuklear tersebut hanya
menggunakan enjin berkuasa nuklear dan tidak akan dilengkapkan dengan senjata
nuklear selaras dengan komitmen Australia di bawah Treaty on the Non-Proliferation
of Nuclear Weapons (NPT).
Penerangan ini disusuli pula oleh panggilan telefon daripada Setiausaha
Pertahanan Amerika Syarikat pada 10 Mac 2023. Akhir sekali, baru-baru ini sesi
pertemuan Minister of State di Ministry of Defense United Kingdom pada 28 Mac
2023 datang ke pejabat MINDEF. Semasa sesi penerangan tersebut Tuan Yang di-
Pertua, saya telah menjelaskan bahawa pendirian dan prinsip Malaysia berhubung
dengan AUKUS ini adalah tetap dan tidak berubah.
Di mana, Malaysia menggesa agar semua pihak berkaitan sama ada di dalam
mahu pun di luar AUKUS ini untuk saling menghormati dan mematuhi sepenuhnya
instrument perundangan negara dan perundangan antarabangsa yang sedia ada,
terutamanya berhubung dengan pengoperasian kapal selam berkuasa nuklear
dalam perairan negara.
Ini termasuklah instruments di bawah Konvensyen Bangsa-Bangsa Bersatu
tentang Undang-undang Laut ataupun United Nations Convention on the Law of the
Sea (UNCLOS), Perjanjian Zon Bebas Senjata Nuklear Asia Tenggara atau dengan
izin Southeast Asia Nuclear Weapon-Free Zone (SEANWFZ) dan Deklarasi ASEAN
sebagai Zone of Peace, Freedom and Neutrality (ZOPFAN).
Sebagai anggota ASEAN Tuan Yang di-Pertua, Malaysia memegang prinsip
untuk mengekalkan ASEAN sebagai Zon Aman, Bebas, dan Berkecuali. Ini
termasuklah dalam isu berkaitan perlucutan senjata nuklear, pencegahan
percambahan nuklear, dan penggunaan teknologi nuklear secara aman.
Bagi memastikan keselamatan dan kedaulatan negara serta kestabilan di
rantau ini kekal terpelihara, Malaysia menggesa agar semua pihak sama ada dalam
mahu pun di luar pakatan AUKUS ini untuk tidak melakukan sebarang aktiviti yang
bersifat provokasi yang boleh mengganggu ketenteraman dan keselamatan di rantau
ini.
Walau bagaimanapun, Malaysia sentiasa menghormati hak semua negara
untuk meningkatkan keupayaan pertahanan masing-masing atau capacity building
mereka masing-masing, mengambil kira kehendak dan kepentingan masing-masing.
Tuan Yang di-Pertua, berdasarkan undang-undang antarabangsa UNCLOS
1982 yang berbunyi, mana-mana kapal atau pun pesawat diberi kebebasan
pelayaran atau pun penerbangan atau freedom of navigation or overflight di laut
lepas atau di zon ekonomi eksklusif di mana-mana negara tetapi tertakluk. Aktiviti
tersebut mestilah mematuhi peraturan dan undang-undang negara pesisir selagi
mana tidak bertentangan dengan UNCLOS 1982."
,1.,,■1010,Menteri Pertahanan [Dato’ Seri Utama Mohamad bin Haji Hasan],"UNCLOS 1982 juga menyatakan bahawa mana-mana kapal selam yang
melalui wilayah negara lain perlulah sentiasa berada atas permukaan air. Ia tidak
boleh menyelam, Tuan Yang di-Pertua. Ia mesti lalu atas permukaan air dan
peraturan ini terpakai di negara kita serta negara-negara persisiran lain di Asia
Tenggara.
Sungguhpun begitu, jika ada kapal selam negara asing, sama ada berkuasa
konvensional ataupun nuklear yang ingin berlayar di bawah permukaan air di dalam
perairan negara, Tentera Laut negara asing yang dia nak tempuh itu mesti
mengemukakan permohonan kepada Tentera Laut Diraja Malaysia dahulu melalui
nota diplomatik bagi mendapatkan kelulusan khas. Peraturan ini juga terpakai
sekiranya ada kapal selam ataupun kapal perang yang ingin memasuki mana-mana
pelabuhan di negara kita. Tuan Yang di-Pertua, terima kasih."
,1.,,■1010,Timbalan Yang di-Pertua [Puan Alice Lau Kiong Yieng],"Yang Berhormat
Bagan."
,1.,,■1010,Tuan Lim Guan Eng [Bagan],"Terima kasih kepada Yang Berhormat Menteri
kerana memberikan satu penerangan yang begitu lengkap sekali tentang satu isu
yang amat penting untuk masa depan dan juga keselamatan negara.
Saya ingin bertanyakan Yang Berhormat Menteri yang menyatakan tadi
bahawa kebenaran mesti diperoleh daripada negara sekiranya ada kapal selam
mana-mana negara yang melalui perairan negara kita. Bolehkah beritahu Dewan
yang mulia ini berapa kali kebenaran diberikan dan daripada negara mana?
Perkara yang paling penting ialah memandangkan Yang Berhormat sebut
tadi bahawa kapal selam nuklear ini hanya untuk enjin dia, bukan untuk senjata dia.
Akan tetapi, seperti yang dimaklumkan oleh Yang Berhormat Menteri dan juga
perbincangan dan perbahasan rancak yang berlaku di Australia, dinyatakan
kemungkinan akan dilengkapkan dengan senjata nuklear, sungguhpun mereka telah
memberikan jaminan.
Adakah Yang Berhormat Menteri bercadang untuk mengadakan satu
mesyuarat dengan semua Menteri Pertahanan ASEAN supaya kalau kita buat
secara sepakat lebih berkesan untuk mendesak semua kuasa luar? Janganlah main
nuklear dan senjata nuklear dalam rantau ASEAN supaya kita boleh berpegang
teguh kepada konsep Zone of Peace, Freedom and Neutrality. Sekian, terima kasih."
,1.,,■1010,Dato’ Seri Utama Mohamad bin Haji Hasan,"Tuan Yang di-Pertua,
berkenaan dengan kebenaran untuk melalui perairan negara kita, selama ini
sebarang apa sahaja pelayaran-pelayaran terutamanya kapal-kapal selam daripada
negara-negara sekutu kita iaitu terutamanya dalam FPDA iaitu Five Power Defence
Arrangements yang mana Australia, New Zealand, United Kingdom, Malaysia and
Singapura yang menjadi anggotanya yang telah pun melebihi 60 tahun. Semua
kebenaran itu ada didapati dan mereka menghormati Undang-undang Laut
Antarabangsa seperti yang disebut di dalam UNCLOS 1982.
Tuan Yang di-Pertua, berkenaan dengan kapal selam ini iaitu kapal selam
yang dipanggil sebagai nuclear powered but conventional weapon. Kuasanya kuasa
nuklear tetapi ia punya persenjataannya masih secara konvensional. Ini diterangkan
dengan begitu detailed oleh ketiga-tiga buah negara iaitu Panglima Angkatan
Tentera (Chief of Defence Forces) dari Australia yang merupakan duta khas sebagai
mewakili Perdana Menteri Australia menerangkan secara detailed bahkan Tentera
Laut ataupun pihak Australia tidak boleh mengubah suai, tidak boleh membuka dia
punya nuklear box tersebut.
Ia memang tidak boleh buka dan ia memang tidak mungkin boleh dibuka
untuk diubahsuai. Ini adalah merupakan SOP yang amat ketat yang perlu mereka
awasi dan perlu mereka turuti.
Berkenaan dengan perundingan ataupun perbincangan antara rakan-rakan
sejawat Menteri-menteri Pertahanan negara-negara ASEAN, kami telah pun ada
jadual untuk mengadakan mesyuarat dan Indonesia akan menjadi tuan rumah yang
bakal diadakan pada bulan tujuh. Akan tetapi, kena tengoklah sebab tuan rumah kata
bulan tujuh, tidak tahu bila masa yang ditetapkan.
Di situ nanti, ini salah satu daripada agenda yang akan kami bahaskan dan
ASEAN Defence Ministers’ Meeting (ADMM) ini, kami akan menjemput apa yang
dipanggil sebagai negara-negara tambahan, enam buah negara termasuklah
Amerika Syarikat dan Australia untuk membincangkan berkenaan perkara ini, apa
yang dipanggil sebagai ASEAN Defence Ministers’ Meeting Plus (ADMM-Plus). Kita
akan bincangkan. Sudah pastinya perancangan penubuhan AUKUS ini menjadi topik
utama dalam perbincangan kami nanti di Jakarta. Insya-Allah, terima kasih."
,1.,,■1010,Timbalan Yang di-Pertua [Puan Alice Lau Kiong Yieng],"Yang Berhormat
Kota Bharu."
,1.,,■1010,Datuk Seri Takiyuddin bin Hassan [Kota Bharu],"Terima kasih Tuan Yang
di-Pertua. Terima kasih Yang Berhormat Menteri. Saya berminat dengan tajuk yang
telah dikemukakan pada hari ini dan saya membaca beberapa artikel mengenai
pakatan pertahanan AUKUS, Australia, UK dan US ini.
Mengikut satu artikel, salah satu sebab kenapa Australia requires submarine
ini adalah kerana mereka memikirkan kehadiran Tentera-tentera Laut China
terutamanya di Laut China Selatan. Jadi, saya ingin bertanya apakah pandangan
Kerajaan Malaysia kita dan apakah langkah yang diambil? Perkara yang pentingnya
adalah memastikan pertahanan dan keselamatan negara kita Malaysia itu sendiri.
Terima kasih."
,1.,,■1010,Dato’ Seri Utama Mohamad bin Haji Hasan,"Terima kasih rakan dari Kota
Bharu. Tuan Yang di-Pertua, berkenaan dengan apa yang dikatakan oleh banyak
pihak mengatakan bahawa penubuhan AUKUS ini disebabkan oleh adanya kuasa
lain yang ada di kawasan ini.
Itu di luar kita punya kuasa sebab penubuhan AUKUS ini adalah merupakan
dasar Amerika Syarikat dan juga negara-negara Barat berkenaan dengan kehadiran
mereka dan keamanan di Indo-Pasifik. Mereka melihat bukan sahaja di ASEAN tetapi
juga di Indo-Pasifik di mana mereka mahu melihat supaya kawasan ini terus kekal
menjadi satu buah kawasan yang aman.
Jadi, ini capacity building seperti yang saya sebutkan tadi negara-negara
untuk mempertingkatkan asas pertahanan mereka. Asas pertahanan mereka itu di
luar kita punya kuasa, Tuan Yang di-Pertua ya, sebab itu masing-masing punya hal.
Kita pun sedang mempertingkatkan kita punya aset-aset pertahanan kita, Tuan Yang
di-Pertua. Akan tetapi, ini dasar mereka untuk melihat supaya kawasan Indo-Pasifik
yang lebih luas. Bukan sahaja di Laut China Selatan tetapi termasuk sampai Pasifik
dan lain-lain negara.
Jadi, ini merupakan dasar mereka dan kita masih lagi kekal seperti disebut
oleh Yang Berhormat Bagan tadi, ASEAN akan terus memutuskan. Ini dasar kita
bahawa di Asia Tenggara ini kita mahu kekal supaya ia menjadi kawasan yang kekal
tiada persenjataan nuklear ataupun penggunaan nuklear digunakan di kawasan ini.
Ini memang kita punya keputusan bersama. Konsensus ASEAN, Tuan Yang di-
Pertua ialah kita hendak mengekalkan Zone of Peace, Freedom and Neutrality
(ZOPFAN) ini.
Jadi, tidak timbul soal mengatakan kita bertelagah dengan sesiapa. ASEAN,
kita satu buah zon yang neutral. Zon aman dan zon bebas dan kita mahu supaya
semua pihak menghormatinya itu. Jika mereka mahu mengadakan apa sahaja
ataupun melalui, kita menghormati United Nations Convention on the Law of the Sea
(UNCLOS).
Kita ada dia punya right of..."
,1.,,■1010,ANNOTATION,[Tidak jelas]
,1.,,■1010,Dato’ Seri Utama Mohamad bin Haji Hasan,"dan juga right untuk mereka lalu.
Jadi, kita menghormati tersebut tetapi tertakluk kepada apa yang disebut dalam
perundangan laut antarabangsa tersebut. Mereka mesti minta izin daripada negara-
negara yang perairan mereka hendak lalu kalau dia hendak lalu. But there is no such
thing atau tidak timbul mengadakan exercise tanpa di luar pengetahuan kita, Tuan
Yang di-Pertua. Insya-Allah."
,1.,,■1010,Timbalan Yang di-Pertua [Puan Alice Lau Kiong Yieng],"Terima kasih.
Saya jemput Yang Berhormat Dungun, Tuan Haji Wan Hassan bin Mohd Ramli."
,2.,,■1020,Tuan Haji Wan Hassan bin Mohd Ramli [Dungun],"minta  Menteri Dalam
Negeri menyatakan langkah bagi memastikan isu kesihatan mental dapat dibendung
dalam kalangan anggota polis terutama yang memegang senjata api bagi
memastikan anggota dapat menjalankan tugas dengan mental yang stabil."
,2.,,■1020,Menteri Dalam Negeri [Datuk Seri Saifuddin Nasution bin Ismail],"Assalamualaikum warahmatullahi wabarakatuh, Ramadan Kareem. Terima kasih
sahabat saya dari Dungun. Tuan Yang di-Pertua, Polis Diraja Malaysia adalah
sebuah agensi penguat kuasa utama negara kita dalam menguatkuasakan undang-
undang dan keselamatan negara. Justeru, polis perlukan warga kerja yang
mempunyai tahap kesihatan fizikal dan mental yang baik dan stabil.
Langkah bagi memastikan tahap kesihatan mental dapat dibendung dan
ditangani dengan baik. Pertama, 130,000 kekuatan anggota dengan tugas yang
begitu berat dan mencabar khusus untuk isu kesihatan mental ini polis ada Pelan
Strategik Polis Diraja Malaysia 2021-2025 dengan teras strategik nombor enam
adalah dari hal Program Pemerkasaan Penilaian Psikologi melalui pengukuran
psikometrik ujian psikologi.
Bagi mendukung pelan ini, ada beberapa inisiatif. Pertama, Arahan
Pentadbiran Jabatan Integriti dan Pematuhan Standard. Kedua, Arahan Ketua Polis
Negara Mengenai Pengurusan Kesihatan Mental. Ada pelan strategik, ada inisiatif,
ada program di bawah program Bahagian Agama dan Kaunseling, ada pengisian
program agama yang berterusan diuruskan oleh Unit Dakwah, Unit Sahsiah dan Unit
Pengimarahan. Ada juga program psikologi yang mengkhusus terus kepada warga
kerja dalam kesemua aspek kesihatan mental.
Ada program berupa peranan rakan sekerja yang diasuh, dididik, dilatih bagi
mengesan kalau rakan kerjanya itu ada tanda-tanda menunjukkan stres, murung
atau ada kebimbangan. Ada dalam modul latihan polis sekarang pun terutama
bermula tahun 2018 dan ke atas, recruitment baharu hendak jadi anggota polis ini
wajib lulus ujian psikologi, ujian psikometrik. Tak lulus, tak dapat kerja. Bukan sahaja
kelulusan fizikal. Kemudian program turun padang (outreach) Bahagian Agama dan
Kaunseling untuk menemui seluruh anggota.
Jadi, ini adalah antara ikhtiar di bawah pasukan polis bagi memastikan tahap
kesihatan mental warga kerjanya itu terbaik sebelum mereka betul-betul dapat
menjalankan tugas dengan kompeten dan berkesan. Terima kasih."
,2.,,■1020,Timbalan Yang di-Pertua [Puan Alice Lau Kiong Yieng],"Yang Berhormat
Dungun."
,2.,,■1020,Tuan Haji Wan Hassan bin Mohd Ramli [Dungun],"Terima kasih Yang
Berhormat Menteri atas jawapan. Saya difahamkan ujian psikologi di bawah Sistem
Pemprofilan Keselamatan (SPIK) merangkumi lima dimensi di antaranya kesihatan
mental. Soalan saya, berapakah kekerapan ujian tersebut dijalankan khususnya
kepada anggota polis yang memegang senjata api dan apakah inisiatif bagi menjaga
kesihatan mental mereka selain Seminar Psikologi Keselamatan."
,2.,,■1020,Datuk Seri Saifuddin Nasution bin Ismail,"Terima kasih. Tuan Yang di-
Pertua, secara jujurnya dan terus terang kita akui kebelakangan ini ada semacam
kecenderungan di kalangan petugas warga polis yang ke arah bertindak bunuh diri.
Ada kecenderungan. Kecenderungan itu dikesan seawal tahun 2015 hingga 2016.
Oleh sebab itu, langkah segera pasukan polis walaupun kesnya angkanya
kecil dan rendah boleh dianggap terpencil berbanding 130,000 kekuatan anggota.
Akan tetapi, cara pasukan polis dan KDN bertindak adalah sebelum kita menyusun
langkah dan tindakan kita menganalisis ke semua data melalui kajian-kajian
empirikal."
,2.,,■1020,Tuan Haji Aminolhuda Hassan [Sri Gading],
,2.,,■1020,ANNOTATION,[Bangun]
,2.,,■1020,Dr. Kelvin Yii Lee Wuen [Bandar Kuching],
,2.,,■1020,ANNOTATION,[Bangun]
,2.,,■1020,Datuk Seri Saifuddin Nasution bin Ismail,"Misalnya, satu kajian tahun
2014-2018 iaitu tajuk kajian, ‘Penerokaan Bunuh Diri Dalam Kalangan Warga Polis’,
ada kajian. Tahun 2014-2018 ada tujuh kes bunuh diri. Kalau Yang Berhormat masih
ingat tahun ini sahaja tahun 2023 kita baru empat kerajaan tiga bulan kita bulan satu
kes yang kita anggap high profile di Perlis dia bunuh isteri. Di Bayan Lepas, dia
tembak diri sendiri. Semuanya itu dalam radar catatan polis.
Oleh sebab itu, kita melihat kesemua aspek yang mana seorang anggota
yang hendak diberikan kebenaran menggunakan senjata api, dia tidak boleh sama
sekali ada tanda-tanda gangguan, tekanan dan sebagainya. Prosedur itu dibuat
melalui ikhtiar program yang berterusan sebelum superiornya itu membenarnya
senjata dimiliki.
Jadi, cara kita buat bukan sahaja memastikan program yang berterusan tetapi
polisi yang hendak kita buat itu mesti bersifat data-driven policy. Bukan sahaja satu
kajian dibuat, sekarang ini pun Yang Berhormat, sedang berlangsung Kajian
Saringan Kesihatan Mental dan Kesejahteraan Psikologi Polis dengan kerjasama
USIM tempoh Januari hingga Jun tahun ini di bawah urus setia R&D polis.
Kemudian, tahun 2022 telah pun lengkap satu kajian yang membabitkan
responden hampir 26,000 anggota polis. Daripada semua ini kita kesan emosi positif,
emosi negatif dia, dan itu memberikan panduan sebelum kita memposisikan dia
terhadap satu-satu tugas. Biarpun angka itu saya tegaskan kecil, rendah dan
terpencil tetapi pihak polis dan KDN tidak alpa satu nyawa sekali pun berharga.
Ikhtiar untuk memastikan insiden seumpama ini tidak berulang adalah keutamaan
kami. Terima kasih."
,2.,,■1020,Dewan Rakyat. Kelvin Yii Lee Wuen [Bandar Kuching],Bandar Kuching.
,2.,,■1020,Timbalan Yang di-Pertua [Puan Alice Lau Kiong Yieng],"Saya jemput
Yang Berhormat Sri Gading."
,2.,,■1020,Tuan Haji Aminolhuda Hassan [Sri Gading],"Terima kasih Tuan Yang di-
Pertua. Kalau kita melihat bahawa keselamatan negara ataupun keselamatan orang
awam berkaitan dengan anggota keselamatan polis ini, penting. Akan tetapi kita
kadang-kadang terkejut dengan berita-berita yang berkenaan yang dikatakan tadi
sakit mental ya.
Jadi persoalan saya, boleh tak kalau kita lihat, sebab dia melibatkan keluarga,
rakan sekerja. Kalau ikutkan bilangan ataupun senarai, dari tahun bilakah yang agak
paling banyak dan waktu bulan berapa agaknya stres itu memberikan beban kepada
anggota polis. Itu yang pertama.
Kedua, adakah kerana beban-beban yang mungkin kerana beban tugas itu
yang berat yang menyebabkan stres itu terlalu tinggi? Apakah langkah-langkah
laporan awal yang perlu dibuat dan siapakah yang bertanggungjawab untuk
membuat laporan ini kepada pihak yang lebih berwajiblah, lebih atas. Sekian, terima
kasih."
,2.,,■1020,Datuk Seri Saifuddin Nasution bin Ismail,"Siapakah yang
bertanggungjawab dalam pasukan polis. Yang bertanggungjawab adalah Jabatan
Integriti dan Pematuhan Standard. Buat masa sekarang mereka punya 109 orang
kaunselor di Bukit Aman, di IPK dan di IPD gred ‘A’ di mana OCPDnya itu berpangkat
ACP. Kita ada 711 yang kita panggil sebagai Rakan Pembimbing Perkhidmatan
Awam (AKRAB). Baik, apakah faktor yang menyumbang kepada gangguan
kesihatan mental ini.
Kajian− saya tak mahu ambil kajian awam ya. Saya ambil kajian untuk polis
sahaja. Benar, seperti Yang Berhormat Sri Gading sebut yang pertama faktor
tekanan. Kedua, status kesihatan. Ketiga, persekitaran tempat kerja. Jadi tiga faktor
utama dan apabila kita zoom ini hasil analisis itu didapati faktor tekanan itu
termasuklah berpunca daripada dia kecewa dalam perhubungan. Dia ada masalah
dalam penyesuaian di penempatan baharu. Dia gagal untuk mengawal daya tindak
diri. Dia kesunyian akibat berjauhan daripada keluarga dan dia ada masalah
perkahwinan."
,2.,,■1030,Datuk Seri Saifuddin Nasution bin Ismail,"Semua faktor ini menyumbang kepada tekanan. Jadi, oleh hal yang demikian,
oleh sebab kajian ini menemui unsur yang menyumbang kepada stres, murung dan
kebimbangan ini, maka keseluruhan langkah yang dibuat oleh pasukan polis secara
responsif bahagian berkenaan adalah mengkaji dari semasa ke semasa modul
latihan, memperhebatkan lagi program-program sedia ada, khusus untuk kita,
dengan izin, address faktor-faktor tadi secara precise dan secara granular, bukan
sekadar rambang ataupun tangkap muat. Itu ialah keutamaan yang kita laksanakan
sekarang. Terima kasih."
,2.,,■1030,Dr. Kelvin Yii Lee Wuen [Bandar Kuching],Boleh satu soalan lagi?
,2.,,■1030,Timbalan Yang di-Pertua [Puan Alice Lau Kiong Yieng],"Saya jemput
Yang Berhormat Tuan Tan Hong Pin, Bakri."
,3.,,■1030,Tuan Tan Hong Pin [Bakri],"minta  Menteri Kesihatan menyatakan status
terkini dalam pelaksanaan Sistem Rekod Perubatan Elektronik (EMR) di hospital dan
klinik di seluruh negara."
,3.,,■1030,Menteri Kesihatan [Dr. Zaliha binti Mustafa],"Terima kasih Tuan Yang di-
Pertua. Saya ingin mengambil kesempatan ini untuk mengucapkan selamat
meneruskan ibadah puasa Ramadhan Kareem. Tuan Yang di-Pertua dan juga terima
kasih diucapkan kepada Yang Berhormat Bakri. Bagi proses pendigitalan di hospital,
Hospital Informative System (HIS) adalah komponen utama bagi proses kerja
pentadbiran dan klinikal di hospital.
Pelaksanaan sistem HIS@KKM di hospital KKM adalah secara berfasa
mengikut projek yang diluluskan di bawah Rolling Plan Rancangan Malaysia (RP
RMK), di mana RP4 RMKe-11 ini ada sebanyak tujuh hospital di Negeri Sembilan
akan terlibat melalui Projek EMR Kebangsaan. Manakala bagi RP2 RMKe-12,
sebanyak tujuh buah hospital KKM lagi seluruh negara akan terlibat dalam
pelaksanaan sistem HIS@KKM ini,
Digitalisasi ini di peringkat penjagaan kesihatan primer, yakni KK, telah
bermula sejak tahun 2005 dengan penggunaan sistem TPC dan seterusnya, sistem
TPC–OCHIS pada tahun 2017 di klinik kesihatan dan juga klinik pergigian secara
bersepadu. Sistem ini membolehkan semua proses perawatan pesakit daripada
pendaftaran sehingga pemberian ubat dilaksanakan secara digital dan rekod pesakit
disimpan secara elektronik.
Ini membolehkan rekod kesihatan pesakit di kongsi di mana-mana klinik
kesihatan yang menggunakan sistem yang saya sebutkan tadi, TPC–OCHIS. Data
dalam sistem ini juga digunakan untuk pelaporan bagi tujuan perancangan program
kesihatan serta membekalkan data kepada aplikasi mudah alih sebagai rekod
kesihatan sepanjang hayat.
Jadi, sehingga kini kita mempunyai 103 buah klinik kesihatan telah dilengkapi
dengan sistem TPC–OCHIS ini dan 42 buah klinik kesihatan di Negeri Sembilan akan
dilengkapi dengan sistem yang sama melalui Projek EMR Kebangsaan seperti yang
saya sebut juga tadi. Terdapat 1,027 buah klinik kesihatan yang menggunakan
sistem janji temu atas talian melalui MySejahtera.
Jadi, 370 buah klinik kesihatan menawarkan perkhidmatan klinik maya
(virtual clinic) kepada pelanggan mereka. Perancangan seterusnya adalah untuk
memperluaskan, insya-Allah semua sistem berkaitan secara lebih menyeluruh bagi
mencapai objektif sistem maklumat kesihatan bersepadu. Terima kasih."
,3.,,■1030,Tuan Tan Hong Pin [Bakri],"Terima kasih Tuan Yang di-Pertua. Tuan Yang
di-Pertua, sistem EMR ini ia sebenarnya satu inisiatif yang baik, di mana ia boleh
mengintegrasikan maklumat dan sejarah penyakit seseorang pesakit. Saya bagi
contoh, saya disebabkan oleh faktor kerjaya..."
,3.,,■1030,Timbalan Yang di-Pertua [Puan Alice Lau Kiong Yieng],"Terus kepada
soalan."
,3.,,■1030,Tuan Tan Hong Pin [Bakri],"Saya hendak bagi latar belakang supaya Yang
Berhormat Menteri boleh faham ya. Saya pergi ke Hospital Kluang, saya isi satu
borang. Kemudian saya pindah ke Hospital Johor Bahru, terpaksa saya mengulangi
dan doktor terpaksa membuang masa untuk bertanya berkenaan dengan sejarah
penyakit saya.
Jadi, sejauh manakah- sebab saya lihat Yang Berhormat Menteri tadi kata
sejak tahun 2005 kita dah ada sistem ini. Jadi, sejauh manakah sistem ini boleh
berintegrasi sepenuhnya? Apakah kekangan dan cabaran yang dihadapi
menyebabkan sehingga hari ini keadaan ini masih saya lihat setiap hospital bekerja
silo."
,3.,,■1030,Dr. Zaliha binti Mustafa,"Terima kasih Yang Berhormat Bakri.
Sememangnya ini ialah impian kita. Akhirnya pada satu hari kelak, semua pesakit
boleh sebenarnya menyimpan mereka punya rekod perubatan sendiri. Apabila pergi
ke klinik mana-mana pun mereka boleh keluarkan data mereka. Jadi, sebenarnya
untuk menjawab itu, kita- sebanyak ini hanya 27.5 peratus sahaja hospital yang telah
mempunyai sistem pengurusan pesakit umum dan hanya 9.5 peratus klinik
kesihatan, 4.4 peratus lagi klinik pergigian yang mempunyai sistem yang saya
sebutkan tadi TPC – OCHIS.
Jadi, cabaran utama kami sebenarnya untuk mendapat ataupun
menyediakan pendigitalan yang menyeluruh ini, kita perlukan bajet yang sangat
tinggi, Yang Berhormat. Bajet itu kadang-kadang boleh mencecah kepada bilionlah.
Jadi, pelaksanaan ini kenapa ia- apakah sebenarnya yang menyumbang kepada
bajet yang tinggi itu ialah kerana ia perlukan naik taraf infrastruktur. Jadi, bangunan
pun perlu sesuai kalau kita hendak menggunakan sistem pendigitalan ini, dengan
pendawaiannya dan sebagainya.
Kemudian, peralatan. Kadang-kadang peralatan kita itu ialah peralatan yang
lama. Jadi, kita kena naik tarafkan peralatan dengan sama ada membaik pulih
ataupun kita kena cari yang baharu. Itu pun menyumbang kepada keperluan bajet
yang tinggi. Of course, yang lainnya adalah sistem itu sendirilah, sistem, kemudian
sistem cloud dan sebagainya.
Jadi, ini yang kadang-kadang maknanya kita memerlukan juga of course,
akhirnya pelaksanaan yang tuntas ini ataupun yang universal thing moving forward,
kita juga memerlukan daripada kerjasama daripada Kementerian Kewangan, insya-
Allah. Terima kasih."
,3.,,■1030,Dato' Dr. Zulkafperi bin Hanapi [Tanjong Karang],"Terima kasih Tuan
Yang di-Pertua. Rekod perubatan ataupun HIS memang kita yakin dapat membantu
mengurangkan kesesakan di hospital-hospital, terutama di unit kecemasan dan juga
di klinik-klinik kesihatan. Akan tetapi ia tidak bermakna sekiranya kekurangan doktor-
doktor dan kakitangan-kakitangan perubatan itu tidak mampu menampung jumlah
pesakit yang ramai. Jadi, saya ingin bertanya di sini. Apakah justifikasinya apabila
