level_1,level_2,level_3,timestamp,author,speech
saya faham ada rentetan-rentetan financial constraint dengan izin, yang kita terpaksa
berbuat demikian. Akan tetapi isunya tidak ada yang kita tidak bayar. Segalanya
berjalan dengan baik cuma jadual itu dari semasa ke semasa perlu kita perbaiki untuk
memastikan pemain industri dan bekalan tidak tertangguh di peringkat pengilang.
Yang Berhormat Tumpat menyatakan tentang ketirisan di sempadan. Saya
faham. Golok, Yang Berhormat bukan mudah. Bukan saja minyak, banyak lagi. Jadi,
itu adalah suatu komitmen kolaborasi bukan hanya KPDN tetapi KDN, Kementerian
Pertahanan dan agensi-agensi lain turut kita perkasakan, kita perkukuhkan daripada
semasa ke semasa. Saya tertarik dengan pandangan Yang Berhormat Tumpat
tentang pendidikan kepenggunaan dan dengan halangan pegawai-pegawai yang
tidak boleh ditambah, JPA bukan tak mahu tambah. Kita simpati dengan doktor
sebagai contoh yang begitu ramai. Akan tetapi untuk menambah pegawai pada
ketika bukan suatu yang kita boleh buat.
Namun begitu saya rasa di pejabat Ahli Parlimen ataupun ADUN, KPDN bila-
bila masa boleh memberikan ataupun kita boleh mengadakan mungkin wacana
ataupun suatu kursus ataupun suatu dialog tentang kepenggunaan. Dalam pejabat-
pejabat Ahli Parlimen, termasuk Yang Berhormat Tumpat perlu kepada program ini,
kita dari semasa ke semasa boleh memberikan ataupun kita boleh menampilkan
tokoh-tokoh ataupun mereka yang pakar dalam bidang kepenggunaan.
Saya faham Yang Berhormat, dalam Islam sendiri tentang kepenggunaan ini
masih banyak yang perlu kita capai. Ada komen yang begitu kritikal tentang
perbelanjaan kita pada bulan Ramadan. Ini daripada kita kecil dulu sampai sudah
bercucu itulah isunya. Kenapakah kita harus membazir di bulan Ramadan? Itu
memerlukan pada satu sistem pendekatan yang holistik yang melibatkan
Kementerian Pendidikan juga supaya kita ditarbiah kembali mungkin Yang
Berhormat, untuk kita lebih sedar tentang bagaimana kita harus berbelanja dan tidak
berlakunya pembaziran khususnya pada bulan yang mulia ini.
Kemudian juga saya setuju dengan Yang Berhormat Tumpat tentang
monopoli. Bukan sekadar − perkara ini kita telah bergerak. BERNAS sebagai contoh
walaupun bukan bidang kuasa saya tapi ada lima tahun lagi. PUSPAKOM kita akan
tamat pada bulan hadapan. Pharmaniaga juga dan juga ada beberapa yang lain.
Touch 'n Go, kementerian KPDN telah membuat keputusan sekarang ini kita buka
kepada players, pemain-pemain baharu untuk lebih bersedia untuk kita membuat
suatu langkah yang lebih proaktif supaya kita dapat memastikan pengguna akhirnya
yang akan dapat faedah apabila monopoli ini dapat kita tamatkan.
Kemudian tentang inovasi tentang promosi barangan Malaysia ini Yang
Berhormat, kita sentiasa sebenarnya membuat banyak kempen-kempen beli
barangan Malaysia ini. Ini tidak pernah berhenti. Dalam kita menjelajah khususnya
Jelajah Rahmah ini kita tetap akan mengutamakan barang-barang tempatan
Malaysia. Semalam sebagai contoh Tuan Pengerusi, KPDN memberikan geran
hampir RM2.6 juta kepada pemain industri direct selling, dengan izin dan franchise.
Yang menggembirakan kami adalah dalam kalangan yang menerima geran itu
hampir ada 400 orang pemain industri direct selling ini hanya 18 peratus sahaja
syarikat milik asing.
Yang lain itu adalah merupakan syarikat-syarikat tempatan yang produk-
produk Malaysia ini sebenarnya telah sama taraf, sama baik kualitinya, brandingnya,
packagingnya dengan syarikat-syarikat antarabangsa. Beberapa jenama tempatan
tentang kosmetik dan herbs boleh lawan sudah Max Factor, L’oreal sudah boleh
lawan dari segi labelingnya dan juga kualiti.
Ini kerajaan melalui KPDN sentiasa memberikan promosi, geran dan inisiatif
untuk anak-anak tempatan ini dapat melahirkan produk-produk yang lebih baik. Yang
Berhormat Hulu Terengganu, ini saja ini. Dia dulu pernah duduk di sini juga. Okey,
cadangan baharu subsidi bersasar ini memang saya sudah sebut dalam
penggulungan kita just the matter of time. NACCOL telah membuat segala persiapan,
data-data daripada ICU, PMO, DOSM sendiri, KPDN sendiri, JPJ dan juga
Kementerian Perladangan dan Komoditi. Kita sudah siap dengan segala data untuk
kita laksanakan subsidi bersasar ini.
Kita yakin dengan fakta-fakta yang dikemukakan sekiranya kita berjaya untuk
melaksanakan targeted subsidy ini kerajaan memang dapat berjimat hampir ke paras
kalau RM50 bilion itu agak melampau. Kalau RM30 bilion itu biasanya kita dapat
selamatkan. Kalau kita benar-benar melakukan dapat melaksanakan subsidi
bersasar ini secara efisien. Berhubungan dengan itu kami telah membawa segala-
galanya dalam NACCOL dan NACCOL pun sudah bawa dalam Kabinet tetapi kita
hanya menunggu sahaja masa yang sesuai untuk kita melaksanakannya.
Akan tetapi dalam apa-apa pun modal business, corporate ataupun mana-
mana mereka yang faham tentang industri ataupun economist yang memberikan
pandangan, pendekatan yang paling baik adalah soft-landing, dengan izin.
■1530
Tidak boleh harsh landing lah. Jadi, kita kena ada tempoh masa, tempoh notis
dan tempoh pendidikan yang harus kita berikan konsultasi dengan pemain industri
supaya apabila kita mengadakan targeted subsidy ini, nanti tidak ada yang
mengalami kerugian ataupun berlakunya disruption at the market level. Itu yang
penting untuk kita fahami.
Yang Berhormat Hulu Terengganu, tentang apa yang disebut oleh Yang Amat
Berhormat Perdana Menteri tentang ketirisan itu. Saya pun telah membawanya
dalam meeting Kabinet dan YABPM mengatakan beliau ada fakta dan beliau ada
segala data. Jadi, kalau dalam beberapa sesi akan datang ini, kalau ada PMQ yang
beliau sendiri akan jawab tentang question itu, saya rasa biar beliau sendiri yang
menjawabnya kerana beliau yang menyatakan fakta itu. Kita telah membekalkan
fakta dan beliau bertanggungjawab untuk menyatakan bahawa memang berlaku
ketirisan yang mengakibatkan dalam isu diesel itu. Sekian, terima kasih.
Tuan Pengerusi [Dato' Ramli bin Dato' Mohd Nor]: Terima kasih Yang
Berhormat Menteri. Yang Berhormat Menteri, saya ada satu kemusykilanlah. Ini perlu
diperbetulkan kerana apa yang diluluskan di dalam Dewan ini ialah keabsahan.
Kementerian Yang Berhormat Menteri, adakah Kementerian Perdagangan Dalam
Negeri dan Hal Ehwal Pengguna ataupun Kementerian Perdagangan Dalam Negeri
dan Kos Sara Hidup? Ini hendak kena betulkan ini.
Datuk Seri Salahuddin bin Ayub: Secara rasminya apabila Yang Amat
Berhormat Perdana Menteri mengumumkan senarai Kabinet baharu, nama yang
diberikan adalah Kementerian Perdagangan Dalam Negeri dan Kos Sara Hidup.
Akronimnya ialah KPDN.
Tuan Pengerusi [Dato’ Ramli bin Dato’ Mohd Nor]: Yang Berhormat
Timbalan Menteri Kewangan.
Datuk Seri Haji Ahmad bin Haji Maslan: Kita menggunakan nama lama
sebab ini ialah tahun sudah.
Tuan Pengerusi [Dato' Ramli bin Dato' Mohd Nor]: Baik.
Datuk Seri Salahuddin bin Ayub: Bajet tambahan.
Datuk Seri Haji Ahmad bin Haji Maslan: Ini bajet tambahan untuk tahun
sudah. Jadi, kita mengekalkan penggunaan nama lama. Belum lagi kita tukar nama
baharu. Ini bererti apa yang dibentangkan ini adalah tepat kerana ia kisah tahun
sudah.
Tuan Pengerusi [Dato' Ramli bin Dato' Mohd Nor]: Baik, baik.
Datuk Seri Haji Ahmad bin Haji Maslan: Baik.
Tuan Pengerusi [Dato' Ramli bin Dato' Mohd Nor]: Ini kerana saya perlu
memastikan rekod ini benar dan diabsahkan perbelanjaan rakyat ini. Terima kasih
kedua-dua Yang Berhormat Menteri dan Yang Berhormat Timbalan Menteri. Kita
terus ke perkara yang berikutannya.
Ahli-ahli Yang Berhormat, masalahnya ialah bahawa wang sejumlah
RM2,058,146,000 untuk Kepala B.25 Anggaran Perbelanjaan Mengurus Tambahan
Pertama 2022 jadi sebahagian daripada Jadual hendaklah disetujukan.
[Masalah dikemuka bagi diputuskan, dan disetujukan]
[Kepala B.25 diperintah jadi sebahagian daripada Jadual]
Tuan Pengerusi [Dato' Ramli bin Dato' Mohd Nor]: Masalahnya ialah
bahawa perbelanjaan di bawah Kepala P.25 Anggaran Perbelanjaan Pembangunan
Tambahan Pertama 2022 hendaklah diluluskan.
[Masalah dikemuka bagi diputuskan, dan disetujukan]
[Kepala P.25 jadi sebahagian daripada Anggaran Perbelanjaan
Pembangunan Tambahan Pertama 2022]
Tuan Pengerusi [Dato' Ramli bin Dato' Mohd Nor]: Ahli-ahli Yang
Berhormat, kita ke kementerian yang berikutannya. Kementerian Kerja Raya.
Tuan Pengerusi [Dato' Ramli bin Dato' Mohd Nor]: Kepala Pembangunan
P.27 di bawah Kementerian Kerja Raya dibuka untuk dibahas.
Tuan Sanisvara Nethaji Rayer a/l Rajaji [Jelutong]: Sebelum itu Tuan
Pengerusi, ada isu peraturan.
Tuan Pengerusi [Dato' Ramli bin Dato' Mohd Nor]: Ya, Yang Berhormat
Jelutong. Peraturan mana? Ini sebab peraturan ini, kena layan.
Tuan Sanisvara Nethaji Rayer a/l Rajaji [Jelutong]: Peraturan 99.
Tuan Pengerusi [Dato' Ramli bin Dato' Mohd Nor]: Ya?
Tuan Sanisvara Nethaji Rayer a/l Rajaji [Jelutong]: Peraturan 99.
Tuan Pengerusi [Dato' Ramli bin Dato' Mohd Nor]: Nombor 9?
Tuan Sanisvara Nethaji Rayer a/l Rajaji [Jelutong]: Peraturan 99, Tuan
Pengerusi.
Tuan Pengerusi [Dato' Ramli bin Dato' Mohd Nor]: Peraturan 99. Ya, Yang
Berhormat Jelutong. Apa ia?
Tuan Sanisvara Nethaji Rayer a/l Rajaji [Jelutong]: “Keputusan Tuan Yang
di-Pertua berkenaan dengan sebarang perkara tafsir dalam mana-mana jua
Peraturan Mesyuarat ini atau berkenaan dengan kelaziman adalah muktamad
kecuali jika ada usul bersendiri menentang keputusan Tuan Yang di-Pertua...”
Kelmarin, ketika itu Tuan Pengerusi mempengerusikan Majlis Mesyuarat dan
kita membincangkan ketika itu rang undang-undang, dengan izin, anti-stalking,
undang-undang mengendap. Ketika itu, Yang Berhormat Kota Bharu telah
membangkitkan isu bahasa dan mempertikaikan rang undang-undang yang telah
dibentangkan dan Tuan Pengerusi telah membuat ruling.
Selepas Tuan Pengerusi membuat ruling, Tuan Pengerusi juga telah
meminta Besut meninggalkan Dewan kerana Besut tidak mematuhi arahan yang
dikeluarkan atau petua Tuan Pengerusi. Hari ini telah tular satu TikTok, di mana
Besut dan juga Pendang mengadakan satu sidang akhbar di luar Dewan dan
mengeluarkan kenyataan-kenyataan bahawa Kerajaan Pakatan Harapan tidak
menghormati bahasa Melayu. Majoriti rakyat Malaysia yang merupakan orang-orang
Melayu mungkin tidak diberikan penghormatan disebabkan rang undang-undang itu
tidak dibentangkan dalam bahasa Malaysia.
Tuan Pengerusi, ini ialah perkara yang begitu serius. Kita tidak pernah
menafikan keutamaan bahasa Malaysia sebagai bahasa ibunda kita. Petua yang
dibuat oleh Tuan Pengerusi adalah begitu jelas. Cuma, saya terkilan. Kenapakah
Yang Berhormat Pendang dan Yang Berhormat Besut, keluar daripada Dewan?
Bukannya mana-mana pihak yang membuat keputusan, Tuan Pengerusi yang telah
membuat keputusan. Keputusan ini dibuat oleh Kerajaan Perpaduan. Seperti yang
dititahkan oleh tuanku. Saya rasa dukacita dengan tindakan Yang Berhormat
Pendang dan Yang Berhormat Besut yang tidak ada di Dewan.
Akan tetapi TikTok itu telah menjadi viral. Saya fikir ini sudah ada rancangan
untuk menggunakan TikTok itu dalam pilihan raya enam buah negeri yang akan
datang. Jadi, saya mahu menuntut sekarang supaya tindakan tegas diambil supaya
perkara ini tidak menjadi polemik di luar sana. [Tepuk] Seolah-olah kerajaan
sekarang tidak menghormati bahasa Melayu, tidak menghormati orang-orang
Melayu.
Yang Berhormat Pendang mengatakan bahawa kalau inilah cara kerajaan ini
mentadbir, kemungkinan hak-hak orang Melayu akan tergugat pada masa yang akan
datang. This is a serious matter, Tuan Pengerusi. You are very straightforward man.
Tuan Pengerusi merupakan seorang yang tegas dan selalu bertindak berpandukan
kepada peraturan-peraturan. Jadi, saya mohon supaya perkara ini diberikan
perhatian dan tindakan tegas diambil. Terima kasih Tuan Pengerusi.
Tuan Mohd Sany bin Hamzan [Hulu Langat]: Tuan Pengerusi, saya rasa
kita semalam semua sudah bersetuju...
Dr. Haji Abd Ghani bin Ahmad [Jerlun]: Tuan Pengerusi...
Tuan Mohd Sany bin Hamzan [Hulu Langat]: ...dengan apa yang
diputuskan oleh Tuan Pengerusi semalam. Jadi, apabila kita tengok pihak sebelah
sana buat kenyataan begitu, pada saya ia mengelirukan Dewan dan menghina
keputusan Tuan Pengerusi dan juga menghina Dewan ini. Oleh sebab itu, saya minta
supaya mereka berdua dihadapkan ke jawatankuasa khas untuk menerima
hukuman. Sekian, terima kasih.
Tuan Pengerusi [Dato' Ramli bin Dato' Mohd Nor]: Yang Berhormat...
Dr. Haji Abd Ghani bin Ahmad [Jerlun]: Tuan Pengerusi...
Tuan Pengerusi [Dato' Ramli bin Dato' Mohd Nor]: Adakah berkaitan
dengan apa yang dinyatakan oleh...
Dr. Haji Abd Ghani bin Ahmad [Jerlun]: Berkaitan, berkaitan.
Tuan Pengerusi [Dato' Ramli bin Dato' Mohd Nor]: Baik.
Dr. Haji Abd Ghani bin Ahmad [Jerlun]: Jika dilihat kepada perkara yang
telah disentuh oleh kedua-dua Ahli Parlimen kita ini, perkara ini telah pun diputuskan
dan sudah adapun tindakan. Cuba rujuk balik Peraturan Mesyuarat 18(6), Peraturan
Dewan.
Tuan Mohd Sany bin Hamzan [Hulu Langat]: Yang Berhormat, silap itu
Yang Berhormat. Bukan soal Yang Berhormat Besut. Ini soal berkaitan dengan
kenyataan Yang Berhormat Pendang dan juga kenyataan yang dikeluarkan oleh
Yang Berhormat Besut soal yang berkaitan dengan bahasa Melayu.
Dr. Haji Abd Ghani bin Ahmad [Jerlun]: Dak, dak...
Tuan Mohd Sany bin Hamzan [Hulu Langat]: Soal yang itu. Bukan soal
kena keluar selama tiga hari itu. Kena tengok isu ini dulu.
Tuan Pengerusi [Dato’ Ramli bin Dato’ Mohd Nor]: Yang Berhormat, Yang
Berhormat...
Tuan Haji Mohd Misbahul Munir bin Masduki [Parit Buntar]: Dengar dulu.
Dengar dulu, Yang Berhormat Hulu Langat.
Dr. Haji Abd Ghani bin Ahmad [Jerlun]: Dak, dak...
[Pembesar suara dimatikan]
Tuan Pengerusi [Dato' Ramli bin Dato' Mohd Nor]: Yang Berhormat, kita
berpandukan peraturan ya. Kalau kita lihat peraturan 35 itu, jelas. Hendak bercakap
berdiri. Tuan Yang di-Pertua benarkan, baru bercakap. Saya sudah benarkan Yang
Berhormat Jelutong untuk bangkitkan isu peraturan. Saya benarkan Hulu Langat
untuk bercakap juga. Saya tidak ada bantah dan apabila saya tidak bantah, itu
bermakna saya benarkanlah. Sekarang, Yang Berhormat tekan. Tekan.
[Menunjukkan isyarat tangan]
Dr. Haji Abd Ghani bin Ahmad [Jerlun]: Baik, saya hendak tarik perhatian
tentang isu yang telah di...
Tuan Pengerusi [Dato' Ramli bin Dato' Mohd Nor]: Sebentar, nanti dulu.
Saya hendak dengar Yang Berhormat Jerlun. Fasal muka baru, saya tidak cam.
Dr. Haji Abd Ghani bin Ahmad [Jerlun]: Okey. Baik. Saya hendak tarik
perhatian Dewan...
Tuan Pengerusi [Dato' Ramli bin Dato' Mohd Nor]: Okey, Yang Berhormat
Jelutong– Sebentar, sebentar. Saya tidak habis lagi. Saya tidak habis lagi. Sabar.
Saya sudah benarkan Yang Berhormat Jelutong bercakap menyampaikan
hasratnya. Saya sudah benarkan Yang Berhormat Hulu Langat menyatakan.
Sekarang, yang lain-lain itu tolonglah diam. Jadi, kita dapat dengar. Sekarang Yang
Berhormat Jerlun. Silakan, apa yang tersirat dalam hati.
Dr. Haji Abd Ghani bin Ahmad [Jerlun]: Baik. Saya ingin...
Tuan Pengerusi [Dato' Ramli bin Dato' Mohd Nor]: Selepas itu, biar saya
pula bercakap. Kita ikut aturanlah ya. Silakan.
Dr. Haji Abd Ghani bin Ahmad [Jerlun]: Baik, saya merujuk peraturan
Dewan yang telah menyebut Perkara 18(6) iaitu perkara yang sama tidak boleh
dibangkitkan selepas diputuskan oleh Tuan Pengerusi. Jadi, dalam isu ini, jika
dibangkitkan semula, ia akan mencacatkan perbahasan kita kerana perkara yang
ditolak itu telah pun dilaksanakan.
■1540
Hukuman telah dikeluarkan. Pihak-pihak telah bertindak sepertimana yang
diarahkan. Soal apa yang berlaku di luar Dewan itu tidak bolehlah dibawa semula
untuk dibincangkan. Oleh sebab, isu pokok yang dibincangkan dalam Dewan ini
sudah ada keputusan. Bila sudah ada keputusan, perkara yang sama tidak perlu
diulang. Itu Peraturan Mesyuarat 18(6), Tuan Pengerusi. Sekian.
Tuan Pengerusi [Dato’ Ramli bin Dato’ Mohd Nor]: Baik. Terima kasih
Yang Berhormat Jerlun. Saya mengambil maklum ketiga-tiga Yang Berhormat punya
apa yang telah dinyatakan. Beginilah, saya berpandu balik pada Perlembagaan. Di
dalam ini tidak ada tindakan boleh diambil. Di luar Dewan itu kita subjek dengan izin,
subject to the civil law. Hendak saman kah, hendak apa kah, itu hak individu setiap
rakyat. [Tepuk] Di dalam Dewan ini, jika mana-mana Yang Berhormat terkilan, kita
ada peraturan juga. Usul-usul boleh dibangkitkan. Keputusan saya muktamad. Jalan
43 ada, 99 ada, 99A ada ya.
Saya selesaikan Yang Berhormat Jelutong punya dulu ya. Yang Berhormat
Jelutong, jika ada terkilan tentang apa yang telah dinyatakan, apa yang telah berlaku,
sila buat usul secara bertulis. Benda itu boleh dikaji semula dan Tuan Yang di-Pertua
boleh memutuskan. Selesai ya Yang Berhormat Jelutong.
Yang Berhormat Hulu Langat, sebagai sokongan kepada apa yang telah
dinyatakan oleh Yang Berhormat Jelutong, sila buat usul juga. Kalau tidak kepuasan
hati.
Yang Berhormat Jerlun, apa yang dinyatakan oleh Yang Berhormat Jerlun itu
memang fakta. Jadi, jika ada kesilapan ataupun ada kesilapan kah dan sebagainya
ketidakpuasan hati, kita tumpukan balik kepada ini. [Sambil menunjukkan senaskhah
dokumen] Benda-benda tiga perkara ini saya telah jelaskan dan sedemikian, kita
baliklah kepada Aturan Urusan Mesyuarat kita. Saya dah jelaskan ya. Janganlah
berangkut-angkutan lagi. Tidak puas hati dalam Dewan, usul. Di luar you are, dengan
izin you are subjected to the civil law. Faham? Faham?
Ahli-ahli: Faham.
Tuan Sanisvara Nethaji Rayer a/l Rajaji [Jelutong]: Tuan Pengerusi...
Tuan Pengerusi [Dato’ Ramli bin Dato’ Mohd Nor]: Kita balik kepada
urusan Majlis.
Tuan Sanisvara Nethaji Rayer a/l Rajaji [Jelutong]: Berterima kasih pada
petua yang dikeluarkan. Cuma, satu lagi perkara yang saya hendak minta. Kalau
perkara ini tidak dibawa kepada perhatian Dewan yang mulia ini, bukankah kita
membenarkan Ahli-ahli Parlimen selepas menerima arahan ataupun petua Tuan
Pengerusi untuk keluar dan membuat kritikan terhadap Tuan Pengerusi? Adakah ini
perkara yang boleh kita benarkan dan menggunakan video itu untuk rancangan jahat
politik mereka?
Tuan Pengerusi [Dato’ Ramli bin Dato’ Mohd Nor]: Yang Berhormat, kita
putuskan di sini. Saya telah bercakap tadi. Kalau ia berkaitan saya sebagai jawatan
saya as, dengan izin the job that I’m doing bestowed by the Parliament dengan izin
hak sebagaimana dalam Peraturan Parlimen kita, saya telah putuskan tadi. Jika saya
terkilan di luar, dia telah buat. Terpulang kepada diri saya sama ada untuk membawa
perkara itu atau tidak. [Tepuk]
Dato’ Rosol bin Wahid [Hulu Terengganu]: Setuju, setuju Tuan Pengerusi.
Tuan Pengerusi [Dato’ Ramli bin Dato’ Mohd Nor]: Baik. Okey, Yang
Berhormat.
Dato’ Rosol bin Wahid [Hulu Terengganu]: Yang Berhormat Jelutong,
buat-buat tidak faham. Terima kasih Tuan Pengerusi.
Tuan Pengerusi [Dato’ Ramli bin Dato’ Mohd Nor]: Yang Berhormat
berkaitan dengan Peraturan? Kalau tidak ada, duduk. Okey, kita balik kepada urusan
kita. Dah tersasul dah kementerian. Balik ya kepada kementerian yang berikutannya
iaitu kementerian yang ketujuh. Kementerian Kerja Raya.
Kepala P.27 [Anggaran Pembangunan (Tamb.) (Bil.1) 2022] –
Tuan Pengerusi [Dato’ Ramli bin Dato’ Mohd Nor]: Kepala Pembangunan
27 di bawah Kementerian Kerja Raya terbuka untuk dibahas. Kalau dilihat di sini,
hanya tiga orang pembahas iaitu Yang Berhormat Kampar, Yang Berhormat Hulu
Selangor dan Yang Berhormat Rasah.
Saya persilakan Yang Berhormat Kampar untuk memulakan perbahasan.
3.44 ptg.
Tuan Chong Zhemin [Kampar]: Terima kasih Tuan Pengerusi. Saya terus
masuk ke Butiran 81000 – Membina Jalan-jalan Baru (Projek Baru). Ada tambahan
RM200 juta. Saya nampak di nota sini ia adalah untuk WCE. Okey, WCE. P.27.
Perlukan tambahan RM200 juta ini untuk pengambilan tanah untuk WCE, peruntukan
secara pinjaman di mana syarikat akan bayar balik pinjaman ini. Jadi, saya hendak
tanya perincian ini. Sejumlah RM200 juta ini untuk pengambilan tanah di kawasan
mana dan berapa besar kawasannya? Bilakah jumlah ini akan dipulangkan kepada
pihak kerajaan?
Bercakap tentang WCE, saya rasa WCE memang ada fungsinya untuk
kurangkan kesesakan di PLUS. Akan tetapi, kita tidak dapat nafikan laluan utama
yang kebanyakan pengguna lebuh raya pakai masihlah Lebuhraya PLUS, Lebuhraya
Utara-Selatan. Saya rasa masalah sekarang bukankah kita bukan hendak hapuskan
tol.
Saya rasa pengguna lebuh raya sekarang boleh terima kita bayar tol tetapi
lepas bayar tol kita tidak mahu ada satu lebuh raya yang tidak selamat dan satu lebuh
raya yang sesak. Oleh sebab, dua minggu lepas atau tiga minggu lepas setiap
minggu saya balik kawasan Ahad hendak balik ke KL dari Kampar sampai ke KL
sesak lima hingga enam jam.
Ia sudah jadi satu amalan. Sudah jadi normalize. Dahulu semasa hari cuti kita
jam. Akan tetapi sekarang hari biasa hari Isnin, Selasa, Rabu pun jam. Kenapa? Ini
kerana sekarang jumlah kenderaan yang ada di atas lebuh raya terlalu banyak dan
kalau kita tengok kawasan Tuan Pengerusi di Tapah. Di Tapah hanya dua laluan
sahaja, dua lane. Dari Tapah sehingga masuk Simpang Pulai sampai Ipoh. Lepas
Ipoh kita naik ke Kuala Kangsar ada bukit-bukit semua. Kita hendak masuk Menora
Tunnel. Jadi, kawasan-kawasan ini adalah kawasan yang paling sesak.
Jadi, saya rasa sudah 20 hingga 30 lebih tahun kita bina lebuh raya PLUS.
Saya rasa masa sudah sampai kita akan adakan satu penilaian pada ke seluruh
Lebuhraya PLUS di mana kawasan-kawasan yang kita perlu upgradekan. Kalau dua
lorong tambah tiga lorong. Tiga lorong tidak cukup tambah empat lorong dan ...
Tuan Haji Azli bin Yusof [Shah Alam]: Yang Berhormat Kampar, mohon.
Tuan Chong Zhemin [Kampar]: Ya. Boleh.
Tuan Haji Azli bin Yusof [Shah Alam]: Saya percaya Yang Berhormat
Kampar juga ada menggunakan laluan-laluan di West Coast ini untuk pulang sekali
sekala. Kalau di bahagian Selangor, ada bahagian yang sekarang ini masih lagi
tertangguh iaitu di laluan daripada Ijok ke Tanjong Karang. Ini sudah lama dah.
Laluan lain semua sudah siap. Akan tetapi yang situ sahaja masih lagi tertangguh.
Setuju kah Yang Berhormat Kampar supaya perkara ini kita segerakan supaya ia
akan memberi kemudahan kepada masyarakat semua?
Tuan Chong Zhemin [Kampar]: Ya, itu saya setujulah sebab kawasan itu
memang kita perlu tambahkan. Jadi, sebenarnya...
Datuk Seri Dr. Dzulkefly bin Ahmad [Kuala Selangor]: Yang Berhormat
Kampar boleh?
Tuan Chong Zhemin [Kampar]: Ya, boleh.
Datuk Seri Dr. Dzulkefly bin Ahmad [Kuala Selangor]: MP Kuala Selangor
ini.
Tuan Chong Zhemin [Kampar]: Boleh, boleh.
Datuk Seri Dr. Dzulkefly bin Ahmad [Kuala Selangor]: Ini kerana ada
kaitan dengan Kuala Selangor Tuan Pengerusi. Lebuhraya Persisiran Pantai Barat
(WCE) ini yang merentasi Jalan Kuala Selangor, Kampung Kantan, Bestari Jaya,
Rawang atas jalan negeri B33 ya, berdekatan dengan Kampung Asahan, tiada
kemudahan laluan masuk keluar lebuh raya. Sekali gus ia dengan tiada laluan
interchange itu maka, pembangunan ataupun limpahan pembangunan tidak dapat
dikecapi oleh kawasan itu, Tuan Pengerusi.
Cadangannya adalah untuk mengadakan interchange di atas LATAR yang
sudah pun. Jadi, maknanya itu interchange berhampiran dengan lebuh raya di situ.
Dengan kata lain, kalaulah boleh kiranya WCE mengambil pertimbangan untuk
diwujudkan interchange atas B33 Kampung Asahan itu kerana ia boleh memberikan
banyak kemudahan termasuklah limpahan ekonomi di kawasan itu, Tuan Pengerusi
dan untuk diadakan interchange di LATAR itu sudah tidak bermakna lagi dari segi
impak ekonomi. Terima kasih Tuan Pengerusi atas kebenaran ini.
Tuan Chong Zhemin [Kampar]: Okey, terima kasih. Saya masuk dalam
ucapan saya. Saya hendak tambah sedikit. Oleh sebab, tadi saya cakap tentang dari
Tapah sampai ke kawasan Menora Tunnel tetapi sekarang kita ada satu rancangan
dari WISE. Saya telah bangkit semasa perbahasan dalam bajet dan juga saya ada
terima jawapan daripada Yang Berhormat Menteri Kerja Raya bahawa kelulusan
WISE ini hanya secara prinsip sahaja.
Jadi, saya hendak dapat satu kepastian sebab Kerajaan Negeri Perak tahun
lepas telah umum bahawa tahun ini September akan mula pembinaan West Ipoh
Span Expressway (WISE). Akan tetapi, West Ipoh Span Expressway ini dia hanya
bina dari Gopeng masuk Kuala Kangsar, masuk Batu Gajah dan pergi Kuala
Kangsar. Akan tetapi, dia tidak selesai masalah yang kita ada dekat Tapah.
Jadi, saya buat cadangan boleh tidak kita panjangkan WISE itu dari Kuala
Kangsar masuk Batu Gajah, pergi ke Kampar dan masuk Tapah. Jadi, we kill two
birds with one stone. Kita selesai masalah di Menora Tunnel. Kita juga selesai
kawasan di Tapah. Ini kerana Tapah sekarang kalau tengok Sabtu dan Ahad jam
semua hendak masuk highway. Jadi, kalau kita boleh tambah satu susur keluar
WISE di Tapah, terus kita boleh masuk ke Kampar masuk Batu Gajah terus sampai
Kuala Kangsar.
■1550
Ini merupakan jalan yang lebih luas, jalan yang lebih lurus berbanding kepada
Lebuhraya Utara Selatan. Saya hendak dapat satu kepastian daripada kementerian
bahawa adakah projek ini telah pun lulus ataupun secara prinsip sebab jawapan
bertulis saya secara prinsip. Akan tetapi pihak kerajaan negeri telah pun buat
pengumuman bahawa September ini akan mula pembinaan. Adakah projek ini telah
diberikan secara tender terbuka ataupun rundingan terus? Ini adalah kerana ini
projek berbilion ringgit. Saya rasa Kerajaan Madani kita perlukan satu tender terbuka
untuk kita kurangkan peluang untuk ketirisan dan juga kebocoran. Itu sahaja saya
hendak bangkit. Sekian, terima kasih.
Tuan Pengerusi [Dato' Ramli bin Dato' Mohd Nor]: Terima kasih Yang
Berhormat Kampar. Dipersilakan Yang Berhormat Hulu Selangor.
3.51 ptg.
Tuan Haji Mohd Hasnizan bin Harun [Hulu Selangor]: Bismillahi Rahmani
Rahim. Assalamualaikum warahmatullahi wabarakatuh dan salam sejahtera. Terima
kasih Tuan Pengerusi. Saya terus kepada P.27 Butiran 81000 – Peruntukan
Tambahan sebanyak RM200 juta. Saya difahamkan WCE ini membantu untuk
mengurangkan kesesakan jalan raya di Lebuhraya Utara Selatan. Saya ini orang
Gopeng juga sebenarnya, orang Perak Kampar. Secara tidak langsung ia boleh
membantu untuk melancarkan perjalanan untuk balik kampung melalui jalan yang
terbaru ini.
