level_1,level_2,level_3,timestamp,author,speech
tetapi pelaksanaan subsidi ini sangat bermasalah sehinggakan petani, penternak,
semuanya ada ramai yang belum dapat. Saya hendak spesifik satu isu iaitu subsidi
untuk penternak ayam. Untuk tahun ini, mereka masih belum mendapat subsidi.
Saya mohon Kementerian Kewangan percepatkan supaya mereka tidak menjadi
mangsa.
Isu kedua adalah tentang HSR. HSR walaupun kita tahu bahawa jangka
masanya baik untuk masa depan tetapi saya cukup khuatir bahawa kemampuan
negara kita dengan hutang yang mencapai RM1.5 trilion ini, kita mungkin tidak boleh
menanggung. Walaupun kita kata memberi kepada private sector untuk buat. Akan
tetapi, kita tahu bahawa infrastruktur besar projek begitu besar ini private sector tidak
mungkin boleh menanggung hutang yang begitu besar. Jadi, akhirnya ia akan
menjadi baby kepada kerajaan.
Jadi, saya harap Yang Berhormat Menteri Kewangan kena fikir berpanjang-
panjang sebelum melaksanakan projek ini. Terima kasih."
USUL,"ANGGARAN PERBELANJAAN PEMBANGUNAN
TAMBAHAN PERTAMA 2022",,■1320,Datuk Seri Haji Ahmad bin Haji Maslan,"Terima kasih. Kita akan fikir
berpanjang-panjang."
USUL,"ANGGARAN PERBELANJAAN PEMBANGUNAN
TAMBAHAN PERTAMA 2022",,■1320,ANNOTATION,[Ketawa]
USUL,"ANGGARAN PERBELANJAAN PEMBANGUNAN
TAMBAHAN PERTAMA 2022",,■1320,Datuk Seri Haji Ahmad bin Haji Maslan,"Kita akan fikir dengan teliti mengenai HSR ini. Walau
bagaimanapun, keputusan setakat ini ialah public sector-driven ataupun syarikat
swasta yang terlibat. Jika, saya ingin memberikan maklumat tentang subsidi ini.
Izinkan saya memberikan pecahannya. Daripada RM52.7 bilion untuk Perkhidmatan
Am Perbendaharaan itu, subsidi produk petroleum RM42 bilion. Subsidi ayam dan
telur RM1.8 bilion. Jika ada syarikat-syarikat yang belum dapat itu saya kira dia
perlu− saya setuju Yang Berhormat Bayan Baru sebut tadi perlu disegerakan.
Kemudian, bayaran pelarasan Bantuan Khas Kewangan Penjawat Awam. Itu
RM1 bilion. Ini termasuklah bayaran RM700 untuk raya dan sebagainya untuk
pangkat 56 dan ke bawah. Subsidi bil elektrik. Pada tahun sudah RM5 bilion.
Pelarasan emolumen dan bantuan khas kewangan doktor lantikan kontrak RM1.2
bilion dan PTPTN untuk sukuk dan juga pinjaman, itu kita subsidi interest ialah
RM675 juta. Itu antara subsidi yang tadi ada Yang Berhormat minta pecahan.
Mengenai..."
USUL,"ANGGARAN PERBELANJAAN PEMBANGUNAN
TAMBAHAN PERTAMA 2022",,■1320,Tuan Khoo Poay Tiong [Kota Melaka],"Ya, Yang Berhormat Timbalan
Menteri."
USUL,"ANGGARAN PERBELANJAAN PEMBANGUNAN
TAMBAHAN PERTAMA 2022",,■1320,Datuk Seri Haji Ahmad bin Haji Maslan,...Yang Berhormat Bachok.
USUL,"ANGGARAN PERBELANJAAN PEMBANGUNAN
TAMBAHAN PERTAMA 2022",,■1320,Tuan Khoo Poay Tiong [Kota Melaka],"Yang Berhormat Timbalan Menteri,
boleh tanya sikit? Tadi tentang petroleum RM42 bilion itu boleh bagi pecahan tidak?
Diesel berapa? Terima kasih."
USUL,"ANGGARAN PERBELANJAAN PEMBANGUNAN
TAMBAHAN PERTAMA 2022",,■1320,Datuk Seri Haji Ahmad bin Haji Maslan,"Nanti saya dapatkan perkara itu.
Sebentar lagi. Diesel ya. Diesel RM27.2 bilion. Pada tahun 2018, RM2.11 bilion.
Pada tahun 2019, RM1.43 bilion. Pada tahun 2020− minyak rasa saya rendah pada
ketika itu maka, subsidi ini cuma RM145 juta. Pada tahun 2021, RM3.06 bilion. Pada
tahun 2022, RM20.45 bilion. Ini khusus untuk diesel sahaja Yang Berhormat Kota
Melaka.
Yang Berhormat Bachok ada menyebut tentang SPR. Saya ingin menyatakan
bahawa untuk PRU DUN enam negeri kita menganggarkan memerlukan RM420 juta.
Ini yang enam negeri yang akan datang ini. Saya bersetuju apa yang Yang
Berhormat Bachok cadangkan supaya diadakan pilihan raya itu ketika hari Sabtulah.
Kita elok hari Sabtu sebab hari Jumaat di kawasan sebelah sini tidak cuti dan yang
di sebelah Pantai Timur cuti. Jadi, elok hari Sabtu saya setuju dan saya kira SPR
juga tidak ada halangan tentang perkara itu.
Seterusnya, Yang Berhormat mana lagi. Mengenai − Yang Berhormat
Bachok menyebut bahawa jika ditarik semua subsidi ini maka inflasi sebenarnya
adalah sekitar 10 peratus. Sekarang ini inflasi sekitar 3.3 peratus dijangka pada
tahun ini. Jadi, kita ini ada masalah. Kita tarik subsidi, maka inflasi harga barang akan
meningkat. Jika, kita tidak tarik subsidi begitu banyak pembangunan yang tidak dapat
dilaksanakan kerana banyak wang hanya kita berikan pada subsidi.
Seterusnya, Yang Berhormat Kampar mengenai paradigm shift atau anjakan
paradigma zero-based budgeting ini adalah satu cadangan yang baik. Kita akan
meneliti tentang apakah lagi yang kita perlu lakukan. Walau bagaimanapun, setepat
mana pun bajet yang kita lakukan masih ada lagi kadang-kadang anggaran yang
tidak tepat atas pelbagai sebab. Sebagai contoh, banjir besar. Tahun sebelumnya
tidak banjir besar, maka anggaran bajet untuk banjir itu kuranglah. Akan tetapi, tiba-
tiba bila ada banjir besar macam baru-baru ini maka diumumkan puluhan juta di
setiap negeri yang melibatkan banjir. Maka ia juga menyebabkan bajet kita setepat
mana pun akan berlaku kekurangan. Ya, Yang Berhormat Pendang."
USUL,"ANGGARAN PERBELANJAAN PEMBANGUNAN
TAMBAHAN PERTAMA 2022",,■1320,Datuk Awang bin Hashim [Pendang],"Terima kasih sahabat saya Yang
Berhormat Pontian. Tadi, saya ada bangkitkan berkenaan dengan stimulus pakej
yang dibelanjakan oleh Kementerian Kesihatan Malaysia sebanyak RM676 juta.
Jadi, saya hendak dapatkan maklum balas atau penjelasan daripada Yang
Berhormat Pontian berkenaan dengan jawatan kontrak dalam KKM yang diserapkan
menjadi perkhidmatan tetap. Dalam perbelanjaan itu, masuk tak beberapa.
Kedua, memang Yang Berhormat Pontian ini dahulu champion GST.
Sekarang ini dalam kita mengawal revenue negara ataupun sell negara kita dalam
Perbendaharaan. Antara GST dengan SST ini mana yang boleh lebih baik mengawal
black economy ini?"
USUL,"ANGGARAN PERBELANJAAN PEMBANGUNAN
TAMBAHAN PERTAMA 2022",,■1320,Dato’ Indera Mohd Shahar bin Abdullah [Paya Besar],"Yang Berhormat
Pontian."
USUL,"ANGGARAN PERBELANJAAN PEMBANGUNAN
TAMBAHAN PERTAMA 2022",,■1320,Datuk Seri Haji Ahmad bin Haji Maslan,"Detil tentang butiran perbelanjaan
Kementerian Kesihatan akan dijawab dalam peringkat Jawatankuasa sebentar lagi
oleh Yang Berhormat Timbalan Menteri Kesihatan. Mengenai black economy
tentulah Yang Berhormat Pendang pun sedia maklum bahawa GST yang
membolehkan dia mengawal black economy ini ataupun dipanggil the shadow
economy. Antara puncanya ialah satu sistem yang dipanggil sebagai input tax credit.
Apabila mereka ingin claim balik GST itu segala maklumat hendaklah diberi kepada
kastam. Kalau maklumat itu tidak lengkap, maka kastam tidak akan bayar input tax
credit ataupun GST refund.
Apabila mereka memberikan maklumat yang lengkap, di situ segala
pengurangan cukai dan sebagainya dapat dikurangkan. GST boleh mengurangkan
daripada 30 bilion jika satu pertiga, dua pertiga GST boleh mengurangkan ekonomi
gelap. GST boleh mengurangkan ekonomi gelap sehingga dua pertiga daripada
jumlah ekonomi gelap itu."
USUL,"ANGGARAN PERBELANJAAN PEMBANGUNAN
TAMBAHAN PERTAMA 2022",,■1320,Dato’ Indera Mohd Shahar bin Abdullah [Paya Besar],"Yang Berhormat
Timbalan Menteri, sikit."
USUL,"ANGGARAN PERBELANJAAN PEMBANGUNAN
TAMBAHAN PERTAMA 2022",,■1320,Timbalan Yang di-Pertua [Puan Alice Lau Kiong Yieng],"Masa sudah
tamat Yang Berhormat Timbalan Menteri."
USUL,"ANGGARAN PERBELANJAAN PEMBANGUNAN
TAMBAHAN PERTAMA 2022",,■1320,Datuk Ahmad Amzad bin Mohamed @ Hashim [Kuala Terengganu],Kuala Terengganu.
USUL,"ANGGARAN PERBELANJAAN PEMBANGUNAN
TAMBAHAN PERTAMA 2022",,■1320,Dato’ Indera Mohd Shahar bin Abdullah [Paya Besar],Boleh?
USUL,"ANGGARAN PERBELANJAAN PEMBANGUNAN
TAMBAHAN PERTAMA 2022",,■1320,Datuk Seri Haji Ahmad bin Haji Maslan,"Yang Berhormat Kuala
Terengganu."
USUL,"ANGGARAN PERBELANJAAN PEMBANGUNAN
TAMBAHAN PERTAMA 2022",,■1320,Dato’ Indera Mohd Shahar bin Abdullah [Paya Besar],"Yang Berhormat
Timbalan Menteri, sikit."
USUL,"ANGGARAN PERBELANJAAN PEMBANGUNAN
TAMBAHAN PERTAMA 2022",,■1330,Datuk Seri Haji Ahmad bin Haji Maslan,"Saya ada nota semua ini. Terima
kasih kerana Yang Berhormat Kuala Terengganu kerana menyokong Fiscal
Responsibility Act (FRA). Betul kenyataan Yang Berhormat Kuala Terengganu
bahawa ada usaha-usaha mengenai vape ini. Akan tetapi kita ingin meneruskan
juga. Bilakah kita akan teruskan cukai ini? Ada pandangan supaya vape itu
dikeluarkan daripada jadual racun. Apabila vape itu dikeluarkan daripada jadual
racun, tindakan Kementerian Kesihatan kita boleh terus melaksanakan cukai untuk
vape.
Yang Berhormat Kuala Selangor, hutang yang produktif, subsidi bersasar
perlu disegerakan dan perbezaan harga antara negara kita dengan negara jiran itu
menyebabkan banyak ketirisan, betul berlaku. Saya pernah menyebut di sini
bagaimana apabila saya pergi ke Sabah dan berbincang dengan Kastam Sabah,
pada hari yang saya hadir itu terdapat tangkapan 200,000 liter diesel di Lautan
Semporna oleh pihak kastam. Tentu hendak dibawa ke negara jiran yang harga
dieselnya lebih rendah.
Apabila saya melawat ke Bukit Kayu Hitam, bagaimana kenderaan-
kenderaan ada compartment ataupun tangki-tangki tambahan di bawah
compartment kereta itu dan ia menyebabkan ketirisan dan penyeludupan yang
ditangkap oleh Kastam di sempadan. Ini pun antara sebab kerana harga diesel kita
jauh lebih rendah dibanding dengan harga negara jiran. Begitu juga dengan RON95.
Jadi, saya kira saya telah menjawab."
USUL,"ANGGARAN PERBELANJAAN PEMBANGUNAN
TAMBAHAN PERTAMA 2022",,■1330,Tuan Chong Zhemin [Kampar],"Yang Berhormat Menteri, berkenaan
dengan SSPN tadi. SSPN."
USUL,"ANGGARAN PERBELANJAAN PEMBANGUNAN
TAMBAHAN PERTAMA 2022",,■1330,Datuk Seri Dr. Dzulkefly bin Ahmad [Kuala Selangor],"Persoalannya Yang
Berhormat Menteri. Yang Berhormat Menteri, kalau boleh minta persoalan segera
yang perlu dilaksanakan adalah the fuel marking program. Kita kembalikan semula
seperti mana pernah dilakukan dahulu."
USUL,"ANGGARAN PERBELANJAAN PEMBANGUNAN
TAMBAHAN PERTAMA 2022",,■1330,Datuk Seri Haji Ahmad bin Haji Maslan,Apa dia?
USUL,"ANGGARAN PERBELANJAAN PEMBANGUNAN
TAMBAHAN PERTAMA 2022",,■1330,Datuk Seri Dr. Dzulkefly bin Ahmad [Kuala Selangor],"Sama ada nano
technology, block chain ataupun fuel marking program yang perlu disegerakan untuk
menyelamatkan daripada ketirisan ataupun..."
USUL,"ANGGARAN PERBELANJAAN PEMBANGUNAN
TAMBAHAN PERTAMA 2022",,■1330,Datuk Seri Haji Ahmad bin Haji Maslan,"Tentunya kita akan menggunakan
teknologi yang terkini apabila kita melaksanakan sistem yang ingin kita nyatakan.
Ya, Yang Berhormat Kampar untuk penjelasan, pengecualian bagi caruman
ke dalam SSPN sehingga RM8,000 setahun akan dilanjutkan bagi tahun taksiran
2023 dan tahun taksiran 2024. Semalam dibentang di Dewan Negara oleh Yang
Berhormat Menteri Kewangan, daripada usaha pengecualian cukai caruman ini,
khusus untuk M40 dan T20 sebenarnya sehingga RM8,000 potongan cukai itu,
kehilangan hasil kepada kita ialah suku bilion ataupun RM250 juta. Walaupun kita
hilang hasil tetapi rakyat boleh membantu anak-anak mereka dalam bentuk
simpanan pendidikan. Terima kasih. Cukuplah, ya."
USUL,"ANGGARAN PERBELANJAAN PEMBANGUNAN
TAMBAHAN PERTAMA 2022",,■1330,Timbalan Yang di-Pertua [Puan Alice Lau Kiong Yieng],Terima kasih.
USUL,"ANGGARAN PERBELANJAAN PEMBANGUNAN
TAMBAHAN PERTAMA 2022",,■1330,Tuan Chong Zhemin [Kampar],"Untuk MITRA boleh tidak bagi jumlah yang
tidak disalurkan secara bertulis."
USUL,"ANGGARAN PERBELANJAAN PEMBANGUNAN
TAMBAHAN PERTAMA 2022",,■1330,Datuk Seri Haji Ahmad bin Haji Maslan,"Ya, MITRA secara bertulis, Yang
Berhormat Kampar."
USUL,"ANGGARAN PERBELANJAAN PEMBANGUNAN
TAMBAHAN PERTAMA 2022",,■1330,Timbalan Yang di-Pertua [Puan Alice Lau Kiong Yieng],"Terima kasih.
Ahli-ahli Yang Berhormat, sekarang saya kemukakan masalah kepada Majlis bagi
diputuskan. Masalahnya ialah bahawa rang undang-undang ini dibacakan kali yang
kedua sekarang hendaklah disetujukan."
USUL,"ANGGARAN PERBELANJAAN PEMBANGUNAN
TAMBAHAN PERTAMA 2022",,■1330,ANNOTATION,"[Masalah dikemuka bagi diputuskan, dan disetujukan]"
USUL,"ANGGARAN PERBELANJAAN PEMBANGUNAN
TAMBAHAN PERTAMA 2022",,■1330,ANNOTATION,"[Rang undang-undang dibacakan kali yang kedua dan diserahkan kepada
Dewan sebagai Jawatankuasa]"
USUL,"ANGGARAN PERBELANJAAN PEMBANGUNAN
TAMBAHAN PERTAMA 2022",,■1330,Timbalan Yang di-Pertua [Puan Alice Lau Kiong Yieng],"Ahli-ahli Yang
Berhormat, saya kemukakan masalah bahawa Usul di atas nama Yang Berhormat
Menteri Kewangan di dalam Aturan Urusan Mesyuarat ini diedarkan kepada
Jawatankuasa sebuah-buah Majlis hendaklah disetujukan."
USUL,"ANGGARAN PERBELANJAAN PEMBANGUNAN
TAMBAHAN PERTAMA 2022",,■1330,ANNOTATION,"[Usul dikemuka bagi diputuskan, dan disetujukan]"
USUL,"ANGGARAN PERBELANJAAN PEMBANGUNAN
TAMBAHAN PERTAMA 2022",,■1330,ANNOTATION,"[Diputuskan,
Bahawa Usul yang berikut ini dirujukkan kepada Jawatankuasa
sebuah-buah Majlis:
“Bahawa Dewan ini, mengikut subseksyen 4(3) Akta
Kumpulan Wang Pembangunan 1996 [Akta 406], membuat
ketetapan bahawa jumlah wang tambahan sebanyak enam
bilion tiga ratus tiga puluh juta satu ratus sembilan puluh
empat ribu dan sembilan ratus ringgit (RM6,350,194,900)
diperuntukkan daripada Kumpulan Wang Pembangunan bagi
tahun kewangan 2022 bagi Maksud dan Butiran (Projek)
seperti yang dinyatakan dalam ruang pertama dan kedua
Penyata Anggaran Perbelanjaan Pembangunan Tambahan
Pertama 2022 yang dibentangkan sebagai Kertas Perintah
22 Tahun 2023 dan yang disenaraikan di sebelah Maksud
dan Butiran (Projek) dalam ruang sembilan dan sepuluh
penyata tersebut.”
[Majlis bersidang dalam Jawatankuasa.
[Timbalan Yang di-Pertua (Puan Alice Lau Kiong Yieng) mempengerusikan
Jawatankuasa]
Tuan Pengerusi [Puan Alice Lau Kiong Yieng]: Minta Yang Berhormat
Menteri Kewangan mengemukakan Anggaran Perbelanjaan bagi semua
kementerian.
Timbalan Menteri Kewangan [Datuk Seri Haji Ahmad bin Haji Maslan]:
Tuan Pengerusi, saya ingin mengemukakan supaya wang sejumlah tidak lebih
daripada melebihi RM60,174,928,000 yang diperuntukkan dalam Anggaran
Perbelanjaan Mengurus Tambahan Pertama 2022 bagi Maksud-maksud Bekalan
B.4, B.10, B.11, B.12, B.14, B.21, B.25, B.42, B.60 dan B.63 untuk kementerian-
kementerian dan jabatan yang berkenaan dijadikan Jadual dan wang sejumlah tidak
lebih daripada RM6,350,194,900 yang diperuntukkan dalam Anggaran Perbelanjaan
Pembangunan Tambahan Pertama Tahun 2022 bagi Maksud-maksud
Pembangunan P.6, P.10, P.14, P.21, P.22, P.25, P.27, P.28, P.30, P.31, P.32, P.33,
P.42, P.43, P.46 dan P.62 untuk kementerian-kementerian dan jabatan yang
berkenaan seperti yang ditunjukkan dalam penyata yang dibentangkan sebagai
Kertas Perintah 21/ 2023 dan Kertas Perintah 22/ 2023 masing-masing dijadikan
Anggaran Perbelanjaan.
Tuan Pengerusi, keperluan bagi mengadakan peruntukan-peruntukan dalam
Anggaran Perbelanjaan Mengurus Tambahan Pertama 2022 dan juga Anggaran
Perbelanjaan Pembangunan Pertama 2022 telah pun dibentangkan terdahulu. Di
samping itu, penjelasan lanjut mengenai cadangan-cadangan anggaran peruntukan
tambahan ini juga diberi dalam memorandum perbendaharaan yang dibentangkan
sebagai Kertas Perintah 21A/2023 bagi Anggaran Perbelanjaan Mengurus
Tambahan Pertama 2022 dan Kertas Perintah 22A / 2023 bagi Anggaran
Perbelanjaan Pembangunan Tambahan Pertama 2022.
Oleh itu, saya tidak berhasrat hendak memberi apa-apa penerangan
tambahan lagi. Tuan Pengerusi, saya mohon mencadangkan.
Kepala B.4 [Jadual] –
Kepala P.6 [Anggaran Pembangunan (Tamb.) (Bil.1) 2022] –
Tuan Pengerusi [Puan Alice Lau Kiong Yieng]: Kepala Bekalan B.4 dan
Kepala Pembangunan P.6 di bawah Jabatan Perdana Menteri terbuka untuk
dibahas. Saya jemput Yang Berhormat Kampar.
1.37 tgh.
Tuan Chong Zhemin [Kampar]: Terima kasih Tuan Pengerusi. Saya terus
ke Butiran 93000 – Projek-projek Kecil, Jabatan Perdana Menteri. Saya nampak di
sini jumlah asalnya RM350 juta dipinda sehingga RM700 juta, bahawa kita kena
tambah lagi RM350 juta. Jadi saya hendak tanya, kenapa duit ini tidak masuk dalam
bajet asal? Oleh kerana kita sedia maklum, kerana saya maklumkan ini merupakan
Projek Mesra Rakyat (PMR) untuk Ahli Parlimen. Jadi, setiap Ahli Parlimen ada
RM3.5 juta untuk tahun lepas.
Jadi, sebenarnya kita sudah tahu bajet ini RM700 juta. Mengapa duit ini tidak
masuk dalam bajet asal dan sekarang ia ditambah kepada dalam supplementary
budget ini? Jadi, ini persoalan saya. Saya juga rasa kita perlu ada kaedah yang
baharu untuk pastikan jumlah Projek Mesra Rakyat untuk tahun ini belum umum lagi,
saya tidak tahu sama ada ada atau tidak.
Jika ada, perlu ada satu kaedah yang baharu untuk pastikan tidak ada
ketirisan dan kebocoran. Oleh kerana jika kita tidak pastikan ada ketirisan, bermakna
duit ini tidak dapat di salurkan kepada projek-projek yang rakyat perlukan. Saya
harap mungkin boleh bagi kelonggaran untuk Ahli-ahli Parlimen untuk mendapatkan
quotation dan adakan agensi yang selaras. Mungkin daripada pihak PBT ataupun
pihak pejabat tanah untuk habiskan projek ini.
Mungkin kita boleh tingkatkan jumlah projek ini, projek-projek kecil daripada
setiap projek yang jumlahnya kurang, kita boleh tingkatkan sedikit dan kita boleh buat
projek yang berimpak lebih tinggi. Itu saja cadangan saya. Saya harap cadangan ini
boleh dipertimbangkan. Sekian, terima kasih.
Tuan Pengerusi [Puan Alice Lau Kiong Yieng]: Sebelah sini, tidak ada.
Saya jemput...
Tuan Haji Muhammad Islahuddin bin Abas [Mersing]: Tuan Pengerusi.
Tuan Pengerusi [Puan Alice Lau Kiong Yieng]: Ya, Yang Berhormat
Mersing.
1.39 tgh.
Tuan Haji Muhammad Islahuddin bin Abas [Mersing]: Saya merujuk P.10
Perbendaharaan. Mengambil kira suntikan dana yang besar, mohon kerajaan
menjelaskan kemampuan modal kewangan kerajaan dalam membiayai Projek
Transit Aliran Deras (MRT3). Adakah ia melibatkan potongan peruntukan untuk
perkhidmatan rakyat?
Tuan Pengerusi [Puan Alice Lau Kiong Yieng]: Yang Berhormat Mersing,
butiran mana?
Tuan Haji Muhammad Islahuddin bin Abas [Mersing]: P.10.
Tuan Pengerusi [Puan Alice Lau Kiong Yieng]: Sekarang B.4.
Tuan Haji Muhammad Islahuddin bin Abas [Mersing]: B.4. Okey, maaf.
Tuan Pengerusi [Puan Alice Lau Kiong Yieng]: Salah butiran.
Tuan Haji Muhammad Islahuddin bin Abas [Mersing]: Okey, terima kasih.
Tuan Pengerusi [Puan Alice Lau Kiong Yieng]: Tidak apa. Saya jemput
Yang Berhormat Sungai Petani.
1.39 tgh.
Dr. Mohammed Taufiq bin Johari [Sungai Petani]: Terima kasih Tuan
Pengerusi. Sungai Petani berhasrat untuk berbahas maksud Bekalan 4 –
Suruhanjaya Pilihan Raya. Butiran 010000 – Pilihan Raya. Tuan Pengerusi, rang
undang-undang ini memperuntukkan RM84,822,600 untuk maksud Bekalan 4.
■1340
Dana ini digunakan untuk menjalankan Pilihan Raya Umum (PRU) ke-15.
Tuan Pengerusi, saya ingin menyentuh tentang kempen pilihan raya. Kita melihat
sejarah PRU ke-15 yang lepas bagaimana kempen pilihan raya ini menjadi satu
pesta demokrasi untuk negara kita. Pesta demokrasi ini diraikan bersama tidak
kiralah daripada mana parti itu datang dan ideologi yang berbeza.
Kita melihat pesta demokrasi ini hadir di peringkat lapangan baik secara terus
dan juga secara online. Kita melihat ada juga kejadian yang menyedihkan bahawa
seharusnya pesta demokrasi ini diraikan secara sihat tetapi pesta demokrasi ini telah
pun dicemari oleh beberapa kempen yang dibuat oleh pihak-pihak yang tertentu
menggunakan aplikasi TikTok, aplikasi online dan sebagainya. Bagaimana fitnah
mampu untuk membuat onar di negara kita, pelbagai fitnah dilontarkan dan
berleluasa tanpa ada kekangan.
Oleh sebab itu, kita melihat bahawa pada tahun ini juga terdapat enam buah
negeri yang akan mengadakan Pilihan Raya Negeri dan saya berharap supaya
kelakuan-kelakuan ini tidak lagi berulang. Saya ambil maklum bahawa perkara ini
tidak tertakluk di bawah Akta Kesalahan Pilihan Raya 1954 [Akta 5].
Namun begitu, saya fikir perlu ada sebuah mekanisme untuk menangani isu
ini. Perlu ada mekanisme supaya pihak SPR diberikan peruntukan kuasa yang lebih
untuk mengambil tindakan dan perlukan satu proses pemantauan yang rapi. Sebab
itu kita lihat bahawa pihak SPR hanya memantau di peringkat lapangan tetapi
bagaimana dengan kempen-kempen online yang begitu jelik dan juga melontarkan
fitnah-fitnah kerana pilihan raya ini tidak hanya semata-mata untuk memenangi
pilihan raya tetapi untuk mengekalkan keharmonian di dalam negara Malaysia
tercinta.
Datuk Seri Dr. Haji Dzulkefly bin Ahmad [Kuala Selangor]: Yang
Berhormat Sungai Petani. Laluan. Kuala Selangor.
Dr. Mohammed Taufiq bin Johari [Sungai Petani]: Ya.
Datuk Seri Dr. Haji Dzulkefly bin Ahmad [Kuala Selangor]: Terima kasih
Tuan Pengerusi. Apakah benar kita hanya ada dua kanan dan kiri dan orang lain
tidak diizinkan? Maaf, kerana bertanya dahulu.
Tuan Pengerusi [Puan Alice Lau Kiong Yieng]: Kalau nanti di sebelah sini
(kanan) tiada pembahas, saya akan bagi Yang Berhormat Kuala Selangor.
Datuk Seri Dr. Haji Dzulkefly bin Ahmad [Kuala Selangor]: Maaf kalau
saya mengambil sedikit waktu. Apakah lebih wajar kalau di peringkat Jawatankuasa
Tuan Pengerusi, kita izinkan sebab seramai mana pun Ahli Parlimen untuk berbahas
kerana ianya adalah pendek.
Tuan Pengerusi [Puan Alice Lau Kiong Yieng]: Empat orang Ahli Parlimen
sahaja.
Datuk Seri Dr. Haji Dzulkefly bin Ahmad [Kuala Selangor]: Tradisinya.
Tuan Pengerusi [Puan Alice Lau Kiong Yieng]: Sila duduk. Jangan bazir
masa.
Datuk Seri Dr. Haji Dzulkefly bin Ahmad [Kuala Selangor]: Ya?
Tuan Pengerusi [Puan Alice Lau Kiong Yieng]: Sila duduk.
Datuk Seri Dr. Haji Dzulkefly bin Ahmad [Kuala Selangor]: No. No. I’m
asking you the question. Saya bertanya.
Tuan Pengerusi [Puan Alice Lau Kiong Yieng]: Saya sudah kata kita akan
bagi empat orang Ahli Parlimen untuk membahas.
Datuk Seri Dr. Haji Dzulkefly bin Ahmad [Kuala Selangor]: Empat orang
sahaja? Okey, saya tanya dahulu. Saya akan bawakan perkara ini kepada Tuan
Yang di-Pertua.
Tuan Pengerusi [Puan Alice Lau Kiong Yieng]: Jadi, kalau Ahli Parlimen
daripada pembangkang tidak mahu ambil bahagian, saya akan bagi peluang kepada
Yang Berhormat Kuala Selangor.
Datuk Seri Dr. Haji Dzulkefly bin Ahmad [Kuala Selangor]: Baik. Saya
tanya atas isu ini dahulu.
Tuan Pengerusi [Puan Alice Lau Kiong Yieng]: Okey.
Datuk Seri Dr. Haji Dzulkefly bin Ahmad [Kuala Selangor]: Mustahak.
Yang Berhormat Sungai Petani, apakah Yang Berhormat Sungai Petani boleh
bersetuju dengan saya untuk memaknakan penglibatan Undi 18? Kita wujudkan satu
yang disifatkan sebagai pendidikan demokrasi, first time voter yang dapat
memberikan mereka pencerahan, menjauhkan mereka daripada indoktrinasi, politik
ketakutan, politik hasutan dan politik adu domba. Sangat mustahak untuk diberikan
peluang untuk mereka memahami pencerahan dalam demokrasi ini. Terima kasih.
Dr. Mohammed Taufiq bin Johari [Sungai Petani]: Terima kasih Yang
Berhormat Kuala Selangor. Saya sangat bersetuju kerana kita
mengimplementasikan Undi 18 dalam keadaan kita tidak bersedia, kita tidak
memberikan satu pendedahan bahawa yang mereka memangkah itu tidak hanya
memilih pemimpin setempat tetapi menentukan masa depan negara.
Tuan Pengerusi, saya ingin meneruskan, masih dalam butiran yang sama.
Kita melihat pada jawapan Menteri pada 28 Mac 2023, jumlah kertas undi pos dalam
dan luar negara yang dikeluarkan adalah sebanyak 365,686 keping kertas undi dan
kertas undi pos yang diterima kembali itu ialah sebanyak 311,378 iaitu 85.19 percent.
Saya ucapkan syabas dan tahniah kepada pihak SPR.
Namun begitu, tidak salah sekiranya pada masa hadapan kita menyasarkan
peratusan ini lebih tinggi? Adakah pihak SPR telah mengenal pasti punca 54,523
keping kertas undi pos yang hilang dan adakah pihak SPR ingin kita mencapai
sehingga 95 percent hingga 100 percent?
Tuan Pengerusi, sedikit. Menyentuh mengenai undian secara pos, saya ingin
tahu berapakah pengundi secara pos kategori 1B iaitu luar negara yang telah
berdaftar dan saya memohon supaya pecahan menurut negeri terutama sekali
negeri-negeri yang bakal terlibat dengan pilihan raya negeri akan datang yang akan
berlangsung pada tahun ini. Terima kasih Tuan Pengerusi.
Tuan Pengerusi [Puan Alice Lau Kiong Yieng]: Terima kasih Yang
Berhormat Sungai Petani. Saya jemput Yang Berhormat Pendang.
1.45 tgh.
Datuk Awang bin Hashim [Pendang]: Terima kasih Tuan Pengerusi. Saya
hendak menyentuh Kepala B.4 iaitu berkenaan dengan Suruhanjaya Pilihan Raya
(SPR). Saya hendak minta penjelasan daripada Yang Berhormat Menteri berkenaan
dengan SPR tentang Borang 14. Saya hendak mencadangkan supaya Borang 14 ini
diberi penekanan sebagai satu – setiap saluran yang memberi jawapan perlu
mendapatkan tandatangan. Kadang-kadang kita dapati Ketua Tempat Mengundi, dia
apabila tiada pengesahan daripada wakil-wakil parti yang bertanding dia just
menerima itu sebagai satu jawapan rasmi.
Jadi, kita minta walaupun apa sahaja Borang 14 ini diberi penekanan dan
disalin di depan wakil-wakil parti sebab Borang 14 ini banyak menimbulkan
complicated ketika membuat pengumuman official ataupun secara rasmi oleh ketua
atau RO. Itu yang kita hendak minta.
Satu lagi saya hendak memberi penekanan berkenaan dengan undang-
undang di bawah SPR, undang-undang yang dikatakan fitnah. Kita hanya
mendengar fitnah ini interpretasinya hanya sebelah pihak. Orang yang bercakap dia
kata dia tidak berkata fitnah, orang yang ditujukan kepada ungkapan-ungkapan fitnah
ini mengatakan itu fitnah. Sebelah sana pula apabila bercakap, dia kata dia tidak
fitnah. Dia membawa satu data yang betul tetapi kami yang sebelah sini pula kata itu
fitnah. Ini satu perkara yang perlu diselesaikan oleh SPR yang berkenaan dengan
fitnah seperti yang disebutkan oleh Yang Berhormat Sungai Petani tadi.
Kita nampak maksud dia ke mana. Sebab fitnah ini kalau kita tengok sebagai
contoh semasa pilihan raya, Yang Amat Berhormat Tambun pernah berceramah di
atas pentas menuduh Presiden PAS berjubah dan berserban. Tiba-tiba memfitnah
dia kata ada hubungan dengan UMNO-BN. Apabila lepas pilihan raya benda itu
berlaku, cikgu dengan anak murid, itu yang kita hendak interpretasi siapa fitnah,
siapa fitnah siapa ini? Ini perkara yang paling kita kena clear kan.
