level_1,level_2,level_3,raw_timestamp,timestamp,author,speech
RANG UNDANG-UNDANG,"RANG UNDANG-UNDANG INSTITUSI PENDIDIKAN
TINGGI SWASTA (PINDAAN) 2014
Bacaan Kali Yang Kedua dan Ketiga",,■1520,1520,Tuan Tony Pua Kiam Wee [Petaling Jaya Utara],"Terima kasih kepada Yang
Berhormat Indera Mahkota. Sebenarnya, saya tak sentuh langsung tentang *the soft part*
dari segi *character development* ataupun pembangunan akhlak seseorang dalam universiti.
Saya rasa dalam perkara ini, secara *general*, memang ada universiti yang lebih baik sikit
tetapi secara *general,* ini merupakan bidang yang langsung diabaikan oleh segala IPT.
Bukan segalalah, kebanyakan IPTS kerana ia tidak memberikan sumber kewangan kepada
sekolah-sekolah tersebut, institusi-institusi tersebut. Kalau tidak dapat wang, asalkan
mereka dapat *certificate*, saya tak kisah sama ada dia bangun, akhlak baik, tidak baik, itu
bukan masalah saya. Masalah saya adalah untuk memberikan sijil kepada dia sahaja dan
sijil ini sekurang-kurangnya tetap pada taraf yang minimum yang ditentukan oleh pihak
kerajaan, sudah cukup. Akhlak tidak masuk dalam MQA. Tidak ada akhlak dalam MQA.
Oleh sebab itu, dalam banyak IPTS ini, *character building, extra curricular activities*,
program-program luar bilik darjah tidak dijalankan secara langsung.
Dua perkara lagi Tuan Yang di-Pertua. Nombor satu adalah mengenai kursus-
kursus yang penting yang dijalankan oleh IPTS-IPTS, terutamanya kursus selain daripada
bidang undang-undang, di bidang *medical*. Selalu kita baca dalam surat khabar, MMA
punya presiden ataupun doktor-doktor yang tidak ingin dinamakan, menyebut dalam surat
khabar bahawa mutu pendidikan yang diberikan, doktor-doktor yang diterima dalam
hospital-hospital sama ada kerajaan ataupun swasta, dia punya standard sudah turun.
Ini adalah akibat, antara sebab utama ialah akibat banyak sekolah swasta tidak
melaksanakan kursus-kursus bidang *medicine* dengan mutu ataupun tahap yang
diperlukan. Antara sebab yang paling ketara sekali ialah *the qualification* ataupun minimum
*grades* yang diperlukan untuk masuk bidang *medicine*. Banyak *private college*, asal *you*
lulus sahaja, kita terima. Lulus sahaja SPM atau dapat 4A, 5A, kita terima masuk bidang
*medicine*. Malah kalau dikatakan di UM, hendak masuk bidang *medicine*, kena semua ‘A’.
Semua ‘A’, kena pergi *interview* lagi bagi SVUSM sebelum boleh masuk ke dalam bidang
*medicine* di universiti-universiti IPTA. Akan tetapi di *private college* tak sama sebab mereka
hendak yuran yang dibayar oleh pihak penuntut, dia tak kira sangat sama ada 3A
sahajakah, 4A sahaja, sudah boleh masuk dalam kursus tersebut.
Saya rasa dalam perkara ini, semua kelayakan yang diterima oleh sekolah-sekolah
tersebut, IPTS-IPTS tersebut perlu dipamerkan secara terbuka, *public.* Di negeri lain kita
tahu, kalau saya hendak pergi *Queens University, Medicine Faculty*, saya akan tahu apakah
gred minimum yang telah pun diterima, penuntut yang diterima pada tahun lalu. sama ada
3A kah, 3A *star*kah, 4A kah dan lain-lain. Akan tetapi di sini semuanya gelap, tak tahu. Saya
tak tahu sama ada Melaka punya kolej yang terima *medicine* itu, *private college,* ada dia
punya minimum *standards* sama ada 2A kah, 1A kah, tak ada ‘A’ pun boleh masukkah,
lulus pun boleh masuk, kita tidak tahu. *So,* semua ini perlu dipamerkan dan diperketat.
Ada juga banyak universiti yang ditubuhkan. Saya boleh namakan seperti Kolej
Masterskill yang banyak menjalankan kursus jururawat. Mereka bukan benar-benar hendak
mengajar dengan cukup baik tetapi mereka mempergunakan sistem tersebut untuk
mendapatkan yuran melalui PTPTN.
*So,* mereka hendak terima penuntut bukan kerana mereka mampu memberikan
pendidikan yang paling baik kepada semua bakal jururawat di sekolah tetapi mereka
menggunakan cara ini untuk mendapatkan pinjaman daripada PTPTN untuk memberikan
keuntungan kepada mereka. Mereka memang terdesak untuk mendapat keuntungan
kerana mereka merupakan syarikat yang tersenarai di Bursa Malaysia. Apabila dia punya
stok menurun, lebih terdesak lagi, mereka ingin mencapai keuntungan dan menggunakan
cara-cara yang merendahkan mutu pendidikan di Malaysia.
Akhir sekali, saya ingin membangkitkan badan yang telah pun ditubuhkan oleh
pihak kerajaan iaitu *Education Malaysia Global Services* untuk menjalankan proses-proses
bagi IPTS di Malaysia untuk menerima penuntut-penuntut daripada luar negeri. Ini proses
termasuklah *visa application*, permohonan visa, pembelian insurans, *medical check-up* dan
lain-lain.
Saya rasa dalam perkara ini, walaupun badan EMGS ini merupakan badan yang
dimiliki oleh kerajaan, kerja-kerjanya telah pun diswastakan kepada pihak-pihak yang
tertentu dan kerja ini telah pun diswastakan tanpa sebarang tender terbuka.
Mereka telah pun mengehadkan klinik-klinik yang penuntut-penuntut luar negeri
boleh datang untuk *health check-up.* Harganya semua naik, kos semua naik dan semua
IPTS yang ada di negara kita membantah dasar-dasar yang telah pun dilaksanakan oleh
EMGS. Yang Berhormat Serdang."
RANG UNDANG-UNDANG,"RANG UNDANG-UNDANG INSTITUSI PENDIDIKAN
TINGGI SWASTA (PINDAAN) 2014
Bacaan Kali Yang Kedua dan Ketiga",,■1520,1520,Dr. Ong Kian Ming [Serdang],"Okey, terima kasih Yang Berhormat Petaling Jaya
Utara. Saya hendak tanya kepada Yang Berhormat Petaling Jaya Utara sama ada Yang
Berhormat sedar bahawa EMGS ini, pertama sekali ditubuhkan dengan matlamat untuk
memasarkan Malaysia sebagai satu destinasi pendidikan tinggi dan juga pendidikan swasta
di pasaran antarabangsa.
Ini adalah sebahagian daripada *education* NKEA di bawah *Economic
Transformation Program*. Ini telah diumumkan pada tahun 2010 tetapi malangnya matlamat
EMGS ini telah dipesongkan ataupun terpesong daripada matlamat utamanya iaitu untuk
membuat Malaysia sebagai satu *international branding* dari segi *education*."
RANG UNDANG-UNDANG,"RANG UNDANG-UNDANG INSTITUSI PENDIDIKAN
TINGGI SWASTA (PINDAAN) 2014
Bacaan Kali Yang Kedua dan Ketiga",,■1530,1530,Dr. Ong Kian Ming [Serdang],"Sekarang saya dimaklumkan bahawa sebelum penubuhan EMGS ini, setiap
pelajar asing mesti bayar *processing fee* untuk visa mereka sebanyak RM250. Akan tetapi
sekarang selepas EMGS ditubuhkan, *processing fee* itu dinaikkan dengan kadar yang
begitu tinggi kepada RM1,000. Pada masa yang sama, *processing time* yang diambil oleh
EMGS pun bertambah daripada mungkin satu bulan atau dua bulan sebelum ini kepada tiga
bulan, empat bulan atau lima bulan. Ada banyak pelajar asing yang tidak boleh balik ke
negeri asal apabila *emergency* berlaku kerana visa dan juga pasport dipegang oleh EMGS.
Adakah ini menunjukkan bahawa Barisan Nasional ini telah memesongkan matlamat satu
polisi yang baik kepada satu matlamat yang mementingkan keuntungan sahaja dan
membawa nama buruk Malaysia kerana ada banyak pelajar asing yang kompelin dan
membuat pelbagai tuduhan kepada IPTS dan juga EMGS ini. Terima kasih."
RANG UNDANG-UNDANG,"RANG UNDANG-UNDANG INSTITUSI PENDIDIKAN
TINGGI SWASTA (PINDAAN) 2014
Bacaan Kali Yang Kedua dan Ketiga",,■1530,1530,Tuan Tony Pua Kiam Wee [Petaling Jaya Utara],"Terima kasih Yang Berhormat
Serdang. Saya rasa ini merupakan antara contoh-contoh di mana banyak dasar-dasar
kerajaan memang cantik dilihat dari segi dasarnya yang ditulis, tetapi bila dilaksanakan
selalunya perlu ada orang tengah untuk mendapat keuntungan. Ini menjadi masalah dan
bila ada orang tengah diberikan konsesi untuk mendapat keuntungan, pihak-pihak tertentu
sahaja akan mendapat keuntungan dan yang rugi dalam bidang ini adalah penuntut,
sekolah-sekolah IPTS dan juga penuntut-penuntut dari luar negeri.
Saya ingin memetik satu paragraf daripada satu laporan yang ada dalam *The
Edge* yang berkata mengenai EMGS bahawa, *“One industry association estimates that its
members alone are losing some 1,000 potential students from foreign countries annually.
Considering the large number of foreigners who are looking to study in Malaysia, the losses
would amount to millions of ringgit”.*
Kritikan ini merupakan satu kritikan yang serius yang telah pun diterbitkan sejak
EMGS dilaksanakan. Saya minta supaya pihak kementerian dapat mengkaji semula
pelaksanaan dasar EMGS supaya ia tidak membebankan penuntut, tidak membebankan
IPTS dan pada masa yang sama mencapai matlamat di mana EMGS ditubuhkan iaitu
mempromosikan bidang pendidikan di Malaysia. Pada masa yang sama mengawal supaya
hanya penuntut-penuntut yang ikhlas sahaja yang dibenarkan masuk ke dalam Malaysia.
Apabila saya belajar di luar negeri sama ada di Singapura atau di UK atau US,
tidak pernah pasport saya dikawal oleh kementerian yang ada dalam negara tersebut.
Kalau orang lain datang ke Malaysia hendak belajar di Malaysia, pasport kita kena dikawal
atau digantung ataupun disimpan oleh pihak kerajaan, saya rasa ini merupakan satu
perkara yang amat boleh disebutkan penghinaan kepada pihak penuntut tersebut. Jadi,
dengan itu saya ucapkan terima kasih kepada Tuan Yang di-Pertua dan kita harap
cadangan-cadangan yang konstruktif, membina yang telah pun diberikan dapat
dipertimbangkan oleh pihak kementerian. Terima kasih."
RANG UNDANG-UNDANG,"RANG UNDANG-UNDANG INSTITUSI PENDIDIKAN
TINGGI SWASTA (PINDAAN) 2014
Bacaan Kali Yang Kedua dan Ketiga",,■1530,1530,Timbalan Yang di-Pertua [Datuk Haji Ismail bin Haji Mohamed Said],"Ya Yang
Berhormat Tebrau. Dia mula dengan Yang Berhormat Pokok Sena."
RANG UNDANG-UNDANG,"RANG UNDANG-UNDANG INSTITUSI PENDIDIKAN
TINGGI SWASTA (PINDAAN) 2014
Bacaan Kali Yang Kedua dan Ketiga",,3.34 ptg.,1534,Tuan Khoo Soo Seang [Tebrau],"Terima kasih kepada Tuan Yang di-Pertua.
Tuan Yang di-Pertua, pada saya, saya berpandangan bahawa sama ada IPTA ataupun
IPTS, mereka berperanan yang sama iaitu membantu negara kita untuk menjana *human
resources* ataupun sumber manusia yang berguna. Jadi, saya rasa bahawa penjanaan
sumber manusia hendaklah mengikut keperluan pasaran. Ini yang saya sudah banyak kali
tegaskan di Parlimen mahupun di Dewan ini ataupun di Senat. Kalau kita menjana sumber
manusia mengikut keperluan pasaran, mungkin tidak berlaku ada graduan yang lama
menganggur tidak mendapat kerja.
Oleh itu, saya pernah sarankan bahawa mungkin Kementerian Sumber Manusia
dan Kementerian Pendidikan boleh bekerjasama untuk membuat unjuran keperluan sumber
manusia, buat tiga tahun hingga lima tahun yang akan datang. Unjuran itu boleh menjadi
rujukan kepada penuntut yang akan masuk ke universiti. Mereka tahu keperluan yang ada.
Kalau mereka ada minat dan bakat, mereka boleh pilih jurusan yang ada *market.*
Jadi saya ingin tanya, apakah sasaran kerajaan? Adakah kita mempunyai sasaran
setiap tahun? *Intake* penuntut universiti agaknya berapa ramai? Apakah peratus *bachelor,
master* dan PhD yang kita perlukan di antara rakyat Malaysia? Kalau ada sasaran ini,
adakah kita mempunyai *roadmap* yang tertentu untuk mencapai sasaran itu?
Tuan Yang di-Pertua, saya sebagai seorang guru, saya agak dekat dengan
penuntut-penuntut. Walaupun usia lanjut, tetapi masih dekat dengan orang muda. Saya
dapati bahawa ramai penuntut kita, pemuda pemudi kita, mereka pilih jurusan di universiti
selalunya ikut kawan. Kalau kawan-kawannya semua ramai yang hendak ambil *accounting*,
dia juga ikut *accounting*. Ramai yang ambil kejuruteraan, dia juga ikut. Ini adalah satu cara
yang tidak betul. Saya berikan contoh, bersama-sama dengan anak saya untuk belajar
*accounting*. Dia satu kumpulan, lima orang ambil *accounting*. Akhirnya yang berjaya hanya
tinggal dua, tiga lagi cicir. Jadi oleh itu, saya berpandangan bahawa Kementerian
Pendidikan haruslah sediakan guru kaunseling yang boleh berikan kaunseling kepada
penuntut, pelajar dari segi pemilihan jurusan, bukan ikut kawan-kawan.
Satu lagi yang saya dapati, ramai ibu bapa yang menggalakkan anak-anak mereka
pilih jurusan yang tertentu, pengajian yang tertentu kerana glamor. Saya berikan contoh
*medicine*, sehingga ke hari ini masih ramai ibu bapa yang mati-matian hendak anak ambil
*medicine*. Jadi walaupun sekarang kita ada *figures* tertentu yang meramalkan mungkin
penuntut *medicine* sudah terlalu ramai, mungkin satu hari mereka susah hendak jalankan
*housemanship*. Akan tetapi masih ramai pemuda kita, kalau dia masuk universiti dia ambil
*medicine*, ini glamor. Ibu bapa juga rasa glamor. Jadi ini cara yang salah. Apa yang
kerajaan boleh buat untuk betulkan ini?
Satu lagi yang saya rasa bahawa setakat ini segala taklimat dan penerangan
berkenaan dengan kemasukan universiti biasanya dibuat oleh IPTS dan kerajaan kurang
ada usaha untuk membuat taklimat itu. Saya rasa kalau IPTS, mereka buat penerangan
dan sebagainya berasaskan kepada kepentingan komersial. Dia tidak neutral. Saya
cadangkan bahawa sepatutnya Kementerian Pendidikan harus juga adakan taklimat dan
penerangan yang lebih baik daripada itu.
Satu lagi Tuan Yang di-Pertua. Daripada pengalaman saya, saya rasa bahawa
kalau kita hendak galakkan murid ambil pengajian yang tertentu, kita harus berikan
rangsangan dan jangan paksa sangat. Pada suatu ketika, kerajaan kita kata kita perlukan
lebih ramai murid sains. Baru-baru ini kita bangkit lagi, tetapi sebelum itu sudah lama ada
bangkitkan hal ini. Jadi ramai pelajar di Tingkatan 3 yang keputusannya okey dipaksa ambil
sains. Akan tetapi murid itu tidak semestinya minat dalam sains."
RANG UNDANG-UNDANG,"RANG UNDANG-UNDANG INSTITUSI PENDIDIKAN
TINGGI SWASTA (PINDAAN) 2014
Bacaan Kali Yang Kedua dan Ketiga",,■1540,1540,Tuan Khoo Soo Seang [Tebrau],"Kalau mereka yang minat di dalam sastera, yang ada bakat dalam sastera, kalau
dibenarkan berterusan dalam jurusan sastera, mungkin mereka berjaya. Mungkin
keputusan di SPM lebih cemerlang. Akan tetapi akhirnya ini murid saya, saya sendiri
nampak. Murid yang baik-baik di Tingkatan 3 apabila dipaksa ambil sains di Tingkatan 4
dan 5, habis. Ini satu kesilapan yang biar kita jangan ulang. Oleh sebab saya nampak
sekarang kita seolah-olah sekali lagi hendak galak tidak mengapa tetapi jangan paksa. Ini
kerana bukan semua orang ada kecenderungan terhadap Sains dan sebagainya. Tuan
Yang di-Pertua, pada saya, saya rasa bahawa penambahan IPTS sepatutnya di suplemen
dan *complement* IPTA. Saingan yang sihat di antara IPTS adalah sangat penting. Akan
tetapi kalau sekiranya ada seperti..."
RANG UNDANG-UNDANG,"RANG UNDANG-UNDANG INSTITUSI PENDIDIKAN
TINGGI SWASTA (PINDAAN) 2014
Bacaan Kali Yang Kedua dan Ketiga",,■1540,1540,Timbalan Yang di-Pertua [Datuk Haji Ismail bin Haji Mohamed Said],"Ya, Yang
Berhormat Batu Gajah bangun."
RANG UNDANG-UNDANG,"RANG UNDANG-UNDANG INSTITUSI PENDIDIKAN
TINGGI SWASTA (PINDAAN) 2014
Bacaan Kali Yang Kedua dan Ketiga",,■1540,1540,Tuan Sivakumar Varatharaju Naidu [Batu Gajah],"Sini, sini depan, depan."
RANG UNDANG-UNDANG,"RANG UNDANG-UNDANG INSTITUSI PENDIDIKAN
TINGGI SWASTA (PINDAAN) 2014
Bacaan Kali Yang Kedua dan Ketiga",,■1540,1540,Timbalan Yang di-Pertua [Datuk Haji Ismail bin Haji Mohamed Said],"Ya, Yang
Berhormat Batu Gajah."
RANG UNDANG-UNDANG,"RANG UNDANG-UNDANG INSTITUSI PENDIDIKAN
TINGGI SWASTA (PINDAAN) 2014
Bacaan Kali Yang Kedua dan Ketiga",,■1540,1540,Tuan Sivakumar Varatharaju Naidu [Batu Gajah],"Yang Berhormat, sini. Boleh?"
RANG UNDANG-UNDANG,"RANG UNDANG-UNDANG INSTITUSI PENDIDIKAN
TINGGI SWASTA (PINDAAN) 2014
Bacaan Kali Yang Kedua dan Ketiga",,■1540,1540,Timbalan Yang di-Pertua [Datuk Haji Ismail bin Haji Mohamed Said],"Ya, sila."
RANG UNDANG-UNDANG,"RANG UNDANG-UNDANG INSTITUSI PENDIDIKAN
TINGGI SWASTA (PINDAAN) 2014
Bacaan Kali Yang Kedua dan Ketiga",,■1540,1540,Tuan Sivakumar Varatharaju Naidu [Batu Gajah],"Terima kasih Tuan Yang di-
Pertua. Terima kasih oleh Yang Berhormat kerana memberi ruangan kepada saya. Saya
hendak tahu dengan konteks liberalisasi ini apabila kita mengurangkan kawalan untuk
pembukaan IPTS di negara kita, ini akan menyebabkan bilangan IPTS akan semakin
bertambah. Kita semua tahu kalau disebut IPTS ini tujuannya adalah perniagaan atau
membuat keuntungan. Ini akan menyebabkan mereka akan cuba menarik lebih ramai
pelajar walaupun mereka tidak memiliki kelayakan yang cukup untuk belajar.
Ini seterusnya akan menambahkan bilangan graduan dalam negara kita dalam
diploma, sarjana, ada sarjana muda, sarjana ataupun di peringkat yang lain. Ini seperti
mana yang diberitahu oleh Yang Berhormat tadi, mungkin tidak dapat memenuhi keperluan
pasaran. Pasaran untuk buruh mungkin kurang, tetapi jumlah bilangan graduan yang akan
wujud adalah terlalu ramai. Ini seterusnya akan mewujudkan pengangguran yang lebih
teruk di negara kita dan seterusnya boleh menimbulkan banyak masalah sosial, ekonomi.
Saya rasa kerajaan kena berwaswas dalam melonggarkan lagi syarat untuk
mewujudkan IPTS. Kita tidak boleh membuka jalan dalam konteks liberalisasi semata-mata
kita hendak menjadikan negara kita hab pendidikan. Ini kita kena berhati-hati. Apa
pandangan Yang Berhormat berkaitan dengan perkara ini? Terima kasih."
RANG UNDANG-UNDANG,"RANG UNDANG-UNDANG INSTITUSI PENDIDIKAN
TINGGI SWASTA (PINDAAN) 2014
Bacaan Kali Yang Kedua dan Ketiga",,■1540,1540,Dato’ Fauzi bin Abdul Rahman [Indera Mahkota],"Tuan Yang di-Pertua, sama
sahaja."
RANG UNDANG-UNDANG,"RANG UNDANG-UNDANG INSTITUSI PENDIDIKAN
TINGGI SWASTA (PINDAAN) 2014
Bacaan Kali Yang Kedua dan Ketiga",,■1540,1540,Timbalan Yang di-Pertua [Datuk Haji Ismail bin Haji Mohamed Said],"Yang
Berhormat Indera Mahkota, ya."
RANG UNDANG-UNDANG,"RANG UNDANG-UNDANG INSTITUSI PENDIDIKAN
TINGGI SWASTA (PINDAAN) 2014
Bacaan Kali Yang Kedua dan Ketiga",,■1540,1540,Dato’ Fauzi bin Abdul Rahman [Indera Mahkota],"Soalan saya sama juga
dengan soalan Yang Berhormat daripada Batu Gajah. Terima kasih Yang Berhormat, terima
kasih Tuan Yang di-Pertua. Saya tertarik dengan ucapan Yang Berhormat tadi. Saya cukup
menyokong bahawasanya kerajaan negara kita wajib memiliki *road map.* Akan tetapi untuk
menzahirkan *road map*, sejajar dengan apa Yang Berhormat Batu Gajah katakan tadi, kita
hendak tahu apa destinasi kita. Adakah baiknya kalau sekiranya kerajaan kita menzahirkan
satu senarai contohnya apa *target* kita, berapa banyak jurutera kita hendak, sepuluh tahun
akan datang, 20 tahun akan datang, 30 tahun akan datang. Dalam kejuruteraan itu bidang
apa? Bidang *atomic*, bidang penggalian, bidang apa juga.
Begitu juga dengan apa Yang Berhormat katakan tadi dari segi sekarang ini
semua hendak jadi doktor. Saya baru ini saya jumpa dengan satu keluarga, tiga doktor dan
satu *pharmacist.* Dia kata dalam ramai-ramai itu yang *pharmacist* yang paling berjaya dari
segi pendapatan. Jadi Yang Berhormat apa pandangan? Saya bertanya ini kerana saya
menghormati Yang Berhormat sebagai seorang pendidik dan tentunya lebih mengetahui
dalam hal ini. Maksud saya tadi, pandangan Yang Berhormat dari segi kalau sekiranya
pemerintah kita kena ada senarai. Berapa doktor kita hendak zahirkan dalam sepuluh tahun
akan datang. Bidang apa? Jurutera juga begitu juga dan selain-lainnya. Terima kasih Tuan
Yang di-Pertua."
RANG UNDANG-UNDANG,"RANG UNDANG-UNDANG INSTITUSI PENDIDIKAN
TINGGI SWASTA (PINDAAN) 2014
Bacaan Kali Yang Kedua dan Ketiga",,■1540,1540,Tuan Khoo Soo Seang [Tebrau],"Saya ucapkan terima kasih kepada kedua-dua
Ahli Yang Berhormat. Sebenarnya saya amat bersetuju. Pertama berkenaan dengan
*liberalization* pembukaan universiti IPTS. Pada saya, saya percaya kita hanya mengubah
corak sahaja. Dulu mereka perlu dipelawa sebelum mereka boleh mohon. Sekarang
mereka boleh mohon terus. Akan tetapi saya percaya Kementerian Pendidikan masih ada
kuasa untuk mengawal. Tidak semestinya sesiapa yang mohon akan diluluskan. Jadi ini
saya percaya.
Berkenaan dengan apa yang dikatakan oleh Yang Berhormat Indera Mahkota, tadi
awal-awal saya sudah cadangkan. Kita mesti ada unjuran. Mungkin kalau hendak buat 30
tahun susah tapi sekurang-kurangnya lima tahun hingga 10 tahun supaya anak-anak kita
tahu apa yang diperlukan. Kalau mereka ada minat, ada bakat mereka boleh pilih mana ada
pasaran. Ini tadi awal-awal saya sudah sebut, jadi saya banyak setuju dengan Ahli-ahli
Yang Berhormat. Jadi memang tidak boleh dinafikan bahawa kalau lebih ramai IPTS dan
juga IPTA ini akan berikan kepada penuntut kita, pelajar kita, pemuda kita lebih banyak
pilihan lagi. Akan tetapi kita kena pastikan khususnya IPTS, mesti ada kualiti yang tertentu
seperti sebelum saya sudah ramai Ahli Yang Berhormat pun ada pandangan yang serupa.
Kita tahu ada IPTS yang murid sudah mohon untuk belajar sesuatu, sudah bayar
yuran akhirnya kelas itu tidak boleh buka. Yuran pun tidak dipulangkan balik. Jadi kita tidak
mahu hal seperti ini berlaku. Khususnya kalau ini berlaku kepada penuntut asing dia akan
cemarkan imej negara kita. Jadi ini saya harap bahawa kerajaan berikan perhatian yang
serius. Saya tidak tahu sama ada kerajaan sekarang puas hati dengan bilangan IPTA yang
sedia ada dan sama ada kita ada rancangan untuk menambah IPTA lagi, kalau ada apa
faktor-faktor yang kita akan timbang, apakah kriteria yang kita akan fikir."
RANG UNDANG-UNDANG,"RANG UNDANG-UNDANG INSTITUSI PENDIDIKAN
TINGGI SWASTA (PINDAAN) 2014
Bacaan Kali Yang Kedua dan Ketiga",,■1540,1540,Puan Teresa Kok Suh Sim [Seputeh],Saya minta penjelasan.
RANG UNDANG-UNDANG,"RANG UNDANG-UNDANG INSTITUSI PENDIDIKAN
TINGGI SWASTA (PINDAAN) 2014
Bacaan Kali Yang Kedua dan Ketiga",,■1540,1540,Timbalan Yang di-Pertua [Datuk Haji Ismail bin Haji Mohamed Said],"Ya, Yang
Berhormat Seputeh."
RANG UNDANG-UNDANG,"RANG UNDANG-UNDANG INSTITUSI PENDIDIKAN
TINGGI SWASTA (PINDAAN) 2014
Bacaan Kali Yang Kedua dan Ketiga",,■1540,1540,Puan Teresa Kok Suh Sim [Seputeh],"Ya, terima kasih Yang Berhormat Tebrau.
Yang Berhormat Tebrau tadi sudah cakap banyak tentang pelajar pilih disiplin yang salah
sehingga tidak dapat lulus dan sebagainya. Mungkin yang kaunseling tentang kepada orang
muda ini boleh dijalankan di Universiti Tunku Abdul Rahman yang diasaskan oleh MCA. Di
sini saya ada satu soalan tentang yang mana Universiti Tunku Abdul Rahman yang ditukar
daripada Kolej Tunku Abdul Rahman kerana daripada jawapan Parlimen yang saya terima,
bila ianya Kolej Tunku Abdul Rahman ditubuhkan pada tahun 1999. KTAR mendapat
subsidi kerajaan sebanyak 50% termasuk *capital, expenditure* dan 50% daripada *trustees*.
Selepas itu bila KTAR di tukar kepada UTAR, ia adalah terletak di bawah Akta Institusi
Pendidikan Tinggi Swasta.
Di sini ia ditulis, kerajaan bersetuju meneruskan bantuan sebelum ini dikenali
*matching grant* sehingga maksimum RM60 juta satu tahun. Bagi saya kalau RM60 juta
daripada pihak kerajaan memang tidak cukup untuk menguruskan satu universiti swasta.
Jadi saya hendak tanya Yang Berhormat ialah apakah pertukaran status daripada Kolej
Tunku Abdul Rahman kepada Universiti Tunku Rahman itu merupakan lebih membebankan
pihak pentadbiran itu Yayasan Pendidikan UTAR. Adakah ini satu kesilapan bagi mereka
yang membuat keputusan di MCA?"
RANG UNDANG-UNDANG,"RANG UNDANG-UNDANG INSTITUSI PENDIDIKAN
TINGGI SWASTA (PINDAAN) 2014
Bacaan Kali Yang Kedua dan Ketiga",,■1540,1540,Tuan Khoo Soo Seang [Tebrau],"Saya ingat Yang Berhormat Seputeh adalah
graduan daripada KTAR bukan? Akan tetapi saya ingat Yang Berhormat sudah dapat fakta
yang salah. KTAR dan UTAR adalah dua entiti yang berlainan. Bukan KTAR menjadi
UTAR. KTAR masih sedia ada dan kita wujudkan UTAR. UTAR dan KTAR berlainan. Jadi
sekarang hanya KTAR menjadi Kolej Universiti Tunku Abdul Rahman tapi UTAR adalah
UTAR. Jadi ini dua perkara yang berlainan."
RANG UNDANG-UNDANG,"RANG UNDANG-UNDANG INSTITUSI PENDIDIKAN
TINGGI SWASTA (PINDAAN) 2014
Bacaan Kali Yang Kedua dan Ketiga",,■1550,1550,Tuan Khoo Soo Seang [Tebrau],"Tuan Yang di-Pertua, pada saya, saya fikir satu lagi ialah IPTS seharusnya tidak
akan bersaing dengan IPTA khususnya bagi perubatan. Saya difahamkan ada IPTS yang
gunakan hospital kerajaan untuk mereka punya *teaching hospital.* Pada saya, kalau dia
IPTS, dia sepatutnya wujud *teaching hospital*nya sendiri. Jadi biarlah hospital kerajaan
menjadi *teaching hospital* bagi IPTA.
Tuan Yang di-Pertua, ini adalah menjadi tanggungjawab kerajaan untuk pastikan
pendidikan tinggi adalah mampu kepada semua pelajar, semua penuntut yang layak dan
saya di sini sekali saya nak merayu kepada kerajaan, berikanlah pertimbangan khas
kepada anak-anak cikgu oleh kerana kalau kita sentiasa kata kita mengenang jasa cikgu, ini
mungkinlah satu caranya. Kalau mereka mungkin sekiranya nak bersaing dengan lain
mungkin kurang sikit, mungkin mereka boleh diberikan sedikit pertimbangan khas dan
khususnya daripada segi biasiswa dan sebagainya.
Berkenaan dengan biasiswa, saya dah nampak ramai anak-anak orang kaya yang
dapat biasiswa. Mereka dapat biasiswa bukan kerana mereka tak mampu, sekali lagi
kerana *glamour.* Kita kata oh anak saya pemegang biasiswa tertentu, ini begitu *glamour.*
Jadi saya cadangkan kita tak boleh menghalang orang daripada mendapat *glamour.* Ini
memang biasa, *human nature* tetapi apa caranya kita boleh galakkan bahawa yang tak
perlukan bantuan kewangan tak mohon biasiswa. Cadangan saya, kita wujudkan gelaran
yang tertentu. Misalnya dulu saya tahu masa kita ada *Queen’s scholar* dan sebagainya.
Bolehkah kita wujudkan gelaran yang tertentu kepada budak yang cemerlang tapi tak
perlukan bantuan. Jadi mereka tak perlu ambil biasiswa, berikan biasiswa kepada orang
miskin, anak orang miskin yang perlukan. Mereka ada gelaran itu, kalau *Agong Scholar* dan
sebagainya, dia dah cukup *glamour.* Jadi ini saya berharap bahawa kerajaan akan timbang.
Tuan Yang di-Pertua, saya ingat itu sahajalah perkara-perkara yang saya nak
bangkitkan. Jadi Tebrau sokong Rang Undang-undang Meminda Akta Institusi Pendidikan
Tinggi. Sekian, terima kasih."
RANG UNDANG-UNDANG,"RANG UNDANG-UNDANG INSTITUSI PENDIDIKAN
TINGGI SWASTA (PINDAAN) 2014
Bacaan Kali Yang Kedua dan Ketiga",,■1550,1550,Timbalan Yang di-Pertua [Dato' Haji Ismail bin Haji Mohamed Said],"Ramai
lagi? Satu, dua tiga, empat, lima, enam. Ya, bagi pihak PKR belum lagi ya? Yang
Berhormat Bayan Baru."
