level_1,level_2,level_3,raw_timestamp,timestamp,author,speech
RANG UNDANG-UNDANG,"RANG UNDANG-UNDANG INSTITUSI PENDIDIKAN
TINGGI SWASTA (PINDAAN) 2014
Bacaan Kali Yang Kedua dan Ketiga",,■1740,1740,Puan Hajah Normala binti Abdul Samad [Pasir Gudang],"Itu di dalam negara kita *effect*nya. Bagi di luar negara pula tentulah *effect* negara
kita. Jika beberapa IPTA berbuat demikian, jadi ia tentu akan memberikan kesan yang
buruk kepada negara kita. Jadi di dalam merangka undang-undang ini, ada beberapa
perkara yang perlu dilihat secara lebih konklusif oleh pihak kementerian. Di antaranya iaitu
menekankan kepada IPTS bahawa tujuan mereka beroperasi, garis panduan kena ada,
bukanlah tujuan utama membuat keuntungan. Pelajaran mereka tidak boleh berniaga. Kita
lihat di negara-negara luar, bukan perniagaan menjadi keutamaannya tetapi IPTS kita
membesarkan soal keuntungan. Satu garis panduan perlu dibuat lepas itu kita kena tengok
dan beritahu mereka, *it’s quantity* ataupun *quality* yang perlu dititikberatkan.
Kita perlu ada semak semula bagaimana pencapaian anak-anak kita yang telah
dihantar di IPTS-IPTS berkenaan. Dengan banyaknya IPTS-IPTS, kita juga mengalami
banyak masalah daripada segi penempatan. Banyak tempat di Lembah Klang, di Selangor.
Di tempat saya sendiri di Bandar Seri Alam sendiri dengan adanya UiTM, ada UniKL. Kalau
dulu pelajar-pelajar ini hanya perlu menyewa rumah bayaran sekitar RM400, pada sesi kali
ini harga rumah naik sehingga RM600 ke RM800. Jadi perkara-perkara ini juga perlu
diambil kira. Demografi sesuatu kawasan itu perlu dilihat dengan teliti supaya bila
meluluskan, kita yakin ia tidak memberi banyak kesan negatif kepada penduduk setempat
atau kepada pelajar itu sendiri.
Tuan Yang di-Pertua, seperkara lagi ialah tentang masalah dasar kita sendiri.
Kalau liberalisasi menjadi keutamaan kita, kita juga kena tengok tentang pasaran buruh
kerana bila terlampau ramai ada kelulusan itu dengan kehendak pekerjaan di dunia
sebenar. Bila IPTS, kebergantungan kepada kerja kerajaan adalah sangat minimum dan
dalam keadaan sekarang memang itu pun tak boleh berlaku, kena bergantung pada pihak
swasta. Pihak swasta kita kena lihat juga dan jangkakan berapakah peluang-peluang
pekerjaan yang mungkin ada di pihak swasta. Sebagai contoh, jika terlampau banyak
mereka belajar daripada sudut *business administration* dengan izin, berapa banyak yang
boleh ada. Yang belajar *human resource management*, yang belajar *accounting
management.* Dalam sebuah kilang, kemungkinan ada satu atau dua sahaja tidak banyak.
Jadi bila terlampau banyak penawaran oleh IPTS ini, dibimbangkan kita akan menambah
lagi lambakan yang telah sedia ada seperti sekarang ini di dalam berapa-berapa bidang.
Tuan Yang di-Pertua, saya juga ingin mengambil pandangan di sini soal sosial
yang ditimbulkan. Ada beberapa perkara yang kita lihat sangat tidak sihat berlaku
hinggakan kita tengok percampuran yang tidak menjadi budaya kita menjadi satu amalan.
Kita juga melihat kadar jenayah. Jadi kita kena lihat perkara ini dengan teliti, tidak boleh
dibiarkan terus kepada pihak IPTS untuk dapat lesen kemudian mereka buatlah apa
mereka suka tanpa kawalan yang sebenarnya dilakukan kepada pelajar-pelajar ini. Kita
juga perlu melihat tentang *hidden cost* yang perlu kerajaan tanggung secara kita sedar
ataupun tidak sedar dengan lambakan memanggil pelajar-pelajar asing ini kerana kita nak
*liberalize* jadi Nigeria ataupun negara mana-manalah contohnya China, India datang belajar
dekat sini.
Memang nampak bagus tetapi apakah kesannya kepada negara kita? Berapa
banyak dia membantu ekonomi kita? Daripada sudut *hidden cost* yang kita mungkin tidak
sedar ada kawan-kawan kita dah beritahu tadi. Saya pun nak tekankan lagi sekali
penggunaan ubat-ubatan di hospital yang di subsidi, mereka juga akan menikmatinya. Kita
juga secara tidak sedar mereka juga akan menikmati barang-barang makanan yang di
subsidi. Mereka akan menikmati minyak-minyak yang di subsidi oleh kerajaan kepada yang
sebenarnya rakyat kita. Ini *hidden cost* yang perlu kita lihat secara teliti. Tidak tercerita lagi
soal mereka menyalahgunakan visa ini. Tuan Yang di-Pertua, salah guna visa ini sangat
senang berlaku. Siapa boleh tangkap dia kalau visa dia dah habis, dia duduk dekat mana
bukan hari-hari Imigresen kita boleh buat pemeriksaan nak tanya pasport orang ada kah
tidak. Jadi ini juga boleh mendatangkan *hidden cost* ataupun kos-kos tersembunyi yang
bakal merugikan negara kita.
Tuan Yang di-Pertua, saya mohon kepada pihak kementerian supaya dengan
pindaan akta ini, garis panduan yang lebih jelas disediakan kepada pihak-pihak IPTS. Jika
perlu, sebelum kelulusan diberi tolonglah buat semakan dengan IPTS yang sedia ada.
Berapa *student* yang mereka ambil bagi setiap kursus yang mereka tawarkan dan tolong
juga pantau mereka daripada segi harga. Kita kasihan kepada ibu bapa. Kita tahu tempat
IPTA kita kurang. Jadi harapan kita adalah kepada IPTS tapi mereka dengan caj yang
begitu tinggi tentunya amat membebankan dengan alasan PTPTN. Jadi kita kena ambil kira
perkara ini. Saya suka nak menekankan supaya tindakan yang sewajarnya, pemantauan
yang sewajarnya dilakukan kepada mereka.
Kepada pekerja-pekerja asing tentulah ia akan menjadi tambahan. Kita cukup
dengan mereka yang tidak mempunyai kemahiran yang tidak balik atau masuk ke dalam
negara kita dan tidak keluar dengan cara yang sah. Tambah pula kalau di permit-permit ini,
macam kawan-kawan tadi ada beritahu oleh Yang Berhormat-Yang Berhormat lain tadi.
Apa perlu mereka yang negara mereka mengajar bahasa Inggeris, bahasa pertuturan
mereka adalah bahasa Inggeris masuk ke dalam negara ini hanya untuk belajar bahasa
Inggeris, apa keperluannya? Adakah niat mereka tulen nak belajar dan di mana
pemantauan yang memang tak mungkin dilakukan kerana bila dia dah masuk, kita tak ada
satu sistem untuk memastikan mereka ini lepas tiga bulan, lepas satu tahun, mereka akan
dicari untuk keluar.
Jadi Tuan Yang di-Pertua, itu sahaja yang ingin saya sampaikan dan sebagai
penggulungan saya, saya ingin meminta pihak kementerian untuk memberi garis panduan
yang sejelas-jelasnya kepada semua IPTS bahawa bidang pendidikan bukanlah bidang
untuk mereka mengaut keuntungan yang tinggi kerana ia memberi kesan kepada para ibu
bapa dan seterusnya anak-anak kita yang satu hari nanti akan mewarisi kita untuk
meneruskan mentadbir negara ini. Keduanya, mestilah ditekankan soal kualiti bukan kuantiti
dan yang terakhir ialah tentang keperluan kepada kursus-kursus itu diluluskan ataupun
diteruskan. Itu sahaja yang ingin saya sampaikan. Saya dengan ini, Pasir Gudang
menyokong kepada pindaan Akta Institusi 555. Terima kasih."
RANG UNDANG-UNDANG,"RANG UNDANG-UNDANG INSTITUSI PENDIDIKAN
TINGGI SWASTA (PINDAAN) 2014
Bacaan Kali Yang Kedua dan Ketiga",,■1740,1740,Tuan Yang di-Pertua,Yang Berhormat Lumut.
RANG UNDANG-UNDANG,"RANG UNDANG-UNDANG INSTITUSI PENDIDIKAN
TINGGI SWASTA (PINDAAN) 2014
Bacaan Kali Yang Kedua dan Ketiga",,5.49 ptg.,1749,Tuan Laksamana Pertama (B) Haji Mohamad Imran bin Abd Hamid [Lumut],"Tuan Yang di-Pertua, dalam membahaskan pindaan Akta Institusi Pendidikan Tinggi
Swasta 1986, saya sekadar ingin melahirkan rasa kebimbangan sayalah dengan lahirnya
ataupun cambahnya, tumbuhnya IPTS-IPTS di negara kita yang kita lihat seolah-olah
macam tidak terkawal. Sebagaimana disebut oleh Yang Berhormat-Yang Berhormat lain,
sekarang ini dah ada 80 IPTS, IPTA tetapi apabila pindaan ini diluluskan nanti, kita tak tahu
apa akan berlaku.
Walau bagaimanapun, izinkan saya untuk melahirkan kebimbangan saya kepada
kementerian untuk mendapatkan penawar-penawarnya supaya kebimbangan ini dapat
dipadamkan dan mudah-mudahan dengan tindakan yang diambil oleh kementerian,
kebimbangan ataupun kekhuatiran saya ini dapat diredakan."
RANG UNDANG-UNDANG,"RANG UNDANG-UNDANG INSTITUSI PENDIDIKAN
TINGGI SWASTA (PINDAAN) 2014
Bacaan Kali Yang Kedua dan Ketiga",,■1750,1750,Tuan Laksamana Pertama (B) Haji Mohamad Imran bin Abd Hamid [Lumut],"Antaranya, kekhuatiran saya dalam kedudukan bahasa Melayu yang akan
menghadapi ancaman bahasa Inggeris oleh kerana kita tahu kebanyakan IPTS yang
dilahirkan di negara kita ini melaksanakan pengajian ilmu kemanusiaan, umpamanya
bahasa, sastera, sejarah dan falsafah yang boleh diajar dalam bahasa Melayu, tetapi
diabaikan. Oleh kerana kita tahu kebanyakan penuntut IPTS dari luar negara, maka bahasa
Inggeris menjadi keutamaan.
Kedua, kita lihat pengajian ilmu ekonomi pengurusan sains dan teknologi juga
menggunakan bahasa Inggeris sepenuhnya. Jadi sekali lagi, bahasa Melayu akan
diabaikan.
Ketiga, status dan matlamat bahasa Melayu sebagai bahasa kebangsaan dan
bahasa ilmu akan tercabar. Ini memang telah kita hadapi dan kita telah alami sebelum ini.
PPSMI telah kita korban atau telah kita hapuskan dan balik kepada bahasa Malaysia.
Mudah-mudahan ini dapat diambil iktibar oleh kementerian.
Seterusnya falsafah pendidikan negara mungkin tidak dihayati oleh IPTS-IPTS ini
dan kita bimbang dasar pembangunan ataupun dasar penyelidikan negara tidak dihayati
oleh IPTS-IPTS yang diwujudkan.
Seterusnya usaha kita memperjuangkan bahasa Melayu sebagai bahasa rasmi
dan ilmiah mungkin terjejas dan mungkin telah terjejas. Ini kita minta Kementerian
Pendidikan melihat situasi ini supaya IPTS memberi penekanan kepada memartabatkan
bahasa Melayu dan sebaliknya bahasa Inggeris akan menguasai kehidupan kita nanti.
Memang hakikatnya kita lihat sekarang ini pun bahasa Inggeris telah menjadi gaya hidup
kita. Kalau kita tidak boleh bertutur dalam bahasa Inggeris keseluruhannya pun, dua tiga
patah perkataan Melayu dicampurkan dengan bahasa Inggeris. Ini merupakan pencemaran
bahasa yang mungkin disebabkan oleh pelaksanaan kursus-kursus di IPTS menggunakan
bahasa Inggeris.
Isu seterusnya yang membimbangkan saya ialah masalah kursus dan kualiti yang
dilaksanakan di IPTS-IPTS yang diwujudkan. Kita tahu terdapat IPTS yang kurang
bertanggungjawab sebaliknya ghairah mementingkan kewangan sahaja. Maka dengan itu
kita lihat berapa ramai Yang Berhormat yang telah membangkitkan isu ini dan kita kesan
dan kita tahu memang terdapat graduan-graduan dari IPTS yang telah dilahirkan yang tidak
memenuhi kualiti yang kita perlukan.
Seterusnya di sesetengah IPTS, kualiti tenaga pengajar boleh dipertikaikan. Ini
memang kita tidak nafikan berlaku dan kita minta Kementerian Pendidikan mengambil satu
langkah ataupun tindakan supaya menentukan semua tenaga pengajar di IPTS mempunyai
kelayakan yang sewajarnya. IPTS mungkin menggunakan khidmat pensyarah yang kurang
wibawa. Sama juga seperti yang saya bincangkan tadi.
Seterusnya pelajar yang lemah diterima dan diberi kelulusan kerana sanggup
membayar yuran. Ini kita tahu sebahagian IPTS yang dilahirkan mementingkan keuntungan.
Kita juga bimbang sebenarnya di negara kita ini. Kita mementingkan pendidikan dan kita
tahu ada anak-anak kita yang sebenarnya tidak cerdik, tidak berkeupayaan, mahu juga
masuk universiti dan bekerja di kedudukan *white collar job,* dengan izin."
RANG UNDANG-UNDANG,"RANG UNDANG-UNDANG INSTITUSI PENDIDIKAN
TINGGI SWASTA (PINDAAN) 2014
Bacaan Kali Yang Kedua dan Ketiga",,■1750,1750,Tuan Sivakumar Varatharaju Naidu [Batu Gajah],Yang Berhormat...
RANG UNDANG-UNDANG,"RANG UNDANG-UNDANG INSTITUSI PENDIDIKAN
TINGGI SWASTA (PINDAAN) 2014
Bacaan Kali Yang Kedua dan Ketiga",,■1750,1750,Tuan Laksamana Pertama (B) Haji Mohamad Imran bin Abd Hamid [Lumut],"Jadi ini merupakan satu masalah pada negara. Ya, sila Yang Berhormat Batu Gajah."
RANG UNDANG-UNDANG,"RANG UNDANG-UNDANG INSTITUSI PENDIDIKAN
TINGGI SWASTA (PINDAAN) 2014
Bacaan Kali Yang Kedua dan Ketiga",,■1750,1750,Tuan Sivakumar Varatharaju Naidu [Batu Gajah],"Terima kasih Yang
Berhormat Lumut. Saya agak tertarik dengan hujah Yang Berhormat Lumut berkaitan
dengan tenaga pengajar. Saya pun hendak tahu dari mana kita akan dapat tenaga pengajar
nanti bila lebih banyak IPTS dibuka. Dari manakah kita akan dapat sumber ini? Mungkin
kerana kita kekurangan sumber tenaga pengajar yang betul-betul berwibawa, mungkin
seperti mana yang dikatakan oleh Yang Berhormat Lumut tadi, kita terpaksa menggunakan
tenaga pengajar yang kurang mahir ataupun kelayakan yang tidak mencukupi. Itu satu
masalah.
Saya juga risau mungkin akan berlaku cubitan daripada IPTA di mana di IPTA kita
ada pensyarah-pensyarah, profesor-profesor yang berwibawa, mungkin juga IPTS-IPTS ini
akan menawarkan gaji yang tingi kepada tenaga pengajar ini dan mereka akan keluar dari
IPTA ke IPTS. Ini akan menjejaskan prestasi IPTA nanti. Apa pandangan Yang Berhormat
berkaitan dengan ini?"
RANG UNDANG-UNDANG,"RANG UNDANG-UNDANG INSTITUSI PENDIDIKAN
TINGGI SWASTA (PINDAAN) 2014
Bacaan Kali Yang Kedua dan Ketiga",,■1750,1750,Tuan Gooi Hsiao-Leung [Alor Star],"Yang Berhormat, boleh saya tambah sedikit
berkaitan dengan ini?"
RANG UNDANG-UNDANG,"RANG UNDANG-UNDANG INSTITUSI PENDIDIKAN
TINGGI SWASTA (PINDAAN) 2014
Bacaan Kali Yang Kedua dan Ketiga",,■1750,1750,Tuan Laksamana Pertama (B) Haji Mohamad Imran bin Abd Hamid [Lumut],Sila Yang Berhormat Alor Star.
RANG UNDANG-UNDANG,"RANG UNDANG-UNDANG INSTITUSI PENDIDIKAN
TINGGI SWASTA (PINDAAN) 2014
Bacaan Kali Yang Kedua dan Ketiga",,■1750,1750,Tuan Gooi Hsiao-Leung [Alor Star],"Tentang isu yang dibangkitkan mengenai
tenaga pengajar. Sebenarnya dalam hujung bulan lepas, ada laporan media yang cukup
besar, *front page in fact,* dalam surat khabar *The Star* yang telah pun melaporkan bahawa
kita sekarang ini mengalami masalah besar-besaran di mana pensyarah-pensyarah
universiti IPTA khususnya *medical faculty* sedang beramai-ramai meninggalkan IPTA untuk
bekerja di IPTS. Dalam keratan surat khabar *The Star* di sini, di *USM Medical Campus in
Kubang Kerian* sebagai contoh, adalah satu tempat di mana *worst effected public university*
di mana 38 senior *lecturers* telah pun meninggalkan kampus tersebut dalam tempoh enam
bulan.
Ini adalah satu masalah yang saya rasa yang cukup cemas yang harus diatasi
ataupun diberi perhatian yang penting oleh Kementerian Pendidikan. Antara alasan yang
diberikan di dalam laporan media adalah pensyarah-pensyarah ini berasa mereka bekerja
dengan cukup kuat dengan tempoh yang lama di universiti-universiti IPTA tetapi tidak
diberikan pengiktirafan terhadap sumbangan mereka dan *promotion* dan gaji mereka juga
tidak dinaikkan. Ini adalah satu masalah yang cukup besar. Apakah pandangan Yang
Berhormat?"
RANG UNDANG-UNDANG,"RANG UNDANG-UNDANG INSTITUSI PENDIDIKAN
TINGGI SWASTA (PINDAAN) 2014
Bacaan Kali Yang Kedua dan Ketiga",,■1750,1750,Tuan Laksamana Pertama (B) Haji Mohamad Imran bin Abd Hamid [Lumut],"Terima kasih Yang Berhormat Batu Gajah dan Yang Berhormat Alor Star. Saya harap
Kementerian Pendidikan dapat mengambil perhatian dalam perkara ini. Sekiranya ia benar-
benar berlaku, maka kita lihat kedudukan IPTA akan terancam dan diancam oleh IPTS.
Kalau benar-benar IPTS yang mencuri tenaga pengajar IPTA benar-benar melaksanakan
kursus yang berwibawa yang boleh diiktiraf oleh negara dan peringkat antarabangsa, kita
tidak cemburulah, kita tidak halang. Akan tetapi, sekiranya ia semata-mata kerana gaji yang
lumayan, sebaliknya penyampaian tidak menemui kualiti, maka ia menjadi satu bencana
kepada negara kita. Untuk itu, kita minta Kementerian Pendidikan supaya mengambil
iktibar, mengambil perkara ini sebagai satu ancaman dan mengambil tindakan sebaiknya
untuk menawar tenaga-tenaga pengajar di IPTA agar tidak lari ke IPTS. Sila Yang
Berhormat Bayan Baru."
RANG UNDANG-UNDANG,"RANG UNDANG-UNDANG INSTITUSI PENDIDIKAN
TINGGI SWASTA (PINDAAN) 2014
Bacaan Kali Yang Kedua dan Ketiga",,■1750,1750,Tuan Sim Tze Tzin [Bayan Baru],"Terima kasih Yang Berhormat Lumut. Saya
cuma hendak tumpang sedikit dalam ucapan Yang Berhormat Lumut. Ada isu tentang
*vocational-technical college* yang di Malaysia di mana sekarang kebanyakan pelajar SPM,
36% pelajar gagal mencapai standard minimum SPM pada tahun 2010 dan 28% gagal
sekurang-sekurangnya satu subjek atau lebih di SPM dan mereka telah terkeluar dari
sistem pendidikan negara. Mereka pergi ke mana? Orang Cina dia pergi jual DVD haram,
orang Melayu dia jadi mat rempit, orang India menjadi gengster. Ini umum.
Jadi isu yang perlu ditangani di mana 36% ini haruslah diserap ke dalam *technical
college*, baik dari IPTS atau IPTA. Jadi saya minta kalau boleh kerajaan, kerana kita ada
pelan perancangan untuk *vocational college* dan sebagainya tetapi nampaknya tidak begitu
dititikberatkan dan kita mahu Menteri bagi satu jawapan bagaimana kita menerapkan
pelajar-pelajar yang SPM *drop out* itu ke dalam sistem *vocational-technical college* di
Malaysia? Terima kasih. Minta Yang Berhormat Menteri jawab."
RANG UNDANG-UNDANG,"RANG UNDANG-UNDANG INSTITUSI PENDIDIKAN
TINGGI SWASTA (PINDAAN) 2014
Bacaan Kali Yang Kedua dan Ketiga",,■1800,1800,Tuan Laksamana Pertama (B) Haji Mohamad Imran bin Abd Hamid [Lumut],"Terima kasih Yang Berhormat Bayan Baru. Memang saya sedari situasi ini dan saya juga
bimbang dengan harapan ibu bapa. Mereka berkehendakkan anak mereka semuanya
berjaya walaupun dia tahu anak dia tidak cerdik, PMR pun tidak lulus, SPM pun tidak lulus
tetapi hendak jadi orang cerdik juga.
Dalam hal ini memang saya setuju dengan Yang Berhormat Bayan Baru supaya
Kementerian Pendidikan menyediakan satu rancangan untuk warga-warga ataupun anak-
anak kita yang tidak berjaya dalam pendidikan dan ia harus memenuhi keperluan tenaga
buruh di negara kita. Jadi caranya mungkin kita tawarkan gaji yang lebih tinggi untuk
buruh-buruh yang melaksanakan tanggungjawab kerja-kerja berat ini.
Saya ingin menyentuh berhubung dengan tenaga pengajar di IPTS. Sebagaimana
diuar-uarkan oleh Yang Berhormat Pokok Sena pagi tadi, AIU atau Albukhary International
University menggunakan tenaga-tenaga pengajar daripada luar negara yang kalau benar-
benar mereka ini berkualiti, berkelayakan kita tidak akan nafikan. Sekarang kalau mereka
dianiaya, ini merupakan satu tindakan yang tidak wajar dan seharusnya kita mengambil
tindakan untuk membantu mereka.
Dalam hal ini, kita mintalah supaya kementerian mengambil serius perkara ini dan
seterusnya memberi bantuan kepada mereka agar dapat memenuhi keperluan tenaga
pelajar berkualiti di negara kita. Begitu juga seperti mana dibangkitkan oleh Yang
Berhormat Pokok Sena tadi Kolej Islam Darul Ulum yang belum dalam permit untuk
laksanakan pendidikan tinggi, sila pertimbangkan untuk diluluskan. Ini kalau tentera bagi
arahan sahaja Yang Berhormat Timbalan Menteri*.*"
RANG UNDANG-UNDANG,"RANG UNDANG-UNDANG INSTITUSI PENDIDIKAN
TINGGI SWASTA (PINDAAN) 2014
Bacaan Kali Yang Kedua dan Ketiga",,■1800,1800,ANNOTATION,[Ketawa]
RANG UNDANG-UNDANG,"RANG UNDANG-UNDANG INSTITUSI PENDIDIKAN
TINGGI SWASTA (PINDAAN) 2014
Bacaan Kali Yang Kedua dan Ketiga",,■1800,1800,Tuan Laksamana Pertama (B) Haji Mohamad Imran bin Abd Hamid [Lumut],"Akan tetapi dalam hal ini kita mohonlah supaya Kementerian Pendidikan memberi
pertimbangan supaya memberi kelulusan kepada Kolej Islam Darul Ulum untuk
meneruskan pendidikan mereka. Kebimbangan saya berhubung dengan masalah kursus
dan kualiti ini juga termasuklah ijazah pelajar yang mungkin tidak diiktiraf oleh kerana
kemasukannya seperti mana Yang Berhormat Pasir Gudang bangkitkan tadi, kalau
kelayakan masuknya pun lemah, keluar dia pun mungkin lemah jugalah. Jadi, kualiti ijazah
itu tidak dapat diiktiraf.
Seterusnya hal ini kita yakin, saya yakin akan menyebabkan para pelajar menjadi
mangsa akibat daripada kelonggaran-kelonggaran yang dilakukan oleh IPTS menyebabkan
graduan-graduan akan menjadi mangsa oleh kerana ijazah mereka tidak diiktiraf ataupun
kualiti mereka tidak diiktiraf ataupun diberi pertimbangan seharusnya. Jadi, oleh itu saya
mohon kepada Kementerian Pendidikan untuk memberi pertimbangan ataupun mencari
penawar kepada kebimbangan yang telah saya lahirkan tadi. Sekian, terima kasih."
RANG UNDANG-UNDANG,"RANG UNDANG-UNDANG INSTITUSI PENDIDIKAN
TINGGI SWASTA (PINDAAN) 2014
Bacaan Kali Yang Kedua dan Ketiga",,■1800,1800,Tuan Yang di-Pertua,"Yang Berhormat Sik, selepas Yang Berhormat Sik Yang
Berhormat Timbalan Menteri menjawab."
RANG UNDANG-UNDANG,"RANG UNDANG-UNDANG INSTITUSI PENDIDIKAN
TINGGI SWASTA (PINDAAN) 2014
Bacaan Kali Yang Kedua dan Ketiga",,6.03 ptg.,1803,Dr. Mansor bin Haji Abd. Rahman [Sik],"*Assalamualaikum warahmatullahi
wabarakatuh.* Terima kasih Tuan Yang di-Pertua kerana memberi peluang saya berucap
dalam isu pindaan Akta Institusi Pendidikan Tinggi Swasta 1996 ataupun Akta 555*.* Saya
menyokong rang undang-undang ini dan pada masa yang sama kita mestilah membuat
kawalan dan *monitoring* yang betul-betul serius. Saya banyak berkawan dengan kawan-
kawan di IPTS, daripada kajian saya melihat sekarang ini jumlah IPTS telah mencapai
bilangan hampir 100 buah termasuk institut, kolej-kolej universiti dan universiti. Kalau kita
masukkan institut yang kecil-kecil beratus-ratus buah. Bagi saya ini adalah agak banyak
dan kemasukan IPTS yang akan datang selepas ini mesti dipertimbangkan betul-betul.
Tuan Yang di-Pertua, pindaan undang-undang mestilah juga mengambil kira
berkenaan kualiti pendidikan itu sendiri dan juga ijazah yang dikeluarkan. Jika terlalu
banyak IPTS, mereka ini akan berlumba-lumba untuk mengambil pelajar. Bagi satu institusi
swasta logiknya keuntungan adalah menjadi keutamaan. Kita dapati ada juga kelulusan
amat minimum dibenarkan untuk masuk ke dalam IPTS. IPTS sudah tentu ingin pelajar-
pelajar mereka lulus, jika banyak pelajar-pelajar yang tidak lulus sudah tentu IPTS mereka
tidak menjadi popular kepada bakal-bakal pelajar. Jika prinsip mereka adalah untuk
meluluskan lebih banyak pelajar maka *the quality of education is compromised* dan ijazah
yang dikeluarkan akan dipertikaikan. Ijazah yang dikeluarkan tidak ada mutu. Graf
kelulusan mungkin direndahkan markahnya untuk meluluskan pelajar. Oleh itu MQA
mestilah betul-betul tegas dalam hal ini.
Sebagai contoh, dari segi profesion yang profesional, universiti terkemuka seperti
*medical faculty, National University of Singapore* pernah meninggikan markah kelulusannya
dan menolak atau membuang atau *reject student* dengan tujuan untuk menjaga kualiti atau
standard pelajar-pelajar lepasan universiti itu. Begitu juga yang kami rasa ketika kami
menjadi pelajar di Universiti Kebangsaan Malaysia dahulu.
Jadi, saya harap kerajaan meneliti perkara yang penting dalam menggubal
undang-undang dan dasar mengenai pendidikan tinggi. Jangan hanya kerana keghairahan
kita untuk menambah IPT tetapi kualiti pendidikan tidak diberi keutamaan. Ini akan
menyebabkan lambakan *graduate* yang tidak mempunyai kelulusan yang sepatutnya dan
suatu hari nanti ini akan menjatuhkan imej negara kita di dalam dan di luar negara.
Satu lagi perkara yang ingin saya sentuh ialah pelajar cemerlang daripada
sekolah-sekolah tertentu yang mereka ini mencapai keputusan yang amat baik, yang tidak
memilih untuk ke luar negara di tempatkan di IPTS yang tidak kondusif seperti rumah-
rumah kedai sebagai asrama mereka. Ini adalah akibat daripada lambakan IPTS yang
begitu banyak dan kita belum bersedia menyediakan prasarana tempat-tempat pendidikan
dan tempat-tempat penginapan untuk mereka. Ini akan menjejaskan pandangan
masyarakat terhadap IPT seperti mana dikatakan oleh Yang Berhormat sebelum ini di luar
negara, apabila mereka kembali ke negara mereka dan juga di dalam negara dan juga
pelajar-pelajar cemerlang yang memilih untuk tidak belajar ke luar negara akan menghadapi
satu masa depan yang negatif.
Akhir sekali, Tuan Yang di-Pertua, saya ingin mengajak kita bersama-sama
selepas undang-undang ini diluluskan marilah kita selain daripada kita mengutamakan
perkara-perkara yang lain. Kita mestilah mengutamakan roh ilmu itu sendiri dan martabat
ilmu itu sendiri supaya perkara negatif sepertimana yang kita bincangkan, seperti mana
yang kita dengarkan keluhan-keluhan daripada Yang Berhormat di sebelah Barisan
Nasional ataupun sebelah pembangkang yang kita bincang hingga petang ini tadi. Sekian,
Yang Berhormat Sik mohon menyokong. Terima kasih."
RANG UNDANG-UNDANG,"RANG UNDANG-UNDANG INSTITUSI PENDIDIKAN
TINGGI SWASTA (PINDAAN) 2014
Bacaan Kali Yang Kedua dan Ketiga",,6.03 ptg.,1803,Tuan Yang di-Pertua,"Terima kasih, sila Yang Berhormat Timbalan Menteri."
