level_1,level_2,level_3,raw_timestamp,timestamp,author,speech
,,,10.00 pagi,1000,ANNOTATION,"[Timbalan Yang di-Pertua (Datuk Haji Ismail bin Haji Mohamed Said)
mempengerusikan Mesyuarat]"
JAWAPAN-JAWAPAN LISAN BAGI PERTANYAAN-PERTANYAAN,1.,,10.00 pagi,1000,Tuan Haji Zainudin bin Haji Ismail [Jelebu],"minta Menteri Pendidikan
menyatakan apakah perancangan dan gerak kerja yang telah dilakukan oleh kerajaan
dalam memastikan profesion perguruan menjadi profesion pilihan."
JAWAPAN-JAWAPAN LISAN BAGI PERTANYAAN-PERTANYAAN,1.,,10.00 pagi,1000,Menteri Pendidikan I [Tan Sri Dato’ Haji Muhyiddin bin Mohd. Yassin],"Tuan
Yang di-Pertua, usaha untuk meningkatkan kecemerlangan dan kualiti pendidikan negara
merupakan agenda utama Kementerian Pendidikan Malaysia khususnya dalam aspek
memartabatkan profesion perguruan. Justeru, di bawah Pelan Pembangunan Pendidikan
Malaysia (PPPM) 2013-2025, pelbagai inisiatif telah dirancang dan dilaksanakan secara
berperingkat-peringkat bagi memastikan profesion perguruan berada di tahap yang terbaik.
Sehubungan itu izinkan saya menjawab pertanyaan lisan yang berhubung kait
dengan pembangunan profesion perguruan secara serentak iaitu pertanyaan tersebut
adalah daripada Yang Berhormat Jelebu pada hari ini dan juga Yang Berhormat Lipis dan
Yang Berhormat Temerloh pada 19 Jun yang akan datang."
JAWAPAN-JAWAPAN LISAN BAGI PERTANYAAN-PERTANYAAN,1.,,10.00 pagi,1000,Timbalan Yang di-Pertua [Datuk Haji Ismail bin Haji Mohamed Said],"Ya, sila."
JAWAPAN-JAWAPAN LISAN BAGI PERTANYAAN-PERTANYAAN,1.,,10.00 pagi,1000,Tan Sri Dato’ Haji Muhyiddin bin Mohd. Yassin,"Untuk maklumat Yang
Berhormat Jelebu, hakikatnya pada masa ini profesion perguruan telah pun menjadi antara
profesion pilihan utama rakyat Malaysia. Sebagai contoh, walaupun jumlah tempat untuk
mengikuti Program Ijazah Sarjana Muda Pendidikan lepasan Sijil Pelajaran Malaysia 2013
hanya 3,000 tempat seperti yang diperlukan, namun permohonan atas talian adalah
sebanyak 53,335 permohonan.
Disebabkan terlalu ramai yang berminat untuk menjadi guru, kementerian telah
melaksanakan pemilihan calon yang cemerlang di antara yang cemerlang melalui proses
pemilihan mengikut syarat dan kriteria pengambilan yang sangat ketat serta mengadakan
ujian saringan supaya mereka yang terpilih benar-benar layak dan memenuhi standard
serta kualiti yang telah pun ditetapkan.
Pada masa yang sama, kementerian sedang dalam proses mentransformasikan
Institut Pendidikan Guru (IPG) ke arah yang lebih berwibawa serta memenuhi keperluan
dan kehendak pedagogi abad ke-21. Modul latihan guru di IPG telah disemak semula
seiring dengan tahap kompetensi dan potensi murid masa kini.
Untuk makluman Yang Berhormat Temerloh, tujuh aspek utama telah dikenal pasti
dalam usaha untuk mentransformasikan IPG iaitu memperkukuh saluran pengambilan guru
pelatih, memantapkan kurikulum IPG, meningkatkan kualiti kepimpinan IPG, meningkatkan
kualiti pensyarah, menaik taraf infrastruktur, meningkatkan aktiviti pendidikan dan inovasi
dan meningkatkan profil IPG.
Di samping itu satu Pelan Strategi Pembangunan Profesional Pensyarah IPG telah
digubal dengan sasaran 33% pensyarahnya memiliki ijazah kedoktoran PhD. menjelang
tahun 2020. Langkah ini dijangkakan mampu meningkatkan lagi kualiti graduan keluaran
IPG setanding dengan keluaran institut pendidikan tinggi yang lain.
Menyentuh pertanyaan yang dibangkitkan oleh Yang Berhormat Lipis,
Kementerian Pendidikan Malaysia sebenarnya telah menjalankan beberapa intervensi
untuk memastikan guru-guru mengajar dalam opsyen dan kepakaran mereka. Ini
termasuklah menyediakan pelan induk pembangunan profesional berterusan supaya guru
lebih bertanggungjawab terhadap pembangunan profesional kendiri.
Pada tahun 2013, seramai 13,964 orang guru gred DG41 dan DG44 telah diberi
kursus pembangunan kompetensi untuk memantapkan lagi kemahiran pedagogi dan
pengurusan guru sekali gus mampu meningkatkan lagi prestasi mereka dalam bilik darjah.
Manakala bagi tahun 2014, pelbagai kursus latihan dalam perkhidmatan sebagai usaha
untuk meningkatkan profesional guru telah dirancang dan dilaksanakan secara
berperingkat-peringkat yang melibatkan 305,058 orang dengan jumlah kos sebanyak
RM41.8 juta.
Kementerian Pendidikan juga telah melaksanakan Program Intervensi Tambah
Opsyen (PITO) bagi menangani isu guru-guru yang mengajar tidak mengikut opsyen bagi
tahun 2011 hingga tahun 2015.
Program ini bertujuan untuk meningkatkan kualiti guru Malaysia melalui
peningkatan tambah opsyen iaitu tanpa mengubah opsyen asal dan secara tidak langsung
menyelesaikan masalah kekurangan guru untuk opsyen tertentu."
JAWAPAN-JAWAPAN LISAN BAGI PERTANYAAN-PERTANYAAN,1.,,■1010,1010,Tan Sri Dato’ Haji Muhyiddin bin Mohd. Yassin,"Pada tahun 2013, seramai 690 orang guru telah mengikuti PITO manakala 800
orang guru pelbagai opsyen akan dilatih melalui program tersebut pada tahun ini. Pada
masa yang sama, unjuran keperluan guru mengikuti opsyen sedang dikaji secara teliti bagi
menyelesaikan isu salah padanan ataupun *mismatch* opsyen guru dalam jangka masa
panjang.
Tuan Yang di-Pertua, sebagai langkah untuk memartabatkan lagi profesion
perguruan, kerajaan telah menggabungkan Skim Pegawai Perkhidmatan Pendidikan
Siswazah dan Lepasan Diploma kepada Skim Pegawai Perkhidmatan Pendidikan. Skim
baru ini menyediakan pelbagai laluan kenaikan pangkat kepada semua guru berasaskan
kecemerlangan. Ini membolehkan seseorang guru dinaikkan pangkat daripada gred DG41
ke DG54 dalam tempoh yang lebih singkat.
Sementara itu, dianggarkan seramai 5,000 orang Pegawai Perkhidmatan
Pendidikan Lepasan Diploma yang telah berjaya memperoleh ijazah akan dilantik terus ke
gred DG42 tertakluk kepada syarat yang ditetapkan.
Selain itu, laluan kerjaya baru juga sedang dirancang dan Pelan Penggantian Guru
sedang ditambah baik. Laluan kerjaya baru ini bertujuan mengemas kini laluan kerjaya
sedia ada kepada tiga laluan yang utama iaitu laluan pengajaran dan pembelajaran, laluan
kepimpinan dan laluan pakar bidang. Langkah ini membolehkan guru menikmati kenaikan
pangkat mengikut laluan kerjaya masing-masing.
Pada masa yang sama, melalui inisiatif Piagam Guru PPPM 2013-2025, instrumen
penilaian bersepadu untuk menggantikan instrumen penilaian sedia ada telah pun
dibangunkan untuk menilai kompetensi dan prestasi seseorang guru mengikut standard
yang ditetapkan. Pada tahun 2013, seramai 101,535 orang guru dan pimpinan sekolah
telah dinilai dengan menggunakan instrumen ini. Hasil penilaian tersebut akan digunakan
untuk menyediakan latihan selaras dengan tangga kerjaya guru di samping mengenal pasti
laluan kerjaya yang bersesuaian pada masa hadapan.
Kementerian juga telah menetapkan agar semua sekolah melaksanakan
pengoperasian berdasarkan kepada Standard Kualiti Pendidikan Malaysia (SKPM) mulai
tahun 2012. Melalui SKPM ini, guru-guru wajar sentiasa merujuk dan memastikan kualiti
pembelajaran dan pengajaran pada standard yang telah ditetapkan.
Dalam pada masa yang sama, guru-guru juga diberikan bimbingan yang
bersesuaian selepas pemeriksaan yang dijalankan secara berkala dan ini sejajar dengan
matlamat PPPM 2013-2025 dalam Anjakan 4 iaitu transformasi keguruan sebagai profesion
pilihan dan Anjakan 10, memaksimumkan keberhasilan murid bagi setiap ringgit dan untuk
meningkatkan lagi tahap kualiti guru dan keberhasilan murid dapat dimaksimumkan.
Sebagai pengiktirafan kepada kepimpinan sekolah dan guru-guru yang berjaya
melonjakkan prestasi sekolah mereka ke tahap yang terbaik, kementerian telah
mewujudkan tawaran baru ataupun *new deals* sejak tahun 2010 sehingga tahun 2013 di
mana seramai 2,380 pengetua, guru besar, 85,012 guru-guru dan 16,843 anggota
kumpulan pelaksana telah menikmati ganjaran tersebut dengan jumlah peruntukan
sebanyak RM804.9 juta. Ini jelas menunjukkan bahawa kerajaan begitu komited untuk
memartabatkan profesion keguruan dan sekali gus meningkatkan kualiti pendidikan negara.
Sesungguhnya saya amat berkeyakinan segala usaha yang dirancang dan
dilaksanakan akan mampu untuk mencapai aspirasi pembangunan modal insan yang
seimbang dan mampu menyumbang kepada pembangunan negara di masa hadapan."
JAWAPAN-JAWAPAN LISAN BAGI PERTANYAAN-PERTANYAAN,1.,,■1010,1010,Tuan Haji Zainudin bin Haji Ismail [Jelebu],"Terima kasih Tuan Yang di-Pertua.
Sebelum itu izinkan saya mengalu-alukan rombongan dan lawatan daripada Persatuan
Tingkatan 6 Sekolah Menengah Sultan Ahmad Tajuddin, Bandar Baharu Kulim."
JAWAPAN-JAWAPAN LISAN BAGI PERTANYAAN-PERTANYAAN,1.,,■1010,1010,ANNOTATION,[Tepuk]
JAWAPAN-JAWAPAN LISAN BAGI PERTANYAAN-PERTANYAAN,1.,,■1010,1010,Tuan Haji Zainudin bin Haji Ismail [Jelebu],"Terima kasih Yang Amat Berhormat Menteri. Satu jawapan yang sangat
meyakinkan dan sangat jelas akan hala tuju dan juga matlamat yang sedang dibawa oleh
Kementerian Pendidikan dalam soal untuk memartabatkan sistem pendidikan dan
profesionalisme perguruan kita.
Jadi jawapan yang sangat meyakinkan itu sesuatu yang dapat kita lihat daripada
seluruh program yang dirangka dan disusun oleh kementerian di bawah pimpinan Yang
Amat Berhormat, cuma satu aspek usaha murni dan cita-cita ini mungkin boleh terhalang
oleh kerana adanya dakwaan-dakwaan atau pemikiran-pemikiran yang sesetengah pihak
mendakwa bahawa kementerian mengindoktrinasikan guru-guru supaya menjadi
penyokong kepada kerajaan semata-mata.
Suara ini merupakan pandangan nakal malah sesuatu yang mungkin cubaan
membawa elemen politik ke dalam sistem pendidikan kita dan akan boleh menjejaskan
profesionalisme perguruan. Jadi mungkinkah..."
JAWAPAN-JAWAPAN LISAN BAGI PERTANYAAN-PERTANYAAN,1.,,■1010,1010,Timbalan Yang di-Pertua [Datuk Haji Ismail bin Haji Mohamed Said],"Ya,
soalan."
JAWAPAN-JAWAPAN LISAN BAGI PERTANYAAN-PERTANYAAN,1.,,■1010,1010,Tuan Haji Zainudin bin Haji Ismail [Jelebu],"Ini soalannya. Soalannya ialah
bagaimana Yang Amat Berhormat Menteri melihat elemen yang sedemikian, dakwaan yang
sedemikian boleh menjejaskan keharmonian dan cita-cita yang sangat baik yang sedang
disusun oleh kementerian di bawah pimpinan Yang Amat Berhormat? Itu soalan saya, Yang
Amat Berhormat Menteri."
JAWAPAN-JAWAPAN LISAN BAGI PERTANYAAN-PERTANYAAN,1.,,■1010,1010,Tan Sri Dato’ Haji Muhyiddin bin Mohd. Yassin,"Tuan Yang di-Pertua, terima
kasih kepada Yang Berhormat di atas soalan itu. Sebenarnya tidak ada suatu usaha khusus
dibuat untuk tujuan yang disebut oleh Yang Berhormat tadi kerana profesion perguruan ini
adalah satu profesion yang mulia. Guru adalah satu tenaga yang profesional. Mereka
mempunyai pendidikan yang tinggi dan faham tentang tugas dan tanggungjawab mereka
bukan sahaja kepada profesionnya tetapi juga kepada sekolah dan juga kepada negara.
Maka oleh sebab itu, saya tidak fikir ada keperluan kita, seperti disebutkan tadi,
untuk meyakinkan bahawa mereka ini harus memberikan sokongan padu kepada kerajaan
kerana mereka sebagai pegawai kerajaan biasanya, orang kata, bersikap setia kepada
kerajaan pada hari ini. Itu yang biasa berlaku bukan sahaja dalam sektor pendidikan tetapi
dalam sektor perkhidmatan awam yang lain.
Jadi oleh sebab itu, saya tidak bimbang langsung. Dalam soal ini, apa pun
tohmahan dan tuduhan mana-mana pihak sekalipun hendak buat terhadap guru, mereka
tahu tentang tugas mereka. Pentingnya kita hendak melihat ialah keupayaan mereka
melaksanakan tanggungjawab, kemampuan mereka memberikan ilmu dan pengetahuan
dan membentuk sahsiah, perwatakan, peribadi dan di samping itu membimbing anak-anak
mereka iaitu pelajar-pelajar di sekolah untuk tahu menilai tentang soal kenegaraan, soal
kebangsaan, soal yang berkaitan dengan patriotisme. Ini sebahagian daripada elemen-
elemen yang memang ada kita terapkan dalam proses pembelajaran.
Jadi bagi saya tidak perlu kita merasa ragu. Apa pun inisiatif yang dibuat oleh
pihak kementerian tidak ada yang khusus yang dibuat untuk *conversation process* kerana
mereka tahu tentang tugas dan tanggungjawab mereka, Tuan Yang di-Pertua."
JAWAPAN-JAWAPAN LISAN BAGI PERTANYAAN-PERTANYAAN,1.,,■1010,1010,Dr. Tan Seng Giaw [Kepong],"Tuan Yang di-Pertua, soalan tambahan. Yang
Amat Berhormat, profesion perguruan memang begitu rumit. Bagaimana Yang Amat
Berhormat dapat memastikan guru-guru ini benar-benar mempunyai kualiti bukan seperti
yang kita nampak menjadi guru tuisyen sahaja dan bagaimana kita boleh memastikan
mereka dapat gaji dan pencen yang sepadan dan secocok dengan profesion yang begitu
murni?"
JAWAPAN-JAWAPAN LISAN BAGI PERTANYAAN-PERTANYAAN,1.,,■1020,1020,Dr. Tan Seng Giaw [Kepong],"Yang Amat Berhormat, kita ada 2,623 buah sekolah yang mempunyai murid
kurang daripada 150 orang. Bagaimana kita dapat memastikan sekolah-sekolah ini dapat
guru yang berkualiti?"
JAWAPAN-JAWAPAN LISAN BAGI PERTANYAAN-PERTANYAAN,1.,,■1020,1020,Tan Sri Dato’ Haji Muhyiddin bin Mohd. Yassin,"Tuan Yang di-Pertua,
bagaimana yang telah pun saya jelaskan panjang lebar dalam ucapan ataupun jawapan
awal saya, kita memang menekankan antara lain ialah tentang kualiti guru. Ini kerana isu ini
sudah lama dibincangkan, menjadi minat seluruh lapisan masyarakat termasuk Ahli Yang
Berhormat dan ia diukur dari segi *outcome* iaitu apakah kualiti pelajar yang dapat kita
lahirkan, yang boleh memenuhi tuntutan pembangunan negara dan juga keperluan di
peringkat global. Oleh sebab itu, proses latihan guru ini dibuat sepanjang masa. Pelbagai
bentuk latihan yang telah pun kita sediakan untuk menentukan setiap guru ini mencapai
tahap *proficiency* yang ditetapkan. Kalau mereka tidak sampai ke tahap itu, maka berkala-
kalalah kursus-kursus diadakan untuk guru berkenaan. Jadi, oleh sebab itu penting bagi kita
menentukan supaya tahap pencapaian dan prestasi guru kita ini sentiasa di tingkat yang
terbaik.
Saya akui mungkin ada kelemahan-kelemahan. Dalam rekod yang lalu, kita dapati
ada kekurangan dan ini telah banyak disuarakan. Oleh sebab itu, langkah yang terbesar
yang saya ambil di peringkat kementerian ialah dengan mengadakan kajian yang
menyeluruh dalam soal yang berkaitan dengan sistem pendidikan negara. Bagaimana Yang
Berhormat sedia maklum, kita telah pun siapkan laporan lengkap yang dipanggil sekarang
ini Pelan Pembangunan Pendidikan Malaysia, di mana segala-galanya yang kita fikir wajar
kita beri perhatian termasuk soal bagaimana kedudukan guru itu dapat dimartabatkan,
kualiti guru itu hendak ditingkatkan, itu telah pun dimasukkan dan sudah pun mula kita
laksanakan dan kita tingkatkan untuk masa-masa akan datang.
Soal bayaran gaji, skim perkhidmatan, saya dimaklumkan bahawa guru sekarang
ini mendapat satu skim yang agaknya umum lebih baik daripada sesetengah perjawatan
dalam kerajaan. Waktu mana Perdana Menteri memutuskan untuk memberikan taraf *time
based* di mana proses kenaikan pangkat dan perjawatan itu agak lebih mudah dengan
syarat mereka ini adalah guru yang cemerlang. Maka, banyak juga skim perkhidmatan yang
lain mengatakan mengapa kita tidak mengikut skim perkhidmatan perguruan yang ada
dengan adanya *time based* yang telah pun disediakan ini. Jadi bermakna, itu satu bentuk
pengiktirafan yang telah pun kita berikan untuk melihat profesion perguruan ini bukan
sahaja penting tetapi diberikan pengiktirafan dari segi bentuk ganjaran dan gaji yang
berpadanan.
Soal sekolah kurang murid ini adalah satu daripada masalah yang kita hadapi di
peringkat kementerian. Setakat hari ini, ada beberapa langkah yang telah pun kita ambil
Yang Berhormat. Pertama, kalau ada persetujuan daripada ibu bapa untuk anak-anak
mereka ini berpindah ke sekolah yang lebih besar. Ini kerana dengan sekolah yang lebih
besar, dengan guru yang lebih ramai tersedia, dengan kelengkapan dan kemudahan
infrastruktur yang agak lebih baik, maka tentu ini akan meningkatkan kualiti pembelajaran
murid-murid yang berkenaan.
Ada beberapa buah sekolah di mana PIBG bersetuju maka murid-murid ini
dipindahkan ke sekolah yang lain. Akan tetapi kalau tidak, termasuk sekolah-sekolah jenis
kebangsaan Cina dan Tamil, kita tidak sentuh. Apa yang penting di situ ialah bagaimana
guru yang diperlukan tadi cukup. Kadang-kadang bukan cukup, melebihi daripada *ratio*
pelajar yang ada di sekolah itu. Disebabkan itu, ada juga masalah berbangkit dari segi
kualiti pembelajaran, tidak lengkap peralatan, tidak ada kemudahan.
Oleh sebab itu, kita dalam proses menilai bagaimanakah cara untuk kita melihat ke
hadapan, sama ada boleh diintegrasikan kalau sekolah itu tidak jauh di antara satu sama
lain dengan syarat ibu bapa bersetuju dan memang pihak kementerian tidak ada halangan.
Mungkin satu hari kita perlu cari jalan lain untuk menentukan supaya sekolah kurang murid
ini mempunyai sejumlah pelajar yang mencukupi untuk membolehkan proses pembelajaran
itu berjalan dengan lebih baik lagi."
JAWAPAN-JAWAPAN LISAN BAGI PERTANYAAN-PERTANYAAN,1.,,■1020,1020,Puan Hajah Siti Zailah binti Mohd. Yusoff [Rantau Panjang],"Terima kasih
kerana memberi peluang kepada saya. Soalan tambahan saya ialah saya ingin penjelasan
berkenaan dengan pengambilan guru, penempatan guru terutama lepasan Ijazah Sarjana
Muda Pendidikan, yang mana mereka ini ramai yang menganggur berbanding dengan
Diploma Pendidikan Lepasan Ijazah ataupun Kursus Perguruan Lepasan Ijazah. Seolah-
olah lepasan Sarjana Muda Pendidikan ini ketinggalan mendapat persaingan. Pengambilan
diberi keutamaan kepada lepasan diploma menyebabkan ribuan daripada anak-anak kita
lepasan Sarjana Muda Pendidikan ini menunggu bertahun sedangkan mereka terpaksa
membayar balik pinjaman dan sebagainya. Jadi, sejauh mana keprihatinan kementerian
untuk menangani lepasan Ijazah Sarjana Muda Pendidikan ini yang tidak mendapat tempat
walaupun bertahun telah *graduated*. Itu yang pertama.
Kedua ialah masalah ponteng sekolah, yang mana didapati satu fenomena yang
sangat menggerunkan kita. Kebanyakan sekolah terutama di luar bandar, fenomena
ponteng sekolah, ada satu sekolah sampai 200 pelajar satu hari ponteng. Jadi, sejauh
mana kementerian memantau isu-isu ini? Apakah ini mempunyai kesan kerana cara
pembelajaran yang tidak menarik dan sebagainya menyebabkan pelajar tidak minat dengan
pelajaran? Minta penjelasan."
JAWAPAN-JAWAPAN LISAN BAGI PERTANYAAN-PERTANYAAN,1.,,■1020,1020,Tan Sri Dato’ Haji Muhyiddin bin Mohd. Yassin,"Tuan Yang di-Pertua, isu
penempatan graduan ijazah ini memang kita telah akui ada sedikit masalah terutama dalam
tempoh dua tahun kebelakangan ini. Pertama adalah kerana keputusan kerajaan untuk
melanjutkan tempoh persaraan daripada 58 tahun kepada 60 tahun. Jadi bila kita membuat
perancangan dahulu sepatutnya guru ini sudah bersara, jadi guru itu tidak bersara. Jadi
dengan keadaan begitu, guru di peringkat sama ada di IPG kita atau IPTA yang sudah pun
kita hantar untuk dilatih menjadi guru tidak mendapat tempat itu. Ini kerana kekosongan
tidak berlaku, hendak tunggu sampai mereka ini sudah bersara, barulah dapat di isi. Jadi,
ini tempoh peralihan kerana keputusan dibuat oleh kerajaan untuk melanjutkan tarikh
persaraan tadi.
Namun begitu, kita telah mengambil langkah-langkah yang sewajarnya. Ada
beberapa ribu guru yang telah pun kita kenal pasti sudah pun ditemu duga tetapi belum lagi
dapat ditempatkan sehingga kita dapat kekosongan berlaku. Itu pertama. Kedua ialah
perwujudan jawatan-jawatan baru yang memang bila kita lihat jumlah sekolah itu
bertambah, kita perlu dapat kelulusan jawatan-jawatan baru. Ini menunggu keputusan
daripada pihak Jabatan Perkhidmatan Awam dan kalau itu dapat disegerakan, bermakna
guru-guru yang masih menunggu tadi bolehlah ditempatkan di sekolah-sekolah yang
berkenaan.
Isu disiplin pelajar ini memang kita beri perhatian walaupun boleh saya sebutkan di
sini dari segi peratusan insiden ini jumlahnya adalah amat kecil, tidak sampai 1% kerana
kita ada sejumlah hampir 5.6 juta pelajar. Jadi kalau ada 10 orang atau 20 orang, dari segi
jumlah itu tidaklah sebenar mana tetapi tidak bermakna kita tidak memberikan perhatian.
Tanggungjawab untuk menentukan disiplin ini sentiasa terkawal diletakkan kepada sekolah,
di bawah tanggungjawab guru disiplin. Semua guru di sekolah itu menjaga disiplin tetapi
ada juga guru yang bertanggungjawab khas untuk melihat soal disiplin.
Jadi kalau ada perkara-perkara sebegitu berlaku, memang pun ada laporan yang
kita terima maka kita terpaksa memaklumkan kepada ibu bapa. Ada juga guru-guru sekolah
itu dan pengetua ataupun guru besar pergi ke rumah ibu bapa memberitahu. Kadang-
kadang ibu bapa sendiri tidak tahu bahawa anak mereka ponteng. Keluar dengan pakaian
sekolah tetapi tidak pergi ke sekolah, pergi ke tempat lain. Ini telah kita kenal pasti dan kita
ambil langkah dalam kes-kes tertentu. Kalau ia dianggap tidak berapa serius, maka tidak
ada masalah, kita boleh membimbing mereka.
Akan tetapi kalau ada kes yang serius sampai sudah lama sangat tidak ke sekolah
maka tindakan tertentu terpaksa kita ambil. Namun yang penting ialah peranan ibu bapa
selain daripada sekolah untuk membantu dari segi isu disiplin ini dapat kita atasi Tuan Yang
di-Pertua."
JAWAPAN-JAWAPAN LISAN BAGI PERTANYAAN-PERTANYAAN,2.,,■1020,1020,Tuan Sim Chee Keong [Bukit Mertajam],"minta Menteri Pengangkutan
menyatakan secara terperinci kos-kos untuk pembinaan KLIA2 serta syarikat-syarikat
kontraktor dan subkontraktor yang terlibat dan nilai kontrak setiap syarikat."
JAWAPAN-JAWAPAN LISAN BAGI PERTANYAAN-PERTANYAAN,2.,,■1020,1020,Timbalan Menteri Pengangkutan [Datuk Ab. Aziz bin Kaprawi],"*Assalamualaikum warahmatullahi wabarakatuh,* salam sejahtera dan salam 1Malaysia."
JAWAPAN-JAWAPAN LISAN BAGI PERTANYAAN-PERTANYAAN,2.,,■1030,1030,Timbalan Menteri Pengangkutan [Datuk Ab. Aziz bin Kaprawi],"Tuan Yang di-Pertua, kos terperinci bagi pembinaan KLIA2 mengikut pecahan
utama adalah seperti berikut bagi pembinaan terminal, *runway* dan infrastruktur berkaitan;
nilai kontrak yang diberikan oleh pihak MAHB termasuk kos-kos lain seperti pengurusan
projek, bayaran perunding, *visual docking guidance system, passenger boarding bridge* dan
projek penswastaan adalah sebanyak dalam RM3.38 bilion.
Perincian kos bagi pakej utama adalah seperti berikut:
(i) bangunan terminal KLIA2 yang diberikan kepada UEM–Binapuri
Joint Venture dengan nilai kontrak sebanyak RM1.14 bilion;
(ii) pembinaan *runway* 3 dan sistem *taxiway* oleh KUB Berhad
sebanyak RM240.7 juta;
(iii) *aircraft stands* dengan nilai kontrak sebanyak RM543 juta yang
melibatkan banyak kontraktor, Nippon Road (M) Sdn. Bhd.,
Bayangan Sepadu Sdn. Bhd., Noor Angkasa Enterprise Sdn.
Bhd., Award Konsortium Sdn. Bhd./ SWA Water Malaysia Sdn.
Bhd. Joint Venture;
(iv) kerja tanah untuk bangunan terminal, *apron* dan *runway* 3
sebanyak RM524 juta iaitu Gadang-BJQ Joint Venture dan WCT
Berhad;
(v) kos pembinaan infrastruktur dan utiliti adalah sebanyak RM222
juta yang melibatkan beberapa kontraktor, FCY Construction
Sdn. Bhd., Zeta-Datapuri Joint Venture, Suhati Sdn. Bhd.,
Masterplan Consulting Sdn. Bhd, Pernec Corperation Berhad,
Asia Baru Construction Sdn. Bhd., DMA Services Sdn. Bhd.,
Empire Kelana Malaysia Sdn. Bhd., GTC Global Sdn. Bhd.,
Industronics Berhad, JFA Bina Gemilang, Advance Jupiter Sdn.
Bhd., Orinate Sdn. Bhd., Deloitte Consulting (SEA) Sdn. Bhd.,
IBM Malaysia Sdn. Bhd., Perkasa Sutra Sdn. Bhd., Sky Network
Sdn. Bhd.; dan
(vi) pembinaan *parallel taxiway* dan *runway* 2 dan kos *taxiway*
dengan nilai kontrak sebanyak RM161 juta iaitu Intelligent Plus
Sdn. Bhd., Wira Muhibbah Sdn. Bhd., dan Dimensi Teguh Sdn.
Bhd. Joint Venture.
Bagi pembinaan aset-aset kerajaan yang berkaitan dengan pengoperasian KLIA2.
Jumlah kos yang ditanggung oleh MAHB untuk pembinaan aset-aset kerajaan adalah
sebanyak RM582 juta. Ini termasuk pembinaan jalan, penyelenggaraan tambahan,
pemindahan kerja utiliti dan bayaran konsultan bagi aset-aset kerajaan. Aset-aset ini
termasuk menara kawalan yang baru serta peralatannya berharga RM174 juta.
Pembinaan penghubung jalan dan kemudahan awam adalah sebanyak RM294
juta yang melibatkan Acre Works Sdn. Bhd., Suhati Sdn. Bhd. dan TH Technologies Sdn.
Bhd. Seterusnya, RM114 juta adalah kos lain-lain termasuk bayaran konsultan. Jadi,
keseluruhannya ialah RM3.962 bilion. Terima kasih."
JAWAPAN-JAWAPAN LISAN BAGI PERTANYAAN-PERTANYAAN,2.,,■1030,1030,Tuan Sim Chee Keong [Bukit Mertajam],"Terima kasih Yang Berhormat
Timbalan Menteri atas jawapan yang diberikan. Ikut satu laporan akhbar, kenyataan
Pengerusi Jawatankuasa Kira-kira Wang Negara yang juga Yang Berhormat Pulai,
kerosakan di sekitar KLIA2 amat teruk sekali. Dalam satu laporan media, beliau telah
menggambarkan tempat berhenti kapal terbang ataupun *the apron taxiway* sebagai rosak
teruk macam *damage pumpkin,* sebuah labu yang renyuk.
Siapakah yang akan bakal membiayai kos ini dan berapakah kosnya? Mengapa
kos pembinaan landasan yang menghubung KLIA1 dan KLIA2 yang berjumlah RM100 juta
terpaksa dibiayai oleh kerajaan? Sedangkan saya nampak MAHB telah diperuntukkan
ataupun telah menggunakan RM582 juta tadi untuk pembinaan aset-aset kerajaan
termasuk jalan penghubungan dalam KLIA2. Jadi, saya hendak minta pandangan atau pun
jawapan daripada menteri, terutamanya apabila kos asal telah melambung daripada RM2
bilion hinggalah ke RM3.96 bilion tadi. Terima kasih."
