level_1,level_2,level_3,timestamp,author,speech
USUL,"WAKTU MESYUARAT DAN URUSAN
DIBEBASKAN DARIPADA PERATURAN MESYUARAT",,1810,Timbalan Menteri Kemajuan Luar Bandar dan Wilayah I [Tan Sri Datuk Seri Panglima Joseph Kurup],"Seperti mana kita sedia maklum ia juga akan berlaku kepada sesiapa pun.
Undang-undang diketepikan serta diabaikan. Dalam keadaan yang dialami oleh rakyat
Palestin marilah kita bersama-sama menghulurkan apa juga bantuan yang boleh. Di
samping kita bersatu padu untuk mengutuk tindakan ganas yang dilakukan dan sedang
dilakukan oleh Israel. Soalnya bukanlah soal agama tetapi soal seperti mana rakan-rakan
kita kata sebentar tadi ialah soal keperimanusiaan. Oleh yang demikian, kita juga
menyokong penuh gesaan Yang Amat Berhormat agar tentera-tentera Israel diusir keluar
daripada Palestin. Tuan Yang di-Pertua, usul yang dibentangkan oleh Yang Amat
Berhormat Perdana Menteri, kami sokong dengan sepenuh-penuhnya. Sekian."
USUL,"WAKTU MESYUARAT DAN URUSAN
DIBEBASKAN DARIPADA PERATURAN MESYUARAT",,1812,Dr. Tan Seng Giaw [Kepong],"Tuan Yang di-Pertua, dengan secara ringkas saya
hendak menyokong usul Yang Amat Berhormat Perdana Menteri mengenai keganasan di
Gaza. Sebenarnya saya sangat ingat pada 1967 semasa saya jadi pelajar, saya mengikuti
perang Israel ke atas Palestin di mana dalam beberapa hari sahaja, satu minggu tentera
Arab sudah dikalahkan dengan teruk, tahun 1967. Ketika itu saya pun ada dengar pelbagai
tuduhan, pelbagai cadangan untuk menyelesaikan masalah yang bermula pada tahun 1948
dengan wujudnya negara Israel. Hari ini 42 tahun kemudian saya pun dengar perkataan-
perkataan berwarna-warni dan penuh dengan perasaan yang serupa seperti 42 tahun yang
lampau.
Mungkin 42 tahun akan datang pun kita akan dengar perkataan demi perkataan,
tuduhan demi tuduhan yang seperti ini juga dan tidak akan menyelesaikan masalah. Saya
setuju kita mesti mencari cara, saluran untuk mewujudkan gencatan senjata dengan serta-
merta dan kita mestilah berusaha, berikhtiar untuk mengurangkan ketegangan
kemanusiaan. Ini termasuklah sumbangan material iaitu benda-benda untuk orang-orang
Palestin, orang-orang di Gaza yang sedang menderita. Akan tetapi saya setuju dengan
hujah beberapa Ahli Yang Berhormat bahawa sumbangan ini mestilah dikawal. Yang
Berhormat Jelebu, saya berharap kita semua punca sumbangan ini kita mestilah berhati-
hati supaya disampaikan ke sasaran. Ini memang penting sekali tetapi yang ketiganya kita
mesti wujudkan keamanan dan kesejahteraan di rantau Palestin.
Keempatnya, saya pun setujulah kita hadapkan para penjenayah perang ini
kepada The Hague, Mahkamah Antarabangsa. Selain daripada itu, saya hendak Yang
Amat Berhormat dan juga Yang Berhormat Jelebu memberi perhatian. Justeru itu, tadi ada
cadangan daripada Yang Berhormat Bandar Tun Razak supaya kita tubuhkan satu
rombongan ataupun satu pasukan khas yang terdiri daripada Perdana Menteri, Ketua
Pembangkang dan juga Yang Berhormat Jelebu. Ada satu cadangan oleh Yang Berhormat
Pasir Mas untuk melantik Tun Mahathir sebagai wakil. Akan tetapi bagi saya, saya hendak
memberi peringatan di sini, tahun lepas Tony Blair bekas Perdana Menteri Britain telah
dilantik menjadi envoy untuk menyelesaikan masalah Palestin.
Beliau memang mempunyai pengaruh iaitu pengaruh dengan Amerika Syarikat,
pengaruh dengan European Unions, memang ada pengaruh. Akan tetapi sampai sekarang
saya ada dengar dua, tiga hari yang lepas kenyataan dia tidak sampai mana-mana, tidak
dapat menyelesaikan masalah. Di sini, saya hendak pihak kerajaan terutamanya Yang
Berhormat Jelebu. Di sini saya nampak sekarang Hamas, Fatah. Hamas ada hubung kait
rapat dengan Syria. Memang rapat dengan Syria dan juga dengan Lebanon, Hizbollah. Ini
kita nampak pada keseluruhannya ada Iran, Syria, Hizbollah dan Hamas. Di sebelah yang
lain ada Mesir, Saudi Arabiah dan Jordan. Jadi dua golonganlah, dua kumpulan yang
sebelah situ ada pangkalan Amerika Syarikat."
USUL,"WAKTU MESYUARAT DAN URUSAN
DIBEBASKAN DARIPADA PERATURAN MESYUARAT",,1812,Timbalan Yang di-Pertua [Datuk Ronald Kiandee],"Yang Berhormat kepong
cakap dengan siapa, Yang Berhormat Shah Alam kah?"
USUL,"WAKTU MESYUARAT DAN URUSAN
DIBEBASKAN DARIPADA PERATURAN MESYUARAT",,1812,Dr. Tan Seng Giaw [Kepong],"Tidak apalah kita ini tidak ada parti tidak ada apa-
apalah kita tidak ada berat sebelah pun tidak ada kita semua sokong. Dengan ada
sokongan ini tidak timbullah masalah, Yang Berhormat Shah Alam pun boleh semua pun
boleh. Sebenarnya saya sebutkan Yang Berhormat Jelebu."
USUL,"WAKTU MESYUARAT DAN URUSAN
DIBEBASKAN DARIPADA PERATURAN MESYUARAT",,1812,Timbalan Yang di-Pertua [Datuk Ronald Kiandee],"Ya tetapi pandang Yang
Berhormat Shah Alam."
USUL,"WAKTU MESYUARAT DAN URUSAN
DIBEBASKAN DARIPADA PERATURAN MESYUARAT",,1812,Dr. Tan Seng Giaw [Kepong],"Tidak apalah kita mempelbagaikan pandangan
sekarang. Ada dua golongan ini iaitu golongan Iran dan golongan Saudi Arabiah. Mesir pun
ada berusaha untuk mencapai gencatan senjata tetapi setakat ini masih tidak berjaya. Di
sini Yang Berhormat Jelebu, bolehkah Yang Berhormat Jelebu berusaha, ini penting. Ini
kerana kalau kita ada pasukan khas yang dicadangkan oleh Yang Berhormat Ketua
Pembangkang pun, saya tidak tahulah boleh kita capai kejayaan ataupun tidak, Tun
Mahathir pun. Kalau Tony Blair gagal setakat ini tidak berjaya, siapa lagi akan berjaya?
Siapa lagi yang lebih pengaruh daripada Tony Blair? Akan tetapi yang saya khuatirnya
mungkin Hamas akan adakan satu meluaskan aktivitinya kepada Lebanon misalnya dan
perang itu akan sampai kepada Lebanon pula. Bukan di Gaza sahaja kepada Lebanon. Ini
satu besar kemungkinan."
USUL,"WAKTU MESYUARAT DAN URUSAN
DIBEBASKAN DARIPADA PERATURAN MESYUARAT",,1820,Dr. Tan Seng Giaw [Kepong],"Apakah itu boleh Yang Berhormat Jelebu buat untuk berdialog mungkin bertemu
dengan Hamas ataupun itu Syria, Iran, kerana ini ada kena mengena dengan Iran supaya
kita dapat satu persetujuan perpaduan di kalangan Arab. Kalau tidak silap saya Arab Saudi,
kekayaan itu saya ingat, Malaysia terletak di bawah sekali, tiap-tiap hari dia boleh dapat
satu bilion atau boleh lebih dolar Amerika, keuntungannya. Itu daripada minyak sahaja, kita
tak kira itu logam-logam yang lain itu daripada Arab Saudi, banyak saya ingat daripada itu
umat Islam di seluruh dunia, tiap-tiap kali ada musim haji, awal Muharam, musim haji, tiga
juta, empat juta dan tiap-tiap hari ada umat dari seluruh dunia yang pergi ke Mekah, tiap-
tiap hari dan bukan main, dalam satu musim, tiga-empat bilion dolar Amerika yang
diuntungkan oleh Arab Saudi.
Di Malaysia ini tiap-tiap kali ada rakyat Malaysia yang nak menunaikan haji, 27
ribu. Itu Malaysia sahaja dan sampai 30 ribu orang yang pergi, 27 ribu tiap-tiap orang dan
Arab Saudi sahaja begitu kaya. Saya pun nampak tadi ada pangkalan Amerika Syarikat,
pangkalan tentera Amerika Syarikat di Arab Saudi dan di sini, Saya berharap Yang
Berhormat Jelebu datang berbincang dengan Arab Saudi pasal hal demikian, itu kaya sekali
di dunia dan begitu kaya bukan sahaja dari segi sumber Batu Pahat, dia memang kaya
bukan main, tapi apa masalah di sini, apa masalah dengan Iran sebelah satu dengan Arab
Saudi, Jordan dan sebahagian Malaysia di sebelah sini dan kita tak dapat selesaikan
masalah.
Saya berharaplah dengan adanya usul ini, sekali lagi bagi saya, 40 tahun sejak
1967, saya pun tidak nampak macam mana kita boleh selesai. Saya berharap kerajaan
Malaysia dengan usul ini, kita benar-benar boleh berusaha dengan mengadakan pengaruh
ke atas Iran, ke atas Arab Saudi, ke atas Hamas, dan sebagainya, kerana negara Israel ini,
walaupun dia ada dapat sokongan daripada Amerika syarikat, dia kecil sahaja, berapa juta
orangnya? Enam juta orang dan orang Arab berapa orang, sampai 300 juta orang, enam
juta orang.
Jadi tidak ada, nak bandingkan susah, kalau kita hendak salahkan Amerika
Syarikat pun susah juga. Bukan sokong, saya tidak sokong kekerasan, tidak sokong nak
bunuh kanak-kanak tapi saya pun tahulah Yang Berhormat Batu Pahat dan Yang
Berhormat Arau itu, emosinya cukup. Kalau kita bincang secara waras, susah. Yang
Berhormat Batu Pahat itulah masalah dia dan saya berharap dengan keadaan sedemikian,
300 juta orang, berbanding dengan enam juta orang. Mengapa harus seumpama ini berlaku
dan begitu kaya negara seperti Arab Saudi dan kita wujud masalah seumpama ini. Ini
bermakna, punca-punca itu saya berharap dapat dikaji dengan teliti oleh Yang Berhormat
Jelebu, supaya kita sama-samalah dapat menyelesaikan masalah dan di sini, akhir
sekalilah mengenai usaha kita untuk menyelesaikan masalah kemanusiaan dari segi
kemalangan, dari segi makanan, kesihatan, tempat berteduh,di ari segi bekalan air,
kawalan kesihatan seperti Yang Berhormat Mambong pun ada sebut mengenai itu isu
depleted uranium, white phosphorus, bekalan elektrik, bahan api, jalan masuk dan keluar,
lintasan dan keperluan utama.
Kita beri sumbangan RM1 juta atau lebih, saya berharaplah sampai ke sasaran
kita untuk menyelesaikan masalah keadaan kemanusiaan ini. Sekian terima kasih."
USUL,"WAKTU MESYUARAT DAN URUSAN
DIBEBASKAN DARIPADA PERATURAN MESYUARAT",,1820,Datuk Halimah binti Mohamed Sadique [Tenggara],"Akhirnya bergema suara
wanita. Terima kasih Tuan Yang di-Pertua, saya sebagai seorang wanita Malaysia dan saya
yakin boleh mewakili kaum wanita rakyat Malaysia dan rakyat Parlimen Tenggara berdiri
untuk menyokong usul yang telah dibawa oleh Yang Amat Berhormat Perdana Menteri
Malaysia.
Kami merakamkan setinggi-tinggi penghargaan dan tahniah kepada kerajaan
Malaysia dipimpin oleh Yang Amat Berhormat Perdana Menteri yang telah mengambil
inisiatif untuk mengadakan sidang khas Dewan Rakyat mengenai Palestin dan sekali gus
menjadi sebagai satu bukti jiwa merdeka Malaysia yang tidak terkongkong dalam mana-
mana cengkaman kuasa dunia yang membolehkan kita menyuarakan apa sahaja pendapat
kita memperjuangkan segala macam hak kita dan juga bertindak mengikut kewarasan serta
kekuatan atas landasan kebenaran baik untuk diri kita mahupun pihak yang lain.
Dalam kenyataan yang lebih ringkas, Tuan Yang di-Pertua, Malaysia tidak
mungkin berani sekalipun mampu untuk mengadakan sidang khas seperti ini jika
pemimpinnya hanya lantang di pentas politik tetapi jiwanya tunduk dan terikat kepada
kuasa-kuasa besar yang membuli dan menyembelih manusia yang tidak berdosa. Usul
yang dibawa oleh Yang Amat Berhormat Perdana Menteri Malaysia yang berjiwa merdeka
tadi, menjelaskan segala-galanya dan resolusi nya nanti adalah gambaran tulen dan jelas
keprihatinan kita terhadap Palestin dan kebencian kita terhadap kekejaman Rejim Zionis itu.
Hari ini adalah hari yang ke-17 serangan Israel ke Genting Gaza, tahniah kepada
Malaysia yang telah sama-sama menginisiatifkan permohonan untuk mengadakan
Perhimpunan Agung Khas di bawah Resolusi 377 mengenai Palestin. Walaupun Israel
dengan angkuh dan berani menolak mentah-mentah resolusi perhimpunan itu, kita kesal
dengan sikap-sikap kuasa besar dunia yang berdiam diri terhadap kekejaman ini tetapi tidak
seharusnya ia memudarkan semangat kita untuk terus bersuara dan bertindak secara bijak
untuk mengumpul kekuatan meraih simpati dan persefahaman ke arah usaha untuk
memberikan tekanan kepada Rejim Zionis ini untuk akur dengan resolusi badan dunia yang
ada.
Apa yang berlaku di Palestin sekarang ini adalah jelas sebagai satu pencerobohan
ke sebuah negara, ia tidak layak dipanggil sebagai peperangan walaupun istilah gencatan
senjata mahu digunakan untuk memberhentikan kezaliman Israel kerana penentangan
hanyalah terlalu kecil dan berupa tanda mempertahankan diri. Inilah masanya untuk kita
Malaysia memainkan peranan kita dalam OIC, NAM, ASEAN, malahan Komanwel untuk
mengetengahkan keprihatinan kita terhadap Palestin.
Dalam hal ini, ketegasan bertindak amat diperlukan, kita boleh bertegas tetapi kita
pasti berhadapan dengan keadaan di mana negara-negara Arab yang bukan sahaja tidak
berani bersuara apalah lagi untuk bertindak. Suara kita, haruslah bukan sahaja lantang
tetapi peranan kita seharusnya dirasai dan mesej kita bukan sekadar kebencian kepada
kezaliman mereka, tetapi juga mesej keras yang sekurang-kurangnya akan memberikan
kekuatan kepada mereka yang masih kurang berkeyakinan dan juga kepada mereka yang
kuat tetapi tidak pernah bersatu."
USUL,"WAKTU MESYUARAT DAN URUSAN
DIBEBASKAN DARIPADA PERATURAN MESYUARAT",,1830,Datuk Halimah binti Mohamed Sadique [Tenggara],"Tuan Yang di-Pertua, apakah jenis manusia yang sanggup menyebabkan
kemusnahan dan kehancuran kepada manusia lain dengan cara sewenang-wenangnya?
Apakah dasar yang membolehkan mana-mana negara menyerang, mengebom dan
mengganas di negara lain tanpa rasa malu dan bersalah? Bagaimanakah sebuah negara
boleh dibenarkan bertindak mengetepikan segala peraturan dan hukum antarabangsa serta
mengesampingkan hak asasi manusia untuk melaksanakan niat jahat mereka?
Tuan Yang di-Pertua, kita boleh mengutuk dan mengecam tindakan Israel dan
Rejim Zionisnya. Kita sudah pun melakukannya sejak tahun 40-an lagi. Kekejaman Israel
bukan baru, ia bermula sejak penubuhan negara itu lagi. Atas nama wujudnya sebuah
negara Israel, hak asasi dan kepentingan jutaan rakyat Palestin telah pun dinafikan. Apa
yang menyedihkan kita ialah rakyat Palestin yang menjadi pelarian di buminya sendiri dan
lebih tujuh juta pelarian di dunia pada hari ini lebih separuh merupakan pelarian Palestin.
Terfikirkah kita bagaimanakah keadaannya untuk hidup dalam keadaan tertekan,
tertindas dan terhimpit selama lebih 60 tahun? Anak-anak membesar di khemah-khemah
pelarian, mereka hanya melihat keganasan tentera Yahudi, mereka hanya melihat
pembunuhan di hadapan mata mereka. Mereka hanya melihat bagaimana anggota mereka
dimangsai.
Tuan Yang di-Pertua, kita semua tahu Palestin ialah titik tolak kepada semua
masalah di dunia hari ini. Dari tidak kestabilan perbalahan budaya, krisis agama, malah
keganasan, Palestin menjadi tempat bercambahnya kebencian. Palestin mencorakkan
sikap dan nilai anak-anak muda Muslim di seluruh dunia dari The Arab Streets sehinggalah
ke tanah air kita. Selagi masalah Palestin tidak diselesaikan, selagi itulah kita akan
menghadapi masalah besar dalam konteks keselamatan dan kestabilan dunia.
Tuan Yang di-Pertua, masa untuk kita bercakap dan mengecam sudah pun
berakhir. Ini masa untuk bertindak, kita mesti mengerakkan semua usaha untuk
memastikan Rejim Zionis menghentikan tindakan tidak berperikemanusiaan ini serta-merta.
Kita mahu mereka yang menyokong rejim ini secara membabi buta mencelikkan mata
melihat penanggungan rakyat Palestin yang tidak berdosa ini. Mereka harus disedarkan
tentang tindakan mereka.
Israel tahu bahawa apa pun tindakan kejam yang mereka lakukan tidak akan
mendatangkan sebarang masalah kerana mereka akan terus diberikan sokongan oleh
Amerika Syarikat. Dasar Amerika Syarikat yang pro Israel dan lobi Yahudi yang kuat di
Amerika Syarikat akan memastikan bahawa semua kecaman dan kemarahan penduduk
dunia tidak akan mendatangkan sebarang kudis kepada mereka.
Tuan Yang di-Pertua, kita kesal, rakyat Malaysia kesal Pertubuhan Bangsa-
Bangsa Bersatu telah pun gagal melaksanakan tanggungjawabnya dan tidak mampu untuk
berbuat apa-apa. PBB menjadi badan yang telah pun hilang taring dan kuasanya. Orang
tidak lagi menghormati PBB kerana PBB telah gagal menangani isu Palestin. Pada waktu
yang sama, veto Amerika Syarikat menyebabkan semua keputusan pada peringkat tertinggi
di PBB tidak dapat dilaksanakan.
Kita mahu supaya semua pihak melihat kepada akar umbi masalah ini yang
sebenarnya ialah sikap Amerika Syarikat. Dasar luar Amerika Syarikat harus berubah. Kita
kesal kerana Presiden Bush telah gagal malah bersekongkol dengan Israel dan Israel pada
masa ini mengambil kesempatan daripada peralihan kuasa di Rumah Putih untuk bertindak
ke atas Gaza.
Tuan Yang di-Pertua, kita tidak tahu apakah yang boleh dilakukan oleh Barack
Obama apabila memegang teraju Presiden, tetapi harapan yang kita letakkan adalah terlalu
tinggi kepada Obama. Sekiranya Obama harus bergantung kepada orang-orang yang
masih kuat pengaruh Yahudinya, maka Obama juga tidak akan dapat bertindak secara
berkesan dan Obama juga akan gagal. Tekanan harus diberikan kepada Amerika Syarikat
sebagai naung dan sponsor utama Israel. Mereka hanya tahu satu bahasa sahaja iaitu
bahasa kekerasan. Oleh kerana kita tidak mempunyai kekuatan ketenteraan, maka yang
ada kepada kita semua ialah kuasa ekonomi.
Tuan Yang di-Pertua, saya tidak melihat isu ini sebagai isu politik juga bukan isu
kaum, apalagi isu agama. Masalah Palestin bagi saya ialah masalah kemanusiaan,
masalah sejagat, masalah hidup mati rakyat, masalah kekejaman ke atas kaum wanita dan
kanak-kanak selain terkorbannya rakyat yang tidak berdosa. Tuan Yang di-Pertua, kita
mahu semua negara di dunia memberikan tekanan kepada Amerika Syarikat. Kita tahu
Amerika Syarikat dalam kedudukan ekonomi yang lemah. Mereka harus disakitkan lagi
dengan tindakan bersama daripada semua negara yang bersimpati dengan Palestin.
Kita harus menggerakkan usaha setiap negara baik negara Islam ataupun bukan,
mengenakan tindakan sewajarnya bagi memperingatkan kepada Amerika Syarikat bahawa
kuasa ketenteraan sahaja tidak mencukupi. Mereka harus menghormati undang-undang
sejagat.Undang-undang sejagat bermaksud menggunakan kuasa yang ada untuk mengajar
negara-negara yang ganas dan tidak bertimbang rasa. Kita tahu bahawa Amerika Syarikat
mempunyai tradisi kononnya membantu banyak negara sewaktu kesusahan. Itu yang
menjadikan Amerika Syarikat unik dan kononnya dihormati.
Amerika Syarikat menjadi kuasa besar kerana itu, Amerika Syarikat membantu
negara-negara teraniaya sewaktu Perang Dunia Kedua, Amerika Syarikat mengambil
tindakan ke atas banyak negara lain kerana isu hak asasi. Mengapakah Amerika Syarikat
tidak bertindak sama sekali ke atas Israel yang jelas sengaja melanggar hak asasi manusia
di bumi Palestin? Kita tahu kekejaman Israel ke atas Palestin tidak boleh digambarkan
dengan kata-kata pada hari ini. Segala soal yang membabitkan demokrasi dan hak asasi
manusia tidak ada maknanya lagi dengan cara sokongan membabi buta Amerika Syarikat
ke atas Israel. Dasar itu mesti diubah oleh Barack Obama selepas kegagalan Bush.
Pada hari ini Tuan Yang di-Pertua, saya harap kita akan mengambil tindakan
adalah seperti berikut:
(i) untuk menggerakkan lobi antarabangsa untuk mengubah dasar
Amerika Syarikat terhadap Israel; dan
(ii) untuk mengajar Amerika Syarikat dengan mengambil tindakan
sewajarnya ke atas kepentingan ekonomi Amerika Syarikat di
semua negara yang ada di dunia ini.
Tuan Yang di-Pertua, selagi Amerika Syarikat tidak berubah, Israel juga tidak akan
berubah dan bumi Palestin juga tidak akan berubah. Marilah kita rakyat Malaysia bersatu
tanpa mengira fahaman politik, kaum dan agama bersama-sama memberikan sokongan
yang kuat kepada Yang Amat Berhormat Perdana Menteri kita untuk bertindak membuat
perubahan ke atas nasib rakyat Palestin yang tidak berdosa itu.
Saya mengambil kesempatan untuk mengucapkan terima kasih kepada Mercy
Malaysia dan Aman Malaysia yang telah mewakili Misi Kemanusiaan Malaysia dan terima
kasih kepada rakyat Malaysia yang berperikemanusiaan untuk membantu. Saya juga
mewakili suara wanita Malaysia dan rakyat Parlimen Tenggara menyokong usul yang telah
pun dibentangkan oleh Yang Amat Berhormat Perdana Menteri Malaysia. Sekian, terima
kasih... [Tepuk]"
