level_1,level_2,level_3,timestamp,author,speech
USUL,"WAKTU MESYUARAT DAN URUSAN
DIBEBASKAN DARIPADA PERATURAN MESYUARAT",,1940,Dato' Mukhriz bin Tun Mahathir [Jerlun],"Terima kasih Tuan Yang di-Pertua
kerana diberi peluang kepada saya untuk membahaskan usul ini. Saya mengucapkan
tahniah kepada pihak kerajaan kerana telah membuat keputusan memanggil sidang khas
ini untuk membincangkan satu perkara yang saya anggap amat-amat penting sekali. Lebih-
lebih lagi kebelakangan ini kita lihat kezaliman dan kekejaman yang telah dibuat oleh pihak
Rejim Zionis Israel ini terhadap rakyat Palestin yang tidak berdosa. Saya juga rasa begitu
senang hati apabila melihat bahawa Ahli-ahli Parlimen dari kedua-dua belah pihak Barisan
Nasional dan juga Pakatan Rakyat bersatu hati dalam hal ini dan saya harap selepas ini
banyak lagilah perkara-perkara yang boleh kita berpadu sama untuk membincangkan
semata-mata untuk kebaikan rakyat Malaysia dan juga sejagat.
Tuan Yang di-Pertua, apa yang berlaku di Gaza itu kalau kita lihat di muka akhbar
dipanggil sebagai peperangan. Akan tetapi apa yang berlaku sebenarnya bukan
peperangan kerana kita lihat pada satu pihak satu kuasa tentera yang begitu canggih
sebenarnya mempunyai peralatan ketenteraan yang keempat tercanggih di dunia dan satu
pihak lagi iaitu kumpulan Hamas yang setakat dapat melontar bom yang kecil-kecilan.
Malah hasil daripada lontaran bom itu pun tidak seberapa sangat. Kadang-kadang kita lihat
gambar-gambar anak-anak kecil melontar batu ke arah kereta-kereta kebal. Itu bagi saya
bukan peperangan, dan seperti yang kita sedia maklum, peperangan ini berlaku di medan
perang di antara dua pihak yang lebih kurang sama kuasa ketenteraannya.
Namun apa yang berlaku di Gaza, serangan yang dibuat oleh pihak tentera Israel
ini di Bandar Gaza itu sendiri dan yang menjadi mangsanya bukan anggota-anggota
tentera, tetapi rakyat awam yang biasa termasuk juga anak-anak kecil. Persoalannya ialah
dengan resolusi daripada Pertubuhan Bangsa-Bangsa Bersatu, baru-baru ini di mana
dituntut supaya ada gencatan senjata di antara kedua-dua pihak, sebenarnya saya lebih
mengharapkan Israel yang tidak lagi menyerang Palestin, tetapi kita rasa tidak sempurna
resolusi tersebut kerana ia tidak menuntut seperti Israel mengundur tenteranya daripada
Gaza dan sekitar Palestin sebenarnya dan juga menghentikan blockade ataupun sekatan
yang dianjurkan oleh Israel terhadap Gaza.
Saya rasa begitu cemas mengenai keadaan di Gaza kerana usaha-usaha untuk
menghantar misi kemanusiaan ataupun pasukan penyelamat ke dalam kawasan itu begitu
rumit sekali kerana kita menghadapi banyak masalah untuk masuk ke kawasan Gaza
tersebut dan menghantar bekalan-bekalan ubat-ubatan susu, selimut dan sebagainya.
Yang diperlukan sekarang ini ialah satu ketetapan oleh Pertubuhan Bangsa-Bangsa
Bersatu untuk memaksa Israel membuka sempadan Gaza dengan Rafah di Mesir supaya
pasukan-pasukan penyelamat, pasukan-pasukan relief ini dengan izin dapat masuk ke
Gaza dan membantu hospital-hospital dan klinik-klinik kecil di sekitar Gaza.
Selagi ini tidak berlaku Tuan Yang di-Pertua, saya khuatir bekalan-bekalan
sekarang ini yang timbun banyaknya di Cairo, di Rafa dan juga di belah Jordan dan juga di
Selatan Lubnan tidak akan dapat masuk ke Gaza atau di sekitar Palestin dan sekali gus
membantu rakyat Palestin yang memerlukan. Pada waktu yang sama saya lihat bahawa
tiga hari yang lepas konvoi PBB telah dibedil dan ditembak oleh tentera IDF ataupun Israel
Defense Force dengan izin, dan ini juga satu jenayah perang di mana telah diperakukan
oleh undang-undang dunia bahawa misi kemanusiaan tidak boleh dianiya atau tidak boleh
diserang tetapi itu jugalah yang dibuat oleh rejim ganas Israel ini.
Saya kira selagi PBB tidak dapat memaksa pihak Israel untuk membuka
sempadan, tidak membenarkan pasukan dan konvoi keselamatan ini masuk ke kawasan
tersebut maka misi kemanusiaan ataupun usaha untuk membantu mangsa di Gaza ini tidak
akan dijayakan.
Tuan Yang di-Pertua, saya ingin menyentuh mengenai cadangan yang dibuat oleh
Yang Amat Berhormat Perdana Menteri petang tadi mengenai perwujudan satu tribunal
jenayah perang. Tahun lepas dengan izin the KL Foundation to Criminalize War ataupun
Yayasan Penjenayah Perang Kuala Lumpur telah diwujudkan oleh Organisasi Keamanan
Sejagat Perdana ataupun Perdana Global Peace Organization dengan izin, yang pernah
menganjurkan satu persidangan antarabangsa di Kuala Lumpur ini yang dihadiri begitu
ramai tokoh-tokoh yang cintakan keamanan dari seluruh dunia.
Antara resolusi persidangan tersebut adalah untuk mengujudkan atau
menubuhkan satu mahkamah antarabangsa untuk membicarakan jenayah-jenayah perang
seperti George W. Bush, Tony Blair, John Howard dan juga pemimpin-pemimpin dari Israel.
Saya harap yayasan ini juga boleh dipertimbangkan untuk kita ketengahkan idea ataupun
cadangan untuk membicarakan pemimpin-pemimpin Israel ini di dalam tribunal tersebut.
Walaupun saya sendiri juga sayang kepada keamanan dan kerap kali saya mempromosi
keamanan sebagai cara untuk menyelesaikan konflik di antara negara-negara yang
berkonflik, tetapi sebenarnya siapa yang boleh menahan rasa marah terhadap Rejim Zionis
Israel ini apabila kita lihat gambar-gambar yang begitu menyayat hati yang terpapar dalam
dada-dada akhbar dan juga apabila kita menonton berita di kaca TV.
Oleh sebab itu kadang-kadang rasa juga macam kita hendak minta supaya
kerajaan terus mengisytiharkan perang terus terhadap Israel iaitu perang military. Akan
tetapi saya kira lebih sesuailah kalau kita buat masa ini mengisytiharkan perang ekonomi
terhadap Israel dan sekutunya termasuk Amerika Syarikat dengan memboikot produk-
produk mereka dengan cara yang tersusun. Sebenarnya Tuan Yang di-Pertua, walaupun
kita tidak mempunyai hubungan diplomatik mahupun hubungan perdagangan dengan
Israel, tetapi barangan-barangan buatan Israel khususnya barang-barang pertanian.
Memang masuk ke pasaran kita melalui negara jiran iaitu Singapura. Barang-barang
mereka saya kira dipakej semula di Singapura dan masuk melalui tambak Johor dan dijual
di negara kita ini.
Saya harap pihak berkuasa akan melihat perkara ini dan memastikan bahawa
barang-barang buatan Israel ini tidak dapat dijual di pasaran kita kerana kita tidak mahu
menyumbang kepada tingkah-laku yang begitu kejam dan ganas Israel terhadap rakyat
Palestin. Saya juga setuju dengan saranan oleh beberapa Yang Berhormat tadi untuk
membatalkan rundingan kerajaan kita dengan Amerika Syarikat di dalam Free Trade
Agreement atau FTA. Saya juga berharap bawah syarikat-syarikat GLC khususnya
Petronas yang banyak berdagang dengan negara-negara di sekitar dunia ini supaya henti
menggunakan mata wang US Dollar dan kita juga mungkin elok bincang semula kegunaan
ataupun perwujudan dinar emas seperti yang kerap kali disebut dalam Dewan yang mulia
ini."
USUL,"WAKTU MESYUARAT DAN URUSAN
DIBEBASKAN DARIPADA PERATURAN MESYUARAT",,1950,Dato' Mukhriz bin Tun Mahathir [Jerlun],"Saya tidak perlu bincang dengan lebih lanjut mengenai dinar emas, tapi saya kira
semua orang sudah tahu apa tujuannya dan saya kira inilah masanya untuk kita
menghidupkan semula perbincangan mengenai dinar emas ini. Ini point yang terakhir. Saya
juga rasa begitu kesal sebenarnya Tuan Yang di-Pertua mengenai Pertubuhan Bangsa-
Bangsa Bersatu, OIC dan juga Liga Arab yang kelihatan tidak bertaring, tidak mempunyai
sebarang kuasa untuk melakukan sesuatu terhadap Rejim Zionis Israel ini khususnya PBB,
seperti yang kita sedia maklum diwujudkan selepas Perang Dunia Kedua dengan Majlis
Keselamatan yang sebenarnya sudah tidak relevan lagi.
Dengan kuasa veto yang wujud di tangan Amerika Syarikat dan kuasa-kuasa
besar yang lain, sebenarnya ada juga di kalangan mereka yang tidak lagi boleh dianggap
sebagai kuasa besar, tetapi keadilan yang dituntut serata dunia ini tidak dapat dijalankan
dengan baik oleh PBB dan saya harap apa yang berlaku di Palestin ini diambil sebagai satu
pendorong supaya PBB itu disusun semula.
Inilah masanya untuk kita melakukan perkara ini, kerana kalau tidak kezaliman
seperti yang berlaku di Palestin oleh negara-negara road state seperti Israel ini dengan izin,
akan sentiasa berlaku lagi dan kita sampai bila pun tidak akan mencapai keamanan sejagat
seperti yang diidam-idamkan. Oleh itu Tuan Yang di-Pertua, Jerlun juga mohon
menyokong."
USUL,"WAKTU MESYUARAT DAN URUSAN
DIBEBASKAN DARIPADA PERATURAN MESYUARAT",,1950,Tuan Yang di-Pertua,"Okey, terima kasih. Yang Berhormat Rantau Panjang
selepas itu Yang Berhormat Pasir Salak bersedia. Selepas Yang Berhormat Pasir Salak
Yang Berhormat Wangsa Maju, Yang Berhormat Arau. Selepas Yang Berhormat Arau Yang
Berhormat Gombak dan saya mohon maaf kepada nama yang tidak dipanggil.
Penghabisan sebelum saya panggil menteri untuk menggulung Yang Berhormat Pontian."
USUL,"WAKTU MESYUARAT DAN URUSAN
DIBEBASKAN DARIPADA PERATURAN MESYUARAT",,1952,Puan Hajah Siti Zailah binti Mohd. Yusoff [Rantau Panjang],"Terima kasih
Tuan Yang di-Pertua kerana turut memberi peluang kepada saya untuk sama-sama
membahaskan usul kezaliman dan keganasan terhadap rakyat Palestin.
Saya dahului perbahasan dengan membaca satu maksud firman Allah dalam
surah Al-Maidah ayat 78 yang bermaksud, “Orang-orang kafir Yahudi daripada Bani Israel
telah dilaknat dalam kitab Zabur dan Injil melalui lidah Nabi Daud dan Nabi Isa ibnu Mariam
yang demikian mereka selalu menderhaka dan selalu menceroboh”.
Tuan Yang di-Pertua, saya juga mewakili Muslimat seluruh Malaysia dan rakyat
negara kita seluruhnya mengutuk sekeras-kerasnya kezaliman terhadap kanak-kanak dan
wanita yang tidak berdosa. Ribuan nyawa yang tidak berdosa dibunuh begitu juga
bagaimana ribuan rakyat yang cedera akibat daripada peluru yang telah dikenakan kepada
umat rakyat di Palestin. Diharapkan hasil daripada Persidangan Parlimen pada hari ini
melahirkan satu pelan tindakan yang tegas daripada Kerajaan Malaysia terhadap isu
keganasan ini.
Tuan Yang di-Pertua, seruan jihad dan perjuangan Hamas menentang keganasan
dianggap seruan pengganas oleh Amerika, Israel dan konco-konconya. Walaupun Hamas
menang dalam pilihan raya perundangan Palestin, kerajaan Hamas tidak diiktiraf oleh
Amerika dan konco-konconya malah mereka mengadakan sekatan ekonomi terhadap
rakyat Palestin untuk memulaukan kerajaan Hamas.
Saya juga mencadangkan supaya Malaysia mengusulkan kepada negara umat
Islam khususnya OIC, NAM dan PBB supaya memboikot hubungan ekonomi dengan
Amerika dan Israel dan hendaklah kita umat Islam memboikot hubungan dagang terutama
yang melibatkan penjualan minyak kepada negara Amerika dan konco-konconya, dan kita
mengharapkan supaya kajian balik dibuat terhadap perjanjian FTA sebagaimana yang
disarankan oleh ramai Ahli Yang Berhormat.
Tuan Yang di-Pertua, saya mencadangkan dalam menghadapi isu keganasan ini
yang pertama diadakan solat hajat dan bacaan doa Qunut Nazilah. Hendaklah dikeluarkan
arahan kepada seluruh surau dan masjid di seluruh negara dan hendaklah diarahkan
supaya bacaan doa ini dibacakan setiap hari khusus untuk menghancurkan tentera Israel,
Amerika serta konco-konconya dan diharapkan pihak kerajaan, pihak kementerian supaya
mengedarkan doa-doa kepada seluruh rakyat Malaysia.
Yang kedua, saya mencadangkan supaya Majlis Fatwa Kebangsaan
mengeluarkan fatwa mengharamkan penggunaan produk Amerika dan Israel sebagai tanda
protes dan boikot umat Islam rakyat Malaysia terhadap keganasan di Palestin dan kita
mengharapkan dihentikan sebarang iklan barangan Amerika sama ada melalui TV, akhbar
dan sebagainya yang kita lihat sekarang ini iklan barangan Amerika masih lagi diiklankan di
TV kita termasuklah McDonald, Coca-Cola dan sebagainya.
Kita juga mengharapkan supaya filem-filem Amerika diboikot supaya tidak
ditayangkan melalui media kita dan kita menyeru rakyat Malaysia supaya tidak membeli
minyak di semua stesen minyak yang ada kepentingan Amerika dan konco-konconya
seperti stesen minyak Shell, Esso, BP dan sebagainya. Kita hendaklah menyeru rakyat kita
supaya menggunakan minyak daripada stesen Petronas.
Saya juga mencadangkan supaya disebarkan melalui akhbar perdana senarai
terperinci barangan produk Amerika dan Israel supaya rakyat mendapat pendedahan yang
sebenar barangan yang dikeluarkan ataupun yang dibawa masuk ke dalam negara kita,
supaya rakyat mudah untuk tidak berurus niaga dengan barangan daripada negara-negara
tersebut.
Saya juga menggesa supaya dihentikan penggunaan dolar Amerika dalam urusan
perdagangan luar negara dan peringkat antarabangsa. Sudah sampai masanya kita
menggunakan penggunaan dinar emas sebagaimana yang disebut oleh ramai Ahli Yang
Berhormat. Saya juga mencadangkan supaya kita memberi kemudahan kepada
sukarelawan kita yang ingin pergi membantu umat Islam di Palestin terutama memberi
tambang murah ataupun penerbangan percuma kepada semua sukarelawan yang ingin
memberi sumbangan tenaga mereka untuk membantu umat Islam di Palestin dan saya
mengharapkan insya-Allah semua apa yang kita bincangkan dalam sidang ini diberi
perhatian dan tindakan tegas oleh Kerajaan Malaysia sebagai membuktikan kesungguhan
kita sebagai kerajaan dan rakyat Malaysia untuk menyekat dan mengutuk sekeras-kerasnya
keganasan terhadap umat Islam di Palestin.
Jadi dengan kata-kata itu saya turut menyokong. Terima kasih."
USUL,"WAKTU MESYUARAT DAN URUSAN
DIBEBASKAN DARIPADA PERATURAN MESYUARAT",,1957,Dato' Haji Tajuddin Abdul Rahman [Pasir Salak],"Terima kasih Tuan Yang di-
Pertua. Saya tidak mahu menyentuh perkara-perkara yang telah pun disebutkan oleh
rakan-rakan dalam membahaskan usul yang dibentangkan oleh Yang Amat Berhormat
Perdana Menteri. Cuma saya ingin berikan pandangan iaitu kebanyakan daripada
cadangan yang dibuat dalam usul yang dibentangkan oleh Perdana Menteri adalah
merupakan cadangan yang menyeluruh, yang boleh disimpulkan sebagai pendirian
kerajaan dan rakyat Malaysia terhadap isu apa yang berlaku di Palestin ataupun di Gaza.
Walau bagaimanapun, dalam masa yang sama kita memberi sokongan, kita juga
ingin bersikap realistik dalam hal ini, iaitu mengecam Israel semua orang kecam.
Mendesak Security Council untuk mengadakan persidangan membuat keputusan sudah
pun bersidang, tetapi Israel tidak patuh dan kita perlu mendesak lagi, itu kena sokong dan
juga kita mendesak supaya PBB mengadakan perhimpunan dan membuat ketetapan
mengutuk dan juga mengambil tindakan terhadap Israel pun boleh kita lakukan. Kita
menyeru kepada proses damai secara perundingan kemudian kita hendak bekerjasama
dengan OIC, NAM, Arab League dan sebagainya. Pun ini usul-usul yang biasa kita buat di
tempoh waktu yang lalu. Malaysia akan menyokong perjuangan Palestin. Memang selama
ini pun kita sokong. Menghulurkan bantuan setiap kali berlaku tragedi dan kejadian kita juga
hulurkan bantuan dan kita minta supaya United Nations menubuhkan tribunal jenayah.
(cid:1) **2000**
Ini satu usaha yang mungkin dapat diusahakan tetapi walau bagaimanapun Tuan
Yang di-Pertua, Yahudi kita tahu semua terutama orang Islamlah. Yahudi ini satu bangsa
yang ingin menguasai dunia ini. Dan kuasa dalam bidang ekonomi dalam politik,
ketenteraan dan mereka merasakan mereka berhak untuk melakukan apa sahaja. Dan
siapa-siapa yang menentang ataupun menghalang kepada matlamat mereka, mereka akan
perangi. Ini satu yang kita semua tahu.
[Timbalan Yang di-Pertua (Datuk Dr. Haji Wan Junaidi Tuanku Jaafar)
**mempengerusikan Mesyuarat]**
Jadi saya berpendapat sebagaimana yang dinyatakan oleh rakan-rakan
berdasarkan kepada sejarah, saya rasa kita hanya dapat mengatasi buat sementara sahaja
apa yang berlaku sekarang. Manakala Israel akan terus dengan sikap keangkuhan dan
sikap yang tidak kira kepada perikemanusiaan dan sedia untuk berperang untuk berapa
ratus tahun ataupun untuk sehingga hari kiamat. Selagi mereka merasakan mereka kuat.
Jadi dengan sebab itu kekuatan Israel itu hendaklah dilihat bagaimana kita boleh
mengurangkannya, bagaimana mereka itu boleh dilemahkan. Hanya apabila mereka lemah
maka keamanan akan tercapai, mereka tidak berupaya untuk melakukan jenayah seperti
mana yang telah mereka lakukan dalam sejarah kehidupan mereka beribu tahun, beratus
tahun yang lalu.
Jadi saya berpendapat di samping kita untuk melemahkan mereka dari segi
ekonominya, dari segi ketenteraannya, kita juga perlu memperkuatkan diri kita sendiri.
Kalau kita kuat, dia akan jadi lemah; kalau kita lemah, dia jadi kuat. Ini perkara yang perlu
dilihat. Saya ingin menyeru kepada ataupun mencadangkan satu dua practical action
ataupun tindakan yang praktikal iaitu negara-negara Arab yang berjiran dengan Israel,
mereka mempunyai kekayaan sebagaimana yang disebutkan tadi. Dan kenapa tidak
digunakan kekayaan ini untuk membina satu kekuatan pertahanan yang hebat, yang mana
digeruni dan ditakuti oleh pihak musuh iaitu Israel. Kenapa segala kekuatan ini, segala
khazanah ini tidak digunakan? Malah kekayaan ini diletakkan di dalam satu tempat atau
beberapa tempat yang membantu kepada kekuatan Israel.
Bank-bank dipenuhi dengan wang-wang daripada kekayaan dunia Arab. Kenapa
tidak dikeluarkan wang-wang ini daripada bank-bank Yahudi yang dikuasai oleh Yahudi di
negara Arab itu? Itu akan melemahkan satu cara dan gunakan wang ini dengan cara yang
betul untuk membina kekuatan. Kekuatan bangsa Arab, kekuatan orang Islam, kekuatan
masyarakat dunia yang anti kepada keganasan. Ini kita tidak lakukan, jadi dengan sebab itu
saya rasa Malaysia sebuah negara yang sekarang ini menjuarai kedamaian dunia,
menjuarai suatu gagasan yang akan membela mereka yang dizalimi tidak kira agama dan
sebagainya. Ini perlu melihat dalam skop yang lebih luas lagi membawa satu perubahan
dari segi pemikiran, anjakan paradigma di kalangan masyarakat Arab, masyarakat Islam
dunia ketiga.
Tidak cukup dengan bantuan hanya beberapa juta ringgit, tidak cukup dengan
makanan, tidak cukup dengan perubatan. Dia tidak menyelesaikan masalah ketidakstabilan
dan kekejaman yang dilakukan oleh pihak Israel ini. Mereka akan terus melakukan apabila
ada peluang, apabila terusik sedikit. Jadi perjuangan ini adalah perjuangan yang menuntut
kepada kesungguhan dan saya rasa kerajaan Malaysia di bawah kepimpinan Menteri-
Menteri, Perdana Menteri dan juga disokong oleh seluruh rakyat Malaysia pelbagai kaum
yang cinta kepada kedamaian kita dapat. Saya rasa kita dapat melakukannya. Jadi Tuan
Yang di-Pertua, saya juga mohon menyokong terima kasih."
USUL,"WAKTU MESYUARAT DAN URUSAN
DIBEBASKAN DARIPADA PERATURAN MESYUARAT",,1957,Timbalan Yang di-Pertua [Datuk Dr. Haji Wan Junaidi Tuanku Jaafar],"Saya
ingat Wangsa Maju tidak hendak cakap. Ya, sila Yang Berhormat."
USUL,"WAKTU MESYUARAT DAN URUSAN
DIBEBASKAN DARIPADA PERATURAN MESYUARAT",,2005,Tuan Wee Choo Keong [Wangsa Maju],"Terima kasih Tuan Yang di-Pertua.
Saya berdiri untuk mengambil bahagian dalam perbahasan usul ini dan saya menyokong
dengan sepenuhnya apa yang dicadangkan oleh kerajaan. Tuan Yang di-Pertua, tindakan
biadab terbaru Zionis terhadap rakyat Palestin mesti dikutuk sekeras-kerasnya oleh
bukannya Malaysia sahaja, sedunia. Serangan terbaru ini adalah rintangan dari pelbagai
bentuk pencerobohan dan perlanggaran hak asasi rakyat Palestin. Sejak rejim ini mengusir
rakyat Palestin dari tanah air mereka pada tahun 1948 dalam peristiwa Nakba, malapetaka
dan menceroboh Baitul Maqdis dan menguasai Masjid Al-Aqsa sejak tahun 1967.
Rakyat di Semenanjung Gaza yang menderita sejak 18 bulan yang lalu akibat
penutupan sempadan oleh Israel sehingga terputus bekalan makanan, ubatan, bahan api
dan bekalan air bersih kini menghadapi serangan bertubi-tubi Israel dengan menggunakan
jet pejuang F16 dan helikopter penggempur Apache ke atas sasaran awam. Bilangan orang
awam di Gaza yang terbunuh kini telah mencecah lebih daripada 800 orang dan lebih
beribu-ribu mengalami kecederaan. Sebilangan besar dari bangsa adalah wanita dan
kanak-kanak. Bilangan kematian di kalangan rakyat Palestin dijangka akan terus meningkat
kerana masih ramai mangsa yang tertimbus dalam runtuhan bangunan. Serangan juga
akan diteruskan oleh Israel tanpa ada tanda-tanda ia akan dihentikan.
Bahkan pasukan darat tentera Israel juga sedang bersedia di perbatasan Gaza
dan akan melancarkan serangan besar-besaran pada bila-bila masa. Sudah tentu ini akan
meningkatkan lagi kemusnahan, kematian dan kematian di kalangan penduduk-penduduk
di Gaza. Tuan Yang di-Pertua, dakwaan Israel bahawa serangan terbaru ini adalah
merupakan langkah keselamatan untuk mempertahankan diri mereka mesti ditolak. Ini
adalah satu pembohongan yang nyata.
Pada hakikatnya Israel telah melancarkan serangan ini sejak enam bulan lalu
sebaik sahaja tempoh gencatan senjata terakhir 19 Disember yang lalu. Serangan roket
oleh pejuang Palestin hanya dijadikan sebagai alasan untuk mewajarkan tindakan Israel.
Apa yang berlaku ialah serangan roket pejuang merupakan serangan balas ke
atas beberapa provokasi tentera Israel termasuk tindakan menceroboh dalam wilayah Gaza
ketika tempoh gencatan senjata sedang berkuat kuasa. Serangan ini juga dilakukan pada
akhir musim persekolahan di Gaza. Ini jelas menunjukkan bahawa Rejim Zionis mempunyai
motif malafide untuk memaksimumkan jumlah kematian orang awam terutamanya wanita
dan kanak-kanak yang berada di tempat kediaman masing-masing. Serangan yang
ditujukan kepada balai polis yang semestinya berada di dalam pusat bandar jelas bertujuan
untuk meningkatkan kematian dan kecederaan di kalangan orang awam."
USUL,"WAKTU MESYUARAT DAN URUSAN
DIBEBASKAN DARIPADA PERATURAN MESYUARAT",,2010,Tuan Wee Choo Keong [Wangsa Maju],"Tuan Yang di-Pertua, saya menggesa rakyat Malaysia supaya tidak terpengaruh
dengan media Barat dan kenyataan pemimpin-pemimpin US iaitu Amerika Syarikat, Israel,
Mesir dan pihak berkuasa Palestin yang terus mengelak daripada membicarakan isu
sebenar di belakang penentangan rakyat Gaza dan Palestin. Pada hakikatnya, Israel telah
menutup sempadan Gaza dan menghalang makanan ubat, bahan api, bekalan air bersih
dan sebarang bentuk bantuan kemanusiaan. Bahkan penderitaan yang ditanggung oleh
rakyat Gaza sudah sampai ke tahap di mana mereka terpaksa makan rumput di tepi jalan
untuk meneruskan kehidupan mereka. Dengan ini, tindak tanduk rakyat Palestin adalah
selari dengan Konvensyen Geneva yang merestui hak mereka untuk mempertahankan diri
daripada pencerobohan asing dan juga pendudukan haram oleh mana-mana pihak.
Tuan Yang di-Pertua, saya bersama rakyat Malaysia ingin merakamkan rasa amat
sedih yang amat mendalam ke atas penderitaan yang menimpa rakyat Palestin di Gaza
dalam suasana ketika seluruh dunia Islam menyambut Maal Hijrah 1430H dan dunia
menyambut tahun baru 2009. Apakah ia menandakan tahun baru ini menjanjikan
penderitaan berpanjangan kepada rakyat Palestin? Oleh itu saya menggesa seluruh lapisan
masyarakat bangkit untuk menyuarakan bantahan ke atas kebiadaban dan juga
keangkuhan Rejim Zionis era, bahkan Argentina Tuan Yang di-Pertua yang mana
merupakan negara yang sebilangan besar rakyatnya beragama Kristian juga mengutuk
sekeras-kerasnya serangan tentera Israel terhadap penduduk Palestin di Gaza dan
Argentina telah halau keluar Duta Israel dari negaranya kerana sikap Israel yang biadab ini.
Tuan Yang di-Pertua, saya juga cadangkan Kerajaan Malaysia perlu menurut
Argentina dan menghalau keluar Duta Amerika Syarikat untuk menunjukkan Malaysia
adalah berdiri bersama-sama dengan Palestin.
Tuan Yang di-Pertua, saya ingin merakamkan di Dewan yang mulia ini bahawa
saya difahamkan bahawa Amerika Syarikat dan United Kingdom tidak menghantar wakil ke
Parlimen hari ini. Ini menunjukkan bahawa kedua-dua negara ini tidak memberi
penghormatan kepada negara kita. Ahli-ahli Yang Berhormat, janganlah kita memberi
peluang kepada kedua-dua negara ini menghina negara kita with impunity, dengan izin.
Daripada fakta ini saya ingin mencadangkan bahawa Yang Berhormat Menteri
Luar Negeri Ahli Parlimen Jelebu perlu memanggil balik kedua-dua duta kita di kedua-dua
negara untuk memprotes terhadap sikap mereka yang tidak bertanggungjawab yang
menghina negara kita. Kita jangan berikan peluang kepada mereka lagi. Saya harap Yang
Berhormat Jelebu akan ambil tindakan dengan segera... [Tepuk]
Saya menyokong Kerajaan Malaysia untuk mengemukakan usul kepada
Pertubuhan Bangsa-bangsa Bersatu untuk menubuhkan Tribunal Jenayah Antarabangsa
untuk menyiasat, mendakwa dan menghukum penjenayah perang Israel Zionis ini yang
terlibat dengan kekejaman dan keganasan terhadap rakyat Palestin yang tidak berdosa
khasnya kanak-kanak, warga tua dan wanita.
Tuan Yang di-Pertua, saya mencadangkan supaya Kerajaan Malaysia seharusnya
mengutuk Kerajaan Amerika Syarikat yang telah menyokong tindakan Israel ke atas
serangan yang tidak berperikemanusiaan terhadap rakyat di Gaza yang mana Israel telah
membunuh lebih daripada 800 penduduk awam Palestin yang saya kata tidak berdosa
terutamanya kanak-kanak dan wanita.
Saya juga mencadangkan Kerajaan Malaysia seharusnya perlu melancarkan satu
kempen untuk memboikot barangan-barangan daripada Amerika Syarikat dan Israel seperti
McDonalds, Starbuck, Cola-Cola, kereta Chevrolet, Ford dan lain-lain... [Tepuk]
Apa yang penting sekarang, saya harap Ahli Yang Berhormat dari Jelebu yang
juga Menteri Luar Negeri dengan segera memanggil balik duta kita dari Amerika Syarikat
dan United Kingdom kerana kerajaan mereka yang saya kata tadi tidak menghormati
negara kita, tidak menghantar wakil ke sini sedangkan semua negara yang ada duta di
Malaysia hantar wakil mereka ke sini. Terima kasih."
USUL,"WAKTU MESYUARAT DAN URUSAN
DIBEBASKAN DARIPADA PERATURAN MESYUARAT",,2016,Dato' Ismail Kasim [Arau],"Terima kasih Tuan Yang di-Pertua. Assalamualaikum
warahmatullahi wabarokatuh."
USUL,"WAKTU MESYUARAT DAN URUSAN
DIBEBASKAN DARIPADA PERATURAN MESYUARAT",,2016,Datuk Haji Mohamad bin Haji Aziz [Sri Gading],Waalaikumussalam.
