level_1,level_2,level_3,timestamp,author,speech
,,,1430,,[Tuan Yang di-Pertua **mempengerusikan Mesyuarat**]
PEMASYHURAN TUAN YANG DI-PERTUA,MESYUARAT KHAS DI BAWAH PM 11(3),,1430,Tuan Yang di-Pertua,"Ahli-ahli Yang Berhormat, dengan segala hormatnya ingin
saya maklumkan bahawa Yang Amat Berhormat Perdana Menteri selaku Ketua Majlis
Dewan Rakyat telah memaklumkan kepada saya pada 7 Januari 2009 supaya diadakan
satu Mesyuarat Khas pada hari ini selaras dengan peruntukan Peraturan Mesyuarat 11(3).
Inisiatif Yang Amat Berhormat Perdana Menteri serta kerajaan menunjukkan
betapa Kerajaan Malaysia memandang serius pergolakan dan keganasan yang sedang
berlaku ke atas Wilayah Palestin di Gaza. Dalam kesempatan ini suka saya mengingatkan
Ahli-ahli Yang Berhormat sekalian agar memanfaatkan sepenuhnya peluang ini untuk
membahaskan usul yang akan dicadangkan oleh Yang Amat Berhormat Perdana Menteri
dengan sebaik-baiknya. Sekian, terima kasih."
USUL,"MENGECAM PENCEROBOHAN ISRAEL
KE ATAS WILAYAH PALESTIN DI GAZA",,1430,Tuan Yang di-Pertua,Yang Amat Berhormat sila.
USUL,"MENGECAM PENCEROBOHAN ISRAEL
KE ATAS WILAYAH PALESTIN DI GAZA",,1433,Perdana Menteri [Dato’ Seri Abdullah bin Haji Ahmad Badawi],"Terima kasih
Tuan Yang di-Pertua, izinkan saya juga mengucapkan terima kasih kepada semua Ahli
Yang berhormat yang hadir walaupun notis yang dikeluarkan mengenai sidang hari ini
adalah secara tergempar.
Saya berterima kasih atas keprihatinan Ahli-ahli Parlimen Malaysia tidak mengira
agama, bangsa atau haluan politik yang bersedia membahaskan bersama satu isu yang
sangat rapat di hati rakyat Malaysia iaitu penderitaan semasa yang dialami rakyat Palestin
dan masa depan keamanan dan keselamatan bagi negara Palestin. Semuanya telah
menjadi terancam akibat serangan berterusan ke atas Wilayah Palestin oleh Rejim Zionis
Israel. Semuanya tindak tanduk Israel khususnya pengeboman, pembedilan dan
pemusnahan harta benda tanpa sebarang timbang rasa yang sedang dilakukan oleh
mereka di Wilayah Gaza perlu dikecam dan dikutuk oleh seluruh dunia.
Demi mempertahankan kredibiliti negara, kita harus bersepakat menjelaskan
kepada seluruh dunia akan pendirian Malaysia terhadap tindakan pencerobohan dan
kezaliman yang tidak berperikemanusiaan oleh Rejim Zionis ke atas rakyat Palestin
khususnya mereka yang berada di Wilayah Gaza.
Tuan Yang di-Pertua, maka dengan ini saya ingin mencadangkan bahawa
mengikut peruntukan Peraturan Mesyuarat 27(3) Dewan ini mengambil ketetapan-
ketetapan berikut:
“**BAHAWA** Israel telah melancarkan serangan ketenteraan yang
dinamakan Operasi ‘Cast Lead’ pada 27 Disember 2008 ke atas Wilayah
Palestin di Gaza meliputi pengeboman dari udara dan diikuti dengan
serangan oleh pasukan tentera darat bermula pada 3 Januari 2009;
**BAHAWA** serangan Israel ke atas Wilayah Palestin di Gaza merupakan
tindakan yang mencabuli Undang-undang Antarabangsa, Undang-undang
Hak Asasi Manusia, Undang-undang Kemanusiaan Antarabangsa,
Piagam Pertubuhan Bangsa-Bangsa Bersatu serta merupakan jenayah
perang yang menyalahi Konvensyen Keempat Geneva 1949
Perlindungan Orang-orang Awam dalam masa perang;
**BAHAWA** rakyat Malaysia berpegang teguh kepada pendirian bahawa
tiada alasan kukuh bagi penggunaan kekerasan yang dilakukan secara
tidak seimbang, sembarangan dan melampau ke atas Wilayah Palestin di
Gaza dan dengan itu menolak tindakan hukuman kolektif yang diambil ke
atas rakyat Palestin di Gaza; dan
**BAHAWA** rakyat Malaysia berasa sangat dukacita dan kesal dengan
ketidakmampuan masyarakat antarabangsa, terutamanya Majlis
Keselamatan Bangsa-Bangsa Bersatu, untuk menghentikan serta-merta
keganasan negara Israel yang dilakukan ke atas Wilayah Palestin di
Gaza.
DENGAN INI Dewan ini mengambil ketetapan seperti berikut:
(1) Mengecam sekeras-kerasnya serangan
ketenteraan Israel ke atas Wilayah Palestin di
Gaza sehingga mengakibatkan kehilangan
nyawa rakyat awam Palestin, termasuk
golongan wanita, kanak-kanak termasuk bayi
dan warga tua dan menggesa pengunduran
menyeluruh Israel dari Wilayah Palestin di
Gaza.
(2) Menggesa Majlis Keselamatan Pertubuhan
Bangsa-Bangsa Bersatu membuat ketetapan
supaya Israel menghentikan serta-merta
serangan ketenteraannya ke atas Wilayah
Palestin di Gaza melalui gencatan senjata dan
memutuskan untuk menempatkan pasukan
pengaman Pertubuhan Bangsa-Bangsa
Bersatu bagi menguatkuasakan gencatan
senjata tersebut.
(3) Menggesa Perhimpunan Agung Pertubuhan
Bangsa-Bangsa Bersatu supaya mengadakan
Sesi Tergempar Khas Perhimpunan Agung
Pertubuhan Bangsa-Bangsa Bersatu ‘Uniting
For Peace’ di bawah Resolusi 377A(V)
sekiranya pelaksanaan ketetapan Majlis
Keselamatan Pertubuhan Bangsa-Bangsa
Bersatu gagal menguatkuasakan ketetapan
yang diputuskan pada 8 Januari 2009.
(4) Menggesa pihak-pihak yang terlibat supaya
menyambung semula usaha terhadap proses
damai serta melaksanakan dan mematuhi
pelbagai resolusi yang telah ditetapkan oleh
Pertubuhan Bangsa-bangsa Bersatu
berhubung isu Palestin dan konflik Arab–Israel.
(cid:1) **1440**
(5) Memutuskan Malaysia bekerjasama dengan negara
anggota Pertubuhan Persidangan Islam, Pergerakan
Negara-negara Berkecuali, Liga Arab dan negara-
negara sependapat untuk mendukung prinsip-prinsip
undang-undang antarabangsa dan Piagam Pertubuhan
Bangsa-Bangsa Bersatu dalam menangani konflik yang
berlaku di Timur Tengah sekarang;
(6) Menzahirkan sokongan padu rakyat Malaysia kepada
perjuangan rakyat Palestin ke arah mewujudkan negara
Palestin yang merdeka dan berdaulat;
(7) Menyeru rakyat Palestin supaya bersatu padu dengan
tujuan mempertahankan hak mutlak dan menubuhkan
negara Palestin yang merdeka dan berdaulat;
(8) Merayu kepada masyarakat antarabangsa supaya
menghulurkan bantuan kemanusiaan kepada
penduduk-penduduk Wilayah Palestin di Gaza dengan
serta-merta;
(9) Menggesa Perhimpunan Agung Pertubuhan Bangsa-
bangsa Bersatu untuk menubuhkan serta-merta tribunal
jenayah antarabangsa untuk Palestin untuk menyiasat
dan mendakwa penjenayah perang Israel yang disyaki
terlibat... [Tepuk] Dengan kekejaman dan keganasan ke
atas rakyat Palestin dan sebelum mengambil keputusan
untuk menyampaikan resolusi ini kepada semua Dewan
Perundangan dan Parlimen yang berkenaan khasnya
Kongres Amerika Syarikat, Parlimen Britain dan
Parlimen Kesatuan Eropah.
Tuan Yang di-Pertua, saya ingin sekali lagi mengucapkan ribuan terima-kasih
kepada Tuan Yang di-Pertua kerana membenarkan Dewan yang mulia ini membahaskan
isu serangan Israel ke atas Wilayah Gaza pada petang ini. Tuan Yang di-Pertua, Israel
melancarkan serangan yang diberikan nama Cast Lead pada 27 Disember 2008
menggunakan kelengkapan perang yang serba canggih termasuk jet pengebom F16.
Tentera udara Israel telah mengebom lebih 200 rakyat Palestin pada hari pertama itu
sahaja. Lapan hari kemudian, pada tanggal 3 Januari 2009, serangan ke atas Gaza telah
diperhebat oleh Israel dengan mengguna tentera darat termasuk serangan dan bedilan oleh
beratus kereta kebal yang besar.
Pada hari ini, sekurang-kurangnya 800 orang telah mati di Gaza. Lebih 3,000
orang cedera. Hampir 15,000 orang telah menjadi pelarian dalam negeri kerana hendak lari
dari kawasan pertempuran. Persatuan Palang Merah Antarabangsa (ICRC) dalam satu
laporannya pada tarikh 5 Januari 2008 menyatakan bahawa keadaan himpunan manusia di
Gaza sangat membimbangkan kerana makanan, bahan bakar, ubatan, dan keperluan-
keperluan asas yang lain terlalu kurang bagi penduduk setempat.
Pada 8 Januari 2009, atas permintaan dari Malaysia dan Brazil, Presiden
Perhimpunan Agung Pertubuhan Bangsa-Bangsa Bersatu atau UNGA dengan izin, telah
mengumumkan bahawa beliau akan mengadakan sidang tergempar UNGA untuk bersidang
dan mengambil sesuatu keputusan yang sesuai khususnya untuk mendesak Majlis
Keselamatan Bangsa-Bangsa Bersatu atau Security Council dengan izin, supaya bertindak
untuk mengisytiharkan gencatan senjata tanpa syarat dan memaksa pihak Israel berundur
dari bumi Gaza. Seolah-olah bertujuan menghalang berlakunya Perhimpunan Agong PBB
hasil permintaan dari Malaysia dan Brazil itu, Majlis Keselamatan berjaya bersidang dan
meluluskan satu ketetapan atau resolusi pada 9 Januari 2009.
Harap Ahli Yang Berhormat sekalian ambil perhatian bahawa Majlis Keselamatan
hanya bertindak setelah mereka membiarkan serangan Israel berlaku selama dua minggu
tanpa sebarang keredaan dan kita semua tahu mengapa Majlis Keselamatan tiada maya
untuk bertindak. Israel tidak mahu Majlis Keselamatan bertindak dan dia ada penyokong
kuat dalam Majlis Keselamatan yang menghalang Majlis Keselamatan dari mengambil
tindakan. Sebenarnya mengenai isu Palestin, Amerika Syarikat telah menggunakan kuasa
vetonya sebanyak 28 kali dalam tempoh 36 tahun sejak 1973 iaitu menyekat Majlis
Keselamatan supaya tidak dapat bertindak.
Marilah kita bersama-sama menyeru bakal Presiden Barack Obama melakukan
sesuatu yang benar-benar membawa pembaharuan. Amerika Syarikat mengaku negara
demokrasi yang terulung di dunia. Mengapa ia menolak keputusan pilihan raya umum di
Palestin pada tahun 2006, yang telah memberi kemenangan kepada parti Hamas. Amerika
Syarikat mengaku dirinya jaguh mempertahankan hak asasi manusia. Mengapa ia
membiarkan Israel membunuh kanak-kanak, orang tua dan wanita biasa serta orang-orang
awam lain. Semuanya tidak berdosa.
Benar pada 9 Januari 2009, Majlis Keselamatan telah meluluskan resolusi
bernombor 1860 (2009) yang mengisytiharkan gencatan senjata di Gaza mendesak supaya
semua pihak mematuhi gencatan senjata dan tentera Israel diarah undur keluar daripada
wilayah Palestin tetapi resolusi ini senyap sahaja tentang kepungan atau blockade yang
dikenakan oleh pihak Israel ke atas Palestin. Ada dua perkara yang sangat tidak
memuaskan bersabit resolusi ini:
(i) semua 14 negara anggota Majlis Keselamatan telah mengundi
menyokong resolusi tersebut melainkan Amerika Syarikat yang
telah mengambil keputusan mengundi berkecuali; dan
(ii) resolusi itu tidak mengandungi sebarang peruntukan untuk
mengadakan satu pasukan antarabangsa sama ada satu
kumpulan pengawasan atau satu pasukan tentera peacekeeping
dengan izin, untuk menyelia gencatan senjata dan menentukan
segala arahan dipatuhi.
Oleh kerana tiadanya kumpulan atau pasukan antarabangsa
maka tiada siapa pun untuk menentukan supaya tentera Israel
berundur keluar daripada Wilayah Gaza. Tiada siapa untuk
menentukan gencatan senjata benar-benar berlaku. Inilah
kelemahan resolusi bernombor 9567 itu.
Akibatnya pada ketika ini, iaitu sudah empat hari gencatan senjata diisytiharkan
iaitu pada masa Dewan yang mulia ini sedang bersidang serangan hebat Israel ke atas
Gaza masih berlaku dan masih berterusan. Orang-orang di Gaza terus mati dan cedera.
Bilangan yang mati terus bertambah hari demi hari. Bilangan yang cedera dan kehilangan
rumah tangga serta harta benda bertambah hari demi hari. Bekalan makanan, bahan bakar,
ubatan dan keperluan asas terus berkurangan hari demi hari. Bekalan bantuan dari dunia
luar tidak dapat sampai kepada mangsa-mangsa peperangan yang memerlukan kerana
jalan-jalan ditutup dan tidak selamat bagi pembantu-pembantu untuk bergerak bebas.
Barang bantuan juga tidak dapat sampai menerusi Pantai Gaza kerana laluan sekeliling
Gaza dikepong atau dengan izin, di blokade oleh Israel.
Serangan ke atas Wilayah Gaza kali ini adalah yang terburuk pernah dilakukan
oleh Rejim Zionis terhadap Palestin untuk penaklukan wilayah itu dalam tahun 1967.
Kanak-kanak Palestin ada yang mati terbunuh kena tembak dengan izin, sniper fire.
Pengeboman dan bedilan kereta kebal Israel secara rambang telah kena tiga buah sekolah
yang ditadbir oleh United Nations Relief and Works Agency dan serangan ini
mengorbankan berpuluh anak sekolah. Kekejaman tentera Israel ke atas Palestin tiada
tolok bandingnya.
Malaysia berasa amat sedih dan kesal dengan situasi yang berlaku di Gaza akibat
serangan dan tindakan kejam tentera Israel beratus orang rakyat Palestin yang tidak
berdosa telah menjadi mangsa. Serangan ini telah melumpuhkan sebuah wilayah kecil yang
tidak berupaya untuk mempertahankan dirinya dari serangan kejam yang bertubi-tubi.
Sekatan atau dengan izin, blokade yang dilakukan oleh tentera laut Israel
menyekat bantuan tiba melalui laut Wilayah Gaza. Malaysia hampa dengan kegagalan
masyarakat antarabangsa untuk mengambil tindakan menghentikan serangan ini
terutamanya kegagalan Majlis Keselamatan PBB. Tuan Yang di-Pertua, seperti yang sering
dibangkitkan oleh Ahli-ahli Parlimen Malaysia di Dewan yang mulia ini Israel telah sering
kali dan secara berterusan bersikap angkuh melakukan tindakan-tindakan yang agresif dan
kejam ke atas rakyat Palestin sejak sekian lama."
USUL,"MENGECAM PENCEROBOHAN ISRAEL
KE ATAS WILAYAH PALESTIN DI GAZA",,1450,Perdana Menteri [Dato’ Seri Abdullah bin Haji Ahmad Badawi],"Pelbagai resolusi telah diluluskan oleh Majlis Keselamatan tetapi tidak dihiraukan
oleh Israel. Namun Israel lebih memilih untuk tidak mengendahkan dan membelakangkan
undang-undang antarabangsa. Sebaliknya Israel mengambil langkah yang lebih biadab dan
tidak berperikemanusiaan terhadap rakyat Palestin. Malaysia pernah menaruh harapan
akan usaha pihak Amerika Syarikat untuk membuka jalan menyelesaikan melalui Proses
Damai Annapolis yang diadakan pada 27 November 2007. Semasa Persidangan Annapolis
tersebut, persetujuan telah dicapai oleh kedua-dua pihak, Palestin dan Israel bagi
mengadakan rundingan berterusan agar dapat mewujudkan negara Palestin yang bebas
dan berdaulat pada akhir tahun 2008.
Persetujuan semasa persidangan tersebut disaksikan oleh masyarakat
antarabangsa termasuk oleh Malaysia yang turut dijemput menyertai. Kita merasa amat
kecewa apabila proses damai Annapolis menemui jalan buntu. Masyarakat antarabangsa
yang rata-rata mengutuk tindakan Rejim Israel menyerang Gaza. Demonstrasi dan protes
bagi mengecam tindakan Israel itu diadakan di beberapa negara. Malangnya ada juga pihak
yang bersikap serong dan meletakkan tanggungjawab bulat-bulat ke atas pejuang-pejuang
Hamas di Gaza yang melancar roket-roket ke arah Israel tetapi Ahli Yang Berhormat
sekalian haruslah sedar bahawa ini adalah tindakan orang-orang yang terkepung, tidak
boleh bebas dan merentas sempadan wilayah mereka sendiri.
Pada 27 Disember 2008, Profesor Richard Falk, Pelapor Khas Hak PBB Mengenai
Asasi Manusia di wilayah yang diduduki telah menyifatkan pengeboman Israel ke atas Gaza
supaya pencabulan besar terhadap perundangan kemanusiaan antarabangsa, International
Humanitarian Law, dengan izin, seperti yang ditetapkan oleh Konvensyen Geneva.
Tuan Yang di-Pertua, walau bagaimanapun Malaysia tetap tidak berputus asa.
Kerajaan melalui Kementerian Luar Negeri telah mengarahkan wakil tetap Malaysia ke
Pertubuhan Bangsa-Bangsa Bersatu di New York supaya terus berusaha demi keamanan
dan keselamatan bumi Palestin, khususnya beliau telah diarah bekerjasama dan berurusan
rapat dengan wakil negara-negara Anggota Organization of Islamic Conference, dengan
izin dan Non-Aligned Movement, dengan izin.
Sekiranya gencatan senjata terus tidak berkuat kuasa dan keadaan buruk di Gaza
tidak berubah, maka negara-negara yang sependapat dengan Malaysia mestilah berusaha
semula untuk meminta Presiden Perhimpunan Agung PBB mengadakan sidang tergempar
perhimpunan agung berlandaskan Resolusi Nombor 377A (V) 1950, Uniting for Peace.
Saya sendiri telah juga mengutus kepada Setiausaha Agung PBB, Presiden Perhimpunan
Agung PBB, ketua-ketua kerajaan negara Anggota Majlis Keselamatan, negara-negara
OIC, negara-negara NAM serta beberapa tokoh seperti Pope Benedict, Richard, Barack
Obama dan Jimmy Carter untuk membantu dalam usaha mencari kedamaian di Timur
Tengah amnya dan di Gaza, khasnya.
Kementerian Luar Negeri juga telah secara rasminya mengaktifkan akaun amanah
kemanusiaan rakyat Palestin bagi membolehkan rakyat Malaysia menyalurkan bantuan
kepada rakyat Palestin. Kerajaan telah pun menyumbang RM3,500,000 kepada penduduk
Gaza melalui MERCY Malaysia. Mengambil kesempatan ini, saya ingin menyeru kepada
Ahli-ahli Dewan yang mulia ini untuk turut membantu usaha-usaha murni ini dengan
menggalakkan semua rakyat Malaysia dari semua lapisan masyarakat untuk membantu
rakyat Palestin yang kini berada dalam keadaan yang amat daif akibat serangan tentera
Rejim Zionis. Selaku masyarakat Malaysia yang sentiasa prihatin dan simpati kepada
kesengsaraan golongan yang tertindas, marilah kita sama-sama menghulurkan sedikit
sumbangan ikhlas bagi membantu rakyat Palestin di Gaza.
Tuan Yang di-Pertua, bersama-samalah kita memanjatkan doa kepada Yang
Maha Esa agar bencana kemanusiaan dapat dihentikan serta-merta. Malaysia akan terus
memantau krisis di wilayah Palestin di Gaza.
Tuan Yang di-Pertua, saya mohon mencadangkan... [Tepuk]"
USUL,"MENGECAM PENCEROBOHAN ISRAEL
KE ATAS WILAYAH PALESTIN DI GAZA",,1450,Tuan Yang di-Pertua,Ada yang menyokong?... Sila Yang Berhormat.
USUL,"MENGECAM PENCEROBOHAN ISRAEL
KE ATAS WILAYAH PALESTIN DI GAZA",,1455,Timbalan Perdana Menteri [Dato’ Sri Mohd. Najib bin Tun Haji Abdul Razak],"Tuan Yang di-Pertua, saya berdiri untuk menyokong penuh usul yang dibentangkan oleh
Yang Amat Berhormat Perdana Menteri sebentar tadi. Sesungguhnya usul tersebut telah
memberi gambaran yang sangat jelas tentang pendirian kita seluruh rakyat Malaysia, tidak
kira agama, bangsa sekalipun fahaman politik yang berbeza berkaitan isu serangan Rejim
Zionis Israel ke atas Wilayah Gaza, Palestin ini.
Marilah kita sama-sama bersatu di bawah kepimpinan Yang Amat Berhormat
Perdana Menteri dalam mengecam dengan sekeras-kerasnya serangan ketenteraan Rejim
Zionis ke atas Wilayah Gaza sehingga mengakibatkan kehilangan nyawa rakyat awam
Palestin termasuk golongan wanita, kanak-kanak, bayi dan warga tua, seraya menggesa
pengunduran menyeluruh Rejim Zionis Israel dari wilayah tersebut... [Tepuk]
Tuan Yang di-Pertua, daripada usul yang dibentangkan tadi, saya tertarik dengan
garapan oleh Profesor Richard Falk selaku Pelapor Khas PBB Mengenai Hak Asasi
Manusia. Beliau telah menyifatkan pengeboman Israel ke atas Gaza sebagai pencabulan
besar perundangan kemanusiaan antarabangsa seperti yang ditetapkan oleh Konvensyen
Geneva. Justeru, dapatlah disimpulkan bahawa tindakan ganas tersebut merangkumi satu
hukuman kolektif yang menyasarkan serangan terhadap orang awam tidak berdosa melalui
justifikasi tindakan ketenteraan tanpa perikemanusiaan. Sehubungan itu saya berasa
terpanggil untuk menyongsong lipatan sejarah yang barangkali dapat mengingatkan kita
kepada kezaliman dan kekejaman pihak Israel serta sekutunya.
Yang pertama, pengeboman dan penyerangan ke atas Sabra dan Shatila iaitu dua
kem pelarian Palestin di selatan ibu kota Lebanon yang telah mencatatkan sejarah
kekejaman Rejim Zionis Israel membunuh lebih 2,000 pelarian Palestin tanpa belas ihsan.
Memang benar peristiwa meruntun jiwa ini telah berlaku lebih 26 tahun yang lampau,
namun kejadian tanggal 20 September 1982 itu merupakan satu kisah pahit kepada sejarah
kewujudan manusia di era moden yang sukar untuk dilupakan.
Keduanya pula, tarikh 20 Mac 2003 menjadi satu lagi titik hitam dalam perjalanan
tamadun dunia. Pada hari itu Amerika Syarikat dan sekutunya telah melancarkan serangan
ke atas Iraq. Ironisnya sejak peperangan meletus, rakyat dari seluruh dunia termasuk warga
Amerika Syarikat dan Britain sendiri telah membantah dan mengutuk pencerobohan
tersebut. Malah beberapa negara NATO, negara NAM, negara OIC dan kebanyakan negara
yang cintakan keamanan dalam dunia telah juga menyanggah sebarang tindakan
menggunakan ketenteraan untuk menyelesaikan konflik.
Sayangnya Majlis Keselamatan Bangsa-Bangsa Bersatu tidak dapat membuat
apa-apa keputusan muktamad. Kendati hal yang demikian Tuan Yang di-Pertua, pada
waktu tersebut Amerika Syarikat dan sekutunya tidak langsung menghiraukan suara
antarabangsa kerana mereka mempunyai kekuatan ketenteraan yang terbesar di seantero
dunia. Pada ketika itu Malaysia sebagai sebuah negara yang sangat prihatin tentang apa
yang berlaku telah menggesa Amerika Syarikat dan sekutunya menamatkan tindakan
ketenteraan unilateral ke atas Iraq secara serta-merta.
Bagi maksud tersebut, satu usul mengecam serangan Amerika terhadap Iraq telah
turut dibentangkan dalam Dewan yang mulia ini, kita telah secara rasmi merakam dan
menuntut semua pihak yang berkenaan supaya segera kembali kepada proses
penyelesaian secara aman.
Tuan Yang di-Pertua, rentetan daripada itu, tampaknya sejarah dan situasi yang
sama seperti dua peristiwa besar yang saya sebutkan tadi seolah-olah sedang berulang
kembali.
Kali ini juga Rejim Zionis Israel tanpa segan silu terus mengambil tindakan kejam
demi kepentingan mereka sendiri sehingga sanggup mengorbankan keamanan dan
kestabilan dunia."
