level_1,level_2,level_3,raw_timestamp,timestamp,author,speech
USUL,"KAJIAN SEPARUH PENGGAL
RANCANGAN MALAYSIA KESEBELAS (2018-2020)",,11.51 pg.,1151,Timbalan Menteri di Jabatan Perdana Menteri [Tuan Mohamed Hanipa bin Maidin],"Terima kasih Tuan Yang di-Pertua. Minta maaf sebab saya ingat, saya tidak
menjangkakan Yang Berhormat begitu cepat habis. Satu sejarah ya."
USUL,"KAJIAN SEPARUH PENGGAL
RANCANGAN MALAYSIA KESEBELAS (2018-2020)",,11.51 pg.,1151,Timbalan Yang di-Pertua,Tidak ada soalan.
USUL,"KAJIAN SEPARUH PENGGAL
RANCANGAN MALAYSIA KESEBELAS (2018-2020)",,11.51 pg.,1151,Tuan Mohamed Hanipa bin Maidin,"Tuan Yang di-Pertua, sebenarnya untuk
agensi yang di bawah tanggungjawab ataupun amanah yang diberikan pada kami, agak
banyak juga isu-isu yang dibangkitkan. Akan tetapi saya bercadang untuk bercakap ini
mengikut agensi Tuan Yang di-Pertua.
Saya pergi dulu kepada agensi SPR. SPR ini ada dua persoalan yang
dibangkitkan oleh seorang sahaja Senator iaitu Yang Berhormat Senator Dato’ Hajah
Fahariyah binti Hj Md Nordin yang bertanyakan soalan, yang membangkitkan soalan
mengenai perundangan dan langkah-langkah yang boleh direformasi dalam Akta Pilihan
Raya bagi membendung perlakuan parti-parti politik yang mencipta manifesto dan beliau
juga menggunakan janji-janji palsu.
Tuan Yang di-Pertua, pertamanya saya rasa ayat janji-janji palsu tidak betullah,
agak nakal sikitlah. Akan tetapi untuk makluman Tuan Yang di-Pertua, pada masa ini
tiada perundangan yang berkaitan manifesto atau pemantauan sama ada sesuatu
manifesto ditunaikan atau tidak oleh parti-parti politik sepanjang tempoh berkempen.
Tidak ada spesifik undang-undang ya. Pada dasarnya, manifesto selagi mana tidak
bercanggah dengan undang-undang dan peraturan sedia ada, ia tidak dapat dilarang
kerana ia merupakan kempen parti politik untuk mendapat sokongan daripada para
pengundi.
Tuan Yang di-Pertua, manifesto ini saya rasa perkara yang agak *common* dalam
semua negara yang mengadakan pilihan raya yang ada parti politik. Mana-mana negara
pun, mana-mana parti politik pun, mereka akan meletakkan manifesto dan sudah tentulah
dalam merangka manifesto ini kita kena kreatiflah dan juga kita kena memastikan
manifesto kita ini bukan sahaja kita hendak laksanakan, tetapi juga menarik kepada ini..."
USUL,"KAJIAN SEPARUH PENGGAL
RANCANGAN MALAYSIA KESEBELAS (2018-2020)",,11.51 pg.,1151,Dato’ Sri Ti Lian Ker,Minta laluan.
USUL,"KAJIAN SEPARUH PENGGAL
RANCANGAN MALAYSIA KESEBELAS (2018-2020)",,11.51 pg.,1151,Tuan Mohamed Hanipa bin Maidin,"Silakan, boleh."
USUL,"KAJIAN SEPARUH PENGGAL
RANCANGAN MALAYSIA KESEBELAS (2018-2020)",,11.51 pg.,1151,Dato’ Sri Ti Lian Ker,"Saya cuma hendak tanya sebab kita berhadapan dengan
rakyat dan ada pemerhati pelajar-pelajar dan sebagainya.
Saya amat kesal kalau kita mengatakan kita boleh meremehkan janji-janji
kerana kita jangan pasang undang-undang kerana ada juga prinsip-prinsip amanah,
prinsip-prinsip akauntabiliti dan sebagainya. Jadi, janganlah kita cuba menjustifikasikan
kalau kita ada janji-janji yang tidak dapat ditunaikan atas tiada undang-undang."
USUL,"KAJIAN SEPARUH PENGGAL
RANCANGAN MALAYSIA KESEBELAS (2018-2020)",,11.51 pg.,1151,Tuan Mohamed Hanipa bin Maidin,"Okey, soalan. Terima kasih kepada Yang
Berhormat yang bertanya soalan tambahan tersebut. Untuk maklumat Yang Berhormat
ya, saya tidak pasti Yang Berhormat merujuk kepada manifesto mana.
Akan tetapi manifesto kalau sekiranya tidak dilaksanakan janji, saya rasa itu
bukanlah satu yang mungkin dalam konteks Pakatan Harapan ini sesuatu yang mungkin
disengajakan. Saya percaya apabila kita meletakkan manifesto, ketika itu kita memang
menjangkakan kita boleh melaksanakan sebab itu kita berani berjanji. Ini sebab pada
masa itu untuk maklumat Yang Berhormat, kita tidak ada banyak *information* yang
mungkin kita perlukan pada waktu itu kerana kita tidak ada akses kepada maklumat-
maklumat yang pihak kerajaan sendiri ada.
Di situ kita ada *disadvantage* sebab apa, apabila kerajaan membuat manifesto,
mereka tahu kekangan-kekangan mereka sedangkan kami masa itu dalam
pembangkang, tidak dapat maklumat yang sebegitu. Bagaimanapun, saya setuju dengan
Yang Berhormat mengatakan kita tidak seharusnya memperlekehkan. Itu saya setuju.
Akan tetapi dalam masa yang sama juga, kita juga bersikap jujur. Kena juga
jujur bahawa banyak juga manifesto yang kita telah laksanakan. Akan tetapi nampaknya
macam tidak langsung di-*highlight-*kan, di-*highlight-*kan yang kita tidak laksanakan. Apa
yang kita laksanakan sudah banyak sudah kita buat ini langsung tidak langsung- terima
kasih pun tidak, jauh sekali untuk hendak puji. Jadi saya rasa ini pun kadang-kadang kita
kena bersikap adil jugalah. *When we talk about justice, not only justice to you,* tetapi *also
to us.*
Jadi saya rasa saya bersetuju secara prinsipnya memang segala janji ini
memang kita laksana. Itu saya setuju. Akan tetapi kalau tidak dapat laksana, bukan tidak
mahu laksana, tidak dapat laksana kerana kita ada kekangan yang banyak. Antaranya,
semua janji ini antaranya memerlukan kewangan sedangkan kewangan kita sama ada
Yang Berhormat suka, tidak suka memang ada masalah.
Oleh sebab itu kita kadang-kadang serba salah. Dalam satu segi kita rasa
hendak dedahkan mungkin masalah kewangan, tetapi dari satu segi lain pula kalau kita
dedahkan, kita takut nanti mungkin seperti mana dikatakan oleh Yang Berhormat Menteri
Kewangan, sistem terperanjat, sistem tidak boleh terima lagi. Kita ini, kita kadang-kadang
kena *start the balance,* dengan izin. Oleh sebab itulah saya rasa manifesto ini, isu yang
dibangkitkan ialah kenapa- oleh kerana soalan ini berkaitan dengan perundangan, sebab
itu dalam jawapan saya, saya merujuk kepada isu perundangan Yang Berhormat. Kalau
soalan ini berkenaan lain, kita jawab lainlah. Jadi saya harap Yang Berhormat dapat
memahamilah kerana apa jawapannya begitu ya.
Seterusnya Yang Berhormat, saya pergi kepada isu yang berkaitan dengan
Suruhanjaya Bebas Aduan dan Salah Laku Polis (IPCMC). Ia dibangkitkan oleh Yang
Berhormat Senator Tuan Alan Ling Sie Kiong pada 3 Disember 2018 yang
mencadangkan struktur dan komposisi IPCMC harus dianggotai oleh ahli profesional
untuk mengendalikan aduan orang ramai demi keadilan orang awam dan anggota polis.
Tuan Yang di-Pertua, kerajaan kini dalam proses untuk merangka penubuhan
IPCMC. Ini untuk makluman para Yang Berhormat Senator, memang ini telah pun
dipersetujui yang turut melibatkan penggubalan draf undang-undang IPCMC. Kedua-dua
proses tersebut memerlukan kajian yang terperinci terhadap struktur, kuasa dan peranan
IPCMC bagi menjadikannya lebih berkesan dengan mengambil kira pandangan semua
pihak. Kerajaan akan memastikan struktur dan komposisi IPCMC diimbangi dengan
kepelbagaian latar belakang dan profesion bagi meningkatkan keyakinan orang awam
terhadap IPCMC.
Seterusnya Tuan Yang di-Pertua, Yang Berhormat Senator Tuan Alan Ling Sie
Kiong juga turut menyarankan supaya Suruhanjaya Pencegahan Rasuah Malaysia
(SPRM) bertanggungjawab kepada Parlimen.
Untuk makluman Yang Berhormat Senator, cadangan untuk memperkasa
SPRM juga telah dibincangkan dan dipersetujui oleh Mmesyuarat Jawatankuasa Khas
Kabinet Mengenai Antirasuah (JKKMAR) Siri 3.
Untuk makluman Yang Berhormat Senator, mesyuarat ini telah pun diadakan
sebanyak lima kali dan saya juga adalah anggota kepada jawatankuasa itu yang
sebenarnya *high level*, yang dipengerusikan oleh Perdana Menteri sendiri. Cadangan
tersebut yang tadi yang memperkasakan SPRM telah dibincangkan dan dipersetujui
pada mesyuarat JKKMAR pada 13 Ogos 2018.
Cadangan tersebut turut merangkumi pengukuhan mekanisme tadbir urus
pelantikan dan perjawatan dan supaya Parlimen memainkan peranan yang lebih dalam
pemantauan kerja SPRM. Bagaimanapun, perkara-perkara ini memerlukan pindaan
undang-undang dan diselaraskan oleh pihak SPRM dengan Jabatan Peguam Negara,
Parlimen, Suruhanjaya Perkhidmatan Awam dan Jabatan Perkhidmatan Awam.
Seterusnya Yang Berhormat Datin Rahimah binti Haji Mahamad, ada?
Tuan Yang di-Pertua, saya hendak minta satu *guideline,* kalau Yang Berhormat
Senator tidak ada, adakah saya perlu menjawab atau macam mana? Ini sebab di Dewan
Rakyat digalakkan kalau Yang Berhormat Senator tidak ada, kita tidak jawab, jawapan
bertulis. Saya hendak tahu macam mana arahan di sini."
USUL,"KAJIAN SEPARUH PENGGAL
RANCANGAN MALAYSIA KESEBELAS (2018-2020)",,11.51 pg.,1151,Timbalan Yang di-Pertua,Terserah kepada Yang Berhormat.
USUL,"KAJIAN SEPARUH PENGGAL
RANCANGAN MALAYSIA KESEBELAS (2018-2020)",,11.51 pg.,1151,Tuan Mohamed Hanipa bin Maidin,"Terserah kepada saya, okey. Saya juga
minta satu *guideline* daripada Tuan Yang di-Pertua, berapa masa yang dibolehkan
kepada kami untuk menjawab?"
USUL,"KAJIAN SEPARUH PENGGAL
RANCANGAN MALAYSIA KESEBELAS (2018-2020)",,11.51 pg.,1151,Timbalan Yang di-Pertua,Bagi setengah jam.
USUL,"KAJIAN SEPARUH PENGGAL
RANCANGAN MALAYSIA KESEBELAS (2018-2020)",,11.51 pg.,1151,Tuan Mohamed Hanipa bin Maidin,"Okey. Minta maaf Tuan Yang di-Pertua.
Di Dewan Rakyat diberikan masa, jadi kami agak takut terlebih masa ya."
USUL,"KAJIAN SEPARUH PENGGAL
RANCANGAN MALAYSIA KESEBELAS (2018-2020)",,11.51 pg.,1151,Timbalan Yang di-Pertua,"Ini tadi masa sudah bagi setengah jam sepatutnya.
Akan tetapi kita punya Cik Puan Hajah tadi sekejap sangat."
USUL,"KAJIAN SEPARUH PENGGAL
RANCANGAN MALAYSIA KESEBELAS (2018-2020)",,11.51 pg.,1151,Tuan Mohamed Hanipa bin Maidin,"Okey, tidak apa. Saya memahami itu.
Terima kasih Tuan Yang di-Pertua"
USUL,"KAJIAN SEPARUH PENGGAL
RANCANGAN MALAYSIA KESEBELAS (2018-2020)",,■1200,1200,Tuan Mohamed Hanipa bin Maidin,"Yang Berhormat Datin Rahimah bin Haji Mohammad pada 4 Disember 2018
telah bertanyakan tentang kriteria yang digunakan oleh SPRM dalam menentukan tahap
ketelusan dan integriti daripada pengisytiharan harta oleh Ahli-ahli Dewan Rakyat dan
Ahli-ahli Dewan Negara jawatan utama sektor awam.
Pengisytiharan harta merupakan satu mekanisme penting dalam memastikan
tadbir urus yang baik dan berintegriti. Saya akui Tuan Yang di-Pertua, pengisytiharan
harta yang kita buat sekarang ini mungkin ada kelemahan-kelemahan tertentu kita
mengakui. Cumanya saya hendak beritahu sekurang-kurangnya kita telah buat satu
perubahan yang pertama kali dalam sejarah di dalam negara kita ini berlakunya satu
polisi untuk kita mengehendaki khususnya sekarang ini Menteri dan Timbalan Menteri
untuk mengisytiharkan harta dan dipaparkan dalam *website* SPRM.
Saya akui mungkin ada kelemahan dan saya juga hendak sedikit mungkin
perbetulkan persepsi tentang pengisytiharan harta ini. Tujuan pengisytiharan harta Tuan
Yang di-Pertua, kita bermula dengan *baseline* dahulu. Sekarang ini kita tengok apa yang
ada, harta yang ada pada semua orang. Selepas ini lepas kita memegang jawatan kita
ini kita tengok macam mana peningkatan selepas ini. Kalau peningkatan itu *legitimate,*
ataupun sah tiada masalah. Isu pengisytiharan harta bukannya masalah isu banyak atau
tidak atau sedikit harta itu, akan tetapi isunya ialah bagaimana kita mendapatkan harta
itu. Adakah dengan cara yang betul, sah mengikut undang-undang ataupun macam
mana.
Sebenarnya Tuan Yang di-Pertua, ini sebenarnya kalau kita baca Al-Quran dia
ambil daripada al-Quran juga berdasarkan firman Allah SWT dalam surah Al-Imran, kisah
ibu kepada Nabi Isa, Siti Maryam, bila mana ia di mihrab dia ada makanan, ditanyakan..."
USUL,"KAJIAN SEPARUH PENGGAL
RANCANGAN MALAYSIA KESEBELAS (2018-2020)",,■1200,1200,ANNOTATION,[Berucap dalam bahasa Arab]
USUL,"KAJIAN SEPARUH PENGGAL
RANCANGAN MALAYSIA KESEBELAS (2018-2020)",,■1200,1200,Tuan Mohamed Hanipa bin Maidin,"Daripada mana kamu mendapatkan makan ini?
Jadi..."
USUL,"KAJIAN SEPARUH PENGGAL
RANCANGAN MALAYSIA KESEBELAS (2018-2020)",,■1200,1200,ANNOTATION,[Berucap dalam bahasa Arab]
USUL,"KAJIAN SEPARUH PENGGAL
RANCANGAN MALAYSIA KESEBELAS (2018-2020)",,■1200,1200,Tuan Mohamed Hanipa bin Maidin,"Ini daripada mana dapat ini, itu dijadikan
sebagai satu polisi negara dalam zaman Saiyidina Umar.
Sekarang ini kita hendak- juga, bila kita pengisytiharan harta ini kita hendak
supaya bila kamu dapat harta, tidak kisah *you can accumulate* berapa banyak harta tetapi
mesti dengan cara yang *legitimate.* Itulah dia punya idea ataupun falsafah kenapa kita
mengadakan pengisytiharan harta ini..."
USUL,"KAJIAN SEPARUH PENGGAL
RANCANGAN MALAYSIA KESEBELAS (2018-2020)",,■1200,1200,Dato’ Haji Mohd Suhaimi bin Abdullah,"Mohon mencelah Yang Berhormat
Tuan Yang di-Pertua."
USUL,"KAJIAN SEPARUH PENGGAL
RANCANGAN MALAYSIA KESEBELAS (2018-2020)",,■1200,1200,Tuan Mohamed Hanipa bin Maidin,"Mana? Oh, minta maaf. Okey, ya."
USUL,"KAJIAN SEPARUH PENGGAL
RANCANGAN MALAYSIA KESEBELAS (2018-2020)",,■1200,1200,Dato’ Haji Mohd Suhaimi bin Abdullah,"Yang Berhormat Menteri, saya tertarik
dengan pengisytiharan harta ini Yang Berhormat. Akan tetapi soalan saya, bila saya
tengok di-*viral-*kan senarai harta-harta tersebut, soalan saya sama ada ia ini *fake news*
ataupun *news* yang betul yang keluar daripada BPR, dan apakah ini akan berlanjutan,
apakah kerajaan akan membuka sebegitu luas sekali dan tidak terfikir kah Yang
Berhormat Menteri sekiranya rakyat tahu, rakyat baik tidak apa, tetapi rakyat yang
perompak-perompak penyamun yang tahu. Apa pandangan Yang Berhormat Menteri?"
USUL,"KAJIAN SEPARUH PENGGAL
RANCANGAN MALAYSIA KESEBELAS (2018-2020)",,■1200,1200,Tuan Mohamed Hanipa bin Maidin,"Terima kasih Tuan Yang di-Pertua, terima
kasih juga kepada Yang Berhormat Senator yang bertanya soalan yang baik itu.
Sebenarnya untuk makluman Yang Berhormat Senator, memang ini
dibincangkan agak secara rancak dalam sesama kamilah, sama ada- sebenarnya Tuan
Yang di-Pertua, kerajaan sekarang ini kalau boleh hendak lebih kepada seminimum yang
bolehlah. Macam mana Yang Berhormat Senator katakan tadi bahawa, kita tidak mahu
nanti kalau terlampau nanti mungkin di sana orang-orang yang salah gunalah seperti
Yang Berhormat Senator katakan tadi seperti penyamun dan perompak.
Akan tetapi nampaknya ada juga mengatakan *we have to be transparent.* Kita
mesti telus. Jangan ada langsung kita simpankan mana-mana maklumat itu daripada
pengetahuan awam. Jadi kita sekarang dalam kadang-kadang serba salah, kita hendak
terlampau jaga mereka punya itu, mereka kata tidak apalah. Mungkin juga Pakatan
Harapan ini kebanyakan tidak banyak harta, agaknya lah. Oleh sebab itu mereka tidak
kisah. Agaknyalah saya tidak tahulah, tetapi memang akuilah ada juga sesetengah itu
mungkin- ya.
Kadang-kadang serba salah Tuan Yang di-Pertua. Untuk makluman, saya
hendak beritahulah, saya sendiri sudah dua kali pengisytiharan harta. Dahulu dengan
INVOKE, masa sebelum menjadi kerajaan kita isytiharkan dengan INVOKE. Masa kita
isytihar itu saya hendak beritahu dengan Yang Berhormat Senator, ketika itu dia minta
kita siar duit dalam akaun. Memanglah duit dalam akaun ini sekejap banyak sekejap
sedikit. Ketika siar itu saya sendiri ketika itu duit saya tengah sedikit. Isytihar lah apa yang
ada, tapi bila duit sedikit dia kata, *“Yang Berhormat pembohong. Sedikit- ini bohong”.* Kita
isytihar sedikit pun salah, isytihar banyak pun salah.
Kadang-kadang kita pun serba salah. Kita ini betul-betul serba salah kadang-
kadang. Hendak macam sekarang ini kita hendak buat sesuatu yang baik orang marah.
Kita tidak buat pun orang marah, Jadi kita kadang-kadang mana satu hendak ikut ini
kadang-kadang, ini yang dilema yang dihadapi oleh kerajaan sekaranglah. Saya bukan
kata kita tidak mahu buat, tetapi yang macam Yang Berhormat kata itu saya akan cuba
bincang dengan pihak yang berkaitan macam mana kita boleh selesaikan masalah.
Akan tetapi kita kata orang itu, Orang Putih kata, kita *start the ball rolling.* Kita
mulakan dahulu budaya ini. Saya harap selepas ini mungkin boleh dilanjutkan. Jadi kalau
sekiranya Yang Berhormat Senator juga hendak isytihar, walaupun tidak menjadi
kewajipan undang-undang, itu terpulanglah. Akan tetapi setakat ini kita tidak mewajibkan
lagi.
Jadi perkara ini amat penting bagi memantau sebarang pertambahan harta
masa seseorang itu memegang jawatan dalam kerajaan. Jika terdapat pertambahan
harta yang tidak sepadan dengan pendapatan mereka, pihak berkuasa akan menyiasat
dengan lebih lanjut berhubung perkara itu bagi memastikan perolehan harta tersebut
adalah secara sah dan tidak menyalahi undang-undang.
Seterusnya Yang Berhormat Senator Datuk Haji Yahaya bin Mohd Ghani, ada?"
USUL,"KAJIAN SEPARUH PENGGAL
RANCANGAN MALAYSIA KESEBELAS (2018-2020)",,■1200,1200,Timbalan Yang di-Pertua,Tidak ada.
USUL,"KAJIAN SEPARUH PENGGAL
RANCANGAN MALAYSIA KESEBELAS (2018-2020)",,■1200,1200,Tuan Mohamed Hanipa bin Maidin,"Beliau bertanyakan soalan tentang
siasatan terperinci semua tabung-tabung kewangan parti politik agar tidak berlaku
rasuah.
Tuan Yang di-Pertua, Mesyuarat Jawatankuasa Khas Kabinet (JKKMR)
Mengenai Anti Rasuah, Bilangan 2, Tahun 2018 yang dipengerusikan oleh Yang Amat
Berhormat Perdana Menteri pada 9 Julai 2018 telah bersetuju dengan cadangan
penggubalan satu undang-undang berhubung dengan pembiayaan politik. Kerajaan
pada masa ini sedang menjalankan kajian yang terperinci bagi menggubal satu rang
undang-undang berkaitan dengan politik.
Untuk makluman, tadi pun ada soalan yang sama di Dewan Rakyat. Saya
hendak beritahu- daripada Dewan Negara, nombor 8 tadi.
Jadi sebenarnya kita telah dalam usaha ke arah mewujudkan rang undang-
undang itu dan *in syaa Allah* jika tiada apa-apa aral, kemungkinan tahun depan kita akan
dapat menyaksikan rang undang-undang ini. Kita doakanlah supaya dapat dilaksanakan
dan saya harap kalau sekiranya rang undang-undang ini digubal, pihak *Senate* juga boleh
bersetuju dan memberikan sokongan sebab ini baik untuk semua.
Oleh sebab ini rang undang-undang untuk semua parti politik tanpa mengira-
dan kalau ikut kita punya cadangan, kemungkinan kita hendak buat seberapa baik yang
bolehlah sebab itu kita telah merujuk banyak buah negara. US, Korea Selatan,
Singapura, banyaklah- Chile, kita hendak mengkaji semua ini dan kita akan cuba
laksanakan seberapa yang boleh.
Rang undang-undang tersebut akan membolehkan antara lainnya- saya bagi
secara umum. Siasatan dibuat terhadap penerimaan dana daripada negara luar dan oleh
parti politik. Pihak GIACC juga menjadi penyelaras terhadap semua keputusan dasar
yang perlu mendapat kelulusan Jemaah Menteri sebelum akta ini dibentangkan di
Parlimen pada tahun 2019, *in syaa Allah* tahun hadapan.
Seterusnya Tuan Yang di-Pertua, daripada Yang Berhormat Senator Dato’ Dr.
Mohd Nor bin Haji Monutty. Ini berkaitan dengan peranan SIAP dalam keberkesanan
membanteras rasuah. Tuan Yang di-Pertua, izinkan saya menjawab dengan bertulis.
Nanti saya akan berjumpa sendiri dengan Yang Berhormat untuk berikan jawapan
bertulis.
Seterusnya saya pergi kepada SPRM. Yang Berhormat Senator Tuan Manolan
bin Mohamad, tiada juga? Ini pun saya jawab secara bertulis Tuan Yang di-Pertua, ada?
Oh *sorry,* kalau ada saya jawablah. Bukan kerana yang tiada saya tidak mahu jawab
tetapi saya rasa mungkin saya lebih suka jawab bertulis untuk dapatkan jawapan yang
lebih lengkap.
Yang Berhormat Senator Tuan Manolan bin Mohamad mencadangkan untuk
mereformasi tadbir urus yang cekap dan amanah. Gejala rasuah di kalangan kakitangan
awam wajib diperangi berhabis-habisan dan pihak kerajaan mesti mengurangkan juga
birokrasi di kementerian-kementerian ataupun jabatan-jabatan kerajaan.
Untuk makluman Yang Berhormat Senator, pelbagai faktor telah dikenal pasti
menjadi penyebab utama kepada berlakunya gejala rasuah di kalangan penjawat awam.
Antara punca utama ialah sikap manusia yang tidak amanah dan tamak, peraturan yang
lapuk dan longgar, tiada pemantauan yang efektif serta sistem-sistem dan prosedur yang
rumit dan menyukarkan. Ini ialah kajian daripada SPRM. Ini telah membuka ruang dan
peluang untuk berlaku rasuah, penyelewengan dan salah guna kuasa.
Antara langkah-langkah yang diambil bagi mereformasi tadbir urus yang cekap
dan amanah, kerajaan telah melaksanakan gerakan pemantapan *governance,* integriti
dan anti rasuah di peringkat kebangsaan yang melibatkan penubuhan jawatankuasa.
Tadi saya kata Jawatankuasa Khas Kabinet Mengenai Anti Rasuah yang menggantikan
Jawatankuasa Khas Kabinet Mengenai Keutuhan Pengurusan Kerajaan (JKKMKPK)
yang telah dilaksanakan pada tahun 1997.
Jawatankuasa Antirasuah (JAR) bagi menggantikan Jawatankuasa Integriti dan
Tadbir Urus yang merupakan mekanisme pelengkap kepada JKKK MKPK sebelum ini.
Selain itu, unit integriti di kementerian akan menyemak dan mengkaji sistem dan
prosedur di kementerian ataupun jabatan agar tidak lapuk, terlalu rumit dan menimbulkan
masalah kerenah birokrasi yang boleh membuka ruang dari berlakunya salah guna kuasa
dan penyelewengan."
USUL,"KAJIAN SEPARUH PENGGAL
RANCANGAN MALAYSIA KESEBELAS (2018-2020)",,■1210,1210,Tuan Mohamed Hanipa bin Maidin,"Ini juga bagi memastikan sistem dan prosedur jelas, telus, mudah difahami dan
didokumenkan. Selain daripada menjalankan siasatan SRPM turut melaksanakan
program penyelidikan kepada pegawai kerajaan dan juga orang awam berkaitan
keburukan dan kesan rasuah kepada masyarakat dan negara.
Tuan Yang di-Pertua, Yang Berhormat Senator Dato’ Dr. Mohd Nor bin Haji
Monutty juga mencadangkan kerajaan mendidik rakyat menangani rasuah bukan
menambahkan hukuman penjara.
Untuk makluman Ahli Yang Berhormat Senator salah satu peranan utama
Suruhanjaya Pencegahan Rasuah Malaysia (SPRM) dinyatakan secara jelas di bawah
Akta Suruhanjaya Pencegahan Rasuah Malaysia (SPRM) adalah mendidik orang ramai.
Itu antara yang dinyatakan dalam akta ini. Untuk menentang rasuah serta mendapatkan
sokongan- orang ramai dalam menentang rasuah.
Untuk makluman Tuan Yang di-Pertua dan juga Yang Berhormat Senator saya
sendiri juga telah mencadangkan kepada pihak SPRM supaya mungkin boleh
menggunakan saluran komunikasi seperti TV, radio untuk mengadakan satu slot khas
untuk menerangkan tentang aspek-aspek yang perlu diketahui oleh masyarakat tentang
rasuah ini.
Antaranya, Tuan Yang di-Pertua, berkaitan dengan isu apabila orang hendak
mengadu ini, dia akan dilindungi. Sesetengah orang ini dia takut hendak mendedahkan
rasuah kerana dia rasa mungkin faktor keselamatan dan sebagainya. Sebenarnya di
sana ada wujudnya satu perlindungan saksi ataupun perlindungan kepada pengadu-
pengadu yang membuat aduan ini. Akan tetapi, mungkin mereka tidak tahu hak ini. Oleh
sebab itu saya telah mencadangkan kepada pihak SPRM supaya mengadakan satu sesi
penerangan di..."
USUL,"KAJIAN SEPARUH PENGGAL
RANCANGAN MALAYSIA KESEBELAS (2018-2020)",,■1210,1210,Tuan Manolan bin Mohamad,"Tuan Yang di-Pertua? Mohon mencelah Yang
Berhormat Menteri? Sini, sini."
USUL,"KAJIAN SEPARUH PENGGAL
RANCANGAN MALAYSIA KESEBELAS (2018-2020)",,■1210,1210,Tuan Mohamed Hanipa bin Maidin,"Oh, *sorry.*"
USUL,"KAJIAN SEPARUH PENGGAL
RANCANGAN MALAYSIA KESEBELAS (2018-2020)",,■1210,1210,Tuan Manolan bin Mohamad,Boleh ya? Terima kasih.
USUL,"KAJIAN SEPARUH PENGGAL
RANCANGAN MALAYSIA KESEBELAS (2018-2020)",,■1210,1210,Tuan Mohamed Hanipa bin Maidin,Silakan.
USUL,"KAJIAN SEPARUH PENGGAL
RANCANGAN MALAYSIA KESEBELAS (2018-2020)",,■1210,1210,Tuan Manolan bin Mohamad,"Okey, berkenaan dengan rasuah ini Yang
Berhormat Menteri, saya tengok adakah langkah yang patut diambil sebagai contoh,
dengan izin, kita mahu *transfer*kan beberapa pegawai yang kita dapat *signal,* dengan
izin, untuk ke jabatan-jabatan lain?
Oleh sebab, rasuah in berlaku biasanya bukan seorang, dia ada *connection*
antara seseorang dengan seseorang. Maka, kalau pindahan pegawai berkenaan ke
jabatan lain, mungkin *connection* mereka dengan orang yang kroni mereka ini boleh
terputus. Jadi, apakah cara ini juga salah satu untuk menyekat rasuah di kalangan
agensi-agensi kerajaan khususnya jabatan-jabatan seperti Imigresen, JPJ dan
sebagainya? Mohon, penjelasan Yang Berhormat Menteri. Terima kasih."
USUL,"KAJIAN SEPARUH PENGGAL
RANCANGAN MALAYSIA KESEBELAS (2018-2020)",,■1210,1210,Tuan Mohamed Hanipa bin Maidin,"Terima kasih kepada Yang Berhormat
Senator Tuan Manolan. Sebenarnya Yang Berhormat Senator Tuan Manolan, saya
secara jujur saya tidak begitu pasti adakah itu puncanya. Walau bagaimanapun Yang
Berhormat Senator Tuan Manolan, oleh sebab soalan ini soalan yang agak baik dan juga
penting, izinkan saya mungkin berikan jawapan secara bertulis selepas ini? Kalau
sekiranya, kadang-kadang kita terlupa, ataupun *overlook*, saya harap Yang Berhormat
Senator Tuan Manolan dapat mengingatkan saya. Pegawai saya *in syaa Allah* akan
menyediakan jawapan itu. Terima kasih.
Seterusnya Tuan Yang di-Pertua, tentang isu ini juga, yang dibangkitkan oleh
Yang Berhormat Senator Dato’ Dr. Mohd Nor bin Haji Monutty..*.*"
USUL,"KAJIAN SEPARUH PENGGAL
RANCANGAN MALAYSIA KESEBELAS (2018-2020)",,■1210,1210,ANNOTATION,[Rakaman kurang jelas]
