level_1,level_2,level_3,raw_timestamp,timestamp,author,speech
USUL,"KAJIAN SEPARUH PENGGAL
RANCANGAN MALAYSIA KESEBELAS (2018-2020)",,■1700,1700,Dr. Maszlee bin Malik,"Di samping itu, KPM juga akan melancarkan Dekad Membaca Kebangsaan
(2020-2030) untuk memartabatkan Bahasa Melayu di negara ini. Ini acap kali saya
sebutkan di Dewan Rakyat dan juga di Dewan Negara ini. Bak kata pepatah, “Yang kurik
itu kendi, yang merah itu saga, yang baik itu budi, yang indah itu bahasa”. Ini penting
kerana impak akhir yang kita harapkan ialah perpaduan dan jati diri yang mantap sebagai
warganegara Malaysia yang maju dan sejahtera.
KPM menghargai cadangan Yang Berhormat Senator Dr. Zaiedi Haji Suhaili
yang mencadangkan kolaboratif antara IPT dengan jabatan bomba. KPM menyokong
sebarang usaha kolaboratif di antara universiti awam dan jabatan bomba untuk
menawarkan program-program akademik baharu yang berkonsepkan *broad-based* dan
*industry driven,* dengan izin, demi keharmonian dan kemakmuran masyarakat serta
negara. KPM menyediakan polisi, prasarana dan penguatkuasaan dalam pendidikan
tinggi melalui pengisian ruang yang diperlukan.
Pada 21 November yang lepas, KPM telah melancarkan program *Life Saving
Skills,* dengan izin, dan Modul Kesedaran Keselamatan dan Menyelamat di Air 2018
selaras dengan apa yang dipraktikkan di negara-negara maju sebagai pembentukan
karakter holistik. Walaupun yang dipaparkan ataupun dihebahkan hanya belajar
berenang, tetapi sebenarnya manual *lifesaving skills* ini lebih luas daripada itu. Diajarkan
CPR, diajarkan teknik *survival* dan lain-lain lagi.
Ini kalau kita lihat, satu, dengan izin, *ground breaking* ataupun permulaan
baharu pada kurikulum kita iaitu kanak-kanak tidak lagi dilihat ingin cemerlang semata-
mata di dalam peperiksaan. Akan tetapi mereka perlu dilengkapkan dengan skil-skil
ataupun kemahiran-kemahiran yang menjadikan mereka warga bertaraf dunia. Ini bukan
perkara baharu di negara-negara maju, memang diajarkan.
Saya teringat bagaimana anak-anak saya sewaktu kami tinggal di *United
Kingdom* dahulu, diajarkan dengan skil berenang, dengan beberapa kemahiran yang lain
walaupun di peringkat sekolah rendah. Ini membentuk sikap mereka sehinggalah mereka
dewasa. Untuk menyediakan manual tersebut, KPM telah mengadakan usaha sama
dengan jabatan bomba sendiri, agensi-agensi, NGO-NGO dan juga beberapa pemegang
taruh yang lain demi memastikan kemahiran yang kita berikan kepada anak-anak kita
mempunyai kualiti yang tinggi.
Berhubung dengan kelajuan Internet di kawasan luar bandar yang dibangkitkan
oleh Yang Berhormat Senator Dato’ Isa bin Ab Hamid- ada Yang Berhormat Senator
Dato’ Isa? Terima kasih Dato’ Isa.
KPM akan bekerjasama erat dengan Kementerian Komunikasi dan Multimedia
untuk memastikan capaian Internat di sekolah selaras untuk mengoptimumkan potensi
murid menguasai kemahiran abad ke-21 bagi melahirkan murid yang dinamik, fleksibel
dan *adaptive* dalam menghadapi apa jua situasi serta berjaya mendepani cabaran
kehidupan di era Revolusi Industri 4.0, dan agar ia boleh dapat dicapai dalam waktu yang
segera.
Tuan Yang di-Pertua, isu TVET. Terima kasih kepada Yang Berhormat Senator
Dr. Zaiedi Haji Suhaili dan Yang Berhormat Senator Datin Rahimah binti Haji Mahamad
yang prihatin dan cakna dengan isu-isu berhubung dengan TVET.
Program Diploma Vokasional Malaysia ataupun DVM yang dijalankan di kolej
vokasional sedang melalui prosedur penilaian akreditasi semasa oleh Agensi Kelayakan
Malaysia ataupun MQA. Diploma Vokasional Malaysia (DVM) yang telah dapat akreditasi
penuh MQA nanti akan dinilai taraf setara dengan diploma tahap empat Kerangka
Kelayakan Malaysia untuk mereka bekerja dalam sektor perkhidmatan awam ataupun
industri tertakluk kepada pihak berkuasa melantik iaitu PBM dan keperluan majikan yang
melantik.
Untuk makluman, jurang gaji lepasan DVM di industri tertakluk kepada jenis
industri, kawasan dan jawatan yang ditawarkan pekerjaan tersebut. Pelajar lepasan DVM
telah mendapat peluang pekerjaan dan gaji yang memuaskan dalam sektor industri.
Dapatan kajian kebolehpasaran oleh KPM bagi graduan DVM bagi tahun 2017, seramai
12,803 orang graduan pelajar yang berpendapatan dengan gaji permulaan antara
RM1,501 hingga RM2,000. Seramai 4,584 orang iaitu 35.80 peratus adalah kumpulan
gaji paling tinggi diperoleh oleh pelajar lepasan DVM.
Berhubung isu penyetaraan sijil TVET. Saya dimaklumkan bahawa akreditasi
MQA dan Jabatan Pembangunan Kemahiran (JPK) dari segi pengiktirafan kedua-dua sijil
adalah setara melalui Sistem Akreditasi Tunggal. Sebagai contoh, pengiktirafan diploma
akademik dan diploma kemahiran berada pada tahap empat MQF.
Berhubung dengan status Jawatankuasa Pemerkasaan Pendidikan Teknikal
dan Latihan Vokasional (TVET), tindakan awal jawatankuasa tersebut adalah
mendapatkan maklum balas daripada pelbagai pihak termasuk industri, institusi-institusi
kerajaan, swasta dan pelajar.
Antara strategi yang telah dilaksanakan oleh JKTVET ialah dengan
mengadakan sesi jelajah ataupun *townhall* dan pertemuan dengan pihak yang
berkepentingan dalam memberikan maklum balas berhubung usaha menambah baik
TVET.
Tuan Yang di-Pertua, isu guru dan pensyarah. Isu berhubung guru dan
pensyarah telah ditimbulkan oleh Yang Berhormat Senator Dr. Zaiedi Haji Suhaili. Ini
banyak ditanyakan oleh Yang Berhormat Senator Dr. Zaiedi. Terima kasih Yang
Berhormat Senator Dr. Zaiedi Haji Suhaili, Yang Berhormat Senator Tuan Adrian Banie
Lasimbang dan Yang Berhormat Senator Datuk Ng Chiang Chin.
Terima kasih saya ucapkan kepada semua. Berhubung penempatan guru
berdasarkan opsyen, KPM sememangnya melaksanakan penempatan guru baharu
berdasarkan kekosongan jawatan dan keperluan opsyen setelah menerima bekalan guru
baharu yang diperakui lantikan tetap oleh Suruhanjaya Perkhidmatan Pendidikan (SPP).
Guru baharu yang berkelahiran dan beralamat di Sarawak akan diberikan
keutamaan untuk ditempatkan ke Sarawak mengikut Dasar 90:10. Bagi menjaga
kebajikan guru-guru yang berkhidmat di kawasan pedalaman pula, kerajaan telah
memperuntukkan Elaun Khas Mengikut Lokasi dan Tahap Kesusahan (EKMLTK) pada
kadar RM500 untuk sekolah pendalaman kategori Pedalaman 1, sebanyak RM1,000
untuk sekolah pedalaman kategori Pedalaman 2 dan RM1,500 untuk kategori Pedalaman
3 berdasarkan kawasan yang diiktiraf oleh jabatan pendidikan negeri.
Selain itu, terdapat juga guru-guru di kawasan pedalaman yang menerima
bayaran insentif pedalaman pada kadar 10 peratus daripada gaji bulanan mereka
berdasarkan kawasan yang diiktiraf oleh pejabat setiausaha kerajaan negeri. Guru-guru
juga layak dibayar Imbuhan Tetap Perumahan pada kadar penuh jika kuarters yang
didiami tidak memenuhi kriteria yang ditetapkan oleh Bahagian Pengurusan Harta,
Jabatan Perdana Menteri.
Izinkan saya memberikan penghargaan dan juga sanjungan dan tahniah
kepada guru-guru yang sanggup berkorban pergi ke kawasan-kawasan pedalaman luar
bandar terutamanya mereka yang pergi ke P3. Dalam kunjungan saya ke Bintulu,
Sarawak baru-baru ini, saya telah bertemu dengan beberapa guru daripada
Semenanjung yang ada di antaranya lebih 10 tahun, malah ada lebih 20 tahun, malah
ada yang telah 28 tahun berada di Sarawak demi untuk mendidik anak-anak bangsa.
Mereka sanggup berjauhan daripada tempat kelahiran mereka. Mereka inilah yang saya
gelarkan sebagai guru-guru adiwira ataupun *hero teachers*. Satu penghargaan wajib
diberikan untuk mereka.
Semua bakal guru telah diberikan pendedahan melalui kursus-kursus yang
diikuti oleh bakal guru semasa menuntut di IPG. Melalui kursus budaya dan
pembelajaran, pelajar akan dapat ataupun pelatih akan dapat memahami dan peka
terhadap kepelbagaian sosiobudaya di Malaysia serta dapat mewujudkan persekitaran
bilik darjah mesra budaya. Ini demi mengelakkan mereka melakukan perkara-perkara
yang tidak cocok dengan komuniti di mana mereka mengajar. Perlunya ada sikap prihatin
dan sensitif terhadap budaya setempat.
Maka, guru-guru akan dengan segera dapat mengadaptasi diri mereka dengan
komuniti, dengan murid-murid dan juga dengan ibu bapa. Di samping itu, semua guru
baharu yang ditempatkan di sekolah rendah dan menengah seluruh negara sama ada di
bandar mahupun di luar bandar telah diberikan pendedahan dan bimbingan untuk
menyesuaikan diri serta dapat mengadaptasi persekitaran komuniti dan budaya sekolah
melalui satu program khas iaitu Program Pembangunan Guru Baharu bagi tempoh antara
1 tahun hingga 3 tahun di sekolah masing-masing di kawasan luar bandar dan juga
pedalaman.
Tuan Yang di-Pertua, berkaitan dasar pendidikan. Yang Berhormat Senator
Datuk Ng Chiang Chin ada?"
USUL,"KAJIAN SEPARUH PENGGAL
RANCANGAN MALAYSIA KESEBELAS (2018-2020)",,■1700,1700,Tuan Yang di-Pertua,Tidak ada.
USUL,"KAJIAN SEPARUH PENGGAL
RANCANGAN MALAYSIA KESEBELAS (2018-2020)",,■1710,1710,Dr. Maszlee bin Malik,"Tidak ada. Jadi kita tidak jawab. Kita jawab secara
bertulis.
Yang Berhormat Senator Puan Bathmavathi? Tadi saya bersama- terima kasih
Senator.
Yang Berhormat Senator Puan Bathmavathi Krishnan merupakan sahabat baik
saya. Kita menghayati perjuangan- bersama-sama memperjuangkan nasib rakyat yang
mempunyai kelainan dan keistimewaan upaya.
Okey, tentang kesediaan sekolah. KPM mempunyai beberapa strategi untuk
memastikan murid berkeperluan khas (MBK) menerima pendidikan yang selari dengan
keperluan mereka sama ada ke sekolah-sekolah biasa, melalui program pendidikan
inklusif, program pendidikan khas integrasi ataupun sekolah pendidikan khas. Kita cuba
sedaya-upaya untuk menggalakkan ramai murid berkeperluan khas agar dapat masuk
ke sekolah-sekolah *mainstream* ataupun sekolah biasa agar konsep *inclusivity,* dengan
izin, ataupun konsep keterbukaan dapat bersama.
Sebenarnya yang memerlukan perhatian bukan sekadar murid berkeperluan
khas tetapi murid-murid biasa untuk membentuk di dalam jiwa mereka sikap manusiawi
agar dapat menerima murid-murid berkeperluan khas sama seperti mereka, agar dapat
membantu apa yang kurang dan juga memanfaatkan apa yang lebih. Maka kita
menyasarkan daripada program inklusif ini agar anak-anak murid yang tidak mempunyai
keperluan khas akan terdidik naluri dan kemanusiaan mereka terhadap rakan-rakan
mereka yang memerlukan keperluan khas.
Antara strateginya adalah dengan menyediakan kemudahan mesra OKU secara
berperingkat di seluruh negara bermula dengan sekolah pendidikan khas dan program
pendidikan khas integrasi. Pelaksanaan program pendidikan inklusif bermula 2019 di
peringkat sekolah rendah dan kursus peningkatan profesionalisme guru berdasarkan
murid berkeperluan khas kepada guru-guru arus perdana, pengetua, guru besar dan guru
pendidikan khas.
Satu dialog yang sangat terkesan buat saya dari filem *Bollywood,* yang bertajuk,
*Taare Zameen Par*, dengan izin, yang bermaksud “seperti bintang di bumi.” Filem yang
dilakonkan dan diarahkan oleh Aamir Khan ini berkaitan seorang murid yang
berkeperluan khas yang mana protagonisnya iaitu seorang guru yang dilakonkan oleh
Aamir Khan sendiri ada menyebutkan, *“Setiap kanak-kanak mempunyai keistimewaan
mereka sendiri, potensi mereka sendiri dan minat mereka sendiri”.*
Apa yang dimaksudkan di sini ialah beliau melihat- sebagai seorang guru, murid-
murid berkeperluan khas bukan sebagai orang yang berkurangan tetapi orang yang
mempunyai keistimewaan mereka dan mereka mempunyai kebolehan yang berbeza dan
mereka ini mempunyai minat yang berbeza yang perlu diserkapi sebagai seorang
manusia.
Hal-hal kualiti pendidikan. Kepada Yang Berhormat Senator Datuk Ng Chiang
Chin."
USUL,"KAJIAN SEPARUH PENGGAL
RANCANGAN MALAYSIA KESEBELAS (2018-2020)",,■1710,1710,Tuan Yang di-Pertua,Tiada.
USUL,"KAJIAN SEPARUH PENGGAL
RANCANGAN MALAYSIA KESEBELAS (2018-2020)",,■1710,1710,Dr. Maszlee bin Malik,"Ya, tiada?"
USUL,"KAJIAN SEPARUH PENGGAL
RANCANGAN MALAYSIA KESEBELAS (2018-2020)",,■1710,1710,Puan Bathmavathi Krishnan,"Tuan Yang di-Pertua, boleh saya minta
penerangan sedikit?"
USUL,"KAJIAN SEPARUH PENGGAL
RANCANGAN MALAYSIA KESEBELAS (2018-2020)",,■1710,1710,Tuan Yang di-Pertua,"Boleh, boleh."
USUL,"KAJIAN SEPARUH PENGGAL
RANCANGAN MALAYSIA KESEBELAS (2018-2020)",,■1710,1710,Dr. Maszlee bin Malik,Silakan Yang Berhormat.
USUL,"KAJIAN SEPARUH PENGGAL
RANCANGAN MALAYSIA KESEBELAS (2018-2020)",,■1710,1710,Puan Bathmavathi Krishnan,"Terima kasih Tuan Yang di-Pertua. Berkenaan
dengan *zero reject policy* dan pengumuman yang sudah pun dibuat oleh Yang Berhormat
Menteri yang kita akan mula pada tahun 2019.
Jadi apa akan berlaku sekiranya ibu bapa bawa murid OKU untuk mendaftar
ataupun untuk masuk sekolah dan dihadapi dengan situasi di mana guru dan juga guru
besar belum sedia untuk menerima. Itu yang saya tanyakan dalam perbahasan saya,
tempoh masa sekarang hingga Januari 2019 itu beberapa minggu sahaja.
Jadi saya rasa mungkin untuk menangani masalah yang dijangka timbul,
mungkin boleh diadakan satu ruang ataupun satu saluran di mana ibu bapa ini boleh
bawa kepincangan mereka berkenaan dengan pendaftaran anak OKU mereka. *Set up*
mungkin di bawah KPMkah, JPN di negeri-negeri dan dari situ kementerian boleh kumpul
*real data,* apa yang dihadapi oleh ibu bapa. *So* satu cadangan sahajalah.
Satu lagi isu yang saya bawa dalam perbahasan saya ialah berkenaan dengan
perkhidmatan sokongan yang 3PK, yang perkhidmatan sokongan bagi murid itu, yang 28
guru telah dihantar ke luar negara yang sekarang ditempatkan di pusat perkhidmatan.
Jadi saya minta supaya ini diteruskan dan ditambahkan kerana keperluan itu ada. Ada
ramai murid keperluan khas yang memerlukan perkhidmatan sokongan. Jadi itu belum
dijawab Yang Berhormat Menteri, silalah."
USUL,"KAJIAN SEPARUH PENGGAL
RANCANGAN MALAYSIA KESEBELAS (2018-2020)",,■1710,1710,Dr. Maszlee bin Malik,"Terima kasih Yang Berhormat Senator. Kita mengambil
maklum cadangan yang diberikan dan saya kira itu bukan sekadar cadangan tetapi satu
perkongsian daripada Yang Berhormat Senator untuk kami lakukan dan kami
laksanakan. *In syaa Allah,* pihak Kementerian Pendidikan akan melakukannya menurut
kemampuan kami dan akan melakukan sebaiknya dan dari semasa ke semasa kita akan
mengambil pandangan dan buah saranan daripada Yang Berhormat Senator.
Oleh kerana hal kualiti pendidikan tidak ada, maka penutup. Tuan Yang di-
Pertua, sekali lagi Kementerian Pendidikan mengucapkan setinggi-tinggi penghargaan
dan ucapan terima kasih di atas keprihatinan, perhatian, teguran dan sokongan yang
berterusan yang telah diberikan oleh Ahli-ahli Yang Berhormat Senator di Dewan Negara
ini khasnya terhadap usaha-usaha yang dijalankan oleh KPM."
USUL,"KAJIAN SEPARUH PENGGAL
RANCANGAN MALAYSIA KESEBELAS (2018-2020)",,■1710,1710,Dato’ Dr. Ananthan a/l Somasundaram,"Sikit, sebelum..."
USUL,"KAJIAN SEPARUH PENGGAL
RANCANGAN MALAYSIA KESEBELAS (2018-2020)",,■1710,1710,Dr. Maszlee bin Malik,"Saya rasa bergembira melihat banyak cadangan yang
diberikan lebih daripada soalan."
USUL,"KAJIAN SEPARUH PENGGAL
RANCANGAN MALAYSIA KESEBELAS (2018-2020)",,■1710,1710,Tuan Yang di-Pertua,"Yang Berhormat Menteri, Yang Berhormat Puan Asmak."
USUL,"KAJIAN SEPARUH PENGGAL
RANCANGAN MALAYSIA KESEBELAS (2018-2020)",,■1710,1710,Puan Asmak binti Husin,"Saya ada bangkitkan beberapa soalan lagi berkaitan
dengan kementerian. Pertama mengenai tugas kaunselor di sekolah yang sentiasa
bertindan, tidak dapat menjalankan tanggungjawab kaunselor dengan baik.
Kedua, saya ada bertanya tentang keberkesanan Program Pencegahan Dadah
di sekolah termasuk Program Saranan iaitu keterlibatan ibu bapa dan program rahsia
yang melibatkan rokok, AIDS dan lain-lain sebab kalau ikutkan *target*, saya ada sebutlah
kita di sekolah ini kita *target* tahun 2012 kita sudah bebas dadah dan negara Malaysia
bebas dadah 2015. Jadi hendak tanya keberkesanan program PPDA.
Seterusnya, saya ada bangkitkan juga soalan berkaitan dengan insentif,
biasiswa dan juga penyediaan pakar di peringkat IPT. Tadi dijawapannya di peringkat
sekolah menengah dan sekolah rendah, di peringkat IPT untuk keseimbangan antara
STEM dan lain-lain itu. Itulah antara soalan yang mungkin tidak dijawab lagi. Sekian."
USUL,"KAJIAN SEPARUH PENGGAL
RANCANGAN MALAYSIA KESEBELAS (2018-2020)",,■1710,1710,Dr. Maszlee bin Malik,"Terima kasih Tuan Yang di-Pertua. Berkaitan dengan
keseimbangan di antara STEM dengan lain-lain, ke hadapan ini, KPM melihat bahawa
perlunya ada kesedaran STEM di kalangan rakyat Malaysia sama ada di peringkat bawah
mahupun di peringkat universiti mahupun di peringkat komuniti. STEM tidak perlu
ataupun tidak boleh hanya dilihat sebagai *stream* ataupun aliran semata-mata tetapi perlu
dilihat sebagai satu cara hidup, cara berfikir yang betul. Maka pada tahun-tahun hadapan,
kita akan memperkenalkan *STEM for all* ataupun *science for all* demi menjadikan
berfikiran cara sains itu adalah sebahagian daripada gaya hidup masyarakat Malaysia.
Itu yang pertama.
Berkaitan dengan sastera supaya dapat diseimbangkan di antara STAM dengan
sastera, seperti mana yang kita tahu kita akan memperkenalkan semula sastera untuk
semua, sama ada di dalam kurikulum-kurikulum yang ada ataupun di integrasikan di
dalam subjek-subjek yang ada. Begitu juga di antara usaha yang kita akan bawa pada
tahun-tahun ke hadapan untuk membawa karya-karya sastera silam kita, karya-karya
sastera agung untuk diperkenalkan di sekolah agar kita dapat membesar, agar anak-
anak kita dapat membangun dengan mengenali akar umbi jati diri mereka.
Begitu juga seperti mana saya sebutkan di Dewan Negara pada pagi tadi, dua
subjek akan diperkenalkan di peringkat IPT iaitu subjek Falsafah dan juga subjek Etika
yang mana falsafah amat penting demi untuk memberikan cara berfikir yang betul.
Maafkan saya bukan di Dewan Negara, saya menjawab soalan di Dewan Rakyat. Bila
ada dua Dewan serentak ini, kita ke sana ke sini, lupa.
Okey, berkaitan dengan kaunselor yang bertindan pula. Jikalau kita lihat, kita
tidak nafikan, kita memerlukan kaunselor yang lebih dan *in syaa Allah*, jikalau keadaan
kewangan semasa kita semakin pulih, semakin baik, kita akan cuba menambah bilangan
kaunselor sama ada di sekolah ataupun di peringkat PPD."
USUL,"KAJIAN SEPARUH PENGGAL
RANCANGAN MALAYSIA KESEBELAS (2018-2020)",,■1720,1720,Dr. Maszlee bin Malik,"Akan tetapi apa yang penting bagi guru-guru juga kita akan sentiasa dari masa
ke semasa memberikan kemahiran kaunseling agar mereka walaupun bukan sebagai
kaunselor, tetapi mempunyai *skill* untuk memberikan kaunseling kepada anak-anak
muridnya.
Berkaitan dengan program antidadah."
USUL,"KAJIAN SEPARUH PENGGAL
RANCANGAN MALAYSIA KESEBELAS (2018-2020)",,■1720,1720,Puan Raj Munni binti Sabu,
USUL,"KAJIAN SEPARUH PENGGAL
RANCANGAN MALAYSIA KESEBELAS (2018-2020)",,■1720,1720,ANNOTATION,[Bangun]
USUL,"KAJIAN SEPARUH PENGGAL
RANCANGAN MALAYSIA KESEBELAS (2018-2020)",,■1720,1720,Menteri Pendidikan [Dr. Maszlee bin Malik],"Semua sekolah kerajaan dan
bantuan kerajaan perlu melaksanakan program PPDA bagi memberikan maklumat
tentang bahaya dadah, rokok, *inhale,* alkohol dan HIV. Manakala bagi murid yang
didapati urin positif yang disaring oleh AADK, program intervensi akan dilaksanakan oleh
guru bimbingan dan kaunseling bagi memastikan murid pulih daripada gejala dadah. Ini
antara yang dilakukan secara berterusan sekarang ini.
(i) di peringkat pendidikan tinggi pula, bagi membendung gejala
penyalahgunaan dadah oleh warga dan pelajar IPTS, KPM telah
mengambil langkah-langkah berikut:
(ii) program kesedaran dan pencegahan penyalahgunaan dadah
dengan kerjasama Agensi Antidadah Kebangsaan (AADK) dan
IPTS;
(iii) mengadakan Hari Bersama Pelanggan (HBP) dengan IPTS
secara bulanan; dan
(iv) pelaksanaan operasi bersepadu dan perkongsian maklumat
dengan agensi penguatkuasaan seperti Jabatan Imigresen
Malaysia dan Polis Diraja Malaysia.
Begitu juga jikalau kita lihat, saya juga telah menerima laporan berkaitan
program-program antidadah yang dilakukan di sekolah-sekolah di seluruh Malaysia
melalui Laporan Jemaah Nazir yang akan dikongsi dengan Yang Berhormat Senator
secara bertulis. Izinkan saya menutup. Okey..."
USUL,"KAJIAN SEPARUH PENGGAL
RANCANGAN MALAYSIA KESEBELAS (2018-2020)",,■1720,1720,Tuan Yang di-Pertua,Ada lagi dua orang Yang Berhormat.
USUL,"KAJIAN SEPARUH PENGGAL
RANCANGAN MALAYSIA KESEBELAS (2018-2020)",,■1720,1720,Dr. Maszlee bin Malik,Ada dua orang lagi?
USUL,"KAJIAN SEPARUH PENGGAL
RANCANGAN MALAYSIA KESEBELAS (2018-2020)",,■1720,1720,Tuan Yang di-Pertua,Silakan Yang Berhormat Senator Puan...
USUL,"KAJIAN SEPARUH PENGGAL
RANCANGAN MALAYSIA KESEBELAS (2018-2020)",,■1720,1720,Dr. Maszlee bin Malik,Ini tidak hendak balik ini. Okey silakan.
USUL,"KAJIAN SEPARUH PENGGAL
RANCANGAN MALAYSIA KESEBELAS (2018-2020)",,■1720,1720,Puan Raj Munni binti Sabu,"Saya ingat soalan saya pun mungkin akan
panjang, saya bawa dalam perbahasan bajet."
USUL,"KAJIAN SEPARUH PENGGAL
RANCANGAN MALAYSIA KESEBELAS (2018-2020)",,■1720,1720,Tuan Yang di-Pertua,Yang Berhormat Dato’ Dr. Ananthan.
USUL,"KAJIAN SEPARUH PENGGAL
RANCANGAN MALAYSIA KESEBELAS (2018-2020)",,■1720,1720,Dato’ Dr. Ananthan a/l Somasudaram,"Walaupun soalan ini adalah
berdasarkan apa yang dikatakan oleh Yang Berhormat Menteri, penjelasan tadi terbaik
tetapi konsep pelaksanaan pendidikan yang bersamaan saksama. Saya hendak tanya
satu soalan. Memang saya sudah bincang tadi tetapi saya hendak Yang Berhormat
Menteri beritahu di Dewan yang mulia ini.
Baru-baru ini ada satu mesej yang tular di media sosial yang menyatakan
bahawa murid-murid lepasan SJKT dan juga SJKC yang mendapat 8A tidak diterima
masuk ke sekolah asrama penuh- sains. Adakah ini maklumat yang benar? Minta
respons daripada Yang Berhormat Menteri. Terima kasih."
USUL,"KAJIAN SEPARUH PENGGAL
RANCANGAN MALAYSIA KESEBELAS (2018-2020)",,■1720,1720,Dr. Maszlee bin Malik,"Berkaitan dengan maklumat yang tular ke media sosial
dan saya sendiri telah menerima dekat 20 tularan daripada rakan-rakan daripada
Menteri-Menteri Pakatan Harapan dan juga rakan-rakan daripada Ahli Dewan Rakyat
sendiri.
Pihak Kementerian Pendidikan Malaysia akan menjawab secara rasmi dan bagi
pihak Yang Berhormat Senator, kita akan memberikan jawapan secara bertulis. Okey.
Ya Yang Berhormat Senator, silakan."
USUL,"KAJIAN SEPARUH PENGGAL
RANCANGAN MALAYSIA KESEBELAS (2018-2020)",,■1720,1720,Tuan Yang di-Pertua,"Ahli-ahli Yang Berhormat, ini adalah berkenaan dengan
perbahasan yang telah dibangkitkan atau yang baru?"
USUL,"KAJIAN SEPARUH PENGGAL
RANCANGAN MALAYSIA KESEBELAS (2018-2020)",,■1720,1720,Tuan Haji Muhamad bin Mustafa,"Ya, ya. Pernah dibangkit tetapi tidak
dijawab."
USUL,"KAJIAN SEPARUH PENGGAL
RANCANGAN MALAYSIA KESEBELAS (2018-2020)",,■1720,1720,Tuan Yang di-Pertua,"Okey, silakan."
USUL,"KAJIAN SEPARUH PENGGAL
RANCANGAN MALAYSIA KESEBELAS (2018-2020)",,■1720,1720,Tuan Haji Muhamad bin Mustafa,"Sikit saja, mengenai IPG Kota Bharu."
USUL,"KAJIAN SEPARUH PENGGAL
RANCANGAN MALAYSIA KESEBELAS (2018-2020)",,■1720,1720,Tuan Yang di-Pertua,Esok Yang Berhormat Menteri hendak balik ini.
USUL,"KAJIAN SEPARUH PENGGAL
RANCANGAN MALAYSIA KESEBELAS (2018-2020)",,■1720,1720,Tuan Haji Muhamad bin Mustafa,"Pandangan berkenaan iaitu lah pandangan
daripada IPG Kota Bharu yang hendak digabungkan dengan TVET. Minta mohon
jawapan."
USUL,"KAJIAN SEPARUH PENGGAL
RANCANGAN MALAYSIA KESEBELAS (2018-2020)",,■1720,1720,Tuan Yang di-Pertua,IPD?
USUL,"KAJIAN SEPARUH PENGGAL
RANCANGAN MALAYSIA KESEBELAS (2018-2020)",,■1720,1720,Tuan Haji Muhamad bin Mustafa,IPG Kota Bharu.
USUL,"KAJIAN SEPARUH PENGGAL
RANCANGAN MALAYSIA KESEBELAS (2018-2020)",,■1720,1720,Tuan Yang di-Pertua,"IPG Kota Bharu, TVET."
USUL,"KAJIAN SEPARUH PENGGAL
RANCANGAN MALAYSIA KESEBELAS (2018-2020)",,■1720,1720,Tuan Haji Muhamad bin Mustafa,Saya tunggu dalam tadi.
USUL,"KAJIAN SEPARUH PENGGAL
RANCANGAN MALAYSIA KESEBELAS (2018-2020)",,■1720,1720,Dr. Maszlee bin Malik,"Bukan hendak balik, hendak pergi ke Dewan Rakyat,
Tuan Yang di-Pertua.
**Tuan Yang di-Pertua;** Okey."
USUL,"KAJIAN SEPARUH PENGGAL
RANCANGAN MALAYSIA KESEBELAS (2018-2020)",,■1720,1720,Dr. Maszlee bin Malik,"Berkaitan dengan status terkini IPG Kota Bharu, kita
akan berikan jawapan bertulis kepada Yang Berhormat Senator yang bertanya, okey.
Pertama sekali saya ingin mengucapkan terima kasih di atas keprihatinan,
perhatian, teguran dan sokongan yang berterusan oleh Ahli-ahli Yang Berhormat Senator
khasnya terhadap usaha-usaha yang dijalankan oleh kementerian.
Perkara-perkara yang dibangkitkan oleh Yang Berhormat Senator yang tidak
dapat saya sentuh kerana kesuntukan masa akan diambil perhatian dan tindakan
sewajarnya. Dia sebab bila berjalan seiring Dewan Rakyat dengan Dewan Negara, kita
melompat sana, melompat sini. Macam *marathon.* Izinkan saya untuk menutup
penggulungan ini dengan kata-kata daripada seorang pemikir dan juga ahli falsafah yang
berasal daripada Iran iaitu Dr. Ali Shariati. Beliau mengatakan, “Kemiskinan bukanlah
hari-hari tanpa makanan tetapi kemiskinan adalah hari-hari tanpa pemikiran”. Sekian,
terima kasih."
USUL,"KAJIAN SEPARUH PENGGAL
RANCANGAN MALAYSIA KESEBELAS (2018-2020)",,■1720,1720,Tuan Yang di-Pertua,"Terima kasih Yang Berhormat Menteri.
Silakan Kementerian Pembangunan Luar Bandar. Yang Berhormat Menteri."
USUL,"KAJIAN SEPARUH PENGGAL
RANCANGAN MALAYSIA KESEBELAS (2018-2020)",,5.25 ptg.,1725,Timbalan Menteri Pembangunan Luar Bandar [Tuan Sivarasa Rasiah],"Terima kasih Tuan Yang di-Pertua. Terlebih dahulu saya ingin menyampaikan
penghargaan dan ucapan terima kasih kepada empat orang Ahli-ahli Yang Berhormat
yang telah sudi berbahas dan membangkitkan perkara-perkara yang berkaitan dengan
Kementerian Pembangunan Luar Bandar sepanjang tiga hari perbahasan Kajian
Separuh Penggal, RMKe-11 ini. Izinkan saya untuk menjawab perkara-perkara yang
telah dibangkitkan oleh Ahli-ahli Yang Berhormat semasa perbahasan tersebut.
Pertama adalah isu yang dibangkitkan oleh Yang Berhormat Senator Datuk
Rabiyah binti Ali."
USUL,"KAJIAN SEPARUH PENGGAL
RANCANGAN MALAYSIA KESEBELAS (2018-2020)",,5.25 ptg.,1725,Tuan Yang di-Pertua,"Ada, ada."
