level_1,level_2,level_3,timestamp,author,speech
JAWAPAN-JAWAPAN LISAN BAGI PERTANYAAN-PERTANYAAN,11.,,1150,Puan Teresa Kok Suh Sim [Seputeh],"Tuan Yang di-Pertua, soalan tambahan.
Hendak tanya Yang Berhormat Menteri. Ini *KL Car Free Morning,* wakil rakyat di sebelah
sini semua tidak dijemput. Sekarang kalau Tuan Yang di-Pertua hendak tanya saya mana
ada tempat *KL Car-Free Morning?* Sebenarnya saya pun tak tahu. Saya tanya Yang
Berhormat- tidak tahu,Yang Berhormat Batu tidak tahu, Yang Berhormat Lembah Pantai
tidak tahu.
Jadi adakah ini menunjukkan yang DBKL atau kementerian telah menjayakan
Program *KL Car-Free Morning* kerana Wakil Rakyat pun tidak tahu, kami tidak dijemput,
tidak ada publisiti?
Sebenarnya saya hendak tanya Yang Berhormat Menteri, sekarang saya pernah
sesak dalam *traffic jam* pada hari Sabtu yang lepas. Hari Sabtu sepatutnya yang orang *free,*
boleh pergi *shopping* dan lain. Saya *stuck* ini *roundabout* dekat Jalan Parlimen sini satu
jam. Tak tau apa yang dilakukan dekat sana, tidak ada papan tanda, tak ada orang tahu
kenapa kita sesak dalam *traffic.*
Saya hendak tanya memandangkan DBKL ingin menjual tanah bagi lebih rumah
mampu milik dibina di sana sini dengan *density* yang tinggi sangat, adakah kementerian
dan juga DBKL mengadakan lebih mesyuarat dengan pihak SPAD untuk membincangkan
macam mana memperluaskan lagi pengangkutan awam khususnya bas untuk orang ramai
supaya kita boleh naik dengan pengangkutan awam."
JAWAPAN-JAWAPAN LISAN BAGI PERTANYAAN-PERTANYAAN,11.,,1200,Puan Teresa Kok Suh Sim [Seputeh],"Jangan tiba-tiba adakan cadangan seperti *congestion charges* dan sebagainya.
Bila dibebel DBKL hendak tambahkan lagi penduduk di pusat bandar Kuala Lumpur tanpa
melihat pada kesesakan trafik dan juga ke tahap pengangkutan awam yang paling tidak
memuaskan yang berlaku di Kuala Lumpur sekarang. Minta penjelasan."
JAWAPAN-JAWAPAN LISAN BAGI PERTANYAAN-PERTANYAAN,11.,,1200,Datuk Seri Tengku Adnan Tengku Mansor,"Tuan Yang di-Pertua, terima kasih
soalan tambahan daripada Yang Berhormat Seputeh. Minta maaf Yang Berhormat Seputeh,
kalau Yang Berhormat Seputeh kata Yang Berhormat Seputeh tidak tahu *Car-Free Morning,*
saya ingat Yang Berhormat Seputeh suka tengok komputer dengan cerita yang bukan-
bukan. Tiap-tiap papan tanda yang kita ada ITIS, tiap-tiap seminggu sebelum ada *Car-Free
Morning,* itu dipaparkan. Tiap-tiap jalan yang akan ditutup, dipaparkan. Tolong buka mata,
tengok. Jangan salahkan DBKL.
Yang Berhormat Seputeh senang, kalau Yang Berhormat Seputeh tidak mahu
menyediakan rumah-rumah untuk orang-orang Seputeh untuk duduk dengan rumah mampu
dimiliki, boleh. Saya tidak payah bangunkan. Semua apa yang kita lakukan Yang Berhormat
kata salah. Apa yang sebenarnya kita lakukan adalah untuk kebaikan rakyat di Kuala
Lumpur. Apa yang telah dibangunkan oleh kerajaan, jaringan *public transport* untuk
makluman Yang Berhormat, kita ada GO-KL *bus* yang diberikan secara percuma. Tiap-tiap
tahun kita berbelanja lebih daripada RM70 juta, kerajaan bayar untuk menyediakan bas
percuma digunakan oleh warga Kuala Lumpur.
Jadi inilah masalah Yang Berhormat tidak tengok. Yang Berhormat hanya buka
*hand phone* cerita yang bukan-bukan, fitnah, fitnah, fitnah, cakap yang bukan-bukan.
Tolong sikitlah. Buka minda, lihat kebaikan yang dilakukan oleh kerajaan yang ada hari ini.
Kerajaan hari ini merupakan kerajaan yang prihatin kepada rakyat. Saya sebagai Menteri
Wilayah Persekutuan berjanji di dalam Dewan ini, saya akan pastikan bahawa rakyat saya
senang. Itu Yang Berhormat, tolong jaga Yang Berhormat Seputeh. Sekian, terima kasih."
JAWAPAN-JAWAPAN LISAN BAGI PERTANYAAN-PERTANYAAN,11.,,1200,ANNOTATION,[Masa untuk Pertanyaan-pertanyaan bagi Jawab Lisan tamat]
RANG UNDANG-UNDANG,"RANG UNDANG-UNDANG PERBEKALAN 2017
Bacaan Kali Yang Kedua
DAN
USUL
ANGGARAN PEMBANGUNAN 2016",,1200,,"*Aturan Urusan Mesyuarat* dibacakan bagi menyambung semula perbahasan yang
ditangguhkan atas masalah, “Bahawa Rang Undang-undang Perbekalan 2017 ini
dibacakan kali yang kedua sekarang” dan “Bahawa Usul yang berikut ini dirujuk kepada
Jawatankuasa sebuah-buah Majlis.”
“Bahawa Dewan ini, mengikut subseksyen 4(3) Akta Kumpulan
Wang Pembangunan 1966 [Akta 406], membuat ketetapan iaitu suatu
jumlah wang sebanyak tidak lebih dari empat puluh lapan bilion ringgit
(RM48,000,000,000) dibelanjakan daripada Kumpulan Wang
Pembangunan bagi tahun 2017, dan bagi tujuan dan butiran
perbelanjaan pembangunan yang dinyatakan di bawah Maksud
Pembangunan atau (“P”) dalam senarai Anggaran Perbelanjaan
Persekutuan 2017, yang dibentangkan sebagai Kertas Perintah 25 Tahun
2016, adalah diuntukkan di bawah Maksud-maksud yang berkenaan
jumlah-jumlah yang bersetentangan dengan butiran-butiran itu di ruangan
enam dan tujuh senarai tersebut.”"
RANG UNDANG-UNDANG,"RANG UNDANG-UNDANG PERBEKALAN 2017
Bacaan Kali Yang Kedua
DAN
USUL
ANGGARAN PEMBANGUNAN 2016",,1200,ANNOTATION,"[26 Oktober, 2016]"
RANG UNDANG-UNDANG,"RANG UNDANG-UNDANG PERBEKALAN 2017
Bacaan Kali Yang Kedua
DAN
USUL
ANGGARAN PEMBANGUNAN 2016",,1200,Tuan Yang di-Pertua,"Ahli Yang Berhormat, giliran yang berhujah sekarang ini
iaitu Yang Berhormat Jerantut dan Yang Berhormat Jerantut ada 30 minit. Jadi Ahli Yang
Berhormat, seperti yang kita sedia maklum di hadapan ini ada dua monitor yang
menandakan masa. Jadi masa itu kalau berakhir maka berakhirlah. Jadi tidak ada *injury,*
kalau ada pencelahan daripada Ahli-ahli Yang Berhormat yang lain. Jadi terpulang kepada
Yang Berhormat yang berhujah itu sama ada bagi laluan atau tidak. Jadi kalau Yang
Berhormat berhujah tidak bagi laluan, saya harap janganlah paksa Ahli Yang Berhormat itu
dengan berdiri dan mengganggu oleh sebab masa itu emas, tidak ada *injury time. So, it will
be your fault* kalau ada perkara sebegitu. Sila Yang Berhormat Jerantut."
RANG UNDANG-UNDANG,"RANG UNDANG-UNDANG PERBEKALAN 2017
Bacaan Kali Yang Kedua
DAN
USUL
ANGGARAN PEMBANGUNAN 2016",,1200,Tuan Sim Chee Keong [Bukit Mertajam],"Tuan Yang di-Pertua, peraturan
mesyuarat. Tuan Yang di-Pertua."
RANG UNDANG-UNDANG,"RANG UNDANG-UNDANG PERBEKALAN 2017
Bacaan Kali Yang Kedua
DAN
USUL
ANGGARAN PEMBANGUNAN 2016",,1200,Tuan Yang di-Pertua,"Sila, peraturan mesyuarat."
RANG UNDANG-UNDANG,"RANG UNDANG-UNDANG PERBEKALAN 2017
Bacaan Kali Yang Kedua
DAN
USUL
ANGGARAN PEMBANGUNAN 2016",,1200,Tuan Sim Chee Keong [Bukit Mertajam],"Terima kasih Tuan Yang di-Pertua.
Saya ingin merujuk kepada Peraturan Mesyuarat 36(12), Perkara 36(12) di mana saya telah
juga menulis sepucuk surat kepada Tuan Yang di-Pertua semalam untuk merujuk Ahli Yang
Berhormat Pekan kepada Jawatankuasa Hak dan Kebebasan kerana ucapan beliau Bajet
2017 itu saya ada sebab untuk percaya bahawa ia telah mengelirukan Dewan. Saya masih
belum dapat lagi keputusan daripada Tuan Yang di-Pertua."
RANG UNDANG-UNDANG,"RANG UNDANG-UNDANG PERBEKALAN 2017
Bacaan Kali Yang Kedua
DAN
USUL
ANGGARAN PEMBANGUNAN 2016",,1200,Tuan Yang di-Pertua,"Terima kasih. Parlimen sekarang luar biasa. Pemikiran-
pemikiran kita pun sekarang luar biasa. Kadang-kadang yang tidak dijangka oleh pemikiran
saya, otak kampung ini membingungkan. Ahli Yang Berhormat, sedia maklum bahawa
apabila sesuatu usul dibawa di bawah Peraturan Mesyuarat 36(12), ia mesti mematuhi
syarat-syarat yang tertentu. Antara lain ialah mesti ada *prima facie* kes.
Sekarang saya menimbang Ahli Yang Berhormat kerana pernah di suatu ketika
dahulu saya ingat seorang Ahli Yang Berhormat daripada Indera Mahkota, bukan yang
sekarang yang bernama Yang Berhormat Azan kalau tidak silap saya. Dia seorang
akauntan dan juruaudit. Dia menimbulkan satu persoalan yang kononnya dalam buku yang
dibentangkan ada duit *missing RM1 billion over.*
Selepas itu pada ketika itu Yang Berhormat Permatang Pauh membuat *press
statement* di luar, bermakna menghentam kepada kerajaan bahawa duit itu hilang.
Jadi saya dihubungi telefon oleh Timbalan Menteri Kewangan pada ketika itu, dia
mohon izin kepada saya, bolehkah dia juga membuat kenyataan akhbar di luar
memandangkan Permatang Pauh membuat kenyataan di luar. Ini kerana *ruling* saya pada
ketika itu ialah beri saya masa untuk tengok dan panggil pihak-pihak yang tertentu sebelum
saya membuat keputusan. Apabila Timbalan Menteri Kewangan membalas kenyataan
akhbar, selepas itu tidak ada lagi tindakan balas daripada orang yang menuduh kerana
penjelasan itu adalah tepat dan *precise.*
Pengalaman saya pada ketika itu saya panggil pegawai-pegawai daripada
Kementerian Kewangan sendiri. Datang seorang senior pegawai kewangan. Dia
menyatakan kepada saya, dia kata Tan Sri Speaker, saya terlibat untuk membuat
belanjawan pada hampir setiap tahun sejak Dato Seri Anwar Ibrahim, Menteri Kewangan,
beginilah cara kami buat, tidak adapun *inquiry.*
Jadi, dalam hal ini saya cuma mengingatkan kadang-kadang ada perkara yang
tidak tertulis yang kita tidak nampak yang mempunyai penjelasan di belakang. Jadi bagi
saya peluang untuk siasat, selepas itu saya akan buat *ruling* kerana itulah kehendak
Peraturan Mesyuarat 36(12), mesti ada *prima facie* kes. Terima kasih Yang Berhormat."
RANG UNDANG-UNDANG,"RANG UNDANG-UNDANG PERBEKALAN 2017
Bacaan Kali Yang Kedua
DAN
USUL
ANGGARAN PEMBANGUNAN 2016",,1200,Tuan Sim Chee Keong [Bukit Mertajam],"Terima kasih Tuan Yang di-Pertua, jadi
saya anggap bahawa keputusan Tuan Yang di-Pertua adalah supaya hal ini akan disiasat."
RANG UNDANG-UNDANG,"RANG UNDANG-UNDANG PERBEKALAN 2017
Bacaan Kali Yang Kedua
DAN
USUL
ANGGARAN PEMBANGUNAN 2016",,1200,Tuan Yang di-Pertua,Saya ada...
RANG UNDANG-UNDANG,"RANG UNDANG-UNDANG PERBEKALAN 2017
Bacaan Kali Yang Kedua
DAN
USUL
ANGGARAN PEMBANGUNAN 2016",,1200,Tuan Sim Chee Keong [Bukit Mertajam],...Dan akan diberikan satu penjelasan.
RANG UNDANG-UNDANG,"RANG UNDANG-UNDANG PERBEKALAN 2017
Bacaan Kali Yang Kedua
DAN
USUL
ANGGARAN PEMBANGUNAN 2016",,1200,Tuan Yang di-Pertua,"Itu sebab saya belum buat keputusan Yang Berhormat
kerana baru saya nampak Yang Berhormat punya usul kelmarin. Usul ini pun
pembentangan bajet belum pernah berlaku dalam mana-mana Parlimen. Setahu saya
bahawa bajet itu ada dia punya *discrepancy* sehingga dituduh yang membentangkan bajet
adalah mengelirukan Dewan. Jadi bagi saya masa."
RANG UNDANG-UNDANG,"RANG UNDANG-UNDANG PERBEKALAN 2017
Bacaan Kali Yang Kedua
DAN
USUL
ANGGARAN PEMBANGUNAN 2016",,1200,Tuan Sim Chee Keong [Bukit Mertajam],"Terima kasih Tuan Yang di-Pertua.
Saya juga ada menyertakan beberapa *evidence* ataupun buktinya. Jadi saya serahkan
kepada kebijaksanaan dan keadilan Tuan Yang di-Pertua dalam hal ini."
RANG UNDANG-UNDANG,"RANG UNDANG-UNDANG PERBEKALAN 2017
Bacaan Kali Yang Kedua
DAN
USUL
ANGGARAN PEMBANGUNAN 2016",,1200,Tuan Yang di-Pertua,Terima kasih. Sila Yang Berhormat Jerantut.
RANG UNDANG-UNDANG,"RANG UNDANG-UNDANG PERBEKALAN 2017
Bacaan Kali Yang Kedua
DAN
USUL
ANGGARAN PEMBANGUNAN 2016",,1208,Tuan Haji Ahmad Nazlan bin Idris [Jerantut],"*Assalamualaikum warahmatullahi
taala wabarakatuh*. Salam sejahtera, salam sehati sejiwa. *Bismillahir Rahmanir Rahim...*"
RANG UNDANG-UNDANG,"RANG UNDANG-UNDANG PERBEKALAN 2017
Bacaan Kali Yang Kedua
DAN
USUL
ANGGARAN PEMBANGUNAN 2016",,1208,ANNOTATION,[Membaca selawat]
RANG UNDANG-UNDANG,"RANG UNDANG-UNDANG PERBEKALAN 2017
Bacaan Kali Yang Kedua
DAN
USUL
ANGGARAN PEMBANGUNAN 2016",,1208,Tuan Haji Ahmad Nazlan bin Idris [Jerantut],"Tuan Yang di-Pertua, terima kasih kerana memberikan ruang kepada
saya untuk turut bersama dalam membahaskan Bajet 2017 yang lalu. Izinkan saya untuk
menghadiahkan sebuah pantun kepada Tuan Yang di-Pertua,
*Nasi lemak anak dara dijual hari-hari,
Untuk dibeli buat sarapan,
Tuan Yang di-Pertua pintar lagi bestari,
Terima kasih mengizinkan saya memberikan ucapan.*
Saya mengambil kesempatan ini untuk merakamkan setinggi-tinggi penghargaan
dan tahniah kepada kerajaan Barisan Nasional yang tidak pernah gagal membentangkan
bajet untuk kesejahteraan rakyat dari dulu, kini dan *insya-Allah* berterusan. Khususnya
kepada Yang Amat Berhormat Perdana Menteri yang juga merupakan Menteri Kewangan.
Walaupun dalam keadaan ekonomi dunia yang bergerak perlahan tetapi kita mampu
merangka sebuah bajet yang membawa kesejahteraan kepada rakyat.
Juga terima kasih kepada rakan-rakan di Kementerian Kewangan yang turut
menyediakan bajet ini sejak dulu sehingga sekarang walaupun pada tahun ini kalau kita
dengar pelbagai ucapan dalam Dewan yang mulia ini, meremehkan bajet yang telah
disediakan oleh kumpulan yang sama sejak sebelum ini. Tahniah, mudah-mudahan usaha
tuan-tuan yang menyediakan bajet ini mendapat keredaan Allah SWT juga."
RANG UNDANG-UNDANG,"RANG UNDANG-UNDANG PERBEKALAN 2017
Bacaan Kali Yang Kedua
DAN
USUL
ANGGARAN PEMBANGUNAN 2016",,1210,Tuan Haji Ahmad Nazlan bin Idris [Jerantut],"Tuan Yang di-Pertua, di kesempatan ini saya ingin membetulkan terlebih dahulu
pemesongan fakta yang dibawa oleh rakan saya daripada Raub pada hari semalam iaitu
dia menyatakan dalam ucapan Yang Amat Berhormat Pekan menyatakan kos membina
616 kilometer jalan kampung. Bagi saya, saya hendak betulkan persepsi ini, kerana
persepsi akan membawa pelbagai natijah yang lain. Sedangkan fakta sebenar yang
diucapkan oleh Yang Amat Berhormat Pekan ialah- ini fakta ya- membina dan menaik taraf
616 kilometer, ia tidak berhenti di situ, ia sambung lagi- 616 kilometer jalan kampung dan
jambatan bagi meningkatkan jaringan perhubungan kampung, pekan dan bandar dengan
peruntukan sebanyak RM1.2 bilion. Ini fakta.
Sebabnya, Tuan Yang di-Pertua, saya juga hendak bagi pantun kepada rakan
saya di Raub ini,
*Berburu ke padang datar,
Dapat rusa berbelang kaki,
Berguru kepalang ajar,
Menyebabkan rakyat dengki-mendengki.*
Oleh sebab fakta yang salah, kerana persepsi yang kita pertambahkan
menyebabkan maklumat yang sebenar tidak dapat disampaikan kepada rakyat. Apabila ini
berlaku, maka pelbagai tanggapan yang ada pada masyarakat yang memungkinkan
natijahnya nanti ialah rakyat sesama sendiri akan mengalami perbalahan ekoran daripada
fakta yang telah kita selewengkan itu.
Tuan Yang di-Pertua, saya ingin sekadar berkongsi maklumat yang saya dapat
mengenai dengan kedudukan harga minyak yang terkini, antara sumber pendapatan utama
tahun-tahun sebelum ini daripada Petronas. Saya mendapat maklumat- kerana apa? Saya
hendak kongsi di Dewan ini kerana ada tohmahan mengatakan Petronas sebuah syarikat
yang zalim, tidak berhati perut, membuang pekerja sesuka hati. Sedangkan, keadaan yang
sebenarnya yang sepatutnya kita kongsi dengan orang ramai kita berikan fakta supaya
masyarakat boleh menganalisis fakta itu dan membuat keputusan.
Tuan Yang di-Pertua, kalau kita membuat perbandingan antara Petronas dengan
sebuah syarikat minyak di Abu Dhabi, hasil minyak yang dikeluarkan oleh negara kita
sekitar 500,000 tong sehari. Di Abu Dhabi, 3.5 juta tong sehari- beza. Kos pengeluaran di
Malaysia ini dalam lingkungan USD4.2 satu tong. Sedangkan di Arab Saudi, kalau di
daratan, kos pengeluarannya cuma USD2 setong, dan kalau di lautan, ia dalam lingkungan
USD12 setong.
Isunya ialah, dalam hal ini, Petronas mempunyai lebih kurang 51,000 orang
kakitangan dengan pengeluaran 500,000 tong sehari, berbanding dengan syarikat
Petroleum Abu Dhabi yang hanya mempunyai 25,000 orang kakitangan sahaja. Hampir
separuh lebihnya yang ada di Petronas sedangkan pengeluaran kita sedikit sahaja. Yang
dibuang oleh Petronas setakat ini baru 1,000 orang daripada 51,000 orang. Berbanding
dengan syarikat minyak yang lebih besar, lebih gagah daripada Petronas, telah pun
membuang kakitangannya seramai 3,000 daripada 25,000 orang. Jadi, ini fakta. Janganlah
kita meletakkan Petronas begitu teruk sedangkan Petronas lah memberikan tanggungjawab
sosial bagi membantu kerajaan membangunkan negara kita.
Tuan Yang di-Pertua, saya juga ingin merujuk ucapan Yang Amat Berhormat
Perdana Menteri dalam pembentangan bajet yang lalu. Kegusaran, kerisauan Yang Amat
Berhormat Perdana Menteri terhadap keadaan alam sekitar di negara kita. Saya hendak
baca semula, Tuan Yang di-Pertua..."
RANG UNDANG-UNDANG,"RANG UNDANG-UNDANG PERBEKALAN 2017
Bacaan Kali Yang Kedua
DAN
USUL
ANGGARAN PEMBANGUNAN 2016",,1210,ANNOTATION,[Membaca petikan]
RANG UNDANG-UNDANG,"RANG UNDANG-UNDANG PERBEKALAN 2017
Bacaan Kali Yang Kedua
DAN
USUL
ANGGARAN PEMBANGUNAN 2016",,1210,Tuan Haji Ahmad Nazlan bin Idris [Jerantut],"*“Sehubungan dengan hal alam
sekitar, kita perlu terus memelihara alam semula jadi terutamanya kawasan tadahan air dan
memastikan bahawa kawasan-kawasan yang telah diisytiharkan sebagai hutan simpanan
dan taman-taman nasional dijaga serta sentiasa dipertahankan agar tidak dicerobohi. Ini
hanya akan menjadi kenyataan seandainya semua kerajaan negeri, tidak kira diperintah
oleh Barisan Nasional ataupun pembangkang, memberikan kerjasama yang sepenuhnya
dengan gandingan sektor swasta dan rakyat jelata”.*
Tuan Yang di-Pertua, masalahnya, apabila alam sekitar kita dinoda dan diperkosa
tanpa ada rasa tanggungjawab yang penuh, maka malapetaka akan melanda rakyat dan
negara.
Kita sering mendengar dan malam semalam pun Yang Berhormat rakan kita di
sebelah sana diberi berpeluang mengatakan salah satu empangan di Johor ini mengalami
kekeringan- kerana apa? Ia kerana di puncaknya di hulu empangan ini sudah tidak ada
hutan, yang ada hanya ladang kelapa sawit. Jadi bagaimana empangan ini boleh
memberikan air yang mencukupi?
Kita sering membaca atau kita sering mendapat maklumat di media bagaimana
krisis bekalan air tidak mengira negeri mana, yang paling hebat di Lembah Klang, di
Selangor, dan tidak terkecuali juga di negeri saya di Pahang.
Selain daripada krisis bekalan air ini juga, pengolahan alam sekitar terutamanya
kawasan-kawasan hutan yang tidak terkawal dengan rapi boleh menjadi antara punca
kepada berlakunya banjir di seluruh negara seperti pengalaman yang telah kita lalui pada
tahun 2014 yang lalu.
Tuan Yang di-Pertua, apabila keadaan alam semula jadi khususnya hutan ini
diteroka tanpa ada halangan seperti mana saya katakan tadi, bukan sahaja membawa
kepada masalah kekurangan bekalan air, bukan sahaja membawa masalah kepada
ancaman banjir tetapi yang turut parahnya ialah berlakunya konflik antara haiwan atau
binatang-binatang yang berada dalam hutan-hutan kita dengan manusia. Kita sering
mendengar bagaimana tanaman-tanaman penduduk, tanaman-tanaman masyarakat yang
berhampiran dengan kawasan hutan telah dirosakkan, telah diserang oleh binatang-
binatang liar khususnya gajah. Tidak kurang juga peristiwa..."
RANG UNDANG-UNDANG,"RANG UNDANG-UNDANG PERBEKALAN 2017
Bacaan Kali Yang Kedua
DAN
USUL
ANGGARAN PEMBANGUNAN 2016",,1210,Datuk Shabudin bin Yahaya [Tasek Gelugor],Yang Berhormat Jerantut.
RANG UNDANG-UNDANG,"RANG UNDANG-UNDANG PERBEKALAN 2017
Bacaan Kali Yang Kedua
DAN
USUL
ANGGARAN PEMBANGUNAN 2016",,1210,Tuan Haji Ahmad Nazlan bin Idris [Jerantut],"Ya, sila. Jangan lama sangat."
RANG UNDANG-UNDANG,"RANG UNDANG-UNDANG PERBEKALAN 2017
Bacaan Kali Yang Kedua
DAN
USUL
ANGGARAN PEMBANGUNAN 2016",,1210,Datuk Shabudin bin Yahaya [Tasek Gelugor],"Ya. Tuan Yang di-Pertua, saya
hendak pendapat sikit, adakah Yang Berhormat Jerantut bersetuju dengan saya bahawa
dalam mengawal alam sekitar di negara kita ini, perlu ada kajian dan semakan semula
peruntukan undang-undang yang diselaraskan di antara kerajaan negeri dengan Kerajaan
Persekutuan? Ini kerana sekarang ini kita tengok banyak yang menjadi masalah kita ialah
apabila Kerajaan Persekutuan hendak membuat sesuatu tindakan, semua tertakluk kepada
undang-undang yang dipakai oleh kerajaan negeri dan ia lebih berkuasa. Jadi, halangan
undang-undang ini menjadi salah satu sebab kenapa pemeliharaan alam sekitar di Malaysia
termasuklah kawasan tadahan air dan sebagainya menjadi satu masalah. Setujukah Yang
Berhormat Jerantut? Terima kasih."
RANG UNDANG-UNDANG,"RANG UNDANG-UNDANG PERBEKALAN 2017
Bacaan Kali Yang Kedua
DAN
USUL
ANGGARAN PEMBANGUNAN 2016",,1210,Tuan Haji Ahmad Nazlan bin Idris [Jerantut],"Terima kasih sahabat saya Yang
Berhormat Tasek Gelugor. Memang itu fakta dan, *insya-Allah,* saya akan sampai kepada
tajuk seperti mana yang diutarakan oleh sahabat saya.
Tuan Yang di-Pertua, kemusnahan hutan tanpa kawalan berlaku di banyak tempat.
Tidak terkecuali di kawasan saya, di Parlimen Jerantut, kawasan Parlimen sahabat saya
Yang Berhormat Lipis yang mana kita bersempadanan dengan Taman Negara. Kawasan
rayau binatang yang sepatutnya membekalkan sumber makanan telah menjadi semakin
berkurangan. Habitat mereka telah terancam menyebabkan mereka menghampiri kawasan-
kawasan penempatan penduduk."
RANG UNDANG-UNDANG,"RANG UNDANG-UNDANG PERBEKALAN 2017
Bacaan Kali Yang Kedua
DAN
USUL
ANGGARAN PEMBANGUNAN 2016",,1220,Tuan Haji Ahmad Nazlan bin Idris [Jerantut],"Tuan Yang di-Pertua dan rakan-rakan sekalian, mengapakah keadaan ini terjadi?
Apakah undang-undang yang sedia ada tidak cukup kuat atau sikap rakus pengusaha-
pengusaha atau salah urus pentadbiran kita? Mengimbau isu kemusnahan hutan ini seperti
mana yang berlaku pada awal tahun ini, kita lihat di dada-dada akhbar bagaimana Sungai
Pahang, antara sungai yang terbesar di Semenanjung ini mengalami kekeringan, hampir
kering, hampir tidak mengalir air sungainya.
Apabila ini berlaku, ancaman, bukan sahaja kemusnahan hutan itu tadi, gangguan
bintang liar, bukan sahaja bekalan air kita terancam, ia menambah seksa kepada
penduduk-penduduk atau pun rakyat yang menjadikan sungai sebagai sumber pendapatan
mereka. Berapa ramai rakan penternak ikan kita rugi jutaan ringgit yang mana mereka
mengusahakan ternakan ini di sepanjang Sungai Pahang?
Terima kasih saya hendak rakamkan kepada beberapa NGO yang turut membantu
mengawal agar kemusnahan hutan ini dapat kita kawal demi kesejahteraan rakyat dan demi
kita hadiahkan kepada generasi yang akan datang, seperti Persatuan Perlindungan Alam
Sekitar, seperti Persatuan Perlindungan Khazanah Alam yang begitu aktif. Sebenarnya
mereka ini merupakan rakan kepada kerajaan, bukan musuh kepada kerajaan kerana
mereka ini hanya mengharapkannya agar kita mampu menguruskan alam ini dengan
sebaiknya, agar alam ini tidak mengajar kita bagaimana menguruskannya."
RANG UNDANG-UNDANG,"RANG UNDANG-UNDANG PERBEKALAN 2017
Bacaan Kali Yang Kedua
DAN
USUL
ANGGARAN PEMBANGUNAN 2016",,1220,Dato’ Hasbullah bin Osman [Gerik],"Yang Berhormat Jerantut, boleh?"
RANG UNDANG-UNDANG,"RANG UNDANG-UNDANG PERBEKALAN 2017
Bacaan Kali Yang Kedua
DAN
USUL
ANGGARAN PEMBANGUNAN 2016",,1220,Tuan Haji Ahmad Nazlan bin Idris [Jerantut],"Sedikit sahaja Yang Berhormat,
saya ada tinggal 15 minit sahaja. Sedikit. Sila."
RANG UNDANG-UNDANG,"RANG UNDANG-UNDANG PERBEKALAN 2017
Bacaan Kali Yang Kedua
DAN
USUL
ANGGARAN PEMBANGUNAN 2016",,1220,Dato’ Hasbullah bin Osman [Gerik],"Terima kasih Tuan Yang di-Pertua. Yang
Berhormat Jerantut, berkaitan dengan proses pemberian balak yang menyebabkan
pencemaran air dan air tersebut jadi tidak ada. Bagaimana pandangan Yang Berhormat
Jerantut, kawasan-kawasan tadahan air ini diberi juga pengeluaran balak oleh pihak jabatan
hutan. Sejauh mana jabatan hutan menyedari perkara tersebut walaupun diperkatakan
beberapa kali tetapi perkara tersebut terus berjalan? Minta pandangan Yang Berhormat
Jerantut."
RANG UNDANG-UNDANG,"RANG UNDANG-UNDANG PERBEKALAN 2017
Bacaan Kali Yang Kedua
DAN
USUL
ANGGARAN PEMBANGUNAN 2016",,1220,Tuan Haji Ahmad Nazlan bin Idris [Jerantut],"Terima kasih sahabat saya dari
Gerik. Itu merupakan satu fakta dan *insya-Allah,* saya akan sampai, jika ada masa, kepada
tajuk Yang Berhormat bangkitkan tadi. Keadaan ini membuktikan apa yang saya katakan
tadi, kemusnahan hutan itu kerana mungkin Tuan Yang di-Pertua, salah urus hutan.
Menebang hutan tanpa mematuhi syarat-syarat yang telah ditetapkan oleh kerajaan, tanpa
mengambil kira peraturan-peraturan yang sedia ada. Mungkin juga wujud pembalakan
haram di celah-celah kawasan pembalakan yang dihalalkan.
Jadi, di sini letaknya peranan penguatkuasaan. Ada desas-desus Tuan Yang di-
Pertua, yang lebih membimbangkan saya sebagai Ahli Parlimen kawasan Jerantut yang
mana kawasan tadahannya, tadahan utama Sungai Pahang ini ialah di Ulu Tembeling. Ada
ura-ura, desas-desus menyatakan kerajaan akan mengecilkan saiz Taman Negara ini yang
berkeluasan 4,343 kilometer persegi ini. Jika ini benar, hendak dikecilkan kepada saiz
taman negeri, ini merupakan satu malapetaka kepada Sungai Pahang sendiri.
Tuan Yang di-Pertua, pada hemat saya, kerajaan perlu lebih komited dalam
menjalankan pemuliharaan dan penjagaan alam sekitar, terutamanya dalam memastikan
kawasan tadahan air negara kita selamat dan mampu membekalkan bekalan air bersih
kepada negara. Oleh itu pada saya, kerajaan perlu mengetatkan undang-undang yang
sedia ada. Kalau Akta Perhutanan Negara 1984 itu tidak mencukupi, maka kita yang ada
dalam Dewan ini, bukan sahaja barisan kerajaan dan juga pembangkang, perlu bersatu
untuk kita sama-sama memastikan agar hutan negara kita ini diurus dengan lebih baik, agar
undang-undang baru yang lebih mencengkam pengusaha-pengusaha ini dapat kita kawal.
Di samping itu, mungkin tambahan kempen-kempen kesedaran perlu diperluaskan
secara agresif, terutama di kawasan-kawasan pedalaman yang berhampiran kawasan
hutan ini supaya kesedaran masyarakat dapat kita pertingkatkan. Selain itu, kaedah-kaedah
penyelidikan seperti yang telah dilancarkan oleh Yang Amat Berhormat Pekan dengan
penubuhan Pusat Penyelidikan Tasik Chini yang mengurus, meneliti keadaan kandungan
air. Suhu air tasik itu boleh dijadikan model contoh untuk memulih semula kawasan-
kawasan yang telah diterokai ini bagi pemuliharaan sungai dan juga alam sekitar.
Penggunaan konsep *public trust* mungkin perlu diperluaskan ke seluruh negara agar
tanggungjawab penjagaan alam sekitar bukan hanya tertakluk kepada kerajaan semata-
mata tetapi rakyat juga ada rasa kepunyaan menjaga alam sekitar kita. Mungkin kita boleh
contoh bagaimana..."
RANG UNDANG-UNDANG,"RANG UNDANG-UNDANG PERBEKALAN 2017
Bacaan Kali Yang Kedua
DAN
USUL
ANGGARAN PEMBANGUNAN 2016",,1220,Dr. Che Rosli bin Che Mat [Hulu Langat],Boleh mencelah sedikit?
