level_1,level_2,level_3,timestamp,author,speech
RANG UNDANG-UNDANG,"RANG UNDANG-UNDANG PERBEKALAN TAMBAHAN (2011) 2011
Jawatankuasa",Maksud B. 13 [Jadual] -,1910,Tuan M. Manogaran [Telok Intan],Penjelasan.
RANG UNDANG-UNDANG,"RANG UNDANG-UNDANG PERBEKALAN TAMBAHAN (2011) 2011
Jawatankuasa",Maksud B. 13 [Jadual] -,1910,Dato' Zulkifli bin Noordin [Kulim Bandar Baharu],"Boleh, boleh, no problem."
RANG UNDANG-UNDANG,"RANG UNDANG-UNDANG PERBEKALAN TAMBAHAN (2011) 2011
Jawatankuasa",Maksud B. 13 [Jadual] -,1910,Tuan M. Manogaran [Telok Intan],"Tuan Pengerusi, sini kita kena bezakan isu.
Yang Berhormat Kulim Bandar Baharu ini dia menjerit-jerit mengenai seorang individu di
sini. I know you are referring openly to the Opposition Leader. Dulu semasa tahun 1998
hingga sekarang, syok sangat dengan dia. Akan tetapi beliau tidak dapat apa yang beliau
perlu, sekarang sudah jadi musuh. Jadi, dia bawa itu masuk ke dalam sini. Sekarang kita
bincang tentang luar negeri punya hal."
RANG UNDANG-UNDANG,"RANG UNDANG-UNDANG PERBEKALAN TAMBAHAN (2011) 2011
Jawatankuasa",Maksud B. 13 [Jadual] -,1910,Dato' Zulkifli bin Noordin [Kulim Bandar Baharu],Kita baru sedar.
RANG UNDANG-UNDANG,"RANG UNDANG-UNDANG PERBEKALAN TAMBAHAN (2011) 2011
Jawatankuasa",Maksud B. 13 [Jadual] -,1910,Tuan M. Manogaran [Telok Intan],"Memang kita tahu, innocent until proven
guilty. Memang kita tahu."
RANG UNDANG-UNDANG,"RANG UNDANG-UNDANG PERBEKALAN TAMBAHAN (2011) 2011
Jawatankuasa",Maksud B. 13 [Jadual] -,1910,Dato' Zulkifli bin Noordin [Kulim Bandar Baharu],"Kita, kita, okey kita..."
RANG UNDANG-UNDANG,"RANG UNDANG-UNDANG PERBEKALAN TAMBAHAN (2011) 2011
Jawatankuasa",Maksud B. 13 [Jadual] -,1910,Tuan M. Manogaran [Telok Intan],"But, you look at yourselflah."
RANG UNDANG-UNDANG,"RANG UNDANG-UNDANG PERBEKALAN TAMBAHAN (2011) 2011
Jawatankuasa",Maksud B. 13 [Jadual] -,1910,Dato' Zulkifli bin Noordin [Kulim Bandar Baharu],Kita sudah tahu...
RANG UNDANG-UNDANG,"RANG UNDANG-UNDANG PERBEKALAN TAMBAHAN (2011) 2011
Jawatankuasa",Maksud B. 13 [Jadual] -,1910,Tuan M. Manogaran [Telok Intan],"Since 1998 you have been ‘syok-syok’ with
him."
RANG UNDANG-UNDANG,"RANG UNDANG-UNDANG PERBEKALAN TAMBAHAN (2011) 2011
Jawatankuasa",Maksud B. 13 [Jadual] -,1910,Dato' Zulkifli bin Noordin [Kulim Bandar Baharu],"Because I know him too
well..."
RANG UNDANG-UNDANG,"RANG UNDANG-UNDANG PERBEKALAN TAMBAHAN (2011) 2011
Jawatankuasa",Maksud B. 13 [Jadual] -,1910,Tuan M. Manogaran [Telok Intan],"But, you didn’t get you want, today he is your
enemy."
RANG UNDANG-UNDANG,"RANG UNDANG-UNDANG PERBEKALAN TAMBAHAN (2011) 2011
Jawatankuasa",Maksud B. 13 [Jadual] -,1910,Tuan Pengerusi [Datuk Ronald Kiandee],Yang Berhormat...
RANG UNDANG-UNDANG,"RANG UNDANG-UNDANG PERBEKALAN TAMBAHAN (2011) 2011
Jawatankuasa",Maksud B. 13 [Jadual] -,1910,Dato' Zulkifli bin Noordin [Kulim Bandar Baharu],Kita..
RANG UNDANG-UNDANG,"RANG UNDANG-UNDANG PERBEKALAN TAMBAHAN (2011) 2011
Jawatankuasa",Maksud B. 13 [Jadual] -,1910,Tuan M. Manogaran [Telok Intan],That’s what it is.
RANG UNDANG-UNDANG,"RANG UNDANG-UNDANG PERBEKALAN TAMBAHAN (2011) 2011
Jawatankuasa",Maksud B. 13 [Jadual] -,1910,Dato' Zulkifli bin Noordin [Kulim Bandar Baharu],Saya kenal dia 12 tahun.
RANG UNDANG-UNDANG,"RANG UNDANG-UNDANG PERBEKALAN TAMBAHAN (2011) 2011
Jawatankuasa",Maksud B. 13 [Jadual] -,1910,Tuan M. Manogaran [Telok Intan],The whole country knows.
RANG UNDANG-UNDANG,"RANG UNDANG-UNDANG PERBEKALAN TAMBAHAN (2011) 2011
Jawatankuasa",Maksud B. 13 [Jadual] -,1910,Dato' Zulkifli bin Noordin [Kulim Bandar Baharu],Saya kenal dia 12 tahun.
RANG UNDANG-UNDANG,"RANG UNDANG-UNDANG PERBEKALAN TAMBAHAN (2011) 2011
Jawatankuasa",Maksud B. 13 [Jadual] -,1910,Tuan M.Manogaran [Telok Intan],You don’t mix up the issues.
RANG UNDANG-UNDANG,"RANG UNDANG-UNDANG PERBEKALAN TAMBAHAN (2011) 2011
Jawatankuasa",Maksud B. 13 [Jadual] -,1910,Dato' Zulkifli bin Noordin [Kulim Bandar Baharu],"Sekarang saya tahu.
Sekarang saya sudah kenal dia. Kita sudah kena bohong. Kita sudah kena tipu."
RANG UNDANG-UNDANG,"RANG UNDANG-UNDANG PERBEKALAN TAMBAHAN (2011) 2011
Jawatankuasa",Maksud B. 13 [Jadual] -,1910,Tuan M. Manogaran [Telok Intan],"You didn’t get what you want, you are talking
like this lah. You and your friends."
RANG UNDANG-UNDANG,"RANG UNDANG-UNDANG PERBEKALAN TAMBAHAN (2011) 2011
Jawatankuasa",Maksud B. 13 [Jadual] -,1910,Dato' Zulkifli bin Noordin [Kulim Bandar Baharu],"Apa yang saya hendak?
Saya hendak kan keadilan... [Dewan riuh] Saya hendak kebenaran... [Dewan riuh] [Tepuk]"
RANG UNDANG-UNDANG,"RANG UNDANG-UNDANG PERBEKALAN TAMBAHAN (2011) 2011
Jawatankuasa",Maksud B. 13 [Jadual] -,1910,Tuan M. Manogaran [Telok Intan],Hipokritlah. You are the biggest hypocrite.
RANG UNDANG-UNDANG,"RANG UNDANG-UNDANG PERBEKALAN TAMBAHAN (2011) 2011
Jawatankuasa",Maksud B. 13 [Jadual] -,1910,Dato' Zulkifli bin Noordin [Kulim Bandar Baharu],"Saya hendakkan supaya
rakyat negara ini hidup dalam keadaan aman."
RANG UNDANG-UNDANG,"RANG UNDANG-UNDANG PERBEKALAN TAMBAHAN (2011) 2011
Jawatankuasa",Maksud B. 13 [Jadual] -,1910,Seorang Ahli,Yes... [Disampuk]
RANG UNDANG-UNDANG,"RANG UNDANG-UNDANG PERBEKALAN TAMBAHAN (2011) 2011
Jawatankuasa",Maksud B. 13 [Jadual] -,1910,Dato' Zulkifli bin Noordin [Kulim Bandar Baharu],"Bukan dipimpin oleh orang
yang ada masalah moral. Orang yang boleh berkonda-kondi sana sini."
RANG UNDANG-UNDANG,"RANG UNDANG-UNDANG PERBEKALAN TAMBAHAN (2011) 2011
Jawatankuasa",Maksud B. 13 [Jadual] -,1910,Seorang Ahli,Ya.
RANG UNDANG-UNDANG,"RANG UNDANG-UNDANG PERBEKALAN TAMBAHAN (2011) 2011
Jawatankuasa",Maksud B. 13 [Jadual] -,1910,Dato' Zulkifli bin Noordin [Kulim Bandar Baharu],"Playing holier-than-thou
punya lakonan."
RANG UNDANG-UNDANG,"RANG UNDANG-UNDANG PERBEKALAN TAMBAHAN (2011) 2011
Jawatankuasa",Maksud B. 13 [Jadual] -,1910,Seorang Ahli,Ya.
RANG UNDANG-UNDANG,"RANG UNDANG-UNDANG PERBEKALAN TAMBAHAN (2011) 2011
Jawatankuasa",Maksud B. 13 [Jadual] -,1910,Dato' Zulkifli bin Noordin [Kulim Bandar Baharu],"Saya tahu Yang Berhormat
Telok Intan, dia tidak boleh hendak jawab. Because dia dalam Dewan ini yang menjerit
every person is presume innocent until proven guilty."
RANG UNDANG-UNDANG,"RANG UNDANG-UNDANG PERBEKALAN TAMBAHAN (2011) 2011
Jawatankuasa",Maksud B. 13 [Jadual] -,1910,Seorang Ahli,Ya.
RANG UNDANG-UNDANG,"RANG UNDANG-UNDANG PERBEKALAN TAMBAHAN (2011) 2011
Jawatankuasa",Maksud B. 13 [Jadual] -,1910,Dato' Zulkifli bin Noordin [Kulim Bandar Baharu],"Kawan itu baru kena
charged. Presiden Bashir baru kena charged, baru kena tuduh. Dia masih innocent Tuan
Pengerusi. Presiden Bashir masih lagi tidak bersalah selagi tidak dijatuhkan, disabitkan oleh
mana-mana mahkamah. Itu prinsip kita. Jadi, kita mesti pegang pada prinsip itu.
Sekarang seolah-olah dilihat kita tunduk kepada tuntutan nyamuk dua tiga ekor ini.
Jadi, saya minta supaya kerajaan bagi mesej yang jelas. Kenapa kita perlu tunduk kepada
tuntutan Barat sehingga kita menafikan rakan sekutu yang telah banyak berjasa dan banyak
membantu kita, dalam masa kita susah dan masa kita senang. Terima kasih Tuan
Pengerusi."
RANG UNDANG-UNDANG,"RANG UNDANG-UNDANG PERBEKALAN TAMBAHAN (2011) 2011
Jawatankuasa",Maksud B. 13 [Jadual] -,1910,Tuan Pengerusi [Datuk Ronald Kiandee],Yang Berhormat Kota Belud.
RANG UNDANG-UNDANG,"RANG UNDANG-UNDANG PERBEKALAN TAMBAHAN (2011) 2011
Jawatankuasa",Maksud B. 13 [Jadual] -,1913,Dato' Abd. Rahman Dahlan [Kota Belud],Terima kasih Tuan Pengerusi.
RANG UNDANG-UNDANG,"RANG UNDANG-UNDANG PERBEKALAN TAMBAHAN (2011) 2011
Jawatankuasa",Maksud B. 13 [Jadual] -,1913,Tuan Chua Tian Chang @ Tian Chua [Batu],Bila pula sini... [Ketawa]
RANG UNDANG-UNDANG,"RANG UNDANG-UNDANG PERBEKALAN TAMBAHAN (2011) 2011
Jawatankuasa",Maksud B. 13 [Jadual] -,1913,Dato' Abd. Rahman Dahlan [Kota Belud],Pusing sini la.
RANG UNDANG-UNDANG,"RANG UNDANG-UNDANG PERBEKALAN TAMBAHAN (2011) 2011
Jawatankuasa",Maksud B. 13 [Jadual] -,1913,Tuan Chua Tian Chang @ Tian Chua [Batu],Dia bukan sebahagian...
RANG UNDANG-UNDANG,"RANG UNDANG-UNDANG PERBEKALAN TAMBAHAN (2011) 2011
Jawatankuasa",Maksud B. 13 [Jadual] -,1913,Dato' Abd. Rahman Dahlan [Kota Belud],"Oh! Dia boleh mencelah. Tuan
Pengerusi, saya amat bersetuju dengan apa yang dikatakan oleh Yang Berhormat Kulim
Bandar Baharu. Bukan soal tentang itu, tidak apa. Saya mahu soal tentang penganjuran ini,
Bekalan..., sorry sejumlah wang RM19.98 juta untuk Dialog Antarabangsa Langkawi.
Sebabnya Tuan Pengerusi ialah, kita jangan lupa kadang-kadang dalam diplomasi
antarabangsa ini dia bukan terlalu senang untuk diurus. Kita melihat bagaimana negara-
negara di dunia ini terpaksa mengambil kedudukan accommodating dalam masa-masa
yang tertentu untuk mencapai satu tujuan yang lebih besar.
Contohnya, kalaulah saya mengingatkan diri saya sendiri bahawa Dialog
Antarabangsa Langkawi ini adalah satu dialog yang ada hubung kait dengan satu lagi
dialog yang diadakan di Afrika, iaitu Southern-Africa International Dialog. Di mana di dalam
SAID ini, saya pernah menghadirinya Tuan Pengerusi, di Zambia. Satu-satunya negara luar
yang dijemput oleh penganjur dari negara-negara Afrika Selatan ialah Malaysia. Satu-
satunya. Negara yang lain semua warna sama. Waktu itu Timbalan Perdana Menteri ialah
Dato’ Seri Yang Amat Berhormat Pekan. Beliau seorang sahaja Tuan Pengerusi. Oleh
sebab itu, pada waktu itu kita amat berbangga sebab Malaysia dipilih dan menjadi satu-
satunya negara luar ya, bukan sahaja daripada negara-negara Eropah ini, satu sahaja
negara luar. Jadi, sebab itu timbal balasnya ialah Dialog Antarabangsa Langkawi.
Kita tidak mahu isu mengenai jemputan ini merosakkan satu imej ataupun satu
objektif yang lebih besar, iaitu untuk memastikan hubungan antara Malaysia dan negara-
negara di Selatan Afrika itu terganggu. Saya tidak mendengar secara khusus bantahan
daripada negara-negara Afrika terhadap jemputan daripada Omar Bashir ini – kepada Omar
Bashir. Belum, saya belum terdengar lagi.
Kalau kita melihat double standard ini memang kita dapat lihat Tuan Pengerusi,
kalau dikira Amerika sendiri berhubung, berbincang dan berdialog sebelum ini dengan
Libya, dengan Israel di mana mereka ini kononnya sekarang ini adalah negara-negara yang
kita anggap sebagai negara pengganas. Jadi, dalam konteks diplomasi antarabangsa ini,
saya rasa tidak begitu tertekanlah kita. Kecualilah kalau seperti mana yang Yang Berhormat
Kulim Bandar Baharu kata tadi, ada satu pertuduhan dan hukuman telah dibuat. Itu satu.
Akan tetapi, yang saya ingin sentuh di sini Tuan Pengerusi ialah tentang RM19.98 juta ini.
Saya melihat Tuan Pengerusi, Malaysia adalah satu-satu negara kalau melayan jemputan-
jemputan, tetamu-tetamu daripada luar negara ini, kita cukup berbelanja lebih. Baguslah,
mungkin dari segi pujian, dari segi feedback daripada peserta-peserta daripada luar negara
ini begitu bagus sekali.
Akan tetapi kadang-kadang apabila saya melihat pula layanan mereka kepada kita
sewaktu kita melawat negara mereka, tidak kiralah negara Afrika, negara Barat dan
sebagainya, tidaklah begitu mewah apa yang kita belanjakan di negara kita ini. Saya tidak
tahulah sama ada RM19.98 juta ini adalah satu jumlah yang memadai ataupun melebihi.
Akan tetapi nyata standard Malaysia ini dalam mengurus program-program Dialog
Antarabangsa ini antara yang terbaik di dunia.
Cuma mungkin kalau boleh saya ingin bertanya kepada Yang Berhormat menteri,
apakah kita boleh kurangkan sedikit dalam dialog-dialog antarabangsa di masa akan
datang supaya jangan terlalu grand, dengan izin, jangan terlalu megah sangat. Bukannya
apa, akan tetapi kita memerlukan dalam keadaan sekarang ini satu perbelanjaan yang
berhemah.
Walau bagaimanapun, saya bersetuju mesti ada satu perbelanjaan yang sesuai
dan Dialog Antarabangsa Langkawi ini harus diteruskan kerana ianya adalah timbal balas
kepada Southern Africa International Dialog yang diadakan di Afrika berulang-ulang di
antara Langkawi dan Southern Africa. Jadi, saya ucapkan tahniah kepada Yang Berhormat
Menteri."
RANG UNDANG-UNDANG,"RANG UNDANG-UNDANG PERBEKALAN TAMBAHAN (2011) 2011
Jawatankuasa",Maksud B. 13 [Jadual] -,1913,Beberapa Ahli,[Bangun]
RANG UNDANG-UNDANG,"RANG UNDANG-UNDANG PERBEKALAN TAMBAHAN (2011) 2011
Jawatankuasa",Maksud B. 13 [Jadual] -,1913,Tuan Chua Tian Chang @ Tian Chua [Batu],Boleh Yang Berhormat Batu.
RANG UNDANG-UNDANG,"RANG UNDANG-UNDANG PERBEKALAN TAMBAHAN (2011) 2011
Jawatankuasa",Maksud B. 13 [Jadual] -,1913,Tuan Pengerusi [Datuk Ronald Kiandee],Yang Berhormat Balik Pulau.
RANG UNDANG-UNDANG,"RANG UNDANG-UNDANG PERBEKALAN TAMBAHAN (2011) 2011
Jawatankuasa",Maksud B. 13 [Jadual] -,1928,Tuan Mohd Yusmadi Mohd Yusoff [Balik Pulau],"Terima kasih Tuan Pengerusi,
bagi membenarkan Yang Berhormat Balik Pulau berbahas bagi Maksud B.13 –
Kementerian Luar Negeri. Yang Berhormat Menteri, ya saya boleh terima pandangan Yang
Berhormat kota Belud tadi bahawa Malaysia bagus dari segi sebagai event organizer. Itu
satu aspek daripada– sangat bagus, malah saya rasa bagus dari segi event organizer.
Akan tetapi isunya ialah pengisian. Itu yang perlu saya mohon Menteri jelaskan dari segi
aspek pengisian Dialog Antarabangsa Langkawi ini di mana dari segi kualitatifnya itu
ataupun dari segi signifikannya itu mungkin perlu diperjelaskan. Oleh kerana jumlah yang
diminta adalah RM19 juta.
Kalau dari segi hendak dijustifikasikan dari segi event organizing nya saya rasa
kita not just another event managers. Kita ada tujuan apatah lagi sekiranya dianjurkan oleh
Kementerian Luar Negeri. Mesti ada satu tujuan yang bersifat strategik di situ. Ini kerana
saya yakin Yang Berhormat Menteri pun maklum, kita boleh banding pelbagai lagi program-
program antarabangsa yang kawan-kawan kita pernah hadiri, Menteri sendiri pernah hadiri.
Saya tidak mahu merujuk kepada aspek-aspek fasad kerana itu tidak penting
kepada saya. Apa yang penting adalah isi pengisiannya itu. Yang Berhormat Menteri, saya
terpanggil untuk sedikit memohon penjelasan Yang Berhormat menteri terhadap apa
sebenarnya arah tuju dasar luar negara ketika mana jemputan kepada Presiden Bashir ini
dibuat."
RANG UNDANG-UNDANG,"RANG UNDANG-UNDANG PERBEKALAN TAMBAHAN (2011) 2011
Jawatankuasa",Maksud B. 13 [Jadual] -,1920,Tuan Mohd Yusmadi Mohd Yusoff [Balik Pulau],"Di mana arah tuju kerana di sini Yang Berhormat Menteri saya rasa pegawai boleh
bantu kita di sini. Apa sahaja tindakan, apa sahaja keputusan kita, ia akan mengundang
reaksi di kalangan arena diplomasi kerana ada dipanggil dengan izin, solidarity
antarabangsanya itu yang diterjemahkan dalam bentuk-bentuk perjanjian, perkumpulan dan
saya ingin tegaskan di sini kita boleh andaikan bahawa ini atas desakan Barat, desakan
Amerika dan sebagainya. Yang Berhormat Menteri ICC ini ialah satu badan yang terhasil
daripada Bangsa-Bangsa Bersatu, kalau kita hendak andaikan Bangsa-Bangsa Bersatu
ialah Amerika saya rasa secara ilmiahnya salah.
Akan tetapi kalau kita hendak mengatakan dari segi pola kuasanya, dominasinya
itu satu bidang yang lain tetapi di sini untuk kita mengatakan bahawa ianya agenda
Amerika, agenda barat dan sebagainya saya rasa itu satu perkara yang tidak tepat dari segi
komposisi organisasinya itu adalah bersifat tidak adil. Itu aspek yang pertama yang saya
rasa Menteri perlu jelaskan kerana kita ialah anggota Bangsa-Bangsa Bersatu dan kita
apatah lagi, saya masih ingat di Dewan yang mulia ini juga dan di Dewan di luar sana kita
secara bersesama dengan wakil daripada Kementerian Luar Negeri kita berbincang arah
tuju ke arah dengan izin, international justice system kita berbincang bagaimana kita ke
arah meratifikasikan ICC ini.
Ada wakil daripada Kementerian Luar Negeri, orang yang amat berpengalaman
pulang daripada head sekarang ini menerajui Unit Perundangan dan Diplomasi di situ. Yang
Berhormat Menteri kerana di sini saya mengambil sikap memberikan perhatian kerana
perkataan yang digunakan oleh - saya walaupun tadi Yang Berhormat Kulim Bandar Baharu
tadi mengatakan pandangan itu saya menghormati pandangan beliau tetapi ini pandangan
Menteri Kabinet, Menteri Undang-undang yang mana mengatakan, dengan izin, laporan
daripada The Star di sini: “Sudan President at dialogue embarrassed us”. Ini kata Menteri,
dan kalau saya boleh baca petikannya di sini, “The foreign office has its reason for inviting
him (al-Bashir) for the moment, but I will still bring it up in Cabinet on Friday.” The quotation,
“The government has not withdrawn its invitation”. Dia tidak datang tetapi kita not withdrawn
our invitation. “But this matter needs to be discuss from all aspects, not just legal. The
Cabinet will have the final say.”
Ya, kita ketengahkan isu moral dan sebagainya bagi saya kalau diandaikan
daripada quotation ini Menteri Undang-undang mengandaikan mungkin ada alasan-alasan
lain. Saya melihat yang perlu dijelaskan oleh Kementerian Luar Negeri dari segi kerangka
diplomasinya itu apa navigasi..."
RANG UNDANG-UNDANG,"RANG UNDANG-UNDANG PERBEKALAN TAMBAHAN (2011) 2011
Jawatankuasa",Maksud B. 13 [Jadual] -,1920,Dato’ Abd. Rahman Dahlan [Kota Belud],Boleh mencelah sedikit?
RANG UNDANG-UNDANG,"RANG UNDANG-UNDANG PERBEKALAN TAMBAHAN (2011) 2011
Jawatankuasa",Maksud B. 13 [Jadual] -,1920,Tuan Mohd. Yusmadi Mohd. Yusoff [Balik Pulau],"Boleh, boleh."
RANG UNDANG-UNDANG,"RANG UNDANG-UNDANG PERBEKALAN TAMBAHAN (2011) 2011
Jawatankuasa",Maksud B. 13 [Jadual] -,1920,Dato’ Abd. Rahman Dahlan [Kota Belud],"Terima kasih. Itu soal Menteri
mempunyai pandangan yang berbeza itu Menteri yang mengatakan yang mempunyai
pendirian undang-undang dan Menteri Luar Negeri. Akan tetapi saya ingin bertanya kepada
Yang Berhormat apakah dalam satu-satu dialog antarabangsa ini kita tidak memberikan
peluang kepada mana-mana pemimpin untuk menerangkan pandangan mereka sama ada
pandangan berkenaan ekonomi, dasar mereka di negara mereka ataupun politik. Saya bagi
contoh dahulu semasa Yang Berhormat Permatang Pauh menjadi Timbalan Perdana
Menteri, Menteri Kewangan dia menggunakan formula IMF untuk menangani masalah krisis
ekonomi.
Selepas itu Perdana Menteri menggunakan formula dia sendiri sehingga beliau
dikatakan paria of the world economy. Ramai orang yang tidak mempercayai formula beliau
itu berjaya. Kalau mengikut teorinya mungkin ramai orang tidak mahu menjemput beliau
untuk memberitahu dasar-dasar yang telah - tetapi apabila beliau telah dijemput di IMF dan
sebagainya maka sedikit sebanyak pandangan itu dapat diterima.
Seperti juga dengan Presiden Mugabe walaupun mungkin kita secara keseluruhan
mengatakan his has been disaster to Zimbabwe economy tetapi apakah dia tidak boleh
diberikan peluang untuk memberitahu kepada dunia tentang dasar beliau dan seterusnya
membuat dialog dengan pemimpin-pemimpin, I think we can learnt something. Itu saya rasa
pandangan saya terhadap kehadiran pemimpin-pemimpin."
RANG UNDANG-UNDANG,"RANG UNDANG-UNDANG PERBEKALAN TAMBAHAN (2011) 2011
Jawatankuasa",Maksud B. 13 [Jadual] -,1920,Tuan Mohd. Yusmadi Mohd. Yusoff [Balik Pulau],"Terima kasih Yang
Berhormat Kota Belud. Saya hendak jawab ini nanti, saya bukannya Menteri Luar, belum
lagi. Minta Menteri yang sebenarlah tetapi saya cuba. Yang Berhormat Kota Belud kalau
boleh saya jelaskan di sini di dalam kerangka diplomasi, ada perkara-perkara yang bersifat
sebagai democratic regime ada perkara sebegitu. Di mana perkara sebegitu diangkat di
peringkat multilateral dan pelbagai lagi, dan demokrasi punya hubungan kait langsung
dengan agenda-agenda pembangunan, pertubuhan terus itu ada masalah lain pula itu.
Bagaimana nanti kita melihat indeks-indeks kebebasan, indeks-indeks demokrasi itu ada
impak langsung kepada pertumbuhan sesebuah negara. Inilah sifat globalisasi sifat
diplomasi, ini pada pandangan saya.
Jadi apabila sebuah negara seperti Malaysia yang mahu diletakkan di dalam
kerangka demokrasi ini membuat keputusan menjemput Bashir ini, Mugabe ini, ini akan
mengundang kepada satu indicator atau petunjuk-petunjuk daripada negara-negara yang
mahu berurusan dengan kita secara diplomasi. Saya beri contoh kita ada sebab kenapa kita
memutuskan hubungan diplomasi kita dengan Israel. Israel mana ada kes kena jenayah
belum lagi tetapi kita potong, putuskan ini. Memang mengundang reaksi. Akan tetapi di sini
saya mengatakan bahawa kita punya pilihan sebab itu kita memohon Kementerian Luar
Negeri untuk menjelaskan.
Di sini tadi saya rasa Yang Berhormat Kota Belud perlu lebih tepat dalam hal ini.
Sekarang dasar luar punya kaitan langsung dengan dasar dalam negeri. Apa yang dibuat
keputusan oleh Yang Berhormat Padang Rengas selaku Menteri Undang-undang, apa yang
dibuat oleh Yang Berhormat Sembrong punya akibat langsung dasar imigrasi kita ada dasar
langsung, dasar kebebasan media kita ada dasar langsung. Okey, secara ringkas Tuan
Pengerusi mengandaikan Yang Berhormat Permatang Pauh menggunakan IMF, IMF saya
rasa itu andaian dan saya berbeza pandangan dengan mantan Perdana Menteri dalam
banyak aspek, tetapi saya pun tidak setuju tidak ada mana literature menggunakan
perkataan paria saya tidak setuju. Dia ada kekuatan dia sendiri. Ingin saya katakan di sini
Yang Berhormat Kota Belud, Malaysia punya pilihan, demokrasi sebenarnya telah terbukti
punya peranan dalam membangunkan negara terutama dalam aspek-aspek pembangunan.
Soalan saya apabila kita menjemput Bashir, kita menjemput Mugabe dia
mengundang contohnya di Zimbabwe itu yang dikatakan the transition of regime kepada
democratic of regime MDC. Itu bagaimana ia akan mengundang satu signal yang
inconsistent. Itu bagi saya dan saya rasa persoalan saya ialah saya mahu memudahkan
gerak kerja supaya soalan saya yang pertama tadi apa arah tuju navigasi dasar luar kita.
Okey, kerana pada masa yang sama Yang Berhormat Kota Belud, Amerika punya dasar-
dasar yang saya rasa ya kita boleh tidak bersetuju dalam banyak perkara, double standard
nya bagaimana?
Akan tetapi kita berurusan dengan Amerika dengan ikatan diplomasinya, dengan
terma-terma kita dan pendekatan kita dan bukannya kita mengikut semua. Jadi di sini
soalan saya apakah dasar luar kita apabila kita menjemput Bashir. Saya tidak masuk dalam
kerangka perundangan, jenayah itu peringkat ini Kerana itu mengundang satu diskusi yang
lain. Ada soalan lagikah."
RANG UNDANG-UNDANG,"RANG UNDANG-UNDANG PERBEKALAN TAMBAHAN (2011) 2011
Jawatankuasa",Maksud B. 13 [Jadual] -,1920,Dato’ Abd. Rahman Dahlan [Kota Belud],"Singkat sahaja. Saya cuma hendak
tanya pandangan Yang Berhormat tentang apakah kita akan - katalah dialog itu Tuan
Pengerusi dialog ekonomi yang mungkin tidak menyentuh tentang isu besar politik dunia.
Apakah katalah contohnya kalaulah dialog itu berbentuk ekonomi ataupun dalam berbentuk
strategi mendapatkan undi bila masa nanti ada pengundian-pengundian peringkat
antarabangsa untuk memihak kepada Kerajaan Malaysia. Kalaulah ianya tidak terlalu
memberatkan, apakah Yang Berhormat bersetuju jika kerajaan menjemput negara-negara
ini untuk memberikan pandangan mereka tentang ekonomi mereka walaupun ekonomi
mereka tidak begitu baik tetapi kita mendengar pola-pola hujah mereka.
Itu pandangan saya. Macam juga dengan China, China sekarang ini engaging
Southern African bagai hendak rak. Berbelanja berbilion-bilion ringgit, some of grant, some
of loan, dengan izin. Kerana itu strategi mereka ialah bukan hendak melihat sangat tentang
politik tentang melihat kepentingan mereka di Bangsa-Bangsa Bersatu di dalam badan
dunia yang memerlukan undi pada mereka."
RANG UNDANG-UNDANG,"RANG UNDANG-UNDANG PERBEKALAN TAMBAHAN (2011) 2011
Jawatankuasa",Maksud B. 13 [Jadual] -,1920,Tuan Mohd. Yusmadi Mohd. Yusoff [Balik Pulau],"Terima kasih Yang
Berhormat Kota Belud kerana membuka ruang di situ. Yang Berhormat Kota Belud saya
tidak mahu kerana masa yang singkat ini, kita tahu China navigasinya dalam sikapnya
humanitarian assistance, bantuan pembangunannya, kita lihat dalam isu Myanmar dan
sebagainya itu menggambarkan sama ada dasar kita dengan China sama ataupun tidak."
RANG UNDANG-UNDANG,"RANG UNDANG-UNDANG PERBEKALAN TAMBAHAN (2011) 2011
Jawatankuasa",Maksud B. 13 [Jadual] -,1930,Tuan Mohd. Yusmadi Mohd. Yusoff [Balik Pulau],"Kerana saya bagi contoh Yang Berhormat Kota Belud. Yang Berhormat Kota
Belud pun hari itu di situ tidak sempat, di National Security Council hari itu kita berbincang
sama ada hendak mengangkatkan sanction ekonomi terhadap Cuba, mesti ada sebab.
Akan tetapi katakan tiba-tiba Malaysia mengundang Fidel Castro, Mugabe dan Bashir, tiba-
tiba dia kata Langkawi International Dialogue ini apa, detached clubkah? Ini perkara-
perkara yang bagi saya boleh dijelaskan tetapi kita perlu mengambil pilihan-pilihan macam
itu sehingga membentuk satu gambaran dasar luar kita ini sebegitu rupa, yang bagi saya
lebih baik digunakan untuk kerja-kerja yang lebih membangunkan imej negara yang lebih
baik. Seterusnya, terima kasih Tuan Pengerusi..."
RANG UNDANG-UNDANG,"RANG UNDANG-UNDANG PERBEKALAN TAMBAHAN (2011) 2011
Jawatankuasa",Maksud B. 13 [Jadual] -,1930,Dato’ Zulkifli bin Noordin [Kulim Bandar Baharu],Yang Berhormat Balik Pulau.
RANG UNDANG-UNDANG,"RANG UNDANG-UNDANG PERBEKALAN TAMBAHAN (2011) 2011
Jawatankuasa",Maksud B. 13 [Jadual] -,1930,Tuan Mohd. Yusmadi Mohd. Yusoff [Balik Pulau],Ya?
RANG UNDANG-UNDANG,"RANG UNDANG-UNDANG PERBEKALAN TAMBAHAN (2011) 2011
Jawatankuasa",Maksud B. 13 [Jadual] -,1930,Tuan Pengerusi [Datuk Ronald Kiandee],"Kita sudah habis masa Yang
Berhormat."
RANG UNDANG-UNDANG,"RANG UNDANG-UNDANG PERBEKALAN TAMBAHAN (2011) 2011
Jawatankuasa",Maksud B. 13 [Jadual] -,1930,Tuan Mohd. Yusmadi Mohd. Yusoff [Balik Pulau],"[Bercakap tanpa
menggunakan pembesar suara]"
RANG UNDANG-UNDANG,"RANG UNDANG-UNDANG PERBEKALAN TAMBAHAN (2011) 2011
Jawatankuasa",Maksud B. 13 [Jadual] -,1930,Dato’ Zulkifli bin Noordin [Kulim Bandar Baharu],"Sedikit sahaja, saya hendak
tanya ini..."
RANG UNDANG-UNDANG,"RANG UNDANG-UNDANG PERBEKALAN TAMBAHAN (2011) 2011
Jawatankuasa",Maksud B. 13 [Jadual] -,1930,Tuan Mohd. Yusmadi Mohd. Yusoff [Balik Pulau],Tidak sempat ini...
