level_1,level_2,level_3,raw_timestamp,timestamp,author,speech
,,,2.30 petang,1430,ANNOTATION,"[Timbalan Yang di-Pertua (Datuk Seri Dr. Ronald Kiandee)
mempengerusikan Mesyuarat]"
UCAPAN DI BAWAH USUL BERKENAAN PERKARA TADBIR KERAJAAN (P.M. 17),Isu Kesesakan Lalu Lintas di Jambatan Batu Pahat,,2.34 ptg.,1434,Dato’ Dr. Noraini binti Ahmad [Parit Sulong],"Terima kasih
Tuan Yang di-Pertua. Saya ingin membawa perhatian Dewan kepada
suatu isu yang berlaku di kawasan Parlimen Parit Sulong baru-baru ini di
mana satu kesesakan jalan raya dan lalu lintas yang luar biasa telah
berlaku di Jambatan Batu Pahat tatkala seluruh warga penduduk Parit
Sulong dari seluruh pelosok ingin pulang ke kampung halaman bagi
meraikan perayaan Aidilfitri. Kesesakan lalu lintas dan jalan raya ini saya
kategorikan sebagai luar biasa di Parlimen Parit Sulong berikutan
berlakunya kesesakan sehingga menyebabkan kenderaan dilihat tidak
bergerak sehingga beberapa jam lamanya.
Saya juga melihat perkara ini bukan sesuatu yang baru lagi
malahan sudah beberapa tahun berlarutan dan kesesakan ini acap kali
berlaku setiap kali musim perayaan menjelma. Saya selaku Ahli Parlimen
di kawasan berkenaan mengambil maklum tentang aduan para penduduk
setempat mengenai masalah kesesakan ini dan tindakan sewajarnya
perlu diambil dan diatasi kerana kita pastinya tidak mahu sehingga
berlakunya sesuatu yang tidak diingini, barulah kita hendak mencari
penyelesaian, bak kata pepatah, *“mencegah lebih baik dari merawat”.*
Antara faktor yang digariskan menjadi punca utama berlakunya
kesesakan jalan raya dan lalu lintas ini, di Jambatan Batu Pahat ini ialah
*‘bottleneck factor’* di mana keadaan jalan raya bermula dari empat lorong
menjadi dua lorong dan kemudian kembali menjadi empat lorong.
Kesesakan jalan raya dan lalu lintas yang berlaku ini biasanya mampu
berlarutan sehingga berjam-jam lamanya dan berkilo meter jaraknya,
bahkan sehingga ke kawasan jalan-jalan kampung juga turut mengalami
kesesakan.
Sehubungan dengan itu, saya ingin memohon penjelasan dari
pihak Kementerian Kerja Raya agar melihat dan menghalusi masalah isu
kesesakan jalan raya dan lalu lintas ini semula serta saya ingin bertanya
beberapa perkara seperti:
(i) adakah terdapat cadangan daripada pihak
kementerian sendiri dalam memperbesarkan
Jambatan Batu Pahat berkenaan?;
(ii) sejauh manakah pihak kementerian ada
membuat pemantauan tentang jalan-jalan yang
kerap menjadi punca kepada kesesakan jalan
raya dan lalu lintas setiap kali tiba waktu
kemuncaknya; dan
(iii) adakah terdapat sistem atau kaedah yang lebih
berkesan dalam usaha mengatasi masalah ini.
Sekian, terima kasih."
UCAPAN DI BAWAH USUL BERKENAAN PERKARA TADBIR KERAJAAN (P.M. 17),Isu Kesesakan Lalu Lintas di Jambatan Batu Pahat,,2.38 ptg.,1438,Timbalan Menteri Kerja Raya [Datuk Rosnah binti Haji Abdul Rashid Shirlin],"Terima kasih Tuan Yang di-Pertua dan terima kasih
diucapkan kepada Ahli Parlimen Parit Sulong, Yang Berhormat Dato' Dr.
Noraini Ahmad di atas keprihatinan dalam menyelesaikan masalah
kesesakan lalu lintas ini. Untuk makluman Ahli Yang Berhormat,
kesesakan lalu lintas terutama menjelang musim-musim perayaan,
merupakan fenomena biasa bukan sahaja di Batu Pahat malahan di
lokasi-lokasi lain juga. Antara faktor yang menyumbang kepada
kesesakan ini adalah jumlah kenderaan yang selama ini tertumpu di
bandar-bandar utama mula keluar memenuhi bandar-bandar sekunder
dan pekan-pekan kecil untuk pulang ke kampung halaman masing-
masing.
Untuk makluman Yang Berhormat Dato’, lokasi jambatan yang
dimaksudkan ini merupakan salah satu lokasi di Jalan Persekutuan
(FT005) dan merupakan laluan utama dari Melaka dan Muar untuk ke
Batu Pahat selain menggunakan Lebuh raya Utara Selatan.
Faktor *bottleneck*, dengan izin, yang dibangkitkan oleh Yang
Berhormat Dato’ Dr. merupakan salah satu daripada beberapa faktor lain
yang menyumbang kepada kesesakan ini. Antaranya ialah jarak di antara
jambatan dan lampu isyarat yang terlalu hampir serta sikap pengguna
jalan raya yang memotong barisan dengan menggunakan laluan
motosikal dan kecemasan di Jambatan Batu Pahat menyumbang kepada
kesesakan terutama waktu puncak dan musim-musim perayaan.
Menjawab soalan Yang Berhormat Dato’ Dr. berkenaan
permasalahan yang dibangkitkan:
(i) pihak kementerian telah memperuntukkan lebih
kurang RM8 juta bagi menaik taraf Jambatan Parit
Keliling iaitu jambatan yang berhampiran dengan
Jambatan Utama Batu Pahat ini yang mana baru
sahaja siap pada 16 Jun 2017 lalu;
(ii) untuk makluman, pihak JKR Batu Pahat telah
menjalankan kerjasama dengan Pejabat Daerah,
Majlis Perbandaran dan PDRM dalam memantau
lokasi-lokasi yang sering mengalami kesesakan lalu
lintas. Jawatankuasa Lalu Lintas yang dipengerusikan
oleh Jurutera Daerah dan dianggotai oleh semua
jabatan teknikal di Batu Pahat telah ditubuhkan dalam
mencari penyelesaian jangka masa pendek dan
jangka masa panjang kepada permasalahan ini.
Antara penyelesaian yang telah dijalankan adalah
merancang dan membina jalan-jalan baru sama ada
melalui peruntukan Persekutuan atau negeri yang
akan menyuraikan lalu lintas terutama pada waktu
puncak;
(iii) selain itu, perbincangan berterusan telah diadakan
menyelaraskan semua sistem dan tempoh lampu
isyarat terutama di dalam bandar yang melibatkan
jalan majlis dan penguatkuasaan peraturan serta
undang-undang sedia ada oleh pihak PDRM atau polis
trafik.
Untuk makluman Ahli Yang Berhormat Dato’ Dr., sebagai langkah
jangka panjang, selari pelan jangka masa panjang Pelan Induk
Pembangunan Rangkaian Jalan Raya Semenanjung Malaysia atau
*Highway Network Development Plan* (HNDP), dengan izin, kementerian
sememangnya telah mempunyai perancangan jangka panjang untuk
membina jalan baru iaitu Batu Pahat *Bypass*.
Cadangan Membina Jalan Baru dan Jambatan Kedua (*bypass*),
Batu Pahat, Johor telah dimohon dalam *Rolling Plan* Pertama (RP1),
Rancangan Malaysia Kesebelas melibatkan skop projek seperti berikut:
(i) membina jambatan baru (*bypass*) sepanjang 365 meter;
(ii) membina jalan baru sepanjang 7.5 kilometer;
(iii) pengalihan utiliti; dan
(iv) pengambilan tanah.
Cadangan projek ini tidak mendapat kelulusan Agensi Pusat iaitu
Unit Perancang Ekonomi, Jabatan Perdana Menteri dalam *Rolling Plan*
Pertama (RP1), Rancangan Malaysia Kesebelas tersebut. Justeru,
kementerian ini bersedia untuk menyenaraikan semula projek ini dalam
pelaksanaan *Rolling Plan* yang akan datang sekiranya projek ini
tersenarai dalam projek keutamaan kerajaan negeri. Sekian, terima kasih
Tuan Yang di-Pertua."
UCAPAN DI BAWAH USUL BERKENAAN PERKARA TADBIR KERAJAAN (P.M. 17),Isu Kesesakan Lalu Lintas di Jambatan Batu Pahat,,■1440,1440,Timbalan Menteri Kerja Raya [Datuk Rosnah binti Haji Abdul Rashid Shirlin],**Kes Penipuan Pajakan Tanah**
UCAPAN DI BAWAH USUL BERKENAAN PERKARA TADBIR KERAJAAN (P.M. 17),Isu Kesesakan Lalu Lintas di Jambatan Batu Pahat,,2.40 ptg.,1440,Tuan Sim Tong Him [Kota Melaka],"Terima kasih Tuan Yang
di-Pertua. Pada 14 Disember 2017, satu laporan polis dibuat oleh
seorang petani buah-buahan, Encik Bong Fook Hin, No. Laporan TG
MINYAK/006757/16 yang mengadu beliau telah ditipu untuk membeli
sebidang tanah di negeri Kelantan dengan pajakan 33 tahun. Tanah itu
seluas 500 ekar di hutan simpanan kekal Ulu Galas Kompartmen 49HSK
Jentiang, Mukim Bunga Tanjung, Kuala Balah Jajahan Kuala Krai,
Kelantan Barat, Kelantan dengan rujukan (PHN.KN.200/1/1618) oleh
dua orang lelaki Cina yang dikenali sebagai Wong Chia Seng (No. K.P
630903-04-5653) dan Chua Soon Teck. Beliau juga berkata ia telah
diyakinkan tentang tawaran ini oleh seorang wakil rakyat Yang
Berhormat Khoo Poey Tiong, ADUN Ayer Keroh yang mengesahkan
kebenaran cadangan tersebut. Yang Berhormat Khoo berkata beliau
sendiri telah pergi ke Kelantan mengesahkan perkara ini.
Saya ingin bertanya, apakah status terkini mengenai laporan ini,
terdapat beberapa orang yang disyaki terlibat dan berapa orang telah
ditangkap? Bilakah kes ini akan dibawa ke mahkamah?
Saya juga ingin tahu status pajakan tanah tersebut. Adakah ia
masih dipajak kepada APBarakah Solutions? Jika ya, adakah semua
bayaran sudah dibuat seperti bayaran deposit lesen, bayaran deposit
ladang, bayaran premium, bayaran sempadan, bayaran lesen dan
proses, deposit permit penggunaan, bayaran permit penggunaan.
Apakah jumlah bayaran keseluruhannya?
Pengadu telah membuat bayaran berjumlah RM528,000 kepada
Wong Chi Seng dan juga RM448,300 kepada seorang lelaki Melayu
Encik Mohd Hafiz bin Mohd Rasdin yang dikatakan adalah Ketua
Pemuda PAS Cawangan Pasir Mas, Kelantan.
Untuk mengelakkan sebarang persepsi yang akan timbul, saya
harap pihak kerajaan dapat memberikan satu jawapan yang menyeluruh
dan telus untuk keadilan si pengadu. Sekian, terima kasih."
UCAPAN DI BAWAH USUL BERKENAAN PERKARA TADBIR KERAJAAN (P.M. 17),Isu Kesesakan Lalu Lintas di Jambatan Batu Pahat,,2.40 ptg.,1440,Timbalan Yang di-Pertua [Datuk Seri Dr. Ronald Kiandee],"Ya, sila Yang Berhormat Menteri."
UCAPAN DI BAWAH USUL BERKENAAN PERKARA TADBIR KERAJAAN (P.M. 17),Isu Kesesakan Lalu Lintas di Jambatan Batu Pahat,,2.44 ptg.,1444,Timbalan Menteri Dalam Negeri [Datuk Nur Jazlan bin Mohamed],"Tuan Yang di-Pertua, PDRM telah menerima satu laporan
polis berkaitan TG MINYAK/006757/16 *report* bertarikh 14 Disember
2016. Di mana pengadu membuat dakwaan telah ditipu sebanyak
RM976,300 berhubung dengan tawaran pajakan tanah seluas 500 ekar
di hutan simpan kekal Mukim Tanah Merah, Kelantan.
Hasil siasatan PDRM terhadap Jabatan Perhutanan Negeri
Kelantan mengesahkan bahawa permohonan Syarikat APBarakah
Solutions untuk pajakan tanah yang dimaksudkan telah diluluskan.
Walau bagaimanapun tiada sebarang pembayaran yang dibuat oleh
Syarikat APBarakah *Solutions* kepada Jabatan Perhutanan Negeri
Kelantan bagi maksud tersebut.
Siasatan terhadap kes ini telah dijalankan di bawah seksyen 420
Kanun Keseksaan (Penipuan). Seramai 18 orang saksi telah dipanggil
memberikan keterangan dan seramai lima orang telah ditangkap bersabit
dengan kes ini. Kertas siasatan telah dimajukan kepada Pejabat Peguam
Negara pada 7 April 2017 dan masih lagi dalam tindakan Pejabat Peguam
Negara.
PDRM tidak berhasrat untuk mendedahkan maklumat suspek
memandangkan kes ini masih lagi dalam siasatan. Terima kasih."
UCAPAN DI BAWAH USUL BERKENAAN PERKARA TADBIR KERAJAAN (P.M. 17),Isu Kesesakan Lalu Lintas di Jambatan Batu Pahat,,2.44 ptg.,1444,Timbalan Yang di-Pertua [Datuk Seri Dr. Ronald Kiandee],"Terima kasih Yang Berhormat. Ahli-ahli Yang Berhormat, Mesyuarat
Kamar Khas hari ini ditangguhkan sehingga jam 2.30 petang, hari Selasa,
25 Julai 2017."
UCAPAN DI BAWAH USUL BERKENAAN PERKARA TADBIR KERAJAAN (P.M. 17),Isu Kesesakan Lalu Lintas di Jambatan Batu Pahat,,2.45 petang,1445,ANNOTATION,[Kamar Khas ditangguhkan pada pukul 2.45 petang]
