level_1,level_2,level_3,raw_timestamp,timestamp,author,speech
,,,2.30 petang,1430,ANNOTATION,"[Timbalan Yang di-Pertua (Dato’ Sri Haji Ismail bin Haji Mohamed Said)
mempengerusikan Mesyuarat]"
UCAPAN DI BAWAH USUL BERKENAAN PERKARA TADBIR KERAJAAN (P.M. 17),Isu PATI dan Tindakan KDN,,2.34 ptg.,1434,Tuan Sivakumar Varatharaju Naidu [Batu Gajah],"Terima kasih
Tuan Yang di-Pertua. Saya amat terkejut dengan pendedahan yang dibuat
oleh Menteri Sumber Manusia di Dewan Rakyat pada 18 Oktober 2016
iaitu tujuh daripada 10 pekerja asing di negara kita adalah dari kalangan
pendatang asing tanpa izin (PATI). Ini membuktikan negara kita telah
dilanda jutaan PATI secara tidak terkawal. Sehingga hari ini, kerajaan tidak
mempunyai satu remedi yang konkrit dan berkesan bagi mengatasi
masalah kemasukan PATI ke negara kita.
Dalam keadaan wujud pengangguran yang agak ketara di negara
kita, pekerja-pekerja asing pula dengan mudah dapat menembusi pasaran
buruh. Kerajaan tidak mempunyai mekanisme kawalan dan pengawasan
yang efektif untuk menghalang kemasukan PATI. Keadaan ini boleh
menghancurkan pembangunan sosioekonomi negara apabila majikan
memilih untuk menyusukan kera di hutan.
Ada sumber-sumber tertentu menyatakan bahawa negara kita
mempunyai lebih kurang 4 juta orang PATI. Adakah ini benar? Jika tidak,
berapakah jumlah yang sebenarnya? Persoalannya, bagaimanakah begitu
ramai orang asing memasuki negara kita secara haram, sedangkan kita
mempunyai banyak agensi penguatkuasaan seperti Polis Diraja Malaysia,
Angkatan Tentera Malaysia, Jabatan Imigresen dan macam-macam lagi?
Adakah Kementerian Dalam Negeri terlalu cuai atau sengaja
membenarkan mereka ini memasuki negara kita dengan agenda tertentu?
Kemasukan PATI secara tidak terkawal adalah amat membahayakan
kesejahteraan dan keselamatan rakyat Malaysia. Apabila seorang PATI
berjaya melangkah masuk negara kita, ini bermakna dia telah berjaya
membutakan semua agensi-agensi penguat kuasa yang telah diberi
tanggungjawab dan kewajipan untuk menjaga ibu pertiwi ini. Bukankah
kedaifan ini amat memalukan serta menjatuhkan imej negara?
Saya berpendapat amalan rasuah yang berleluasa merupakan
punca utama kemasukan PATI ke negara kita. Saya berharap Menteri
Dalam Negeri tidak menafikannya. Saya ingin menimbulkan beberapa
persoalan yang memerlukan maklum balas Menteri Dalam Negeri
berkaitan dengan PATI:
(i) berapakah orang PATI yang telah ditangkap sejak
tahun 2012? Apakah tindakan yang telah diambil
terhadap mereka?;
(ii) berapa orang majikan yang telah ditangkap atas
kesalahan menggaji pekerja asing tanpa permit
kerja sejak tahun 2012? Apakah tindakan-tindakan
yang telah diambil terhadap mereka?;
(iii) apakah langkah-langkah yang tegas yang akan
diambil oleh Kementerian Dalam Negeri terhadap
PATI yang telah menceroboh masuk dan masih
berada di negara kita?; dan
(iv) apakah langkah-langkah serius yang akan diambil
untuk memastikan tidak ada lagi orang asing
memasuki negara kita tanpa dokumen perjalanan
yang sah?
Terima kasih."
UCAPAN DI BAWAH USUL BERKENAAN PERKARA TADBIR KERAJAAN (P.M. 17),Isu PATI dan Tindakan KDN,,2.37 ptg.,1437,Timbalan Menteri Dalam Negeri [Tuan Masir Anak Kujat],"Tuan
Yang di-Pertua, untuk makluman Yang Berhormat dan Dewan yang mulia
ini, statistik Jabatan Imigresen Malaysia (JIM) mengenai isu pendatang
asing tanpa izin (PATI) dalam negara adalah pada kadar 3:1 iaitu setiap
empat orang yang diperiksa, terdapat satu orang PATI dalam operasi yang
dilaksanakan oleh JIM. Statistik tangkapan PATI dari tahun 2012 hingga
2015 adalah seperti berikut.
Melalui 26,893 operasi penguatkuasaan yang telah dijalankan
secara berterusan, seramai 570,733 orang warga asing diperiksa dan
seramai 185,820 PATI berjaya ditangkap dari tahun 2012 sehingga 2015
kerana melakukan pelbagai kesalahan di bawah Akta Imigresen 1959/63
seperti di lampiran yang saya sertakan di sini.
Untuk makluman Yang Berhormat dan Dewan yang mulia ini,
melalui operasi berterusan yang dilaksanakan dari tahun 2012 hingga 2015
melibatkan pelbagai agensi penguatkuasaan seramai 695 orang majikan
telah didakwa di mahkamah dan didapati bersalah kerana menggaji pekerja
asing tanpa dokumen sah serta dikenakan denda dari tahun 2012 hingga
2015.
Langkah-langkah yang tegas yang diambil oleh Kementerian Dalam
Negeri terhadap PATI yang telah menceroboh masuk dan masih berada
dalam negara adalah dengan mengadakan operasi harian bersama agensi
kerajaan yang lain iaitu melalui Program 3+1 dan juga Program Penggajian
dan Penempatan Semula PATI atau Program *Rehiring.* Melalui Program
Serah Diri (Kompaun 3+1), dengan izin yang telah dimulakan pada 22 Julai
2014 sehingga 3 Oktober 2016, seramai 409,634 orang PATI telah
menyerah diri untuk balik ke negara asal.
PATI yang menyerah diri melalui program ini disenarai hitamkan
sebelum dihantar pulang ke negara asal. Manakala mulai 15 Februari 2016
sehingga 30 Jun 2016, seramai 165,564 PATI telah mendaftar di bawah
Program *Rehiring* meliputi 14,591 orang PATI warganegara Indonesia,
115,056 PATI warganegara Bangladesh dan 35,917 orang PATI lain-lain
warganegara. Untuk makluman Yang Berhormat juga dan Dewan yang
mulia ini, seramai 29,267 orang majikan telah menyertai program tersebut.
KDN melalui JIM telah mengambil langkah-langkah serius dalam
memastikan tidak ada lagi orang asing memasuki negara tanpa dokumen
perjalanan yang sah seperti berikut:"
UCAPAN DI BAWAH USUL BERKENAAN PERKARA TADBIR KERAJAAN (P.M. 17),Isu PATI dan Tindakan KDN,,■1440,1440,Timbalan Menteri Dalam Negeri [Tuan Masir Anak Kujat],"(i) proses tapisan awal melalui pengeluaran visa di
kedutaan/pejabat perwakilan Malaysia di luar
negara, di mana tapisan akan dibuat untuk
mengenal pasti sama ada butiran warga asing
berkenaan telah dimasukkan dalam senarai syak
atau *suspect list* (SL) jabatan. Sekiranya nama
mereka tersenarai dalam senarai syak,
warganegara asing berkenaan tidak akan diberikan
visa untuk datang ke Malaysia;
(ii) kawalan dan pemeriksaan di pintu-pintu masuk
negara meliputi pemeriksaan dokumen perjalanan,
latar belakang pengembara dan juga penyemakan
identiti dengan pangkalan data syak, Jabatan
Imigresen;
(iii) penggunaan *auto gate* bagi kemasukan
warganegara Malaysia bagi menjamin keselamatan
dokumen di samping memelihara identiti
warganegara melalui pengecaman cap jari
biometrik. Ia seterusnya dapat membantu dan
memberi peluang kepada Pegawai Imigresen untuk
memberikan lebih perhatian kepada pemeriksaan
pelawat asing yang berisiko tinggi di pintu-pintu
masuk negara; dan
(iv) perkongsian data bersama pihak PDRM bagi warga
asing yang berisiko dalam sistem SL atau *suspect
list*.
Sebagai tambahan, Jabatan Imigresen Malaysia menyemak data
warga asing yang berisiko di pintu masuk negara kepada sistem sekuriti
nasional (NERS) melalui proses pengecaman terhadap data biometrik
pesalah imigresen yang telah direkodkan dalam senarai syak jabatan.
Di samping itu juga, sistem NERS dapat mengenal pasti ketulenan
identiti individu bersama dokumen yang digunakan berdasarkan semakan
silang dengan maklumat biometrik yang terkandung dalam pangkalan data
NERS. Pelaksanaan prosedur ini dapat meningkatkan keberkesanan
kawalan dan pemeriksaan masuk warga asing.
Selain itu juga, kerajaan pada ketika ini mengguna pakai
pendekatan operasi bersepadu dalam melaksanakan operasi
penguatkuasaan yang turut telah diperkasakan dengan pelaksanaan Pelan
Penguatkuasaan PATI Secara Holistik yang bertujuan untuk mewujudkan
satu ekosistem tidak selesa kepada PATI untuk meneruskan kehidupan
seharian mereka.
Antara kekuatan pelan ini adalah mengoptimumkan sumber sedia
ada melalui Prinsip Strategi Lautan Biru Kebangsaan yang melibatkan
kerjasama pelbagai agensi di peringkat Persekutuan, negeri dan
seterusnya pihak berkuasa tempatan. Pelan ini turut menekankan
kesedaran masyarakat setempat berhubung kesalahan dan hukuman yang
dikenakan terhadap majikan yang menggaji PATI. Aktiviti naziran oleh JIM
ke premis-premis menggaji pekerja asing turut dilakukan dari semasa ke
semasa bagi mengesan warga asing serta majikan yang melakukan
kesalahan imigresen. Sekian, terima kasih."
UCAPAN DI BAWAH USUL BERKENAAN PERKARA TADBIR KERAJAAN (P.M. 17),Isu PATI dan Tindakan KDN,,■1440,1440,Timbalan Yang di-Pertua [Dato’ Sri Haji Ismail bin Haji Mohamed Said],"Terima kasih. Baiklah Ahli-ahli Yang Berhormat, mesyuarat Kamar
Khas hari ini ditangguhkan sehingga jam 2.30 petang, hari Khamis, 27
Oktober 2016."
UCAPAN DI BAWAH USUL BERKENAAN PERKARA TADBIR KERAJAAN (P.M. 17),Isu PATI dan Tindakan KDN,,2.43 petang,1443,ANNOTATION,[Kamar Khas ditangguhkan pada pukul 2.43 petang]
