level_1,level_2,level_3,timestamp,author,speech
JAWAPAN-JAWAPAN LISAN BAGI PERTANYAAN-PERTANYAAN,7.,,1140,Datuk Mohamad bin Alamin,"Terima kasih Yang Berhormat Baram. Untuk
makluman Yang Berhormat Baram, bahawa dasar yang sedang dilaksanakan ini yang
disebut-sebut sebagai Dasar 90:10, di mana 90 peratus guru-guru harus diambil dari
negeri Sarawak. Dasar akan kita teruskan sehingga ada satu ketetapan terbaharu
daripada Kabinet Malaysia.
Jadi, untuk makluman Yang Berhormat dan juga Dewan yang mulia ini, bahawa
Kementerian Pendidikan Malaysia mempunyai beberapa pendekatan untuk mengisi
mana-mana kekosongan guru di mana-mana negeri sekalipun. Di negeri Sarawak
contohnya, kita akan membuat pertukaran guru di mana guru-guru yang berasal daripada
Sarawak kita akan hantar semula ke Sarawak, tetapi berdasarkan kekosongan perjawatan
dan juga opsyen seseorang guru tersebut.
Keduanya, kita juga akan melantik guru-guru baharu yang berasal dari Sarawak,
kita akan menempatkan juga di negeri kelahiran mereka, juga berdasarkan kekosongan
perjawatan dan juga opsyen yang ada.
Ketiganya, untuk makluman Yang Berhormat Baram juga, di institut pendidikan
guru (IPG), kita juga ada bakal-bakal guru yang akan dilahirkan dari sana dan ini juga kita
akan bagi mereka keutamaan. Mana-mana yang lahir di negeri Sarawak, kita akan
tempatkan di negeri Sarawak juga.
Untuk makluman Yang Berhormat, pihak Suruhanjaya Perkhidmatan Pendidikan
(SPP) sedang melaksanakan sesi temu duga untuk guru-guru di IPG ini untuk mereka
ditempatkan di negeri Sarawak juga, insya-Allah. Terima kasih."
JAWAPAN-JAWAPAN LISAN BAGI PERTANYAAN-PERTANYAAN,7.,,1140,Datuk Seri Panglima Haji Mohd Shafie bin Haji Apdal [Semporna],"Terima
kasih Tuan Yang di-Pertua, tentang ruang yang diberikan dan terima kasih kepada Yang
Berhormat Timbalan Menteri yang telah menjawab soalan berhubung kait dengan
penempatan guru-guru di Sarawak. Saya harap juga bukan hanya di Sarawak, bahkan
juga di negeri seperti Sabah ya.
Pada tahun 2001, adakah Yang Berhormat sedar bahawa Yang Berhormat
Menteri telah mengumumkan sebanyak 2,400 kekosongan jawatan? Selepas itu, cukup
ramai anak-anak Sabah yang mempunyai keupayaan dan telah pun menerusi ujian. Akan
tetapi malangnya, kurang daripada 40 orang sahaja yang diambil. Seramai 292 anak
Sabah yang qualified, tetapi tidak ditempatkan.
Saya bimbang di Sarawak kerana kita dalam keadaan ekonomi yang begitu rumit.
Kos yang akan perlu dibelanjakan kalau hendak transfer ataupun menempatkan guru-guru
dari Semenanjung, perumahan, pengangkutan, berbagai-bagai masalah yang ada. Saya
sedar bahawa perlu integrasi.
Saya sedar untuk membolehkan anak-anak ini, tetapi sudah ada yang qualified.
Mengapa tidak dilakukan oleh pihak kementerian sehingga tercicir anak-anak Sabah yang
sudah pun mengikuti ujian, 292 tidak dapat tempat yang contract of service (COS) yang
telah pun diumumkan oleh Yang Berhormat Menteri. Saya ingin bertanya kepada Yang
Berhormat Menteri."
JAWAPAN-JAWAPAN LISAN BAGI PERTANYAAN-PERTANYAAN,7.,,1140,Datuk Mohamad bin Alamin,"Terima kasih kepada Yang Berhormat Semporna.
Untuk makluman Ahli Yang Berhormat, di Sabah sahaja seramai 1,653 anak Sabah telah
pun dilantik sebagai guru di mana 1,498 daripada pengambilan one-off dan seramai 155
orang daripada pengambilan COS.
Jadi jumlah keseluruhan yang telah dihantar ke Sabah sahaja Yang Berhormat,
sebanyak 1,221 untuk pengambilan one-off tadi. Manakala pengambilan COS, seramai
1,221 ke Sabah dan 432 ke negeri-negeri lain, tetapi mereka adalah anak-anak Sabah.
Kenapakah kita hantar ke negeri lain? Oleh sebab kekosongan opsyen itu tidak ada di
Sabah, tetapi ada di negeri lain.
Jadi, kita berdasarkan kepada keperluan Yang Berhormat, opsyen ya. Ini adalah
sangat penting sebab opsyen yang ada ini kita amat terhad. Saya minta bantu kepada
Yang Berhormat sendiri, kalau ada mana-mana guru yang mempunyai opsyen yang tepat,
minta mereka memohon akan datang.
Kita sudah cari sedaya upaya Yang Berhormat, untuk mencari calon-calon guru
yang mempunyai opsyen-opsyen yang kita cari. Untuk makluman Yang Berhormat, di
Sabah sahaja contoh, contoh opsyen yang sangat kritikal apa dia? Opsyen Pendidikan
Islam. Susah kita hendak penuhi. Guru-guru yang mempunyai opsyen Pendidikan Islam,
itu fasal kita cari daripada mana-mana negeri untuk datang ke Sabah bantu buat seketika.
Akan tetapi mana-mana opsyen yang lain, umpamanya opsyen Bahasa Melayu
ya, kita juga cari mana-mana graduan kita yang mempunyai ijazah tetapi bukan ikhtisas
pendidikan, tetapi mereka ada ambil subjek-subjek tertentu dalam ijazah mereka, kita juga
pertimbangkan graduan-graduan ini untuk mengisi pengambilan melalui COS sahaja.
Akan tetapi insya-Allah Yang Berhormat, kita akan terus berusaha untuk
memastikan isu kekurangan guru yang ada di seluruh negara, bukan sahaja di Sabah,
bukan sahaja di Sarawak, tetapi kita akan cuba sedaya upaya untuk mengambil langkah-
langkah yang perlu bagi memenuhi keperluan pendidikan anak-anak kita di seluruh
negara. Insya-Allah."
JAWAPAN-JAWAPAN LISAN BAGI PERTANYAAN-PERTANYAAN,7.,,1150,Datuk Seri Panglima Haji Mohd Shafie bin Haji Apdal [Semporna],"Yang
Berhormat, saya soal tadi. Tuan Yang di-Pertua, soalan saya mengapa 292 orang anak-
anak, saya ingat mereka pun communicate dengan Yang Berhormat Timbalan Menteri
tetapi mereka engage dengan saya. Selepas itu mereka maklumkan mereka telah pun
melalui kursus dan lulus, bukan persoalan opsyennya.
Ada opsyen kekosongan jawatan yang ada background pengajian tinggi, yang
pengajian pendidikan mereka itu ditempatkan. Akan tetapi mereka ini sudah pun melulusi
ujian yang telah dilakukan. Kenapa seramai 292 anak-anak tidak dipilih? Bukan oleh
kerana persoalan opsyen semata-mata. Terima kasih."
JAWAPAN-JAWAPAN LISAN BAGI PERTANYAAN-PERTANYAAN,7.,,1150,Tuan Ma'mun bin Sulaiman [Kalabakan],
JAWAPAN-JAWAPAN LISAN BAGI PERTANYAAN-PERTANYAAN,7.,,1150,ANNOTATION,[Bangun]
JAWAPAN-JAWAPAN LISAN BAGI PERTANYAAN-PERTANYAAN,7.,,1150,Datuk Mohamad bin Alamin,"Dasar pengambilan kita kena ingat Yang
Berhormat. Berdasarkan kekosongan perjawatan pertama dan juga kekosongan opsyen
yang ada ini. Kita tidak boleh lari dari dasar ataupun prinsip asas sebagaimana kita untuk
mengambil mana-mana guru kita. Akan tetapi insya-Allah Yang Berhormat Semporna,
percayalah saya sendiri sebagai Timbalan Menteri dari Sabah, saya juga concerned
tentang kekurangan guru, keperluan guru di Sabah, Sarawak dan juga di seluruh negara
insya-Allah. Terima kasih."
JAWAPAN-JAWAPAN LISAN BAGI PERTANYAAN-PERTANYAAN,7.,,1150,Tuan Ma'mun bin Sulaiman [Kalabakan],Satu soalan dari Kalabakan.
JAWAPAN-JAWAPAN LISAN BAGI PERTANYAAN-PERTANYAAN,7.,,1150,Timbalan Yang di-Pertua [Dato' Mohd Rashid Hasnon],"Saya minta Yang
Berhormat Kalabakan bagi soalan ringkas. Terus."
JAWAPAN-JAWAPAN LISAN BAGI PERTANYAAN-PERTANYAAN,7.,,1150,Tuan Ma'mun bin Sulaiman [Kalabakan],"Terima kasih Tuan Yang di-Pertua.
Yang Berhormat Timbalan Menteri, kita punya masalah pendidikan di Sabah ini sudah
berlarutan berpuluh tahunlah saya rasa dengan sekolah daif yang banyak dan kekurangan
guru yang berlarutan bertahun-tahun. Kita ada tiga buah maktab perguruan di Sabah iaitu:
(i) Maktab Perguruan Kent;
(ii) Maktab Perguruan Keningau; dan
(iii) Maktab Perguruan Tawau.
Saya dimaklumkan kita tidak mengambil pelajar yang secukupnya untuk melatih
anak-anak Sabah untuk menjadi guru. Jadi kalau kita hanya beralasan opsyen yang
kurang, opsyen yang tidak dapat dibekalkan untuk memenuhi permintaan sekolah di
Sabah dengan sekolah yang daif, macam mana kita mahu meningkatkan pendidikan di
Sabah? Terima kasih. Tolong jawab."
JAWAPAN-JAWAPAN LISAN BAGI PERTANYAAN-PERTANYAAN,7.,,1150,Datuk Mohamad bin Alamin,"Yang Berhormat Kalabakan, saya tambah satu
lagi. Kita ada IPG Gaya di Kota Kinabalu, ada empat ya. Akan tetapi mana-mana keluaran
daripada IPG ini kita khususkan untuk sekolah-sekolah rendah. Yang Berhormat kena
ingat, setiap tahun berapa ramai guru-guru yang bersara? Ramai juga. Jadi, kita keluarkan
bakal-bakal guru ini melalui IPG. Jadi, insya-Allah Yang Berhormat..."
JAWAPAN-JAWAPAN LISAN BAGI PERTANYAAN-PERTANYAAN,7.,,1150,Tuan Ma'mun bin Sulaiman [Kalabakan],"Sudah semestinya Kementerian
Pendidikan ada unjuran, ada planning yang baik untuk Sabah."
JAWAPAN-JAWAPAN LISAN BAGI PERTANYAAN-PERTANYAAN,7.,,1150,Datuk Mohamad bin Alamin,Yang Berhormat...
JAWAPAN-JAWAPAN LISAN BAGI PERTANYAAN-PERTANYAAN,7.,,1150,Tuan Ma'mun bin Sulaiman [Kalabakan],"Untuk Sabah supaya kita dapat
memenuhi permintaan."
JAWAPAN-JAWAPAN LISAN BAGI PERTANYAAN-PERTANYAAN,7.,,1150,Datuk Mohamad bin Alamin,"Betul, betul. Saya faham."
JAWAPAN-JAWAPAN LISAN BAGI PERTANYAAN-PERTANYAAN,7.,,1150,Tuan Ma'mun bin Sulaiman [Kalabakan],"Saya turun ke bawah. Saya turun ke
bawah, banyak lagi kekosongan guru di sekolah-sekolah."
JAWAPAN-JAWAPAN LISAN BAGI PERTANYAAN-PERTANYAAN,7.,,1150,Timbalan Yang di-Pertua [Dato' Mohd Rashid Hasnon],"Yang Berhormat
Kalabakan, ini bukan perbahasan."
JAWAPAN-JAWAPAN LISAN BAGI PERTANYAAN-PERTANYAAN,7.,,1150,Datuk Seri Haji Mohd Salim Sharif [Jempol],"Sabar- sabar, jangan gaduh.
Gaduh di kawasan sahaja."
JAWAPAN-JAWAPAN LISAN BAGI PERTANYAAN-PERTANYAAN,7.,,1150,Datuk Mohamad bin Alamin,"Yang Berhormat Kalabakan, saya faham."
JAWAPAN-JAWAPAN LISAN BAGI PERTANYAAN-PERTANYAAN,7.,,1150,Tuan Ma'mun bin Sulaiman [Kalabakan],"Minta tolonglah. Yang Berhormat
Timbalan Menteri dari Sabah, tolonglah orang Sabah."
JAWAPAN-JAWAPAN LISAN BAGI PERTANYAAN-PERTANYAAN,7.,,1150,Datuk Mohamad bin Alamin,"Betul, kita akan cari jalan sebaik mungkin Yang
Berhormat Kalabakan. Takkan saya orang Sabah, saya tidak concerned, saya amat
concerned juga. Saya bincang dengan Yang Berhormat Menteri, saya bincang dengan
Pengerusi SBP bagaimana cara untuk kita menyelesaikan isu kekurangan guru di Sabah,
di Sarawak dan seluruh negara. Saya sangat concerned Yang Berhormat. Jadi bagi
kepercayaan kepada KPM untuk cari jalan sama-sama kita."
JAWAPAN-JAWAPAN LISAN BAGI PERTANYAAN-PERTANYAAN,7.,,1150,Datuk Seri Haji Shamsul Iskandar @ Yusre bin Haji Mohd Akin [Hang Tuah Jaya],"Kasi selesai ini kalilah, jangan lain kali."
JAWAPAN-JAWAPAN LISAN BAGI PERTANYAAN-PERTANYAAN,8.,,1150,Dr. Azman bin Ismail [Kuala Kedah],"minta  Menteri Pertanian dan Industri
Makanan menyatakan tentang stok penimbal negara bagi beras:
(a) berapa saiz stok di dalam ukuran tan; dan
(b) bagaimana ditentukan saiz stok berbanding dengan keperluan
negara. Di mana disimpan stok-stok beras itu."
JAWAPAN-JAWAPAN LISAN BAGI PERTANYAAN-PERTANYAAN,8.,,1150,Menteri Pertanian dan Industri Makanan [Datuk Seri Dr. Ronald Kiandee],"Terima kasih Tuan Yang di-Pertua dan terima kasih Ahli Yang Berhormat dari Kuala
Kedah.
Untuk makluman Ahli Yang Berhormat, pada masa ini kedudukan stok penimbal
beras adalah pada paras 221,311 tan metrik iaitu 88.5 peratus daripada jumlah sasaran
yang ditetapkan oleh kerajaan iaitu sebanyak ‘250,000’ tan metrik menjelang tahun 2022.
Kerajaan sedang menggandakan stok penimbal secara berperingkat daripada 150,000
tan metrik kepada 290,000 tan metrik menjelang tahun 2023 bagi memastikan jaminan
bekalan makanan negara untuk menghadapi sebarang situasi luar jangka.
Bagi menampung keperluan beras negara, kementerian sentiasa memastikan
kedudukan stok beras sentiasa melebihi paras purata keperluan iaitu 200,000 tan metrik
sebulan. Kedudukan stok beras di dalam negara di peringkat kilang, borong dan runcit
sentiasa pada kadar konsisten setiap masa iaitu purata 400,000 tan metrik hingga 500,000
tan metrik.
Kementerian sentiasa memantau kedudukan stok ini secara dekat dan membuat
survey stock-taking berkala pada setiap bulan bagi memastikan kedudukan stok dan
bekalan dalam negara sentiasa stabil. Jika diambil kira dengan stok dagangan (trading
stock), bekalan beras negara adalah pada keadaan stabil dan mencukupi untuk
menampung keperluan domestik untuk tempoh empat hingga lima bulan dan bukan
seperti yang dianggarkan sebelum ini Tuan Yang di-Pertua. Saya pernah menganggarkan
lima hingga enam bulan tetapi sebenarnya empat hingga lima bulan stok domestik bagi
menampung keperluan yang ada.
Selain itu, terdapat juga stok padi yang sedia diproses menjadi beras di kilang-
kilang dengan purata 100,000 metrik tan hingga 200,000 metrik tan setiap bulan iaitu
mengambil kira pengeluaran padi beras negara yang sentiasa berterusan melalui
kawasan jelapang dan luar jelapang negara. Bagi memastikan pengeluaran padi tempatan
secara berterusan, jadual penanaman di seluruh negara adalah dirancang secara
bersistematik iaitu melalui pusingan kitaran antara negeri-negeri.
Bagi menampung keperluan yang tidak dapat ditampung oleh pengeluaran beras
tempatan negara, kerajaan mengimport sebanyak 80,000 tan metrik beras secara purata
setiap bulan. Berdasarkan kepada data-data tersebut, ia jelas membuktikan bahawa
kedudukan beras negara adalah kekal stabil sepanjang masa. Malah ketika kerajaan dan
negara berhadapan dengan pandemik COVID-19, bekalan beras di seluruh negara adalah
juga stabil dan tidak terputus.
Untuk makluman Ahli Yang Berhormat, saiz stok penimbal beras ditentukan
berdasarkan keupayaan negara untuk mengurus, memulihara, menyelenggara dan
mengekalkan stok penimbal beras pada kadar yang ditetapkan oleh kerajaan. Perkara ini
adalah penting supaya kualiti beras stockpile yang disimpan sentiasa berada dalam
keadaan baik dan sedia untuk digunakan apabila diperlukan.
Saiz stok penimbal beras yang terlalu besar adalah tidak bersesuaian kerana akan
menyebabkan pengurusan yang kurang efisien serta menelan kos yang tinggi dalam
mengurus, memulihara dan mengekalkan stok penimbal beras tersebut.
Selain itu, jumlah stockpile juga mengambil kira keperluan penduduk ketika situasi
di luar jangka. Sekian, terima kasih."
JAWAPAN-JAWAPAN LISAN BAGI PERTANYAAN-PERTANYAAN,8.,,1150,Dr. Azman bin Ismail [Kuala Kedah],"Terima kasih Tuan Yang di-Pertua dan
terima kasih Yang Berhormat Menteri. Itu jawapan yang panjang dan memuaskan saya.
Namun saya ada soalan.
Beras ialah satu barang yang boleh rosak. Umumnya dua tahunlah saya
difahamkan kalau kita telah gilap. Apakah langkah-langkah yang diambil untuk
memastikan bahawa kita tidak mengalami kerugian kerana kerosakan beras? Pertama.
Keduanya ialah setakat ini berapakah peratus kerosakan beras yang berlaku pada
stok penimbal kita? Terima kasih."
JAWAPAN-JAWAPAN LISAN BAGI PERTANYAAN-PERTANYAAN,8.,,1150,Datuk Seri Dr. Ronald Kiandee,"Seperti yang saya katakan tadi, memang benar
stockpile beras jumlahnya itu ditentukan berdasarkan kepada keadaan dan kapasiti kita
untuk mengurus dan memulihara stockpile. Memang benar beras tidak boleh disimpan
lebih dari jangka waktu yang tertentu. Jadi sebab itu stockpile kita itu dipusing setiap kali.
After how many months, setiap beberapa bulan ia akan dijual dan direfurbished stok yang
baru kerana beras tidak boleh disimpan untuk jangka masa yang lama kerana ia akan
rosak seperti yang dikatakan, memang benar.
Oleh sebab itu, saiz stockpile itu ditentukan berdasarkan kepada kapasiti dan
keupayaan kita untuk mengurus dan memulihara stockpile. Jadi pada peringkat ini,
kedudukan stockpile kita adalah mencukupi untuk tempoh empat hingga lima bulan seperti
yang dikatakan tadi. Jadi kita memandang serius tentang kedudukan stockpile bagi
memastikan bahawa keperluan beras negara sentiasa mencukupi dalam keadaan apa
sekalipun. Terima kasih."
JAWAPAN-JAWAPAN LISAN BAGI PERTANYAAN-PERTANYAAN,8.,,1150,Datuk Zakaria bin Mohd. Edris @ Tubau [Libaran],Libaran.
JAWAPAN-JAWAPAN LISAN BAGI PERTANYAAN-PERTANYAAN,8.,,1150,Timbalan Yang di-Pertua [Dato' Mohd Rashid Hasnon],"Terima kasih Yang
Berhormat Menteri. Soalan tambahan kedua..."
JAWAPAN-JAWAPAN LISAN BAGI PERTANYAAN-PERTANYAAN,8.,,1150,Dato' Haji Che Abdullah bin Mat Nawi [Tumpat],Tumpat.
JAWAPAN-JAWAPAN LISAN BAGI PERTANYAAN-PERTANYAAN,8.,,1150,Datuk Seri Haji Mohd Salim Sharif [Jempol],"Ha! Jempol, Jempol."
JAWAPAN-JAWAPAN LISAN BAGI PERTANYAAN-PERTANYAAN,8.,,1150,Timbalan Yang di-Pertua [Dato' Mohd Rashid Hasnon],"Saya jemput Yang
Berhormat Libaran."
JAWAPAN-JAWAPAN LISAN BAGI PERTANYAAN-PERTANYAAN,8.,,1150,Datuk Zakaria bin Mohd. Edris @ Tubau [Libaran],"Terima kasih Tuan Yang di-
Pertua dan terima kasih kepada Yang Berhormat Menteri yang telah memberikan
jawapan.
Tuan Yang di-Pertua, keselamatan makanan tidak dapat lari daripada kecukupan
makanan mudah didapati pada setiap masa dan selamat juga digunakan. Di Malaysia,
walaupun perbincangan tentang isu keselamatan makanan telah ditanggapi dalam
maksud yang luas. Perbincangan masih menyentuh tentang padi dan beras yang menjadi
makanan ruji penduduk di negara kita Malaysia.
Soalan saya, adakah penularan wabak COVID-19 yang melanda dunia termasuk
Malaysia ketika ini boleh membuka ruang kepada kementerian MAFI melihat semula
mekanisme kawalan padi dan beras untuk kegunaan pemakanan bagi penduduk-
penduduk di Malaysia. Terima kasih Tuan Yang di-Pertua."
JAWAPAN-JAWAPAN LISAN BAGI PERTANYAAN-PERTANYAAN,8.,,1200,Datuk Seri Dr. Ronald Kiandee,"Terima kasih Yang Berhormat Libaran. Memang
kedudukan dan dasar kita untuk menanam 70 peratus daripada keperluan mengeluarkan
beras 70 peratus daripada keperluan dan mengimport 30 peratus iaitu lebih kurang 80,000
metrik tan setiap bulan. Namun, adalah menjadi tanggungjawab kerajaan untuk
memastikan bukan sahaja kita boleh mencapai 70 peratus pengeluaran untuk bekalan
tempatan, tetapi untuk terus meningkatkan pengeluaran ini dari semasa ke semasa.
Oleh sebab itu, pelbagai pendekatan dan dasar diolah oleh kerajaan melalui MAFI
untuk memastikan bahawa kita mampu mencapai bukan sahaja pada tahap 70 peratus
keperluan negara, tetapi lebih daripada itu. Jadi antara pendekatan yang dibuat oleh
kerajaan adalah pendekatan melalui SMART Sawah Berskala Besar (SMART SBB).
Tujuan dan matlamatnya adalah untuk mengurus ladang sawah secara berkumpulan,
secara efficient untuk menentukan hasil pengeluaran itu dapat ditingkatkan dan
mengurangkan pergantungan kita kepada import.
Saya bersetuju dengan Ahli Yang Berhormat Libaran bahawa beras makanan
adalah merupakan aspek sekuriti makanan yang perlu ditangani oleh kerajaan. Dalam
menangani keadaan ini, kita harus mampu mengeluarkan bekalan-bekalan makanan yang
boleh dikeluarkan dari negara kita pada tahap yang maksima dan mengurangkan
kebergantungan kita kepada import. Ini kerana kalau kerajaan, kalau negara bergantung
kepada import dalam keadaan sekuriti makanan, kita akan terdedah kepada kenaikan kos,
harga dan sebagainya.
Oleh sebab itu adalah penting bagi kita untuk meningkatkan pengeluaran
termasuk meningkatkan pengeluaran beras, padi bagi memastikan keperluan negara
sentiasa dapat dipenuhi sepenuhnya oleh negara kita. Terima kasih."
JAWAPAN-JAWAPAN LISAN BAGI PERTANYAAN-PERTANYAAN,8.,,1200,Timbalan Yang di-Pertua [Dato’ Mohd Rashid Hasnon],"Terima kasih Yang
Berhormat Menteri."
JAWAPAN-JAWAPAN LISAN BAGI PERTANYAAN-PERTANYAAN,8.,,1200,Tuan Fong Kui Lun [Bukit Bintang],
JAWAPAN-JAWAPAN LISAN BAGI PERTANYAAN-PERTANYAAN,8.,,1200,ANNOTATION,[Bangun]
JAWAPAN-JAWAPAN LISAN BAGI PERTANYAAN-PERTANYAAN,8.,,1200,Timbalan Yang di-Pertua [Dato’ Mohd Rashid Hasnon],"Saya bagi ruang
soalan tambahan yang ketiga kepada Yang Berhormat Bukit Bintang."
JAWAPAN-JAWAPAN LISAN BAGI PERTANYAAN-PERTANYAAN,8.,,1200,Tuan Fong Kui Lun [Bukit Bintang],"Terima kasih Tuan Yang di-Pertua, soalan
tambahan. Saya ingin bertanya kepada Yang Berhormat Menteri, adakah kerajaan
bercadang untuk membuka pusat stok penimbal beras negara di setiap negeri bagi
memudahkan .."
JAWAPAN-JAWAPAN LISAN BAGI PERTANYAAN-PERTANYAAN,8.,,1200,ANNOTATION,[Tidak jelas]
JAWAPAN-JAWAPAN LISAN BAGI PERTANYAAN-PERTANYAAN,8.,,1200,Tuan Fong Kui Lun [Bukit Bintang],"... berlaku apabila terputus bekalan di negara kita. Minta
penjelasan Yang Berhormat Menteri."
JAWAPAN-JAWAPAN LISAN BAGI PERTANYAAN-PERTANYAAN,8.,,1200,Timbalan Yang di-Pertua [Dato’ Mohd Rashid Hasnon],"Terima kasih Yang
Berhormat Bukit Bintang, Yang Berhormat Menteri."
JAWAPAN-JAWAPAN LISAN BAGI PERTANYAAN-PERTANYAAN,8.,,1200,Datuk Seri Dr. Ronald Kiandee,"Kita telah mewujudkan stockpile ini di 24 lokasi
di seluruh negara. Akan tetapi adalah menjadi dasar keselamatan, kita tidak
mengumumkan where, di mana kedudukan loji stockpile ataupun gudang stockpile beras
yang didirikan oleh kerajaan di 24 lokasi di seluruh negara. Ini adalah atas dasar
keselamatan. Padi beras merupakan satu yang perlu dijaga secara selamat dan jika
didedahkan di mana 24 lokasi ini dia akan mendedahkan lokasi ini untuk serangan dan
sebagainya. So kita ada 24 lokasi Yang Berhormat di seluruh negeri di negara kita. Jadi
lokasi-lokasi ini cukup untuk menangani sebarang kekurangan di setiap negeri jika berlaku
kekurangan. Jadi 24 lokasi ini memadai. Namun ianya akan sentiasa dilihat jika ada
keperluan untuk menambah lokasi-lokasi gudang stockpile yang didirikan setakat ini.
Terima kasih."
JAWAPAN-JAWAPAN LISAN BAGI PERTANYAAN-PERTANYAAN,8.,,1200,Datuk Seri Haji Mohd Salim Sharif [Jempol],"Sedikit lagi, ada masa, ada masa."
JAWAPAN-JAWAPAN LISAN BAGI PERTANYAAN-PERTANYAAN,8.,,1200,Timbalan Yang di-Pertua [Dato’ Mohd Rashid Hasnon],"Soalan terhad kepada
tiga soalan tambahan, minta maaf."
JAWAPAN-JAWAPAN LISAN BAGI PERTANYAAN-PERTANYAAN,8.,,1200,Datuk Seri Haji Mohd Salim Sharif [Jempol],Tadi empat.
JAWAPAN-JAWAPAN LISAN BAGI PERTANYAAN-PERTANYAAN,8.,,1200,Timbalan Yang di-Pertua [Dato’ Mohd Rashid Hasnon],"Ahli-ahli Yang
Berhormat, sekarang tamatlah sesi Pertanyaan-pertanyaan Bagi Jawab Lisan pada hari
ini. Terima kasih Ahli-ahli Yang Berhormat."
JAWAPAN-JAWAPAN LISAN BAGI PERTANYAAN-PERTANYAAN,8.,,1200,ANNOTATION,[Masa untuk Pertanyaan-pertanyaan bagi Jawab Lisan tamat]
USUL,"WAKTU MESYUARAT DAN URUSAN DIBEBASKAN
DARIPADA PERATURAN MESYUARAT",,1203,Timbalan Menteri di Jabatan Perdana Menteri (Parlimen dan Undang- undang) [Datuk Wira Hajah Mas Ermieyati binti Samsudin],"Tuan Yang di-Pertua,
“Mengikut Peraturan Mesyuarat 12(1), saya mohon
mencadangkan bahawa Mesyuarat pada hari ini tidak akan ditangguhkan
sehingga dibahas dan diputuskan (D.R 25/2022) Rang Undang-undang
Levi Keuntungan Luar Biasa (Pindaan) 2022, (D.R 31/2022) Rang
Undang-undang Cukai Jualan (Pindaan) 2022, (D.R 32/2022) Rang
Undang-undang Cukai Perkhidmatan (Pindaan) 2022 seperti di nombor
satu hingga tiga dan Usul-usul Menteri Kewangan di nombor empat
hingga sepuluh dalam Aturan Urusan Mesyuarat dan Usul-usul hari ini
selepas itu Majlis Mesyuarat akan ditangguhkan ke suatu tarikh yang
tidak ditetapkan”."
USUL,"WAKTU MESYUARAT DAN URUSAN DIBEBASKAN
DARIPADA PERATURAN MESYUARAT",,1203,Timbalan Yang di-Pertua [Dato’ Mohd Rashid Hasnon],Ada sokongan?
USUL,"WAKTU MESYUARAT DAN URUSAN DIBEBASKAN
DARIPADA PERATURAN MESYUARAT",,1203,"Timbalan Menteri Pembangunan Wanita, Keluarga dan Masyarakat [Dato’ Hajah Siti Zailah binti Mohd Yusoff]","Tuan Yang di-Pertua, saya menyokong."
USUL,"WAKTU MESYUARAT DAN URUSAN DIBEBASKAN
DARIPADA PERATURAN MESYUARAT",,1203,Timbalan Yang di-Pertua [Dato’ Mohd Rashid Hasnon],"Terima kasih Ahli-ahli
Yang Berhormat, sekarang saya kemukakan masalah pada Majlis untuk diputuskan.
Masalahnya ialah usul seperti yang dikemukakan tadi hendaklah disetujukan."
USUL,"WAKTU MESYUARAT DAN URUSAN DIBEBASKAN
DARIPADA PERATURAN MESYUARAT",,1203,ANNOTATION,[Usul dikemuka bagi diputuskan; dan disetujukan]
RANG UNDANG-UNDANG DIBAWA KE DALAM MESYUARAT,"RANG UNDANG-UNDANG KANUN KESEKSAAN (PINDAAN) 2022
Bacaan Kali Yang Pertama",,1203,,"Rang undang-undang bernama Suatu Akta untuk meminda Kanun Keseksaan;
dibawa ke dalam Mesyuarat oleh Timbalan Menteri di Jabatan Perdana Menteri (Parlimen
dan Undang-undang) [Datuk Wira Hajah Mas Ermieyati binti Samsudin]; dibaca kali yang
pertama; akan dibaca kali yang kedua pada Mesyuarat akan datang."
RANG UNDANG-UNDANG DIBAWA KE DALAM MESYUARAT,"RANG UNDANG-UNDANG KANUN TATACARA JENAYAH
(PINDAAN) (NO. 2) 2022
Bacaan Kali Yang Pertama",,1203,,"Rang undang-undang bernama Suatu Akta untuk meminda Kanun Tatacara
Jenayah; dibawa ke dalam Mesyuarat oleh Timbalan Menteri di Jabatan Perdana Menteri
(Parlimen dan Undang-undang) [Datuk Wira Hajah Mas Ermieyati binti Samsudin]; dibaca
kali yang pertama; akan dibaca kali yang kedua pada Mesyuarat akan datang."
RANG UNDANG-UNDANG DIBAWA KE DALAM MESYUARAT,"RANG UNDANG-UNDANG KANUN TATACARA JENAYAH
(PINDAAN) (NO. 2) 2022
Bacaan Kali Yang Pertama",,1203,Datuk Seri Haji Salahuddin bin Ayub [Pulai],"Tuan Yang di-Pertua, Peraturan
Mesyuarat."
RANG UNDANG-UNDANG DIBAWA KE DALAM MESYUARAT,"RANG UNDANG-UNDANG KANUN TATACARA JENAYAH
(PINDAAN) (NO. 2) 2022
Bacaan Kali Yang Pertama",,1203,Timbalan Yang di-Pertua [Dato’ Mohd Rashid Hasnon],Sila.
