level_1,level_2,level_3,timestamp,author,speech
RANG UNDANG-UNDANG,"RANG UNDANG-UNDANG LEVI KEUNTUNGAN
LUAR BIASA (PINDAAN) 2022
Bacaan Kali Yang Kedua dan Ketiga",,1440,Dato' Indera Mohd Shahar bin Abdullah,"Okey. Ada yang membangkitkan
Tuan Yang di-Pertua Cukai Makmur ini dikenakan kepada industri sawit. Saya hendak
jelaskan dekat sini, Cukai Makmur ini hanya dikenakan pada syarikat yang mendapatkan
keuntungan melebihi RM100 juta. Sebanyak 233 buah syarikat yang telah dikenal pasti
yang akan dikenakan Cukai Makmur hanya sekali (one-off) untuk tahun 2022 seperti mana
yang diumumkan oleh Yang Berhormat Menteri dalam belanjawan tempoh hari dan
daripada 233 belum ada industri sawit yang dikenakan dalam Cukai Makmur ini.
Saya ingat Tuan Yang di-Pertua, semua perkara ini telah saya jawab, cuma ada
juga yang berbangkitkan berkaitan Petronas. Saya hendak beritahu Yang Berhormat Kota
Kinabalu, betul Yang Berhormat. Petronas membayar dividen kepada kerajaan, saya juga
hendak memaklumkan kepada Dewan, Petronas tidak pernah tidak menunaikan
tanggungjawab untuk bayar dividen kepada kerajaan.
Cumanya persoalan Yang Berhormat, hanya bayar RM25 bilion, mana yang lain?
Yang Berhormat, kita pun akui hasil negara hari ini bergantung sepenuhnya kepada
minyak dan minyak ini semakin hari semakin berkurangan. Sudah pasti lebihan
keuntungan yang diperolehi oleh Petronas akan digunakan untuk membuat inovasi-
inovasi dan eksplorasi yang baharu supaya berdaya saing Petronas ini dapat diteruskan,
supaya mereka dapat terus menunaikan tanggungjawab untuk memberi dividen kepada
kerajaan, itu yang pertama.
Akan tetapi Yang Berhormat, jangan hanya kita lihat kepada dividen semata-mata.
Ini kerana Petronas juga kena membayar Petroleum (Income Tax) Act (PITA). Mereka
kena juga kena bayar corporate income tax. Pegawai-pegawai atau pekerja-pekerja
mereka juga kena membayar income tax. Kalau kita lihat secara keseluruhan Yang
Berhormat, saya rasa kadar yang dibayar kepada kerajaan pada kali ini amat munasabah.
Sekiranya ada keperluan, sudah pasti pihak Kementerian Kewangan akan berbincang
dengan pihak Petronas untuk menaikkan dividen."
RANG UNDANG-UNDANG,"RANG UNDANG-UNDANG LEVI KEUNTUNGAN
LUAR BIASA (PINDAAN) 2022
Bacaan Kali Yang Kedua dan Ketiga",,1440,Tuan Chan Foong Hin [Kota Kinabalu],"Yang Berhormat Timbalan Menteri,
boleh saya tanya?"
RANG UNDANG-UNDANG,"RANG UNDANG-UNDANG LEVI KEUNTUNGAN
LUAR BIASA (PINDAAN) 2022
Bacaan Kali Yang Kedua dan Ketiga",,1440,Dato' Indera Mohd Shahar bin Abdullah,Boleh.
RANG UNDANG-UNDANG,"RANG UNDANG-UNDANG LEVI KEUNTUNGAN
LUAR BIASA (PINDAAN) 2022
Bacaan Kali Yang Kedua dan Ketiga",,1440,Tuan Chan Foong Hin [Kota Kinabalu],"Untuk levi keuntungan luar biasa ini
yang dikenakan kepada industri kelapa sawit. Pada tahun lalu sebanyak RM1.9 bilion
dikutip dan pada tahun ini setakat bulan Jun sejumlah RM2.1 bilion dikutip. Sabah
merupakan negeri pengeluar minyak yang terbesar di Malaysia ini. Biasanya sebanyak 24
peratus CPO dihasilkan di Sabah. So, berapakah nisbah atau peratusan daripada levi
keuntungan luar biasa ini untuk kilang kelapa sawit akan dikembalikan kepada Sabah?"
RANG UNDANG-UNDANG,"RANG UNDANG-UNDANG LEVI KEUNTUNGAN
LUAR BIASA (PINDAAN) 2022
Bacaan Kali Yang Kedua dan Ketiga",,1440,Dato' Indera Mohd Shahar bin Abdullah,"Yang Berhormat, telah saya
nyatakan tadi ke mana duit tersebut digerakkan, tetapi Yang Berhormat telah masuk
kepada topik 40 peratus. Jadi, 40 peratus Yang Berhormat tahu, sekarang ini tengah
berlaku perbincangan pihak Kerajaan Negeri Sabah dan Sarawak jadi tidak elok saya
mendahului perbincangan mereka. Terima kasih Yang Berhormat.
Tuan Yang di-Pertua, saya kira itu sahaja yang dapat saya rumuskan. Saya
ucapkan sekali lagi terima kasih banyak-banyak kepada Ahli-ahli Yang Berhormat yang
mengambil bahagian dalam Akta Levi Keuntungan Luar Biasa. Terima kasih Tuan Yang
di-Pertua, terima kasih Ahli-ahli Yang Berhormat."
RANG UNDANG-UNDANG,"RANG UNDANG-UNDANG LEVI KEUNTUNGAN
LUAR BIASA (PINDAAN) 2022
Bacaan Kali Yang Kedua dan Ketiga",,1440,Dato' Ramli bin Dato' Mohd Nor [Cameron Highlands],"Terima kasih Yang
Berhormat Menteri. Kita teruskan agenda selanjutnya. Ahli-ahli Yang Berhormat,
sekarang saya kemukakan masalah kepada Majlis bagi diputuskan. Masalahnya ialah
bahawa rang undang-undang ini dibaca kali yang kedua sekarang."
RANG UNDANG-UNDANG,"RANG UNDANG-UNDANG LEVI KEUNTUNGAN
LUAR BIASA (PINDAAN) 2022
Bacaan Kali Yang Kedua dan Ketiga",,1440,ANNOTATION,[Masalah dikemukakan bagi diputuskan; dan disetujukan]
RANG UNDANG-UNDANG,"RANG UNDANG-UNDANG LEVI KEUNTUNGAN
LUAR BIASA (PINDAAN) 2022
Bacaan Kali Yang Kedua dan Ketiga",,1440,ANNOTATION,"[Rang undang-undang dibacakan kali yang kedua dan diserahkan kepada Dewan
sebagai Jawatankuasa]"
RANG UNDANG-UNDANG,"RANG UNDANG-UNDANG LEVI KEUNTUNGAN
LUAR BIASA (PINDAAN) 2022
Bacaan Kali Yang Kedua dan Ketiga",,1440,ANNOTATION,[Majlis bersidang dalam Jawatankuasa]
RANG UNDANG-UNDANG,"RANG UNDANG-UNDANG LEVI KEUNTUNGAN
LUAR BIASA (PINDAAN) 2022
Bacaan Kali Yang Kedua dan Ketiga",,1440,ANNOTATION,"[Dato’ Ramli bin Dato’ Mohd Nor (Cameron Highlands) mempengerusikan
Jawatankuasa]"
RANG UNDANG-UNDANG,"RANG UNDANG-UNDANG LEVI KEUNTUNGAN
LUAR BIASA (PINDAAN) 2022
Bacaan Kali Yang Kedua dan Ketiga",,1440,ANNOTATION,[Fasal-fasal dikemukakan kepada Jawatankuasa]
RANG UNDANG-UNDANG,"RANG UNDANG-UNDANG LEVI KEUNTUNGAN
LUAR BIASA (PINDAAN) 2022
Bacaan Kali Yang Kedua dan Ketiga",,1440,ANNOTATION,"[Fasal-fasal 1 hingga 6 diperintahkan jadi sebahagian daripada rang undang-
undang]"
RANG UNDANG-UNDANG,"RANG UNDANG-UNDANG LEVI KEUNTUNGAN
LUAR BIASA (PINDAAN) 2022
Bacaan Kali Yang Kedua dan Ketiga",,1440,ANNOTATION,[Rang undang-undang dimaklumkan kepada Majlis sekarang]
RANG UNDANG-UNDANG,"RANG UNDANG-UNDANG LEVI KEUNTUNGAN
LUAR BIASA (PINDAAN) 2022
Bacaan Kali Yang Kedua dan Ketiga",,1440,ANNOTATION,[Majlis Mesyuarat bersidang semula]
RANG UNDANG-UNDANG,"RANG UNDANG-UNDANG LEVI KEUNTUNGAN
LUAR BIASA (PINDAAN) 2022
Bacaan Kali Yang Kedua dan Ketiga",,1440,ANNOTATION,"[Rang undang-undang dilaporkan dengan tidak ada pindaan; dibacakan kali yang
ketiga, disokong oleh Menteri Perusahaan, Perladangan dan Komoditi (Datuk Hajah
Zuraida binti Kamaruddin) dan diluluskan]"
RANG UNDANG-UNDANG,"RANG UNDANG-UNDANG LEVI KEUNTUNGAN
LUAR BIASA (PINDAAN) 2022
Bacaan Kali Yang Kedua dan Ketiga",,1440,Dato' Ramli bin Dato' Mohd Nor [Cameron Highlands],.
RANG UNDANG-UNDANG,"RANG UNDANG-UNDANG CUKAI JUALAN (PINDAAN) 2022
Bacaan Kali Yang Kedua dan Ketiga",,1449,Timbalan Menteri Kewangan I [Dato' Indera Mohd Shahar bin Abdullah],"Tuan Yang di-Pertua, saya mohon mencadangkan suatu akta untuk meminda Akta Cukai
Jualan 2022 dibacakan kali kedua sekarang.
Tuan Yang di-Pertua, Rang Undang-undang Cukai Jualan (Pindaan) 2022 yang
dicadangkan ini merupakan pindaan ke atas Akta Cukai Jualan 2018 [Akta 806]. Pindaan
yang dibuat ini secara asasnya melibatkan pindaan ke atas empat seksyen sedia ada dan
mewujudkan lima seksyen, satu jadual dan satu bahagian baharu di dalam akta tersebut.
Antara pindaan utama yang dibuat adalah bagi meluaskan skop kenaan Cukai
Jualan dengan mengenakan Cukai Jualan ke atas Barang Bernilai Rendah atau Low
Value Goods (LVG) yang dijual secara atas talian dan barang tersebut diimport masuk ke
Malaysia."
RANG UNDANG-UNDANG,"RANG UNDANG-UNDANG CUKAI JUALAN (PINDAAN) 2022
Bacaan Kali Yang Kedua dan Ketiga",,1450,Timbalan Menteri Kewangan I [Dato' Indera Mohd Shahar bin Abdullah],"Cadangan peluasan skop ini merupakan salah satu langkah di bawah inisiatif
kemampanan hasil yang telah diumumkan dalam pembentangan Bajet 2022.
Untuk makluman Ahli Yang Berhormat, pada masa ini, barang bernilai rendah iaitu
RM500 ke bawah tidak dikenakan sebarang cukai apabila ia diimport masuk ke dalam
Malaysia selaras dengan kemudahan de minimis, dengan izin. Namun begitu, didapati
cara ini menyebabkan layanan tidak adil, terutamanya kepada peniaga tempatan kerana
barang yang diimport dari luar negara tidak dikenakan cukai, sedangkan barang keluaran
tempatan tertakluk kepada kenaan cukai jualan pada kadar yang ditetapkan. Senario ini
tidak berbangkit kerana barang bernilai RM500 ke atas kerana ia tertakluk kepada kenaan
duti atau cukai berdasarkan kadar yang ditetapkan. Tiada sebarang kemudahan atau
pengecualian yang diberikan.
Tuan Yang di-Pertua, selain daripada layanan tidak adil, kemudahan de minimis
ini juga telah diambil kesempatan oleh pihak tertentu. Sebagai contoh, barang bernilai
tinggi di ikrar sebagai barang bernilai RM500 dan ke bawah bagi mengelakkan membayar
duti atau cukai dan menyebabkan kerugian kepada kerajaan. Berdasarkan maklumat
daripada pihak Kastam Diraja Malaysia, sebanyak 1,922 kesalahan pengingkaran
dagangan de minimis telah direkodkan bagi tahun 2020. Pada tahun 2021 pula, JKDM
berjaya mengutip semula duti atau cukai sebanyak dari 1,228 transaksi yang melibatkan
kesalahan pengingkaran barang de minimis. Manakala sehingga Jun 2022, sebanyak 276
kesalahan pengingkaran dengan jumlah duti cukai telah direkodkan.
Cadangan peluasan skop kenaan ini bukan merupakan langkah ke belakang dan
Malaysia bukanlah satu-satunya yang akan atau telah melaksanakan. Di peringkat global,
negara seperti Australia, New Zealand, United Kingdom dan Norway telah pun
mengenakan cukai sama ada GST atau VAT ke atas barang bernilai rendah. Singapura
juga telah melaksanakan perkara yang sama mulai 1 Januari 2023 di mana barang bernilai
SGD400 dikenakan GST pada kadar tujuh peratus.
Ahli Yang Berhormat, tindakan yang diambil oleh negara-negara ini adalah
selaras dengan perkembangan ekonomi semasa dan pihak Organisation for Economic
Co-operation and Development (OECD) melalui International VAT atau GST Guidelines
yang diterbitkan pada tahun 2017, juga menggariskan cadangan kenaan cukai tidak
langsung ke atas urus niaga yang melibatkan transaksi rentas sempadan dalam
menangani cabaran mencukai ekonomi e-dagang. Peluasan skop cukai jualan ini secara
tidak langsung dapat memberi hasil tambahan kepada kerajaan dengan anggaran kutipan
sebanyak RM200 juta. Tambahan hasil ini pasti akan digunakan sepenuhnya bagi
pembangunan negara dan akan memberi manfaat kepada rakyat terutamanya golongan
yang memerlukan.
Selain daripada pindaan tersebut Yang Berhormat, berkaitan dengan cadangan
pengenaan cukai jualan ke atas barang bernilai rendah tersebut, pindaan yang
dicadangkan dalam rang undang-undang ini juga berkaitan dengan kemudahan yang
disediakan kepada pengilang daripada aspek pelanjutan tempoh masa bagi
melaksanakan sesuatu obligasi atau pindaan ke atas terma dan syarat yang ditetapkan
dalam keadaan tertentu, pembatalan pendaftaran dan peremitan cukai bagi keadaan
tertentu. Terdapat juga pindaan tambahan lain yang bertujuan untuk memperjelas dan
memperkemaskan peruntukan sedia ada.
Tuan Yang di-Pertua, saya mohon untuk menghuraikan setiap fasal dalam rang
undang-undang ini. Rang undang-undang ini mempunyai 10 fasal seperti berikut.
Fasal 1 mengandungi tajuk ringkas dan tarikh permulaan kuat kuasa akta yang
dicadangkan. Fasal ini juga bertujuan untuk memberi Menteri kuasa untuk menetapkan
tarikh efektif untuk mengena dan melevikan cukai jualan ke atas barang bernilai rendah di
bawah akta yang dicadangkan.
Fasal 2 bertujuan memasukkan bahagian baharu IIIA dengan pengenaan cukai
jualan ke atas barang bernilai rendah dan seksyen baharu 11A, 11B, 11C dan 11D ke
dalam Akta 806.
Seksyen 11A yang dicadangkan mengandungi tarif bagi perkataan atau ungkapan
tertentu yang digunakan dalam Bahagian IIIA yang dicadangkan dan apa-apa peraturan
yang dibuat di bawah Akta 806 berhubung dengan bahagian itu. Seksyen 11B yang
dicadangkan mengadakan peruntukan bagi pemakaian Akta 806 sebagai mana yang
diubahsuai oleh Bahagian IIIA yang dicadangkan dan jadual baharu ke atas barang
bernilai rendah. Seksyen 11C yang dicadangkan mengadakan peruntukan bagi
pemakaian dalam wilayah dan luar wilayah Bahagian IIIA yang dicadangkan. Seksyen
11D yang dicadangkan memperkatakan tentang paparan maklumat pada bungkus barang
bernilai rendah.
Fasal 3 Tuan Yang di-Pertua, bertujuan untuk memasukkan subseksyen 19(5) ke
dalam Akta 806 bagi membolehkan Ketua Pegawai Kastam membatalkan pendaftaran
pengilang berdaftar setelah pengilang berdaftar membuat permohonan pembatalan.
Sekiranya Ketua Pengarah Kastam berpuas hati, pengilang berdaftar itu telah
dikecualikan daripada pendaftaran di bawah Akta 806.
Fasal 4 bertujuan untuk memasukkan seksyen baharu 57A yang
memperuntukkan bahawa sekiranya terdapat pengurangan dalam kuantiti barang
bercukai yang sepatutnya dijumpai dalam kawasan khas hendaklah dalam ketiadaan bukti
yang berlawanan, dianggap telah salah mengalih barang tersebut dan bertanggungan
untuk membayar cukai yang dilevikan ke atas barang yang dijumpai kurang tersebut.
Manakala subseksyen 57A(2) memperuntukkan bahawa jika pengurangan yang disebut
dalam subseksyen 57A(1) disebabkan oleh kebocoran, pecah atau kemalangan lain,
Ketua Pengarah boleh meremitkan keseluruhan atau mana-mana bahagian daripada
cukai jualan yang boleh dilevikan ke atas barang yang dijumpai kurang itu.
Fasal 5 Tuan Yang di-Pertua bertujuan untuk meminda perenggan 91(a) bagi
memasukkan rujukan kepada pekerja di bawah seksyen 89 Akta 806 berkenaan perlakuan
satu kesalahan di bawah seksyen 91 Akta 806.
Fasal 6 bertujuan untuk meminda seksyen 106 Akta 806 bagi memberi Menteri
kuasa untuk membuat peraturan mengenai perkara yang berhubung dengan barang
bernilai rendah.
Fasal 7 bertujuan memasukkan seksyen baharu 106A dan 106B ke dalam Akta
806. Seksyen 106A adalah untuk memberi kuasa kepada Menteri bagi melanjutkan
tempoh untuk melakukan perbuatan atau benda yang perlu disempurnakan dalam tempoh
tertentu di bawah Akta 806 sekiranya dia berpuas hati bahawa perbuatan atau benda itu
tidak dapat disempurnakan dalam tempoh itu disebabkan oleh berlakunya apa-apa
kecemasan awam atau krisis kesihatan awam. Manakala seksyen 106B adalah untuk
memberi Menteri kuasa untuk menambah, memotong, mengubah terma dan syarat yang
dikenakan menurut kuasa Akta 806 bagi maksud melaksanakan tujuan Akta 806 dengan
syarat bahawa notis munasabah diberikan kepada orang yang terikat dengan terma dan
syarat tersebut.
Fasal 8 Tuan Yang di-Pertua bertujuan untuk memasukkan jadual baharu ke
dalam Akta 806 yang menyatakan pengubahsuaian kepada peruntukan Akta 806 yang
terpakai kepada LVG. Peruntukan jadual antara lain mengubahsuai Akta 806 dengan
mengganti perkataan pengilang, pengilang berdaftar dan barang bercukai kepada penjual,
penjual berdaftar dan barang bernilai rendah.
Fasal 9 dan 10 bertujuan mengadakan peruntukan peralihan. Selain itu pindaan
lain yang tidak dinyatakan secara khusus merupakan pindaan kecil atau berbangkit.
Tuan Yang di-Pertua, saya mohon mencadangkan."
RANG UNDANG-UNDANG,"RANG UNDANG-UNDANG CUKAI JUALAN (PINDAAN) 2022
Bacaan Kali Yang Kedua dan Ketiga",,1450,Datuk Mohd Azis bin Jamman [Sepanggar],"Tuan Yang di-Pertua, saya bangun
di bawah Peraturan Mesyuarat 36 (12) mengelirukan Dewan. Saya mohon sedikit masa
kerana ini sangat penting Tuan Yang di-Pertua kerana Yang Berhormat Menteri
Kewangan sebelum ini telah memberikan satu jawapan kepada Yang Berhormat Sibuti
berkenaan dengan isu lantikan Ahli Lembaga Pengarah Lembaga Hasil Dalam Negeri.
Jawapan dia ringkas Tuan Yang di-Pertua, “Kementerian Kewangan masih sedang
meneliti aspek perundangan yang berkaitan dalam menimbang cadangan pelantikan wakil
yang berasal dari negeri Sabah dan negeri Sarawak dalam Lembaga Pengarah Hasil
Dalam Negeri”.
Tuan Yang di-Pertua, jawapan ini bukan saja mengelirukan, malah menghina,
merendahkan akal kami di dalam Dewan ini sebagai penggubal undang-undang. Kalau
saya rujuk kepada senarai terkini jawatan yang ada dalam Lembaga Hasil sekarang ini,
dia terdapat dua kekosongan Yang Berhormat Menteri yang mana kekosongan jawatan
ini saya rasa boleh diisi oleh wakil daripada Kerajaan Negeri Sabah dan juga wakil
daripada Kerajaan Negeri Sarawak.
Jadi kalau dilihat daripada jawapan Yang Berhormat Menteri ini seolah-olah
menggambarkan bahawa Sabah dan Sarawak itu tidak mempunyai kerajaan. Saya harap,
ia perlu diperjelaskan oleh Yang Berhormat Menteri kerana ini merupakan satu perkara
yang sering dibangkitkan oleh rakyat Sabah dan Sarawak, yang mana saya rasa ini
merupakan satu usaha untuk menidakkan hak kami.
Jawapan-jawapan yang diberi oleh Menteri Kewangan sentiasa menyakitkan hati
rakyat negeri Sabah dan Sarawak. Perkara seperti ini bukan sahaja baharu Tuan Yang
di-Pertua."
RANG UNDANG-UNDANG,"RANG UNDANG-UNDANG CUKAI JUALAN (PINDAAN) 2022
Bacaan Kali Yang Kedua dan Ketiga",,1450,Dato' Ramli bin Dato' Mohd Nor [Cameron Highlands],Yang Berhormat.
RANG UNDANG-UNDANG,"RANG UNDANG-UNDANG CUKAI JUALAN (PINDAAN) 2022
Bacaan Kali Yang Kedua dan Ketiga",,1450,Datuk Mohd Azis bin Jamman [Sepanggar],"Saya selalu bertanya jawapan ini
di dalam Dewan ini dan sering kali kita diberi jawapan yang ..."
RANG UNDANG-UNDANG,"RANG UNDANG-UNDANG CUKAI JUALAN (PINDAAN) 2022
Bacaan Kali Yang Kedua dan Ketiga",,1450,Dato' Ramli bin Dato' Mohd Nor [Cameron Highlands],"Yang Berhormat
Sepanggar, cuba ringkaskan. Direct to the point."
RANG UNDANG-UNDANG,"RANG UNDANG-UNDANG CUKAI JUALAN (PINDAAN) 2022
Bacaan Kali Yang Kedua dan Ketiga",,1500,Datuk Mohd Azis bin Jamman [Sepanggar],"Jadi saya minta jawapan yang
mengelirukan ini, saya harap Kementerian Kewangan perlu menjelaskan apa maksud dia
jawapan ini. Adakah Kerajaan Negeri Sabah dan Kerajaan Negeri Sarawak itu tidak
diiktiraf sebagai wakil daripada Kerajaan Sabah dan Sarawak? Oleh sebab terdapat dua
kekosongan, kita minta Kementerian Kewangan untuk menjelaskan perkara ini. Terima
kasih."
RANG UNDANG-UNDANG,"RANG UNDANG-UNDANG CUKAI JUALAN (PINDAAN) 2022
Bacaan Kali Yang Kedua dan Ketiga",,1500,Dato' Ramli bin Dato’ Mohd Nor [Cameron Highlands],"Okey. Yang Berhormat
Sepanggar, perkara Yang Berhormat Sepanggar bangkitkan itu saya rasa tidak mungkin
Yang Berhormat Menteri dapat menjawab on the spot."
RANG UNDANG-UNDANG,"RANG UNDANG-UNDANG CUKAI JUALAN (PINDAAN) 2022
Bacaan Kali Yang Kedua dan Ketiga",,1500,Datuk Mohd Azis bin Jamman [Sepanggar],"Faham, faham. Saya faham."
RANG UNDANG-UNDANG,"RANG UNDANG-UNDANG CUKAI JUALAN (PINDAAN) 2022
Bacaan Kali Yang Kedua dan Ketiga",,1500,Dato' Ramli bin Dato’ Mohd Nor [Cameron Highlands],"Jadi, saya mohon
dapat Yang Berhormat Sepanggar tuliskan secara hitam putih, nyatakan bahagian mana
dan sebagainya, forward-kan kepada pihak Dewan."
RANG UNDANG-UNDANG,"RANG UNDANG-UNDANG CUKAI JUALAN (PINDAAN) 2022
Bacaan Kali Yang Kedua dan Ketiga",,1500,Datuk Mohd Azis bin Jamman [Sepanggar],Terima kasih Tuan Yang di-Pertua.
RANG UNDANG-UNDANG,"RANG UNDANG-UNDANG CUKAI JUALAN (PINDAAN) 2022
Bacaan Kali Yang Kedua dan Ketiga",,1500,Dato' Ramli bin Dato’ Mohd Nor [Cameron Highlands],"Kita teruskan dengan
agenda kita. Ada sesiapa yang menyokong?"
RANG UNDANG-UNDANG,"RANG UNDANG-UNDANG CUKAI JUALAN (PINDAAN) 2022
Bacaan Kali Yang Kedua dan Ketiga",,1500,Timbalan Menteri Kesihatan I [Dato’ Dr. Haji Noor Azmi bin Ghazali],"Tuan
Yang di-Pertua, saya mohon menyokong."
RANG UNDANG-UNDANG,"RANG UNDANG-UNDANG CUKAI JUALAN (PINDAAN) 2022
Bacaan Kali Yang Kedua dan Ketiga",,1500,Dato' Ramli bin Dato’ Mohd Nor [Cameron Highlands],"Baik. Ahli-ahli Yang
Berhormat, masalah di hadapan Majlis ialah rang undang-undang bernama suatu Akta
untuk meminda Akta Cukai Jualan 2018 dibacakan kali yang kedua sekarang dan terbuka
untuk dibahaskan.
Mengikut senarai yang telah diberi kepada pihak Majlis, mereka yang akan
berbahas adalah Yang Berhormat Tebrau, Yang Berhormat Bukit Bendera, Yang
Berhormat Jerai, Yang Berhormat Papar, Yang Berhormat Rasah, Yang Berhormat
Sepang. Semuanya lima minit. Saya mulakan dengan Yang Berhormat Tebrau."
RANG UNDANG-UNDANG,"RANG UNDANG-UNDANG CUKAI JUALAN (PINDAAN) 2022
Bacaan Kali Yang Kedua dan Ketiga",,1501,Tuan Steven Choong Shiau Yoon [Tebrau],"Terima kasih Tuan Yang di-Pertua
mengizinkan saya sertai perbahasan RUU Akta Cukai Jualan 2018 (Pindaan) 2022. Saya
sudilah menyokong RUU ini kerana ia akan level the playing field dengan izin, antara
penjual tempatan dan penjual di luar Malaysia mengenai barangan yang bernilai rendah
yang banyak dibeli atas talian melalui Shopee atau Lazada dan sebagainya.
Saya ucap terima kasihlah kepada Kementerian Kewangan
kerana selalu mengemas kini peraturan-peraturan dan juga undang-undang untuk
memastikan apa yang dalam undang-undang adalah up-to-date, yang ikut keperluan
semasa. Akan tetapi, saya pun berharaplah Yang Berhormat Menteri yang menjaga
perundangan di dalam Pejabat Perdana Menteri pun lakukan yang sama untuk buat satu
usul atau mencadangkan untuk mengemas kini Perkara 48 (1)(e) di mana disebut kalau
seorang Ahli Dewan Rakyat akan hilang kelayakan untuk menjadi seorang Ahli Parlimen
sekiranya didenda melebihi RM2,000.
Itu adalah satu angka yang sudah lama tidak dikemas kini. Saya berharaplah
Yang Berhormat Menteri yang menjaga perundangan kalau dapat tahu, dapat buat satu
usul pada masa yang akan datang. Walaupun saya sokong tetapi saya ada soalan nak
beri kepada Yang Berhormat Timbalan Menteri untuk menjawab. Walaupun ini bagus,
tetapi kemungkinan rakyat di luar kena tahu dan jelas apa kesan kepada mereka. Jadi
soalan saya adalah, adakah ini akan menyebabkan inflasi semakin naik ketika rakyat
khususnya golongan B40 sedang cuba menyesuaikan diri dengannya. Sekiranya tidak,
minta Yang Berhormat Timbalan Menteri menunjukkan statistik untuk menyangkal
kebimbangan saya.
Kedua, bagaimana Jabatan Kastam Diraja Malaysia boleh memastikan kesemua
penjual tempatan dan di luar negara yang mengimport barangan bernilai rendah dapat
didaftarkan untuk dikenakan cukai jualan kepada pembeli? Jikalau tidak, tujuan untuk
adakan RUU ini tidak akan tercapai. Saya juga berharaplah Yang Berhormat Timbalan
Menteri boleh mengemukakan statistik kutipan cukai jualan dan cukai perkhidmatan
melalui pelaksanaan GST dan berapa kekurangan kutipan apabila GST dimansuhkan dan
digantikan dengan SST. Apa kekurangannya? Minta juga Yang Berhormat Timbalan
Menteri menyatakan statistik yang menunjukkan pelaksanaan GST menyebabkan
kenaikan harga barangan seperti mana yang didakwa oleh PH selama ini.
Sebaliknya, sekiranya GST tidak menyebabkan kenaikan harga barangan dan
GST berupaya meningkatkan kutipan cukai lebih tinggi dan efisien, bukankah itu alasan
yang baik untuk membawa balik GST pada masa yang sesuai? Kerajaan harus
menganjurkan libat urus dengan semua perusahaan dan saya yakin majoriti mereka lebih
menyokong pelaksanaan GST berbanding dengan SST..."
RANG UNDANG-UNDANG,"RANG UNDANG-UNDANG CUKAI JUALAN (PINDAAN) 2022
Bacaan Kali Yang Kedua dan Ketiga",,1501,Tuan Cha Kee Chin [Rasah],"Yang Berhormat Tebrau, boleh celah sikit?"
RANG UNDANG-UNDANG,"RANG UNDANG-UNDANG CUKAI JUALAN (PINDAAN) 2022
Bacaan Kali Yang Kedua dan Ketiga",,1501,Tuan Steven Choong Shiau Yoon [Tebrau],"Sekejap, biar saya habis dulu ya.
Alasannya mudah, pelaksanaan GST memerlukan semua yang menghasilkan barangan
mesti didaftarkan di bawah GST tetapi ia tidak perlu di dalam pelaksanaan SST. Ini
bermakna berlaku unlevel playing field dengan izin, di dalam SST. Selain daripada itu, di
bawah pelaksanaan SST, mereka yang berdaftar boleh memilih untuk tidak mengeluarkan
invois atau resit kepada pembeli. Tindakan mereka yang tidak bertanggungjawab ini
bertujuan untuk mengelak membayar cukai jualan atau cukai perkhidmatan seterusnya
menyebabkan berlakunya ketirisan hasil cukai. Ini tidak boleh berlaku di bawah
pelaksanaan GST. Ya, silakan Yang Berhormat Rasah."
RANG UNDANG-UNDANG,"RANG UNDANG-UNDANG CUKAI JUALAN (PINDAAN) 2022
Bacaan Kali Yang Kedua dan Ketiga",,1501,Tuan Cha Kee Chin [Rasah],"Yang Berhormat Tebrau, terima kasih kerana
memberi laluan. Saya tengok ucapan Yang Berhormat, dulu Yang Berhormat tak ada buat
tuduhan macam ini. Kata PH kata GST barang naik semua apabila Yang Berhormat
bersama dengan kami. Akan tetapi, lepas Yang Berhormat lompat, hujahan Yang
Berhormat itu jauh berbeza dan terbalik sama sekali. Saya rasa ini suatu yang sangat
mengelirukan rakyat bukan mengelirukan Dewan. Ini suatu yang saya terkejutlah Yang
Berhormat."
RANG UNDANG-UNDANG,"RANG UNDANG-UNDANG CUKAI JUALAN (PINDAAN) 2022
Bacaan Kali Yang Kedua dan Ketiga",,1501,Tuan Steven Choong Shiau Yoon [Tebrau],"Terima kasih Yang Berhormat
Rasah, beritahu apa Yang Berhormat rasa. Selama ini di PH, saya ada pendirian sendiri.
Saya tidak pernah dalam Dewan ini atau di dalam apa-apa ceramah, saya menyarankan
GST itu adalah tidak bagus. Itu pendirian saya. Pada bengkel tahun 2020 semasa saya
masih dalam PH, saya ada sebut dan pun sudah dilaporkan dalam media, saya kata saya
rindu kepada pelaksanaan GST dan Yang Berhormat Pontian pun kata terima kasih
kepada saya. Jadi, saya konsisten dalam pendirian saya, ya."
RANG UNDANG-UNDANG,"RANG UNDANG-UNDANG CUKAI JUALAN (PINDAAN) 2022
Bacaan Kali Yang Kedua dan Ketiga",,1501,Tuan Cha Kee Chin [Rasah],"Tahniah, tahniah Yang Berhormat Tebrau. Lepas
jadi katak lompat memang bagus hujahan itu. Rakyat akan dengar dan rakyat akan
menjadi saksi."
RANG UNDANG-UNDANG,"RANG UNDANG-UNDANG CUKAI JUALAN (PINDAAN) 2022
Bacaan Kali Yang Kedua dan Ketiga",,1501,Dato' Ramli bin Dato’ Mohd Nor [Cameron Highlands],Sila gulung.
RANG UNDANG-UNDANG,"RANG UNDANG-UNDANG CUKAI JUALAN (PINDAAN) 2022
Bacaan Kali Yang Kedua dan Ketiga",,1501,Tuan Steven Choong Shiau Yoon [Tebrau],"Saya tidak mengelirukan. Itu
pendirian saya sendiri selama ini."
RANG UNDANG-UNDANG,"RANG UNDANG-UNDANG CUKAI JUALAN (PINDAAN) 2022
Bacaan Kali Yang Kedua dan Ketiga",,1501,Tuan Cha Kee Chin [Rasah],"Bagus, bagus. Tahniahlah. Itu menunjukkan
kenapa Yang Berhormat lompat"
RANG UNDANG-UNDANG,"RANG UNDANG-UNDANG CUKAI JUALAN (PINDAAN) 2022
Bacaan Kali Yang Kedua dan Ketiga",,1501,ANNOTATION,[Pembesar suara dimatikan]
