level_1,level_2,level_3,timestamp,author,speech
RANG UNDANG-UNDANG,"RANG UNDANG-UNDANG CUKAI PERKHIDMATAN
(PINDAAN) 2022
Bacaan Kali Yang Kedua dan Ketiga",,1614,Tuan Ma'mun bin Sulaiman [Kalabakan],"Terima kasih Tuan Yang di-Pertua
atas peluang yang diberikan kepada Kalabakan untuk turut serta dalam perbahasan Rang
Undang-undang Cukai Perkhidmatan (Pindaan) 2022.
Tuan Yang di-Pertua, saya meneliti pembentangan Yang Berhormat Timbalan
Menteri atas RUU ini. Sebagai permulaan, saya ingin bertanya apakah pandangan
kerajaan mengenai cadangan yang diberikan oleh pakar-pakar percukaian dan pemain
industri mengenai penggabungan Akta Cukai Barang dan Perkhidmatan (GST) dan Akta
Cukai Jualan dan Perkhidmatan (SST) sedia ada bagi menambah baik sistem cukai
semasa di negara ini.
Perihal penyeludupan dan ketirisan cukai − saya mendengar jawapan daripada
Yang Berhormat Timbalan Menteri Kewangan dari Sipitang semalam mengenai anggaran
kehilangan pendapatan daripada penyeludupan tahun lalu berjumlah RM800 juta. Soalan
saya, melalui sembilan rang undang-undang yang dibawa oleh Kementerian Kewangan
hari ini dan semalam, adakah aktiviti penyeludupan ini dapat dikurangkan dengan
mengimplementasikan undang-undang yang diluluskan? Dengan pindaan kepada Akta
Cukai Jualan dan Akta Cukai Perkhidmatan ini, berapakah anggaran penambahan hasil
yang bakal dikutip oleh kerajaan?
Di bawah SST semasa, terdapat kira-kira 800 item atau barang yang dikenakan
kadar jualan lima peratus dan 5,600 item lagi dikenakan 10 peratus. Manakala, di bawah
GST sebelum ini 11,000 item dikenakan cukai. Soalan saya, melalui pindaan Akta Cukai
Jualan dan Akta Cukai Perkhidmatan hari ini, berapakah jumlah item yang akan dikenakan
cukai setelah RUU ini telah diluluskan?
Saya juga ingin tahu sejak SST dilaksanakan semula menggantikan GST pada
tahun 2018 dan sejak itu, berapakah jumlah item yang dikenakan cukai pada tahun
tersebut dan hari ini? Berapakah jumlah item tambahan yang dimasukkan dalam senarai
SST? Mohon juga diperjelaskan apakah kategori barangan dan perkhidmatan yang paling
banyak dimasukkan dalam senarai SST.
Saya terus kepada fasal-fasal dalam rang undang-undang ini. Pertama, pindaan
seksyen 26A. Akta Cukai Perkhidmatan 2018"
RANG UNDANG-UNDANG,"RANG UNDANG-UNDANG CUKAI PERKHIDMATAN
(PINDAAN) 2022
Bacaan Kali Yang Kedua dan Ketiga",,1614,ANNOTATION,[Akta 807]
RANG UNDANG-UNDANG,"RANG UNDANG-UNDANG CUKAI PERKHIDMATAN
(PINDAAN) 2022
Bacaan Kali Yang Kedua dan Ketiga",,1614,Tuan Ma'mun bin Sulaiman [Kalabakan],"yang disebut Akta Ibu dalam akta
ini dipinda dalam teks bahasa kebangsaan dalam subseksyen 26A(1) dengan
menggantikan perkataan ‘perkhidmatan bercukai’ dengan perkataan ‘perkhidmatan
bercukai diimport’. Mohon penjelasan, panduan berkenaan perkhidmatan bercukai
diimport telah dikeluarkan pada 9 Januari 2019. Namun, hari ini pada tahun 2022 ini,
melalui pindaan ini kita baru ingin memasukkan perkataan ‘perkhidmatan bercukai
diimport’. Bagaimana ini boleh berlaku? Saya mohon penjelasan.
Kedua, seksyen baharu 38A. Pembayaran balik cukai perkhidmatan dan
sebagainya kepada orang berdaftar asing. Mohon penjelasan, berapakah tempoh bayaran
balik yang ditetapkan dan bagaimana kerajaan ingin memastikan agar tiada sebarang isu
tunggakan yang boleh mencemarkan reputasi negara?
Ketiga, seksyen 90A dan seksyen 90B – kecemasan awam, krisis kesihatan awam
dan notis munasabah. Mohon agar definisi atau tafsiran mengenai ‘kecemasan awam’
diperjelaskan secara spesifik dengan contoh-contoh kejadian. Begitu juga dengan
seksyen 90B mengenai ‘notis munasabah’. Apakah maksud ‘notis munasabah’? Adakah
notis serta-merta dianggap munasabah? Beberapa hari notis yang dikeluarkan dianggap
sebagai notis munasabah? Apa yang dianggap sebagai ‘notis munasabah’? Saya mohon
penjelasan.
Terakhir dan keempat, cukai perkhidmatan yang dikutip di Sabah. Setiap tahun
dipertanyakan mengenai berapa jumlah cukai yang dikutip dari Sabah tetapi tidak pernah
dijawab. Terbaru, jawapan yang diberi oleh Yang Berhormat Menteri Kewangan atas
soalan Yang Berhormat Semporna pada 26 Julai 2022 tidak memberikan apa-apa indikasi
atau jawapan yang tuntas terhadap jumlah kutipan cukai dari negeri Sabah. Rakyat Sabah
juga berhak untuk dapatkan informasi yang lengkap terutamanya kutipan cukai yang
dihasilkan dari negeri Sabah. Sekian terima kasih."
RANG UNDANG-UNDANG,"RANG UNDANG-UNDANG CUKAI PERKHIDMATAN
(PINDAAN) 2022
Bacaan Kali Yang Kedua dan Ketiga",,1614,Tuan Yang di-Pertua,"Terima kasih Yang Berhormat Kalabakan. Akhir sekali
Yang Berhormat Tumpat, silakan."
RANG UNDANG-UNDANG,"RANG UNDANG-UNDANG CUKAI PERKHIDMATAN
(PINDAAN) 2022
Bacaan Kali Yang Kedua dan Ketiga",,1618,Dato' Haji Che Abdullah bin Mat Nawi [Tumpat],"Terima kasih Tuan Yang di-
Pertua. Akhirnya setelah beberapa kali saya mencuba untuk bangun dan berbahas,
akhirnya diberi kesempatan pada petang ini dalam untuk membahaskan suatu akta bagi
meminda Akta Cukai Perkhidmatan 2018, (Pindaan) 2022.
Saya ingin membangkitkan beberapa persoalan dalam akta ini. Pertama,
mengambil kesempatan daripada peluang perbahasan ini, saya ucapkan tahniah kepada
kerajaan atas usaha penambahbaikan SST. Umum mengetahui bahawa masalah utama
SST adalah liputan yang tidak meluas, bukan seperti GST yang lebih menyeluruh.
Saya yakin keutamaan kerajaan ketika ini adalah terhadap aspek hakisan dalam
percukaian bagi mengelak pihak tertentu terlepas daripada membayar cukai. Kementerian
seharusnya melakukan semakan bagi memastikan sistem SST ini menutup sebarang
kelompangan dan kelemahan yang menyebabkan masih ada pihak yang dapat lari
daripada dikenakan cukai SST ini setelah empat tahun beroperasi."
RANG UNDANG-UNDANG,"RANG UNDANG-UNDANG CUKAI PERKHIDMATAN
(PINDAAN) 2022
Bacaan Kali Yang Kedua dan Ketiga",,1620,Dato' Haji Che Abdullah bin Mat Nawi [Tumpat],"Tuan Yang di-Pertua, SST seharusnya menjadi cukai yang lebih progresif yang
menjadi fokus lebih kepada kumpulan berpendapatan tinggi yang mampu untuk
membayar cukai dengan pelaksanaan cukai lebih tinggi untuk barangan mewah dan
mengurangkan cukai atau meniadakan cukai untuk pengguna yang berpendapatan
rendah.
Tuan Yang di-Pertua, harga semua kereta baharu kembali kepada asal selepas
pengecualian cukai jualan dan perkhidmatan SST yang berakhir pada 30 Jun 2022
dengan jangkaan kenaikan sehingga 10 peratus bagi model pemasangan tempatan dan
sekitar lima peratus bagi model import sepenuhnya. Saya difahamkan bahawa Proton
Nasional menjangkakan jumlah tempahan akan berkurangan mendadak pada bulan Julai
dan seterusnya.
Dengan iklim ekonomi yang belum stabil, kebimbangan kita bahawa jika
pengecualian ini tidak diteruskan, kita akan menyaksikan jualan kereta nasional dalam
negara akan terjejas. Oleh itu, saya ingin menggesa kerajaan melanjutkan sepenuhnya
ataupun menimbangkan bagi pelanjutan sepenuhnya insentif pengecualian cukai jualan
dan perkhidmatan SST bagi merancakkan industri seterusnya merancakkan ekonomi.
Tuan Yang di-Pertua, seterusnya saya ingin mendapat penjelasan daripada pihak
kerajaan. Adakah benar sistem GST lebih baik daripada SST sebagai sistem percukaian.
Saya ingin merujuk kepada pendapat beberapa orang pakar ekonomi yang mengatakan
GST berbanding SST mempunyai model percukaian yang adil, cekap dan sesuai untuk
menutup jurang kewangan kerajaan dan mengelakkan ketirisan. Bahkan sehingga kini,
lebih 170 buah negara menggunakan sistem percukaian ini di seluruh dunia.
Oleh itu, saya ingin mengetahui sama ada kementerian membuat kajian yang
komprehensif berkenaan modul sistem percukaian mana lebih baik dan apakah kerajaan
berhasrat untuk memperkenalkan semula GST. Jadi, saya mohon penjelasan daripada
kerajaan dan mohon menyokong. Terima kasih."
RANG UNDANG-UNDANG,"RANG UNDANG-UNDANG CUKAI PERKHIDMATAN
(PINDAAN) 2022
Bacaan Kali Yang Kedua dan Ketiga",,1620,Tuan Yang di-Pertua,"Terima kasih Yang Berhormat Tumpat. Saya tidak tahu
apa Timbalan saya buat. Akan tetapi kalau saya Pengerusikan, saya selalu bagi laluan
pada Yang Berhormat Tumpat."
RANG UNDANG-UNDANG,"RANG UNDANG-UNDANG CUKAI PERKHIDMATAN
(PINDAAN) 2022
Bacaan Kali Yang Kedua dan Ketiga",,1620,Dato’ Haji Che Abdullah bin Mat Nawi [Tumpat],"Terima kasih, Tuan Yang di-
Pertua."
RANG UNDANG-UNDANG,"RANG UNDANG-UNDANG CUKAI PERKHIDMATAN
(PINDAAN) 2022
Bacaan Kali Yang Kedua dan Ketiga",,1620,Tuan Yang di-Pertua,"Tiada lagi ya? Saya menjemput Yang Berhormat Timbalan
Menteri untuk menjawab. Silakan."
RANG UNDANG-UNDANG,"RANG UNDANG-UNDANG CUKAI PERKHIDMATAN
(PINDAAN) 2022
Bacaan Kali Yang Kedua dan Ketiga",,1622,Timbalan Menteri Kewangan I [Dato’ Indera Mohd Shahar bin Abdullah],"Terima kasih Tuan Yang di-Pertua. Terima kasih Ahli-ahli Yang Berhormat yang telah
mengambil bahagian dalam pindaan Akta Cukai Perkhidmatan.
Tuan Yang di-Pertua, izinkan saya menjawab satu persatu dan mungkin ada
jawapan-jawapan saya ini terkait dengan mana-mana Ahli Yang Berhormat yang
bangkitkan.
Saya hendak pergi yang pertamanya, memberi penjelasan berkaitan perkara-
perkara yang dibangkitkan di bawah seksyen 38A iaitu memberi kuasa kepada Ketua
Pengarah untuk membuat bayaran balik. Ini perkara yang penting.
Sekejap, Tuan Yang di-Pertua..."
RANG UNDANG-UNDANG,"RANG UNDANG-UNDANG CUKAI PERKHIDMATAN
(PINDAAN) 2022
Bacaan Kali Yang Kedua dan Ketiga",,1622,ANNOTATION,[Meneguk air]
RANG UNDANG-UNDANG,"RANG UNDANG-UNDANG CUKAI PERKHIDMATAN
(PINDAAN) 2022
Bacaan Kali Yang Kedua dan Ketiga",,1622,Datuk Seri Haji Shamsul Iskandar @ Yusre bin Haji Mohd Akin [Hang Tuah Jaya],Minum dahulu.
RANG UNDANG-UNDANG,"RANG UNDANG-UNDANG CUKAI PERKHIDMATAN
(PINDAAN) 2022
Bacaan Kali Yang Kedua dan Ketiga",,1622,Dato’ Indera Mohd Shahar bin Abdullah,"Tuan Yang di-Pertua, yang
dibangkitkan adalah- adakah ia memberi kesan negatif kepada peniaga. Ia tidak. Kepada
Ahli Yang Berhormat Rasah dan Ahli Yang Berhormat daripada Tebrau.
Sebenarnya, apabila kita mewujudkan seksyen 38A ini, kita memberi kuasa
kepada Ketua Pengarah. OBA ini Orang Berdaftar Asing. Sebenarnya ada lebihan cukai
yang kita kena bayar balik kepada OBA-OBA ini. Akan tetapi dengan peruntukan sedia
ada, sebab di Kementerian Kewangan melalui Jabatan Kastam Negara Malaysia sudah
ada permohonan-permohonan yang untuk mereka minta supaya jangan pulangkan balik
duit itu. Bawa ke hadapan. Akan tetapi dalam peruntukkan sedia ada tidak dibenarkan
kerana disebabkan nilai tukar wang asing dengan beberapa faktor dan jumlah untuk kita
pulangkan balik itu kecil. RM10, RM50, RM100.
Jadi, kita buat seksyen ini merupakan tujuan untuk membantu pihak peniaga
orang yang berdaftar asing ini supaya mereka dapat kemudahan. Kemudahan ini sudah
pasti memberi kesan yang baik kepada ekonomi negara. Tidak timbullah isu seperti mana
yang dibangkitkan oleh Yang Berhormat Rasah tadi KP memegang bayaran balik. Klausa
ini sebenarnya tidak memberi kesan negatif seperti mana saya sebutkan tadi kerana
peniaga tidak mahu terima refund. Dia meminta bawa bring foward dia punya itu untuk
taksiran yang akan datang.
Yang Berhormat Tebrau juga ada membangkitkan, adakah peniaga perlu
mendaftar jika membuat satu transaksi tetapi melebihi RM500 ribu?
Untuk makluman Yang Berhormat, masih perlu berdaftar kerana nilai
perkhidmatan yang diberikan adalah lebih RM500 walaupun sekali sahaja. Ia sudah
melepasi syor seperti mana yang selalu saya maklumkan dalam bacaan kali kedua
sebentar tadi. Yang Berhormat Tebrau juga bangkitkan fasal 3, kuasa Ketua Pengarah
untuk bayaran balik jika dilakukan bermaksud syarikat akan menerima perkhidmatan
Malaysia.
Seperti mana yang saya sebut dalam jawapan kepada Yang Berhormat Rasah
sebentar tadi. Tiada isu kerana untuk service provider untuk tidak enggan menerima
perkhidmatan digital.
Fasal 5, mengenai pemberhentian tanggungan. Bagaimanakah service provider
memberi servis setahun sekali dan melebihi nilai ambang?
Untuk makluman Yang Berhormat, sekiranya service provider telah mencapai nilai
ambang, memberi perkhidmatan digital sekali setahun, mereka masih perlu berdaftar
dengan perkhidmatan ke atas perkhidmatan.
Yang Berhormat Kalabakan tiada. Bertanyakan perkara ini. Saya minta nanti saya
akan berikan jawapan secara bertulis.
Fasal 2 juga dibangkitkan seksyen 26A(1). Dia punya jawapan menyelaras
dengan bahasa Inggeris. Ini merupakan editorial punya enakmen sahaja, Yang
Berhormat.
Yang Berhormat Rasah saya sudah jawab. Fasiliti pada peniaga.
Yang Berhormat Tebrau pun saya sudah sentuh. 90A- 90B seperti mana pindaan-
pindaan yang telah saya nyatakan sebentar tadi.
Saya juga hendak menyentuh perkara yang disebut oleh banyak Ahli Yang
Berhormat dan Ahli Yang Berhormat Bagan tadi ada minta saya bagikan data berkaitan
kutipan SST.
Izinkan saya, Tuan Yang di-Pertua, untuk memberi sedikit penjelasan berkaitan
kutipan SST selepas kita mansuhkan GST.
Untuk makluman Ahli Yang Berhormat, statistik kutipan cukai jualan dan cukai
perkhidmatan berdasarkan data dari 1 September 2018 sehingga 30 Jun 2022 adalah
sebanyak RM98.7 bilion. Kalau kita hendak membandingkan anggaran GST yang
memberi hasil lebih kurang RM40 bilion setahun, maka empat tahun anggaran hasil GST
sebanyak RM160 bilion. Ahli Yang Berhormat Rasah, kita kekurangan lagi RM62 bilion
untuk kita tampung.
Sama ada isu dia mana kerajaan atau tidak kerajaan, itu bukan saya hendak
jawab dekat sini. Cumanya apa saya faham dan saya dimaklumkan oleh pihak Kastam
Diraja Malaysia, SST ini single stage. GST pun multistage.
Saya lihat semalam semasa Yang Berhormat Timbalan Menteri Kewangan II
menjawab, ramai yang minta supaya dalam pindaan-pindaan tersebut masukkan elemen-
elemen. Tidak boleh. SST kita tidak boleh buat seperti mana GST kerana GST multistage.
Ramai tanya, adakah GST boleh menurunkan harga? Saya tidak boleh bagi tahu
naik atau turun kerana faktor harga, faktor inflasi ini bukan tertumpu sahaja pada cukai. Ia
juga ada melibatkan supply side dan demand side. Dahulu mungkin Tuan Yang di-Pertua,
hanya daripada segi supply side, dengan izin. Sekarang sudah ada tanda-tanda bahawa
ada demand side juga menyumbang kepada kedudukan nilai inflasi."
RANG UNDANG-UNDANG,"RANG UNDANG-UNDANG CUKAI PERKHIDMATAN
(PINDAAN) 2022
Bacaan Kali Yang Kedua dan Ketiga",,1622,Tuan Cha Kee Chin [Rasah],Yang Berhormat Timbalan Menteri.
RANG UNDANG-UNDANG,"RANG UNDANG-UNDANG CUKAI PERKHIDMATAN
(PINDAAN) 2022
Bacaan Kali Yang Kedua dan Ketiga",,1622,Dato’ Indera Mohd Shahar bin Abdullah,"Sekejap ya. Saya yakin kalau
peniaga-peniaga berdisiplin, sudah pasti kita dapat keuntungan daripada skim atau cukai
GST yang kita laksanakan tempoh hari. Cuma perkara yang berbangkit fasal claim ini. Kita
akui itu sebabnya, Tuan Yang di-Pertua, untuk kita laksanakan apa-apa tindakan cukai
untuk menampung hasil negara yang berkurangan ini, kita akan buat libat urus secara
menyeluruh, dan kita akan lihat satu per satu kelemahan pelaksanaan cukai tempoh hari.
Terima kasih."
RANG UNDANG-UNDANG,"RANG UNDANG-UNDANG CUKAI PERKHIDMATAN
(PINDAAN) 2022
Bacaan Kali Yang Kedua dan Ketiga",,1622,Tuan Cha Kee Chin [Rasah],"Yang Berhormat Timbalan Menteri, merujuk
kepada jawapan Yang Berhormat Timbalan Menteri tadi. Kutipan sebenar yang telah
dikutip sehingga 30 Jun sebanyak RM98.7 bilion. Akan tetapi kalau GST setahun RM40
bilion. Maknanya RM160 bilion. Ia menunjukkan kekurangan ataupun pengurangan hasil
kerajaan lebih kurang dalam 35 hingga 40 peratus daripada kutipan SST kalau berbanding
dengan GST.
Saya hendak tanya. Pandemik yang berlaku dengan PKP sebelum ini. Adakah
ada kesan terhadap pengurangan ini. Sebab saya nampak pengurangan ini agak besar
jurangnya. Jumlah 35 to 40 percent yang mana bagi saya satu yang baiknya rakyat tidak
payah bayar lebih. Beban rakyat semua kita dapat kurangkan dengan pelaksanaan SST
ini. Cuma apakah ada sumbangan faktor pandemik COVID-19 dan juga PKP sebelum ini?
Terima kasih, Tuan Yang di-Pertua."
RANG UNDANG-UNDANG,"RANG UNDANG-UNDANG CUKAI PERKHIDMATAN
(PINDAAN) 2022
Bacaan Kali Yang Kedua dan Ketiga",,1630,Dato' Indera Mohd Shahar bin Abdullah,"Apa Yang Berhormat Rasah cuba
memberi penerangan, saya faham. Mungkin sebab RM98.7 bilion itu sebab pandemik
tetapi Yang Berhormat ini cukai jualan dan cukai perkhidmatan. Ia bukan cukai korporat,
ia bukan cukai pendapatan, ia kita cukaikan kepada transaksi perniagaan. Pada waktu
COVID-19 ini, perniagaan masih berlarutan. Memang betul ada perniagaan-perniagaan
yang terkesan tetapi Yang Berhormat juga setuju dengan saya ada juga perniagaan-
perniagaan yang sampai Yang Berhormat minta kita buat levi keuntungan luar biasa
sebentar tadi, Yang Berhormat.
Jadi, saya harap perbincangan kita harus adil kerana perkara-perkara yang saya
nyatakan ini adalah berdasarkan fakta. Saya tidak mempolitikkan perkara ini. Tuan Yang
di-Pertua, terima kasih."
RANG UNDANG-UNDANG,"RANG UNDANG-UNDANG CUKAI PERKHIDMATAN
(PINDAAN) 2022
Bacaan Kali Yang Kedua dan Ketiga",,1630,Tuan Yang di-Pertua,"Terima kasih, Yang Berhormat Timbalan Menteri. Ahli-
ahli Yang Berhormat, sekarang saya kemukakan masalah kepada Majlis bagi diputuskan.
Masalahnya ialah bahawa rang undang-undang ini dibacakan kali yang kedua sekarang."
RANG UNDANG-UNDANG,"RANG UNDANG-UNDANG CUKAI PERKHIDMATAN
(PINDAAN) 2022
Bacaan Kali Yang Kedua dan Ketiga",,1630,ANNOTATION,[Masalah dikemukakan bagi diputuskan; dan disetujukan]
RANG UNDANG-UNDANG,"RANG UNDANG-UNDANG CUKAI PERKHIDMATAN
(PINDAAN) 2022
Bacaan Kali Yang Kedua dan Ketiga",,1630,ANNOTATION,"[Rang undang-undang dibacakan kali yang kedua dan diserahkan kepada Dewan
sebagai Jawatankuasa]"
RANG UNDANG-UNDANG,"RANG UNDANG-UNDANG CUKAI PERKHIDMATAN
(PINDAAN) 2022
Bacaan Kali Yang Kedua dan Ketiga",,1630,ANNOTATION,[Majlis bersidang dalam Jawatankuasa]
RANG UNDANG-UNDANG,"RANG UNDANG-UNDANG CUKAI PERKHIDMATAN
(PINDAAN) 2022
Bacaan Kali Yang Kedua dan Ketiga",,1630,ANNOTATION,[Tuan Yang di-Pertua mempengerusikan Jawatankuasa]
RANG UNDANG-UNDANG,"RANG UNDANG-UNDANG CUKAI PERKHIDMATAN
(PINDAAN) 2022
Bacaan Kali Yang Kedua dan Ketiga",,1630,ANNOTATION,[Fasal-fasal dikemukakan kepada Jawatankuasa]
RANG UNDANG-UNDANG,"RANG UNDANG-UNDANG CUKAI PERKHIDMATAN
(PINDAAN) 2022
Bacaan Kali Yang Kedua dan Ketiga",,1630,ANNOTATION,"[Fasal-fasal 1 hingga 7 diperintahkan jadi sebahagian daripada rang undang-
undang]"
RANG UNDANG-UNDANG,"RANG UNDANG-UNDANG CUKAI PERKHIDMATAN
(PINDAAN) 2022
Bacaan Kali Yang Kedua dan Ketiga",,1630,ANNOTATION,[Rang undang-undang dimaklumkan kepada Majlis sekarang]
RANG UNDANG-UNDANG,"RANG UNDANG-UNDANG CUKAI PERKHIDMATAN
(PINDAAN) 2022
Bacaan Kali Yang Kedua dan Ketiga",,1630,ANNOTATION,[Majlis Mesyuarat bersidang semula]
RANG UNDANG-UNDANG,"RANG UNDANG-UNDANG CUKAI PERKHIDMATAN
(PINDAAN) 2022
Bacaan Kali Yang Kedua dan Ketiga",,1630,ANNOTATION,"[Rang undang-undang dilaporkan dengan tidak ada pindaan; dibacakan kali yang
ketiga, disokong oleh Timbalan Menteri Pengangkutan (Dato’ Henry Sum Agong) dan
diluluskan]"
USUL-USUL MENTERI KEWANGAN,"AKTA TATACARA KEWANGAN 1957 [AKTA 61]
Menukar Baki Pinjaman Kerajaan Malaysia Kepada FELCRA",,1633,Timbalan Menteri Kewangan I [Dato' Indera Mohd Shahar bin Abdullah],"Bismillahi Rahmani Rahim. Assalamualaikum warahmatullahi wabarakatuh. Tuan Yang
di-Pertua, saya mohon mencadangkan:-
“Bahawa Majlis ini, mengikut perenggan 8(3)(a)(iv) Akta
Tatacara Kewangan 1957 [Akta 61], mengambil ketetapan bersetuju
supaya kerajaan melalui Menteri Kewangan (Diperbadankan) membuat
pelaburan dengan menukar baki pinjaman Kerajaan Malaysia sebanyak
RM969,268,000 kepada FELCRA Berhad (FELCRA), sebuah syarikat
dimiliki sepenuhnya oleh Menteri Kewangan (Diperbadankan) kepada
ekuiti bersamaan Sembilan Ratus Enam Puluh Sembilan Juta Dua Ratus
Enam Puluh Lapan Ribu (969,268,000) unit syer biasa pada nilai RM1
bagi satu unit syer yang dibentangkan di hadapan Majlis ini bagi tahun
2022 disahkan.”
Tuan Yang di-Pertua, saya mohon usul untuk Dewan ini mengambil ketetapan di
bawah perenggan 8(3)(a)(iv) Akta Tatacara Kewangan 1957 [Akta 61] untuk bersetuju
supaya Kerajaan Malaysia melalui Menteri Kewangan (Diperbadankan) membuat
pelaburan dengan menukar pinjaman kerajaan sebanyak RM969,268,000 kepada
FELCRA Berhad (FELCRA) sebuah syarikat yang dimiliki oleh Menteri Kewangan
(Diperbadankan) kepada ekuiti dalam FELCRA bersamaan Sembilan Ratus Enam Puluh
Sembilan Juta Dua Ratus Enam Puluh Lapan Ribu unit syer biasa kepada nilai RM1 bagi
satu unit syer.
Tuan Yang di-Pertua, mengikut peruntukan di bawah perenggan 8(3)(a)(iv) Akta
Tatacara Kewangan 1957 [Akta 61], Menteri Kewangan boleh membuat pelaburan wang
dalam kedudukan kredit persekutuan dengan mana-mana bank atau selainnya dipegang
oleh Persekutuan selepas dibenarkan oleh resolusi Dewan Rakyat. Sehubungan dengan
itu, persetujuan Dewan yang mulia ini adalah dipohon bagi membolehkan Kerajaan
Malaysia membuat pelaburan dalam FELCRA dengan menukarkan status pinjaman
Kerajaan Malaysia berjumlah RM969,268,000 kepada ekuiti melalui pemilikan syer.
Tujuan pinjaman ini ditukarkan kepada ekuiti adalah bagi meningkatkan nilai
perniagaan dengan izin, enterprise value, memperbaiki kunci kira-kira, balance sheet
dengan izin, dan nisbah penggearan (gear ratio) FELCRA. Hal ini dapat membantu pihak
FELCRA untuk memohon pinjaman kepada institusi kewangan atau pasaran modal untuk
membiayai projek-projek komersialnya dan berupaya beroperasi secara mandiri dan
mampan pada masa akan datang selaras dengan objektif transformasinya.
Sehingga kini, FELCRA telah memajukan seluas 203,953 hektar ladang bagi
pihak 108,122 orang peserta merangkumi 1,366 buah projek penyatuan dan pemulihan
serta 32,265 hektar estet milik FELCRA. Seramai 107,066 orang atau 99 peratus peserta
adalah daripada golongan B40 dan rata-ratanya tidak mempunyai pendapatan tetap.
Tuan Yang di-Pertua, saya mohon mencadangkan."
USUL-USUL MENTERI KEWANGAN,"AKTA TATACARA KEWANGAN 1957 [AKTA 61]
Menukar Baki Pinjaman Kerajaan Malaysia Kepada FELCRA",,1633,Timbalan Menteri Pertahanan [Dato' Sri Ikmal Hisham bin Abdul Aziz],"Saya
menyokong."
USUL-USUL MENTERI KEWANGAN,"AKTA TATACARA KEWANGAN 1957 [AKTA 61]
Menukar Baki Pinjaman Kerajaan Malaysia Kepada FELCRA",,1633,Tuan Yang di-Pertua,"Terima kasih, Yang Berhormat Timbalan Menteri. Ahli-
ahli Yang Berhormat, masalah sekarang ini terbuka untuk di bahas. Ada tiga orang
pembahas. Dimulakan oleh Yang Berhormat Kuala Selangor, diikuti oleh Yang Berhormat
Hang Tuah Jaya dan akhir sekali Yang Berhormat Pokok Sena. Silakan."
USUL-USUL MENTERI KEWANGAN,"AKTA TATACARA KEWANGAN 1957 [AKTA 61]
Menukar Baki Pinjaman Kerajaan Malaysia Kepada FELCRA",,1637,Datuk Seri Dr. Haji Dzulkefly bin Ahmad [Kuala Selangor],"Terima kasih Tuan
Yang di-Pertua. Saya terpanggil untuk memberi sedikit pandangan saya atas permintaan
untuk Dewan Rakyat ini memberi kelulusan bagi melalui penggantian ataupun menjadikan
pinjaman yang diberikan kepada FELCRA Berhad yang hampir RM1 bilion ataupun
RM969,268,000 kepada FELCRA yang sekali gus akan pastinya memberi bantuan
kepada FELCRA daripada segi perbaiki balance sheet mereka the gearing ratio supaya
mereka lebih bankable.
Kesemua itu adalah satu niat yang baik Tuan Yang di-Pertua, memandangkan
seperti mana yang disebutkan oleh Yang Berhormat Timbalan Menteri sebentar tadi.
Hampir 99 peratus adalah daripada golongan yang berpendapatan rendah, B40 .Saya
memerhatikan peserta-peserta yang tercatat dalam program-program yang dikatakan
projek-projek penyatuan dan pemulihan itu. Semuanya dalam usaha untuk memacu apa
yang diistilahkan dengan transformasi FELCRA baharu atau memacu FELCRA baharu
dalam satu engineering atau kejuruteraan transformasi. Kesemua itu adalah baik Tuan
Yang di-Pertua dan perlu kita sokong. Cuma, apakah dalam hal-hal ini— saya ingin
bertanya sedikit kepada Yang Berhormat Timbalan Menteri.
Pertama adalah valuation. Penilaian yang dibuat itu ordinary shares yang dengan
nilai RM1 satu syer. Apakah itu satu nilai yang munasabah berdasarkan valuation
pasaran? Is it a market value? Perkara itu adalah mustahak untuk kita diberi faham kepada
Dewan Rakyat ini."
USUL-USUL MENTERI KEWANGAN,"AKTA TATACARA KEWANGAN 1957 [AKTA 61]
Menukar Baki Pinjaman Kerajaan Malaysia Kepada FELCRA",,1640,Datuk Seri Dr. Haji Dzulkefly bin Ahmad [Kuala Selangor],"Kedua, juga perjelaskan daripada segi terms and conditions. Apakah ada di sana
kawalan ataupun management control dan sebagainya supaya tidak mudah diberikan,
ditukarkan loan kepada investment ini sebagai satu precedent kerana mustahak untuk kita
sebagai wakil rakyat memahami bahawa - saya memerhatikan juga daripada Laporan
Ketua Audit Negara sedikit waktu dahulu, memang banyak KPI yang tidak mereka capai.
Itu adalah yang lalu. tahun 2017 hingga tahun 2020. Akan tetapi, saya..."
USUL-USUL MENTERI KEWANGAN,"AKTA TATACARA KEWANGAN 1957 [AKTA 61]
Menukar Baki Pinjaman Kerajaan Malaysia Kepada FELCRA",,1640,Tuan Sivarasa Rasiah [Sungai Buloh],"Yang Berhormat Kuala Selangor, boleh
mencelah?"
USUL-USUL MENTERI KEWANGAN,"AKTA TATACARA KEWANGAN 1957 [AKTA 61]
Menukar Baki Pinjaman Kerajaan Malaysia Kepada FELCRA",,1640,Datuk Seri Dr. Haji Dzulkefly bin Ahmad [Kuala Selangor],"Ya, sila."
