level_1,level_2,level_3,raw_timestamp,timestamp,author,speech
RANG UNDANG-UNDANG,"RANG UNDANG-UNDANG PERBEKALAN 2009
Bacaan Kali Yang Kedua
DAN
USUL
ANGGARAN PEMBANGUNAN 2009",,■1220,1220,Tuan Lim Guan Eng [Bagan],"Minta maaf, nanti. Amar makruf tanpa diiringi nahi
mungkar adalah sia-sia, manakala nahi mungkar tanpa menjalankan amar makruf adalah
hampa. Amar makruf tanpa nahi mungkar akan mewujudkan bandar-bandar yang cantik
dan indah seperti Putrajaya dengan rumah-rumah yang tersusun, bangunan-bangunan
pencakar langit yang pada lahirnya tampak megah dan membanggakan, tetapi pada
batinnya buruk dan pecah berderai kerana penghuninya terdiri daripada manusia yang
rosak akhlak dan mentalnya. Sesungguhnya pembangunan raksasa tanpa nahi mungkar..."
RANG UNDANG-UNDANG,"RANG UNDANG-UNDANG PERBEKALAN 2009
Bacaan Kali Yang Kedua
DAN
USUL
ANGGARAN PEMBANGUNAN 2009",,■1220,1220,Dato’ Ismail bin Kasim [Arau],"Bagan, pohon laluan."
RANG UNDANG-UNDANG,"RANG UNDANG-UNDANG PERBEKALAN 2009
Bacaan Kali Yang Kedua
DAN
USUL
ANGGARAN PEMBANGUNAN 2009",,■1220,1220,Tuan Lim Guan Eng [Bagan],...tidak baik.
RANG UNDANG-UNDANG,"RANG UNDANG-UNDANG PERBEKALAN 2009
Bacaan Kali Yang Kedua
DAN
USUL
ANGGARAN PEMBANGUNAN 2009",,■1220,1220,Dr. Haji Mohd. Puad Zarkashi [Batu Pahat],"Itu habuan seks sebagai sedekah
itu amar makruf ke?"
RANG UNDANG-UNDANG,"RANG UNDANG-UNDANG PERBEKALAN 2009
Bacaan Kali Yang Kedua
DAN
USUL
ANGGARAN PEMBANGUNAN 2009",,■1220,1220,Tuan Lim Guan Eng [Bagan],Itu amalan jahiliah.
RANG UNDANG-UNDANG,"RANG UNDANG-UNDANG PERBEKALAN 2009
Bacaan Kali Yang Kedua
DAN
USUL
ANGGARAN PEMBANGUNAN 2009",,■1220,1220,Dr. Haji Mohd. Puad Zarkashi [Batu Pahat],Jawablah.
RANG UNDANG-UNDANG,"RANG UNDANG-UNDANG PERBEKALAN 2009
Bacaan Kali Yang Kedua
DAN
USUL
ANGGARAN PEMBANGUNAN 2009",,■1220,1220,Tuan Lim Guan Eng [Bagan],"...akan hanya melahirkan manusia-manusia yang
tidak mengikuti ajaran universal agama."
RANG UNDANG-UNDANG,"RANG UNDANG-UNDANG PERBEKALAN 2009
Bacaan Kali Yang Kedua
DAN
USUL
ANGGARAN PEMBANGUNAN 2009",,■1220,1220,Seorang Ahli,Dakwah ke?
RANG UNDANG-UNDANG,"RANG UNDANG-UNDANG PERBEKALAN 2009
Bacaan Kali Yang Kedua
DAN
USUL
ANGGARAN PEMBANGUNAN 2009",,■1220,1220,Tuan Lim Guan Eng [Bagan],"Ini bukan dakwah. Ini adalah ingatan tentang
pentadbiran politik. Begitu juga nahi mungkar tanpa amar makruf akan menyebabkan
kemunduran di mana tiada kemajuan dalam masyarakat, tiada kegiatan dan jumud tanpa
perjuangan..."
RANG UNDANG-UNDANG,"RANG UNDANG-UNDANG PERBEKALAN 2009
Bacaan Kali Yang Kedua
DAN
USUL
ANGGARAN PEMBANGUNAN 2009",,■1220,1220,Dato’ Ismail bin Kasim [Arau],Pohon laluan.
RANG UNDANG-UNDANG,"RANG UNDANG-UNDANG PERBEKALAN 2009
Bacaan Kali Yang Kedua
DAN
USUL
ANGGARAN PEMBANGUNAN 2009",,■1220,1220,Tuan Lim Guan Eng [Bagan],...di dunia yang sentiasa bergerak...
RANG UNDANG-UNDANG,"RANG UNDANG-UNDANG PERBEKALAN 2009
Bacaan Kali Yang Kedua
DAN
USUL
ANGGARAN PEMBANGUNAN 2009",,■1220,1220,Timbalan Yang di-Pertua [Datuk Ronald Kiandee],"Hendak bagi laluan, Yang
Berhormat?"
RANG UNDANG-UNDANG,"RANG UNDANG-UNDANG PERBEKALAN 2009
Bacaan Kali Yang Kedua
DAN
USUL
ANGGARAN PEMBANGUNAN 2009",,■1220,1220,Tuan Lim Guan Eng [Bagan],...ke arah kemajuan.
RANG UNDANG-UNDANG,"RANG UNDANG-UNDANG PERBEKALAN 2009
Bacaan Kali Yang Kedua
DAN
USUL
ANGGARAN PEMBANGUNAN 2009",,■1220,1220,Timbalan Yang di-Pertua [Datuk Ronald Kiandee],"Yang Berhormat tidak ada
masa, Yang Berhormat."
RANG UNDANG-UNDANG,"RANG UNDANG-UNDANG PERBEKALAN 2009
Bacaan Kali Yang Kedua
DAN
USUL
ANGGARAN PEMBANGUNAN 2009",,■1220,1220,Tuan Lim Guan Eng [Bagan],"Saya rasa inilah harapan rakyat Malaysia ke atas
sistem pentadbiran politik amar makruf nahi mungkar yang diamalkan oleh Baginda Umar
Abdul Aziz."
RANG UNDANG-UNDANG,"RANG UNDANG-UNDANG PERBEKALAN 2009
Bacaan Kali Yang Kedua
DAN
USUL
ANGGARAN PEMBANGUNAN 2009",,(cid:1) 1230,1230,Tuan Lim Guan Eng [Bagan],"Di sini saya ingin menyeru sekiranya kita hendak menjalinkan hubungan baik
hendaklah jauhkan diri daripada sistem amalan politik perkauman yang sering dimain-
mainkan oleh ahli-ahli politik Barisan Nasional khususnya daripada UMNO. Saya ingin
berikan peringatan bahawa janganlah cuba menggunakan media massa untuk menutup
kesalahan dan kemungkaran masing-masing dengan menggunakan isu-isu perkauman.
Saya amat kesal bahawa Yang Berhormat Seputeh apabila menjalankan tugasnya
dengan baik dan elok sekarang diancam, diugut dan bukan sahaja ditahan di bawah ISA
tetapi sekarang ada Chamil Wariya, seorang wartawan yang kita anggap sebagai wartawan
yang baik tetapi boleh sampai ke tahap yang begitu rendah hendakkan beliau dibunuh.
Adakah ini yang diamalkan oleh Barisan Nasional?
Semalam saya lihat Yang Amat Berhormat Timbalan Perdana Menteri melahirkan
perasaan tidak puas hati tentang satu laporan yang tidak benar oleh MalaysiaKini.
MalaysiaKini telah mengambil peranan yang bertanggungjawab dengan meminta maaf.
Kalau buat salah, minta maaf dan bertaubat kita boleh terima, tetapi kalau Utusan Malaysia
yang menggalakkan pembunuhan seorang Ahli Parlimen..."
RANG UNDANG-UNDANG,"RANG UNDANG-UNDANG PERBEKALAN 2009
Bacaan Kali Yang Kedua
DAN
USUL
ANGGARAN PEMBANGUNAN 2009",,(cid:1) 1230,1230,Dr. Haji Mohd. Puad Zarkashi [Batu Pahat],Itu cerpen. Itu cerpenlah.
RANG UNDANG-UNDANG,"RANG UNDANG-UNDANG PERBEKALAN 2009
Bacaan Kali Yang Kedua
DAN
USUL
ANGGARAN PEMBANGUNAN 2009",,(cid:1) 1230,1230,Tuan Lim Guan Eng [Bagan],"...mengapakah tidak ada sebarang tindakan
diambil ke atasnya. Lebih-lebih lagi apabila Utusan Malaysia memainkan isu perkauman
yang tidak berasas di mana Yang Berhormat Seputeh tidak pernah menimbulkan isu-isu
berkaitan dengan agama tetapi dipermainkan oleh Utusan Malaysia bahawa beliau
bertanggungjawab ke atas perkara itu. Itu adalah sesesuatu yang sungguh tidak
bertanggungjawab. Kalau kita lihat dari semua ajaran agama universal, ISA sekarang
ketinggalan zaman. Ia bukan sahaja melawan semua ajaran agama, ia harus dimansuhkan
dengan segera."
RANG UNDANG-UNDANG,"RANG UNDANG-UNDANG PERBEKALAN 2009
Bacaan Kali Yang Kedua
DAN
USUL
ANGGARAN PEMBANGUNAN 2009",,(cid:1) 1230,1230,Dato’ Haji Lilah Yasin [Jempol],Masa sudah cukup.
RANG UNDANG-UNDANG,"RANG UNDANG-UNDANG PERBEKALAN 2009
Bacaan Kali Yang Kedua
DAN
USUL
ANGGARAN PEMBANGUNAN 2009",,(cid:1) 1230,1230,Tuan Lim Guan Eng [Bagan],"Saya ingin menyeru kepada pihak kerajaan
mansuhkanlah ISA sebelum anda dimansuhkan. Sekian."
RANG UNDANG-UNDANG,"RANG UNDANG-UNDANG PERBEKALAN 2009
Bacaan Kali Yang Kedua
DAN
USUL
ANGGARAN PEMBANGUNAN 2009",,(cid:1) 1230,1230,Dato’ Ismail Kasim [Arau],"Kerajaan baru Pulau Pinang, bola sepak pun tidak
boleh jaga."
RANG UNDANG-UNDANG,"RANG UNDANG-UNDANG PERBEKALAN 2009
Bacaan Kali Yang Kedua
DAN
USUL
ANGGARAN PEMBANGUNAN 2009",,12.32 tgh.,1232,Datuk Haji Yussof Haji Mahal [Labuan],"Bismillahir rahmanir rahim.
Assalamualaikum warahmatullahi wabarakatuh dan salam perpaduan. Terima kasih Tuan
Yang di-Pertua kerana memberikan peluang kepada Labuan untuk sama-sama
membahaskan Bajet 2009 - Rancangan Malaysia Kesembilan yang dibentangkan oleh
Yang Amat Berhormat Perdana Menteri yang lalu. Sebelumnya saya mengucapkan tahniah
kepada Kerajaan Barisan Nasional di bawah kepimpinan Perdana Menteri dan Timbalan
Perdana Menteri yang dapat mengimbangi ekonomi negara dan menguruskan perbelanjaan
kerajaan secara berhemah.
Labuan yakin dan percaya berdasarkan Misi Nasional, Malaysia mampu
mengekalkan momentum pertumbuhan ekonomi yang positif. Walau bagaimanapun masih
banyak hal yang harus kita perbaiki. Umpamanya kalau kita di Labuan, Sabah dan
Sarawak yang mana banyak disuarakan oleh Ahli-ahli Yang Berhormat dari Sabah dan
Sarawak dan juga Labuan masih banyak sekolah-sekolah yang kurang sempurna terutama
sekolah-sekolah di pedalaman Sabah dan Sarawak. Bagaimanalah kita mampu memupuk
minda kelas pertama jikalau tempat mengasah minda iaitu tempat mengasah ilmu masih
dalam keadaan daif. Mungkin Labuan pula agak baik sedikit, akan tetapi masih ketinggalan
jika dibandingkan dengan sekolah-sekolah di Wilayah Persekutuan yang lain seperti Kuala
Lumpur dan Putrajaya untuk mengimbangi status Labuan sebagai Wilayah Persekutuan
ketidakseimbangan ini harus diperbaiki. Dengan itu Labuan memohon agar semua pusat
pendidikan di Labuan dapat dinaiktarafkan. Salah satu daripadanya iaitu cabang Universiti
Malaysia Sabah, Kampus Antarabangsa Labuan dinaiktarafkan sebagai sebuah universiti
penuh yang mempunyai identiti tersendiri yang kini dengan menjadikan Universiti
Antarabangsa Labuan.
Universiti Malaysia Sabah Kampus Antarabangsa Labuan (UMSKAL) mula
beroperasi sejak tahun 1999, telah ditubuhkan bertujuan untuk menghasilkan graduan dan
juga menyokong usaha kerajaan untuk menjadikan Wilayah Persekutuan sebagai pusat
kewangan pesisir yang terulung di rantau ini. Hasrat ini dapat dipenuhi oleh UMSKAL
dengan pengeluaran hampir 600 orang graduan dalam bidang perniagaan antarabangsa
dan kewangan antarabangsa serta teknologi maklumat setiap tahun.
Walau bagaimanapun kebanyakan masyarakat di Wilayah Persekutuan Labuan
telah menyatakan bahawa kesan kehadiran UMSKAL adalah terhad disebabkan bilangan
pelajar seramai cuma hanya 2,000 orang pada saat ini yang dikira agak kecil. Sebagai
contoh, Kolej Matrikulasi di Labuan sendiri mempunyai lebih daripada 3,000 pelajar. Ini
menyebabkan kehadiran UMSKAL tidak dianggap sebagai membawa sebarang
pembangunan ekonomi untuk Labuan seperti mana yang diharapkan oleh rakyat dan
industri di Wilayah Persekutuan Labuan. Sejak penubuhan UMSKAL ini juga bilangan
sekolah fakulti dan penawaran ijazah oleh UMSKAL tidak berubah oleh kerana UMSKAL
tidak boleh menawarkan kursus yang sama yang telah ditawarkan oleh Universiti Malaysia
Sabah di Kota Kinabalu.
Oleh yang demikian dalam usaha menyokong pembangunan Wilayah Persekutuan
Labuan maka saya mencadangkan bagi membolehkan UMSKAL untuk berkembang kita
perlu menaiktarafkan UMSKAL kepada universiti yang beroperasi sendiri yang terasing
daripada Universiti Malaysia Sabah Kota Kinabalu dengan menggunakan contohnya
Universiti Malaysia Antarabangsa Labuan. Sekiranya Universiti Malaysia Antarabangsa
Labuan berjaya menjadi kenyataan, maka universiti akan dapat memainkan peranan yang
penting dalam membantu membangunkan Wilayah Persekutuan Labuan dengan
menawarkan program-program ijazah selari dengan perancangan strategik pembangunan
Wilayah Persekutuan Labuan itu sendiri. Contohnya, sebagaimana yang dirancang di
Wilayah Persekutuan Labuan ia adalah salah sebuah pulau yang menjadi pusat industri
minyak dan gas; pusat pelancongan dan juga hab industri makanan halal.
Universiti Malaysia Antarabangsa Labuan juga akan menawarkan ijazah-ijazah
sarjana muda, ijazah sarjana kedoktoran dalam bidang-bidang yang relevan kepada
pembangunan Wilayah Persekutuan Labuan, Sabah, Sarawak dan juga negara kita
Malaysia amnya. Lokasi Universiti Malaysia Labuan yang unik dan kelebihan yang sedia
ada maka Labuan telah dikenali sebagai pusat kewangan pesisir, pusat minyak dan gas,
pusat industri perkapalan, pusat pelancongan laut serta sebagai markas tentera udara di
Timur Malaysia. Maka Universiti Labuan boleh memajukan industri-industri ini dengan
menawarkan ijazah-ijazah dalam bidang-bidang berikut.
(i) Fakulti yang sudah ada iaitu Fakulti Perniagaan Antarabangsa
yang mengeluarkan Ijazah Sarjana Perniagaan Antarabangsa,
Ijazah Sarjana Muda Pemasaran Antarabangsa;
(ii) Fakulti Kewangan Antarabangsa yang mengeluarkan Ijazah
Sarjana Muda Kewangan Antarabangsa dan Ijazah Sarjana
Muda Kewangan Islam; dan
(iii) Fakulti Sains Informatif - Ijazah Sarjana Muda Sains Teknologi
Multimedia dan juga Ijazah Sarjana Muda Teknologi Maklumat.
Ketiga-ketiga fakulti tersebut sudah pun dijalankan pada saat ini tetapi universiti
tersebut tidak dapat menambah fakulti ataupun jurusan yang lain disebabkan ia tertakluk
kepada universiti induk iaitu Universiti Malaysia Sabah yang berada di Kota Kinabalu."
RANG UNDANG-UNDANG,"RANG UNDANG-UNDANG PERBEKALAN 2009
Bacaan Kali Yang Kedua
DAN
USUL
ANGGARAN PEMBANGUNAN 2009",,■1240,1240,Datuk Haji Yussof Haji Mahal [Labuan],"Oleh itu, sekiranya ia menjadi kenyataan dan diterima oleh kerajaan, maka fakulti
yang akan ditambah adalah seperti berikut. Pertama iaitu Fakulti Pengurusan Gunaan yang
mana akan mengeluarkan Sarjana Muda Pengurusan Strategik, Sarjana Muda Pengurusan
Industri Makanan Halal, Sarjana Muda Pengurusan Perhotelan, Sarjana Muda Pengurusan
Pelancongan, Sarjana Muda Logistik dan Pengangkutan dan sarjana Muda Pengurusan
Zon Pesisir Pantai.
Manakala, jurusan kedua iaitu jurusan kejuruteraan yang mana akan dapat
ditubuhkan atau diadakan jurusan Sarjana Muda Kejuruteraan Marin, Sarjana Muda
Kejuruteraan Minyak dan Gas dan juga Sarjana Muda Kejuruteraan Aeroangkasa.
Fakulti Sains yang seterusnya yang ketiga iaitu Fakulti Sains Oseanografi dan
Geologi Marin yang mana akan membolehkan mengadakan Sarjana Muda Oseanografi,
Sarjana Muda Geologi Marin, Sarjana Muda Akuakultur Marin, Sarjana Muda Ekologi
Hidupan Liar dan Marin dan Sarjana Muda Teknologi Marin.
Keenam-enam fakulti ini akan disokong oleh pusat yang menawarkan kursus tetapi
tidak menawarkan ijazah seperti pusat bahasa dan ilmu, dan pusat kemahiran islamiah.
Justifikasi ekonomi. Melalui penubuhan fakulti-fakulti ini, Universiti Malaysia
Labuan boleh berkembang mengasaskan satu kampus yang menempatkan kapasiti
maksimum seramai hampir 8,000 orang pelajar dan lebih kurang 1,200 orang kakitangan
iaitu 600 orang tenaga pengajar dan 600 kakitangan sokongan. Universiti Malaysia Labuan
juga dikenali sebagai universiti kecil ataupun universiti butik yang mengkhususkan kepada
bidang spesifik yang mana kehadiran Universiti Malaysia Labuan akan mampu
meningkatkan ekonomi di Wilayah Persekutuan Labuan kerana bilangan warga kampus
yang hampir 8,000 orang ini akan menyediakan critical mass dengan izin yang mampu
menjana ekonomi Wilayah Persekutuan Labuan.
Universiti Malaysia Labuan juga dijangka akan menyediakan peluang-peluang
pekerjaan kepada 1,200 orang secara terus-menerus dan akan menyumbang secara terus-
menerus sebanyak RM100 juta setahun."
RANG UNDANG-UNDANG,"RANG UNDANG-UNDANG PERBEKALAN 2009
Bacaan Kali Yang Kedua
DAN
USUL
ANGGARAN PEMBANGUNAN 2009",,■1240,1240,Dato’ Ismail Kasim [Arau],Minta laluan.
RANG UNDANG-UNDANG,"RANG UNDANG-UNDANG PERBEKALAN 2009
Bacaan Kali Yang Kedua
DAN
USUL
ANGGARAN PEMBANGUNAN 2009",,■1240,1240,Timbalan Yang di-Pertua [Datuk Ronald Kiandee],"Yang Berhormat Arau
bangun, Yang Berhormat."
RANG UNDANG-UNDANG,"RANG UNDANG-UNDANG PERBEKALAN 2009
Bacaan Kali Yang Kedua
DAN
USUL
ANGGARAN PEMBANGUNAN 2009",,■1240,1240,Datuk Haji Yussof bin Haji Mahal [Labuan],Okey.
RANG UNDANG-UNDANG,"RANG UNDANG-UNDANG PERBEKALAN 2009
Bacaan Kali Yang Kedua
DAN
USUL
ANGGARAN PEMBANGUNAN 2009",,■1240,1240,Dato’ Ismail Kasim [Arau],"Terima kasih Tuan Yang di-Pertua dan terima kasih
sahabat saya Yang Berhormat Labuan. Saya ingin bertanya pandangan Yang Berhormat
apabila Yang Berhormat bangkitkan kedudukan IPTA dan universiti termasuk di Labuan di
negara kita. Saya mendapat maklum balas iaitu berhubung dengan wujud sedikit elemen
ketergesaan kita dalam usaha kita hendak meningkatkan taraf kecemerlangan universiti di
negara kita ini, iaitu apabila kita mengalu-alukan kemasukan pelajar-pelajar asing ke negara
kita untuk belajar di negara kita dan cara kita buat itu sebenarnya tidak betul iaitu
pensyarah-pensyarah telah diarahkan oleh NC ataupun Naib Canselor supaya meluluskan
markah walaupun pelajar itu tidak lulus.
Ketika melihat, yang kedua, iaitu terdapat di sebuah universiti IPTA di negara kita
yang nilai akademik pensyarah itu, dalam KPInya, Key Perfomance Index dengan izin, Tuan
Yang di-Pertua tidak diberi keutamaan malah dinilai dari sudut-sudut kerja-kerja yang lain
sebagai sumber pemarkahan untuk meningkatkan skill gaji pensyarah-pensyarah
berkenaan. Apa pandangan Yang Berhormat berhubung perkara ini. Kalau sekiranya ia
benar-benar terjadi, maka saya berasa amat kesal tentang perkara ini."
RANG UNDANG-UNDANG,"RANG UNDANG-UNDANG PERBEKALAN 2009
Bacaan Kali Yang Kedua
DAN
USUL
ANGGARAN PEMBANGUNAN 2009",,■1240,1240,Datuk Haji Yussof bin Haji Mahal [Labuan],"Terima kasih Yang Berhormat
Arau. Bagi pandangan saya, apabila kita tubuhkan contohnya, apa yang saya nyatakan,
adakan di Labuan sebagai sebuah universiti tersendiri, kerana kedudukan Labuan itu
sendiri yang berkedudukan internasional, contohnya, kita ada IOFC di situ dan juga seperti
mana yang kita maklum, yang dilihat, yang dinyatakan tadi, kita rasa tergesa untuk
menjadikan universiti sebagai satu misi kerajaan. Saya rasa dalam hal ini kualiti kita harus
utamakan. Itulah sebabnya kita akan jadikan Labuan sebagai satu contoh sebuah Pulau
yang sudah agak terkenal berbanding dengan Langkawi. Langkawi lebih menonjol kepada
pelancongan, yang mana kalau kita lihat kedudukan Labuan. Kedudukan Labuan dengan
adanya fasilitas yang ada, contohnya kita ada oil and gas di situ, tidak salah kita bangun
dan kita hidupkan sebuah universitinya tersendiri yang mana benda ini akan dapat menarik
secara tidak langsung pelajar-pelajar dari luar dan juga kita tidak boleh compromise dalam
hal kualiti dalam pendidikan yang mana kedudukan dan standard di Labuan itu sendiri telah
pun tertubuh pusat perniagaan pesisir yang meliputi dan juga akan mendedahkan dan
berhubung kait, berurusan dengan negara-negara luar.
Saya setuju dengan pandangan Yang Berhormat, benda ini harus kita fikirkan
semasak-masaknya supaya apa pun yang terjadi, benda ini akan kita jaga dan kualiti harus
kita kekalkan supaya sesuatu yang kita tubuhkan itu harus berdaya maju dan berdaya
saing. Terima kasih Yang Berhormat. Harap dapat menjawab soalan Yang Berhormat
itulah.
Seterusnya, dalam hal ini saya juga meneruskan tidak termasuk penjanaan
ekonomi secara langsung contohnya daripada pihak swasta yang akan meningkatkan
pelaburan, mereka memberi perkhidmatan kepada warga universiti atau mencari peluang
perniagaan di sekitar kampus di Labuan yang mana terdapat lebih kurang 8,000 pelancong
contohnya pelajar yang tetap dan menetap selama tiga hingga empat tahun di Wilayah
Persekutuan Labuan. Jadi secara Langsung sumbangan Universiti Malaysia Antarabangsa
Labuan dari aspek ekonomi terhadap Wilayah Persekutuan Labuan juga dijangka akan
dapat memperoleh pembangunan keseluruhan rakyat dan industri di Wilayah Persekutuan
Labuan sehingga ke tahap yang cemerlang.
Justifikasi bukan ekonomi - Penubuhan Universiti Malaysia Antarabangsa Labuan
serta penawaran kursus-kursus unik yang disesuaikan kepada kelebihan semula jadi dan
industri telah sedia ada di Wilayah Persekutuan Labuan akan meningkatkan lagi kualiti
penimbaan ilmu dan kualiti graduan serta kebolehsaingan di Universiti Malaysia
Antarabangsa Labuan. Penambahan nilai ini kepada Wilayah Persekutuan Labuan dan
negara yang bakal diperoleh jika universiti ini terwujud dan dinaik taraf adakah jauh
melebihi kos yang terlibat.
Penyelidikan yang akan dijalankan oleh pensyarah-pensyarah dalam bidang
spesifik mereka akan membantu negara untuk melindungi dan pada masa yang sama
menguruskan pengeluaran hasil sumber-sumber negara secara berterusan. Bagi generasi
akan datang, ilmu yang diperoleh oleh penyelidikan marin akan membolehkan negara
mengawal dan mengurus sumber asli lautan yang tidak ternilai harganya melalui
pengeksploitasian hasil-hasilnya.
Imej Malaysia sebagai negara Islam yang maju lebih terserlah jika Malaysia
berjaya menjadi pemimpin industri makanan halal. Universiti Malaysia Antarabangsa Halal
juga dijangka mampu memenuhi hasrat kejayaan ini memandangkan ia merupakan
universiti pertama di Malaysia yang menawarkan Ijazah Sarjana Muda Pengurusan Industri
Makanan Halal.
Secara keseluruhannya, jelas sekali bahawa Wilayah Persekutuan Labuan
memerlukan universiti yang berperanan penting dalam membantu menjayakan
perancangan pembangunan Wilayah Persekutuan Labuan itu sendiri dan juga negara kita
amnya.
Kebolehsaingan industri-industri penting negara akan dipertingkatkan sekiranya
universiti ini ditubuhkan."
