level_1,level_2,level_3,raw_timestamp,timestamp,author,speech
RANG UNDANG-UNDANG,"RANG UNDANG-UNDANG PERBEKALAN 2024
DAN
USUL
ANGGARAN PEMBANGUNAN 2024
Jawatankuasa","Kepala B.31 [Jadual] –
Kepala P.31 [Anggaran Pembangunan 2024] –",5.03 ptg.,1703,Tuan Manndzri bin Nasib [Tenggara],"Terima kasih, Tuan Pengerusi. Saya
mulakan dengan keyakinan bahawa kepelbagaian biodiversiti sumber bernilai tinggi
pelancongan dan masyarakat kita yang berbilang kaum ini dan etnik adalah aset yang mampu
menarik pelancong antarabangsa dan domestik untuk melancong di negara kita. Saya juga
berharap agar MOTAC menyokong usaha kerajaan Johor yang baru pagi tadi
membentangkan bajet Tahun Melawat Johor 2026 dengan sasaran 12 juta pelancong.
Kerana apa? kerana antara pintu masuk utama pelancong di negara kita ini selain
daripada KLIA dan juga *international airport* yang lain adalah daripada Changi, Singapura.
Jadi menyokong aktiviti di Johor itu merupakan satu langkah yang tepat jugalah untuk
merangsang aktiviti pelancongan di negara kita dan kerana kita tahu pada 2019 ketika
semua-semuanya masih sihat, kita telah berjaya menarik 26.1 juta pelancong antarabangsa
dengan pendapatan sekitar RM86.14 bilion. Ini adalah satu yang sangat membanggakan.
Jadi Tuan Pengerusi saya terus kepada Butiran 010500 – Pembangunan Prasaran
daripada RM2.3 juta naik kepada RM2.93 juta dan bajet Johor juga pagi tadi membentangkan
tentang RM20 juta saya sebut bajet kita dengan bajet negeri Johor ini kerana supaya
berlakunya saling menyaling, simbiosis antara MOTAC Malaysia dengan Johor supaya boleh
merangsang beberapa pembangunan prasarana pelancongan.
Kalau di tempat saya Tenggara ini ada satu Gunung Muntahak namanya, tingginya
634 meter ada air terjun sepuluh tingkat dan membentuk aliran Sungai Tengkil. Jadi, saya
sudah sebut dua tiga kali sudah perkara ini, mudah-mudahan pihak Kementerian- MOTAC
boleh ambil langkah sesuatu, bekerjasama dengan KEJORA, Jabatan Perhutanan, untuk
membangunkan Gunung Muntahak ini kerana memiliki nilai pelancongan yang amat baik.
Seterusnya Butiran 010800 – Pejabat Kementerian Pelancongan, Seni dan Budaya
Negeri. Daripada RM21 juta naik RM22 juta dan Butiran 020400 – Pusat Pelancongan
Malaysia daripada RM8 juta naik RM9 juta.
Saya hendak memaklumkan di sini kepada pihak kementerian, Puan Pengerusi,
bahawa di tempat saya ini ada satu bangunan yang sangat cantik dan tersergam namanya
Pusat Perkhidmatan dan Transit Pelancongan, Kota Tinggi di Kampung Batu Ampat, tetapi
sejak tujuh tahun ia dibina masih belum ada apa-apa lagi aktiviti yang berlaku di situ.
Jadi di tempat saya ini memang ada serangan gajahlah, tetapi bila ada gajah putih
satu macam ini, dia menyerang lagi Ahli Parlimen. Jadi langkah yang saya ambil adalah
mendirikan pejabat ataupun Pusat Khidmat Ahli Parlimen Tenggara ini di *compartment*
bangunan ini. Jadi saya ingin bertanya kepada pihak kementerian, adakah apa-apa usaha
yang akan dilakukan pada tahun 2024 ini untuk mengupayakan fungsi sebenar,
mengupayakan fungsi sebenar Pusat Khidmat dan Transit Pelancongan di Kampung Batu
Ampat untuk Kota Tinggi ini?
Kalau boleh saya mencadangkan supaya dilakukan jemputan ataupun perbincangan
dengan beberapa pihak untuk mengajak agensi-agensi lain supaya berfungsi di pusat
khidmat itu seperti JPJ, imigresen, Jabatan Pendaftaran Negara, supaya ia menjadi
*community-based tourism.* Sekurang-kurangnya bila bangunan itu ada diisikan dengan
agensi-agensi yang penting dan dekat dengan masyarakat jadi adalah pelancong juga yang
akan datang menggunakan perkhidmatan di bangunan berkenaan.
Seterusnya adalah Butiran 040300 – Program Penggalakan Pemasaran, Promosi
dan Acara-acara Pelancongan, Seni dan Budaya, daripada RM294 juta naik ke RM350 juta.
Di Tenggara juga berdekatan dengan bangunan tadi itu ada *sanctuary* gajah.
*Sanctuary* gajah ini ada tiga ekor sekarang- gajah, satu betina dan dua jantan. Namanya
Nina, Jes dan Panti. Jadi untuk ke arah 2026 fungsi penuh pusat *sanctuary* ini saya
mencadangkan agar pihak MOTAC juga mengambil kira dalam tempoh dua tahun, 2024 dan
2025 ini, supaya melihat bagaimanakah pembangunan *sanctuary* gajah ini boleh benar-benar
memberi faedah dan nilai tambah sebagai produk pelancongan di Malaysia khususnya di
Johor dan di tempat sayalah, Tenggara.
Saya suka hendak maklumkan dua hari lepas pun saya sebut tentang *sport tourism*,
pelancongan sukan di Tenggara *which is* Bandar Tenggara dan saya hendak mengumumkan
juga, hendak memberitahu. Ada tidak apa-apa perancangan daripada pihak MOTAC untuk
membangunkan jajaran trek *motocross* yang sedia ada di antara Empangan Linggiu, Bandar
Tenggara ke sempadan Mersing. Ini memang telah digunakan oleh masyarakat setempat
seluruh Johor dan negara termasuk juga dari Indonesia dan Singapura untuk buat *trail* di
sana.
Jadi kalau ada pengkhususan-pengkhususan tertentu daripada Kementerian
Pelancongan, bolehlah ia memberi faedah tambahan kepada pelancongan Malaysia dan juga
menambah produk-produk pelancongan yang boleh memberi manfaat kepada rakyat. Saya
minta untuk satu minit lagi, Tuan Pengerusi sedikit sahaja.
Di Tenggara juga ada tiga kampung Orang Asli. Itu juga boleh menjadi produk
pelancongan yang baik dan di Kampung Sungai Telur dalam Parlimen saya ada Taman Tema
Air, Lanchara De Malayos malangnya tidak dipromosikan baik-baik. Oleh kerana apa, kerana
Tenggara ini letaknya 30 minit sahaja daripada *Senai International Airport* dan satu jam
daripada Changi. Jadi kalau Kementerian Pelancongan ada perancangan-perancangan
tertentu, dia akan memberi faedah bukan sahaja kepada negara, tetapi kepada rakyat
setempat.
Akhirnya, saya hendak menyentuh tentang Butiran 030800 – Perbadanan Kemajuan
Kraftangan, daripada RM73 juta naik ke RM75 juta. Kraf tangan adalah satu hal yang unik
dan terkhusus bergantung kepada lokasi-lokasi dan tradisi-tradisi masyarakat.
Misalnya di kawasan-kawasan FELDA sebenarnya kaya dengan kraf tangan bernilai
tinggi. Saya bagi contoh mak saya, Hajah Ngainun Haji Kasmuin ini dahulu dia buat bunga
botol. Dia buat bunga daripada tali rafia, dia buat hiasan dinding daripada lidi sawit. Dia buat
juga hiasan daripada botol aerosol yang terbuang."
RANG UNDANG-UNDANG,"RANG UNDANG-UNDANG PERBEKALAN 2024
DAN
USUL
ANGGARAN PEMBANGUNAN 2024
Jawatankuasa","Kepala B.31 [Jadual] –
Kepala P.31 [Anggaran Pembangunan 2024] –",■1710,1710,Tuan Manndzri bin Nasib [Tenggara],"Jadi maksudnya, ada tak perancangan daripada Perbadanan Kemajuan Kraftangan
Malaysia ini untuk merakyatkan kraf tangan supaya seni kraf tangan yang memang dah ada
dekat kawasan-kawasan FELDA misalnya, kampung-kampung tradisi pun, *even* di Kampung
Orang Asli pun boleh diketengahkan dan di meluaskan lagi kerana ia memang memiliki
nilainya yang tersendiri. Selain daripada itu, mengetengahkan aspek *waste to wealth* itu
sebenarnya boleh juga memberi nilai tambah kepada industri kraf tangan di negara ini. Itu
sahajalah yang ingin saya sampaikan. Terima kasih. Sekian."
RANG UNDANG-UNDANG,"RANG UNDANG-UNDANG PERBEKALAN 2024
DAN
USUL
ANGGARAN PEMBANGUNAN 2024
Jawatankuasa","Kepala B.31 [Jadual] –
Kepala P.31 [Anggaran Pembangunan 2024] –",■1710,1710,Tuan Pengerusi [Puan Alice Lau Kiong Yieng],"Terima kasih Yang Berhormat
Tenggara. Saya jemput Yang Berhormat Dungun."
RANG UNDANG-UNDANG,"RANG UNDANG-UNDANG PERBEKALAN 2024
DAN
USUL
ANGGARAN PEMBANGUNAN 2024
Jawatankuasa","Kepala B.31 [Jadual] –
Kepala P.31 [Anggaran Pembangunan 2024] –",5.10 ptg.,1710,Tuan Haji Wan Hassan bin Mohd Ramli [Dungun],"Terima kasih Puan Pengerusi.
Butiran 020500 – Lembaga Penggalakan Pelancongan Malaysia (LPPM).
Pada bulan Jun baru-baru ini, media melaporkan tentang bantahan Kesatuan
Pekerja-Pekerja LPPM terhadap cadangan kerajaan bagi pihak kementerian melantik pihak
luar untuk menjalankan pentadbiran dan pengoperasian *Tourism Malaysia* di dalam dan di
luar negara.
Antara sebab bantahan adalah lantikan sedemikian mengganggu laluan kerjaya
kakitangan dan pegawai *Tourism Malaysia*. Saya mempunyai keyakinan bahawa fungsi
Lembaga Penggalakan Pelancongan Malaysia ialah mengekalkan Malaysia sebagai
destinasi pelancongan yang unggul dan meningkatkan sumbangan dalam sektor
pelancongan kepada ekonomi negara. Berasaskan kepada fungsi ini, maka diharapkan isu
ini dapat diselesaikan. Maka, saya pohon penjelasan kementerian dalam perkara ini.
Butiran 030400 – Warisan Negara. Pertama, saya ingin bertanya apakah rancangan
kementerian untuk bekerjasama dengan kerajaan-kerajaan negeri bagi menaik taraf dan
memulihara kawasan-kawasan yang berpotensi dicalonkan sebagai Tapak Warisan Dunia
UNESCO. Pengiktirafan ini adalah penting kerana selain memperoleh bantuan kewangan
daripada UNESCO untuk tujuan penyelenggaraan, kesan limpahan daripada pengiktirafan ini
adalah mewujudkan aktiviti huluan dan hiliran pelancongan yang akan menjana ekonomi
penduduk setempat. Setakat ini, adakah sudah wujud usaha-usaha bagi butiran ini dengan
negeri-negeri?
Butiran yang sama dalam perkara yang melibatkan artifak negara yang masih banyak
dipegang oleh pihak bekas penjajah negara di muzium-muzium negara mereka. Apakah
usaha kementerian dalam isu ini?
Ketiga, adakah kementerian melakukan proses pemuliharaan tempat warisan negara
secara aktif? Saya khuatir kita terpaksa melihat insiden pemusnahan tempat arkeologi di
Lembah Bujang berulang berikutan tiada pemantauan daripada pihak berkuasa. Pohon
penjelasan.
Butiran 040600 – *Islamic Tourism Centre* (ITC). Saya ingin untuk mengetahui
daripada butiran yang berkait dengan soal yang melibatkan *Islamic Tourism Centre* ini
dengan peruntukan RM2.2 juta. Diharapkan usaha-usaha menjadikan Malaysia sebagai
destinasi pelancongan mesra Muslim. Kalau dulunya kita dapat melihat limpahan pelancong-
pelancong dari Timur Tengah berada di negara kita, tetapi sekarang agak kurang. Soalan
saya, sejauh manakah usaha-usaha promosi *Islamic tourism* dilaksanakan dan fokus ITC
untuk meningkatkan kefahaman pemain-pemain industri ini jika berlaku limpahan pelancong-
pelancong dari Timur Tengah?
Kesan daripada limpahan pelancongan itu memberi rantaian yang sangat baik untuk
pemain-pemain industri ini seperti:
(i) wujudnya pemandu pelancong berbahasa Arab yang sangat ramai
ketika limpahan pelancong-pelancong Timur Tengah ke negara ini;
(ii) memperkenalkan budaya masyarakat Malaysia kepada mereka;
(iii) meningkatkan industri halal negara dalam meletakkan bahawa
Malaysia menjadi hab halal negara yang sangat penting di peringkat
dunia; dan
(iv) pulangan ekonomi kepada pengusaha-pengusaha tempatan.
Terima kasih Puan Pengerusi."
RANG UNDANG-UNDANG,"RANG UNDANG-UNDANG PERBEKALAN 2024
DAN
USUL
ANGGARAN PEMBANGUNAN 2024
Jawatankuasa","Kepala B.31 [Jadual] –
Kepala P.31 [Anggaran Pembangunan 2024] –",5.10 ptg.,1710,Tuan Pengerusi [Puan Alice Lau Kiong Yieng],"Terima kasih Yang Berhormat
Dungun.
Saya jemput Yang Berhormat Gopeng."
RANG UNDANG-UNDANG,"RANG UNDANG-UNDANG PERBEKALAN 2024
DAN
USUL
ANGGARAN PEMBANGUNAN 2024
Jawatankuasa","Kepala B.31 [Jadual] –
Kepala P.31 [Anggaran Pembangunan 2024] –",5.16 ptg.,1716,Tuan Tan Kar Hing [Gopeng],"Terima kasih kepada Tuan Pengerusi kerana izinkan
saya untuk mengambil bahagian dalam perbahasan peringkat Jawatankuasa bagi MOTAC.
Tumpuan perbahasan saya adalah berkenaan dengan pembangunan ekopelancongan
dalam negara secara amnya dan negeri Perak secara khususnya.
Pertama, saya ingin menyentuh P.31, Butiran 00800 – Kajian-kajian Pelancongan.
Kalau ikut Pelan Pembangunan Sektor Ekopelancongan setakat ini, kita hanya ada Pelan
Ekopelancongan Kebangsaan tahun 2016 hingga tahun 2025. Saya berpendapat bahawa
adalah tiba masa untuk MOTAC tumpukan sepenuh perhatian dan membuat kajian dalam
pembangunan sektor ekopelancongan negara kita. Apatah lagi kita bakal menyambut Tahun
Melawat Malaysia pada tahun 2026 yang tidak lama lagi.
Bagi Butiran 01900 – Pembangunan Ecotourism. Saya berpandangan bahawa
strategi yang ditekankan dalam Pelan Ekopelancongan Kebangsaan yang saya sebutkan tadi
masih lagi tidak tercapai dan kita masih lagi jauh ketinggalan terutamanya dalam soal
mewujudkan persekitaran yang *pro-business* untuk menarik lebih ramai pelabur asing
ataupun domestik dalam sektor tersebut. Kita mempunyai pelbagai destinasi ataupun produk-
produk pelancongan yang menarik.
Namun, saya ingin bertanyakan adakah kita mampu bersaing dengan destinasi-
destinasi dalam rantau Asian apabila Vietnam, Indonesia dan Thailand telah giat
mempromosikan negara masing-masing sebagai destinasi yang terkemuka. Kita mungkin
kurang bermaya dalam bab menarik minat pelabur-pelabur dalam sektor pelancongan sama
ada dalam bidang perhotelan dan vila penginapan yang premium. Sepertimana yang berlaku
di Ha Long Bay, Vietnam yang telah pun mendapat pengiktirafan Tapak Warisan Dunia
UNESCO pada tahun 1994 dan kini mereka telah pun menerima kunjungan ataupun ketibaan
pelancong sekitar 14 juta pelancong pada tahun ini dijangkakan.
Saya berpandangan bahawa seperti mana yang kita ada juga Tapak Warisan Dunia
UNESCO di Taman Negeri Royal Belum, Perak, di Lembah Lenggong di Perak masih lagi
kita jauh ketinggalan kalau berbanding dengan Ha Long Bay di Vietnam. Saya rasa tugas
hakiki MOTAC tidak seharusnya hanya menumpukan pada soal promosi ataupun pelesenan
sahaja ataupun menjalankan projek pembangunan yang berskala kecil dan kurang impak.
Kalau lihat kepada pembangunan *ecotourism* untuk tahun depan, hanya sekitar RM9 juta
sahaja.
Bagi saya, sebaliknya peranan MOTAC harus diperkasakan sebagai badan
koordinasi antara kementerian-kementerian di Kerajaan Persekutuan, kerajaan negeri dan
PBT dan juga komuniti setempat untuk menemui dan seterusnya menguruskan produk
pelancongan dengan baik serta membuka ruang lebih banyak kepada minat pelaburan-
pelaburan asing ataupun pelaburan-pelaburan domestik.
Kedua, saya ingin sentuh tentang Butiran 01100 – Program Penyediaan/Peningkatan
Kemudahan Pelancongan, Butiran 01400 – Penyelenggaraan Kemudahan/Infrastruktur dan
Butiran 40600 – Program Pemuliharaan/Pemugaran Tinggalan Sejarah yang rata-ratanya
sentuh tentang program-program naik taraf kemudahan infrastruktur dan pemuliharaan
tinggalan sejarah."
RANG UNDANG-UNDANG,"RANG UNDANG-UNDANG PERBEKALAN 2024
DAN
USUL
ANGGARAN PEMBANGUNAN 2024
Jawatankuasa","Kepala B.31 [Jadual] –
Kepala P.31 [Anggaran Pembangunan 2024] –",■1720,1720,Tuan Tan Kar Hing [Gopeng],"Berdasarkan kepada Dasar Pelancongan Negara 2020 - 2030, kerajaan
menyasarkan Malaysia akan kembali menjadi sebuah negara destinasi pelancong terbaik
dalam dunia.
Namun saya lihat permasalahan paling ketara adalah kita harus mengatasi masalah
pengurusan dan penyelenggaraan destinasi pelancongan yang kurang memuaskan dan tidak
mampan. Ini menyebabkan pelancong ke destinasi akan kurang gembira dan kecewa dan
tidak dapat menimba pengalaman mereka melancong ke destinasi tersebut.
Saya ingin tarik perhatian dalam negara kita ada banyak tapak yang mampu memberi
pengalaman yang hebat *actually*. Dua tapak Geopark UNESCO, lapan tapak Geopark
Kebangsaan dan lima tapak Warisan Dunia UNESCO, tetapi saya rasa pengurusan di
beberapa tapak tersebut masih lagi jauh ketinggalan.
Contohnya di Lembah Lenggong yang diiktiraf sebagai tapak Geopark dan Tapak
Warisan Dunia UNESCO. Usaha membangunkan kawasan tersebut masih lagi jauh
ketinggalan dan kalau ambil contoh juga di kawasan saya, Geopark Kebangsaan Lembah
Kinta yang sebahagiannya di kawasan Parlimen Gopeng yang mempunyai 22 Geotapak terus
kurang diberikan perhatian.
Contohnya adalah Gua Tambun yang mempunyai lukisan merah prasejarah yang
berusia 3,000 hingga 4,000 tahun yang lalu, tetapi kemudahan asas dan penyelenggaraan
tapak tersebut masih kurang memuaskan dan sebahagiannya kawasan diancam dengan
vandalisme yang berterusan.
Kesimpulannya Puan Pengerusi, saya ingin memohon kepada MOTAC untuk
pertama, kajian pelan pembangunan eko-pelancongan perlu disegerakan untuk kita
menyambut Tahun Melawat Malaysia 2026.
Kedua, perkasakan peranan MOTAC dalam soal pembangunan dan menarik
pelaburan dalam sektor pelancongan dan ketiga adalah tumpukan sepenuhnya projek-projek
pembangunan dalam beberapa produk pelancongan yang sudah pun terkemuka khususnya
tapak Geopark Dunia UNESCO, Geopark Kebangsaan dan Tapak Warisan Dunia UNESCO.
Sekian sahaja, terima kasih."
RANG UNDANG-UNDANG,"RANG UNDANG-UNDANG PERBEKALAN 2024
DAN
USUL
ANGGARAN PEMBANGUNAN 2024
Jawatankuasa","Kepala B.31 [Jadual] –
Kepala P.31 [Anggaran Pembangunan 2024] –",■1720,1720,Tuan Pengerusi [Puan Alice Lau Kiong Yieng],"Terima kasih Yang Berhormat
Gopeng. Saya jemput Yang Berhormat Kuala Kedah."
RANG UNDANG-UNDANG,"RANG UNDANG-UNDANG PERBEKALAN 2024
DAN
USUL
ANGGARAN PEMBANGUNAN 2024
Jawatankuasa","Kepala B.31 [Jadual] –
Kepala P.31 [Anggaran Pembangunan 2024] –",5.22 ptg.,1722,Dr. Ahmad Fakhruddin bin Fakhrurazi [Kuala Kedah],"*Assalamualaikum
warahmatullahi wabarakatuh* dan salam sejahtera. Terima kasih Puan Pengerusi.
Kuala Kedah terus merujuk kepada Butiran 010500 – Pembangunan Prasarana yang
tertakluk di bawah Butiran 010000 – Pengurusan. Pada Butiran 010500 tersebut, didapati
bahawa terdapat peningkatan signifikan pada anggaran tahun 2024.
Kuala Kedah ingin mendapatkan maklumat lanjut berhubung impak maksimum yang
bakal diraih daripada kenaikan anggaran berkenaan. Ini kerana pada tahun 2022, negara
kita telah berjaya menarik 10 juta pelancong asing dan menjana RM28.2 bilion.
Tuan Pengerusi, seperti yang diketahui bahawa penyediaan prasarana pelancongan
yang bersifat kontemporari merupakan salah satu jalan untuk melicinkan lagi aktiviti promosi
pelancongan terutamanya di pintu-pintu masuk negara seperti perkhidmatan kaunter di
lapangan terbang antarabangsa, kemudahan di jeti, maritim, serta pintu masuk negara jalan
darat. Justeru apakah pelan rapi pihak kementerian untuk meningkatkan lagi mutu prasarana
di pintu-pintu masuk negara supaya perkhidmatan yang diberikan itu dapat meninggalkan
memori atau pengalaman manis kepada pelancong sewaktu tiba dan keluar negara.
Dalam hal ini Kuala Kedah juga ingin bertanya adakah kementerian merancang untuk
menaiktarafkan prasarana pelancongan yang terdapat di Jeti Kuala Kedah ke Langkawi
seperti penambahan kios jualan barangan tempatan, kaunter pertanyaan pelancongan,
kemudahan skrin LED sebagai promosi pelancongan dan lain-lain lagi yang turut terkait di
bawah Butiran 020000 – Pembangunan dan Promosi Pelancongan.
Puan Pengerusi, dalam hal ini apakah pihak kementerian bercadang untuk
menaiktarafkan prasarana jeti Kuala Kedah sebagai pintu masuk antarabangsa maritim pada
masa akan datang serta menjadikan pengkalan berkenaan sebagai pusat transit ke destinasi
pelancongan maritim yang lain?
Kuala Kedah bertanyakan hal demikian kerana inilah masa pihak kementerian
menyokong dan memantapkan lagi jalinan hubungan Pertumbuhan Segi Tiga Indonesia-
Malaysia-Thailand (IMT-GT) memandangkan platform kerjasama ketiga-tiga buah negara
berjiran ini dapat merealisasikan Tahun Melawat IMT-GT 2023-2025 bagi mempromosi
pelancongan wilayah serantau. Kuala Kedah menjadi pintu masuk pelancong antarabangsa
seperti dari Indonesia dan Thailand.
Kuala Kedah juga memohon pihak kementerian menyatakan langkah-langkah
komprehensif yang dirangka oleh pihak kementerian untuk menggalakkan ketibaan
pelancong asing seramai 26.1 juta orang, sempena Tahun Melawat Malaysia 2026. Apakah
inisiatif pihak kementerian untuk menyemarakkan lagi sektor pelancongan di peringkat
negeri-negeri terutamanya Kedah yang akan menganjurkan Tahun Melawat Kedah 2025?
Puan Pengerusi, merujuk Butiran 020400 – Pusat Pelancongan Malaysia. Kuala
Kedah ingin mengetahui apakah pelan strategik kementerian bagi meningkatkan promosi
pelancongan dalam penghasilan produk pelancongan yang baharu dan lebih menarik? Di
Parlimen Kuala Kedah terdapat Gua Batu Kapur di Gunung Keriang, Kedah seperti Gua
Terus, Gua Pelamin dan Gua Seribu Bayur yang boleh dibangunkan untuk pelancongan
aktiviti lasak dan pencinta alam semula jadi.
Begitu juga aspek *historical tourism,* dengan izin di Kampung Telok Bulang, Kedah
yang mempunyai tujuh telaga bersejarah dan Pantai Leman bersebelahan Kota Marina,
Kuala Kedah. Sejarah Perang Kedah bersama Siam boleh dimajukan untuk menarik
pelancong ke Kedah. Oleh itu, Kuala Kedah ingin bertanya apakah langkah-langkah yang
telah diambil oleh kementerian bertujuan untuk mempelbagaikan usaha mempromosi produk-
produk pelancongan baharu tersebut?
Puan Pengerusi, merujuk Butiran 020500 – Lembaga Penggalakan Pelancongan
Malaysia (LPPM).
Apakah inisiatif yang dirancang dan disediakan oleh kerajaan untuk membantu
persatuan-persatuan dan pertubuhan bukan kerajaan (NGO) untuk mewujudkan
jawatankuasa khas dengan agensi-agensi pelancongan secara berpusat? Penubuhan
Jawatankuasa ini sangat penting untuk mengkaji dan memberi maklum balas yang bertujuan
memperbaiki kelemahan perkhidmatan pelancongan yang sedia ada. Jika sudah dibentuk,
apakah impak yang telah dapat membantu meningkatkan pertumbuhan ekonomi negara dan
memberikan perkhidmatan yang lebih baik kepada pelancong luar?
Puan Pengerusi, saya merujuk Butiran 040300 – Program Penggalakan, Pemasaran,
Promosi dan Acara-acara Pelancongan, Seni dan Budaya. Kuala Kedah ingin mendapatkan
penjelasan apakah program utama yang dijalankan sehingga melibatkan kenaikan
perbelanjaan yang begitu tinggi dan kedua berapakah anggaran pulangan *return of
investment* (ROI) kepada negara yang akan diperoleh dengan anggaran perbelanjaan yang
sangat besar ini dan apakah mekanisme yang digunakan oleh pihak kementerian untuk
memastikan program-program yang dirancang benar-benar memberi pendapatan kepada
negara? Sekian, terima kasih."
RANG UNDANG-UNDANG,"RANG UNDANG-UNDANG PERBEKALAN 2024
DAN
USUL
ANGGARAN PEMBANGUNAN 2024
Jawatankuasa","Kepala B.31 [Jadual] –
Kepala P.31 [Anggaran Pembangunan 2024] –",5.22 ptg.,1722,Tuan Pengerusi [Puan Alice Lau Kiong Yieng],"Terima kasih Yang Berhormat
Kuala Kedah. Saya jemput Yang Berhormat Kota Melaka."
RANG UNDANG-UNDANG,"RANG UNDANG-UNDANG PERBEKALAN 2024
DAN
USUL
ANGGARAN PEMBANGUNAN 2024
Jawatankuasa","Kepala B.31 [Jadual] –
Kepala P.31 [Anggaran Pembangunan 2024] –",5.28 ptg.,1728,Tuan Khoo Poay Tiong [Kota Melaka],"Terima kasih Puan Pengerusi. Saya
merujuk kepada Butiran 94000 – Pemasaran dan Promosi, Butiran 020500 – Lembaga
Penggalakan Pelancongan Malaysia (LPPM), Butiran 020100 – Dasar Pelancongan dan
Hubungan Antarabangsa, Butiran 030400 – Warisan Negara, Butiran 020300 –
Pembangunan Industri.
Puan Pengerusi, seperti yang kita tahu industri pelancongan perlu bangkit sebagai
destinasi tumpuan pelancongan bagi membantu meningkatkan ekonomi Malaysia, negara
kita. Kita boleh lihat industri pelancongan adalah antara sektor yang paling utama yang telah
menyumbang kepada ekonomi Malaysia dan sumber pendapatan tukaran asing juga
datangnya daripada sektor pelancongan.
Kalau hari ini selepas COVID-19 kita hendak bangunkan negara kita sungguhpun kita
tumpukan kepada sektor pelaburan untuk membina lebih banyak kilang, tetapi itu mengambil
masa. Beli tanah, mendirikan kilang, tetapi kalau pelancongan itu ia kita terus dapat manfaat
dengan lebih cepat dan tepat. Jadi kita perlu tumpukan kepada pelancongan.
Hari ini kita lihat pasaran yang terbesar di mana kita boleh dapat ramai pelancong
datang ke Malaysia ialah mereka dari negara China. Kalau kita lihat sebelum COVID-19
2019, statistik menunjukkan pelancong China mereka pergi ke Thailand lebih daripada
datang ke Malaysia.
Tahun tersebut ada lebih kurang 13 juta pelancong China pergi ke Thailand,
sedangkan hanya 3.5 juta datang ke Malaysia. Padahal di Malaysia ini masyarakat kita lebih
majmuk. Kita ada- mereka datang sini mereka akan rasa lebih mesra, tetapi kenapa kita kalah
kepada Thailand?"
RANG UNDANG-UNDANG,"RANG UNDANG-UNDANG PERBEKALAN 2024
DAN
USUL
ANGGARAN PEMBANGUNAN 2024
Jawatankuasa","Kepala B.31 [Jadual] –
Kepala P.31 [Anggaran Pembangunan 2024] –",■1730,1730,Tuan Khoo Poay Tiong [Kota Melaka],"Kita lihat salah satu daripada sebabnya ialah Thailand mereka tidak perlu visa, tetapi
mereka datang ke Malaysia mereka perlu memohon visa, barangkali itu adalah sebab utama
kurang minatnya mereka datang ke Malaysia.
Baru-baru ini kita lihat bila berlakunya insiden di Thailand di mana berlakunya
pelancong diculik- pelancong China diculik di Thailand. Para pelancong daripada China
mereka tidak pergi ke Thailand. Maka itu adalah ruang untuk kita sambut mereka datang ke
Malaysia dan kita lihat di Negara Thailand mereka bertindak dengan begitu cepat sekali.
Apabila insiden itu berlaku, pelancong China kurang pergi ke Thailand mereka terus katakan
tidak perlu visa untuk pergi ke Thailand. Apabila pengumuman itu dibuat, mereka
melaksanakan dasar tersebut dalam satu minggu pertama tanpa visa, orang China pergi ke
Thailand 100,000 dalam seminggu- 100,000 pelancong China pergi ke Thailand."
RANG UNDANG-UNDANG,"RANG UNDANG-UNDANG PERBEKALAN 2024
DAN
USUL
ANGGARAN PEMBANGUNAN 2024
Jawatankuasa","Kepala B.31 [Jadual] –
Kepala P.31 [Anggaran Pembangunan 2024] –",■1730,1730,ANNOTATION,[Tuan Yang di-Pertua mempengerusikan Jawatankuasa]
