level_1,level_2,level_3,raw_timestamp,timestamp,author,speech
RANG UNDANG-UNDANG,"RANG UNDANG-UNDANG PERBEKALAN 2015
Bacaan Kali Yang Kedua
Dan
USUL
ANGGARAN PEMBANGUNAN 2015",,■1230,1230,Datuk Haji Ahmad bin Haji Maslan,"Tak faham tak
apalah. Saya sudah sebut tadi daripada segi jumlah kenderaan yang dimiliki oleh mereka
yang berpendapatan rendah kemudian dibandingkan dengan mereka yang berpendapatan
tinggi, jumlahnya, cc nya itu memang melebihi daripada mereka yang berpendapatan
rendah dan kita bukan mereka reka angka itu- 70-30 itu bukan rekaan. Kita ada
jawatankuasa yang mendapatkan angka-angka itu, kita tidak mereka reka cerita Yang
Berhormat.
Kemudian mengenai defisit 17 tahun ini, saya sebahagiannya saya sudah jawab
tadi. Yang Berhormat Kuala Nerus, satu lagi mengenai hutang. Jumlah hutang Kerajaan
Persekutuan tahun 2009-2014. Pada tahun 2009-RM362.4 bilion; peratus pada KDNK –
50.8 peratus. Tahun 2010 – RM407.1 bilion; peratus pada KDNK – 51.1 peratus. KDNK kita
pada ketika itu RM797.3 bilion. Pada tahun 2009, KDNK kita RM712.9 bilion.
Hutang tahun 2011 – RM456.1 bilion; peratus pada KDNK – 51.6 peratus. KDNK
pada tahun 2011 – RM885.3 bilion. Pada tahun 2012, hutang – RM501.6 bilion, peratus
pada KDNK – 53.3 peratus. KDNK pada ketika itu RM941.9 bilion.
Pada tahun sudah, hutang – RM539.9 bilion, peratus pada KDNK – 54.7 peratus.
KDNK pada tahun sudah RM986.7 bilion.
Sehingga Jun 2014, hutang Kerajaan Persekutuan – RM568.9 bilion, peratus pada
KDNK – 52.8 peratus. KDNK sehingga Jun 2014 – RM1.0782 trilion. Sudah melepasi bilion
KDNK kita. Itu satu berita yang menarik.
Kemudian duti subsidi harga minyak kos sara hidup. Kaedah untuk membayar itu
saya sudah sebut tadi, kita sudah tetapkan pada tahun-tahun yang tertentu daripada bajet,
ia tidak boleh melebihi peratusan yang tertentu. Kita masih mampu untuk membayarnya
dan kita telah membayarnya dengan jadual yang tepat. Saya juga ingin memaklumkan 97
peratus daripada hutang itu ialah hutang daripada sumber-sumber dalaman negara.
Hasil daripada petroleum, cukai pendapatan petroleum (PITA). Tahun 2014,
anggaran RM28.28 bilion. Duti eksport petroleum, RM1.94 bilion, dividen Petronas RM29
bilion, anggaran tahun 2014, royalti Petroleum RM5.7 bilion dan pendapatan daripada
operasi petroleum pihak berkuasa bersama Malaysia-Thailand (MTJA) RM2.02 bilion yang
menjumlahkan RM66.94 bilion hasil daripada pendapatan petroleum.
Kemudian ditanyakan penjelasan daripada pihak kerajaan bagaimana kalau trend
penurunan harga minyak ini berterusan. Bagaimanakah kedudukan belanjawan negara?
Sebahagiannya saya telah jawab tadi tetapi saya ada angka-angka baru. Hasil keseluruhan
Kerajaan Persekutuan pada tahun 2014 dianggarkan berjumlah RM225.1 bilion. Anggaran
ini adalah berdasarkan harga purata minyak mentah dunia jenis tapis pada USD110 setong.
Harga purata minyak mentah tapis dari Januari hingga September 2014 ialah USD112 se
tong. Dari 1 hingga 23 Oktober 2014 pula, harga purata minyak mentah tapis USD92
setong.
Ada orang bertanya kenapa tidak diturunkan minyak RM2.30 sen itu. Apabila kita
mengetahui bahawa harga minyak dunia ini turun, kenapa tidak diturunkan daripada
RM2.30 sen? Saya ingin membuat sedikit ulasan bahawa minyak Malaysia ini ada dua
jenis. Satu harga minyak bersubsidi RM2.30 sen, satu lagi ialah harga minyak sebenar.
Dalam masa purata bulan Oktober ini, harga subsidi masih ada lagi 12 sen satu liter
RON95. Jika pada tahun sudah 74 sen subsidi tetapi pada bulan Oktober baru-baru ini oleh
sebab turun harga minyak dunia, subsidinya ialah 12 sen satu liter. Masih ada lagi subsidi
dan ia belum lagi turun di bawah harga RM2.30 sen.
Oleh sebab itu, persoalan sama ada kita perlu menurun ataupun tidak harga
minyak itu belum lagi berbangkit kerana kita masih lagi memberikan subsidi kepada satu
liter sebanyak 12 sen untuk RON95. Sekiranya harga turun kepada USD84 setong dan
kekal sehingga bulan Disember 2014, harga purata bagi keseluruhan tahun 2014 dijangka
masih tinggi pada paras lebih daripada USD 110 setong. Tambahan pula kutipan hasil
berkaitan petroleum sehingga September 2014 telah mencapai 76 peratus daripada
sasaran yang telah ditetapkan. Oleh itu kerajaan masih mengekalkan sasaran kutipan hasil
tahun 2014 pada paras RM225.1 bilion dan paras defisit fiskal sebagai peratusan KDNK
bagi tahun 2014 dijangka masih lagi mencapai sasaran 3.5 peratus.
Hasil berkaitan petroleum mewakili 29.7 peratus daripada jumlah anggaran hasil
tahun 2014 manakala selebihnya adalah daripada hasil cukai pendapatan syarikat dan
individu, duti setem, duti eksais, cukai jualan dan perkhidmatan, bayaran lesen dan permit
serta faedah daripada pelaburan kerajaan. Peratus hasil berkaitan petroleum daripada
jumlah keseluruhan hasil kerajaan juga telah menurun daripada 41.3 peratus pada tahun
2009 kepada 29.7 peratus pada tahun 2014.
Ini menunjukkan kebergantungan kerajaan kepada hasil berkaitan petroleum
semakin kurang."
RANG UNDANG-UNDANG,"RANG UNDANG-UNDANG PERBEKALAN 2015
Bacaan Kali Yang Kedua
Dan
USUL
ANGGARAN PEMBANGUNAN 2015",,■1230,1230,Timbalan Yang di-Pertua [Datuk Haji Ismail bin Haji Mohamed Said],"Ya, Yang
Berhormat PJ Utara bangun."
RANG UNDANG-UNDANG,"RANG UNDANG-UNDANG PERBEKALAN 2015
Bacaan Kali Yang Kedua
Dan
USUL
ANGGARAN PEMBANGUNAN 2015",,■1230,1230,Tuan Tony Pua Kiam Wee [Petaling Jaya Utara],"Soalan saya pendek sahaja,
saya tak ceramah. Dua perkara sahaja. Nombor satu..."
RANG UNDANG-UNDANG,"RANG UNDANG-UNDANG PERBEKALAN 2015
Bacaan Kali Yang Kedua
Dan
USUL
ANGGARAN PEMBANGUNAN 2015",,■1230,1230,Timbalan Yang di-Pertua [Datuk Haji Ismail bin Haji Mohamed Said],"Ya, sila."
RANG UNDANG-UNDANG,"RANG UNDANG-UNDANG PERBEKALAN 2015
Bacaan Kali Yang Kedua
Dan
USUL
ANGGARAN PEMBANGUNAN 2015",,■1240,1240,Tuan Tony Pua Kiam Wee [Petaling Jaya Utara],"Adakah kerajaan membuat
kesimpulan bahawa kalau harga petroleum menurun, adalah lebih baik bagi kerajaan
kerana subsidi menurun lebih daripada kekurangan hasil yang dikutip, itu nombor satu.
Nombor dua, apa *breakeven point* subsidi bagi petroleum di mana kalau harga
minyak antarabangsa turun di bawah harga tersebut, kerajaan tidak lagi perlu memberikan
subsidi bagi petrol dan diesel."
RANG UNDANG-UNDANG,"RANG UNDANG-UNDANG PERBEKALAN 2015
Bacaan Kali Yang Kedua
Dan
USUL
ANGGARAN PEMBANGUNAN 2015",,■1240,1240,Datuk Haji Ahmad bin Haji Maslan,"Ya, sebagaimana saya sebut tadi, angka
yang kita agak khuatir ialah apabila minyak itu turun antara USD70 hingga USD60 se tong.
Ia belum lagi menyampai paras itu*, breakeven*. Kerajaan ada dua pilihan apabila sampai
RM2.30. Pilihan pertama ialah menurunkan harga minyak. Itu ialah satu perkara yang
popular untuk dilakukan dan pilihan kedua mula mengenakan cukai jualan. Cukai jualan ini
ialah 58 sen satu liter RON95 yang kita tidak kutip, ya. Sepatutnya harga RON95 itu
RM2.30+58 sen sama dengan RM2.88 sepatutnya, ya harga RON95. Akan tetapi oleh
sebab Kerajaan Barisan Nasional ini amat baik kepada rakyat, kita bukan sahaja beri
subsidi, kita juga tidak kenakan cukai jualan kerana Kerajaan BN baik kepada rakyat.
**Tony Pua Kiam Wee[ Petaling Jaya Utara]:** Yang Berhormat Menteri, soalan
saya, apa harga minyak antarabangsa di mana harga pam akan menjadi RM2.30
*breakeven*, harga minyak antarabangsa sama ada USD75 se tong kah atau USD80 se
tong, bila harga antarabangsa di mana harga pam akan menjadi harga pasaran RM2.30?"
RANG UNDANG-UNDANG,"RANG UNDANG-UNDANG PERBEKALAN 2015
Bacaan Kali Yang Kedua
Dan
USUL
ANGGARAN PEMBANGUNAN 2015",,■1240,1240,Seorang Ahli,Menteri tidak fahamlah.
RANG UNDANG-UNDANG,"RANG UNDANG-UNDANG PERBEKALAN 2015
Bacaan Kali Yang Kedua
Dan
USUL
ANGGARAN PEMBANGUNAN 2015",,■1240,1240,Datuk Haji Ahmad bin Haji Maslan,"Ya, saya faham tetapi angkanya tidak ada
pada saya. Jadi saya..."
RANG UNDANG-UNDANG,"RANG UNDANG-UNDANG PERBEKALAN 2015
Bacaan Kali Yang Kedua
Dan
USUL
ANGGARAN PEMBANGUNAN 2015",,■1240,1240,Beberapa Ahli,Menteri tidak fahamlah.
RANG UNDANG-UNDANG,"RANG UNDANG-UNDANG PERBEKALAN 2015
Bacaan Kali Yang Kedua
Dan
USUL
ANGGARAN PEMBANGUNAN 2015",,■1240,1240,Datuk Haji Ahmad bin Haji Maslan,"...Bercerita perkara lain. Saya faham antara
USD75 atau USD80 ya, itu antaranya. Apabila perkara itu berlaku, dia akan mencapai satu
RM2.30, USD75 kah, USD80 kah atau USD70? Pegawai-pegawai saya sedang
menyediakan jawapan itu, ya. Saya tidak tahu semua perkara dalam dunia ini. Bukan
begitu?"
RANG UNDANG-UNDANG,"RANG UNDANG-UNDANG PERBEKALAN 2015
Bacaan Kali Yang Kedua
Dan
USUL
ANGGARAN PEMBANGUNAN 2015",,■1240,1240,ANNOTATION,[Ketawa]
RANG UNDANG-UNDANG,"RANG UNDANG-UNDANG PERBEKALAN 2015
Bacaan Kali Yang Kedua
Dan
USUL
ANGGARAN PEMBANGUNAN 2015",,■1240,1240,Datuk Haji Ahmad bin Haji Maslan,"Akan tetapi apabila minyak itu tiba pada jumlah sama ada USD75 ataupun
USD70 satu tong itu, persoalannya ialah yang lebih penting sama ada kita hendak turunkan
harga minyak atau kita hendak mula mengenakan 58 sen seliter cukai jualan.
Kalau kita hendak kenakan cukai jualan pun, kalau minyak terus turun, dia
hendaklah sehingga 1 April 2015. Pada 1 April 2015 tidak ada cukai jualan dan kita juga
telah maklumkan tidak ada GST kepada minyak. Oleh sebab itu, kalau kita hendak kenakan
pun hanya sehingga 1 April 2015 cukai jualan itu. Kita memang berharap harga minyak itu
turun untuk menurunkan harga barang dan kita juga menanti kalau harga minyak itu turun,
adakah harga barang akan turun? Itu satu lagi persoalan yang cukup baik untuk kita lihat
apa yang berlaku di luar sana. Okey.
Kerajaan terus melaksanakan langkah bagi meningkatkan kutipan hasil apabila
perkara-perkara itu berlaku, ya. Pertama..."
RANG UNDANG-UNDANG,"RANG UNDANG-UNDANG PERBEKALAN 2015
Bacaan Kali Yang Kedua
Dan
USUL
ANGGARAN PEMBANGUNAN 2015",,■1240,1240,Tuan Loke Siew Fook [Seremban],Yang Berhormat Menteri.
RANG UNDANG-UNDANG,"RANG UNDANG-UNDANG PERBEKALAN 2015
Bacaan Kali Yang Kedua
Dan
USUL
ANGGARAN PEMBANGUNAN 2015",,■1240,1240,Datuk Haji Ahmad bin Haji Maslan,"...Antara langkahnya imenambah baik
pentadbiran cukai supaya lebih cekap dalam pungutan cukai. Saya habiskan para ini
selepas itu saya beri. Kedua, meningkatkan penggunaan *e-filing* dan kemudahan untuk
membayar cukai termasuk pembayaran cukai secara atas talian. Ini apabila hasil kita
kurang, kita akan mengadakan langkah-langkah ini dan meningkatkan langkah-langkah itu.
Ketiga, meningkatkan pematuhan cukai termasuk melalui penguatkuasaan dan
pengauditan cukai yang lebih baik. Keempat, memperluas asas cukai supaya tidak hanya
bergantung kepada cukai pendapatan hasil berasaskan petroleum. Seterusnya,
memperteguh asas-asas ekonomi makro negara untuk meningkatkan lagi aktiviti ekonomi
dan keuntungan sektor swasta seterusnya dapat menyumbang kepada peningkatan hasil
kerajaan. Sila, Yang Berhormat Seremban."
RANG UNDANG-UNDANG,"RANG UNDANG-UNDANG PERBEKALAN 2015
Bacaan Kali Yang Kedua
Dan
USUL
ANGGARAN PEMBANGUNAN 2015",,■1240,1240,Timbalan Yang di-Pertua [Dato' Haji Ismail bin Haji Mohamed Said],"Ya, sila."
RANG UNDANG-UNDANG,"RANG UNDANG-UNDANG PERBEKALAN 2015
Bacaan Kali Yang Kedua
Dan
USUL
ANGGARAN PEMBANGUNAN 2015",,■1240,1240,Tuan Loke Siew Fook [Seremban],"Terima kasih, saya ingat Yang Berhormat
Menteri tadi telah memberikan satu jawapan yang kontradiksilah kepada jawapan rasmi
yang selalu diberikan oleh kerajaan. Tadi Yang Berhormat Timbalan Menteri mengatakan
bahawa kalau harga minyak diturunkan, mungkin ini dapat menurunkan harga barangan.
Bukankah selalu kerajaan memberikan jawapan rasmi kenaikan harga minyak itu tidak
menyumbang ataupun rasionalisasi subsidi ini menyumbang kepada kenaikan harga
barangan dan juga tidak menyumbang kepada inflasi? Jadi saya ingat Yang Berhormat
Timbalan Menteri sendiri telah memberikan satu jawapan yang cukup kontradiksi. Ini
menunjukkan bahawa sememangnya apa yang dilakukan oleh kerajaan ini menyumbang
kepada kadar inflasi yang lebih tinggi. Terima kasih."
RANG UNDANG-UNDANG,"RANG UNDANG-UNDANG PERBEKALAN 2015
Bacaan Kali Yang Kedua
Dan
USUL
ANGGARAN PEMBANGUNAN 2015",,■1240,1240,Datuk Haji Ahmad bin Haji Maslan,"Bilakah kami cakap macam itu Yang
Berhormat Seremban? Bilakah saya ada cakap kenaikan harga minyak tidak menyumbang
kepada inflasi? Bila, siapa dia, dan di manakah? Tolong beritahu. Tidak mungkin kita tidak
belajar ekonomi. Mestilah ada peratusan yang tertentu. Yang Berhormat Petaling Jaya
Utara, sudah dapat jawapan. Harga minyak di pam menjadi tanpa subsidi apabila harga
minyak mentah tapis mencecah antara USD75 ke USD80 se tong, okey. Yang Berhormat
Seremban, kita mengetahui apabila kita tarik subsidi 20 sen, maka harga minyak naik 20
sen. Memang ada kenaikan tetapi yang kita tidak mahu ialah kenaikan itu tidak berkadaran
dengan harga. Saya selalu bercakap di mana-mana, tarik subsidi minyak 20 sen, naik harga
roti canai 20 sen. Kadang-kadang kita bertanya kepada mereka, goreng roti canai guna
minyak diesel kah atau apa?
Mereka kata bahawa tepung yang dibawa menggunakan lori itu menggunakan
minyak diesel. Akan tetapi sebenarnya kos-kos seperti itu boleh diserap. Kalau bawa 100
kampit tepung ketika minyak harga RM2.10, tambahlah jadi 110 kampit tepung di dalam lori
itu supaya kos RM2.10 jadi RM2.30 itu boleh diserap. Akan tetapi kadang-kadang tidak
mahu dilakukan perkara ini dan sentiasa memandai-mandai mengambil kesempatan
daripada kesempitan. Yang Berhormat Kuala Nerus, Yang Berhormat Kota Raja, Yang
Berhormat Beruas, Yang Berhormat Tanjong, Yang Berhormat Sarikei..."
RANG UNDANG-UNDANG,"RANG UNDANG-UNDANG PERBEKALAN 2015
Bacaan Kali Yang Kedua
Dan
USUL
ANGGARAN PEMBANGUNAN 2015",,■1240,1240,Timbalan Yang di-Pertua [Dato' Haji Ismail bin Haji Mohamed Said],"Yang
Berhormat, Yang Berhormat Bagan Serai bangun."
RANG UNDANG-UNDANG,"RANG UNDANG-UNDANG PERBEKALAN 2015
Bacaan Kali Yang Kedua
Dan
USUL
ANGGARAN PEMBANGUNAN 2015",,■1240,1240,Dr. Haji Noor Azmi bin Ghazali [Bagan Serai],"Terima kasih Tuan Yang di-
Pertua, terima kasih Yang Berhormat Menteri. Sedikit sahaja. Saya hendak minta
penjelasan. Kalau dikatakan harga minyak naik, harga barang mesti naik. Kalau harga
minyak turun, apa pula jadi dengan harga barang? Adakah kenaikan harga barang ini
disebabkan semata-mata oleh naik harga minyak ataupun kerana eksploitasi ataupun
*additive action* oleh orang-orang yang suka mengambil kesempatan. Terima kasih."
RANG UNDANG-UNDANG,"RANG UNDANG-UNDANG PERBEKALAN 2015
Bacaan Kali Yang Kedua
Dan
USUL
ANGGARAN PEMBANGUNAN 2015",,■1240,1240,Datuk Haji Ahmad bin Haji Maslan,"Kos satu-satu barangan itu ada pelbagai.
Kalau kos pen ini misalnya - barang-barang untuk membuat pen lepas itu gaji pekerja yang
buat pen, sewa kilang itu, dan semuanya ya. Kemudian, elektrik dalam kilang itu dan
mengangkut pen ini dalam lori yang ada minyak yang naik. Ini bererti jumlah peratusan
untuk pengangkutan dalam satu-satu produk itu kecil. Oleh sebab itu, apabila minyak naik,
perlu sedikit sahaja kenaikan yang berlaku dan kadang-kadang boleh diserap.
Akan tetapi kalau minyak turun, ini kita ingin melihat apa yang akan berlaku di
sana. Harapan kita ialah peniaga-peniaga tidak kira apa juga bangsa sentiasa
bertanggungjawab tentang harga barang ini.
Satu lagi kalaupun minyak naik, lepas itu harga barangnya itu naik, kalaupun
minyak turun, harga barang pun turun, kalau tidak ada orang hendak beli barang itu,
akhirnya barang itu turun juga. Ini kaedah *supply and demand*, apabila sampai kepada satu
titik *equilibrium* yang tertentu maka, berdasarkan penawaran dan juga permintaan akan
rendah ataupun tinggi. Yang Berhormat Kuala Nerus, Yang Berhormat Kota Raja, Yang
Berhormat Beruas, Yang Berhormat Tanjong dan Yang Berhormat Sarikei. Anggaran purata
harga minyak mentah dunia pada tahun 2014 ialah USD110, harga purata minyak mentah
tapis, Januari hingga Oktober 2014 USD109.7. Sekiranya harga minyak mentah dunia terus
turun secara relatifnya purata harga minyak mentah pada tahun 2014 tidak akan jauh
daripada anggaran asal. Okey, ini sudah ada jawapan tadi.
Yang Berhormat Kapar, mengapakah rakyat Malaysia tidak berhak menikmati
subsidi petrol dan diesel walaupun Malaysia negara pengeluar minyak? Pada asasnya
Malaysia minyak mentah jenis tapis *blend*. Namun minyak tersebut tidak digunakan dalam
negeri kerana minyak itu berkualiti tinggi dan harganya lebih mahal serta lebih
menguntungkan jika dieksport. Di samping itu, minyak tersebut digali daripada persisiran
laut dalam di mana kos cari gali adalah lebih tinggi berbanding dengan minyak dari negara
Timur Tengah yang digali di darat.
Oleh itu, Malaysia mengimport minyak jenis lain yang harganya lebih rendah untuk
kegunaan kenderaan dan industri tempatan. Oleh itu, dengan mengeksport minyak tapis
*blend* dan mengimport minyak berkualiti rendah untuk kegunaan dalam negara, minyak
Malaysia masih meraih manfaat daripada sumber minyak mentah semula jadinya dan
seterusnya digunakan untuk pembangunan negara."
RANG UNDANG-UNDANG,"RANG UNDANG-UNDANG PERBEKALAN 2015
Bacaan Kali Yang Kedua
Dan
USUL
ANGGARAN PEMBANGUNAN 2015",,■1250,1250,Datuk Haji Ahmad bin Haji Maslan,"Kemudian Yang Berhormat Alor Gajah, Yang Berhormat Langkawi dan Yang
Berhormat Seputeh mengenai iklan untuk *request for proposal* bagi pembangunan sistem
penyampaian subsidi bersasar bagi kenderaan petrol telah dikeluarkan pada 10 Oktober
2014 dan akan ditutup pada 10 November 2014. Dengan perkataan lain, syarikat-syarikat
masih ada beberapa hari untuk memberikan cadangan bagaimana kaedah rasionalisasi
subsidi yang dijangka diadakan pada tahun 2015. Setakat ini mengenai pendapatan itu
belum ada lagi muktamad. Kita ingin mendengar dan melihat cadangan yang terbaik
daripada syarikat-syarikat yang telah mengambil RFP itu. Itu sahaja mengenai minyak ini.
Kemudian Yang Berhormat Pengkalan Chepa, sejak tahun 2010 sehingga 2014
pertumbuhan KDNK benar telah mendapati sasaran unjuran dan terus berkembang selari
dengan perkembangan ekonomi serta pelaksanaan transformasi kerajaan yang memberi
impak tinggi kepada negara. KDNK negara berkembang secara purata sebanyak 4.1
peratus dalam tempoh 2005 hingga 2009 dan 5.8 peratus bagi tempoh 2010 hingga 2013.
Purata pertumbuhan KDNK yang pesat bagi tempoh 2010-2013 didorong oleh pelbagai
inisiatif kerajaan sebagai Program Transformasi Nasional dan Program Transformasi
Ekonomi.
Yang Berhormat Ketereh, sektor perkhidmatan dianggar menyumbang sebanyak
55.3 peratus kepada KDNK pada 2014 dan diunjurkan meningkat kepada 55.4 peratus
pada 2015. Sektor ini disasarkan untuk menyumbang sebanyak 60 peratus kepada KDNK
menjelang 2020. 55.4 meningkat kepada 60. Usaha yang dilakukan bagi meningkatkan
sumbangan sektor perkhidmatan kepada KDNK menjelang 2020 termasuk Program
Transformasi Ekonomi (ETP) yang mana tujuh bidang keberhasilan ekonomi utara NKEA
yang dikenal pasti berkait secara langsung dengan sektor perkhidmatan.
Penggubalan Pelan Induk Sektor Perkhidmatan, *Services Sector Blueprint* dengan
izin yang merangkumi liberalisasi dan meningkatkan eksport perkhidmatan menyediakan
insentif cukai, bukan cukai yang berkesan, pembangunan modal insan dan pelaksanaan
kawal selia sektor perkhidmatan dan Rancangan Malaysia Kesebelas yang sedang digubal
juga dijangka akan terus memberikan tumpuan perkhidmatan.
*MyExport* komoditi pulangan RM20 bilion, tetapi Filipina menghantar tenaga kerja
mendapat RM22 bilion, ini yang dikatakan Yang Berhormat Ketereh. Perbandingan antara
komoditi dengan tenaga kerja ialah suatu perbandingan yang kurang setara.
Ini adalah kerana eksport komoditi bergantung kepada harga pasaran dunia yang
mana ia dipengaruhi oleh faktor permintaan dan penawaran serta aktiviti spekulasi yang
berada di luar kawalan. Manakala eksport tenaga kerja pula dipengaruhi oleh faktor
permintaan dan penawaran di antara negara sumber dan negara penerima. Oleh itu
perbandingan tersebut tidak boleh dibuat sebagai panduan perbandingan jumlah pulangan
komoditi berjumlah RM20 bilion dengan tenaga kerja mendapat RM22 bilion tersebut.
Dalam tempoh lapan bulan pertama 2014, pendapatan eksport komoditi meningkat
sebanyak 8.1 peratus kepada RM115.1 bilion. Bagi keseluruhan tahun 2014, pendapatan
eksport kelapa sawit dijangka meningkat 4.9 peratus kepada RM48.2 bilion, 2013 RM44.2
bilion.
Berikutan harga eksport yang stabil iaitu RM2,400 se tan metrik serta prospek
perdagangan luar yang semakin baik. Sementara itu dengan harga purata getah yang lebih
rendah pendapatan eksport getah bagi 2014 dijangka menguncup 12.5 peratus kepada
RM6.1 bilion dibandingkan pada tahun 2013, RM7 bilion.
Yang Berhormat Kluang memohon pandangan mengkaji keadaan *stagnation* dan
*inflation* yang berlaku serentak apabila GST dilaksanakan. Perbelanjaan pengguna dijangka
terus kukuh walaupun pengguna mengambil langkah berhati-hati dalam perbelanjaan
berikutan pelaksanaan Cukai Barangan Dan Perkhidmatan (GST). Peningkatan inflasi
dijangka bersifat sementara dan akan berkurangan selepas beberapa bulan pelaksanaan
GST. Kerajaan turut meluaskan skop barangan keperluan yang dikecualikan GST dan juga
bekalan berkadar sifar dalam usaha untuk mengawal peningkatan harga barangan yang
mendadak. Selain itu, penambahan peruntukan bantuan-bantuan sebagaimana yang kita
sedia maklum dan juga pelaksanaan Akta Kawalan Harga dan Antipencatutan 2011
dijangka dapat mengurangkan kenaikan harga barang yang mendadak. Selain
itu,pendapatan eksport yang tinggi dijangka meningkatkan pemerolehan perniagaan dan
pendapatan isi rumah. Seterusnya mengurangkan kesan peningkatan inflasi kepada
permintaan domestik.
Pelaburan swasta dijangka kekal kukuh disokong oleh peningkatan aktiviti
domestik dan sektor luar yang menggalakkan seterusnya mengimbangi pertumbuhan
ekonomi negara pada tahun 2015. Berdasarkan semakan semula oleh Tabung Kewangan
Antarabangsa (IMF) pada Oktober 2014, ekonomi dunia dan perdagangan global dijangka
terus berkembang pada kadar 3.8 peratus dan 5 peratus pada tahun 2015. Seiring dengan
prospek pertumbuhan global dan perdagangan yang bertambah baik serta perdagangan
serantau yang menggalakkan, eksport dijangka berkembang, dirangsang oleh peningkatan
permintaan global terutamanya terhadap barangan elektronik dan elektrik. Selain daripada
itu, kepelbagaian ekonomi domestik turut menyumbang kepada perkembangan positif ini
seterusnya meningkatkan pertumbuhan ekonomi pada tahun 2015.
Yang Berhormat Permatang Pauh, hutang isi rumah. Hutang isi rumah meningkat
pada kadar tahunan yang lebih perlahan untuk enam suku yang berturutan iaitu sebanyak
9.7 peratus, tahun 2013 11.5 peratus. Ekoran pelaksanaan pelbagai langkah awalan yang
diambil oleh pihak kerajaan dan Bank Negara Malaysia, kedudukan kewangan dan
keupayaan sektor isi rumah untuk membayar balik hutang kekal utuh dan disokong oleh
keadaan guna tenaga yang menggalakkan dan tahap pendapatan yang lebih tinggi.
Sektor isi rumah giat mengumpul aset kewangan yang meningkat pada kadar yang
hampir sepadan dengan pertumbuhan hutang isi rumah. Nisbah aset kewangan pada
hutang isi rumah kekal tinggi pada 2.2 kali. Nisbah pinjaman terjejas sektor isi rumah kekal
pada paras yang rendah iaitu 1.2 peratus tahun 2013, tahun 2013 1.3 peratus. Ini NPL yang
rendah. Sebagaimana yang dimaklumkan oleh Yang Amat Berhormat Perdana Menteri
pada pagi tadi bahawa hutang isi rumah ini majoritinya adalah untuk membeli rumah dan
daripada seluruh hutang pembelian rumah itu 85 peratus adalah untuk membeli rumah yang
pertama. Jadi dengan perkataan lain, mereka akan bayar..."
RANG UNDANG-UNDANG,"RANG UNDANG-UNDANG PERBEKALAN 2015
Bacaan Kali Yang Kedua
Dan
USUL
ANGGARAN PEMBANGUNAN 2015",,■1250,1250,Datuk Seri Reezal Merican [Kepala Batas],
RANG UNDANG-UNDANG,"RANG UNDANG-UNDANG PERBEKALAN 2015
Bacaan Kali Yang Kedua
Dan
USUL
ANGGARAN PEMBANGUNAN 2015",,■1250,1250,ANNOTATION,[Bangun]
RANG UNDANG-UNDANG,"RANG UNDANG-UNDANG PERBEKALAN 2015
Bacaan Kali Yang Kedua
Dan
USUL
ANGGARAN PEMBANGUNAN 2015",,■1250,1250,Datuk Haji Ahmad bin Haji Maslan,"...Sebab ini rumah pertama. Takkan rumah
pertama pun mereka tidak dapat hendak bayar. Sebab itu NPL untuk hutang isi rumah
cuma 1.2 peratus."
RANG UNDANG-UNDANG,"RANG UNDANG-UNDANG PERBEKALAN 2015
Bacaan Kali Yang Kedua
Dan
USUL
ANGGARAN PEMBANGUNAN 2015",,■1250,1250,Timbalan Yang di-Pertua [Datuk Haji Ismail bin Haji Mohamed Said],"Ya, Yang
Berhormat Kepala Batas."
RANG UNDANG-UNDANG,"RANG UNDANG-UNDANG PERBEKALAN 2015
Bacaan Kali Yang Kedua
Dan
USUL
ANGGARAN PEMBANGUNAN 2015",,■1250,1250,Datuk Haji Ahmad bin Haji Maslan,Sila.
RANG UNDANG-UNDANG,"RANG UNDANG-UNDANG PERBEKALAN 2015
Bacaan Kali Yang Kedua
Dan
USUL
ANGGARAN PEMBANGUNAN 2015",,■1250,1250,Datuk Seri Reezal Merican [Kepala Batas],"Terima kasih. Perkara tentang
*household debt* banyak kali sudah dibangkitkan. Banyak kali juga diberikan jawapan. Pagi
tadi pun Yang Amat Berhormat Perdana Menteri pun sudah bagi jawapan tentang *the*
komposisi *of household debt* ini. Cuma saya hendak minta pencelahan dan mungkin
cadangan kepada Yang Berhormat Timbalan Menteri, mungkin boleh mengadakan matriks
yang baru supaya Bank Negara bukan hanya melihat pada *household debt* sahaja, tetapi
juga melihat kepada *household wealth*. Supaya dengan cara itu, kita boleh *derive the actual
household net worth*. Dengan itu juga kita boleh melihat bahawa keadaan kedudukan,
kecairan terutamanya di kalangan rakyat Malaysia. Terima kasih."
